ID,Date,Primary Type,Description,Arrest,Domestic,Community Area,Latitude,Longitude,Date_TS,Month,Day,Hour,Year,Crime_Category
11215212,01/25/2018 07:30:00 PM,ROBBERY,ARMED: HANDGUN,false,false,42,41.778201262,-87.599177537,2018-01-25T19:30:00.000+02:00,1,25,19,2018,Violent
11218421,01/30/2018 12:40:00 PM,BURGLARY,FORCIBLE ENTRY,false,false,30,41.849852628,-87.695392076,2018-01-30T12:40:00.000+02:00,1,30,12,2018,Non-Violent
11205836,01/16/2018 08:05:00 PM,THEFT,$500 AND UNDER,true,false,8,41.911124622,-87.637932903,2018-01-16T20:05:00.000+02:00,1,16,20,2018,Non-Violent
11194857,01/02/2018 10:30:00 PM,BURGLARY,UNLAWFUL ENTRY,false,false,22,41.91758509,-87.686384761,2018-01-02T22:30:00.000+02:00,1,2,22,2018,Non-Violent
11219924,02/01/2018 06:42:00 AM,PROSTITUTION,SOLICIT ON PUBLIC WAY,true,false,56,41.803515121,-87.743044463,2018-02-01T06:42:00.000+02:00,2,1,6,2018,Non-Violent
11210885,01/22/2018 03:00:00 PM,THEFT,$500 AND UNDER,false,false,77,41.9978699,-87.670547769,2018-01-22T15:00:00.000+02:00,1,22,15,2018,Non-Violent
11207419,01/18/2018 03:00:00 PM,CRIMINAL TRESPASS,TO LAND,true,false,24,41.903201873,-87.676593393,2018-01-18T15:00:00.000+02:00,1,18,15,2018,Non-Violent
11203741,01/14/2018 06:06:00 AM,BURGLARY,FORCIBLE ENTRY,true,false,65,41.779593638,-87.732554469,2018-01-14T06:06:00.000+02:00,1,14,6,2018,Non-Violent
11218503,01/30/2018 04:30:00 PM,BATTERY,SIMPLE,false,false,8,41.910022484,-87.63855839,2018-01-30T16:30:00.000+02:00,1,30,16,2018,Violent
11211354,01/22/2018 10:30:00 PM,BURGLARY,UNLAWFUL ENTRY,false,false,71,41.751668628,-87.661857789,2018-01-22T22:30:00.000+02:00,1,22,22,2018,Non-Violent
11210691,01/22/2018 09:00:00 AM,BATTERY,SIMPLE,false,false,19,41.933342907,-87.747832033,2018-01-22T09:00:00.000+02:00,1,22,9,2018,Violent
11192862,01/01/2018 07:24:00 PM,CRIMINAL DAMAGE,TO PROPERTY,false,false,49,41.721136094,-87.616541819,2018-01-01T19:24:00.000+02:00,1,1,19,2018,Non-Violent
11212307,01/22/2018 10:17:00 AM,THEFT,RETAIL THEFT,false,false,30,41.844160231,-87.7313416,2018-01-22T10:17:00.000+02:00,1,22,10,2018,Non-Violent
11210677,01/22/2018 10:07:00 AM,THEFT,$500 AND UNDER,false,false,41,41.790773422,-87.591579126,2018-01-22T10:07:00.000+02:00,1,22,10,2018,Non-Violent
11211673,01/23/2018 09:00:00 AM,OTHER OFFENSE,SEX OFFENDER: FAIL REG NEW ADD,false,false,67,41.788416273,-87.658368623,2018-01-23T09:00:00.000+02:00,1,23,9,2018,Non-Violent
11205298,01/16/2018 09:00:00 AM,DECEPTIVE PRACTICE,FRAUD OR CONFIDENCE GAME,false,false,4,41.974455132,-87.686681102,2018-01-16T09:00:00.000+02:00,1,16,9,2018,Non-Violent
11212972,01/24/2018 05:00:00 PM,CRIMINAL DAMAGE,TO VEHICLE,false,false,8,41.905097987,-87.64838335,2018-01-24T17:00:00.000+02:00,1,24,17,2018,Non-Violent
11222768,02/04/2018 10:20:00 AM,CRIMINAL TRESPASS,TO LAND,true,false,8,41.889006322,-87.63661199,2018-02-04T10:20:00.000+02:00,2,4,10,2018,Non-Violent
11193869,01/02/2018 06:00:00 AM,THEFT,$500 AND UNDER,false,false,77,41.988360427,-87.656760817,2018-01-02T06:00:00.000+02:00,1,2,6,2018,Non-Violent
11215576,01/27/2018 08:45:00 AM,BATTERY,DOMESTIC BATTERY SIMPLE,false,true,68,41.773752636,-87.631654156,2018-01-27T08:45:00.000+02:00,1,27,8,2018,Violent
11194257,01/03/2018 01:50:00 PM,ASSAULT,AGGRAVATED:KNIFE/CUTTING INSTR,false,true,19,41.917175081,-87.786471,2018-01-03T13:50:00.000+02:00,1,3,13,2018,Violent
11216718,01/24/2018 09:00:00 PM,BURGLARY,UNLAWFUL ENTRY,false,false,5,41.959477421,-87.690619501,2018-01-24T21:00:00.000+02:00,1,24,21,2018,Non-Violent
11203627,01/14/2018 01:30:00 AM,BATTERY,DOMESTIC BATTERY SIMPLE,false,true,6,41.932789263,-87.645510903,2018-01-14T01:30:00.000+02:00,1,14,1,2018,Violent
11217751,01/15/2018 02:45:00 PM,THEFT,OVER $500,false,false,27,41.873765737,-87.699296047,2018-01-15T14:45:00.000+02:00,1,15,14,2018,Non-Violent
11210341,01/12/2018 11:05:00 PM,CRIMINAL DAMAGE,TO PROPERTY,false,false,6,41.938882329,-87.661889437,2018-01-12T23:05:00.000+02:00,1,12,23,2018,Non-Violent
11203645,01/14/2018 03:00:00 AM,THEFT,$500 AND UNDER,false,false,6,41.943844128,-87.649380278,2018-01-14T03:00:00.000+02:00,1,14,3,2018,Non-Violent
11202581,01/12/2018 02:30:00 PM,THEFT,$500 AND UNDER,false,false,73,41.713753878,-87.642987258,2018-01-12T14:30:00.000+02:00,1,12,14,2018,Non-Violent
11207717,01/18/2018 10:12:00 PM,ASSAULT,AGGRAVATED: OTHER DANG WEAPON,false,false,52,41.69841234,-87.532867444,2018-01-18T22:12:00.000+02:00,1,18,22,2018,Violent
11209318,01/16/2018 07:00:00 AM,MOTOR VEHICLE THEFT,AUTOMOBILE,false,false,8,41.8926701,-87.628106353,2018-01-16T07:00:00.000+02:00,1,16,7,2018,Non-Violent
11216985,01/28/2018 06:30:00 PM,THEFT,$500 AND UNDER,false,false,7,41.91753707,-87.635537499,2018-01-28T18:30:00.000+02:00,1,28,18,2018,Non-Violent
11196007,01/05/2018 12:27:00 PM,THEFT,RETAIL THEFT,false,false,8,41.899734047,-87.624142375,2018-01-05T12:27:00.000+02:00,1,5,12,2018,Non-Violent
11215506,01/27/2018 10:45:00 AM,CRIMINAL DAMAGE,TO PROPERTY,false,false,19,41.924123091,-87.755026727,2018-01-27T10:45:00.000+02:00,1,27,10,2018,Non-Violent
11218293,01/29/2018 03:00:00 PM,BATTERY,AGGRAVATED: OTHER DANG WEAPON,false,false,19,41.933780135,-87.777269865,2018-01-29T15:00:00.000+02:00,1,29,15,2018,Violent
11199398,01/09/2018 01:00:00 PM,BATTERY,SIMPLE,false,false,52,41.688218178,-87.537357913,2018-01-09T13:00:00.000+02:00,1,9,13,2018,Violent
11213282,01/24/2018 10:14:00 PM,BATTERY,DOMESTIC BATTERY SIMPLE,true,true,68,41.772583096,-87.637895348,2018-01-24T22:14:00.000+02:00,1,24,22,2018,Violent
11205008,01/15/2018 07:35:00 PM,NARCOTICS,POSS: CANNABIS 30GMS OR LESS,true,false,67,41.791200801,-87.665724773,2018-01-15T19:35:00.000+02:00,1,15,19,2018,Non-Violent
11195548,01/04/2018 02:22:00 PM,THEFT,OVER $500,false,false,54,41.6530627,-87.615628469,2018-01-04T14:22:00.000+02:00,1,4,14,2018,Non-Violent
11207730,01/18/2018 07:50:00 PM,ASSAULT,AGGRAVATED: HANDGUN,false,false,53,41.668103653,-87.639178322,2018-01-18T19:50:00.000+02:00,1,18,19,2018,Violent
11213233,01/24/2018 06:16:00 PM,BATTERY,AGGRAVATED DOMESTIC BATTERY: KNIFE/CUTTING INST,false,true,66,41.772986419,-87.700546154,2018-01-24T18:16:00.000+02:00,1,24,18,2018,Violent
11219458,01/31/2018 03:45:00 PM,ASSAULT,SIMPLE,true,true,19,41.919081304,-87.767568654,2018-01-31T15:45:00.000+02:00,1,31,15,2018,Violent
11201028,01/10/2018 05:00:00 PM,CRIMINAL DAMAGE,TO VEHICLE,false,false,17,41.943879652,-87.781982655,2018-01-10T17:00:00.000+02:00,1,10,17,2018,Non-Violent
11198646,01/08/2018 03:45:00 PM,BATTERY,DOMESTIC BATTERY SIMPLE,false,true,68,41.767943282,-87.651765093,2018-01-08T15:45:00.000+02:00,1,8,15,2018,Violent
11205397,01/16/2018 07:49:00 AM,BATTERY,AGGRAVATED PO: OTHER DANG WEAP,true,false,70,41.740196326,-87.730448553,2018-01-16T07:49:00.000+02:00,1,16,7,2018,Violent
11216284,01/20/2018 03:50:00 PM,BATTERY,DOMESTIC BATTERY SIMPLE,false,true,69,41.761404236,-87.612740084,2018-01-20T15:50:00.000+02:00,1,20,15,2018,Violent
11205272,01/16/2018 09:15:00 AM,THEFT,$500 AND UNDER,false,false,27,41.874060099,-87.705924314,2018-01-16T09:15:00.000+02:00,1,16,9,2018,Non-Violent
11208981,01/18/2018 08:00:00 PM,ASSAULT,SIMPLE,false,true,68,41.777309867,-87.640802922,2018-01-18T20:00:00.000+02:00,1,18,20,2018,Violent
11202962,01/11/2018 02:31:00 PM,MOTOR VEHICLE THEFT,AUTOMOBILE,false,false,33,41.859936038,-87.623980263,2018-01-11T14:31:00.000+02:00,1,11,14,2018,Non-Violent
11220300,02/01/2018 02:00:00 PM,NARCOTICS,POSS: CANNABIS 30GMS OR LESS,true,false,61,41.796558942,-87.650075738,2018-02-01T14:00:00.000+02:00,2,1,14,2018,Non-Violent
11214228,01/25/2018 06:04:00 PM,BATTERY,AGGRAVATED: HANDGUN,true,false,23,41.895955178,-87.716328708,2018-01-25T18:04:00.000+02:00,1,25,18,2018,Violent
11195691,01/05/2018 01:00:00 AM,BATTERY,DOMESTIC BATTERY SIMPLE,false,true,46,41.73659457,-87.556952553,2018-01-05T01:00:00.000+02:00,1,5,1,2018,Violent
11222699,02/04/2018 12:00:00 AM,BURGLARY,UNLAWFUL ENTRY,false,false,56,41.79492248,-87.767532402,2018-02-04T00:00:00.000+02:00,2,4,0,2018,Non-Violent
11203018,01/13/2018 07:30:00 AM,CRIMINAL DAMAGE,TO VEHICLE,false,true,62,41.788769861,-87.716371206,2018-01-13T07:30:00.000+02:00,1,13,7,2018,Non-Violent
11222910,02/04/2018 12:00:00 PM,ASSAULT,SIMPLE,false,false,67,41.779413066,-87.666968951,2018-02-04T12:00:00.000+02:00,2,4,12,2018,Violent
11214204,01/25/2018 03:10:00 PM,THEFT,RETAIL THEFT,true,false,44,41.737750767,-87.604855911,2018-01-25T15:10:00.000+02:00,1,25,15,2018,Non-Violent
11196404,01/05/2018 07:40:00 PM,THEFT,RETAIL THEFT,false,false,24,41.895732399,-87.687784384,2018-01-05T19:40:00.000+02:00,1,5,19,2018,Non-Violent
11220373,02/01/2018 03:00:00 AM,THEFT,$500 AND UNDER,false,false,5,41.941329375,-87.683693168,2018-02-01T03:00:00.000+02:00,2,1,3,2018,Non-Violent
11196634,01/05/2018 07:30:00 PM,ASSAULT,SIMPLE,false,false,69,41.766610297,-87.61407476,2018-01-05T19:30:00.000+02:00,1,5,19,2018,Violent
11197693,01/07/2018 11:45:00 AM,THEFT,FROM BUILDING,false,false,30,41.848809325,-87.72101749,2018-01-07T11:45:00.000+02:00,1,7,11,2018,Non-Violent
11218263,01/30/2018 11:20:00 AM,CRIMINAL TRESPASS,TO LAND,true,false,32,41.879499198,-87.627002693,2018-01-30T11:20:00.000+02:00,1,30,11,2018,Non-Violent
11200814,01/10/2018 07:52:00 PM,NARCOTICS,POSS: HEROIN(WHITE),true,false,69,41.752114055,-87.605224922,2018-01-10T19:52:00.000+02:00,1,10,19,2018,Non-Violent
11221496,02/02/2018 08:02:00 PM,NARCOTICS,POSS: HEROIN(WHITE),true,false,43,41.751906995,-87.553191248,2018-02-02T20:02:00.000+02:00,2,2,20,2018,Non-Violent
11213028,01/22/2018 09:00:00 AM,ASSAULT,SIMPLE,false,false,3,41.954892271,-87.650754774,2018-01-22T09:00:00.000+02:00,1,22,9,2018,Violent
11192858,01/01/2018 04:50:00 PM,BATTERY,SIMPLE,false,false,42,41.78208803,-87.614063137,2018-01-01T16:50:00.000+02:00,1,1,16,2018,Violent
11196583,01/05/2018 10:51:00 PM,ROBBERY,ARMED: HANDGUN,false,false,32,41.871362551,-87.63058763,2018-01-05T22:51:00.000+02:00,1,5,22,2018,Violent
11220406,02/01/2018 04:40:00 PM,BATTERY,DOMESTIC BATTERY SIMPLE,false,true,66,41.784695402,-87.686582123,2018-02-01T16:40:00.000+02:00,2,1,16,2018,Violent
11222886,02/04/2018 02:55:00 PM,BATTERY,DOMESTIC BATTERY SIMPLE,false,true,27,41.874893494,-87.697287444,2018-02-04T14:55:00.000+02:00,2,4,14,2018,Violent
11215772,01/27/2018 01:55:00 PM,WEAPONS VIOLATION,UNLAWFUL POSS OTHER FIREARM,true,false,73,41.708762127,-87.641191195,2018-01-27T13:55:00.000+02:00,1,27,13,2018,Non-Violent
11197248,01/06/2018 06:44:00 PM,WEAPONS VIOLATION,UNLAWFUL POSS OF HANDGUN,true,false,27,41.871481309,-87.71314587,2018-01-06T18:44:00.000+02:00,1,6,18,2018,Non-Violent
11195524,01/04/2018 05:20:00 PM,BATTERY,AGGRAVATED - HANDGUN,false,false,26,41.871423156,-87.72536551,2018-01-04T17:20:00.000+02:00,1,4,17,2018,Violent
11216117,01/27/2018 11:10:00 PM,ASSAULT,SIMPLE,false,false,53,41.684229864,-87.625309487,2018-01-27T23:10:00.000+02:00,1,27,23,2018,Violent
11209462,01/20/2018 06:15:00 PM,BATTERY,DOMESTIC BATTERY SIMPLE,false,true,42,41.778384336,-87.604656531,2018-01-20T18:15:00.000+02:00,1,20,18,2018,Violent
11221182,02/02/2018 12:09:00 PM,THEFT,OVER $500,false,false,71,41.740635186,-87.648613323,2018-02-02T12:09:00.000+02:00,2,2,12,2018,Non-Violent
11218505,01/30/2018 12:00:00 PM,CRIMINAL TRESPASS,TO LAND,true,false,32,41.884650262,-87.627915459,2018-01-30T12:00:00.000+02:00,1,30,12,2018,Non-Violent
11197842,01/07/2018 07:00:00 PM,MOTOR VEHICLE THEFT,AUTOMOBILE,true,false,62,41.797915361,-87.717167339,2018-01-07T19:00:00.000+02:00,1,7,19,2018,Non-Violent
11209832,01/10/2018 09:00:00 AM,THEFT,$500 AND UNDER,false,false,29,41.851487242,-87.728696242,2018-01-10T09:00:00.000+02:00,1,10,9,2018,Non-Violent
11207375,01/15/2018 10:15:00 AM,OTHER OFFENSE,TELEPHONE THREAT,false,true,67,41.772324861,-87.654831089,2018-01-15T10:15:00.000+02:00,1,15,10,2018,Non-Violent
11192814,01/01/2018 04:30:00 PM,BATTERY,DOMESTIC BATTERY SIMPLE,false,true,43,41.764802087,-87.576941433,2018-01-01T16:30:00.000+02:00,1,1,16,2018,Violent
11214948,01/25/2018 07:00:00 PM,THEFT,$500 AND UNDER,false,false,63,41.80288982,-87.689476369,2018-01-25T19:00:00.000+02:00,1,25,19,2018,Non-Violent
11206942,01/15/2018 04:00:00 AM,DECEPTIVE PRACTICE,FRAUD OR CONFIDENCE GAME,false,false,31,41.854980383,-87.656340424,2018-01-15T04:00:00.000+02:00,1,15,4,2018,Non-Violent
11197363,01/05/2018 02:00:00 PM,THEFT,$500 AND UNDER,false,false,40,41.782861937,-87.623774464,2018-01-05T14:00:00.000+02:00,1,5,14,2018,Non-Violent
11212042,01/22/2018 03:00:00 PM,CRIMINAL TRESPASS,TO LAND,false,false,77,41.995456826,-87.666596116,2018-01-22T15:00:00.000+02:00,1,22,15,2018,Non-Violent
11220700,02/01/2018 08:44:00 PM,CRIMINAL TRESPASS,TO RESIDENCE,false,false,25,41.883209435,-87.764962093,2018-02-01T20:44:00.000+02:00,2,1,20,2018,Non-Violent
11205584,01/16/2018 01:20:00 PM,THEFT,OVER $500,false,false,60,41.843400911,-87.660297645,2018-01-16T13:20:00.000+02:00,1,16,13,2018,Non-Violent
11200409,01/10/2018 02:30:00 PM,NARCOTICS,POSS: HEROIN(WHITE),true,false,27,41.872336473,-87.718053942,2018-01-10T14:30:00.000+02:00,1,10,14,2018,Non-Violent
11215418,01/27/2018 05:00:00 AM,BATTERY,AGGRAVATED - HANDGUN,false,false,53,41.675634814,-87.633409079,2018-01-27T05:00:00.000+02:00,1,27,5,2018,Violent
11202508,01/12/2018 01:41:00 PM,ASSAULT,SIMPLE,false,false,43,41.761218589,-87.576191815,2018-01-12T13:41:00.000+02:00,1,12,13,2018,Violent
11209845,01/19/2018 06:20:00 PM,THEFT,$500 AND UNDER,false,false,17,41.952897791,-87.787860507,2018-01-19T18:20:00.000+02:00,1,19,18,2018,Non-Violent
11203405,01/13/2018 05:30:00 PM,BATTERY,SIMPLE,false,false,46,41.751342079,-87.56137777,2018-01-13T17:30:00.000+02:00,1,13,17,2018,Violent
11199216,01/09/2018 10:30:00 AM,MOTOR VEHICLE THEFT,AUTOMOBILE,false,false,63,41.799934918,-87.704964513,2018-01-09T10:30:00.000+02:00,1,9,10,2018,Non-Violent
11218767,01/30/2018 07:04:00 PM,NARCOTICS,POSS: CANNABIS 30GMS OR LESS,true,false,43,41.765755571,-87.576292427,2018-01-30T19:04:00.000+02:00,1,30,19,2018,Non-Violent
11200108,01/10/2018 08:24:00 AM,BATTERY,SIMPLE,false,true,68,41.780908644,-87.649677275,2018-01-10T08:24:00.000+02:00,1,10,8,2018,Violent
11221059,02/01/2018 07:40:00 AM,BATTERY,DOMESTIC BATTERY SIMPLE,false,true,34,41.824673536,-87.631329575,2018-02-01T07:40:00.000+02:00,2,1,7,2018,Violent
11192653,01/01/2018 12:01:00 AM,CRIMINAL DAMAGE,TO PROPERTY,false,false,67,41.76502212,-87.656198299,2018-01-01T00:01:00.000+02:00,1,1,0,2018,Non-Violent
11202370,01/12/2018 03:15:00 PM,ASSAULT,AGGRAVATED: HANDGUN,false,false,29,41.866358918,-87.709806763,2018-01-12T15:15:00.000+02:00,1,12,15,2018,Violent
11216334,01/28/2018 02:20:00 AM,BATTERY,AGGRAVATED:KNIFE/CUTTING INSTR,true,false,25,41.90938466,-87.765089988,2018-01-28T02:20:00.000+02:00,1,28,2,2018,Violent
11195590,01/03/2018 10:48:00 PM,BATTERY,DOMESTIC BATTERY SIMPLE,false,true,43,41.769257286,-87.581306331,2018-01-03T22:48:00.000+02:00,1,3,22,2018,Violent
11196909,01/06/2018 01:40:00 PM,ASSAULT,AGGRAVATED: HANDGUN,false,false,27,41.873321775,-87.705902161,2018-01-06T13:40:00.000+02:00,1,6,13,2018,Violent
11208839,01/18/2018 12:00:00 PM,DECEPTIVE PRACTICE,ATTEMPT - FINANCIAL IDENTITY THEFT,false,false,39,41.806890268,-87.589834384,2018-01-18T12:00:00.000+02:00,1,18,12,2018,Non-Violent
11213633,01/25/2018 11:21:00 AM,OTHER OFFENSE,TELEPHONE THREAT,false,false,61,41.799245305,-87.674454214,2018-01-25T11:21:00.000+02:00,1,25,11,2018,Non-Violent
11202187,01/12/2018 11:20:00 AM,ASSAULT,SIMPLE,false,false,24,41.903698307,-87.667018987,2018-01-12T11:20:00.000+02:00,1,12,11,2018,Violent
11219047,01/31/2018 05:35:00 AM,ROBBERY,STRONGARM - NO WEAPON,false,false,67,41.77948038,-87.66391419,2018-01-31T05:35:00.000+02:00,1,31,5,2018,Violent
11195753,01/03/2018 03:00:00 AM,ROBBERY,ARMED: OTHER DANGEROUS WEAPON,false,false,26,41.874288556,-87.725441164,2018-01-03T03:00:00.000+02:00,1,3,3,2018,Violent
11223345,02/05/2018 09:27:00 AM,THEFT,OVER $500,false,false,71,41.74958972,-87.665844597,2018-02-05T09:27:00.000+02:00,2,5,9,2018,Non-Violent
11201077,01/10/2018 01:00:00 PM,THEFT,$500 AND UNDER,false,false,37,41.794533814,-87.631438536,2018-01-10T13:00:00.000+02:00,1,10,13,2018,Non-Violent
11201680,01/11/2018 03:17:00 PM,THEFT,$500 AND UNDER,false,false,7,41.91229747,-87.649533476,2018-01-11T15:17:00.000+02:00,1,11,15,2018,Non-Violent
11218786,01/30/2018 09:01:00 PM,NARCOTICS,FOUND SUSPECT NARCOTICS,true,false,40,41.781576603,-87.615660095,2018-01-30T21:01:00.000+02:00,1,30,21,2018,Non-Violent
11200991,01/11/2018 05:06:00 AM,BATTERY,AGGRAVATED DOMESTIC BATTERY: OTHER DANG WEAPON,true,true,67,41.782574883,-87.670357078,2018-01-11T05:06:00.000+02:00,1,11,5,2018,Violent
11222713,02/04/2018 05:45:00 AM,ASSAULT,AGGRAVATED: HANDGUN,false,false,29,41.866235211,-87.720473094,2018-02-04T05:45:00.000+02:00,2,4,5,2018,Violent
11204800,01/15/2018 05:31:00 PM,MOTOR VEHICLE THEFT,AUTOMOBILE,false,false,24,41.89478961,-87.690449409,2018-01-15T17:31:00.000+02:00,1,15,17,2018,Non-Violent
11214330,01/26/2018 05:35:00 AM,BATTERY,DOMESTIC BATTERY SIMPLE,false,true,61,41.800662937,-87.646151874,2018-01-26T05:35:00.000+02:00,1,26,5,2018,Violent
11215926,01/25/2018 08:57:00 AM,DECEPTIVE PRACTICE,ILLEGAL USE CASH CARD,false,false,8,,,2018-01-25T08:57:00.000+02:00,1,25,8,2018,Non-Violent
11209643,01/21/2018 04:30:00 AM,BATTERY,AGGRAVATED: HANDGUN,false,false,2,41.987267534,-87.689563935,2018-01-21T04:30:00.000+02:00,1,21,4,2018,Violent
11213407,01/24/2018 11:30:00 PM,THEFT,RETAIL THEFT,false,false,32,41.867414944,-87.627231186,2018-01-24T23:30:00.000+02:00,1,24,23,2018,Non-Violent
11198181,01/08/2018 10:09:00 AM,ASSAULT,AGGRAVATED:KNIFE/CUTTING INSTR,true,true,71,41.749780682,-87.667066613,2018-01-08T10:09:00.000+02:00,1,8,10,2018,Violent
11222731,02/03/2018 06:00:00 PM,THEFT,OVER $500,false,false,48,41.729160106,-87.58548161,2018-02-03T18:00:00.000+02:00,2,3,18,2018,Non-Violent
11220170,01/31/2018 05:45:00 PM,THEFT,POCKET-PICKING,false,false,8,41.903775756,-87.639324074,2018-01-31T17:45:00.000+02:00,1,31,17,2018,Non-Violent
11208858,01/19/2018 02:10:00 PM,ROBBERY,AGGRAVATED VEHICULAR HIJACKING,false,false,25,41.869163856,-87.770993928,2018-01-19T14:10:00.000+02:00,1,19,14,2018,Violent
11222832,02/03/2018 05:00:00 PM,CRIMINAL DAMAGE,TO VEHICLE,false,false,28,41.874628587,-87.683788939,2018-02-03T17:00:00.000+02:00,2,3,17,2018,Non-Violent
11220011,01/31/2018 11:00:00 AM,CRIMINAL DAMAGE,TO PROPERTY,false,false,14,41.961003292,-87.723330791,2018-01-31T11:00:00.000+02:00,1,31,11,2018,Non-Violent
11217262,01/24/2018 08:00:00 AM,ASSAULT,SIMPLE,false,false,4,41.974953796,-87.701323687,2018-01-24T08:00:00.000+02:00,1,24,8,2018,Violent
11196110,01/05/2018 01:00:00 PM,THEFT,RETAIL THEFT,false,false,65,41.754592961,-87.741528537,2018-01-05T13:00:00.000+02:00,1,5,13,2018,Non-Violent
11201253,01/11/2018 04:37:00 AM,OTHER OFFENSE,TELEPHONE THREAT,false,false,23,41.904343932,-87.73492394,2018-01-11T04:37:00.000+02:00,1,11,4,2018,Non-Violent
11202450,01/12/2018 03:00:00 PM,OFFENSE INVOLVING CHILDREN,OTHER OFFENSE,false,true,30,41.843254432,-87.728171881,2018-01-12T15:00:00.000+02:00,1,12,15,2018,Non-Violent
11222766,02/04/2018 08:00:00 AM,CRIMINAL DAMAGE,TO PROPERTY,false,false,22,41.921757573,-87.724244889,2018-02-04T08:00:00.000+02:00,2,4,8,2018,Non-Violent
11212294,01/23/2018 07:45:00 PM,ROBBERY,ARMED: HANDGUN,false,false,28,41.86557542,-87.671313862,2018-01-23T19:45:00.000+02:00,1,23,19,2018,Violent
11194101,01/03/2018 12:29:00 PM,THEFT,RETAIL THEFT,false,false,19,41.923976215,-87.766294416,2018-01-03T12:29:00.000+02:00,1,3,12,2018,Non-Violent
11192257,01/01/2018 01:13:00 AM,CRIMINAL DAMAGE,TO PROPERTY,false,false,69,41.765089765,-87.614044091,2018-01-01T01:13:00.000+02:00,1,1,1,2018,Non-Violent
11197275,01/06/2018 10:00:00 PM,BATTERY,DOMESTIC BATTERY SIMPLE,false,true,43,41.769845753,-87.57231828,2018-01-06T22:00:00.000+02:00,1,6,22,2018,Violent
11202598,01/12/2018 06:45:00 PM,DECEPTIVE PRACTICE,FORGERY,true,false,67,41.770362952,-87.664705498,2018-01-12T18:45:00.000+02:00,1,12,18,2018,Non-Violent
11192390,01/01/2018 04:23:00 AM,OTHER OFFENSE,HARASSMENT BY ELECTRONIC MEANS,false,true,23,41.899095398,-87.718013856,2018-01-01T04:23:00.000+02:00,1,1,4,2018,Non-Violent
11217655,01/29/2018 08:30:00 AM,THEFT,$500 AND UNDER,false,false,49,41.68543018,-87.612673218,2018-01-29T08:30:00.000+02:00,1,29,8,2018,Non-Violent
11223376,02/05/2018 07:30:00 AM,ROBBERY,STRONGARM - NO WEAPON,false,false,16,41.946488939,-87.718661096,2018-02-05T07:30:00.000+02:00,2,5,7,2018,Violent
11209282,01/16/2018 03:00:00 PM,THEFT,$500 AND UNDER,false,false,43,41.767116798,-87.570906274,2018-01-16T15:00:00.000+02:00,1,16,15,2018,Non-Violent
11222264,02/03/2018 02:40:00 PM,DECEPTIVE PRACTICE,COMPUTER FRAUD,false,false,32,41.886202772,-87.620685715,2018-02-03T14:40:00.000+02:00,2,3,14,2018,Non-Violent
11216693,01/28/2018 03:47:00 PM,THEFT,RETAIL THEFT,false,false,22,41.931403963,-87.686686143,2018-01-28T15:47:00.000+02:00,1,28,15,2018,Non-Violent
11221960,02/03/2018 01:30:00 PM,OTHER OFFENSE,TELEPHONE THREAT,false,false,4,41.968636934,-87.687081926,2018-02-03T13:30:00.000+02:00,2,3,13,2018,Non-Violent
11201503,01/11/2018 11:50:00 AM,DECEPTIVE PRACTICE,FRAUD OR CONFIDENCE GAME,false,false,65,41.775728867,-87.715330376,2018-01-11T11:50:00.000+02:00,1,11,11,2018,Non-Violent
11210027,01/21/2018 03:00:00 PM,BURGLARY,UNLAWFUL ENTRY,false,false,53,41.671938901,-87.623679963,2018-01-21T15:00:00.000+02:00,1,21,15,2018,Non-Violent
11206670,01/17/2018 05:02:00 PM,THEFT,RETAIL THEFT,true,false,32,41.883500187,-87.627876698,2018-01-17T17:02:00.000+02:00,1,17,17,2018,Non-Violent
11219073,01/31/2018 05:00:00 AM,THEFT,RETAIL THEFT,true,false,41,41.795190552,-87.588007653,2018-01-31T05:00:00.000+02:00,1,31,5,2018,Non-Violent
11211135,01/20/2018 12:00:00 AM,DECEPTIVE PRACTICE,ILLEGAL USE CASH CARD,false,false,6,41.940111723,-87.668962965,2018-01-20T00:00:00.000+02:00,1,20,0,2018,Non-Violent
11212339,01/23/2018 09:50:00 PM,ASSAULT,AGGRAVATED: HANDGUN,false,false,38,41.80857747,-87.607777054,2018-01-23T21:50:00.000+02:00,1,23,21,2018,Violent
11207295,01/18/2018 01:12:00 PM,BATTERY,SIMPLE,false,true,67,41.76968909,-87.657879472,2018-01-18T13:12:00.000+02:00,1,18,13,2018,Violent
11193215,01/02/2018 11:00:00 AM,CRIMINAL DAMAGE,TO VEHICLE,false,false,66,41.782250451,-87.693481387,2018-01-02T11:00:00.000+02:00,1,2,11,2018,Non-Violent
11193760,01/02/2018 10:00:00 PM,INTERFERENCE WITH PUBLIC OFFICER,OBSTRUCTING IDENTIFICATION,true,false,53,41.685180281,-87.62411657,2018-01-02T22:00:00.000+02:00,1,2,22,2018,Non-Violent
11218449,01/28/2018 09:00:00 PM,DECEPTIVE PRACTICE,ILLEGAL USE CASH CARD,false,false,19,41.928274887,-87.771004268,2018-01-28T21:00:00.000+02:00,1,28,21,2018,Non-Violent
11193898,01/01/2018 11:19:00 AM,ASSAULT,SIMPLE,false,false,21,41.939262335,-87.71335694,2018-01-01T11:19:00.000+02:00,1,1,11,2018,Violent
11223647,02/03/2018 12:26:00 PM,ASSAULT,SIMPLE,false,false,3,41.96538061,-87.659110921,2018-02-03T12:26:00.000+02:00,2,3,12,2018,Violent
11223664,02/05/2018 03:59:00 PM,OTHER OFFENSE,SEX OFFENDER: FAIL TO REGISTER,true,false,30,41.843281635,-87.695171094,2018-02-05T15:59:00.000+02:00,2,5,15,2018,Non-Violent
11204440,01/14/2018 04:00:00 PM,THEFT,$500 AND UNDER,false,false,8,41.909270561,-87.64722927,2018-01-14T16:00:00.000+02:00,1,14,16,2018,Non-Violent
11194427,01/03/2018 03:28:00 PM,BATTERY,DOMESTIC BATTERY SIMPLE,true,true,69,41.760284994,-87.61237142,2018-01-03T15:28:00.000+02:00,1,3,15,2018,Violent
11205269,01/08/2018 12:00:00 AM,OFFENSE INVOLVING CHILDREN,CHILD ABUSE,false,false,26,41.878772294,-87.73372314,2018-01-08T00:00:00.000+02:00,1,8,0,2018,Non-Violent
11198661,01/08/2018 03:24:00 PM,DECEPTIVE PRACTICE,THEFT OF LABOR/SERVICES,true,false,43,41.756418148,-87.576090645,2018-01-08T15:24:00.000+02:00,1,8,15,2018,Non-Violent
11192985,01/01/2018 08:00:00 AM,CRIMINAL DAMAGE,CRIMINAL DEFACEMENT,false,false,14,41.968405527,-87.712783941,2018-01-01T08:00:00.000+02:00,1,1,8,2018,Non-Violent
11203858,01/14/2018 10:24:00 AM,ARSON,ATTEMPT ARSON,false,false,7,41.918134916,-87.65145894,2018-01-14T10:24:00.000+02:00,1,14,10,2018,Non-Violent
11213197,01/24/2018 05:09:00 PM,BATTERY,DOMESTIC BATTERY SIMPLE,false,true,68,41.760925028,-87.651582796,2018-01-24T17:09:00.000+02:00,1,24,17,2018,Violent
11199357,01/08/2018 12:30:00 PM,OTHER OFFENSE,TELEPHONE THREAT,false,false,60,41.833393992,-87.646168819,2018-01-08T12:30:00.000+02:00,1,8,12,2018,Non-Violent
11198152,01/07/2018 09:45:00 AM,CRIMINAL DAMAGE,TO VEHICLE,false,false,26,41.879805655,-87.722039942,2018-01-07T09:45:00.000+02:00,1,7,9,2018,Non-Violent
11219042,01/30/2018 08:00:00 PM,ROBBERY,AGGRAVATED,false,false,53,41.681424455,-87.643698996,2018-01-30T20:00:00.000+02:00,1,30,20,2018,Violent
11196086,01/05/2018 05:50:00 AM,BATTERY,SIMPLE,false,false,68,41.768705488,-87.653498246,2018-01-05T05:50:00.000+02:00,1,5,5,2018,Violent
11218798,01/24/2018 07:00:00 PM,CRIMINAL DAMAGE,TO VEHICLE,false,false,8,41.910623586,-87.638577589,2018-01-24T19:00:00.000+02:00,1,24,19,2018,Non-Violent
11207980,01/19/2018 07:30:00 AM,OTHER OFFENSE,HARASSMENT BY TELEPHONE,false,true,31,41.85113807,-87.684327623,2018-01-19T07:30:00.000+02:00,1,19,7,2018,Non-Violent
11207574,01/17/2018 01:32:00 PM,THEFT,$500 AND UNDER,false,false,54,41.657859678,-87.603403942,2018-01-17T13:32:00.000+02:00,1,17,13,2018,Non-Violent
11223246,02/04/2018 10:00:00 PM,THEFT,OVER $500,false,false,24,41.89795909,-87.663071285,2018-02-04T22:00:00.000+02:00,2,4,22,2018,Non-Violent
11211692,01/22/2018 02:30:00 AM,CRIM SEXUAL ASSAULT,NON-AGGRAVATED,false,false,21,41.939330941,-87.707791583,2018-01-22T02:30:00.000+02:00,1,22,2,2018,Non-Violent
11197085,01/06/2018 05:00:00 PM,ASSAULT,SIMPLE,false,false,56,41.799639692,-87.742948,2018-01-06T17:00:00.000+02:00,1,6,17,2018,Violent
11205817,01/11/2018 04:45:00 PM,ASSAULT,SIMPLE,false,false,44,41.742710224,-87.634088181,2018-01-11T16:45:00.000+02:00,1,11,16,2018,Violent
11201307,01/11/2018 08:15:00 AM,THEFT,OVER $500,false,false,8,41.892310034,-87.63972734,2018-01-11T08:15:00.000+02:00,1,11,8,2018,Non-Violent
11194361,01/03/2018 03:40:00 PM,MOTOR VEHICLE THEFT,AUTOMOBILE,false,false,37,41.817156358,-87.631228252,2018-01-03T15:40:00.000+02:00,1,3,15,2018,Non-Violent
11194040,01/01/2018 05:42:00 PM,OTHER OFFENSE,HARASSMENT BY ELECTRONIC MEANS,false,true,69,41.760284994,-87.61237142,2018-01-01T17:42:00.000+02:00,1,1,17,2018,Non-Violent
11197783,01/07/2018 06:55:00 PM,NARCOTICS,POSS: HEROIN(WHITE),true,false,29,41.855835127,-87.73254257,2018-01-07T18:55:00.000+02:00,1,7,18,2018,Non-Violent
11203706,01/14/2018 06:50:00 AM,MOTOR VEHICLE THEFT,AUTOMOBILE,false,false,70,41.745244731,-87.707147047,2018-01-14T06:50:00.000+02:00,1,14,6,2018,Non-Violent
11192975,01/01/2018 11:11:00 PM,BATTERY,DOMESTIC BATTERY SIMPLE,true,true,7,41.931841867,-87.640839061,2018-01-01T23:11:00.000+02:00,1,1,23,2018,Violent
11206742,01/17/2018 07:15:00 PM,BATTERY,SIMPLE,true,false,68,41.772613371,-87.636098706,2018-01-17T19:15:00.000+02:00,1,17,19,2018,Violent
11217421,01/29/2018 11:15:00 AM,WEAPONS VIOLATION,UNLAWFUL POSS OF HANDGUN,false,false,14,41.96192637,-87.726631098,2018-01-29T11:15:00.000+02:00,1,29,11,2018,Non-Violent
11219951,01/31/2018 09:30:00 AM,ASSAULT,SIMPLE,false,false,49,41.687991156,-87.631378691,2018-01-31T09:30:00.000+02:00,1,31,9,2018,Violent
11200655,01/09/2018 12:00:00 AM,THEFT,FROM BUILDING,false,false,6,41.935156334,-87.639384562,2018-01-09T00:00:00.000+02:00,1,9,0,2018,Non-Violent
11206409,01/17/2018 11:50:00 AM,WEAPONS VIOLATION,UNLAWFUL POSS OF HANDGUN,true,false,65,41.767866105,-87.713737958,2018-01-17T11:50:00.000+02:00,1,17,11,2018,Non-Violent
11211560,01/23/2018 07:00:00 AM,OTHER OFFENSE,HARASSMENT BY TELEPHONE,false,false,7,41.932145724,-87.639351045,2018-01-23T07:00:00.000+02:00,1,23,7,2018,Non-Violent
11221050,01/25/2018 11:00:00 PM,THEFT,$500 AND UNDER,false,false,8,41.892575593,-87.621683663,2018-01-25T23:00:00.000+02:00,1,25,23,2018,Non-Violent
11220342,01/31/2018 09:00:00 PM,OTHER OFFENSE,TELEPHONE THREAT,false,true,15,41.955687696,-87.784204399,2018-01-31T21:00:00.000+02:00,1,31,21,2018,Non-Violent
11214306,01/25/2018 12:00:00 PM,THEFT,OVER $500,false,false,46,41.738307887,-87.562380271,2018-01-25T12:00:00.000+02:00,1,25,12,2018,Non-Violent
11221356,02/02/2018 05:45:00 PM,ROBBERY,STRONGARM - NO WEAPON,false,false,8,41.907320745,-87.631556325,2018-02-02T17:45:00.000+02:00,2,2,17,2018,Violent
11200703,01/10/2018 07:00:00 PM,BATTERY,DOMESTIC BATTERY SIMPLE,false,true,67,41.761042853,-87.663684347,2018-01-10T19:00:00.000+02:00,1,10,19,2018,Violent
11218407,01/30/2018 01:40:00 PM,OTHER OFFENSE,TELEPHONE THREAT,false,false,7,41.926299014,-87.640917382,2018-01-30T13:40:00.000+02:00,1,30,13,2018,Non-Violent
11221667,02/02/2018 11:00:00 PM,ASSAULT,SIMPLE,false,true,32,41.884790951,-87.624469241,2018-02-02T23:00:00.000+02:00,2,2,23,2018,Violent
11198678,01/08/2018 06:50:00 PM,BATTERY,DOMESTIC BATTERY SIMPLE,false,true,15,41.960590909,-87.758278218,2018-01-08T18:50:00.000+02:00,1,8,18,2018,Violent
11207094,01/17/2018 03:12:00 PM,BATTERY,SIMPLE,false,false,65,41.780328363,-87.717896689,2018-01-17T15:12:00.000+02:00,1,17,15,2018,Violent
11192939,01/01/2018 09:00:00 PM,MOTOR VEHICLE THEFT,AUTOMOBILE,true,false,44,41.736259984,-87.628068782,2018-01-01T21:00:00.000+02:00,1,1,21,2018,Non-Violent
11203702,01/14/2018 05:27:00 AM,BATTERY,DOMESTIC BATTERY SIMPLE,true,true,38,41.810657946,-87.607826939,2018-01-14T05:27:00.000+02:00,1,14,5,2018,Violent
11209744,01/20/2018 08:00:00 PM,MOTOR VEHICLE THEFT,THEFT/RECOVERY: AUTOMOBILE,false,false,2,41.991344692,-87.704284595,2018-01-20T20:00:00.000+02:00,1,20,20,2018,Non-Violent
11207502,01/17/2018 05:00:00 PM,DECEPTIVE PRACTICE,FINANCIAL IDENTITY THEFT OVER $ 300,false,false,28,41.860295708,-87.659088972,2018-01-17T17:00:00.000+02:00,1,17,17,2018,Non-Violent
11201761,01/10/2018 10:00:00 PM,CRIMINAL DAMAGE,TO VEHICLE,false,false,13,41.981846635,-87.711263186,2018-01-10T22:00:00.000+02:00,1,10,22,2018,Non-Violent
11223444,02/05/2018 05:22:00 AM,OTHER OFFENSE,VIOLATE ORDER OF PROTECTION,true,true,62,41.788769861,-87.716371206,2018-02-05T05:22:00.000+02:00,2,5,5,2018,Non-Violent
11210010,01/20/2018 09:00:00 PM,THEFT,$500 AND UNDER,false,false,38,41.816647233,-87.615895985,2018-01-20T21:00:00.000+02:00,1,20,21,2018,Non-Violent
11193968,01/03/2018 06:30:00 AM,BURGLARY,UNLAWFUL ENTRY,false,false,16,41.954505026,-87.708032917,2018-01-03T06:30:00.000+02:00,1,3,6,2018,Non-Violent
11207021,01/18/2018 12:00:00 AM,MOTOR VEHICLE THEFT,AUTOMOBILE,false,false,3,41.973339203,-87.653132052,2018-01-18T00:00:00.000+02:00,1,18,0,2018,Non-Violent
11213762,01/01/2018 12:00:00 PM,DECEPTIVE PRACTICE,FINANCIAL IDENTITY THEFT OVER $ 300,false,false,63,41.792722974,-87.692552145,2018-01-01T12:00:00.000+02:00,1,1,12,2018,Non-Violent
11216719,01/28/2018 04:40:00 PM,ASSAULT,AGGRAVATED: HANDGUN,false,false,67,41.789924212,-87.657194052,2018-01-28T16:40:00.000+02:00,1,28,16,2018,Violent
11202137,01/11/2018 11:07:00 PM,OTHER OFFENSE,HARASSMENT BY TELEPHONE,false,false,64,41.784508378,-87.769306958,2018-01-11T23:07:00.000+02:00,1,11,23,2018,Non-Violent
11200665,01/10/2018 09:10:00 AM,THEFT,OVER $500,false,false,35,41.833661892,-87.61417218,2018-01-10T09:10:00.000+02:00,1,10,9,2018,Non-Violent
11216614,01/28/2018 03:30:00 PM,NARCOTICS,POSS: HEROIN(WHITE),true,false,26,41.875188816,-87.731722451,2018-01-28T15:30:00.000+02:00,1,28,15,2018,Non-Violent
11218109,01/20/2018 11:27:00 AM,NARCOTICS,MANU/DELIVER: HEROIN (WHITE),true,false,43,41.754879819,-87.562654754,2018-01-20T11:27:00.000+02:00,1,20,11,2018,Non-Violent
11200758,01/10/2018 08:43:00 PM,NARCOTICS,POSSESSION OF DRUG EQUIPMENT,true,false,29,41.863919757,-87.722664867,2018-01-10T20:43:00.000+02:00,1,10,20,2018,Non-Violent
11202511,01/12/2018 05:00:00 PM,CRIMINAL TRESPASS,TO LAND,true,false,26,41.88065283,-87.731763004,2018-01-12T17:00:00.000+02:00,1,12,17,2018,Non-Violent
11213455,01/25/2018 07:50:00 AM,MOTOR VEHICLE THEFT,AUTOMOBILE,false,false,23,41.89626756,-87.712678392,2018-01-25T07:50:00.000+02:00,1,25,7,2018,Non-Violent
11200475,01/08/2018 07:00:00 PM,BATTERY,SIMPLE,false,false,6,41.93991842,-87.653288878,2018-01-08T19:00:00.000+02:00,1,8,19,2018,Violent
11202070,01/12/2018 05:30:00 AM,BURGLARY,FORCIBLE ENTRY,false,false,19,41.935011253,-87.759764997,2018-01-12T05:30:00.000+02:00,1,12,5,2018,Non-Violent
11222042,02/03/2018 01:00:00 AM,DECEPTIVE PRACTICE,CREDIT CARD FRAUD,false,false,8,41.90840423,-87.6346267,2018-02-03T01:00:00.000+02:00,2,3,1,2018,Non-Violent
11207636,01/18/2018 08:20:00 PM,CRIMINAL TRESPASS,TO LAND,false,false,61,41.807979803,-87.643964604,2018-01-18T20:20:00.000+02:00,1,18,20,2018,Non-Violent
11204645,01/15/2018 01:55:00 PM,THEFT,PURSE-SNATCHING,false,false,44,41.735752519,-87.625429032,2018-01-15T13:55:00.000+02:00,1,15,13,2018,Non-Violent
11201778,01/11/2018 05:58:00 PM,BATTERY,DOMESTIC BATTERY SIMPLE,true,true,68,41.762640204,-87.641481172,2018-01-11T17:58:00.000+02:00,1,11,17,2018,Violent
11199050,01/09/2018 06:25:00 AM,BATTERY,SIMPLE,true,false,49,41.722768379,-87.624410361,2018-01-09T06:25:00.000+02:00,1,9,6,2018,Violent
11218469,01/29/2018 06:30:00 PM,THEFT,$500 AND UNDER,false,false,11,41.983404967,-87.770758491,2018-01-29T18:30:00.000+02:00,1,29,18,2018,Non-Violent
11215512,01/03/2018 12:00:00 PM,THEFT,OVER $500,false,false,76,41.976290414,-87.905227221,2018-01-03T12:00:00.000+02:00,1,3,12,2018,Non-Violent
11329590,05/28/2018 11:08:00 PM,ASSAULT,SIMPLE,false,false,32,41.882107947,-87.624609064,2018-05-28T23:08:00.000+02:00,5,28,23,2018,Violent
11282247,04/11/2018 03:30:00 PM,THEFT,$500 AND UNDER,false,false,28,41.881470317,-87.665189884,2018-04-11T15:30:00.000+02:00,4,11,15,2018,Non-Violent
11371666,07/05/2018 09:20:00 PM,THEFT,$500 AND UNDER,false,false,24,41.904660809,-87.662652211,2018-07-05T21:20:00.000+02:00,7,5,21,2018,Non-Violent
11323185,05/18/2018 11:35:00 AM,ASSAULT,SIMPLE,false,false,43,41.765191853,-87.583652091,2018-05-18T11:35:00.000+02:00,5,18,11,2018,Violent
11381843,07/15/2018 10:30:00 PM,CRIMINAL DAMAGE,TO VEHICLE,false,false,39,41.803653573,-87.603772447,2018-07-15T22:30:00.000+02:00,7,15,22,2018,Non-Violent
11265185,03/24/2018 02:15:00 AM,BATTERY,SIMPLE,true,false,8,41.893676841,-87.631176812,2018-03-24T02:15:00.000+02:00,3,24,2,2018,Violent
11400346,06/01/2018 07:00:00 PM,DECEPTIVE PRACTICE,FINANCIAL IDENTITY THEFT OVER $ 300,false,false,16,41.952143258,-87.73080082,2018-06-01T19:00:00.000+02:00,6,1,19,2018,Non-Violent
11252508,03/10/2018 09:45:00 AM,CRIM SEXUAL ASSAULT,AGGRAVATED: HANDGUN,false,false,32,41.882446221,-87.627847897,2018-03-10T09:45:00.000+02:00,3,10,9,2018,Non-Violent
11310347,05/09/2018 03:00:00 PM,BATTERY,SIMPLE,false,false,31,41.852586768,-87.650210212,2018-05-09T15:00:00.000+02:00,5,9,15,2018,Violent
11287644,04/17/2018 08:00:00 AM,DECEPTIVE PRACTICE,CREDIT CARD FRAUD,false,false,15,41.943311745,-87.75305593,2018-04-17T08:00:00.000+02:00,4,17,8,2018,Non-Violent
11311828,05/11/2018 06:40:00 AM,BATTERY,DOMESTIC BATTERY SIMPLE,false,true,73,41.719198602,-87.653573414,2018-05-11T06:40:00.000+02:00,5,11,6,2018,Violent
11332521,05/31/2018 11:40:00 AM,ASSAULT,AGGRAVATED:KNIFE/CUTTING INSTR,false,false,43,41.767339778,-87.572666808,2018-05-31T11:40:00.000+02:00,5,31,11,2018,Violent
11321903,05/21/2018 02:15:00 PM,THEFT,OVER $500,false,false,63,41.80462016,-87.684368169,2018-05-21T14:15:00.000+02:00,5,21,14,2018,Non-Violent
11391354,07/24/2018 05:00:00 PM,BURGLARY,FORCIBLE ENTRY,false,false,29,41.858742458,-87.733814847,2018-07-24T17:00:00.000+02:00,7,24,17,2018,Non-Violent
11393179,07/09/2018 11:20:00 AM,DECEPTIVE PRACTICE,COUNTERFEIT CHECK,false,false,25,41.89495505,-87.754026441,2018-07-09T11:20:00.000+02:00,7,9,11,2018,Non-Violent
11342083,06/07/2018 10:30:00 PM,BATTERY,DOMESTIC BATTERY SIMPLE,false,true,72,41.729420391,-87.674640667,2018-06-07T22:30:00.000+02:00,6,7,22,2018,Violent
11366946,06/30/2018 12:40:00 PM,BATTERY,SIMPLE,false,false,46,41.728317522,-87.545230358,2018-06-30T12:40:00.000+02:00,6,30,12,2018,Violent
11318474,05/17/2018 06:30:00 AM,BURGLARY,FORCIBLE ENTRY,false,false,71,41.753326207,-87.646539749,2018-05-17T06:30:00.000+02:00,5,17,6,2018,Non-Violent
11264575,03/23/2018 12:20:00 PM,BATTERY,SIMPLE,false,false,23,41.905481311,-87.736221102,2018-03-23T12:20:00.000+02:00,3,23,12,2018,Violent
11250025,03/08/2018 02:09:00 AM,CRIMINAL TRESPASS,TO VEHICLE,false,false,38,41.810627063,-87.613824655,2018-03-08T02:09:00.000+02:00,3,8,2,2018,Non-Violent
11226091,02/08/2018 11:00:00 AM,BATTERY,AGGRAVATED DOMESTIC BATTERY: OTHER DANG WEAPON,true,true,69,41.764169292,-87.594832667,2018-02-08T11:00:00.000+02:00,2,8,11,2018,Violent
11372769,07/07/2018 05:00:00 PM,CRIMINAL DAMAGE,TO VEHICLE,false,false,50,41.721918366,-87.585137009,2018-07-07T17:00:00.000+02:00,7,7,17,2018,Non-Violent
11379788,07/14/2018 06:00:00 AM,BATTERY,SIMPLE,false,false,30,41.842582305,-87.694759669,2018-07-14T06:00:00.000+02:00,7,14,6,2018,Violent
11250925,03/08/2018 11:05:00 PM,BATTERY,DOMESTIC BATTERY SIMPLE,false,true,1,42.017212988,-87.673765643,2018-03-08T23:05:00.000+02:00,3,8,23,2018,Violent
11247271,03/02/2018 06:30:00 AM,BATTERY,DOMESTIC BATTERY SIMPLE,false,true,69,41.758437308,-87.613561282,2018-03-02T06:30:00.000+02:00,3,2,6,2018,Violent
11347938,06/12/2018 01:00:00 PM,DECEPTIVE PRACTICE,CREDIT CARD FRAUD,false,false,32,41.879845704,-87.629356347,2018-06-12T13:00:00.000+02:00,6,12,13,2018,Non-Violent
11368528,07/03/2018 07:00:00 PM,THEFT,$500 AND UNDER,false,false,25,41.877498158,-87.760444798,2018-07-03T19:00:00.000+02:00,7,3,19,2018,Non-Violent
11234961,02/13/2018 12:00:00 PM,DECEPTIVE PRACTICE,ATTEMPT - FINANCIAL IDENTITY THEFT,false,false,15,41.952124816,-87.775481877,2018-02-13T12:00:00.000+02:00,2,13,12,2018,Non-Violent
11310043,05/09/2018 03:00:00 PM,THEFT,FROM BUILDING,false,false,8,41.893303118,-87.62617482,2018-05-09T15:00:00.000+02:00,5,9,15,2018,Non-Violent
11316013,05/14/2018 02:00:00 PM,THEFT,$500 AND UNDER,false,false,26,41.877935188,-87.72899045,2018-05-14T14:00:00.000+02:00,5,14,14,2018,Non-Violent
11380577,07/15/2018 03:08:00 AM,BATTERY,SIMPLE,true,false,6,41.942935676,-87.649360582,2018-07-15T03:08:00.000+02:00,7,15,3,2018,Violent
11273454,04/02/2018 09:05:00 AM,NARCOTICS,MANU/DEL:CANNABIS 10GM OR LESS,true,false,25,41.894948184,-87.754841897,2018-04-02T09:05:00.000+02:00,4,2,9,2018,Non-Violent
11267475,03/26/2018 03:23:00 PM,BATTERY,DOMESTIC BATTERY SIMPLE,false,true,25,41.878519316,-87.751226285,2018-03-26T15:23:00.000+02:00,3,26,15,2018,Violent
11277068,04/05/2018 08:25:00 PM,NARCOTICS,MANU/DELIVER:PCP,true,false,29,41.860881736,-87.708861467,2018-04-05T20:25:00.000+02:00,4,5,20,2018,Non-Violent
11276865,04/05/2018 03:10:00 PM,WEAPONS VIOLATION,UNLAWFUL POSS OF HANDGUN,true,false,49,41.719847137,-87.628215306,2018-04-05T15:10:00.000+02:00,4,5,15,2018,Non-Violent
11225801,02/08/2018 07:00:00 AM,ROBBERY,ARMED:KNIFE/CUTTING INSTRUMENT,false,false,28,41.878278759,-87.67901144,2018-02-08T07:00:00.000+02:00,2,8,7,2018,Violent
11312000,05/11/2018 10:00:00 AM,THEFT,$500 AND UNDER,false,false,30,41.834731175,-87.704749033,2018-05-11T10:00:00.000+02:00,5,11,10,2018,Non-Violent
11347116,06/13/2018 08:30:00 AM,THEFT,$500 AND UNDER,false,false,38,41.809717284,-87.628198973,2018-06-13T08:30:00.000+02:00,6,13,8,2018,Non-Violent
11266802,03/26/2018 03:20:00 AM,DECEPTIVE PRACTICE,THEFT OF LABOR/SERVICES,false,false,6,41.950615509,-87.649616689,2018-03-26T03:20:00.000+02:00,3,26,3,2018,Non-Violent
11300210,04/30/2018 12:37:00 PM,OTHER OFFENSE,HARASSMENT BY ELECTRONIC MEANS,false,true,73,41.719380746,-87.635883238,2018-04-30T12:37:00.000+02:00,4,30,12,2018,Non-Violent
11375747,07/10/2018 04:22:00 PM,THEFT,OVER $500,false,false,70,41.748060338,-87.741302702,2018-07-10T16:22:00.000+02:00,7,10,16,2018,Non-Violent
11377927,07/12/2018 02:50:00 PM,ASSAULT,SIMPLE,false,false,1,42.019399237,-87.675049485,2018-07-12T14:50:00.000+02:00,7,12,14,2018,Violent
11353211,06/14/2018 12:45:00 PM,DECEPTIVE PRACTICE,FRAUD OR CONFIDENCE GAME,false,false,21,41.938446096,-87.703555098,2018-06-14T12:45:00.000+02:00,6,14,12,2018,Non-Violent
11343682,06/10/2018 01:00:00 PM,CRIMINAL DAMAGE,TO PROPERTY,false,false,43,41.753585384,-87.563194315,2018-06-10T13:00:00.000+02:00,6,10,13,2018,Non-Violent
11239120,02/24/2018 04:50:00 AM,CRIMINAL DAMAGE,TO VEHICLE,false,false,49,41.714278436,-87.613969936,2018-02-24T04:50:00.000+02:00,2,24,4,2018,Non-Violent
11381259,07/15/2018 08:28:00 PM,BATTERY,SIMPLE,false,false,53,41.673554115,-87.616411124,2018-07-15T20:28:00.000+02:00,7,15,20,2018,Violent
11393851,03/18/2018 10:00:00 AM,OTHER OFFENSE,HARASSMENT BY TELEPHONE,false,false,7,41.913286805,-87.637435488,2018-03-18T10:00:00.000+02:00,3,18,10,2018,Non-Violent
11327717,05/27/2018 02:40:00 AM,BATTERY,SIMPLE,false,false,28,41.873044241,-87.684598065,2018-05-27T02:40:00.000+02:00,5,27,2,2018,Violent
11233492,02/17/2018 06:18:00 PM,OTHER OFFENSE,VIOLATE ORDER OF PROTECTION,true,true,2,41.983793231,-87.700394,2018-02-17T18:18:00.000+02:00,2,17,18,2018,Non-Violent
11231687,02/15/2018 04:00:00 PM,BATTERY,DOMESTIC BATTERY SIMPLE,false,true,27,41.874894997,-87.69706345,2018-02-15T16:00:00.000+02:00,2,15,16,2018,Violent
11236437,02/19/2018 09:00:00 AM,BURGLARY,UNLAWFUL ENTRY,false,false,27,41.871729291,-87.716899535,2018-02-19T09:00:00.000+02:00,2,19,9,2018,Non-Violent
11282546,04/11/2018 05:50:00 PM,CRIMINAL DAMAGE,TO VEHICLE,false,false,8,41.88946287,-87.624222942,2018-04-11T17:50:00.000+02:00,4,11,17,2018,Non-Violent
11302466,05/02/2018 11:25:00 AM,BATTERY,AGG PO HANDS NO/MIN INJURY,true,false,73,41.729756954,-87.65559428,2018-05-02T11:25:00.000+02:00,5,2,11,2018,Violent
11354688,06/20/2018 07:21:00 PM,NARCOTICS,POSSESSION OF DRUG EQUIPMENT,true,false,27,41.874473632,-87.710811069,2018-06-20T19:21:00.000+02:00,6,20,19,2018,Non-Violent
11370340,06/26/2018 10:45:00 AM,OTHER OFFENSE,LICENSE VIOLATION,false,false,29,41.854864309,-87.724846958,2018-06-26T10:45:00.000+02:00,6,26,10,2018,Non-Violent
11317051,04/13/2018 09:00:00 AM,BURGLARY,FORCIBLE ENTRY,false,false,66,41.778469673,-87.692158778,2018-04-13T09:00:00.000+02:00,4,13,9,2018,Non-Violent
11333706,06/01/2018 11:29:00 AM,ASSAULT,AGG PO HANDS NO/MIN INJURY,false,true,49,41.685428767,-87.612885572,2018-06-01T11:29:00.000+02:00,6,1,11,2018,Violent
11267905,03/26/2018 05:30:00 PM,BURGLARY,FORCIBLE ENTRY,false,false,46,41.740407428,-87.563630268,2018-03-26T17:30:00.000+02:00,3,26,17,2018,Non-Violent
11306854,05/06/2018 06:20:00 PM,BATTERY,AGGRAVATED:KNIFE/CUTTING INSTR,true,false,26,41.88068763,-87.728982876,2018-05-06T18:20:00.000+02:00,5,6,18,2018,Violent
11393162,07/26/2018 06:15:00 PM,NARCOTICS,POSS: CRACK,true,false,27,41.880932047,-87.709514547,2018-07-26T18:15:00.000+02:00,7,26,18,2018,Non-Violent
11343213,06/10/2018 09:48:00 AM,ASSAULT,AGGRAVATED: HANDGUN,false,true,17,41.95276806,-87.806503971,2018-06-10T09:48:00.000+02:00,6,10,9,2018,Violent
11273790,03/13/2018 09:00:00 AM,DECEPTIVE PRACTICE,FORGERY,false,false,35,41.839464759,-87.623233908,2018-03-13T09:00:00.000+02:00,3,13,9,2018,Non-Violent
11383109,07/04/2018 09:00:00 AM,DECEPTIVE PRACTICE,COMPUTER FRAUD,false,false,6,41.954507152,-87.653372774,2018-07-04T09:00:00.000+02:00,7,4,9,2018,Non-Violent
11349875,06/16/2018 05:54:00 PM,NARCOTICS,POSS: HEROIN(WHITE),true,false,23,41.894420385,-87.712622818,2018-06-16T17:54:00.000+02:00,6,16,17,2018,Non-Violent
11240569,02/25/2018 10:00:00 AM,DECEPTIVE PRACTICE,ILLEGAL USE CASH CARD,false,false,28,41.885182294,-87.642757034,2018-02-25T10:00:00.000+02:00,2,25,10,2018,Non-Violent
11275962,03/29/2018 05:00:00 PM,THEFT,$500 AND UNDER,false,false,75,41.68619909,-87.666869995,2018-03-29T17:00:00.000+02:00,3,29,17,2018,Non-Violent
11395779,07/28/2018 10:30:00 AM,CRIMINAL DAMAGE,TO VEHICLE,false,false,7,41.924601612,-87.644779409,2018-07-28T10:30:00.000+02:00,7,28,10,2018,Non-Violent
11387312,07/21/2018 05:30:00 AM,CRIMINAL DAMAGE,TO PROPERTY,false,false,25,41.886159979,-87.766724423,2018-07-21T05:30:00.000+02:00,7,21,5,2018,Non-Violent
11395742,07/28/2018 11:30:00 PM,BURGLARY,FORCIBLE ENTRY,false,false,16,41.950909166,-87.710384041,2018-07-28T23:30:00.000+02:00,7,28,23,2018,Non-Violent
11245021,03/02/2018 01:10:00 PM,THEFT,FROM BUILDING,false,false,43,41.756164455,-87.552538628,2018-03-02T13:10:00.000+02:00,3,2,13,2018,Non-Violent
11317624,05/17/2018 02:15:00 AM,ROBBERY,ARMED: HANDGUN,false,false,7,41.926757471,-87.64231251,2018-05-17T02:15:00.000+02:00,5,17,2,2018,Violent
11289094,04/09/2018 11:00:00 AM,OTHER OFFENSE,HARASSMENT BY ELECTRONIC MEANS,false,true,7,41.9305046,-87.648938479,2018-04-09T11:00:00.000+02:00,4,9,11,2018,Non-Violent
11261894,03/20/2018 05:53:00 PM,BATTERY,SIMPLE,true,false,46,41.72825629,-87.550726234,2018-03-20T17:53:00.000+02:00,3,20,17,2018,Violent
11224540,02/05/2018 02:45:00 PM,THEFT,OVER $500,false,false,43,41.756337333,-87.561471842,2018-02-05T14:45:00.000+02:00,2,5,14,2018,Non-Violent
11291008,04/20/2018 07:37:00 PM,NARCOTICS,POSS: HEROIN(WHITE),true,false,26,41.885042394,-87.725794609,2018-04-20T19:37:00.000+02:00,4,20,19,2018,Non-Violent
11372362,07/06/2018 07:00:00 PM,BURGLARY,ATTEMPT FORCIBLE ENTRY,false,false,49,41.719052849,-87.629813689,2018-07-06T19:00:00.000+02:00,7,6,19,2018,Non-Violent
11259084,03/16/2018 08:30:00 PM,CRIMINAL DAMAGE,TO PROPERTY,false,false,40,,,2018-03-16T20:30:00.000+02:00,3,16,20,2018,Non-Violent
11304264,05/03/2018 09:00:00 PM,THEFT,$500 AND UNDER,false,true,49,41.708124063,-87.624754387,2018-05-03T21:00:00.000+02:00,5,3,21,2018,Non-Violent
11280965,03/30/2018 01:20:00 PM,CRIMINAL DAMAGE,TO VEHICLE,false,false,58,41.821559897,-87.692062939,2018-03-30T13:20:00.000+02:00,3,30,13,2018,Non-Violent
11326456,05/25/2018 06:00:00 PM,THEFT,RETAIL THEFT,true,false,32,41.883500187,-87.627876698,2018-05-25T18:00:00.000+02:00,5,25,18,2018,Non-Violent
11277133,04/05/2018 11:15:00 PM,CRIMINAL DAMAGE,TO PROPERTY,true,true,68,41.759309777,-87.643041666,2018-04-05T23:15:00.000+02:00,4,5,23,2018,Non-Violent
11291067,04/20/2018 08:33:00 PM,BATTERY,DOMESTIC BATTERY SIMPLE,false,true,75,41.695058024,-87.681259958,2018-04-20T20:33:00.000+02:00,4,20,20,2018,Violent
11253847,03/12/2018 10:00:00 AM,THEFT,FROM BUILDING,false,false,65,41.754878573,-87.722171321,2018-03-12T10:00:00.000+02:00,3,12,10,2018,Non-Violent
11265697,03/24/2018 05:27:00 PM,THEFT,RETAIL THEFT,true,false,63,41.803671998,-87.703846021,2018-03-24T17:27:00.000+02:00,3,24,17,2018,Non-Violent
11286820,04/16/2018 06:00:00 AM,THEFT,PURSE-SNATCHING,false,false,35,41.833139425,-87.615319213,2018-04-16T06:00:00.000+02:00,4,16,6,2018,Non-Violent
11261114,03/19/2018 10:45:00 PM,MOTOR VEHICLE THEFT,AUTOMOBILE,false,false,6,41.951457303,-87.648582038,2018-03-19T22:45:00.000+02:00,3,19,22,2018,Non-Violent
11270960,03/29/2018 11:50:00 AM,ASSAULT,SIMPLE,false,false,43,41.756765393,-87.562690836,2018-03-29T11:50:00.000+02:00,3,29,11,2018,Violent
11301472,05/01/2018 10:55:00 AM,THEFT,RETAIL THEFT,false,false,7,41.92510186,-87.671992307,2018-05-01T10:55:00.000+02:00,5,1,10,2018,Non-Violent
11262170,03/21/2018 01:10:00 AM,BATTERY,AGGRAVATED DOMESTIC BATTERY: HANDS/FIST/FEET SERIOUS INJURY,false,true,52,41.711247981,-87.536487866,2018-03-21T01:10:00.000+02:00,3,21,1,2018,Violent
11324213,03/16/2018 12:00:00 PM,OTHER OFFENSE,VIOLATION OF CIVIL NO CONTACT ORDER,false,false,48,41.725333082,-87.560788034,2018-03-16T12:00:00.000+02:00,3,16,12,2018,Non-Violent
11223751,02/05/2018 07:29:00 PM,BATTERY,DOMESTIC BATTERY SIMPLE,false,true,67,41.785053856,-87.655459563,2018-02-05T19:29:00.000+02:00,2,5,19,2018,Violent
11319150,05/18/2018 09:44:00 AM,CRIMINAL DAMAGE,TO PROPERTY,false,false,35,41.831203853,-87.612552184,2018-05-18T09:44:00.000+02:00,5,18,9,2018,Non-Violent
11337529,06/05/2018 01:35:00 AM,ROBBERY,ARMED: HANDGUN,false,false,25,41.873852593,-87.76240869,2018-06-05T01:35:00.000+02:00,6,5,1,2018,Violent
11340654,06/06/2018 05:40:00 PM,DECEPTIVE PRACTICE,CREDIT CARD FRAUD,false,false,77,41.993521791,-87.668897047,2018-06-06T17:40:00.000+02:00,6,6,17,2018,Non-Violent
11340710,06/07/2018 07:10:00 PM,BATTERY,SIMPLE,false,false,8,41.894948428,-87.623750896,2018-06-07T19:10:00.000+02:00,6,7,19,2018,Violent
11362637,06/23/2018 04:30:00 PM,THEFT,OVER $500,false,false,24,41.910518966,-87.675324398,2018-06-23T16:30:00.000+02:00,6,23,16,2018,Non-Violent
11260368,03/19/2018 12:30:00 AM,CRIMINAL DAMAGE,TO VEHICLE,false,false,3,41.970796815,-87.672652445,2018-03-19T00:30:00.000+02:00,3,19,0,2018,Non-Violent
11331301,04/27/2018 10:30:00 PM,CRIMINAL DAMAGE,TO PROPERTY,false,false,53,41.67127677,-87.656310546,2018-04-27T22:30:00.000+02:00,4,27,22,2018,Non-Violent
11249073,03/07/2018 03:14:00 AM,OTHER OFFENSE,ANIMAL ABUSE/NEGLECT,false,false,23,41.899838339,-87.718899318,2018-03-07T03:14:00.000+02:00,3,7,3,2018,Non-Violent
11297033,04/26/2018 06:00:00 PM,THEFT,OVER $500,false,false,6,41.938741422,-87.640937164,2018-04-26T18:00:00.000+02:00,4,26,18,2018,Non-Violent
11235858,02/20/2018 12:00:00 PM,DECEPTIVE PRACTICE,FINANCIAL IDENTITY THEFT $300 AND UNDER,false,false,66,41.767358489,-87.681998261,2018-02-20T12:00:00.000+02:00,2,20,12,2018,Non-Violent
11387200,07/21/2018 03:00:00 AM,BATTERY,DOMESTIC BATTERY SIMPLE,true,true,67,41.786794006,-87.661110042,2018-07-21T03:00:00.000+02:00,7,21,3,2018,Violent
11249897,03/07/2018 09:38:00 PM,CRIMINAL DAMAGE,CRIMINAL DEFACEMENT,false,false,31,41.857947023,-87.656823051,2018-03-07T21:38:00.000+02:00,3,7,21,2018,Non-Violent
11345205,06/12/2018 09:39:00 AM,ASSAULT,AGGRAVATED: HANDGUN,true,false,55,41.651264337,-87.545925134,2018-06-12T09:39:00.000+02:00,6,12,9,2018,Violent
11236762,02/21/2018 01:00:00 AM,ASSAULT,SIMPLE,false,true,29,41.863468645,-87.721435656,2018-02-21T01:00:00.000+02:00,2,21,1,2018,Violent
11303538,05/03/2018 11:05:00 AM,ROBBERY,STRONGARM - NO WEAPON,false,false,14,41.968384066,-87.714909548,2018-05-03T11:05:00.000+02:00,5,3,11,2018,Violent
11295802,04/25/2018 08:00:00 PM,DECEPTIVE PRACTICE,FRAUD OR CONFIDENCE GAME,false,false,17,41.937979548,-87.81193669,2018-04-25T20:00:00.000+02:00,4,25,20,2018,Non-Violent
11360235,06/23/2018 06:14:00 PM,CRIMINAL DAMAGE,TO PROPERTY,false,false,61,41.808875992,-87.644681263,2018-06-23T18:14:00.000+02:00,6,23,18,2018,Non-Violent
11312005,05/11/2018 09:19:00 AM,OTHER OFFENSE,HARASSMENT BY TELEPHONE,false,true,25,41.887282776,-87.756879522,2018-05-11T09:19:00.000+02:00,5,11,9,2018,Non-Violent
11316825,05/10/2018 04:00:00 PM,THEFT,$500 AND UNDER,false,false,21,41.945238279,-87.712670479,2018-05-10T16:00:00.000+02:00,5,10,16,2018,Non-Violent
11275148,04/03/2018 03:30:00 PM,DECEPTIVE PRACTICE,FRAUD OR CONFIDENCE GAME,false,false,8,41.891694878,-87.626155832,2018-04-03T15:30:00.000+02:00,4,3,15,2018,Non-Violent
11307573,05/07/2018 03:00:00 PM,THEFT,POCKET-PICKING,false,false,77,41.979355509,-87.668294069,2018-05-07T15:00:00.000+02:00,5,7,15,2018,Non-Violent
11371392,07/06/2018 02:40:00 PM,BATTERY,SIMPLE,true,false,27,41.880933395,-87.709257484,2018-07-06T14:40:00.000+02:00,7,6,14,2018,Violent
11384381,07/17/2018 08:00:00 PM,OTHER OFFENSE,HARASSMENT BY ELECTRONIC MEANS,false,true,5,41.95857181,-87.689635921,2018-07-17T20:00:00.000+02:00,7,17,20,2018,Non-Violent
11318537,05/17/2018 07:30:00 PM,BATTERY,SIMPLE,false,false,29,41.867258874,-87.714343161,2018-05-17T19:30:00.000+02:00,5,17,19,2018,Violent
11227033,02/09/2018 06:30:00 PM,THEFT,$500 AND UNDER,true,false,8,41.88772996,-87.632505286,2018-02-09T18:30:00.000+02:00,2,9,18,2018,Non-Violent
11252121,03/10/2018 07:00:00 AM,BATTERY,DOMESTIC BATTERY SIMPLE,false,true,13,41.983648896,-87.716222029,2018-03-10T07:00:00.000+02:00,3,10,7,2018,Violent
11298586,04/28/2018 06:30:00 PM,THEFT,ATTEMPT THEFT,false,false,76,41.965720818,-87.836684841,2018-04-28T18:30:00.000+02:00,4,28,18,2018,Non-Violent
11239379,02/24/2018 12:35:00 PM,CRIMINAL TRESPASS,TO RESIDENCE,true,true,74,41.682318607,-87.708390837,2018-02-24T12:35:00.000+02:00,2,24,12,2018,Non-Violent
11389951,07/22/2018 10:00:00 PM,THEFT,$500 AND UNDER,false,false,29,41.862992331,-87.703381983,2018-07-22T22:00:00.000+02:00,7,22,22,2018,Non-Violent
11398316,07/31/2018 04:28:00 PM,ASSAULT,SIMPLE,false,false,32,41.874053979,-87.62868556,2018-07-31T16:28:00.000+02:00,7,31,16,2018,Violent
11316894,05/16/2018 10:45:00 AM,NARCOTICS,POSS: METHAMPHETAMINES,true,false,68,41.787623197,-87.648634237,2018-05-16T10:45:00.000+02:00,5,16,10,2018,Non-Violent
11336174,06/03/2018 03:00:00 PM,THEFT,FROM BUILDING,false,false,8,41.892017399,-87.624165306,2018-06-03T15:00:00.000+02:00,6,3,15,2018,Non-Violent
11369342,07/03/2018 06:30:00 PM,MOTOR VEHICLE THEFT,AUTOMOBILE,false,false,43,41.75540448,-87.551356727,2018-07-03T18:30:00.000+02:00,7,3,18,2018,Non-Violent
11311636,05/10/2018 11:02:00 PM,ASSAULT,SIMPLE,true,false,32,41.885739907,-87.631528141,2018-05-10T23:02:00.000+02:00,5,10,23,2018,Violent
11242121,02/27/2018 11:02:00 AM,INTERFERENCE WITH PUBLIC OFFICER,OBSTRUCTING IDENTIFICATION,true,false,25,41.879262318,-87.744095767,2018-02-27T11:02:00.000+02:00,2,27,11,2018,Non-Violent
11319039,02/01/2018 12:00:00 AM,DECEPTIVE PRACTICE,CREDIT CARD FRAUD,false,false,71,41.738884922,-87.663145149,2018-02-01T00:00:00.000+02:00,2,1,0,2018,Non-Violent
11269797,03/28/2018 11:29:00 PM,NARCOTICS,POSS: CRACK,true,false,29,41.865779186,-87.705649171,2018-03-28T23:29:00.000+02:00,3,28,23,2018,Non-Violent
11330638,05/29/2018 07:02:00 PM,OTHER OFFENSE,OTHER VEHICLE OFFENSE,false,false,44,41.747171922,-87.632647257,2018-05-29T19:02:00.000+02:00,5,29,19,2018,Non-Violent
11251006,03/08/2018 01:00:00 PM,BATTERY,SIMPLE,false,false,35,41.835686337,-87.620644613,2018-03-08T13:00:00.000+02:00,3,8,13,2018,Violent
11366539,07/01/2018 08:00:00 PM,BURGLARY,UNLAWFUL ENTRY,false,false,65,41.770524747,-87.718738237,2018-07-01T20:00:00.000+02:00,7,1,20,2018,Non-Violent
11253227,03/10/2018 03:00:00 PM,BATTERY,SIMPLE,false,false,68,41.771877151,-87.654300584,2018-03-10T15:00:00.000+02:00,3,10,15,2018,Violent
11263110,03/21/2018 07:59:00 PM,BATTERY,DOMESTIC BATTERY SIMPLE,true,true,58,41.824601958,-87.69527224,2018-03-21T19:59:00.000+02:00,3,21,19,2018,Violent
11234545,02/18/2018 04:00:00 PM,THEFT,$500 AND UNDER,false,false,8,41.890980345,-87.621547117,2018-02-18T16:00:00.000+02:00,2,18,16,2018,Non-Violent
11260767,03/19/2018 12:00:00 PM,OTHER OFFENSE,TELEPHONE THREAT,false,true,43,41.757223742,-87.562289526,2018-03-19T12:00:00.000+02:00,3,19,12,2018,Non-Violent
11327334,05/26/2018 12:22:00 PM,ASSAULT,SIMPLE,false,false,43,41.767199478,-87.575106114,2018-05-26T12:22:00.000+02:00,5,26,12,2018,Violent
11335222,06/02/2018 07:50:00 PM,BATTERY,DOMESTIC BATTERY SIMPLE,false,true,45,41.744188343,-87.586388217,2018-06-02T19:50:00.000+02:00,6,2,19,2018,Violent
11340096,06/07/2018 10:50:00 AM,THEFT,RETAIL THEFT,false,false,67,41.786735319,-87.665162422,2018-06-07T10:50:00.000+02:00,6,7,10,2018,Non-Violent
11308462,04/04/2018 03:00:00 PM,DECEPTIVE PRACTICE,"THEFT BY LESSEE,MOTOR VEH",false,false,69,41.777522654,-87.615558647,2018-04-04T15:00:00.000+02:00,4,4,15,2018,Non-Violent
11311750,05/10/2018 07:30:00 PM,MOTOR VEHICLE THEFT,AUTOMOBILE,false,false,42,41.774449537,-87.602145833,2018-05-10T19:30:00.000+02:00,5,10,19,2018,Non-Violent
11297392,04/27/2018 11:50:00 AM,CRIMINAL TRESPASS,TO LAND,true,false,26,41.873907046,-87.725430093,2018-04-27T11:50:00.000+02:00,4,27,11,2018,Non-Violent
11238220,02/22/2018 10:00:00 AM,OTHER OFFENSE,HARASSMENT BY TELEPHONE,false,false,56,41.79568962,-87.76727628,2018-02-22T10:00:00.000+02:00,2,22,10,2018,Non-Violent
11402870,08/01/2018 03:30:00 PM,BATTERY,AGGRAVATED:KNIFE/CUTTING INSTR,false,false,7,41.931463882,-87.653819694,2018-08-01T15:30:00.000+02:00,8,1,15,2018,Violent
11231267,02/15/2018 06:31:00 AM,CRIMINAL TRESPASS,TO LAND,true,false,1,42.002942073,-87.6607969,2018-02-15T06:31:00.000+02:00,2,15,6,2018,Non-Violent
11362809,06/24/2018 04:25:00 PM,ASSAULT,SIMPLE,false,false,32,41.874422837,-87.625299815,2018-06-24T16:25:00.000+02:00,6,24,16,2018,Violent
11332947,05/31/2018 06:15:00 PM,NARCOTICS,MANU/DEL:CANNABIS 10GM OR LESS,true,false,25,41.880881024,-87.752636986,2018-05-31T18:15:00.000+02:00,5,31,18,2018,Non-Violent
11316126,05/13/2018 08:00:00 PM,THEFT,$500 AND UNDER,false,false,12,41.969819603,-87.750642157,2018-05-13T20:00:00.000+02:00,5,13,20,2018,Non-Violent
11365178,06/30/2018 06:59:00 PM,NARCOTICS,POSS: CANNABIS 30GMS OR LESS,true,false,25,41.89617732,-87.748285487,2018-06-30T18:59:00.000+02:00,6,30,18,2018,Non-Violent
11285971,04/15/2018 02:15:00 PM,CRIMINAL DAMAGE,TO PROPERTY,false,false,8,41.90178302,-87.627995064,2018-04-15T14:15:00.000+02:00,4,15,14,2018,Non-Violent
11381160,07/15/2018 01:00:00 AM,THEFT,FROM BUILDING,false,false,8,41.90316534,-87.629210442,2018-07-15T01:00:00.000+02:00,7,15,1,2018,Non-Violent
11297017,04/26/2018 11:00:00 PM,BATTERY,DOMESTIC BATTERY SIMPLE,false,true,23,41.909797796,-87.733025085,2018-04-26T23:00:00.000+02:00,4,26,23,2018,Violent
11266002,03/24/2018 11:15:00 PM,BATTERY,AGG PO HANDS NO/MIN INJURY,true,false,27,41.885342444,-87.710092279,2018-03-24T23:15:00.000+02:00,3,24,23,2018,Violent
11319886,05/19/2018 10:52:00 AM,BATTERY,DOMESTIC BATTERY SIMPLE,true,true,71,41.746198078,-87.656051678,2018-05-19T10:52:00.000+02:00,5,19,10,2018,Violent
11356543,06/22/2018 11:27:00 PM,ASSAULT,SIMPLE,false,false,6,41.939935646,-87.652491107,2018-06-22T23:27:00.000+02:00,6,22,23,2018,Violent
11248754,03/06/2018 04:58:00 PM,DECEPTIVE PRACTICE,FRAUD OR CONFIDENCE GAME,false,false,70,41.749175751,-87.740475242,2018-03-06T16:58:00.000+02:00,3,6,16,2018,Non-Violent
11296626,04/21/2018 09:00:00 PM,MOTOR VEHICLE THEFT,AUTOMOBILE,false,false,73,41.719196291,-87.653646697,2018-04-21T21:00:00.000+02:00,4,21,21,2018,Non-Violent
11399374,07/30/2018 04:00:00 PM,ROBBERY,STRONGARM - NO WEAPON,false,false,1,42.01608781,-87.680474697,2018-07-30T16:00:00.000+02:00,7,30,16,2018,Violent
11239865,02/24/2018 11:35:00 PM,ASSAULT,SIMPLE,true,false,39,41.805322323,-87.603808532,2018-02-24T23:35:00.000+02:00,2,24,23,2018,Violent
11369583,07/04/2018 10:20:00 PM,NARCOTICS,POSS: HALLUCINOGENS,true,false,58,41.82464871,-87.692824605,2018-07-04T22:20:00.000+02:00,7,4,22,2018,Non-Violent
11387617,07/19/2018 03:30:00 PM,BURGLARY,FORCIBLE ENTRY,false,false,1,42.00059524,-87.666818402,2018-07-19T15:30:00.000+02:00,7,19,15,2018,Non-Violent
11336046,06/03/2018 04:30:00 PM,PUBLIC PEACE VIOLATION,RECKLESS CONDUCT,true,false,49,41.707160552,-87.623823775,2018-06-03T16:30:00.000+02:00,6,3,16,2018,Non-Violent
11254321,03/12/2018 12:30:00 PM,DECEPTIVE PRACTICE,BOGUS CHECK,false,false,10,41.975821967,-87.807053208,2018-03-12T12:30:00.000+02:00,3,12,12,2018,Non-Violent
11361568,06/27/2018 02:20:00 PM,DECEPTIVE PRACTICE,CREDIT CARD FRAUD,false,false,32,41.883210464,-87.634350417,2018-06-27T14:20:00.000+02:00,6,27,14,2018,Non-Violent
11303960,05/03/2018 06:00:00 PM,CRIMINAL DAMAGE,TO VEHICLE,false,false,51,41.713433323,-87.571412846,2018-05-03T18:00:00.000+02:00,5,3,18,2018,Non-Violent
11316806,05/15/2018 04:00:00 PM,BURGLARY,UNLAWFUL ENTRY,false,false,8,41.89484588,-87.630278831,2018-05-15T16:00:00.000+02:00,5,15,16,2018,Non-Violent
11304179,05/04/2018 12:13:00 AM,CRIMINAL TRESPASS,TO VEHICLE,true,false,46,41.737291965,-87.558629562,2018-05-04T00:13:00.000+02:00,5,4,0,2018,Non-Violent
11281562,04/10/2018 09:00:00 PM,CRIMINAL DAMAGE,TO PROPERTY,false,true,29,41.865545592,-87.723930666,2018-04-10T21:00:00.000+02:00,4,10,21,2018,Non-Violent
11357436,06/23/2018 05:30:00 PM,ASSAULT,SIMPLE,true,false,28,41.874363279,-87.643013039,2018-06-23T17:30:00.000+02:00,6,23,17,2018,Violent
11383619,07/17/2018 08:03:00 PM,ROBBERY,STRONGARM - NO WEAPON,true,false,19,41.938593616,-87.764963064,2018-07-17T20:03:00.000+02:00,7,17,20,2018,Violent
11295061,04/24/2018 05:56:00 PM,THEFT,OVER $500,false,true,42,41.773979206,-87.604570751,2018-04-24T17:56:00.000+02:00,4,24,17,2018,Non-Violent
11365334,06/28/2018 05:00:00 AM,OTHER OFFENSE,HARASSMENT BY ELECTRONIC MEANS,false,false,28,41.861559271,-87.65976218,2018-06-28T05:00:00.000+02:00,6,28,5,2018,Non-Violent
11344634,06/08/2018 11:59:00 PM,DECEPTIVE PRACTICE,FINANCIAL IDENTITY THEFT $300 AND UNDER,false,false,62,41.794465466,-87.734227204,2018-06-08T23:59:00.000+02:00,6,8,23,2018,Non-Violent
11341771,06/08/2018 07:30:00 AM,OTHER OFFENSE,TELEPHONE THREAT,false,false,49,41.724625087,-87.620668121,2018-06-08T07:30:00.000+02:00,6,8,7,2018,Non-Violent
11325038,04/30/2018 10:37:00 AM,NARCOTICS,MANU/DELIVER: HEROIN (WHITE),true,false,23,41.894262843,-87.711401266,2018-04-30T10:37:00.000+02:00,4,30,10,2018,Non-Violent
11347125,06/13/2018 01:00:00 PM,THEFT,OVER $500,false,false,25,41.906535632,-87.763326205,2018-06-13T13:00:00.000+02:00,6,13,13,2018,Non-Violent
11404879,08/01/2018 09:00:00 AM,THEFT,$500 AND UNDER,false,false,73,41.706902188,-87.644507138,2018-08-01T09:00:00.000+02:00,8,1,9,2018,Non-Violent
11233582,02/17/2018 09:20:00 PM,BATTERY,SIMPLE,false,false,16,41.939081232,-87.728277456,2018-02-17T21:20:00.000+02:00,2,17,21,2018,Violent
11277226,04/05/2018 10:45:00 PM,BATTERY,AGGRAVATED DOMESTIC BATTERY: KNIFE/CUTTING INST,false,true,29,41.862405884,-87.714639603,2018-04-05T22:45:00.000+02:00,4,5,22,2018,Violent
11231140,02/14/2018 02:20:00 PM,BATTERY,PRO EMP HANDS NO/MIN INJURY,false,false,53,41.664592914,-87.63905866,2018-02-14T14:20:00.000+02:00,2,14,14,2018,Violent
11309118,05/08/2018 06:25:00 PM,BATTERY,AGGRAVATED: HANDGUN,true,false,1,42.011949951,-87.682956633,2018-05-08T18:25:00.000+02:00,5,8,18,2018,Violent
11402048,08/03/2018 07:47:00 PM,THEFT,$500 AND UNDER,true,false,77,41.984439362,-87.660094215,2018-08-03T19:47:00.000+02:00,8,3,19,2018,Non-Violent
11266261,03/25/2018 02:54:00 AM,DECEPTIVE PRACTICE,CREDIT CARD FRAUD,false,false,5,41.955436401,-87.679652922,2018-03-25T02:54:00.000+02:00,3,25,2,2018,Non-Violent
11396777,07/29/2018 09:00:00 PM,CRIMINAL DAMAGE,TO VEHICLE,false,false,4,41.96766048,-87.690099677,2018-07-29T21:00:00.000+02:00,7,29,21,2018,Non-Violent
11364714,06/30/2018 08:30:00 AM,BATTERY,AGGRAVATED DOMESTIC BATTERY: OTHER DANG WEAPON,false,true,26,41.882560426,-87.728172025,2018-06-30T08:30:00.000+02:00,6,30,8,2018,Violent
11242167,02/27/2018 10:46:00 AM,WEAPONS VIOLATION,UNLAWFUL POSS OF HANDGUN,false,false,37,41.802767891,-87.632089547,2018-02-27T10:46:00.000+02:00,2,27,10,2018,Non-Violent
11350881,06/17/2018 03:00:00 PM,ASSAULT,AGGRAVATED PO: OTHER DANG WEAP,true,false,29,41.860911204,-87.695744714,2018-06-17T15:00:00.000+02:00,6,17,15,2018,Violent
11355024,06/20/2018 10:30:00 PM,BATTERY,SIMPLE,false,false,49,41.686204282,-87.634931017,2018-06-20T22:30:00.000+02:00,6,20,22,2018,Violent
11278683,01/11/2018 12:00:00 PM,DECEPTIVE PRACTICE,FINANCIAL IDENTITY THEFT OVER $ 300,false,false,41,41.798153832,-87.583286379,2018-01-11T12:00:00.000+02:00,1,11,12,2018,Non-Violent
11231778,02/15/2018 04:50:00 PM,WEAPONS VIOLATION,UNLAWFUL POSS OTHER FIREARM,true,false,8,41.895766655,-87.622048593,2018-02-15T16:50:00.000+02:00,2,15,16,2018,Non-Violent
11398816,07/31/2018 11:00:00 PM,ROBBERY,ARMED: HANDGUN,false,false,28,41.887084037,-87.651018015,2018-07-31T23:00:00.000+02:00,7,31,23,2018,Violent
11289853,04/19/2018 03:57:00 PM,THEFT,$500 AND UNDER,true,false,46,41.729170867,-87.551235346,2018-04-19T15:57:00.000+02:00,4,19,15,2018,Non-Violent
11310289,04/15/2018 06:20:00 PM,THEFT,FROM BUILDING,false,false,7,,,2018-04-15T18:20:00.000+02:00,4,15,18,2018,Non-Violent
11240399,02/25/2018 04:55:00 PM,BATTERY,DOMESTIC BATTERY SIMPLE,true,true,3,41.968344623,-87.644823343,2018-02-25T16:55:00.000+02:00,2,25,16,2018,Violent
11310008,05/09/2018 12:50:00 PM,ASSAULT,SIMPLE,false,false,53,41.664592914,-87.63905866,2018-05-09T12:50:00.000+02:00,5,9,12,2018,Violent
11328568,05/26/2018 07:00:00 PM,ASSAULT,SIMPLE,false,false,8,41.893594981,-87.628118216,2018-05-26T19:00:00.000+02:00,5,26,19,2018,Violent
11300173,04/25/2018 03:55:00 PM,THEFT,OVER $500,false,false,1,42.013105233,-87.67238403,2018-04-25T15:55:00.000+02:00,4,25,15,2018,Non-Violent
11365182,06/27/2018 08:00:00 PM,BURGLARY,UNLAWFUL ENTRY,false,false,56,41.806787822,-87.749246195,2018-06-27T20:00:00.000+02:00,6,27,20,2018,Non-Violent
11285937,04/14/2018 05:00:00 PM,BATTERY,SIMPLE,false,false,44,41.750782715,-87.625813624,2018-04-14T17:00:00.000+02:00,4,14,17,2018,Violent
11247957,03/05/2018 11:25:00 AM,OFFENSE INVOLVING CHILDREN,CHILD ABUSE,true,false,50,41.707519433,-87.601839023,2018-03-05T11:25:00.000+02:00,3,5,11,2018,Non-Violent
11273075,03/30/2018 10:30:00 PM,THEFT,OVER $500,false,false,67,41.763901639,-87.673511035,2018-03-30T22:30:00.000+02:00,3,30,22,2018,Non-Violent
11299151,04/28/2018 01:00:00 AM,THEFT,POCKET-PICKING,false,false,22,41.927273891,-87.704469775,2018-04-28T01:00:00.000+02:00,4,28,1,2018,Non-Violent
11336074,06/03/2018 05:00:00 PM,THEFT,$500 AND UNDER,false,false,28,41.868219921,-87.664046556,2018-06-03T17:00:00.000+02:00,6,3,17,2018,Non-Violent
11341764,06/08/2018 08:00:00 PM,MOTOR VEHICLE THEFT,AUTOMOBILE,false,false,41,41.802094324,-87.58914897,2018-06-08T20:00:00.000+02:00,6,8,20,2018,Non-Violent
11342136,06/08/2018 09:00:00 PM,CRIMINAL DAMAGE,TO VEHICLE,false,false,19,41.927266789,-87.74293029,2018-06-08T21:00:00.000+02:00,6,8,21,2018,Non-Violent
11371396,07/06/2018 03:00:00 PM,THEFT,$500 AND UNDER,false,false,8,41.896888586,-87.628203192,2018-07-06T15:00:00.000+02:00,7,6,15,2018,Non-Violent
11362828,05/28/2018 12:57:00 PM,DECEPTIVE PRACTICE,COMPUTER FRAUD,false,false,7,41.918633393,-87.648528893,2018-05-28T12:57:00.000+02:00,5,28,12,2018,Non-Violent
11319969,05/19/2018 12:05:00 PM,THEFT,RETAIL THEFT,true,false,20,41.924359985,-87.736960088,2018-05-19T12:05:00.000+02:00,5,19,12,2018,Non-Violent
11331642,05/29/2018 02:30:00 PM,CRIMINAL DAMAGE,TO VEHICLE,false,false,75,41.693652844,-87.643637956,2018-05-29T14:30:00.000+02:00,5,29,14,2018,Non-Violent
11240543,02/24/2018 11:34:00 PM,ROBBERY,STRONGARM - NO WEAPON,false,false,14,41.968329005,-87.719991913,2018-02-24T23:34:00.000+02:00,2,24,23,2018,Violent
11347309,06/14/2018 07:15:00 AM,ASSAULT,AGGRAVATED:KNIFE/CUTTING INSTR,false,true,1,42.021162087,-87.671421028,2018-06-14T07:15:00.000+02:00,6,14,7,2018,Violent
11323174,05/22/2018 08:00:00 AM,THEFT,OVER $500,false,false,53,41.682828519,-87.644899406,2018-05-22T08:00:00.000+02:00,5,22,8,2018,Non-Violent
11261257,03/16/2018 12:00:00 PM,ASSAULT,SIMPLE,false,true,19,41.925912977,-87.758982939,2018-03-16T12:00:00.000+02:00,3,16,12,2018,Violent
11272442,03/31/2018 07:30:00 PM,BATTERY,AGGRAVATED DOMESTIC BATTERY: HANDS/FIST/FEET SERIOUS INJURY,false,true,53,41.677910904,-87.633128177,2018-03-31T19:30:00.000+02:00,3,31,19,2018,Violent
11282746,04/11/2018 09:45:00 PM,ROBBERY,ARMED: HANDGUN,false,false,15,41.963352217,-87.761150766,2018-04-11T21:45:00.000+02:00,4,11,21,2018,Violent
11376938,07/11/2018 01:00:00 PM,BATTERY,AGGRAVATED DOMESTIC BATTERY: OTHER DANG WEAPON,false,true,68,41.760660071,-87.646721787,2018-07-11T13:00:00.000+02:00,7,11,13,2018,Violent
11247383,03/05/2018 06:00:00 AM,BATTERY,DOMESTIC BATTERY SIMPLE,false,true,60,41.833375569,-87.648598169,2018-03-05T06:00:00.000+02:00,3,5,6,2018,Violent
11338442,06/05/2018 07:23:00 PM,THEFT,$500 AND UNDER,false,false,32,41.886202772,-87.620685715,2018-06-05T19:23:00.000+02:00,6,5,19,2018,Non-Violent
11254049,03/12/2018 03:18:00 PM,ASSAULT,SIMPLE,false,true,33,41.854963672,-87.627133239,2018-03-12T15:18:00.000+02:00,3,12,15,2018,Violent
11284445,04/13/2018 01:30:00 PM,ROBBERY,AGGRAVATED,true,false,47,41.72575083,-87.601548,2018-04-13T13:30:00.000+02:00,4,13,13,2018,Violent
11311862,05/11/2018 08:15:00 AM,ASSAULT,AGGRAVATED: OTHER DANG WEAPON,false,false,34,41.82417802,-87.6337748,2018-05-11T08:15:00.000+02:00,5,11,8,2018,Violent
11288682,04/18/2018 11:00:00 AM,DECEPTIVE PRACTICE,CREDIT CARD FRAUD,false,false,6,41.948533921,-87.647988403,2018-04-18T11:00:00.000+02:00,4,18,11,2018,Non-Violent
11328204,05/25/2018 07:00:00 PM,CRIMINAL DAMAGE,TO VEHICLE,false,false,43,41.753068233,-87.563830848,2018-05-25T19:00:00.000+02:00,5,25,19,2018,Non-Violent
11281912,04/10/2018 12:51:00 PM,BATTERY,DOMESTIC BATTERY SIMPLE,false,true,53,41.666063219,-87.640312849,2018-04-10T12:51:00.000+02:00,4,10,12,2018,Violent
11308001,05/07/2018 01:00:00 PM,ASSAULT,SIMPLE,false,false,44,41.74899896,-87.605175838,2018-05-07T13:00:00.000+02:00,5,7,13,2018,Violent
11319091,05/18/2018 01:30:00 PM,BATTERY,SIMPLE,false,false,77,41.988719229,-87.668384208,2018-05-18T13:30:00.000+02:00,5,18,13,2018,Violent
11387874,06/04/2018 12:01:00 PM,THEFT,OVER $500,true,false,62,41.799611371,-87.723345492,2018-06-04T12:01:00.000+02:00,6,4,12,2018,Non-Violent
11244897,03/02/2018 10:10:00 AM,BATTERY,AGGRAVATED:KNIFE/CUTTING INSTR,false,false,58,41.82039114,-87.694580308,2018-03-02T10:10:00.000+02:00,3,2,10,2018,Violent
11302858,05/02/2018 05:07:00 PM,THEFT,RETAIL THEFT,true,false,32,41.882394062,-87.627844798,2018-05-02T17:07:00.000+02:00,5,2,17,2018,Non-Violent
11302360,05/02/2018 09:00:00 AM,DECEPTIVE PRACTICE,FINANCIAL IDENTITY THEFT $300 AND UNDER,false,false,6,41.947405773,-87.643817256,2018-05-02T09:00:00.000+02:00,5,2,9,2018,Non-Violent
11232107,02/15/2018 08:51:00 PM,BATTERY,SIMPLE,false,false,43,41.765187118,-87.582086968,2018-02-15T20:51:00.000+02:00,2,15,20,2018,Violent
11360259,06/25/2018 10:00:00 PM,CRIMINAL DAMAGE,TO VEHICLE,false,false,6,41.938715225,-87.64251054,2018-06-25T22:00:00.000+02:00,6,25,22,2018,Non-Violent
11235347,02/08/2018 08:00:00 AM,DECEPTIVE PRACTICE,FRAUD OR CONFIDENCE GAME,false,false,17,41.949527464,-87.809574452,2018-02-08T08:00:00.000+02:00,2,8,8,2018,Non-Violent
11403973,08/05/2018 04:55:00 PM,THEFT,OVER $500,false,false,8,41.892017399,-87.624165306,2018-08-05T16:55:00.000+02:00,8,5,16,2018,Non-Violent
11249383,03/07/2018 11:02:00 AM,OTHER OFFENSE,HARASSMENT BY ELECTRONIC MEANS,false,false,8,41.907153315,-87.639680572,2018-03-07T11:02:00.000+02:00,3,7,11,2018,Non-Violent
11379253,07/10/2018 11:45:00 PM,THEFT,$500 AND UNDER,false,false,54,41.654609229,-87.607557296,2018-07-10T23:45:00.000+02:00,7,10,23,2018,Non-Violent
11360397,06/24/2018 03:00:00 AM,BATTERY,DOMESTIC BATTERY SIMPLE,true,true,67,41.779053457,-87.661766501,2018-06-24T03:00:00.000+02:00,6,24,3,2018,Violent
11259506,03/17/2018 06:00:00 PM,THEFT,$500 AND UNDER,false,false,26,41.877044066,-87.729134707,2018-03-17T18:00:00.000+02:00,3,17,18,2018,Non-Violent
11314801,05/11/2018 12:00:00 PM,DECEPTIVE PRACTICE,FRAUD OR CONFIDENCE GAME,false,false,21,41.931980314,-87.711538479,2018-05-11T12:00:00.000+02:00,5,11,12,2018,Non-Violent
11401679,08/03/2018 03:00:00 PM,CRIMINAL DAMAGE,TO PROPERTY,false,false,46,41.748825153,-87.562543948,2018-08-03T15:00:00.000+02:00,8,3,15,2018,Non-Violent
11275027,04/03/2018 04:36:00 PM,BATTERY,DOMESTIC BATTERY SIMPLE,false,true,42,41.772581369,-87.611804821,2018-04-03T16:36:00.000+02:00,4,3,16,2018,Violent
11291676,04/21/2018 02:45:00 PM,THEFT,$500 AND UNDER,false,false,71,41.753530996,-87.660277146,2018-04-21T14:45:00.000+02:00,4,21,14,2018,Non-Violent
11245201,03/02/2018 03:42:00 PM,CRIMINAL DAMAGE,TO VEHICLE,false,true,23,41.891092358,-87.705188393,2018-03-02T15:42:00.000+02:00,3,2,15,2018,Non-Violent
11298420,04/28/2018 01:56:00 PM,WEAPONS VIOLATION,UNLAWFUL POSS OF HANDGUN,true,false,25,41.879492192,-87.746113289,2018-04-28T13:56:00.000+02:00,4,28,13,2018,Non-Violent
11389462,07/19/2018 12:00:00 AM,DECEPTIVE PRACTICE,COUNTERFEIT CHECK,false,false,71,41.75139611,-87.654245291,2018-07-19T00:00:00.000+02:00,7,19,0,2018,Non-Violent
11260061,03/18/2018 08:39:00 PM,OTHER OFFENSE,GUN OFFENDER: ANNUAL REGISTRATION,true,false,43,41.764728804,-87.586292974,2018-03-18T20:39:00.000+02:00,3,18,20,2018,Non-Violent
11335948,06/03/2018 12:50:00 PM,ASSAULT,SIMPLE,false,false,71,41.753460038,-87.653816736,2018-06-03T12:50:00.000+02:00,6,3,12,2018,Violent
11338030,06/05/2018 12:40:00 PM,OTHER OFFENSE,HARASSMENT BY TELEPHONE,false,false,3,41.96517823,-87.673398093,2018-06-05T12:40:00.000+02:00,6,5,12,2018,Non-Violent
11319534,05/18/2018 08:30:00 PM,CRIMINAL TRESPASS,TO LAND,true,false,15,41.95337247,-87.751512543,2018-05-18T20:30:00.000+02:00,5,18,20,2018,Non-Violent
11304671,05/01/2018 10:30:00 AM,NARCOTICS,FOUND SUSPECT NARCOTICS,true,false,29,41.868180939,-87.709271389,2018-05-01T10:30:00.000+02:00,5,1,10,2018,Non-Violent
11239670,02/24/2018 06:35:00 PM,CRIMINAL DAMAGE,TO PROPERTY,false,true,61,41.800821127,-87.653830052,2018-02-24T18:35:00.000+02:00,2,24,18,2018,Non-Violent
11277523,04/06/2018 03:00:00 AM,OTHER OFFENSE,HARASSMENT BY TELEPHONE,false,true,71,41.755633717,-87.644173224,2018-04-06T03:00:00.000+02:00,4,6,3,2018,Non-Violent
11378049,07/11/2018 10:00:00 PM,THEFT,OVER $500,false,false,77,41.994967619,-87.664110751,2018-07-11T22:00:00.000+02:00,7,11,22,2018,Non-Violent
11365339,06/30/2018 10:00:00 PM,BATTERY,SIMPLE,false,false,3,41.973297864,-87.655886894,2018-06-30T22:00:00.000+02:00,6,30,22,2018,Violent
11310089,05/09/2018 03:24:00 PM,CRIMINAL TRESPASS,TO LAND,true,false,35,41.831101673,-87.617716013,2018-05-09T15:24:00.000+02:00,5,9,15,2018,Non-Violent
11390592,07/24/2018 11:45:00 AM,CRIMINAL DAMAGE,TO PROPERTY,false,false,29,41.862526771,-87.704058362,2018-07-24T11:45:00.000+02:00,7,24,11,2018,Non-Violent
11343389,06/10/2018 03:16:00 PM,WEAPONS VIOLATION,UNLAWFUL POSS OF HANDGUN,true,false,63,41.792969681,-87.708442966,2018-06-10T15:16:00.000+02:00,6,10,15,2018,Non-Violent
11341862,06/08/2018 09:17:00 PM,BATTERY,AGGRAVATED: OTHER DANG WEAPON,false,false,2,42.006563517,-87.685940267,2018-06-08T21:17:00.000+02:00,6,8,21,2018,Violent
11334438,06/01/2018 09:21:00 PM,BATTERY,DOMESTIC BATTERY SIMPLE,true,true,69,41.752114055,-87.605224922,2018-06-01T21:21:00.000+02:00,6,1,21,2018,Violent
11321648,05/21/2018 07:00:00 AM,OTHER OFFENSE,TELEPHONE THREAT,false,true,66,41.778013152,-87.701893587,2018-05-21T07:00:00.000+02:00,5,21,7,2018,Non-Violent
11237807,02/22/2018 06:38:00 PM,CRIMINAL TRESPASS,TO RESIDENCE,false,false,61,41.805750197,-87.674618643,2018-02-22T18:38:00.000+02:00,2,22,18,2018,Non-Violent
11242692,02/27/2018 09:34:00 PM,BATTERY,SIMPLE,false,false,6,41.932755165,-87.647150367,2018-02-27T21:34:00.000+02:00,2,27,21,2018,Violent
11369841,07/05/2018 02:53:00 AM,ASSAULT,SIMPLE,true,false,42,41.774322836,-87.596061639,2018-07-05T02:53:00.000+02:00,7,5,2,2018,Violent
11307433,05/07/2018 12:35:00 PM,THEFT,$500 AND UNDER,false,false,8,41.909522907,-87.642175128,2018-05-07T12:35:00.000+02:00,5,7,12,2018,Non-Violent
11302444,05/02/2018 11:45:00 AM,NARCOTICS,FOUND SUSPECT NARCOTICS,true,false,25,41.881734378,-87.751531274,2018-05-02T11:45:00.000+02:00,5,2,11,2018,Non-Violent
11405746,08/04/2018 06:30:00 PM,THEFT,$500 AND UNDER,false,false,6,41.935305565,-87.657035191,2018-08-04T18:30:00.000+02:00,8,4,18,2018,Non-Violent
11310847,03/13/2018 11:01:00 AM,NARCOTICS,FORFEIT PROPERTY,true,false,28,41.878931004,-87.639585621,2018-03-13T11:01:00.000+02:00,3,13,11,2018,Non-Violent
11304777,04/25/2018 06:30:00 PM,PUBLIC PEACE VIOLATION,ARSON THREAT,false,false,23,41.906602961,-87.735024073,2018-04-25T18:30:00.000+02:00,4,25,18,2018,Non-Violent
11364430,06/30/2018 04:30:00 AM,ROBBERY,STRONGARM - NO WEAPON,false,false,46,41.751719438,-87.566914357,2018-06-30T04:30:00.000+02:00,6,30,4,2018,Violent
11340694,06/07/2018 06:43:00 PM,NARCOTICS,POSS: CANNABIS 30GMS OR LESS,true,false,40,41.789203723,-87.624621256,2018-06-07T18:43:00.000+02:00,6,7,18,2018,Non-Violent
11367429,07/01/2018 06:00:00 AM,ASSAULT,SIMPLE,false,false,53,41.678634792,-87.620527832,2018-07-01T06:00:00.000+02:00,7,1,6,2018,Violent
11328072,05/27/2018 01:00:00 PM,BATTERY,DOMESTIC BATTERY SIMPLE,false,true,25,41.878476241,-87.774598987,2018-05-27T13:00:00.000+02:00,5,27,13,2018,Violent
11311904,05/11/2018 08:39:00 AM,BATTERY,DOMESTIC BATTERY SIMPLE,false,true,44,41.746926625,-87.605114972,2018-05-11T08:39:00.000+02:00,5,11,8,2018,Violent
11391359,07/24/2018 10:00:00 PM,CRIMINAL DAMAGE,TO PROPERTY,false,false,61,41.808645771,-87.661883006,2018-07-24T22:00:00.000+02:00,7,24,22,2018,Non-Violent
11296961,04/26/2018 10:13:00 PM,NARCOTICS,POSS: HEROIN(WHITE),true,false,70,41.74471918,-87.726840811,2018-04-26T22:13:00.000+02:00,4,26,22,2018,Non-Violent
11225653,02/08/2018 01:10:00 AM,BATTERY,DOMESTIC BATTERY SIMPLE,true,true,67,41.766086243,-87.662634866,2018-02-08T01:10:00.000+02:00,2,8,1,2018,Violent
11230600,02/04/2018 04:00:00 PM,THEFT,OVER $500,false,false,71,41.742700562,-87.647510427,2018-02-04T16:00:00.000+02:00,2,4,16,2018,Non-Violent
11311267,05/10/2018 12:00:00 PM,THEFT,OVER $500,false,false,32,41.879361356,-87.635879544,2018-05-10T12:00:00.000+02:00,5,10,12,2018,Non-Violent
11289303,04/19/2018 06:30:00 AM,BURGLARY,FORCIBLE ENTRY,false,false,16,41.95983397,-87.725345729,2018-04-19T06:30:00.000+02:00,4,19,6,2018,Non-Violent
11291641,04/21/2018 01:55:00 PM,ASSAULT,AGGRAVATED - HANDGUN,false,false,22,41.923090338,-87.726661097,2018-04-21T13:55:00.000+02:00,4,21,13,2018,Violent
11378457,07/13/2018 03:22:00 AM,CRIMINAL TRESPASS,TO VEHICLE,false,true,75,41.680799541,-87.669942159,2018-07-13T03:22:00.000+02:00,7,13,3,2018,Non-Violent
11349636,06/15/2018 07:00:00 AM,OTHER OFFENSE,OTHER VEHICLE OFFENSE,false,false,23,41.894134421,-87.724823283,2018-06-15T07:00:00.000+02:00,6,15,7,2018,Non-Violent
11284101,04/13/2018 11:05:00 AM,BATTERY,DOMESTIC BATTERY SIMPLE,false,true,44,41.735050032,-87.615266006,2018-04-13T11:05:00.000+02:00,4,13,11,2018,Violent
11392308,07/25/2018 06:52:00 PM,BATTERY,SIMPLE,true,false,43,41.756713129,-87.563900924,2018-07-25T18:52:00.000+02:00,7,25,18,2018,Violent
11260841,03/19/2018 12:00:00 PM,THEFT,OVER $500,false,false,28,41.883099003,-87.65002851,2018-03-19T12:00:00.000+02:00,3,19,12,2018,Non-Violent
11362060,06/27/2018 08:29:00 PM,BATTERY,DOMESTIC BATTERY SIMPLE,true,true,67,41.764682386,-87.663785792,2018-06-27T20:29:00.000+02:00,6,27,20,2018,Violent
11359818,06/25/2018 10:45:00 PM,ROBBERY,STRONGARM - NO WEAPON,false,false,41,41.79771109,-87.589052989,2018-06-25T22:45:00.000+02:00,6,25,22,2018,Violent
11384434,07/18/2018 04:42:00 PM,THEFT,RETAIL THEFT,false,false,19,41.926287021,-87.785547998,2018-07-18T16:42:00.000+02:00,7,18,16,2018,Non-Violent
11367677,07/02/2018 09:00:00 PM,THEFT,$500 AND UNDER,false,false,14,41.965641039,-87.730611143,2018-07-02T21:00:00.000+02:00,7,2,21,2018,Non-Violent
11248788,03/06/2018 05:30:00 PM,THEFT,$500 AND UNDER,false,false,15,41.95347181,-87.743552438,2018-03-06T17:30:00.000+02:00,3,6,17,2018,Non-Violent
11239830,02/19/2018 06:30:00 PM,OTHER OFFENSE,HARASSMENT BY TELEPHONE,false,false,28,41.885393253,-87.663547848,2018-02-19T18:30:00.000+02:00,2,19,18,2018,Non-Violent
11288640,04/18/2018 07:02:00 AM,NARCOTICS,POSS: CANNABIS 30GMS OR LESS,true,false,4,41.968567269,-87.694245756,2018-04-18T07:02:00.000+02:00,4,18,7,2018,Non-Violent
11265948,03/24/2018 08:00:00 AM,BATTERY,SIMPLE,false,false,32,41.886917318,-87.621739119,2018-03-24T08:00:00.000+02:00,3,24,8,2018,Violent
11373255,07/08/2018 02:30:00 AM,ROBBERY,ARMED: HANDGUN,false,false,25,41.873814246,-87.745023355,2018-07-08T02:30:00.000+02:00,7,8,2,2018,Violent
11357672,06/24/2018 02:25:00 AM,BATTERY,SIMPLE,false,false,26,41.869825013,-87.724143356,2018-06-24T02:25:00.000+02:00,6,24,2,2018,Violent
11277147,04/05/2018 11:30:00 PM,BATTERY,SIMPLE,true,false,32,41.880251406,-87.626157171,2018-04-05T23:30:00.000+02:00,4,5,23,2018,Violent
11348739,06/15/2018 03:00:00 PM,DECEPTIVE PRACTICE,THEFT OF LABOR/SERVICES,false,false,53,41.673422231,-87.644201698,2018-06-15T15:00:00.000+02:00,6,15,15,2018,Non-Violent
11361492,06/23/2018 11:00:00 PM,CRIMINAL DAMAGE,TO VEHICLE,false,false,37,41.795911297,-87.63186358,2018-06-23T23:00:00.000+02:00,6,23,23,2018,Non-Violent
11273313,04/01/2018 02:30:00 PM,THEFT,$500 AND UNDER,false,false,32,41.886018055,-87.633937881,2018-04-01T14:30:00.000+02:00,4,1,14,2018,Non-Violent
11280597,04/09/2018 09:20:00 PM,BATTERY,AGGRAVATED - OTHER DANGEROUS WEAPON,false,false,35,41.842695834,-87.61721984,2018-04-09T21:20:00.000+02:00,4,9,21,2018,Violent
11357564,06/23/2018 09:00:00 PM,MOTOR VEHICLE THEFT,AUTOMOBILE,false,false,75,41.693770837,-87.657026692,2018-06-23T21:00:00.000+02:00,6,23,21,2018,Non-Violent
11354822,05/12/2018 07:40:00 PM,DECEPTIVE PRACTICE,"THEFT BY LESSEE,MOTOR VEH",false,false,76,41.980826277,-87.883611316,2018-05-12T19:40:00.000+02:00,5,12,19,2018,Non-Violent
11314650,05/14/2018 01:30:00 AM,BURGLARY,HOME INVASION,false,false,69,41.759144852,-87.635727727,2018-05-14T01:30:00.000+02:00,5,14,1,2018,Non-Violent
11243399,02/28/2018 04:30:00 PM,THEFT,FROM BUILDING,false,false,32,41.878262498,-87.625374936,2018-02-28T16:30:00.000+02:00,2,28,16,2018,Non-Violent
11352588,05/15/2018 09:45:00 AM,BURGLARY,FORCIBLE ENTRY,false,false,68,41.782937259,-87.646095517,2018-05-15T09:45:00.000+02:00,5,15,9,2018,Non-Violent
11230231,02/13/2018 10:20:00 PM,OTHER OFFENSE,HARASSMENT BY ELECTRONIC MEANS,false,false,8,41.900424796,-87.642467932,2018-02-13T22:20:00.000+02:00,2,13,22,2018,Non-Violent
11273325,04/02/2018 01:45:00 AM,BATTERY,DOMESTIC BATTERY SIMPLE,true,true,73,41.718019577,-87.657937301,2018-04-02T01:45:00.000+02:00,4,2,1,2018,Violent
11306479,05/03/2018 12:00:00 PM,DECEPTIVE PRACTICE,"THEFT BY LESSEE,MOTOR VEH",false,false,43,41.7661636,-87.584113638,2018-05-03T12:00:00.000+02:00,5,3,12,2018,Non-Violent
11274882,04/03/2018 03:55:00 PM,ASSAULT,SIMPLE,false,false,68,41.768860797,-87.643184887,2018-04-03T15:55:00.000+02:00,4,3,15,2018,Violent
11320829,05/20/2018 05:00:00 AM,CRIMINAL DAMAGE,TO PROPERTY,false,true,53,41.673547959,-87.616744282,2018-05-20T05:00:00.000+02:00,5,20,5,2018,Non-Violent
11305677,05/05/2018 02:04:00 PM,THEFT,$500 AND UNDER,false,false,8,41.904370109,-87.631460067,2018-05-05T14:04:00.000+02:00,5,5,14,2018,Non-Violent
11235368,02/19/2018 07:50:00 PM,THEFT,RETAIL THEFT,false,false,8,41.903892302,-87.631858359,2018-02-19T19:50:00.000+02:00,2,19,19,2018,Non-Violent
11266534,03/25/2018 03:00:00 PM,CRIMINAL DAMAGE,TO PROPERTY,false,false,70,41.750717774,-87.707310077,2018-03-25T15:00:00.000+02:00,3,25,15,2018,Non-Violent
11327550,05/26/2018 10:50:00 PM,CRIMINAL DAMAGE,TO PROPERTY,false,false,53,41.68047754,-87.656605811,2018-05-26T22:50:00.000+02:00,5,26,22,2018,Non-Violent
11345403,06/12/2018 12:30:00 AM,CRIMINAL DAMAGE,TO VEHICLE,false,false,49,41.688277582,-87.633795602,2018-06-12T00:30:00.000+02:00,6,12,0,2018,Non-Violent
11349586,06/05/2018 02:30:00 PM,DECEPTIVE PRACTICE,FINANCIAL IDENTITY THEFT OVER $ 300,false,false,29,41.860291693,-87.710372301,2018-06-05T14:30:00.000+02:00,6,5,14,2018,Non-Violent
11249187,03/05/2018 04:50:00 AM,MOTOR VEHICLE THEFT,AUTOMOBILE,false,false,28,41.869491081,-87.643733672,2018-03-05T04:50:00.000+02:00,3,5,4,2018,Non-Violent
11266364,03/25/2018 02:00:00 PM,OTHER OFFENSE,TELEPHONE THREAT,false,true,69,41.771894915,-87.621864432,2018-03-25T14:00:00.000+02:00,3,25,14,2018,Non-Violent
11403410,08/05/2018 03:19:00 AM,BATTERY,DOMESTIC BATTERY SIMPLE,true,true,65,41.778677993,-87.721296466,2018-08-05T03:19:00.000+02:00,8,5,3,2018,Violent
11380362,07/14/2018 10:00:00 PM,BATTERY,DOMESTIC BATTERY SIMPLE,false,true,68,41.76432331,-87.637079178,2018-07-14T22:00:00.000+02:00,7,14,22,2018,Violent
11323931,05/18/2018 04:00:00 PM,DECEPTIVE PRACTICE,ILLEGAL USE CASH CARD,false,false,66,41.764535195,-87.693334867,2018-05-18T16:00:00.000+02:00,5,18,16,2018,Non-Violent
11337845,06/02/2018 12:00:00 PM,DECEPTIVE PRACTICE,FINANCIAL IDENTITY THEFT OVER $ 300,false,false,27,41.870827271,-87.716544717,2018-06-02T12:00:00.000+02:00,6,2,12,2018,Non-Violent
11302753,05/02/2018 04:30:00 PM,DECEPTIVE PRACTICE,CREDIT CARD FRAUD,false,false,32,41.883500187,-87.627876698,2018-05-02T16:30:00.000+02:00,5,2,16,2018,Non-Violent
11247292,03/02/2018 03:10:00 PM,THEFT,OVER $500,false,false,32,41.887711996,-87.617139647,2018-03-02T15:10:00.000+02:00,3,2,15,2018,Non-Violent
11334988,05/31/2018 04:00:00 PM,CRIMINAL DAMAGE,TO VEHICLE,false,false,61,41.817227301,-87.637474922,2018-05-31T16:00:00.000+02:00,5,31,16,2018,Non-Violent
11250076,02/02/2018 12:18:00 PM,NARCOTICS,MANU/DELIVER: HEROIN (WHITE),true,false,29,41.858939963,-87.718230098,2018-02-02T12:18:00.000+02:00,2,2,12,2018,Non-Violent
11366217,07/01/2018 05:27:00 PM,BATTERY,SIMPLE,false,false,26,41.878774252,-87.733572569,2018-07-01T17:27:00.000+02:00,7,1,17,2018,Violent
11271581,03/30/2018 07:09:00 PM,BATTERY,AGGRAVATED DOMESTIC BATTERY: KNIFE/CUTTING INST,false,true,26,41.875290002,-87.72384912,2018-03-30T19:09:00.000+02:00,3,30,19,2018,Violent
11333712,06/01/2018 08:00:00 AM,THEFT,FROM BUILDING,false,false,11,41.969388501,-87.762056504,2018-06-01T08:00:00.000+02:00,6,1,8,2018,Non-Violent
11313233,05/12/2018 06:25:00 PM,LIQUOR LAW VIOLATION,LIQUOR LICENSE VIOLATION,true,false,29,41.866098236,-87.730368538,2018-05-12T18:25:00.000+02:00,5,12,18,2018,Non-Violent
11266326,03/25/2018 10:30:00 AM,BATTERY,DOMESTIC BATTERY SIMPLE,true,true,39,41.810817084,-87.603922258,2018-03-25T10:30:00.000+02:00,3,25,10,2018,Violent
11326759,05/26/2018 02:00:00 AM,BATTERY,DOMESTIC BATTERY SIMPLE,false,true,25,41.889492699,-87.755401618,2018-05-26T02:00:00.000+02:00,5,26,2,2018,Violent
11247814,03/05/2018 05:05:00 PM,INTERFERENCE WITH PUBLIC OFFICER,OBSTRUCTING IDENTIFICATION,true,false,69,41.759164899,-87.634510669,2018-03-05T17:05:00.000+02:00,3,5,17,2018,Non-Violent
11338338,06/05/2018 06:53:00 PM,NARCOTICS,POSS: CRACK,true,false,23,41.899789214,-87.722550972,2018-06-05T18:53:00.000+02:00,6,5,18,2018,Non-Violent
11311145,05/10/2018 01:25:00 AM,ASSAULT,SIMPLE,false,false,71,41.756674516,-87.670887594,2018-05-10T01:25:00.000+02:00,5,10,1,2018,Violent
11267597,03/26/2018 06:55:00 PM,ROBBERY,STRONGARM - NO WEAPON,false,false,8,41.90707646,-87.63967773,2018-03-26T18:55:00.000+02:00,3,26,18,2018,Violent
11289264,04/19/2018 02:40:00 AM,CRIMINAL DAMAGE,TO PROPERTY,false,true,44,41.748753673,-87.600264396,2018-04-19T02:40:00.000+02:00,4,19,2,2018,Non-Violent
11352074,06/03/2018 12:00:00 AM,DECEPTIVE PRACTICE,ILLEGAL USE CASH CARD,false,false,24,41.897779604,-87.673780258,2018-06-03T00:00:00.000+02:00,6,3,0,2018,Non-Violent
11379435,07/13/2018 09:20:00 AM,THEFT,$500 AND UNDER,false,false,62,41.800464977,-87.723370404,2018-07-13T09:20:00.000+02:00,7,13,9,2018,Non-Violent
11224097,02/04/2018 03:00:00 AM,BATTERY,SIMPLE,false,false,24,41.909881891,-87.676690246,2018-02-04T03:00:00.000+02:00,2,4,3,2018,Violent
11303377,05/03/2018 08:00:00 AM,BATTERY,DOMESTIC BATTERY SIMPLE,true,true,49,41.708171691,-87.627141674,2018-05-03T08:00:00.000+02:00,5,3,8,2018,Violent
11300087,04/29/2018 04:00:00 PM,CRIMINAL DAMAGE,CRIMINAL DEFACEMENT,false,false,10,41.98384357,-87.787717818,2018-04-29T16:00:00.000+02:00,4,29,16,2018,Non-Violent
11359537,06/25/2018 07:00:00 PM,BATTERY,DOMESTIC BATTERY SIMPLE,false,true,27,41.871487845,-87.708277264,2018-06-25T19:00:00.000+02:00,6,25,19,2018,Violent
11238090,02/22/2018 10:24:00 PM,PUBLIC PEACE VIOLATION,RECKLESS CONDUCT,true,false,69,41.751452878,-87.624567581,2018-02-22T22:24:00.000+02:00,2,22,22,2018,Non-Violent
11335681,06/03/2018 10:15:00 AM,ROBBERY,STRONGARM - NO WEAPON,false,false,3,41.955918057,-87.649740161,2018-06-03T10:15:00.000+02:00,6,3,10,2018,Violent
11245736,03/03/2018 07:58:00 AM,ASSAULT,AGG PO HANDS NO/MIN INJURY,true,false,46,41.744630904,-87.553455227,2018-03-03T07:58:00.000+02:00,3,3,7,2018,Violent
11371819,07/06/2018 07:00:00 PM,CRIMINAL DAMAGE,TO VEHICLE,false,false,77,41.984109031,-87.660855375,2018-07-06T19:00:00.000+02:00,7,6,19,2018,Non-Violent
11246861,03/04/2018 07:00:00 AM,CRIMINAL DAMAGE,TO PROPERTY,false,false,6,41.932812132,-87.64429052,2018-03-04T07:00:00.000+02:00,3,4,7,2018,Non-Violent
11340857,01/01/2018 12:01:00 AM,OFFENSE INVOLVING CHILDREN,AGG SEX ASSLT OF CHILD FAM MBR,false,true,69,41.772382712,-87.61865868,2018-01-01T00:01:00.000+02:00,1,1,0,2018,Non-Violent
11251837,03/09/2018 09:00:00 PM,BATTERY,SIMPLE,false,false,22,41.92415554,-87.702302976,2018-03-09T21:00:00.000+02:00,3,9,21,2018,Violent
11353033,06/18/2018 10:30:00 PM,BURGLARY,UNLAWFUL ENTRY,false,false,68,41.783413836,-87.64319384,2018-06-18T22:30:00.000+02:00,6,18,22,2018,Non-Violent
11369298,07/04/2018 04:00:00 PM,THEFT,POCKET-PICKING,false,false,31,41.852004263,-87.688536253,2018-07-04T16:00:00.000+02:00,7,4,16,2018,Non-Violent
11321963,05/13/2018 01:08:00 PM,THEFT,$500 AND UNDER,false,false,61,41.805867966,-87.672189321,2018-05-13T13:08:00.000+02:00,5,13,13,2018,Non-Violent
11386068,07/20/2018 02:40:00 AM,CRIMINAL DAMAGE,TO PROPERTY,false,true,25,41.893523315,-87.757998728,2018-07-20T02:40:00.000+02:00,7,20,2,2018,Non-Violent
11226411,02/08/2018 11:15:00 PM,THEFT,FROM BUILDING,false,false,28,41.873219626,-87.675868666,2018-02-08T23:15:00.000+02:00,2,8,23,2018,Non-Violent
11317203,05/13/2018 05:00:00 PM,THEFT,FROM BUILDING,false,false,63,41.7971979,-87.701785981,2018-05-13T17:00:00.000+02:00,5,13,17,2018,Non-Violent
11350952,06/15/2018 04:30:00 PM,BURGLARY,FORCIBLE ENTRY,false,false,61,41.80608712,-87.655175532,2018-06-15T16:30:00.000+02:00,6,15,16,2018,Non-Violent
11242262,02/27/2018 02:50:00 PM,OTHER OFFENSE,TELEPHONE THREAT,false,false,56,41.788200237,-87.763348971,2018-02-27T14:50:00.000+02:00,2,27,14,2018,Non-Violent
11285278,04/14/2018 02:58:00 PM,THEFT,RETAIL THEFT,true,false,32,41.882394062,-87.627844798,2018-04-14T14:58:00.000+02:00,4,14,14,2018,Non-Violent
11377212,07/11/2018 07:52:00 PM,BATTERY,SIMPLE,false,false,23,41.893217103,-87.711367337,2018-07-11T19:52:00.000+02:00,7,11,19,2018,Violent
11366498,07/02/2018 04:15:00 AM,THEFT,OVER $500,false,false,15,41.955178882,-87.752738738,2018-07-02T04:15:00.000+02:00,7,2,4,2018,Non-Violent
11322243,05/21/2018 08:13:00 PM,BATTERY,SIMPLE,true,false,68,41.789843644,-87.648687614,2018-05-21T20:13:00.000+02:00,5,21,20,2018,Violent
11256809,03/15/2018 10:15:00 AM,MOTOR VEHICLE THEFT,AUTOMOBILE,false,true,69,41.772011702,-87.628344479,2018-03-15T10:15:00.000+02:00,3,15,10,2018,Non-Violent
11328127,05/27/2018 12:00:00 PM,OTHER OFFENSE,TELEPHONE THREAT,false,false,25,41.899585096,-87.74709732,2018-05-27T12:00:00.000+02:00,5,27,12,2018,Non-Violent
11379313,07/13/2018 03:05:00 PM,WEAPONS VIOLATION,UNLAWFUL POSS OF HANDGUN,true,false,32,41.880489793,-87.620771231,2018-07-13T15:05:00.000+02:00,7,13,15,2018,Non-Violent
11266502,03/23/2018 09:00:00 AM,THEFT,FROM BUILDING,false,false,1,42.015936971,-87.673293082,2018-03-23T09:00:00.000+02:00,3,23,9,2018,Non-Violent
11357357,06/23/2018 06:11:00 PM,ASSAULT,SIMPLE,false,false,27,41.875292483,-87.705963666,2018-06-23T18:11:00.000+02:00,6,23,18,2018,Violent
11265916,03/24/2018 05:30:00 PM,ROBBERY,ARMED: HANDGUN,false,false,32,41.871811902,-87.627340674,2018-03-24T17:30:00.000+02:00,3,24,17,2018,Violent
11314831,04/01/2018 09:00:00 PM,OTHER OFFENSE,OTHER CRIME AGAINST PERSON,false,false,43,41.759873573,-87.564163718,2018-04-01T21:00:00.000+02:00,4,1,21,2018,Non-Violent
11353821,06/20/2018 09:47:00 AM,OTHER OFFENSE,TELEPHONE THREAT,false,false,28,41.881634016,-87.656125244,2018-06-20T09:47:00.000+02:00,6,20,9,2018,Non-Violent
11392471,07/25/2018 09:45:00 PM,BATTERY,DOMESTIC BATTERY SIMPLE,false,true,22,41.930741754,-87.715945805,2018-07-25T21:45:00.000+02:00,7,25,21,2018,Violent
11371764,07/06/2018 08:40:00 PM,BATTERY,SIMPLE,true,false,28,41.87417034,-87.64241662,2018-07-06T20:40:00.000+02:00,7,6,20,2018,Violent
11372625,07/01/2018 10:00:00 AM,MOTOR VEHICLE THEFT,AUTOMOBILE,false,false,23,41.890499193,-87.719833545,2018-07-01T10:00:00.000+02:00,7,1,10,2018,Non-Violent
11271881,03/31/2018 05:27:00 AM,THEFT,FROM BUILDING,false,false,61,41.801602096,-87.644421734,2018-03-31T05:27:00.000+02:00,3,31,5,2018,Non-Violent
11276033,04/04/2018 07:30:00 PM,THEFT,OVER $500,false,false,71,41.754885266,-87.677110743,2018-04-04T19:30:00.000+02:00,4,4,19,2018,Non-Violent
11347331,06/14/2018 04:18:00 AM,BURGLARY,FORCIBLE ENTRY,false,false,19,41.920614966,-87.775910739,2018-06-14T04:18:00.000+02:00,6,14,4,2018,Non-Violent
11375597,07/10/2018 12:30:00 PM,ASSAULT,SIMPLE,false,false,43,41.761988329,-87.564820216,2018-07-10T12:30:00.000+02:00,7,10,12,2018,Violent
11306193,05/06/2018 01:19:00 AM,BATTERY,AGG: HANDS/FIST/FEET SERIOUS INJURY,true,false,8,41.891051707,-87.63405559,2018-05-06T01:19:00.000+02:00,5,6,1,2018,Violent
11267190,03/26/2018 01:15:00 PM,THEFT,RETAIL THEFT,true,false,61,41.808659359,-87.660921846,2018-03-26T13:15:00.000+02:00,3,26,13,2018,Non-Violent
11317261,05/16/2018 12:00:00 PM,THEFT,FROM BUILDING,false,false,8,41.895273434,-87.629741563,2018-05-16T12:00:00.000+02:00,5,16,12,2018,Non-Violent
11340849,06/08/2018 12:05:00 AM,CRIMINAL DAMAGE,TO PROPERTY,true,true,29,41.868289635,-87.700051402,2018-06-08T00:05:00.000+02:00,6,8,0,2018,Non-Violent
11393492,07/26/2018 09:30:00 PM,BATTERY,DOMESTIC BATTERY SIMPLE,false,true,24,41.904789104,-87.692814025,2018-07-26T21:30:00.000+02:00,7,26,21,2018,Violent
11241716,02/26/2018 09:50:00 PM,DECEPTIVE PRACTICE,CREDIT CARD FRAUD,false,false,53,41.662584472,-87.645060188,2018-02-26T21:50:00.000+02:00,2,26,21,2018,Non-Violent
11292325,04/21/2018 10:00:00 PM,THEFT,$500 AND UNDER,false,false,19,41.926190033,-87.756224399,2018-04-21T22:00:00.000+02:00,4,21,22,2018,Non-Violent
11365044,06/28/2018 04:00:00 PM,BURGLARY,UNLAWFUL ENTRY,false,false,30,41.847863888,-87.727478807,2018-06-28T16:00:00.000+02:00,6,28,16,2018,Non-Violent
11388499,07/22/2018 01:30:00 PM,BATTERY,DOMESTIC BATTERY SIMPLE,false,true,54,41.657895352,-87.603403539,2018-07-22T13:30:00.000+02:00,7,22,13,2018,Violent
11365367,06/30/2018 04:00:00 PM,THEFT,FROM BUILDING,false,false,77,41.977094683,-87.6598884,2018-06-30T16:00:00.000+02:00,6,30,16,2018,Non-Violent
11267106,03/26/2018 10:19:00 AM,THEFT,RETAIL THEFT,true,false,15,41.953436358,-87.746273229,2018-03-26T10:19:00.000+02:00,3,26,10,2018,Non-Violent
11336035,06/03/2018 02:30:00 PM,BATTERY,SIMPLE,false,false,70,41.749267369,-87.706045214,2018-06-03T14:30:00.000+02:00,6,3,14,2018,Violent
11332154,05/30/2018 01:00:00 PM,THEFT,$500 AND UNDER,false,false,41,41.791783249,-87.606162298,2018-05-30T13:00:00.000+02:00,5,30,13,2018,Non-Violent
11400953,08/02/2018 05:20:00 PM,OTHER OFFENSE,TELEPHONE THREAT,false,true,66,41.783889146,-87.691085473,2018-08-02T17:20:00.000+02:00,8,2,17,2018,Non-Violent
11358333,06/24/2018 05:00:00 PM,THEFT,OVER $500,false,false,8,41.90434894,-87.632937036,2018-06-24T17:00:00.000+02:00,6,24,17,2018,Non-Violent
11344573,06/11/2018 03:00:00 PM,THEFT,OVER $500,false,false,70,41.736254784,-87.690329208,2018-06-11T15:00:00.000+02:00,6,11,15,2018,Non-Violent
11348865,06/15/2018 03:30:00 PM,THEFT,$500 AND UNDER,false,false,35,41.841633579,-87.609304732,2018-06-15T15:30:00.000+02:00,6,15,15,2018,Non-Violent
11290874,04/20/2018 04:30:00 PM,CRIMINAL TRESPASS,TO LAND,false,false,65,41.764109867,-87.72155223,2018-04-20T16:30:00.000+02:00,4,20,16,2018,Non-Violent
11371543,06/29/2018 07:30:00 AM,CRIMINAL DAMAGE,TO PROPERTY,false,false,22,41.919075195,-87.719883249,2018-06-29T07:30:00.000+02:00,6,29,7,2018,Non-Violent
11295126,04/24/2018 01:00:00 PM,CRIMINAL DAMAGE,TO PROPERTY,false,false,69,41.76735037,-87.624084711,2018-04-24T13:00:00.000+02:00,4,24,13,2018,Non-Violent
11334100,05/30/2018 03:00:00 PM,SEX OFFENSE,CRIMINAL SEXUAL ABUSE,false,false,7,41.919311217,-87.636668238,2018-05-30T15:00:00.000+02:00,5,30,15,2018,Non-Violent
11379561,07/14/2018 02:50:00 AM,BATTERY,SIMPLE,false,false,67,41.771325476,-87.660351436,2018-07-14T02:50:00.000+02:00,7,14,2,2018,Violent
11258864,03/17/2018 01:42:00 PM,ROBBERY,ARMED: HANDGUN,false,false,71,41.746018447,-87.663327476,2018-03-17T13:42:00.000+02:00,3,17,13,2018,Violent
11367668,06/28/2018 10:00:00 PM,BATTERY,SIMPLE,false,false,24,41.903222669,-87.675432381,2018-06-28T22:00:00.000+02:00,6,28,22,2018,Violent
11349716,06/16/2018 12:00:00 AM,THEFT,OVER $500,false,false,3,41.976311243,-87.6605954,2018-06-16T00:00:00.000+02:00,6,16,0,2018,Non-Violent
11260774,03/19/2018 01:15:00 PM,BATTERY,DOMESTIC BATTERY SIMPLE,false,true,46,41.745229674,-87.545485275,2018-03-19T13:15:00.000+02:00,3,19,13,2018,Violent
11394805,07/28/2018 06:00:00 AM,CRIMINAL DAMAGE,TO PROPERTY,false,false,33,41.846859523,-87.617323885,2018-07-28T06:00:00.000+02:00,7,28,6,2018,Non-Violent
11277207,04/05/2018 10:50:00 PM,BATTERY,DOMESTIC BATTERY SIMPLE,false,true,26,41.881088655,-87.720764494,2018-04-05T22:50:00.000+02:00,4,5,22,2018,Violent
11354463,06/18/2018 02:25:00 PM,THEFT,OVER $500,false,false,2,42.009535711,-87.682101819,2018-06-18T14:25:00.000+02:00,6,18,14,2018,Non-Violent
11271275,03/30/2018 01:17:00 PM,NARCOTICS,POSS: CANNABIS MORE THAN 30GMS,true,false,26,41.876987813,-87.733585601,2018-03-30T13:17:00.000+02:00,3,30,13,2018,Non-Violent
11265025,03/23/2018 07:10:00 PM,THEFT,FROM BUILDING,false,false,28,41.883641965,-87.648579514,2018-03-23T19:10:00.000+02:00,3,23,19,2018,Non-Violent
11244534,03/01/2018 08:08:00 PM,BATTERY,AGGRAVATED DOMESTIC BATTERY: KNIFE/CUTTING INST,false,true,68,41.764816217,-87.640079564,2018-03-01T20:08:00.000+02:00,3,1,20,2018,Violent
11294549,04/24/2018 02:28:00 PM,BATTERY,AGGRAVATED - HANDGUN,false,false,23,41.899525741,-87.722546136,2018-04-24T14:28:00.000+02:00,4,24,14,2018,Violent
11331841,05/30/2018 05:43:00 PM,NARCOTICS,POSS: HEROIN(WHITE),true,false,23,41.894002684,-87.72482086,2018-05-30T17:43:00.000+02:00,5,30,17,2018,Non-Violent
11310030,05/08/2018 09:10:00 PM,ASSAULT,SIMPLE,false,true,22,41.923745167,-87.712603237,2018-05-08T21:10:00.000+02:00,5,8,21,2018,Violent
11344638,06/11/2018 07:11:00 PM,NARCOTICS,SOLICIT NARCOTICS ON PUBLICWAY,true,false,23,41.893705086,-87.708244333,2018-06-11T19:11:00.000+02:00,6,11,19,2018,Non-Violent
11333931,06/01/2018 01:12:00 PM,THEFT,RETAIL THEFT,true,false,13,41.994758989,-87.7144777,2018-06-01T13:12:00.000+02:00,6,1,13,2018,Non-Violent
11228816,02/12/2018 02:15:00 PM,BATTERY,SIMPLE,false,false,6,41.939920598,-87.653193291,2018-02-12T14:15:00.000+02:00,2,12,14,2018,Violent
11229151,02/09/2018 02:00:00 PM,THEFT,$500 AND UNDER,false,false,25,41.909165461,-87.783765675,2018-02-09T14:00:00.000+02:00,2,9,14,2018,Non-Violent
11328140,05/27/2018 03:01:00 PM,THEFT,FROM BUILDING,true,false,77,41.984109031,-87.660855375,2018-05-27T15:01:00.000+02:00,5,27,15,2018,Non-Violent
11263730,03/22/2018 01:00:00 PM,BATTERY,DOMESTIC BATTERY SIMPLE,false,true,53,41.677124277,-87.631042884,2018-03-22T13:00:00.000+02:00,3,22,13,2018,Violent
11359845,06/25/2018 11:05:00 PM,CRIMINAL TRESPASS,TO RESIDENCE,false,true,17,41.941118416,-87.782440164,2018-06-25T23:05:00.000+02:00,6,25,23,2018,Non-Violent
11365779,07/01/2018 01:00:00 AM,CRIMINAL DAMAGE,TO PROPERTY,false,false,63,41.796829998,-87.698767709,2018-07-01T01:00:00.000+02:00,7,1,1,2018,Non-Violent
11299610,04/29/2018 03:00:00 AM,THEFT,OVER $500,false,false,24,41.903354381,-87.666864606,2018-04-29T03:00:00.000+02:00,4,29,3,2018,Non-Violent
11344548,06/09/2018 12:00:00 AM,THEFT,$500 AND UNDER,false,false,8,41.891619401,-87.631746585,2018-06-09T00:00:00.000+02:00,6,9,0,2018,Non-Violent
11328573,05/27/2018 11:00:00 PM,ASSAULT,SIMPLE,true,true,51,41.721317888,-87.568543136,2018-05-27T23:00:00.000+02:00,5,27,23,2018,Violent
11397035,07/30/2018 09:00:00 AM,OTHER OFFENSE,HARASSMENT BY TELEPHONE,false,false,23,41.901835987,-87.725055051,2018-07-30T09:00:00.000+02:00,7,30,9,2018,Non-Violent
11323444,05/22/2018 08:10:00 PM,NARCOTICS,POSS: BARBITUATES,true,false,53,41.685226244,-87.630705836,2018-05-22T20:10:00.000+02:00,5,22,20,2018,Non-Violent
11271288,03/30/2018 10:42:00 AM,PUBLIC PEACE VIOLATION,RECKLESS CONDUCT,true,false,30,41.847029349,-87.716087031,2018-03-30T10:42:00.000+02:00,3,30,10,2018,Non-Violent
11317094,05/15/2018 03:45:00 PM,BATTERY,SIMPLE,false,false,21,41.933755774,-87.71508615,2018-05-15T15:45:00.000+02:00,5,15,15,2018,Violent
11377906,07/12/2018 02:30:00 PM,THEFT,OVER $500,false,false,38,41.812585491,-87.622925618,2018-07-12T14:30:00.000+02:00,7,12,14,2018,Non-Violent
11242243,02/27/2018 01:10:00 PM,WEAPONS VIOLATION,UNLAWFUL USE OTHER DANG WEAPON,true,false,49,41.71902307,-87.620528559,2018-02-27T13:10:00.000+02:00,2,27,13,2018,Non-Violent
11312311,05/11/2018 03:50:00 PM,NARCOTICS,MANU/DEL:CANNABIS OVER 10 GMS,true,false,40,41.789280246,-87.620135797,2018-05-11T15:50:00.000+02:00,5,11,15,2018,Non-Violent
11254011,03/12/2018 12:20:00 PM,BATTERY,DOMESTIC BATTERY SIMPLE,false,true,71,41.756506074,-87.674525042,2018-03-12T12:20:00.000+02:00,3,12,12,2018,Violent
11354558,06/20/2018 05:37:00 PM,BATTERY,AGGRAVATED: HANDGUN,false,false,43,41.764448809,-87.565468967,2018-06-20T17:37:00.000+02:00,6,20,17,2018,Violent
11366635,07/02/2018 09:08:00 AM,BATTERY,SIMPLE,true,false,30,41.851761023,-87.705558672,2018-07-02T09:08:00.000+02:00,7,2,9,2018,Violent
11310355,05/05/2018 06:00:00 PM,BATTERY,SIMPLE,false,false,1,42.02059812,-87.666436575,2018-05-05T18:00:00.000+02:00,5,5,18,2018,Violent
11312236,05/09/2018 10:30:00 PM,BATTERY,DOMESTIC BATTERY SIMPLE,true,true,52,41.700441032,-87.537701543,2018-05-09T22:30:00.000+02:00,5,9,22,2018,Violent
11228157,02/11/2018 04:00:00 PM,THEFT,RETAIL THEFT,false,false,63,41.803671998,-87.703846021,2018-02-11T16:00:00.000+02:00,2,11,16,2018,Non-Violent
11254841,03/10/2018 11:30:00 PM,THEFT,OVER $500,false,false,19,41.92467439,-87.746316497,2018-03-10T23:30:00.000+02:00,3,10,23,2018,Non-Violent
11306027,05/05/2018 03:30:00 PM,BATTERY,SIMPLE,false,false,43,41.756152334,-87.584523288,2018-05-05T15:30:00.000+02:00,5,5,15,2018,Violent
11402820,08/03/2018 04:00:00 PM,THEFT,$500 AND UNDER,false,true,66,41.777284571,-87.6892926,2018-08-03T16:00:00.000+02:00,8,3,16,2018,Non-Violent
11366866,06/25/2018 06:12:00 PM,DECEPTIVE PRACTICE,"THEFT BY LESSEE,MOTOR VEH",false,false,15,41.959125819,-87.747485772,2018-06-25T18:12:00.000+02:00,6,25,18,2018,Non-Violent
11263722,03/22/2018 12:00:00 PM,DECEPTIVE PRACTICE,CREDIT CARD FRAUD,false,false,24,41.910723346,-87.677471499,2018-03-22T12:00:00.000+02:00,3,22,12,2018,Non-Violent
11243365,02/28/2018 12:30:00 PM,MOTOR VEHICLE THEFT,AUTOMOBILE,false,false,8,41.905921825,-87.650321536,2018-02-28T12:30:00.000+02:00,2,28,12,2018,Non-Violent
11336855,06/01/2018 10:30:00 PM,ROBBERY,ARMED: HANDGUN,false,false,46,41.751933979,-87.55110567,2018-06-01T22:30:00.000+02:00,6,1,22,2018,Violent
11338671,06/06/2018 01:50:00 AM,BATTERY,AGGRAVATED DOMESTIC BATTERY: OTHER DANG WEAPON,false,true,61,41.803427645,-87.64406475,2018-06-06T01:50:00.000+02:00,6,6,1,2018,Violent
11403400,08/05/2018 01:10:00 AM,WEAPONS VIOLATION,UNLAWFUL POSS OF HANDGUN,true,false,23,41.893583154,-87.720241104,2018-08-05T01:10:00.000+02:00,8,5,1,2018,Non-Violent
11224480,02/06/2018 02:30:00 PM,BATTERY,SIMPLE,false,false,6,41.94266078,-87.64013022,2018-02-06T14:30:00.000+02:00,2,6,14,2018,Violent
11266825,03/26/2018 03:15:00 AM,CRIMINAL DAMAGE,TO VEHICLE,false,false,44,41.742710224,-87.634088181,2018-03-26T03:15:00.000+02:00,3,26,3,2018,Non-Violent
11244914,03/01/2018 09:00:00 PM,BATTERY,AGGRAVATED OF A CHILD,false,true,71,41.737367232,-87.64000479,2018-03-01T21:00:00.000+02:00,3,1,21,2018,Violent
11248453,03/06/2018 11:15:00 AM,NARCOTICS,POSS: HEROIN(WHITE),true,false,26,41.884574185,-87.73488077,2018-03-06T11:15:00.000+02:00,3,6,11,2018,Non-Violent
11337273,06/04/2018 05:50:00 PM,ROBBERY,ARMED - HANDGUN,false,false,46,41.745711423,-87.574659097,2018-06-04T17:50:00.000+02:00,6,4,17,2018,Violent
11338368,06/01/2018 06:45:00 PM,THEFT,OVER $500,false,false,24,41.910592416,-87.670441113,2018-06-01T18:45:00.000+02:00,6,1,18,2018,Non-Violent
11308129,05/07/2018 10:13:00 PM,CRIMINAL TRESPASS,TO LAND,true,false,2,42.00020718,-87.681435397,2018-05-07T22:13:00.000+02:00,5,7,22,2018,Non-Violent
11253247,03/07/2018 03:00:00 AM,ASSAULT,AGGRAVATED:KNIFE/CUTTING INSTR,false,true,26,41.877043679,-87.729061272,2018-03-07T03:00:00.000+02:00,3,7,3,2018,Violent
11354426,06/20/2018 06:59:00 PM,GAMBLING,GAME/DICE,true,false,29,41.861717546,-87.721386272,2018-06-20T18:59:00.000+02:00,6,20,18,2018,Non-Violent
11260448,03/19/2018 11:50:00 AM,NARCOTICS,MANU/DEL:CANNABIS 10GM OR LESS,true,false,25,41.880801426,-87.752634034,2018-03-19T11:50:00.000+02:00,3,19,11,2018,Non-Violent
11280447,04/09/2018 06:00:00 PM,THEFT,OVER $500,false,false,67,41.767726292,-87.663867778,2018-04-09T18:00:00.000+02:00,4,9,18,2018,Non-Violent
11399290,07/31/2018 07:30:00 PM,THEFT,POCKET-PICKING,false,false,32,41.884476226,-87.631310613,2018-07-31T19:30:00.000+02:00,7,31,19,2018,Non-Violent
11251851,03/08/2018 12:59:00 AM,OFFENSE INVOLVING CHILDREN,CHILD ABUSE,false,false,72,41.708796576,-87.662267494,2018-03-08T00:59:00.000+02:00,3,8,0,2018,Non-Violent
11368340,07/03/2018 05:30:00 PM,THEFT,$500 AND UNDER,false,true,65,41.778802358,-87.71377935,2018-07-03T17:30:00.000+02:00,7,3,17,2018,Non-Violent
11273341,04/02/2018 03:08:00 AM,ASSAULT,AGGRAVATED:KNIFE/CUTTING INSTR,false,true,52,41.717068527,-87.535280506,2018-04-02T03:08:00.000+02:00,4,2,3,2018,Violent
11356679,06/23/2018 03:50:00 AM,MOTOR VEHICLE THEFT,AUTOMOBILE,false,false,35,41.845278983,-87.625316624,2018-06-23T03:50:00.000+02:00,6,23,3,2018,Non-Violent
11327258,05/26/2018 01:12:00 PM,BATTERY,PRO EMP HANDS NO/MIN INJURY,false,false,69,41.751119567,-87.614647172,2018-05-26T13:12:00.000+02:00,5,26,13,2018,Violent
11399793,08/01/2018 08:20:00 PM,DECEPTIVE PRACTICE,STOLEN PROP: BUY/RECEIVE/POS.,true,false,32,41.873883785,-87.624218932,2018-08-01T20:20:00.000+02:00,8,1,20,2018,Non-Violent
11240065,02/25/2018 06:50:00 AM,BATTERY,AGGRAVATED DOMESTIC BATTERY: KNIFE/CUTTING INST,true,true,71,41.754981686,-87.652646228,2018-02-25T06:50:00.000+02:00,2,25,6,2018,Violent
11371922,07/06/2018 10:35:00 PM,MOTOR VEHICLE THEFT,AUTOMOBILE,false,false,71,41.753682356,-87.653821721,2018-07-06T22:35:00.000+02:00,7,6,22,2018,Non-Violent
11352469,06/18/2018 04:30:00 PM,THEFT,OVER $500,false,false,53,41.683974167,-87.650631169,2018-06-18T16:30:00.000+02:00,6,18,16,2018,Non-Violent
11339367,06/02/2018 05:30:00 PM,OFFENSE INVOLVING CHILDREN,CHILD ABUSE,false,true,28,41.869333381,-87.686919244,2018-06-02T17:30:00.000+02:00,6,2,17,2018,Non-Violent
11224115,02/06/2018 09:11:00 AM,OTHER OFFENSE,OTHER CRIME AGAINST PERSON,false,false,67,41.773188686,-87.677404455,2018-02-06T09:11:00.000+02:00,2,6,9,2018,Non-Violent
11319985,05/19/2018 05:00:00 AM,THEFT,$500 AND UNDER,false,false,8,41.896702263,-87.626464221,2018-05-19T05:00:00.000+02:00,5,19,5,2018,Non-Violent
11320219,05/19/2018 05:24:00 PM,ASSAULT,AGGRAVATED:KNIFE/CUTTING INSTR,false,false,28,41.866331725,-87.666379171,2018-05-19T17:24:00.000+02:00,5,19,17,2018,Violent
11264920,03/23/2018 12:01:00 AM,THEFT,$500 AND UNDER,false,false,24,41.89103641,-87.66136974,2018-03-23T00:01:00.000+02:00,3,23,0,2018,Non-Violent
11342729,06/09/2018 12:15:00 PM,BATTERY,DOMESTIC BATTERY SIMPLE,false,true,2,42.00488935,-87.697686723,2018-06-09T12:15:00.000+02:00,6,9,12,2018,Violent
11245315,03/02/2018 05:54:00 PM,THEFT,FROM BUILDING,false,false,8,41.903125898,-87.632182661,2018-03-02T17:54:00.000+02:00,3,2,17,2018,Non-Violent
11241045,02/26/2018 10:10:00 AM,CRIMINAL TRESPASS,TO LAND,true,false,77,41.985534487,-87.660126814,2018-02-26T10:10:00.000+02:00,2,26,10,2018,Non-Violent
11267613,03/24/2018 02:00:00 AM,CRIM SEXUAL ASSAULT,NON-AGGRAVATED,false,false,25,41.880129791,-87.772094898,2018-03-24T02:00:00.000+02:00,3,24,2,2018,Non-Violent
11291924,04/21/2018 06:49:00 PM,BATTERY,SIMPLE,true,false,51,41.722383615,-87.581996008,2018-04-21T18:49:00.000+02:00,4,21,18,2018,Violent
11316333,05/15/2018 07:00:00 PM,THEFT,$500 AND UNDER,false,false,22,41.930049492,-87.685920733,2018-05-15T19:00:00.000+02:00,5,15,19,2018,Non-Violent
11261251,03/17/2018 04:30:00 PM,DECEPTIVE PRACTICE,CREDIT CARD FRAUD,false,false,32,41.885741529,-87.631344503,2018-03-17T16:30:00.000+02:00,3,17,16,2018,Non-Violent
11340461,06/07/2018 04:40:00 PM,BATTERY,DOMESTIC BATTERY SIMPLE,false,true,66,41.78564034,-87.688695643,2018-06-07T16:40:00.000+02:00,6,7,16,2018,Violent
11373866,07/08/2018 05:11:00 AM,BATTERY,DOMESTIC BATTERY SIMPLE,false,true,25,41.912355313,-87.747347874,2018-07-08T05:11:00.000+02:00,7,8,5,2018,Violent
11334161,05/31/2018 12:00:00 PM,CRIMINAL DAMAGE,TO VEHICLE,false,false,24,41.893484334,-87.651140887,2018-05-31T12:00:00.000+02:00,5,31,12,2018,Non-Violent
11360561,06/26/2018 05:00:00 PM,DECEPTIVE PRACTICE,FINANCIAL IDENTITY THEFT $300 AND UNDER,false,false,67,41.789969105,-87.662041276,2018-06-26T17:00:00.000+02:00,6,26,17,2018,Non-Violent
11303038,05/01/2018 11:00:00 PM,OTHER OFFENSE,HARASSMENT BY ELECTRONIC MEANS,false,false,46,41.74752679,-87.564956072,2018-05-01T23:00:00.000+02:00,5,1,23,2018,Non-Violent
11247226,03/05/2018 02:15:00 AM,THEFT,RETAIL THEFT,true,false,73,41.721194359,-87.663966368,2018-03-05T02:15:00.000+02:00,3,5,2,2018,Non-Violent
11250323,03/06/2018 11:30:00 AM,THEFT,OVER $500,false,false,25,41.897819723,-87.765501067,2018-03-06T11:30:00.000+02:00,3,6,11,2018,Non-Violent
11306173,05/05/2018 11:16:00 PM,CRIMINAL DAMAGE,TO PROPERTY,true,false,8,41.901073698,-87.63136393,2018-05-05T23:16:00.000+02:00,5,5,23,2018,Non-Violent
11343218,06/10/2018 12:15:00 PM,THEFT,$500 AND UNDER,false,false,38,41.82386008,-87.615162409,2018-06-10T12:15:00.000+02:00,6,10,12,2018,Non-Violent
11256092,03/08/2018 11:52:00 AM,MOTOR VEHICLE THEFT,AUTOMOBILE,false,false,7,41.921819301,-87.648505851,2018-03-08T11:52:00.000+02:00,3,8,11,2018,Non-Violent
11334701,06/02/2018 07:00:00 AM,THEFT,$500 AND UNDER,false,false,69,41.753887157,-87.611358218,2018-06-02T07:00:00.000+02:00,6,2,7,2018,Non-Violent
11389714,07/22/2018 11:00:00 PM,BURGLARY,FORCIBLE ENTRY,false,false,23,41.899811416,-87.726220311,2018-07-22T23:00:00.000+02:00,7,22,23,2018,Non-Violent
11365291,06/30/2018 09:20:00 PM,THEFT,OVER $500,false,false,29,41.85384608,-87.715063469,2018-06-30T21:20:00.000+02:00,6,30,21,2018,Non-Violent
11333769,06/01/2018 11:45:00 AM,THEFT,RETAIL THEFT,true,false,32,41.882470918,-87.627847625,2018-06-01T11:45:00.000+02:00,6,1,11,2018,Non-Violent
11340259,06/07/2018 07:30:00 AM,BATTERY,DOMESTIC BATTERY SIMPLE,false,true,71,41.751201471,-87.670731314,2018-06-07T07:30:00.000+02:00,6,7,7,2018,Violent
11259631,03/18/2018 12:00:00 PM,NARCOTICS,MANU/DEL:CANNABIS 10GM OR LESS,true,false,26,41.876223222,-87.721817052,2018-03-18T12:00:00.000+02:00,3,18,12,2018,Non-Violent
11376526,06/25/2018 09:35:00 AM,CRIMINAL DAMAGE,TO VEHICLE,false,false,41,41.797936811,-87.606301777,2018-06-25T09:35:00.000+02:00,6,25,9,2018,Non-Violent
11406084,08/06/2018 06:30:00 PM,THEFT,$500 AND UNDER,false,false,14,41.96478474,-87.697522955,2018-08-06T18:30:00.000+02:00,8,6,18,2018,Non-Violent
11377112,07/11/2018 07:42:00 PM,BATTERY,SIMPLE,false,false,8,41.892631323,-87.6182857,2018-07-11T19:42:00.000+02:00,7,11,19,2018,Violent
11224670,02/05/2018 08:25:00 PM,BATTERY,DOMESTIC BATTERY SIMPLE,false,true,25,41.881810242,-87.74594885,2018-02-05T20:25:00.000+02:00,2,5,20,2018,Violent
11290827,04/20/2018 02:45:00 PM,ASSAULT,SIMPLE,false,false,3,41.966669657,-87.654795172,2018-04-20T14:45:00.000+02:00,4,20,14,2018,Violent
11245603,03/03/2018 12:36:00 AM,CRIMINAL DAMAGE,TO VEHICLE,false,false,27,41.8838154,-87.696361678,2018-03-03T00:36:00.000+02:00,3,3,0,2018,Non-Violent
11364721,06/29/2018 01:23:00 PM,OFFENSE INVOLVING CHILDREN,ENDANGERING LIFE/HEALTH CHILD,false,true,23,41.906411523,-87.712403816,2018-06-29T13:23:00.000+02:00,6,29,13,2018,Non-Violent
11262290,03/20/2018 04:55:00 PM,THEFT,$500 AND UNDER,false,false,40,41.780946398,-87.621995369,2018-03-20T16:55:00.000+02:00,3,20,16,2018,Non-Violent
11313224,05/12/2018 06:37:00 PM,NARCOTICS,POSS: HEROIN(WHITE),true,false,23,41.901869443,-87.718968006,2018-05-12T18:37:00.000+02:00,5,12,18,2018,Non-Violent
11351039,06/17/2018 09:30:00 PM,ASSAULT,SIMPLE,false,true,51,41.713432983,-87.571361574,2018-06-17T21:30:00.000+02:00,6,17,21,2018,Violent
11405110,08/06/2018 02:30:00 PM,BATTERY,SIMPLE,false,false,67,41.767961562,-87.659048619,2018-08-06T14:30:00.000+02:00,8,6,14,2018,Violent
11265674,03/12/2018 05:47:00 PM,THEFT,RETAIL THEFT,false,false,7,41.93121391,-87.676890454,2018-03-12T17:47:00.000+02:00,3,12,17,2018,Non-Violent
11368762,07/04/2018 02:30:00 AM,BATTERY,DOMESTIC BATTERY SIMPLE,false,true,54,41.655821115,-87.601322854,2018-07-04T02:30:00.000+02:00,7,4,2,2018,Violent
11244207,02/28/2018 04:11:00 PM,OTHER OFFENSE,HARASSMENT BY TELEPHONE,false,false,68,41.759309777,-87.643041666,2018-02-28T16:11:00.000+02:00,2,28,16,2018,Non-Violent
11316807,05/16/2018 10:20:00 AM,PUBLIC PEACE VIOLATION,ARSON THREAT,false,true,44,41.743942175,-87.60662908,2018-05-16T10:20:00.000+02:00,5,16,10,2018,Non-Violent
11355373,06/17/2018 10:30:00 PM,DECEPTIVE PRACTICE,CREDIT CARD FRAUD,false,false,6,41.933335215,-87.666890688,2018-06-17T22:30:00.000+02:00,6,17,22,2018,Non-Violent
11377078,07/11/2018 06:10:00 PM,DECEPTIVE PRACTICE,CREDIT CARD FRAUD,false,false,8,41.895003278,-87.62152816,2018-07-11T18:10:00.000+02:00,7,11,18,2018,Non-Violent
11362215,06/28/2018 04:33:00 AM,CRIMINAL DAMAGE,TO VEHICLE,false,false,40,41.786867488,-87.622263593,2018-06-28T04:33:00.000+02:00,6,28,4,2018,Non-Violent
11369605,07/04/2018 09:44:00 PM,ASSAULT,AGGRAVATED PO: HANDGUN,true,false,26,41.885499559,-87.726620241,2018-07-04T21:44:00.000+02:00,7,4,21,2018,Violent
11237666,02/21/2018 06:00:00 PM,THEFT,OVER $500,false,false,47,41.726863192,-87.596109965,2018-02-21T18:00:00.000+02:00,2,21,18,2018,Non-Violent
11304003,05/03/2018 06:00:00 PM,THEFT,FROM BUILDING,false,true,46,41.742048903,-87.560008753,2018-05-03T18:00:00.000+02:00,5,3,18,2018,Non-Violent
11379053,07/12/2018 02:15:00 PM,BURGLARY,FORCIBLE ENTRY,false,false,26,41.87073742,-87.723874012,2018-07-12T14:15:00.000+02:00,7,12,14,2018,Non-Violent
11246642,03/04/2018 10:46:00 AM,NARCOTICS,MANU/DEL:CANNABIS 10GM OR LESS,true,false,69,41.764737283,-87.624890577,2018-03-04T10:46:00.000+02:00,3,4,10,2018,Non-Violent
11325244,05/20/2018 07:00:00 AM,THEFT,OVER $500,false,true,17,41.938045457,-87.834808319,2018-05-20T07:00:00.000+02:00,5,20,7,2018,Non-Violent
11229108,02/09/2018 03:00:00 PM,DECEPTIVE PRACTICE,CREDIT CARD FRAUD,false,false,49,41.711904507,-87.627229006,2018-02-09T15:00:00.000+02:00,2,9,15,2018,Non-Violent
11246653,02/27/2018 07:49:00 PM,OTHER OFFENSE,OTHER CRIME INVOLVING PROPERTY,true,false,71,41.755964835,-87.653225905,2018-02-27T19:49:00.000+02:00,2,27,19,2018,Non-Violent
11389798,07/23/2018 01:00:00 AM,CRIMINAL DAMAGE,TO VEHICLE,false,false,30,41.850126439,-87.691832759,2018-07-23T01:00:00.000+02:00,7,23,1,2018,Non-Violent
11371732,07/06/2018 03:15:00 PM,CRIMINAL DAMAGE,TO PROPERTY,false,false,71,41.739529428,-87.656521138,2018-07-06T15:15:00.000+02:00,7,6,15,2018,Non-Violent
11247844,03/05/2018 04:30:00 PM,BATTERY,DOMESTIC BATTERY SIMPLE,false,true,1,42.005525532,-87.661936028,2018-03-05T16:30:00.000+02:00,3,5,16,2018,Violent
11331641,05/30/2018 10:45:00 AM,CRIMINAL DAMAGE,TO VEHICLE,false,true,43,41.772625715,-87.576471929,2018-05-30T10:45:00.000+02:00,5,30,10,2018,Non-Violent
11292508,04/22/2018 02:10:00 PM,INTERFERENCE WITH PUBLIC OFFICER,OBSTRUCTING IDENTIFICATION,true,false,22,41.914369244,-87.717907584,2018-04-22T14:10:00.000+02:00,4,22,14,2018,Non-Violent
11404489,08/06/2018 02:16:00 AM,BURGLARY,ATTEMPT FORCIBLE ENTRY,false,false,58,41.812801161,-87.710194416,2018-08-06T02:16:00.000+02:00,8,6,2,2018,Non-Violent
11268383,03/18/2018 02:00:00 AM,BATTERY,SIMPLE,false,false,8,41.890051565,-87.62891376,2018-03-18T02:00:00.000+02:00,3,18,2,2018,Violent
11360282,06/25/2018 10:05:00 PM,BURGLARY,FORCIBLE ENTRY,false,false,49,41.690756016,-87.624439765,2018-06-25T22:05:00.000+02:00,6,25,22,2018,Non-Violent
11376329,07/10/2018 06:30:00 PM,MOTOR VEHICLE THEFT,AUTOMOBILE,false,false,31,41.854809036,-87.684176721,2018-07-10T18:30:00.000+02:00,7,10,18,2018,Non-Violent
11311448,05/10/2018 06:30:00 PM,CRIMINAL TRESPASS,TO LAND,true,false,48,41.734547924,-87.585594973,2018-05-10T18:30:00.000+02:00,5,10,18,2018,Non-Violent
11250857,03/08/2018 12:00:00 PM,CRIMINAL DAMAGE,TO VEHICLE,false,true,17,41.944010579,-87.811766254,2018-03-08T12:00:00.000+02:00,3,8,12,2018,Non-Violent
11277865,04/06/2018 09:00:00 AM,CRIMINAL DAMAGE,TO VEHICLE,false,false,22,41.92046017,-87.67083136,2018-04-06T09:00:00.000+02:00,4,6,9,2018,Non-Violent
11265492,03/23/2018 03:30:00 PM,BATTERY,SIMPLE,false,false,19,41.924102822,-87.756452662,2018-03-23T15:30:00.000+02:00,3,23,15,2018,Violent
11377876,07/12/2018 03:00:00 PM,CRIMINAL DAMAGE,TO PROPERTY,false,false,25,41.887213953,-87.765650083,2018-07-12T15:00:00.000+02:00,7,12,15,2018,Non-Violent
11250658,02/23/2018 10:00:00 AM,DECEPTIVE PRACTICE,FORGERY,false,false,66,41.78558545,-87.686254176,2018-02-23T10:00:00.000+02:00,2,23,10,2018,Non-Violent
11387067,07/08/2018 03:33:00 AM,ASSAULT,SIMPLE,false,false,8,41.904370109,-87.631460067,2018-07-08T03:33:00.000+02:00,7,8,3,2018,Violent
11325917,05/23/2018 02:52:00 PM,THEFT,RETAIL THEFT,false,false,15,41.95347181,-87.743552438,2018-05-23T14:52:00.000+02:00,5,23,14,2018,Non-Violent
11376861,07/11/2018 03:50:00 PM,THEFT,OVER $500,false,true,17,41.952474868,-87.77919919,2018-07-11T15:50:00.000+02:00,7,11,15,2018,Non-Violent
11336228,06/03/2018 07:50:00 PM,WEAPONS VIOLATION,UNLAWFUL USE HANDGUN,false,false,58,41.811272937,-87.696743415,2018-06-03T19:50:00.000+02:00,6,3,19,2018,Non-Violent
11391149,07/24/2018 06:45:00 PM,THEFT,$500 AND UNDER,false,false,6,41.934442799,-87.65452679,2018-07-24T18:45:00.000+02:00,7,24,18,2018,Non-Violent
11377203,07/10/2018 11:00:00 PM,DECEPTIVE PRACTICE,COUNTERFEITING DOCUMENT,false,false,32,41.884994019,-87.617390346,2018-07-10T23:00:00.000+02:00,7,10,23,2018,Non-Violent
11348894,06/15/2018 03:05:00 PM,ROBBERY,STRONGARM - NO WEAPON,false,false,37,41.80466668,-87.632497972,2018-06-15T15:05:00.000+02:00,6,15,15,2018,Violent
11259590,03/18/2018 10:30:00 AM,BATTERY,DOMESTIC BATTERY SIMPLE,false,true,71,41.744940618,-87.660158003,2018-03-18T10:30:00.000+02:00,3,18,10,2018,Violent
11260452,01/19/2018 09:00:00 PM,BURGLARY,FORCIBLE ENTRY,false,false,25,41.890152822,-87.752979049,2018-01-19T21:00:00.000+02:00,1,19,21,2018,Non-Violent
11396028,07/29/2018 03:24:00 PM,ASSAULT,SIMPLE,false,false,68,41.786017541,-87.648592655,2018-07-29T15:24:00.000+02:00,7,29,15,2018,Violent
11227813,02/10/2018 12:45:00 PM,THEFT,$500 AND UNDER,false,false,75,41.684789786,-87.6633151,2018-02-10T12:45:00.000+02:00,2,10,12,2018,Non-Violent
11232796,02/16/2018 07:30:00 PM,BATTERY,DOMESTIC BATTERY SIMPLE,false,true,67,41.793237052,-87.657276584,2018-02-16T19:30:00.000+02:00,2,16,19,2018,Violent
11313943,05/09/2018 10:35:00 PM,ROBBERY,ARMED: HANDGUN,false,false,19,41.931944535,-87.771130065,2018-05-09T22:35:00.000+02:00,5,9,22,2018,Violent
11259081,03/16/2018 06:45:00 PM,THEFT,FROM BUILDING,false,false,8,41.904932948,-87.635557213,2018-03-16T18:45:00.000+02:00,3,16,18,2018,Non-Violent
11306575,05/06/2018 11:35:00 AM,NARCOTICS,MANU/DELIVER: HEROIN (WHITE),true,false,27,41.88090842,-87.711736421,2018-05-06T11:35:00.000+02:00,5,6,11,2018,Non-Violent
11255711,03/14/2018 09:15:00 AM,ASSAULT,SIMPLE,false,false,66,41.772685171,-87.693228195,2018-03-14T09:15:00.000+02:00,3,14,9,2018,Violent
11389408,07/21/2018 02:30:00 PM,THEFT,POCKET-PICKING,false,false,6,41.947225886,-87.655545441,2018-07-21T14:30:00.000+02:00,7,21,14,2018,Non-Violent
11351949,06/18/2018 08:30:00 AM,ASSAULT,SIMPLE,false,false,8,41.901822321,-87.633071176,2018-06-18T08:30:00.000+02:00,6,18,8,2018,Violent
11344871,06/06/2018 01:00:00 AM,CRIMINAL SEXUAL ASSAULT,AGGRAVATED - HANDGUN,false,false,69,41.759464944,-87.633308893,2018-06-06T01:00:00.000+02:00,6,6,1,2018,Violent
11238107,02/23/2018 12:34:00 AM,OTHER OFFENSE,OTHER VEHICLE OFFENSE,false,false,32,41.875679322,-87.62657476,2018-02-23T00:34:00.000+02:00,2,23,0,2018,Non-Violent
11260681,03/18/2018 09:05:00 PM,BATTERY,AGGRAVATED: OTHER DANG WEAPON,false,false,19,41.921121293,-87.757287897,2018-03-18T21:05:00.000+02:00,3,18,21,2018,Violent
11258332,03/16/2018 08:28:00 PM,WEAPONS VIOLATION,POSS FIREARM/AMMO:NO FOID CARD,true,false,61,41.797545198,-87.67516843,2018-03-16T20:28:00.000+02:00,3,16,20,2018,Non-Violent
11385923,07/19/2018 09:22:00 PM,PROSTITUTION,OTHER PROSTITUTION OFFENSE,true,false,24,41.895700883,-87.690972853,2018-07-19T21:22:00.000+02:00,7,19,21,2018,Non-Violent
11365984,07/01/2018 02:56:00 PM,BATTERY,DOMESTIC BATTERY SIMPLE,true,true,71,41.755020104,-87.652645822,2018-07-01T14:56:00.000+02:00,7,1,14,2018,Violent
11246604,03/04/2018 10:27:00 AM,CRIMINAL TRESPASS,TO LAND,false,false,77,41.978991238,-87.659941972,2018-03-04T10:27:00.000+02:00,3,4,10,2018,Non-Violent
11345000,06/08/2018 12:00:00 PM,BATTERY,SIMPLE,false,false,75,41.689402074,-87.668824981,2018-06-08T12:00:00.000+02:00,6,8,12,2018,Violent
11287965,04/17/2018 03:45:00 PM,DECEPTIVE PRACTICE,CREDIT CARD FRAUD,false,false,46,41.742271198,-87.56000975,2018-04-17T15:45:00.000+02:00,4,17,15,2018,Non-Violent
11282610,04/11/2018 07:45:00 AM,BURGLARY,FORCIBLE ENTRY,false,false,6,41.935666755,-87.656391877,2018-04-11T07:45:00.000+02:00,4,11,7,2018,Non-Violent
11346240,06/09/2018 09:00:00 AM,MOTOR VEHICLE THEFT,AUTOMOBILE,false,false,25,41.876554708,-87.763317302,2018-06-09T09:00:00.000+02:00,6,9,9,2018,Non-Violent
11334452,05/27/2018 03:30:00 PM,BURGLARY,UNLAWFUL ENTRY,true,false,32,41.877687677,-87.628737441,2018-05-27T15:30:00.000+02:00,5,27,15,2018,Non-Violent
11290722,03/27/2018 08:00:00 PM,THEFT,$500 AND UNDER,false,true,31,41.852934738,-87.663629657,2018-03-27T20:00:00.000+02:00,3,27,20,2018,Non-Violent
11280935,04/09/2018 09:00:00 AM,ASSAULT,SIMPLE,false,false,25,41.880350767,-87.756872059,2018-04-09T09:00:00.000+02:00,4,9,9,2018,Violent
11310743,05/09/2018 02:00:00 PM,CRIMINAL DAMAGE,TO VEHICLE,false,false,43,41.756623356,-87.55303151,2018-05-09T14:00:00.000+02:00,5,9,14,2018,Non-Violent
11252426,02/24/2018 10:00:00 AM,NON-CRIMINAL,LOST PASSPORT,false,false,76,41.979006297,-87.906463155,2018-02-24T10:00:00.000+02:00,2,24,10,2018,Non-Violent
11252113,03/10/2018 07:00:00 AM,CRIMINAL DAMAGE,TO PROPERTY,false,true,24,41.89458743,-87.661365575,2018-03-10T07:00:00.000+02:00,3,10,7,2018,Non-Violent
11338643,06/06/2018 01:18:00 AM,THEFT,RETAIL THEFT,true,false,60,41.83805499,-87.645458414,2018-06-06T01:18:00.000+02:00,6,6,1,2018,Non-Violent
11313484,05/13/2018 01:00:00 AM,ROBBERY,STRONGARM - NO WEAPON,false,false,23,41.890703831,-87.70640419,2018-05-13T01:00:00.000+02:00,5,13,1,2018,Violent
11363133,06/28/2018 11:15:00 PM,ASSAULT,PRO EMP HANDS NO/MIN INJURY,true,false,42,41.781165519,-87.614432757,2018-06-28T23:15:00.000+02:00,6,28,23,2018,Violent
11392880,07/26/2018 12:00:00 PM,NARCOTICS,POSS: HEROIN(WHITE),true,false,23,41.892376532,-87.719885364,2018-07-26T12:00:00.000+02:00,7,26,12,2018,Non-Violent
11285002,04/10/2018 11:40:00 AM,THEFT,FROM BUILDING,false,false,22,41.919121284,-87.68579605,2018-04-10T11:40:00.000+02:00,4,10,11,2018,Non-Violent
11345592,06/12/2018 09:00:00 AM,CRIMINAL TRESPASS,TO LAND,false,false,66,41.760496065,-87.690472114,2018-06-12T09:00:00.000+02:00,6,12,9,2018,Non-Violent
11365293,06/30/2018 09:14:00 PM,BATTERY,SIMPLE,false,false,38,41.816085018,-87.623019008,2018-06-30T21:14:00.000+02:00,6,30,21,2018,Violent
11292717,01/01/2018 12:01:00 AM,OFFENSE INVOLVING CHILDREN,SEX ASSLT OF CHILD BY FAM MBR,false,true,3,41.974066268,-87.657754267,2018-01-01T00:01:00.000+02:00,1,1,0,2018,Non-Violent
11403708,08/05/2018 11:00:00 AM,NARCOTICS,MANU/DELIVER: HEROIN (WHITE),true,false,27,41.873765737,-87.699296047,2018-08-05T11:00:00.000+02:00,8,5,11,2018,Non-Violent
11393120,07/26/2018 05:30:00 PM,DECEPTIVE PRACTICE,FRAUD OR CONFIDENCE GAME,false,false,66,41.779182873,-87.683312156,2018-07-26T17:30:00.000+02:00,7,26,17,2018,Non-Violent
11390520,07/24/2018 12:20:00 PM,THEFT,ATTEMPT THEFT,false,false,7,41.92510186,-87.671992307,2018-07-24T12:20:00.000+02:00,7,24,12,2018,Non-Violent
11232596,02/14/2018 04:00:00 AM,BATTERY,DOMESTIC BATTERY SIMPLE,false,true,66,41.776245872,-87.6994106,2018-02-14T04:00:00.000+02:00,2,14,4,2018,Violent
11394763,07/28/2018 01:00:00 AM,BATTERY,AGGRAVATED - KNIFE / CUTTING INSTRUMENT,false,false,66,41.779202501,-87.687766548,2018-07-28T01:00:00.000+02:00,7,28,1,2018,Violent
11402859,08/04/2018 01:30:00 PM,THEFT,OVER $500,false,false,23,41.888784093,-87.716258161,2018-08-04T13:30:00.000+02:00,8,4,13,2018,Non-Violent
11320569,05/20/2018 12:00:00 AM,BATTERY,SIMPLE,false,false,15,41.942266661,-87.763559423,2018-05-20T00:00:00.000+02:00,5,20,0,2018,Violent
11380775,06/01/2018 12:01:00 AM,CRIM SEXUAL ASSAULT,PREDATORY,false,true,73,41.72802938,-87.662840357,2018-06-01T00:01:00.000+02:00,6,1,0,2018,Non-Violent
11349314,06/15/2018 05:51:00 AM,BATTERY,SIMPLE,false,false,17,41.945182323,-87.811153867,2018-06-15T05:51:00.000+02:00,6,15,5,2018,Violent
11251887,03/09/2018 08:40:00 PM,BATTERY,AGGRAVATED: OTHER FIREARM,true,false,49,41.698996618,-87.625674829,2018-03-09T20:40:00.000+02:00,3,9,20,2018,Violent
11399800,08/01/2018 04:15:00 PM,BATTERY,SIMPLE,false,true,31,41.846097772,-87.684488671,2018-08-01T16:15:00.000+02:00,8,1,16,2018,Violent
11296995,04/26/2018 11:05:00 PM,CRIMINAL SEXUAL ASSAULT,NON-AGGRAVATED,false,true,48,41.727237032,-87.573041151,2018-04-26T23:05:00.000+02:00,4,26,23,2018,Violent
11367399,07/02/2018 08:10:00 PM,BATTERY,SIMPLE,true,false,32,41.876587174,-87.628727499,2018-07-02T20:10:00.000+02:00,7,2,20,2018,Violent
11329108,05/19/2018 02:00:00 AM,THEFT,OVER $500,false,false,8,41.896561044,-87.636584978,2018-05-19T02:00:00.000+02:00,5,19,2,2018,Non-Violent
11234042,02/18/2018 04:45:00 PM,CRIMINAL DAMAGE,TO VEHICLE,false,false,33,41.849137532,-87.618249094,2018-02-18T16:45:00.000+02:00,2,18,16,2018,Non-Violent
11277016,04/03/2018 10:00:00 PM,OTHER OFFENSE,OTHER VEHICLE OFFENSE,false,true,29,41.865205115,-87.694604352,2018-04-03T22:00:00.000+02:00,4,3,22,2018,Non-Violent
11337514,06/04/2018 06:00:00 PM,WEAPONS VIOLATION,UNLAWFUL POSS OF HANDGUN,true,false,3,41.962698848,-87.64056018,2018-06-04T18:00:00.000+02:00,6,4,18,2018,Non-Violent
11253465,03/11/2018 04:10:00 PM,THEFT,$500 AND UNDER,false,false,8,41.907446122,-87.650070174,2018-03-11T16:10:00.000+02:00,3,11,16,2018,Non-Violent
11274989,04/03/2018 04:00:00 PM,ASSAULT,AGG PO HANDS NO/MIN INJURY,true,false,58,41.822562231,-87.694646782,2018-04-03T16:00:00.000+02:00,4,3,16,2018,Violent
11341075,06/07/2018 10:00:00 AM,BATTERY,SIMPLE,false,false,19,41.935428755,-87.783400598,2018-06-07T10:00:00.000+02:00,6,7,10,2018,Violent
11312209,05/11/2018 02:30:00 PM,ASSAULT,SIMPLE,false,false,29,41.860600554,-87.731760097,2018-05-11T14:30:00.000+02:00,5,11,14,2018,Violent
11311453,05/10/2018 02:00:00 AM,CRIMINAL DAMAGE,TO VEHICLE,true,false,23,41.899779248,-87.72377425,2018-05-10T02:00:00.000+02:00,5,10,2,2018,Non-Violent
11238126,02/22/2018 10:33:00 PM,ROBBERY,ATTEMPT: STRONGARM-NO WEAPON,false,false,1,42.019883291,-87.667150628,2018-02-22T22:33:00.000+02:00,2,22,22,2018,Violent
11264695,03/22/2018 05:00:00 PM,DECEPTIVE PRACTICE,FORGERY,false,false,49,41.694120148,-87.627939823,2018-03-22T17:00:00.000+02:00,3,22,17,2018,Non-Violent
11305661,05/05/2018 02:12:00 PM,THEFT,OVER $500,false,false,75,41.680418426,-87.662437948,2018-05-05T14:12:00.000+02:00,5,5,14,2018,Non-Violent
11319447,05/18/2018 06:30:00 PM,ASSAULT,AGGRAVATED:KNIFE/CUTTING INSTR,false,true,6,41.954294839,-87.668664955,2018-05-18T18:30:00.000+02:00,5,18,18,2018,Violent
11331787,05/30/2018 05:10:00 PM,ROBBERY,STRONGARM - NO WEAPON,false,false,28,41.871379501,-87.682837848,2018-05-30T17:10:00.000+02:00,5,30,17,2018,Violent
11376172,07/10/2018 08:30:00 PM,THEFT,RETAIL THEFT,true,false,32,41.878222138,-87.627288482,2018-07-10T20:30:00.000+02:00,7,10,20,2018,Non-Violent
11399698,07/26/2018 02:30:00 AM,CRIM SEXUAL ASSAULT,NON-AGGRAVATED,false,false,26,41.876798457,-87.730440547,2018-07-26T02:30:00.000+02:00,7,26,2,2018,Non-Violent
11337690,05/27/2018 05:00:00 PM,THEFT,$500 AND UNDER,false,false,32,41.878366498,-87.618242788,2018-05-27T17:00:00.000+02:00,5,27,17,2018,Non-Violent
11372716,07/07/2018 06:30:00 PM,BATTERY,SIMPLE,false,false,73,41.716960786,-87.638235272,2018-07-07T18:30:00.000+02:00,7,7,18,2018,Violent
11360073,06/26/2018 09:00:00 AM,CRIMINAL DAMAGE,TO PROPERTY,false,true,69,41.759332335,-87.634516183,2018-06-26T09:00:00.000+02:00,6,26,9,2018,Non-Violent
11256357,03/14/2018 04:15:00 PM,CRIMINAL TRESPASS,TO RESIDENCE,false,false,26,41.87046297,-87.720260149,2018-03-14T16:15:00.000+02:00,3,14,16,2018,Non-Violent
11368234,07/01/2018 01:00:00 PM,THEFT,$500 AND UNDER,false,true,71,41.734964951,-87.660610243,2018-07-01T13:00:00.000+02:00,7,1,13,2018,Non-Violent
11292434,04/22/2018 08:00:00 AM,CRIMINAL DAMAGE,TO VEHICLE,false,true,66,41.76156662,-87.708428858,2018-04-22T08:00:00.000+02:00,4,22,8,2018,Non-Violent
11313326,05/12/2018 07:40:00 PM,CRIMINAL DAMAGE,TO VEHICLE,false,false,75,41.692233255,-87.652715044,2018-05-12T19:40:00.000+02:00,5,12,19,2018,Non-Violent
11235769,02/20/2018 03:30:00 PM,THEFT,FROM BUILDING,false,false,8,41.895993005,-87.635683921,2018-02-20T15:30:00.000+02:00,2,20,15,2018,Non-Violent
11363973,06/29/2018 05:45:00 PM,DECEPTIVE PRACTICE,CREDIT CARD FRAUD,false,false,8,41.896888586,-87.628203192,2018-06-29T17:45:00.000+02:00,6,29,17,2018,Non-Violent
11228940,02/12/2018 04:25:00 PM,BATTERY,SIMPLE,true,false,43,41.767245969,-87.57632989,2018-02-12T16:25:00.000+02:00,2,12,16,2018,Violent
11250055,02/20/2018 03:00:00 PM,OTHER OFFENSE,TELEPHONE THREAT,false,false,19,41.916287654,-87.747319251,2018-02-20T15:00:00.000+02:00,2,20,15,2018,Non-Violent
11319711,05/19/2018 12:00:00 AM,THEFT,OVER $500,false,false,11,41.980004995,-87.770218355,2018-05-19T00:00:00.000+02:00,5,19,0,2018,Non-Violent
11236636,02/21/2018 08:50:00 AM,ASSAULT,SIMPLE,false,false,33,41.859815277,-87.623977927,2018-02-21T08:50:00.000+02:00,2,21,8,2018,Violent
11330011,05/27/2018 11:00:00 AM,BATTERY,DOMESTIC BATTERY SIMPLE,false,true,72,41.70907094,-87.689109597,2018-05-27T11:00:00.000+02:00,5,27,11,2018,Violent
11258567,03/17/2018 12:07:00 AM,BATTERY,DOMESTIC BATTERY SIMPLE,false,true,73,41.726212389,-87.662796973,2018-03-17T00:07:00.000+02:00,3,17,0,2018,Violent
11228630,02/12/2018 10:10:00 AM,NARCOTICS,POSS: CANNABIS 30GMS OR LESS,true,false,26,41.88460779,-87.73185811,2018-02-12T10:10:00.000+02:00,2,12,10,2018,Non-Violent
11247509,03/02/2018 05:30:00 PM,BURGLARY,UNLAWFUL ENTRY,false,false,28,41.876628223,-87.650053381,2018-03-02T17:30:00.000+02:00,3,2,17,2018,Non-Violent
11234228,02/18/2018 06:50:00 PM,NARCOTICS,MANU/DEL:CANNABIS OVER 10 GMS,true,false,38,41.806820652,-87.619526814,2018-02-18T18:50:00.000+02:00,2,18,18,2018,Non-Violent
11366837,03/30/2018 12:34:00 PM,NARCOTICS,MANU/DELIVER: HEROIN (WHITE),true,false,29,41.861757307,-87.716507075,2018-03-30T12:34:00.000+02:00,3,30,12,2018,Non-Violent
11304846,04/30/2018 11:00:00 PM,CRIM SEXUAL ASSAULT,NON-AGGRAVATED,false,false,8,41.896083132,-87.629765732,2018-04-30T23:00:00.000+02:00,4,30,23,2018,Non-Violent
11255976,03/13/2018 02:30:00 PM,BATTERY,SIMPLE,false,false,49,41.6979571,-87.631138505,2018-03-13T14:30:00.000+02:00,3,13,14,2018,Violent
11326369,05/25/2018 05:30:00 PM,ASSAULT,AGGRAVATED:KNIFE/CUTTING INSTR,false,true,73,41.730441843,-87.654927641,2018-05-25T17:30:00.000+02:00,5,25,17,2018,Violent
11278738,04/07/2018 02:30:00 PM,BATTERY,DOMESTIC BATTERY SIMPLE,false,true,69,41.768607797,-87.615335449,2018-04-07T14:30:00.000+02:00,4,7,14,2018,Violent
11396320,07/29/2018 06:45:00 PM,BATTERY,DOMESTIC BATTERY SIMPLE,false,true,25,41.879466846,-87.748136827,2018-07-29T18:45:00.000+02:00,7,29,18,2018,Violent
11336468,06/03/2018 11:15:00 PM,CRIMINAL DAMAGE,TO PROPERTY,false,false,68,41.76632455,-87.6541502,2018-06-03T23:15:00.000+02:00,6,3,23,2018,Non-Violent
11310927,05/10/2018 09:32:00 AM,BATTERY,DOMESTIC BATTERY SIMPLE,false,true,1,42.00916802,-87.663038372,2018-05-10T09:32:00.000+02:00,5,10,9,2018,Violent
11225672,02/08/2018 01:27:00 AM,CRIMINAL DAMAGE,TO PROPERTY,true,true,58,41.823676605,-87.695670327,2018-02-08T01:27:00.000+02:00,2,8,1,2018,Non-Violent
11365363,06/30/2018 09:50:00 PM,BATTERY,SIMPLE,false,false,16,41.950736661,-87.707930056,2018-06-30T21:50:00.000+02:00,6,30,21,2018,Violent
11333995,06/01/2018 03:00:00 PM,OFFENSE INVOLVING CHILDREN,OTHER OFFENSE,false,true,31,41.856711931,-87.679055131,2018-06-01T15:00:00.000+02:00,6,1,15,2018,Non-Violent
11232470,02/14/2018 01:00:00 PM,OTHER OFFENSE,HARASSMENT BY TELEPHONE,false,false,22,41.925399582,-87.714571533,2018-02-14T13:00:00.000+02:00,2,14,13,2018,Non-Violent
11397378,07/30/2018 12:30:00 PM,DECEPTIVE PRACTICE,CREDIT CARD FRAUD,false,false,23,41.902033059,-87.731206045,2018-07-30T12:30:00.000+02:00,7,30,12,2018,Non-Violent
11340669,06/07/2018 04:00:00 PM,OTHER OFFENSE,OTHER VEHICLE OFFENSE,false,true,29,41.870028132,-87.708823855,2018-06-07T16:00:00.000+02:00,6,7,16,2018,Non-Violent
11384717,07/18/2018 03:15:00 PM,ASSAULT,SIMPLE,false,true,70,41.749823255,-87.705321529,2018-07-18T15:15:00.000+02:00,7,18,15,2018,Violent
11364565,06/29/2018 11:00:00 PM,THEFT,$500 AND UNDER,false,false,30,41.841482234,-87.732992461,2018-06-29T23:00:00.000+02:00,6,29,23,2018,Non-Violent
11333378,06/01/2018 01:45:00 AM,ROBBERY,ARMED: HANDGUN,false,false,60,41.830840524,-87.639107097,2018-06-01T01:45:00.000+02:00,6,1,1,2018,Violent
11268600,03/27/2018 07:28:00 PM,OTHER OFFENSE,VEHICLE TITLE/REG OFFENSE,true,false,42,41.782081122,-87.615152161,2018-03-27T19:28:00.000+02:00,3,27,19,2018,Non-Violent
11325419,05/24/2018 08:18:00 PM,OTHER OFFENSE,GUN OFFENDER: DUTY TO REGISTER,true,false,43,41.752881737,-87.56262002,2018-05-24T20:18:00.000+02:00,5,24,20,2018,Non-Violent
11398012,07/22/2018 05:30:00 PM,THEFT,POCKET-PICKING,false,false,6,41.94631018,-87.654297987,2018-07-22T17:30:00.000+02:00,7,22,17,2018,Non-Violent
11326677,05/25/2018 10:30:00 AM,BURGLARY,FORCIBLE ENTRY,false,false,60,41.842692891,-87.639089089,2018-05-25T10:30:00.000+02:00,5,25,10,2018,Non-Violent
11287291,04/16/2018 09:55:00 PM,THEFT,OVER $500,false,false,22,41.925521214,-87.72190873,2018-04-16T21:55:00.000+02:00,4,16,21,2018,Non-Violent
11257497,03/15/2018 10:42:00 PM,THEFT,OVER $500,false,false,61,41.806253938,-87.664908299,2018-03-15T22:42:00.000+02:00,3,15,22,2018,Non-Violent
11249900,03/07/2018 09:15:00 PM,INTERFERENCE WITH PUBLIC OFFICER,OBSTRUCTING IDENTIFICATION,true,false,54,41.655620743,-87.616997925,2018-03-07T21:15:00.000+02:00,3,7,21,2018,Non-Violent
11267895,03/26/2018 09:00:00 PM,THEFT,$500 AND UNDER,false,false,72,41.702728034,-87.680706414,2018-03-26T21:00:00.000+02:00,3,26,21,2018,Non-Violent
11299395,04/29/2018 03:00:00 AM,DECEPTIVE PRACTICE,CREDIT CARD FRAUD,false,false,7,41.927850407,-87.648849255,2018-04-29T03:00:00.000+02:00,4,29,3,2018,Non-Violent
11361897,06/27/2018 12:30:00 PM,THEFT,OVER $500,false,true,65,41.784960495,-87.730271372,2018-06-27T12:30:00.000+02:00,6,27,12,2018,Non-Violent
11268174,03/27/2018 01:14:00 PM,OTHER OFFENSE,TELEPHONE THREAT,false,false,25,41.906550549,-87.755875985,2018-03-27T13:14:00.000+02:00,3,27,13,2018,Non-Violent
11255611,03/13/2018 08:00:00 PM,THEFT,$500 AND UNDER,false,false,49,41.69713283,-87.623831477,2018-03-13T20:00:00.000+02:00,3,13,20,2018,Non-Violent
11389359,07/23/2018 08:45:00 AM,BATTERY,DOMESTIC BATTERY SIMPLE,true,true,42,41.77404557,-87.603352878,2018-07-23T08:45:00.000+02:00,7,23,8,2018,Violent
11293734,04/23/2018 05:00:00 PM,THEFT,RETAIL THEFT,true,false,51,41.695908161,-87.595822806,2018-04-23T17:00:00.000+02:00,4,23,17,2018,Non-Violent
11364269,06/29/2018 11:00:00 PM,THEFT,$500 AND UNDER,false,false,51,41.698712958,-87.560751533,2018-06-29T23:00:00.000+02:00,6,29,23,2018,Non-Violent
11320208,05/18/2018 07:00:00 PM,DECEPTIVE PRACTICE,ILLEGAL USE CASH CARD,false,false,25,41.867299133,-87.773521484,2018-05-18T19:00:00.000+02:00,5,18,19,2018,Non-Violent
11311685,05/11/2018 02:00:00 AM,WEAPONS VIOLATION,RECKLESS FIREARM DISCHARGE,false,false,25,41.910158059,-87.760575352,2018-05-11T02:00:00.000+02:00,5,11,2,2018,Non-Violent
11267948,03/27/2018 09:55:00 AM,BATTERY,DOMESTIC BATTERY SIMPLE,false,true,17,41.950251564,-87.782519604,2018-03-27T09:55:00.000+02:00,3,27,9,2018,Violent
11302156,05/02/2018 05:30:00 AM,MOTOR VEHICLE THEFT,AUTOMOBILE,false,false,75,41.686135722,-87.655565362,2018-05-02T05:30:00.000+02:00,5,2,5,2018,Non-Violent
11392938,07/25/2018 01:00:00 AM,THEFT,$500 AND UNDER,false,false,46,41.751331332,-87.555309104,2018-07-25T01:00:00.000+02:00,7,25,1,2018,Non-Violent
11228683,02/12/2018 10:15:00 AM,OTHER OFFENSE,VIOLATE ORDER OF PROTECTION,true,true,49,41.688359857,-87.619505198,2018-02-12T10:15:00.000+02:00,2,12,10,2018,Non-Violent
11388422,07/22/2018 01:00:00 PM,THEFT,$500 AND UNDER,false,false,27,41.884859762,-87.695157785,2018-07-22T13:00:00.000+02:00,7,22,13,2018,Non-Violent
11350322,06/17/2018 02:30:00 AM,BATTERY,AGGRAVATED DOMESTIC BATTERY: OTHER DANG WEAPON,false,true,69,41.765071635,-87.616852081,2018-06-17T02:30:00.000+02:00,6,17,2,2018,Violent
11370783,07/05/2018 09:21:00 PM,BATTERY,DOMESTIC BATTERY SIMPLE,true,true,53,41.677513514,-87.615422762,2018-07-05T21:21:00.000+02:00,7,5,21,2018,Violent
11284729,04/09/2018 11:45:00 PM,THEFT,$500 AND UNDER,false,false,28,41.880108035,-87.647309981,2018-04-09T23:45:00.000+02:00,4,9,23,2018,Non-Violent
11338908,06/03/2018 01:00:00 AM,THEFT,OVER $500,true,false,65,41.768748315,-87.723725933,2018-06-03T01:00:00.000+02:00,6,3,1,2018,Non-Violent
11376307,06/05/2018 10:00:00 PM,DECEPTIVE PRACTICE,CREDIT CARD FRAUD,false,false,70,41.753500009,-87.699213004,2018-06-05T22:00:00.000+02:00,6,5,22,2018,Non-Violent
11293588,04/22/2018 07:10:00 PM,CRIMINAL TRESPASS,TO LAND,true,false,69,41.777503445,-87.615558861,2018-04-22T19:10:00.000+02:00,4,22,19,2018,Non-Violent
11327082,05/26/2018 12:45:00 PM,DECEPTIVE PRACTICE,THEFT OF LOST/MISLAID PROP,false,false,66,41.764709928,-87.682912101,2018-05-26T12:45:00.000+02:00,5,26,12,2018,Non-Violent
11338657,06/04/2018 10:00:00 PM,CRIMINAL DAMAGE,TO PROPERTY,false,false,32,41.873139387,-87.625438818,2018-06-04T22:00:00.000+02:00,6,4,22,2018,Non-Violent
11401759,08/03/2018 03:10:00 PM,BATTERY,DOMESTIC BATTERY SIMPLE,false,true,2,41.998281878,-87.687458979,2018-08-03T15:10:00.000+02:00,8,3,15,2018,Violent
11244025,03/01/2018 11:40:00 AM,CRIMINAL TRESPASS,TO LAND,false,false,6,41.946245192,-87.646601378,2018-03-01T11:40:00.000+02:00,3,1,11,2018,Non-Violent
11258457,03/17/2018 12:55:00 AM,CRIMINAL DAMAGE,TO PROPERTY,false,false,27,41.872118081,-87.713165416,2018-03-17T00:55:00.000+02:00,3,17,0,2018,Non-Violent
11242891,02/28/2018 12:30:00 AM,CRIMINAL DAMAGE,TO PROPERTY,false,false,15,41.939314951,-87.746876909,2018-02-28T00:30:00.000+02:00,2,28,0,2018,Non-Violent
11361149,06/27/2018 07:28:00 AM,CRIMINAL TRESPASS,TO LAND,true,false,34,41.827797157,-87.631434876,2018-06-27T07:28:00.000+02:00,6,27,7,2018,Non-Violent
11261364,03/20/2018 09:20:00 AM,BATTERY,SIMPLE,false,false,69,41.761660926,-87.596957994,2018-03-20T09:20:00.000+02:00,3,20,9,2018,Violent
11252468,03/06/2018 08:00:00 AM,THEFT,OVER $500,false,false,4,41.966224523,-87.680730331,2018-03-06T08:00:00.000+02:00,3,6,8,2018,Non-Violent
11273925,04/02/2018 02:40:00 PM,THEFT,RETAIL THEFT,false,false,6,41.93374417,-87.644581852,2018-04-02T14:40:00.000+02:00,4,2,14,2018,Non-Violent
11291165,04/20/2018 10:00:00 PM,CRIMINAL TRESPASS,TO LAND,false,false,8,41.888993854,-87.626934833,2018-04-20T22:00:00.000+02:00,4,20,22,2018,Non-Violent
11392503,07/26/2018 12:30:00 AM,THEFT,OVER $500,false,false,72,41.705588942,-87.682874768,2018-07-26T00:30:00.000+02:00,7,26,0,2018,Non-Violent
11276811,04/05/2018 09:38:00 AM,DECEPTIVE PRACTICE,CREDIT CARD FRAUD,false,false,69,41.766246905,-87.624932618,2018-04-05T09:38:00.000+02:00,4,5,9,2018,Non-Violent
11355850,06/22/2018 10:29:00 AM,ASSAULT,SIMPLE,true,false,22,41.917407385,-87.70579017,2018-06-22T10:29:00.000+02:00,6,22,10,2018,Violent
11325642,05/24/2018 05:00:00 PM,CRIMINAL DAMAGE,TO PROPERTY,false,false,51,41.712619895,-87.560969586,2018-05-24T17:00:00.000+02:00,5,24,17,2018,Non-Violent
11294815,04/24/2018 03:30:00 PM,BURGLARY,FORCIBLE ENTRY,false,false,23,41.89622626,-87.718776002,2018-04-24T15:30:00.000+02:00,4,24,15,2018,Non-Violent
11369324,07/04/2018 04:30:00 PM,THEFT,OVER $500,false,false,6,41.933025659,-87.653872945,2018-07-04T16:30:00.000+02:00,7,4,16,2018,Non-Violent
11291537,04/20/2018 06:00:00 AM,MOTOR VEHICLE THEFT,"THEFT/RECOVERY: TRUCK,BUS,MHOME",false,false,67,41.776830664,-87.675057643,2018-04-20T06:00:00.000+02:00,4,20,6,2018,Non-Violent
11345299,06/12/2018 08:50:00 AM,BATTERY,AGGRAVATED OF A CHILD,false,false,69,41.759782914,-87.605427789,2018-06-12T08:50:00.000+02:00,6,12,8,2018,Violent
11396438,07/29/2018 02:19:00 AM,BATTERY,SIMPLE,false,true,58,41.813003731,-87.69067732,2018-07-29T02:19:00.000+02:00,7,29,2,2018,Violent
11329375,05/28/2018 05:50:00 PM,ROBBERY,ARMED: HANDGUN,false,false,25,41.887973057,-87.773260229,2018-05-28T17:50:00.000+02:00,5,28,17,2018,Violent
11402250,08/04/2018 01:05:00 AM,THEFT,$500 AND UNDER,true,false,69,41.779059693,-87.615596501,2018-08-04T01:05:00.000+02:00,8,4,1,2018,Non-Violent
11239641,02/02/2018 09:00:00 AM,DECEPTIVE PRACTICE,ILLEGAL USE CASH CARD,false,false,73,41.72463337,-87.640874353,2018-02-02T09:00:00.000+02:00,2,2,9,2018,Non-Violent
11291728,01/09/2018 10:00:00 AM,OTHER OFFENSE,HARASSMENT BY ELECTRONIC MEANS,false,false,74,41.691424104,-87.709866104,2018-01-09T10:00:00.000+02:00,1,9,10,2018,Non-Violent
11265242,03/24/2018 05:00:00 AM,BATTERY,DOMESTIC BATTERY SIMPLE,false,true,8,41.892659231,-87.616599571,2018-03-24T05:00:00.000+02:00,3,24,5,2018,Violent
11330158,05/29/2018 11:30:00 AM,CRIMINAL DAMAGE,TO PROPERTY,false,false,28,41.883090343,-87.680137475,2018-05-29T11:30:00.000+02:00,5,29,11,2018,Non-Violent
11260237,03/19/2018 03:57:00 AM,ROBBERY,ARMED - HANDGUN,false,false,16,41.961282922,-87.738443258,2018-03-19T03:57:00.000+02:00,3,19,3,2018,Violent
11406261,08/07/2018 03:55:00 PM,BATTERY,SIMPLE,false,false,68,41.771594538,-87.638701525,2018-08-07T15:55:00.000+02:00,8,7,15,2018,Violent
11380278,07/14/2018 07:06:00 PM,CRIMINAL DAMAGE,TO PROPERTY,false,true,24,41.898427949,-87.69923948,2018-07-14T19:06:00.000+02:00,7,14,19,2018,Non-Violent
11333932,06/01/2018 10:49:00 AM,WEAPONS VIOLATION,UNLAWFUL POSS OF HANDGUN,true,false,68,41.771877151,-87.654300584,2018-06-01T10:49:00.000+02:00,6,1,10,2018,Non-Violent
11315864,05/12/2018 08:00:00 PM,CRIMINAL TRESPASS,TO LAND,false,false,25,41.920315481,-87.802471942,2018-05-12T20:00:00.000+02:00,5,12,20,2018,Non-Violent
11403541,08/05/2018 01:00:00 AM,THEFT,$500 AND UNDER,false,true,68,41.762519013,-87.64919809,2018-08-05T01:00:00.000+02:00,8,5,1,2018,Non-Violent
11251389,01/24/2018 11:00:00 AM,THEFT,FROM BUILDING,false,false,43,41.75888559,-87.575306614,2018-01-24T11:00:00.000+02:00,1,24,11,2018,Non-Violent
11345415,06/06/2018 03:00:00 PM,DECEPTIVE PRACTICE,CREDIT CARD FRAUD,false,false,69,41.754477263,-87.605282506,2018-06-06T15:00:00.000+02:00,6,6,15,2018,Non-Violent
11264696,03/23/2018 08:30:00 AM,BATTERY,SIMPLE,true,false,3,41.967895809,-87.650082791,2018-03-23T08:30:00.000+02:00,3,23,8,2018,Violent
11283879,04/13/2018 12:00:00 AM,BURGLARY,UNLAWFUL ENTRY,false,false,21,41.936769862,-87.715259183,2018-04-13T00:00:00.000+02:00,4,13,0,2018,Non-Violent
11302755,05/02/2018 05:00:00 PM,THEFT,$500 AND UNDER,false,false,49,41.721895856,-87.613841024,2018-05-02T17:00:00.000+02:00,5,2,17,2018,Non-Violent
11303765,05/02/2018 11:30:00 PM,THEFT,OVER $500,false,false,27,41.879268532,-87.694941688,2018-05-02T23:30:00.000+02:00,5,2,23,2018,Non-Violent
11245996,03/02/2018 02:30:00 PM,THEFT,OVER $500,false,false,25,41.902141421,-87.765958681,2018-03-02T14:30:00.000+02:00,3,2,14,2018,Non-Violent
11292451,04/21/2018 08:20:00 PM,THEFT,FROM BUILDING,false,false,8,41.897895128,-87.624096605,2018-04-21T20:20:00.000+02:00,4,21,20,2018,Non-Violent
11380249,07/14/2018 03:00:00 PM,THEFT,OVER $500,false,false,8,41.907056567,-87.634586291,2018-07-14T15:00:00.000+02:00,7,14,15,2018,Non-Violent
11233373,02/17/2018 05:00:00 PM,BATTERY,DOMESTIC BATTERY SIMPLE,false,true,30,41.851850721,-87.699406076,2018-02-17T17:00:00.000+02:00,2,17,17,2018,Violent
11267437,03/26/2018 03:00:00 PM,DECEPTIVE PRACTICE,CREDIT CARD FRAUD,false,false,8,41.894520607,-87.624240456,2018-03-26T15:00:00.000+02:00,3,26,15,2018,Non-Violent
11380768,07/12/2018 08:30:00 PM,MOTOR VEHICLE THEFT,"CYCLE, SCOOTER, BIKE W-VIN",false,false,6,41.93530386,-87.657211622,2018-07-12T20:30:00.000+02:00,7,12,20,2018,Non-Violent
11354063,06/20/2018 01:30:00 PM,BATTERY,DOMESTIC BATTERY SIMPLE,false,true,61,41.800686241,-87.644086795,2018-06-20T13:30:00.000+02:00,6,20,13,2018,Violent
11251654,03/09/2018 05:56:00 PM,BATTERY,DOMESTIC BATTERY SIMPLE,false,true,14,41.971154212,-87.708550409,2018-03-09T17:56:00.000+02:00,3,9,17,2018,Violent
11383262,07/17/2018 03:00:00 PM,CRIMINAL DAMAGE,TO VEHICLE,false,false,61,41.811401934,-87.666278027,2018-07-17T15:00:00.000+02:00,7,17,15,2018,Non-Violent
11244152,02/18/2018 02:23:00 PM,DECEPTIVE PRACTICE,ILLEGAL USE CASH CARD,false,false,19,41.923976215,-87.766294416,2018-02-18T14:23:00.000+02:00,2,18,14,2018,Non-Violent
11292728,04/22/2018 07:30:00 PM,ROBBERY,ARMED: HANDGUN,false,false,71,41.74095603,-87.652266736,2018-04-22T19:30:00.000+02:00,4,22,19,2018,Violent
11347369,06/14/2018 09:07:00 AM,BATTERY,SIMPLE,true,false,35,41.823798151,-87.619756522,2018-06-14T09:07:00.000+02:00,6,14,9,2018,Violent
11364526,06/26/2018 09:00:00 PM,THEFT,$500 AND UNDER,false,false,26,41.881858277,-87.724091496,2018-06-26T21:00:00.000+02:00,6,26,21,2018,Non-Violent
11384356,07/12/2018 10:00:00 AM,THEFT,$500 AND UNDER,false,false,20,41.919889619,-87.729083434,2018-07-12T10:00:00.000+02:00,7,12,10,2018,Non-Violent
11257813,01/08/2018 11:00:00 AM,OTHER OFFENSE,TELEPHONE THREAT,false,true,29,41.860012065,-87.720114032,2018-01-08T11:00:00.000+02:00,1,8,11,2018,Non-Violent
11242258,02/26/2018 12:00:00 PM,CRIMINAL TRESPASS,TO LAND,false,false,53,41.685095427,-87.641258195,2018-02-26T12:00:00.000+02:00,2,26,12,2018,Non-Violent
11317912,05/16/2018 09:45:00 PM,BATTERY,SIMPLE,false,false,71,41.737275576,-87.648517108,2018-05-16T21:45:00.000+02:00,5,16,21,2018,Violent
11329640,05/27/2018 02:00:00 AM,CRIMINAL DAMAGE,TO VEHICLE,false,false,6,41.953396801,-87.6614761,2018-05-27T02:00:00.000+02:00,5,27,2,2018,Non-Violent
11293476,04/23/2018 12:54:00 PM,ASSAULT,SIMPLE,false,false,71,41.734209915,-87.646633525,2018-04-23T12:54:00.000+02:00,4,23,12,2018,Violent
11288474,04/17/2018 07:30:00 PM,THEFT,$500 AND UNDER,false,false,49,41.68632222,-87.631316289,2018-04-17T19:30:00.000+02:00,4,17,19,2018,Non-Violent
11256413,03/14/2018 03:30:00 PM,ASSAULT,AGGRAVATED: OTHER DANG WEAPON,false,false,28,41.880239322,-87.662566142,2018-03-14T15:30:00.000+02:00,3,14,15,2018,Violent
11311567,05/10/2018 09:23:00 PM,BATTERY,SIMPLE,false,false,20,41.918099272,-87.731484927,2018-05-10T21:23:00.000+02:00,5,10,21,2018,Violent
11305727,05/05/2018 02:39:00 PM,WEAPONS VIOLATION,UNLAWFUL POSS OF HANDGUN,true,false,68,41.78330986,-87.650132087,2018-05-05T14:39:00.000+02:00,5,5,14,2018,Non-Violent
11247247,03/04/2018 08:00:00 PM,CRIMINAL DAMAGE,TO VEHICLE,false,false,14,41.967036336,-87.713323052,2018-03-04T20:00:00.000+02:00,3,4,20,2018,Non-Violent
11393437,07/26/2018 04:00:00 PM,BURGLARY,FORCIBLE ENTRY,false,false,16,41.941243201,-87.737104191,2018-07-26T16:00:00.000+02:00,7,26,16,2018,Non-Violent
11350403,06/17/2018 08:45:00 AM,BATTERY,DOMESTIC BATTERY SIMPLE,false,true,23,41.902576214,-87.732214795,2018-06-17T08:45:00.000+02:00,6,17,8,2018,Violent
11256532,03/13/2018 07:15:00 AM,BATTERY,DOMESTIC BATTERY SIMPLE,true,true,46,41.747514446,-87.575909455,2018-03-13T07:15:00.000+02:00,3,13,7,2018,Violent
11302393,05/02/2018 09:17:00 AM,CRIMINAL TRESPASS,TO STATE SUP LAND,true,false,42,41.780454612,-87.602235272,2018-05-02T09:17:00.000+02:00,5,2,9,2018,Non-Violent
11389171,07/23/2018 07:00:00 AM,CRIMINAL DAMAGE,TO PROPERTY,false,false,25,41.900999107,-87.768040532,2018-07-23T07:00:00.000+02:00,7,23,7,2018,Non-Violent
11367880,07/03/2018 10:15:00 AM,THEFT,OVER $500,true,false,8,41.896669722,-87.628760228,2018-07-03T10:15:00.000+02:00,7,3,10,2018,Non-Violent
11260362,03/19/2018 09:02:00 AM,ROBBERY,STRONGARM - NO WEAPON,false,false,6,41.954537863,-87.65114825,2018-03-19T09:02:00.000+02:00,3,19,9,2018,Violent
11236791,02/21/2018 03:50:00 PM,THEFT,OVER $500,false,false,8,41.898371341,-87.625222661,2018-02-21T15:50:00.000+02:00,2,21,15,2018,Non-Violent
11352466,06/19/2018 05:00:00 AM,CRIMINAL DAMAGE,TO VEHICLE,false,false,73,41.709028196,-87.654046801,2018-06-19T05:00:00.000+02:00,6,19,5,2018,Non-Violent
11315676,04/05/2018 09:00:00 AM,NARCOTICS,POSS: CANNABIS MORE THAN 30GMS,true,false,29,41.868180939,-87.709271389,2018-04-05T09:00:00.000+02:00,4,5,9,2018,Non-Violent
11325103,05/24/2018 02:30:00 PM,BATTERY,DOMESTIC BATTERY SIMPLE,false,true,61,41.808052976,-87.674675749,2018-05-24T14:30:00.000+02:00,5,24,14,2018,Violent
11250970,03/08/2018 12:40:00 AM,OTHER OFFENSE,TELEPHONE THREAT,false,true,25,41.893491529,-87.762075893,2018-03-08T00:40:00.000+02:00,3,8,0,2018,Non-Violent
11373084,07/08/2018 03:30:00 AM,BATTERY,DOMESTIC BATTERY SIMPLE,false,true,61,41.8022325,-87.662371745,2018-07-08T03:30:00.000+02:00,7,8,3,2018,Violent
11235763,02/14/2018 12:00:00 AM,CRIMINAL DAMAGE,TO VEHICLE,false,false,75,41.681781411,-87.672695972,2018-02-14T00:00:00.000+02:00,2,14,0,2018,Non-Violent
11255781,03/13/2018 06:00:00 PM,MOTOR VEHICLE THEFT,AUTOMOBILE,false,false,43,41.759691138,-87.584738713,2018-03-13T18:00:00.000+02:00,3,13,18,2018,Non-Violent
11375819,07/10/2018 12:46:00 PM,BATTERY,"AGGRAVATED P.O. - HANDS, FISTS, FEET, NO / MINOR INJURY",true,false,53,41.67443174,-87.616320857,2018-07-10T12:46:00.000+02:00,7,10,12,2018,Violent
11266042,03/24/2018 06:00:00 PM,BURGLARY,FORCIBLE ENTRY,false,false,42,41.78383109,-87.587449909,2018-03-24T18:00:00.000+02:00,3,24,18,2018,Non-Violent
11268065,03/22/2018 11:15:00 AM,THEFT,OVER $500,false,false,77,41.983538891,-87.665668558,2018-03-22T11:15:00.000+02:00,3,22,11,2018,Non-Violent
11231014,02/14/2018 07:30:00 PM,BATTERY,DOMESTIC BATTERY SIMPLE,false,true,43,41.756230175,-87.562678914,2018-02-14T19:30:00.000+02:00,2,14,19,2018,Violent
11227771,02/07/2018 11:45:00 PM,THEFT,PURSE-SNATCHING,false,false,38,41.812469009,-87.613910419,2018-02-07T23:45:00.000+02:00,2,7,23,2018,Non-Violent
11267154,03/26/2018 12:35:00 PM,CRIMINAL TRESPASS,TO RESIDENCE,false,true,27,41.88099198,-87.704402338,2018-03-26T12:35:00.000+02:00,3,26,12,2018,Non-Violent
11382378,07/16/2018 07:50:00 PM,BATTERY,DOMESTIC BATTERY SIMPLE,false,true,70,41.740730145,-87.69860949,2018-07-16T19:50:00.000+02:00,7,16,19,2018,Violent
11235235,02/19/2018 09:33:00 PM,CRIMINAL DAMAGE,TO VEHICLE,false,true,69,41.768602908,-87.632318787,2018-02-19T21:33:00.000+02:00,2,19,21,2018,Non-Violent
11367098,07/02/2018 05:00:00 PM,DECEPTIVE PRACTICE,CREDIT CARD FRAUD,false,false,32,41.879890416,-87.630832031,2018-07-02T17:00:00.000+02:00,7,2,17,2018,Non-Violent
11352086,06/17/2018 03:21:00 PM,OTHER OFFENSE,HARASSMENT BY TELEPHONE,false,false,25,41.911662113,-87.765591484,2018-06-17T15:21:00.000+02:00,6,17,15,2018,Non-Violent
11319315,05/18/2018 05:10:00 PM,ROBBERY,ARMED:KNIFE/CUTTING INSTRUMENT,false,false,27,41.88545291,-87.712246904,2018-05-18T17:10:00.000+02:00,5,18,17,2018,Violent
11333021,05/30/2018 08:00:00 PM,THEFT,FROM BUILDING,false,false,3,41.956751032,-87.652760684,2018-05-30T20:00:00.000+02:00,5,30,20,2018,Non-Violent
11322237,05/17/2018 05:00:00 PM,ASSAULT,SIMPLE,false,false,77,41.99159478,-87.660316773,2018-05-17T17:00:00.000+02:00,5,17,17,2018,Violent
11360827,06/26/2018 06:57:00 PM,BATTERY,DOMESTIC BATTERY SIMPLE,false,true,67,41.771486508,-87.672491175,2018-06-26T18:57:00.000+02:00,6,26,18,2018,Violent
11379323,07/12/2018 12:15:00 PM,BURGLARY,FORCIBLE ENTRY,false,false,45,41.741492236,-87.584096377,2018-07-12T12:15:00.000+02:00,7,12,12,2018,Non-Violent
11301852,04/28/2018 12:25:00 AM,ASSAULT,SIMPLE,true,true,15,41.950602094,-87.75285012,2018-04-28T00:25:00.000+02:00,4,28,0,2018,Violent
11236356,01/21/2018 12:30:00 AM,BATTERY,DOMESTIC BATTERY SIMPLE,false,true,29,41.864169598,-87.704380001,2018-01-21T00:30:00.000+02:00,1,21,0,2018,Violent
11405070,08/05/2018 03:00:00 AM,THEFT,$500 AND UNDER,false,false,20,41.925328679,-87.731696262,2018-08-05T03:00:00.000+02:00,8,5,3,2018,Non-Violent
11244211,02/28/2018 01:00:00 PM,ASSAULT,SIMPLE,false,false,28,41.881441785,-87.667837814,2018-02-28T13:00:00.000+02:00,2,28,13,2018,Violent
11341124,06/08/2018 08:00:00 AM,CRIMINAL DAMAGE,TO VEHICLE,false,false,56,41.791344555,-87.781769935,2018-06-08T08:00:00.000+02:00,6,8,8,2018,Non-Violent
11345241,06/11/2018 11:30:00 PM,MOTOR VEHICLE THEFT,AUTOMOBILE,false,false,25,41.877657178,-87.747899972,2018-06-11T23:30:00.000+02:00,6,11,23,2018,Non-Violent
11303439,05/02/2018 12:00:00 PM,DECEPTIVE PRACTICE,FRAUD OR CONFIDENCE GAME,false,false,28,41.880002373,-87.641134667,2018-05-02T12:00:00.000+02:00,5,2,12,2018,Non-Violent
11311085,05/10/2018 02:00:00 PM,THEFT,FROM BUILDING,false,false,8,41.896664035,-87.629175344,2018-05-10T14:00:00.000+02:00,5,10,14,2018,Non-Violent
11280937,04/10/2018 04:00:00 AM,CRIMINAL DAMAGE,TO PROPERTY,false,false,68,41.769756045,-87.646951053,2018-04-10T04:00:00.000+02:00,4,10,4,2018,Non-Violent
11292874,04/22/2018 11:01:00 PM,WEAPONS VIOLATION,UNLAWFUL POSS OF HANDGUN,true,false,75,41.697655764,-87.655451743,2018-04-22T23:01:00.000+02:00,4,22,23,2018,Non-Violent
11276038,04/04/2018 06:30:00 PM,DECEPTIVE PRACTICE,ILLEGAL USE CASH CARD,false,false,25,41.908412291,-87.762141267,2018-04-04T18:30:00.000+02:00,4,4,18,2018,Non-Violent
11325613,05/24/2018 10:30:00 PM,ROBBERY,AGGRAVATED,false,false,68,41.786846316,-87.629073,2018-05-24T22:30:00.000+02:00,5,24,22,2018,Violent
11250327,03/08/2018 12:00:00 PM,THEFT,$500 AND UNDER,false,false,68,41.768199866,-87.646923653,2018-03-08T12:00:00.000+02:00,3,8,12,2018,Non-Violent
11302046,05/01/2018 10:45:00 PM,ROBBERY,ARMED: HANDGUN,false,false,68,41.766458362,-87.65172216,2018-05-01T22:45:00.000+02:00,5,1,22,2018,Violent
11292952,04/22/2018 02:30:00 AM,BATTERY,AGGRAVATED DOMESTIC BATTERY: OTHER DANG WEAPON,true,true,58,41.822763321,-87.695771109,2018-04-22T02:30:00.000+02:00,4,22,2,2018,Violent
11337116,05/29/2018 09:00:00 AM,DECEPTIVE PRACTICE,FORGERY,false,false,28,41.882181424,-87.680036566,2018-05-29T09:00:00.000+02:00,5,29,9,2018,Non-Violent
11242648,02/27/2018 09:16:00 PM,NARCOTICS,POSS: CANNABIS 30GMS OR LESS,true,false,2,41.990438745,-87.700225173,2018-02-27T21:16:00.000+02:00,2,27,21,2018,Non-Violent
11309781,05/05/2018 10:00:00 AM,CRIMINAL DAMAGE,TO PROPERTY,false,false,1,42.015128925,-87.681235193,2018-05-05T10:00:00.000+02:00,5,5,10,2018,Non-Violent
11258481,03/17/2018 01:45:00 AM,THEFT,OVER $500,false,false,53,41.677553124,-87.660523954,2018-03-17T01:45:00.000+02:00,3,17,1,2018,Non-Violent
11224743,02/06/2018 09:05:00 PM,BATTERY,DOMESTIC BATTERY SIMPLE,false,true,71,41.739098268,-87.644921637,2018-02-06T21:05:00.000+02:00,2,6,21,2018,Violent
11257796,03/16/2018 07:02:00 AM,ASSAULT,SIMPLE,false,true,29,41.859826458,-87.721330884,2018-03-16T07:02:00.000+02:00,3,16,7,2018,Violent
11245316,03/02/2018 05:00:00 PM,THEFT,$500 AND UNDER,false,false,8,41.905033733,-87.64452317,2018-03-02T17:00:00.000+02:00,3,2,17,2018,Non-Violent
11312652,05/08/2018 11:00:00 PM,ROBBERY,STRONGARM - NO WEAPON,false,false,71,41.732357234,-87.656299678,2018-05-08T23:00:00.000+02:00,5,8,23,2018,Violent
11364658,06/30/2018 09:15:00 AM,ROBBERY,ATTEMPT: ARMED-HANDGUN,false,false,42,41.773087037,-87.608866374,2018-06-30T09:15:00.000+02:00,6,30,9,2018,Violent
11359658,06/25/2018 08:38:00 PM,BATTERY,AGGRAVATED: OTHER DANG WEAPON,false,false,40,41.789277593,-87.620150494,2018-06-25T20:38:00.000+02:00,6,25,20,2018,Violent
11230976,02/14/2018 09:00:00 PM,BATTERY,DOMESTIC BATTERY SIMPLE,false,true,43,41.76874464,-87.59024569,2018-02-14T21:00:00.000+02:00,2,14,21,2018,Violent
11226535,02/08/2018 07:00:00 PM,OTHER OFFENSE,HARASSMENT BY TELEPHONE,false,false,21,41.935914849,-87.703859325,2018-02-08T19:00:00.000+02:00,2,8,19,2018,Non-Violent
11351145,06/18/2018 02:16:00 AM,BATTERY,DOMESTIC BATTERY SIMPLE,true,true,56,41.808744843,-87.740740624,2018-06-18T02:16:00.000+02:00,6,18,2,2018,Violent
11381192,07/15/2018 07:59:00 PM,MOTOR VEHICLE THEFT,AUTOMOBILE,false,false,33,41.859982309,-87.620815406,2018-07-15T19:59:00.000+02:00,7,15,19,2018,Non-Violent
11323383,05/22/2018 03:30:00 PM,BATTERY,SIMPLE,false,false,35,41.823798151,-87.619756522,2018-05-22T15:30:00.000+02:00,5,22,15,2018,Violent
11313973,05/13/2018 05:50:00 PM,BATTERY,SIMPLE,true,false,25,41.884757997,-87.75522762,2018-05-13T17:50:00.000+02:00,5,13,17,2018,Violent
11265481,03/24/2018 02:30:00 PM,DECEPTIVE PRACTICE,STOLEN PROP: BUY/RECEIVE/POS.,false,false,29,41.856790413,-87.708424071,2018-03-24T14:30:00.000+02:00,3,24,14,2018,Non-Violent
11393586,07/25/2018 09:34:00 PM,ASSAULT,SIMPLE,false,false,2,41.997571982,-87.69892942,2018-07-25T21:34:00.000+02:00,7,25,21,2018,Violent
11371598,07/06/2018 04:51:00 PM,CRIMINAL TRESPASS,TO LAND,true,false,32,41.883500187,-87.627876698,2018-07-06T16:51:00.000+02:00,7,6,16,2018,Non-Violent
11392245,07/25/2018 07:42:00 PM,ASSAULT,AGGRAVATED: HANDGUN,false,false,21,41.94172452,-87.7211438,2018-07-25T19:42:00.000+02:00,7,25,19,2018,Violent
11258885,03/17/2018 02:40:00 PM,THEFT,OVER $500,false,false,24,41.911826672,-87.677496944,2018-03-17T14:40:00.000+02:00,3,17,14,2018,Non-Violent
11325240,05/24/2018 02:20:00 PM,BATTERY,SIMPLE,false,false,3,41.969080365,-87.655479287,2018-05-24T14:20:00.000+02:00,5,24,14,2018,Violent
11394263,07/27/2018 09:50:00 AM,THEFT,FROM BUILDING,false,false,32,41.86821682,-87.6304532,2018-07-27T09:50:00.000+02:00,7,27,9,2018,Non-Violent
11241873,02/27/2018 07:30:00 AM,CRIMINAL DAMAGE,TO VEHICLE,false,true,68,41.757421401,-87.642992266,2018-02-27T07:30:00.000+02:00,2,27,7,2018,Non-Violent
11378443,07/13/2018 12:14:00 AM,BATTERY,AGGRAVATED: HANDGUN,false,false,43,41.768920292,-87.576376188,2018-07-13T00:14:00.000+02:00,7,13,0,2018,Violent
11374382,07/09/2018 12:01:00 AM,BURGLARY,UNLAWFUL ENTRY,false,false,14,41.967397872,-87.721890876,2018-07-09T00:01:00.000+02:00,7,9,0,2018,Non-Violent
11270226,03/29/2018 01:35:00 AM,WEAPONS VIOLATION,UNLAWFUL USE HANDGUN,false,false,4,41.974887491,-87.69086176,2018-03-29T01:35:00.000+02:00,3,29,1,2018,Non-Violent
11271238,03/30/2018 12:57:00 PM,DECEPTIVE PRACTICE,FRAUD OR CONFIDENCE GAME,false,false,6,41.93467801,-87.653928911,2018-03-30T12:57:00.000+02:00,3,30,12,2018,Non-Violent
11269423,03/28/2018 12:10:00 PM,THEFT,OVER $500,false,false,8,41.908543264,-87.649977652,2018-03-28T12:10:00.000+02:00,3,28,12,2018,Non-Violent
11295560,04/25/2018 09:15:00 AM,NARCOTICS,SALE/DEL DRUG PARAPHERNALIA,true,false,69,41.764112658,-87.600129909,2018-04-25T09:15:00.000+02:00,4,25,9,2018,Non-Violent
11397722,07/31/2018 01:00:00 AM,THEFT,OVER $500,false,false,4,41.964810619,-87.694275948,2018-07-31T01:00:00.000+02:00,7,31,1,2018,Non-Violent
11265523,03/23/2018 11:00:00 PM,THEFT,$500 AND UNDER,false,false,8,41.889179438,-87.633040334,2018-03-23T23:00:00.000+02:00,3,23,23,2018,Non-Violent
11259277,03/17/2018 08:34:00 PM,OTHER OFFENSE,TELEPHONE THREAT,false,true,25,41.88113134,-87.768156926,2018-03-17T20:34:00.000+02:00,3,17,20,2018,Non-Violent
11311650,05/10/2018 11:45:00 PM,ROBBERY,STRONGARM - NO WEAPON,false,false,44,41.750702661,-87.612493314,2018-05-10T23:45:00.000+02:00,5,10,23,2018,Violent
11381000,07/15/2018 02:39:00 PM,BATTERY,DOMESTIC BATTERY SIMPLE,true,true,57,41.805286839,-87.72963332,2018-07-15T14:39:00.000+02:00,7,15,14,2018,Violent
11254004,03/11/2018 01:30:00 PM,THEFT,$500 AND UNDER,false,false,75,41.694805498,-87.681251524,2018-03-11T13:30:00.000+02:00,3,11,13,2018,Non-Violent
11294007,04/24/2018 01:50:00 AM,OTHER OFFENSE,FALSE/STOLEN/ALTERED TRP,true,false,75,41.693184393,-87.642405395,2018-04-24T01:50:00.000+02:00,4,24,1,2018,Non-Violent
11331234,05/29/2018 09:30:00 PM,THEFT,$500 AND UNDER,false,false,4,41.974262927,-87.684230156,2018-05-29T21:30:00.000+02:00,5,29,21,2018,Non-Violent
11286488,04/16/2018 08:36:00 AM,BURGLARY,UNLAWFUL ENTRY,true,false,5,41.944988881,-87.682498136,2018-04-16T08:36:00.000+02:00,4,16,8,2018,Non-Violent
11265034,03/23/2018 06:43:00 PM,BATTERY,DOMESTIC BATTERY SIMPLE,false,true,66,41.78564034,-87.688695643,2018-03-23T18:43:00.000+02:00,3,23,18,2018,Violent
11269883,03/28/2018 11:10:00 PM,BATTERY,SIMPLE,false,false,69,41.769185486,-87.625732415,2018-03-28T23:10:00.000+02:00,3,28,23,2018,Violent
11296389,01/27/2018 08:20:00 AM,NARCOTICS,MANU/DELIVER:CRACK,true,false,66,41.779234929,-87.68524012,2018-01-27T08:20:00.000+02:00,1,27,8,2018,Non-Violent
11337370,06/04/2018 05:52:00 PM,ASSAULT,AGGRAVATED:KNIFE/CUTTING INSTR,false,false,16,41.959894669,-87.719219814,2018-06-04T17:52:00.000+02:00,6,4,17,2018,Violent
11390037,07/23/2018 06:00:00 PM,CRIMINAL DAMAGE,TO VEHICLE,false,false,32,41.885384381,-87.629486511,2018-07-23T18:00:00.000+02:00,7,23,18,2018,Non-Violent
11394517,07/27/2018 07:50:00 PM,BATTERY,AGGRAVATED:KNIFE/CUTTING INSTR,false,false,43,41.754823635,-87.551092573,2018-07-27T19:50:00.000+02:00,7,27,19,2018,Violent
11396648,07/30/2018 04:12:00 AM,BATTERY,AGGRAVATED: OTHER DANG WEAPON,false,false,28,41.871479231,-87.676253661,2018-07-30T04:12:00.000+02:00,7,30,4,2018,Violent
11317485,05/16/2018 10:12:00 PM,BATTERY,SIMPLE,false,false,7,41.916806799,-87.653324872,2018-05-16T22:12:00.000+02:00,5,16,22,2018,Violent
11398528,07/31/2018 05:45:00 PM,THEFT,$500 AND UNDER,false,false,22,41.916084216,-87.669594341,2018-07-31T17:45:00.000+02:00,7,31,17,2018,Non-Violent
11406001,07/31/2018 01:00:00 PM,THEFT,$500 AND UNDER,false,false,76,41.976762981,-87.900983721,2018-07-31T13:00:00.000+02:00,7,31,13,2018,Non-Violent
11340794,06/07/2018 12:00:00 PM,THEFT,$500 AND UNDER,false,false,37,41.809125265,-87.631906508,2018-06-07T12:00:00.000+02:00,6,7,12,2018,Non-Violent
11275059,04/03/2018 03:16:00 PM,NARCOTICS,POSS: CANNABIS 30GMS OR LESS,true,false,71,41.756437359,-87.663589289,2018-04-03T15:16:00.000+02:00,4,3,15,2018,Non-Violent
11300851,04/30/2018 10:50:00 PM,BATTERY,DOMESTIC BATTERY SIMPLE,false,true,56,41.786585188,-87.766949365,2018-04-30T22:50:00.000+02:00,4,30,22,2018,Violent
11257770,03/15/2018 08:20:00 AM,CRIMINAL DAMAGE,TO VEHICLE,false,false,28,41.872332627,-87.679608149,2018-03-15T08:20:00.000+02:00,3,15,8,2018,Non-Violent
11406739,08/07/2018 10:56:00 PM,PUBLIC PEACE VIOLATION,FALSE POLICE REPORT,true,false,24,41.902200472,-87.680486394,2018-08-07T22:56:00.000+02:00,8,7,22,2018,Non-Violent
11242513,02/27/2018 09:00:00 AM,THEFT,FROM BUILDING,false,false,1,42.013892318,-87.667077,2018-02-27T09:00:00.000+02:00,2,27,9,2018,Non-Violent
11382311,07/14/2018 03:30:00 PM,CRIMINAL DAMAGE,TO VEHICLE,false,false,3,41.974146947,-87.65980913,2018-07-14T15:30:00.000+02:00,7,14,15,2018,Non-Violent
11259714,03/17/2018 02:00:00 AM,MOTOR VEHICLE THEFT,AUTOMOBILE,false,false,22,41.921388038,-87.678060444,2018-03-17T02:00:00.000+02:00,3,17,2,2018,Non-Violent
11246380,03/03/2018 11:50:00 PM,BATTERY,SIMPLE,false,false,28,41.881883933,-87.640060441,2018-03-03T23:50:00.000+02:00,3,3,23,2018,Violent
11246885,03/04/2018 04:20:00 PM,THEFT,$500 AND UNDER,false,false,25,41.915055232,-87.76417995,2018-03-04T16:20:00.000+02:00,3,4,16,2018,Non-Violent
11321687,05/21/2018 07:30:00 AM,THEFT,$500 AND UNDER,true,false,42,41.774945985,-87.586321063,2018-05-21T07:30:00.000+02:00,5,21,7,2018,Non-Violent
11364863,06/29/2018 09:45:00 AM,ROBBERY,ARMED: HANDGUN,false,false,67,41.783970683,-87.671604009,2018-06-29T09:45:00.000+02:00,6,29,9,2018,Violent
11379101,07/13/2018 11:56:00 AM,OTHER OFFENSE,VIOLATE ORDER OF PROTECTION,false,true,39,41.809297059,-87.591967028,2018-07-13T11:56:00.000+02:00,7,13,11,2018,Non-Violent
11389304,07/23/2018 06:15:00 AM,CRIMINAL DAMAGE,TO CITY OF CHICAGO PROPERTY,false,false,61,41.82319282,-87.668426668,2018-07-23T06:15:00.000+02:00,7,23,6,2018,Non-Violent
11309558,05/08/2018 07:30:00 PM,CRIMINAL DAMAGE,TO VEHICLE,false,false,24,41.89758755,-87.685356151,2018-05-08T19:30:00.000+02:00,5,8,19,2018,Non-Violent
11285833,03/26/2018 09:00:00 AM,CRIMINAL DAMAGE,TO PROPERTY,false,true,25,41.897501344,-87.771068626,2018-03-26T09:00:00.000+02:00,3,26,9,2018,Non-Violent
11292839,04/22/2018 06:58:00 PM,ASSAULT,SIMPLE,false,true,27,41.882024194,-87.69304878,2018-04-22T18:58:00.000+02:00,4,22,18,2018,Violent
11302372,05/02/2018 09:50:00 AM,BATTERY,AGGRAVATED: OTHER DANG WEAPON,false,false,27,41.880966348,-87.706741745,2018-05-02T09:50:00.000+02:00,5,2,9,2018,Violent
11332871,05/31/2018 03:20:00 PM,THEFT,$500 AND UNDER,false,false,43,41.758421765,-87.576133063,2018-05-31T15:20:00.000+02:00,5,31,15,2018,Non-Violent
11401919,08/03/2018 06:44:00 PM,NARCOTICS,POSS: CRACK,true,false,27,41.887078564,-87.701375268,2018-08-03T18:44:00.000+02:00,8,3,18,2018,Non-Violent
11256300,03/14/2018 07:57:00 PM,NARCOTICS,POSS: CANNABIS 30GMS OR LESS,true,false,29,41.861643436,-87.721383308,2018-03-14T19:57:00.000+02:00,3,14,19,2018,Non-Violent
11379694,07/14/2018 05:45:00 AM,BATTERY,DOMESTIC BATTERY SIMPLE,true,true,29,41.861740823,-87.716503562,2018-07-14T05:45:00.000+02:00,7,14,5,2018,Violent
11246510,03/04/2018 07:55:00 AM,DECEPTIVE PRACTICE,THEFT OF LABOR/SERVICES,false,false,14,41.970791478,-87.710984648,2018-03-04T07:55:00.000+02:00,3,4,7,2018,Non-Violent
11389677,07/22/2018 09:15:00 PM,ASSAULT,AGGRAVATED: HANDGUN,false,false,6,41.942935676,-87.649360582,2018-07-22T21:15:00.000+02:00,7,22,21,2018,Violent
11370482,07/02/2018 11:00:00 AM,BATTERY,AGGRAVATED OF A CHILD,false,true,28,41.863739949,-87.676167707,2018-07-02T11:00:00.000+02:00,7,2,11,2018,Violent
11231024,02/14/2018 08:22:00 PM,BATTERY,AGGRAVATED DOMESTIC BATTERY: OTHER DANG WEAPON,true,true,73,41.713518017,-87.63936748,2018-02-14T20:22:00.000+02:00,2,14,20,2018,Violent
11267628,03/26/2018 06:00:00 PM,ASSAULT,SIMPLE,false,false,67,41.764682386,-87.663785792,2018-03-26T18:00:00.000+02:00,3,26,18,2018,Violent
11245764,03/02/2018 01:58:00 PM,DECEPTIVE PRACTICE,COUNTERFEITING DOCUMENT,false,false,25,41.90215894,-87.764507548,2018-03-02T13:58:00.000+02:00,3,2,13,2018,Non-Violent
11340419,06/07/2018 02:45:00 PM,ASSAULT,SIMPLE,false,false,73,41.731144695,-87.66292886,2018-06-07T14:45:00.000+02:00,6,7,14,2018,Violent
11355696,06/22/2018 12:26:00 AM,WEAPONS VIOLATION,UNLAWFUL POSS OF HANDGUN,true,false,8,41.897546797,-87.626352062,2018-06-22T00:26:00.000+02:00,6,22,0,2018,Non-Violent
11237393,01/19/2018 01:00:00 PM,THEFT,FROM BUILDING,false,false,10,41.98287878,-87.791440835,2018-01-19T13:00:00.000+02:00,1,19,13,2018,Non-Violent
11306049,05/05/2018 06:30:00 PM,BATTERY,DOMESTIC BATTERY SIMPLE,false,true,23,41.898111443,-87.7249398,2018-05-05T18:30:00.000+02:00,5,5,18,2018,Violent
11272941,03/31/2018 11:00:00 AM,BURGLARY,FORCIBLE ENTRY,false,false,17,41.940799122,-87.802033757,2018-03-31T11:00:00.000+02:00,3,31,11,2018,Non-Violent
11327615,05/26/2018 11:15:00 PM,ROBBERY,STRONGARM - NO WEAPON,false,false,43,41.758066253,-87.563928742,2018-05-26T23:15:00.000+02:00,5,26,23,2018,Violent
11295302,04/25/2018 10:35:00 AM,CRIMINAL DAMAGE,TO VEHICLE,false,true,52,41.718855397,-87.537701542,2018-04-25T10:35:00.000+02:00,4,25,10,2018,Non-Violent
11234716,02/17/2018 09:00:00 AM,THEFT,$500 AND UNDER,false,false,69,41.765016282,-87.612827961,2018-02-17T09:00:00.000+02:00,2,17,9,2018,Non-Violent
11309857,05/09/2018 12:08:00 PM,BATTERY,AGG: HANDS/FIST/FEET NO/MINOR INJURY,true,false,68,41.779975054,-87.630937377,2018-05-09T12:08:00.000+02:00,5,9,12,2018,Violent
11236674,02/20/2018 11:51:00 AM,PUBLIC PEACE VIOLATION,BOMB THREAT,false,false,8,41.896765602,-87.622055873,2018-02-20T11:51:00.000+02:00,2,20,11,2018,Non-Violent
11400549,08/01/2018 06:00:00 PM,THEFT,$500 AND UNDER,false,false,29,41.86640116,-87.705973505,2018-08-01T18:00:00.000+02:00,8,1,18,2018,Non-Violent
11271180,03/30/2018 12:06:00 PM,THEFT,RETAIL THEFT,false,false,74,41.692563205,-87.70086269,2018-03-30T12:06:00.000+02:00,3,30,12,2018,Non-Violent
11399059,08/01/2018 02:30:00 AM,CRIMINAL DAMAGE,TO PROPERTY,false,false,30,41.840361342,-87.708576605,2018-08-01T02:30:00.000+02:00,8,1,2,2018,Non-Violent
11318831,05/16/2018 06:00:00 PM,CRIMINAL DAMAGE,CRIMINAL DEFACEMENT,false,false,66,41.777393312,-87.686666494,2018-05-16T18:00:00.000+02:00,5,16,18,2018,Non-Violent
11256237,03/13/2018 07:45:00 AM,CRIMINAL DAMAGE,TO VEHICLE,false,false,40,41.790575619,-87.606139277,2018-03-13T07:45:00.000+02:00,3,13,7,2018,Non-Violent
11315636,05/15/2018 08:12:00 AM,THEFT,OVER $500,false,false,26,41.87435219,-87.726057418,2018-05-15T08:12:00.000+02:00,5,15,8,2018,Non-Violent
11346241,06/12/2018 06:55:00 PM,DECEPTIVE PRACTICE,FINANCIAL IDENTITY THEFT $300 AND UNDER,false,false,67,41.760490199,-87.664917956,2018-06-12T18:55:00.000+02:00,6,12,18,2018,Non-Violent
11304381,05/03/2018 01:20:00 PM,ROBBERY,ARMED: HANDGUN,false,false,63,41.800468654,-87.687883221,2018-05-03T13:20:00.000+02:00,5,3,13,2018,Violent
11376260,07/11/2018 12:07:00 AM,NARCOTICS,POSS: CANNABIS MORE THAN 30GMS,true,false,67,41.777783594,-87.654887206,2018-07-11T00:07:00.000+02:00,7,11,0,2018,Non-Violent
11361575,06/27/2018 12:35:00 PM,DECEPTIVE PRACTICE,FORGERY,false,false,43,41.770986288,-87.582580182,2018-06-27T12:35:00.000+02:00,6,27,12,2018,Non-Violent
11377912,07/07/2018 12:10:00 AM,THEFT,$500 AND UNDER,false,false,67,41.778868505,-87.673896581,2018-07-07T00:10:00.000+02:00,7,7,0,2018,Non-Violent
11305409,05/04/2018 10:30:00 AM,ASSAULT,AGGRAVATED:KNIFE/CUTTING INSTR,false,true,67,41.784111601,-87.667968952,2018-05-04T10:30:00.000+02:00,5,4,10,2018,Violent
11290785,04/20/2018 12:00:00 PM,THEFT,FROM BUILDING,false,false,67,41.773275806,-87.66161048,2018-04-20T12:00:00.000+02:00,4,20,12,2018,Non-Violent
11260230,03/19/2018 04:30:00 AM,ROBBERY,ARMED: HANDGUN,false,false,14,41.964709376,-87.71844922,2018-03-19T04:30:00.000+02:00,3,19,4,2018,Violent
11322710,05/22/2018 08:52:00 AM,DECEPTIVE PRACTICE,ILLEGAL USE CASH CARD,false,false,68,41.77999793,-87.629294594,2018-05-22T08:52:00.000+02:00,5,22,8,2018,Non-Violent
11401516,08/03/2018 11:50:00 AM,PUBLIC PEACE VIOLATION,BOMB THREAT,false,false,8,41.907153315,-87.639680572,2018-08-03T11:50:00.000+02:00,8,3,11,2018,Non-Violent
11393094,07/26/2018 12:51:00 PM,THEFT,OVER $500,false,false,25,41.884803231,-87.757676681,2018-07-26T12:51:00.000+02:00,7,26,12,2018,Non-Violent
11368369,07/03/2018 06:00:00 PM,THEFT,$500 AND UNDER,false,false,21,41.939300539,-87.711794487,2018-07-03T18:00:00.000+02:00,7,3,18,2018,Non-Violent
11228237,02/11/2018 05:15:00 PM,THEFT,RETAIL THEFT,false,false,73,41.721194359,-87.663966368,2018-02-11T17:15:00.000+02:00,2,11,17,2018,Non-Violent
11273335,04/01/2018 04:27:00 AM,BATTERY,DOMESTIC BATTERY SIMPLE,false,true,9,42.000150753,-87.806768167,2018-04-01T04:27:00.000+02:00,4,1,4,2018,Violent
11279952,04/09/2018 04:08:00 AM,OTHER OFFENSE,TELEPHONE THREAT,false,false,38,41.815875001,-87.609162058,2018-04-09T04:08:00.000+02:00,4,9,4,2018,Non-Violent
11403820,08/05/2018 12:35:00 PM,NARCOTICS,POSS: CANNABIS MORE THAN 30GMS,true,false,66,41.778656405,-87.684846319,2018-08-05T12:35:00.000+02:00,8,5,12,2018,Non-Violent
11288464,04/18/2018 08:00:00 AM,NARCOTICS,POSS: HEROIN(WHITE),true,false,27,41.880933814,-87.709334595,2018-04-18T08:00:00.000+02:00,4,18,8,2018,Non-Violent
11355366,06/21/2018 06:11:00 PM,DECEPTIVE PRACTICE,ILLEGAL USE CASH CARD,false,false,8,41.891062111,-87.617043461,2018-06-21T18:11:00.000+02:00,6,21,18,2018,Non-Violent
11373876,07/08/2018 09:00:00 PM,BATTERY,DOMESTIC BATTERY SIMPLE,false,true,29,41.858283017,-87.723691271,2018-07-08T21:00:00.000+02:00,7,8,21,2018,Violent
11343719,06/11/2018 12:30:00 AM,CRIMINAL TRESPASS,TO LAND,true,false,49,41.700502156,-87.642634662,2018-06-11T00:30:00.000+02:00,6,11,0,2018,Non-Violent
11347867,06/14/2018 03:48:00 AM,THEFT,RETAIL THEFT,false,false,14,41.968234567,-87.728571616,2018-06-14T03:48:00.000+02:00,6,14,3,2018,Non-Violent
11360083,06/26/2018 10:25:00 AM,ASSAULT,SIMPLE,false,true,22,41.918607801,-87.707012974,2018-06-26T10:25:00.000+02:00,6,26,10,2018,Violent
11277805,04/05/2018 09:00:00 PM,BURGLARY,UNLAWFUL ENTRY,false,false,66,41.758536181,-87.68307707,2018-04-05T21:00:00.000+02:00,4,5,21,2018,Non-Violent
11317730,05/17/2018 05:50:00 AM,ASSAULT,SIMPLE,false,false,23,41.910538546,-87.732463394,2018-05-17T05:50:00.000+02:00,5,17,5,2018,Violent
11259785,03/18/2018 01:00:00 PM,BATTERY,SIMPLE,false,false,14,41.964757111,-87.713547384,2018-03-18T13:00:00.000+02:00,3,18,13,2018,Violent
11302738,04/26/2018 07:00:00 PM,ASSAULT,SIMPLE,false,false,53,41.670633685,-87.632354229,2018-04-26T19:00:00.000+02:00,4,26,19,2018,Violent
11262848,03/20/2018 09:00:00 PM,CRIMINAL DAMAGE,TO VEHICLE,false,false,71,41.738715873,-87.661923123,2018-03-20T21:00:00.000+02:00,3,20,21,2018,Non-Violent
11384798,07/18/2018 09:37:00 PM,BATTERY,AGGRAVATED: HANDGUN,false,false,22,41.920468501,-87.713608713,2018-07-18T21:37:00.000+02:00,7,18,21,2018,Violent
11405124,07/15/2018 09:00:00 AM,THEFT,FROM BUILDING,false,false,71,41.732123799,-87.641072346,2018-07-15T09:00:00.000+02:00,7,15,9,2018,Non-Violent
11260017,03/11/2018 08:00:00 AM,CRIMINAL DAMAGE,TO PROPERTY,false,false,71,41.749422306,-87.665842667,2018-03-11T08:00:00.000+02:00,3,11,8,2018,Non-Violent
11406796,08/08/2018 01:15:00 AM,BATTERY,SIMPLE,true,false,48,41.736796922,-87.594296314,2018-08-08T01:15:00.000+02:00,8,8,1,2018,Violent
11326529,05/22/2018 07:30:00 PM,THEFT,$500 AND UNDER,false,true,15,41.952853599,-87.749848235,2018-05-22T19:30:00.000+02:00,5,22,19,2018,Non-Violent
11312894,05/11/2018 07:00:00 PM,MOTOR VEHICLE THEFT,AUTOMOBILE,false,false,16,41.95421088,-87.722722794,2018-05-11T19:00:00.000+02:00,5,11,19,2018,Non-Violent
11384982,07/19/2018 12:44:00 AM,BATTERY,SIMPLE,false,false,46,41.751111693,-87.55773047,2018-07-19T00:44:00.000+02:00,7,19,0,2018,Violent
11236035,02/20/2018 05:37:00 PM,OTHER OFFENSE,LICENSE VIOLATION,false,false,40,41.783432002,-87.615701737,2018-02-20T17:37:00.000+02:00,2,20,17,2018,Non-Violent
11299012,04/28/2018 09:30:00 PM,MOTOR VEHICLE THEFT,AUTOMOBILE,false,false,6,41.939902161,-87.654715152,2018-04-28T21:30:00.000+02:00,4,28,21,2018,Non-Violent
11265925,03/24/2018 04:09:00 PM,CRIMINAL TRESPASS,TO LAND,false,false,3,41.966409353,-87.648852157,2018-03-24T16:09:00.000+02:00,3,24,16,2018,Non-Violent
11309844,04/25/2018 07:30:00 PM,CRIMINAL DAMAGE,TO PROPERTY,false,false,38,41.808384413,-87.618126623,2018-04-25T19:30:00.000+02:00,4,25,19,2018,Non-Violent
11259594,03/18/2018 01:00:00 AM,ROBBERY,STRONGARM - NO WEAPON,false,false,8,41.908176407,-87.634618163,2018-03-18T01:00:00.000+02:00,3,18,1,2018,Violent
11300364,04/29/2018 08:00:00 PM,THEFT,$500 AND UNDER,false,false,68,41.793889744,-87.648398856,2018-04-29T20:00:00.000+02:00,4,29,20,2018,Non-Violent
11355890,06/22/2018 11:01:00 AM,BATTERY,SIMPLE,true,false,43,41.772391355,-87.583839542,2018-06-22T11:01:00.000+02:00,6,22,11,2018,Violent
11266712,03/25/2018 09:45:00 PM,WEAPONS VIOLATION,UNLAWFUL POSS OF HANDGUN,true,false,25,41.894862444,-87.764043393,2018-03-25T21:45:00.000+02:00,3,25,21,2018,Non-Violent
11244308,03/01/2018 02:30:00 PM,CRIMINAL TRESPASS,TO LAND,true,false,32,41.876607964,-87.627644063,2018-03-01T14:30:00.000+02:00,3,1,14,2018,Non-Violent
11314772,05/14/2018 02:15:00 PM,ASSAULT,SIMPLE,false,false,1,42.007961462,-87.662719889,2018-05-14T14:15:00.000+02:00,5,14,14,2018,Violent
11354076,06/20/2018 02:37:00 PM,CRIMINAL DAMAGE,TO PROPERTY,false,false,25,41.90938466,-87.765089988,2018-06-20T14:37:00.000+02:00,6,20,14,2018,Non-Violent
11375761,07/10/2018 10:00:00 AM,MOTOR VEHICLE THEFT,"CYCLE, SCOOTER, BIKE W-VIN",false,false,15,41.949699362,-87.752873014,2018-07-10T10:00:00.000+02:00,7,10,10,2018,Non-Violent
11347057,06/13/2018 08:29:00 PM,THEFT,OVER $500,false,false,29,41.862531403,-87.724260317,2018-06-13T20:29:00.000+02:00,6,13,20,2018,Non-Violent
11226839,02/09/2018 08:30:00 AM,CRIMINAL DAMAGE,TO VEHICLE,false,false,28,41.878232347,-87.68388831,2018-02-09T08:30:00.000+02:00,2,9,8,2018,Non-Violent
11332222,05/22/2018 10:00:00 PM,DECEPTIVE PRACTICE,ILLEGAL USE CASH CARD,false,false,28,41.869315289,-87.663176006,2018-05-22T22:00:00.000+02:00,5,22,22,2018,Non-Violent
11315381,05/12/2018 08:00:00 PM,BATTERY,DOMESTIC BATTERY SIMPLE,false,true,29,41.853176323,-87.724796887,2018-05-12T20:00:00.000+02:00,5,12,20,2018,Violent
11353203,06/16/2018 07:50:00 PM,THEFT,OVER $500,false,false,32,41.885909437,-87.630979095,2018-06-16T19:50:00.000+02:00,6,16,19,2018,Non-Violent
11392259,07/25/2018 06:16:00 PM,BATTERY,DOMESTIC BATTERY SIMPLE,false,true,25,41.884871908,-87.752784467,2018-07-25T18:16:00.000+02:00,7,25,18,2018,Violent
11301560,04/24/2018 12:00:00 PM,DECEPTIVE PRACTICE,BOGUS CHECK,false,false,28,41.881883933,-87.640060441,2018-04-24T12:00:00.000+02:00,4,24,12,2018,Non-Violent
11388964,07/23/2018 02:04:00 AM,OTHER OFFENSE,OTHER WEAPONS VIOLATION,true,false,69,41.758161103,-87.629218121,2018-07-23T02:04:00.000+02:00,7,23,2,2018,Non-Violent
11366363,07/01/2018 11:48:00 PM,NARCOTICS,POSS: COCAINE,true,false,20,41.917631709,-87.730240077,2018-07-01T23:48:00.000+02:00,7,1,23,2018,Non-Violent
11373869,07/08/2018 08:35:00 PM,BATTERY,AGGRAVATED: HANDGUN,false,false,67,41.765708956,-87.674262285,2018-07-08T20:35:00.000+02:00,7,8,20,2018,Violent
11298511,04/28/2018 03:39:00 PM,NARCOTICS,POSS: CANNABIS MORE THAN 30GMS,true,false,26,41.880741173,-87.724572141,2018-04-28T15:39:00.000+02:00,4,28,15,2018,Non-Violent
11312305,05/11/2018 03:44:00 PM,CRIMINAL TRESPASS,TO LAND,true,false,25,41.903965244,-87.764627434,2018-05-11T15:44:00.000+02:00,5,11,15,2018,Non-Violent
11322310,05/21/2018 08:10:00 PM,INTERFERENCE WITH PUBLIC OFFICER,OBSTRUCTING IDENTIFICATION,true,false,49,41.704662765,-87.628209119,2018-05-21T20:10:00.000+02:00,5,21,20,2018,Non-Violent
11292272,04/22/2018 02:00:00 AM,CRIMINAL DAMAGE,TO VEHICLE,false,false,5,41.956035556,-87.675010798,2018-04-22T02:00:00.000+02:00,4,22,2,2018,Non-Violent
11313718,05/13/2018 05:00:00 AM,OTHER OFFENSE,HARASSMENT BY ELECTRONIC MEANS,false,false,21,41.932029777,-87.708013605,2018-05-13T05:00:00.000+02:00,5,13,5,2018,Non-Violent
11293448,04/23/2018 02:00:00 PM,CRIMINAL DAMAGE,TO PROPERTY,false,false,15,41.957346677,-87.779370225,2018-04-23T14:00:00.000+02:00,4,23,14,2018,Non-Violent
11319513,05/18/2018 05:50:00 PM,THEFT,$500 AND UNDER,false,true,29,41.863717908,-87.703081168,2018-05-18T17:50:00.000+02:00,5,18,17,2018,Non-Violent
11303159,05/03/2018 12:10:00 AM,THEFT,RETAIL THEFT,false,false,28,41.867251542,-87.639594427,2018-05-03T00:10:00.000+02:00,5,3,0,2018,Non-Violent
11340877,06/08/2018 12:20:00 AM,BURGLARY,UNLAWFUL ENTRY,false,false,30,41.851808154,-87.702141,2018-06-08T00:20:00.000+02:00,6,8,0,2018,Non-Violent
11292441,04/22/2018 12:43:00 PM,NARCOTICS,POSS: CANNABIS 30GMS OR LESS,true,false,52,41.70274621,-87.53809059,2018-04-22T12:43:00.000+02:00,4,22,12,2018,Non-Violent
11333252,05/31/2018 10:00:00 PM,ASSAULT,AGGRAVATED: OTHER DANG WEAPON,true,false,27,41.882837304,-87.702118463,2018-05-31T22:00:00.000+02:00,5,31,22,2018,Violent
11314971,05/14/2018 04:00:00 PM,THEFT,RETAIL THEFT,true,false,48,41.734547924,-87.585594973,2018-05-14T16:00:00.000+02:00,5,14,16,2018,Non-Violent
11240989,02/26/2018 02:15:00 AM,BATTERY,AGGRAVATED DOMESTIC BATTERY: KNIFE/CUTTING INST,true,true,43,41.752950248,-87.554061838,2018-02-26T02:15:00.000+02:00,2,26,2,2018,Violent
11327137,05/23/2018 07:13:00 AM,CRIMINAL DAMAGE,TO CITY OF CHICAGO PROPERTY,false,false,62,41.785312103,-87.738760112,2018-05-23T07:13:00.000+02:00,5,23,7,2018,Non-Violent
11327397,05/26/2018 06:45:00 PM,BATTERY,DOMESTIC BATTERY SIMPLE,true,true,46,41.734899916,-87.555525763,2018-05-26T18:45:00.000+02:00,5,26,18,2018,Violent
11375626,07/10/2018 09:50:00 AM,THEFT,FROM BUILDING,false,false,25,41.894195047,-87.775112112,2018-07-10T09:50:00.000+02:00,7,10,9,2018,Non-Violent
11319372,05/16/2018 09:00:00 PM,THEFT,$500 AND UNDER,false,false,6,41.953297273,-87.667473173,2018-05-16T21:00:00.000+02:00,5,16,21,2018,Non-Violent
11382793,07/17/2018 07:05:00 AM,THEFT,$500 AND UNDER,false,false,28,41.874953063,-87.690244345,2018-07-17T07:05:00.000+02:00,7,17,7,2018,Non-Violent
11363205,06/29/2018 01:35:00 AM,NARCOTICS,POSS: HALLUCINOGENS,true,false,27,41.874854078,-87.719803273,2018-06-29T01:35:00.000+02:00,6,29,1,2018,Non-Violent
11382110,07/03/2018 11:15:00 AM,DECEPTIVE PRACTICE,BOGUS CHECK,false,false,32,41.878178813,-87.628276721,2018-07-03T11:15:00.000+02:00,7,3,11,2018,Non-Violent
11231046,02/14/2018 10:55:00 PM,THEFT,RETAIL THEFT,true,false,25,41.909614875,-87.747016581,2018-02-14T22:55:00.000+02:00,2,14,22,2018,Non-Violent
11325896,05/23/2018 03:45:00 PM,BATTERY,AGG PRO EMP HANDS SERIOUS INJ,false,false,68,41.784797052,-87.647333315,2018-05-23T15:45:00.000+02:00,5,23,15,2018,Violent
11331675,05/30/2018 04:53:00 PM,THEFT,RETAIL THEFT,false,false,43,41.757457948,-87.586106086,2018-05-30T16:53:00.000+02:00,5,30,16,2018,Non-Violent
11364502,06/29/2018 04:45:00 PM,THEFT,RETAIL THEFT,true,false,69,41.765558228,-87.622733535,2018-06-29T16:45:00.000+02:00,6,29,16,2018,Non-Violent
11334231,05/06/2018 08:00:00 PM,KIDNAPPING,CHILD ABDUCTION/STRANGER,false,true,68,41.770210385,-87.641715094,2018-05-06T20:00:00.000+02:00,5,6,20,2018,Violent
11400318,08/01/2018 08:20:00 PM,THEFT,$500 AND UNDER,false,true,25,41.882279032,-87.762175778,2018-08-01T20:20:00.000+02:00,8,1,20,2018,Non-Violent
11361591,06/27/2018 04:00:00 PM,ASSAULT,SIMPLE,false,false,4,41.96571152,-87.692450503,2018-06-27T16:00:00.000+02:00,6,27,16,2018,Violent
11303481,05/03/2018 11:50:00 AM,OTHER OFFENSE,TELEPHONE THREAT,false,true,66,41.758888273,-87.681768714,2018-05-03T11:50:00.000+02:00,5,3,11,2018,Non-Violent
11240373,02/25/2018 09:00:00 AM,OTHER OFFENSE,TELEPHONE THREAT,false,false,16,41.956804837,-87.699554499,2018-02-25T09:00:00.000+02:00,2,25,9,2018,Non-Violent
11333841,05/25/2018 06:25:00 PM,OTHER OFFENSE,VIOLATE ORDER OF PROTECTION,false,true,6,41.94727404,-87.652552714,2018-05-25T18:25:00.000+02:00,5,25,18,2018,Non-Violent
11307367,05/06/2018 11:00:00 PM,THEFT,$500 AND UNDER,false,false,26,41.878737741,-87.736572949,2018-05-06T23:00:00.000+02:00,5,6,23,2018,Non-Violent
11373391,07/07/2018 11:00:00 PM,MOTOR VEHICLE THEFT,AUTOMOBILE,false,false,69,41.757770586,-87.606608702,2018-07-07T23:00:00.000+02:00,7,7,23,2018,Non-Violent
11392075,06/24/2018 12:00:00 AM,THEFT,$500 AND UNDER,false,false,40,41.792342253,-87.624025622,2018-06-24T00:00:00.000+02:00,6,24,0,2018,Non-Violent
11404435,08/05/2018 10:19:00 PM,THEFT,$500 AND UNDER,false,false,32,41.884335468,-87.619164088,2018-08-05T22:19:00.000+02:00,8,5,22,2018,Non-Violent
11321697,05/21/2018 12:00:00 AM,OTHER OFFENSE,TELEPHONE THREAT,false,false,25,41.891282784,-87.772169896,2018-05-21T00:00:00.000+02:00,5,21,0,2018,Non-Violent
11276442,04/04/2018 06:00:00 PM,THEFT,OVER $500,false,false,57,41.806950719,-87.723558305,2018-04-04T18:00:00.000+02:00,4,4,18,2018,Non-Violent
11376761,07/11/2018 02:21:00 PM,DECEPTIVE PRACTICE,ATTEMPT - FINANCIAL IDENTITY THEFT,false,false,25,41.874125824,-87.74370601,2018-07-11T14:21:00.000+02:00,7,11,14,2018,Non-Violent
11349137,06/15/2018 05:56:00 PM,WEAPONS VIOLATION,UNLAWFUL POSS OTHER FIREARM,false,false,26,41.86985561,-87.721639097,2018-06-15T17:56:00.000+02:00,6,15,17,2018,Non-Violent
11310374,05/04/2018 05:15:00 AM,ARSON,BY FIRE,false,false,61,41.794953997,-87.664611327,2018-05-04T05:15:00.000+02:00,5,4,5,2018,Non-Violent
11307567,05/07/2018 12:26:00 PM,CRIMINAL TRESPASS,TO LAND,true,false,29,41.866235446,-87.720517147,2018-05-07T12:26:00.000+02:00,5,7,12,2018,Non-Violent
11253660,03/10/2018 12:53:00 PM,THEFT,$500 AND UNDER,false,false,7,41.923962671,-87.646689724,2018-03-10T12:53:00.000+02:00,3,10,12,2018,Non-Violent
11361918,06/27/2018 07:30:00 PM,THEFT,FROM BUILDING,false,false,33,41.865024598,-87.624096564,2018-06-27T19:30:00.000+02:00,6,27,19,2018,Non-Violent
11378816,07/13/2018 10:30:00 AM,BATTERY,AGGRAVATED:KNIFE/CUTTING INSTR,false,false,25,41.899051718,-87.754474276,2018-07-13T10:30:00.000+02:00,7,13,10,2018,Violent
11292399,04/21/2018 11:00:00 PM,ROBBERY,STRONGARM - NO WEAPON,false,false,21,41.939932925,-87.718646877,2018-04-21T23:00:00.000+02:00,4,21,23,2018,Violent
11355565,06/21/2018 07:05:00 PM,DECEPTIVE PRACTICE,CREDIT CARD FRAUD,false,false,8,41.8945086,-87.622742041,2018-06-21T19:05:00.000+02:00,6,21,19,2018,Non-Violent
11248693,03/06/2018 05:08:00 PM,NARCOTICS,POSS: CANNABIS 30GMS OR LESS,true,false,66,41.78018541,-87.703170178,2018-03-06T17:08:00.000+02:00,3,6,17,2018,Non-Violent
11261085,03/17/2018 11:00:00 AM,BATTERY,SIMPLE,false,false,32,41.884335468,-87.619164088,2018-03-17T11:00:00.000+02:00,3,17,11,2018,Violent
11307989,05/07/2018 10:30:00 AM,BURGLARY,UNLAWFUL ENTRY,false,false,13,41.985556978,-87.713834875,2018-05-07T10:30:00.000+02:00,5,7,10,2018,Non-Violent
11276525,04/05/2018 03:00:00 AM,CRIMINAL DAMAGE,TO PROPERTY,false,false,1,42.022062685,-87.67484904,2018-04-05T03:00:00.000+02:00,4,5,3,2018,Non-Violent
11256766,03/15/2018 10:00:00 AM,BATTERY,DOMESTIC BATTERY SIMPLE,false,true,53,41.677605515,-87.656826249,2018-03-15T10:00:00.000+02:00,3,15,10,2018,Violent
11277489,04/06/2018 01:00:00 AM,DECEPTIVE PRACTICE,CREDIT CARD FRAUD,false,false,8,41.889561428,-87.620196651,2018-04-06T01:00:00.000+02:00,4,6,1,2018,Non-Violent
11391435,07/12/2018 06:00:00 PM,DECEPTIVE PRACTICE,"THEFT BY LESSEE,MOTOR VEH",false,false,15,41.959125819,-87.747485772,2018-07-12T18:00:00.000+02:00,7,12,18,2018,Non-Violent
11272804,04/01/2018 12:00:00 PM,OTHER OFFENSE,OTHER VEHICLE OFFENSE,true,false,23,41.910530882,-87.72268738,2018-04-01T12:00:00.000+02:00,4,1,12,2018,Non-Violent
11383811,07/17/2018 09:30:00 PM,BATTERY,DOMESTIC BATTERY SIMPLE,false,true,44,41.736126864,-87.629184056,2018-07-17T21:30:00.000+02:00,7,17,21,2018,Violent
11323280,05/22/2018 05:47:00 PM,NARCOTICS,POSS: CANNABIS 30GMS OR LESS,true,false,23,41.905617196,-87.723953828,2018-05-22T17:47:00.000+02:00,5,22,17,2018,Non-Violent
11275529,04/03/2018 09:53:00 PM,OTHER OFFENSE,HARASSMENT BY TELEPHONE,false,false,72,41.704145855,-87.659609593,2018-04-03T21:53:00.000+02:00,4,3,21,2018,Non-Violent
11294776,04/24/2018 04:30:00 PM,THEFT,OVER $500,false,false,63,41.793545571,-87.701843839,2018-04-24T16:30:00.000+02:00,4,24,16,2018,Non-Violent
11342818,06/09/2018 01:58:00 PM,BATTERY,SIMPLE,false,true,47,41.727013209,-87.598537052,2018-06-09T13:58:00.000+02:00,6,9,13,2018,Violent
11400734,08/02/2018 08:00:00 AM,BURGLARY,UNLAWFUL ENTRY,false,false,25,41.88116427,-87.768156635,2018-08-02T08:00:00.000+02:00,8,2,8,2018,Non-Violent
11363064,06/28/2018 04:45:00 PM,THEFT,$500 AND UNDER,false,false,6,41.93467801,-87.653928911,2018-06-28T16:45:00.000+02:00,6,28,16,2018,Non-Violent
11387314,07/12/2018 10:00:00 AM,DECEPTIVE PRACTICE,CREDIT CARD FRAUD,false,false,69,41.760060669,-87.624392233,2018-07-12T10:00:00.000+02:00,7,12,10,2018,Non-Violent
11311370,04/27/2018 07:00:00 AM,CRIMINAL DAMAGE,TO VEHICLE,false,false,49,41.688882891,-87.628659715,2018-04-27T07:00:00.000+02:00,4,27,7,2018,Non-Violent
11268048,03/27/2018 09:54:00 AM,BATTERY,DOMESTIC BATTERY SIMPLE,false,true,41,41.797909788,-87.603338833,2018-03-27T09:54:00.000+02:00,3,27,9,2018,Violent
11338387,06/05/2018 05:24:00 PM,ASSAULT,SIMPLE,false,false,33,41.851949553,-87.618995915,2018-06-05T17:24:00.000+02:00,6,5,17,2018,Violent
11298157,04/27/2018 10:00:00 AM,BATTERY,DOMESTIC BATTERY SIMPLE,false,true,1,42.020154788,-87.669488362,2018-04-27T10:00:00.000+02:00,4,27,10,2018,Violent
11344494,06/11/2018 04:00:00 PM,DECEPTIVE PRACTICE,FINANCIAL IDENTITY THEFT OVER $ 300,false,false,8,41.889353661,-87.635513776,2018-06-11T16:00:00.000+02:00,6,11,16,2018,Non-Violent
11241375,02/20/2018 03:30:00 PM,THEFT,RETAIL THEFT,false,false,28,41.869527301,-87.639268759,2018-02-20T15:30:00.000+02:00,2,20,15,2018,Non-Violent
11390733,07/24/2018 06:30:00 AM,THEFT,$500 AND UNDER,false,false,40,41.790857624,-87.607771565,2018-07-24T06:30:00.000+02:00,7,24,6,2018,Non-Violent
11290279,04/20/2018 01:14:00 AM,CRIMINAL DAMAGE,TO PROPERTY,false,true,69,41.763556474,-87.606752345,2018-04-20T01:14:00.000+02:00,4,20,1,2018,Non-Violent
11230689,02/14/2018 08:00:00 AM,CRIMINAL DAMAGE,TO VEHICLE,false,false,28,41.871967842,-87.643975079,2018-02-14T08:00:00.000+02:00,2,14,8,2018,Non-Violent
11233937,02/17/2018 05:00:00 PM,THEFT,$500 AND UNDER,false,false,4,41.961417436,-87.681830938,2018-02-17T17:00:00.000+02:00,2,17,17,2018,Non-Violent
11370828,07/05/2018 10:10:00 PM,BATTERY,DOMESTIC BATTERY SIMPLE,false,true,72,41.712698257,-87.690457822,2018-07-05T22:10:00.000+02:00,7,5,22,2018,Violent
11298417,04/28/2018 02:15:00 PM,CRIMINAL DAMAGE,TO PROPERTY,false,true,42,41.773481403,-87.573481416,2018-04-28T14:15:00.000+02:00,4,28,14,2018,Non-Violent
11271602,03/30/2018 01:00:00 PM,CRIMINAL DAMAGE,TO PROPERTY,false,false,77,41.980639456,-87.65510293,2018-03-30T13:00:00.000+02:00,3,30,13,2018,Non-Violent
11346324,06/12/2018 06:00:00 PM,THEFT,$500 AND UNDER,false,false,6,41.948191378,-87.653145817,2018-06-12T18:00:00.000+02:00,6,12,18,2018,Non-Violent
11284391,04/12/2018 08:00:00 PM,ASSAULT,SIMPLE,false,false,21,41.933871015,-87.705474449,2018-04-12T20:00:00.000+02:00,4,12,20,2018,Violent
11234663,02/19/2018 09:00:00 AM,THEFT,$500 AND UNDER,false,false,22,41.930049492,-87.685920733,2018-02-19T09:00:00.000+02:00,2,19,9,2018,Non-Violent
11378302,07/12/2018 09:38:00 PM,NARCOTICS,POSS: CANNABIS MORE THAN 30GMS,true,false,52,41.722069687,-87.525998691,2018-07-12T21:38:00.000+02:00,7,12,21,2018,Non-Violent
11288643,04/17/2018 03:05:00 PM,ASSAULT,SIMPLE,false,false,73,41.716736461,-87.6479477,2018-04-17T15:05:00.000+02:00,4,17,15,2018,Violent
11245658,03/03/2018 04:30:00 AM,BATTERY,DOMESTIC BATTERY SIMPLE,false,true,14,41.967608532,-87.706003721,2018-03-03T04:30:00.000+02:00,3,3,4,2018,Violent
11322879,05/20/2018 01:30:00 PM,THEFT,$500 AND UNDER,false,false,67,41.791803761,-87.66088535,2018-05-20T13:30:00.000+02:00,5,20,13,2018,Non-Violent
11297065,04/27/2018 12:30:00 AM,THEFT,$500 AND UNDER,false,false,67,41.782707791,-87.660646744,2018-04-27T00:30:00.000+02:00,4,27,0,2018,Non-Violent
11302407,05/02/2018 11:00:00 AM,THEFT,OVER $500,false,true,23,41.899593359,-87.721329659,2018-05-02T11:00:00.000+02:00,5,2,11,2018,Non-Violent
11278467,04/06/2018 04:00:00 PM,CRIMINAL DAMAGE,TO PROPERTY,false,false,73,41.705040598,-87.648943512,2018-04-06T16:00:00.000+02:00,4,6,16,2018,Non-Violent
11251802,03/09/2018 05:50:00 PM,INTERFERENCE WITH PUBLIC OFFICER,OBSTRUCTING IDENTIFICATION,true,false,67,41.770243878,-87.674974691,2018-03-09T17:50:00.000+02:00,3,9,17,2018,Non-Violent
11270735,03/29/2018 04:30:00 PM,BATTERY,SIMPLE,false,false,32,41.883500187,-87.627876698,2018-03-29T16:30:00.000+02:00,3,29,16,2018,Violent
11359083,06/25/2018 11:45:00 AM,THEFT,$500 AND UNDER,true,false,30,41.844381272,-87.715092209,2018-06-25T11:45:00.000+02:00,6,25,11,2018,Non-Violent
11326590,05/25/2018 09:52:00 PM,WEAPONS VIOLATION,UNLAWFUL POSS OTHER FIREARM,true,false,52,41.707222109,-87.536493636,2018-05-25T21:52:00.000+02:00,5,25,21,2018,Non-Violent
11390470,07/24/2018 10:13:00 AM,BATTERY,DOMESTIC BATTERY SIMPLE,true,true,40,41.780040887,-87.621569078,2018-07-24T10:13:00.000+02:00,7,24,10,2018,Violent
11316057,03/06/2018 09:00:00 AM,DECEPTIVE PRACTICE,FINANCIAL IDENTITY THEFT OVER $ 300,false,false,25,41.873845156,-87.763121074,2018-03-06T09:00:00.000+02:00,3,6,9,2018,Non-Violent
11332964,05/18/2018 03:00:00 PM,DECEPTIVE PRACTICE,FRAUD OR CONFIDENCE GAME,false,false,2,41.997784328,-87.686820211,2018-05-18T15:00:00.000+02:00,5,18,15,2018,Non-Violent
11388395,07/19/2018 10:00:00 PM,THEFT,$500 AND UNDER,false,false,5,41.951160369,-87.676671127,2018-07-19T22:00:00.000+02:00,7,19,22,2018,Non-Violent
11357674,06/24/2018 02:34:00 AM,CRIMINAL DAMAGE,TO PROPERTY,false,false,23,41.895361374,-87.726431415,2018-06-24T02:34:00.000+02:00,6,24,2,2018,Non-Violent
11301486,05/01/2018 02:55:00 PM,BATTERY,DOMESTIC BATTERY SIMPLE,false,true,67,41.766237192,-87.662636959,2018-05-01T14:55:00.000+02:00,5,1,14,2018,Violent
11402350,08/04/2018 04:00:00 AM,BURGLARY,UNLAWFUL ENTRY,false,false,71,41.730312272,-87.641025852,2018-08-04T04:00:00.000+02:00,8,4,4,2018,Non-Violent
11276143,04/04/2018 08:28:00 PM,BATTERY,SIMPLE,true,false,69,41.765430523,-87.630077021,2018-04-04T20:28:00.000+02:00,4,4,20,2018,Violent
11227367,02/10/2018 08:50:00 AM,BATTERY,DOMESTIC BATTERY SIMPLE,false,true,59,41.825983523,-87.670287326,2018-02-10T08:50:00.000+02:00,2,10,8,2018,Violent
11251400,03/09/2018 01:35:00 PM,THEFT,ATTEMPT THEFT,false,false,77,41.976851852,-87.654999693,2018-03-09T13:35:00.000+02:00,3,9,13,2018,Non-Violent
11293625,04/23/2018 04:04:00 PM,BATTERY,DOMESTIC BATTERY SIMPLE,false,true,19,41.921178565,-87.74745455,2018-04-23T16:04:00.000+02:00,4,23,16,2018,Violent
11253236,03/11/2018 03:00:00 PM,BATTERY,SIMPLE,false,false,46,41.730087889,-87.550491518,2018-03-11T15:00:00.000+02:00,3,11,15,2018,Violent
11295081,04/25/2018 12:00:00 AM,BATTERY,DOMESTIC BATTERY SIMPLE,false,true,19,41.919028675,-87.780425598,2018-04-25T00:00:00.000+02:00,4,25,0,2018,Violent
11365412,07/01/2018 01:13:00 AM,ASSAULT,SIMPLE,true,false,61,41.808584003,-87.665881774,2018-07-01T01:13:00.000+02:00,7,1,1,2018,Violent
11303731,05/03/2018 03:30:00 PM,SEX OFFENSE,PUBLIC INDECENCY,false,false,38,41.805286869,-87.616484885,2018-05-03T15:30:00.000+02:00,5,3,15,2018,Non-Violent
11381763,06/20/2018 04:00:00 PM,THEFT,FROM BUILDING,false,true,67,41.782574883,-87.670357078,2018-06-20T16:00:00.000+02:00,6,20,16,2018,Non-Violent
11320404,05/19/2018 08:30:00 PM,THEFT,$500 AND UNDER,false,false,57,41.807427017,-87.715117523,2018-05-19T20:30:00.000+02:00,5,19,20,2018,Non-Violent
11344795,06/11/2018 10:05:00 PM,DECEPTIVE PRACTICE,COUNTERFEITING DOCUMENT,false,false,4,41.977017622,-87.692447486,2018-06-11T22:05:00.000+02:00,6,11,22,2018,Non-Violent
11302722,05/02/2018 01:30:00 PM,BATTERY,AGG: HANDS/FIST/FEET NO/MINOR INJURY,false,false,3,41.954535555,-87.651221802,2018-05-02T13:30:00.000+02:00,5,2,13,2018,Violent
11244432,02/28/2018 08:10:00 PM,THEFT,FROM BUILDING,false,false,28,41.884492443,-87.649000096,2018-02-28T20:10:00.000+02:00,2,28,20,2018,Non-Violent
11381861,07/15/2018 01:15:00 PM,THEFT,RETAIL THEFT,false,false,24,41.905529073,-87.667554656,2018-07-15T13:15:00.000+02:00,7,15,13,2018,Non-Violent
11335397,06/03/2018 12:32:00 AM,BATTERY,SIMPLE,true,false,2,41.997676381,-87.693020157,2018-06-03T00:32:00.000+02:00,6,3,0,2018,Violent
11383481,07/06/2018 01:10:00 PM,DECEPTIVE PRACTICE,CREDIT CARD FRAUD,false,false,6,41.93743245,-87.649180491,2018-07-06T13:10:00.000+02:00,7,6,13,2018,Non-Violent
11380669,07/14/2018 11:00:00 PM,MOTOR VEHICLE THEFT,AUTOMOBILE,false,false,3,41.967895809,-87.650082791,2018-07-14T23:00:00.000+02:00,7,14,23,2018,Non-Violent
11237878,02/12/2018 08:25:00 AM,ASSAULT,SIMPLE,false,false,32,41.883401379,-87.627874112,2018-02-12T08:25:00.000+02:00,2,12,8,2018,Violent
11330352,05/29/2018 04:37:00 PM,CRIMINAL TRESPASS,TO STATE SUP LAND,true,false,68,41.779975054,-87.630937377,2018-05-29T16:37:00.000+02:00,5,29,16,2018,Non-Violent
11315395,05/15/2018 12:15:00 AM,ROBBERY,ARMED: HANDGUN,false,false,66,41.762032927,-87.695404999,2018-05-15T00:15:00.000+02:00,5,15,0,2018,Violent
11228557,02/12/2018 06:30:00 AM,MOTOR VEHICLE THEFT,AUTOMOBILE,false,false,31,41.858887842,-87.654419724,2018-02-12T06:30:00.000+02:00,2,12,6,2018,Non-Violent
11297116,04/26/2018 09:30:00 PM,CRIMINAL DAMAGE,TO VEHICLE,false,false,48,41.729007014,-87.575518763,2018-04-26T21:30:00.000+02:00,4,26,21,2018,Non-Violent
11307490,04/26/2018 12:00:00 PM,OTHER OFFENSE,HARASSMENT BY ELECTRONIC MEANS,false,false,32,41.884516393,-87.619132695,2018-04-26T12:00:00.000+02:00,4,26,12,2018,Non-Violent
11358087,06/23/2018 09:00:00 PM,OTHER OFFENSE,HARASSMENT BY TELEPHONE,false,true,2,41.999881616,-87.697265657,2018-06-23T21:00:00.000+02:00,6,23,21,2018,Non-Violent
11281161,04/10/2018 01:34:00 PM,INTERFERENCE WITH PUBLIC OFFICER,OBSTRUCTING IDENTIFICATION,true,false,54,41.653059579,-87.602503098,2018-04-10T13:34:00.000+02:00,4,10,13,2018,Non-Violent
11290535,04/20/2018 08:25:00 AM,OTHER OFFENSE,SEX OFFENDER: FAIL TO REGISTER,false,false,1,42.016998846,-87.680469059,2018-04-20T08:25:00.000+02:00,4,20,8,2018,Non-Violent
11343049,06/10/2018 03:40:00 AM,BATTERY,AGGRAVATED DOMESTIC BATTERY: HANDS/FIST/FEET SERIOUS INJURY,true,true,43,41.758384331,-87.554927042,2018-06-10T03:40:00.000+02:00,6,10,3,2018,Violent
11289290,04/19/2018 03:33:00 AM,BATTERY,DOMESTIC BATTERY SIMPLE,true,true,3,41.96811792,-87.661211122,2018-04-19T03:33:00.000+02:00,4,19,3,2018,Violent
11231410,02/15/2018 12:36:00 PM,NARCOTICS,POSS: HEROIN(WHITE),true,false,23,41.899114936,-87.715519577,2018-02-15T12:36:00.000+02:00,2,15,12,2018,Non-Violent
11393306,07/26/2018 07:19:00 PM,NARCOTICS,POSS: CRACK,true,false,32,41.887145175,-87.627087409,2018-07-26T19:19:00.000+02:00,7,26,19,2018,Non-Violent
11241110,02/25/2018 03:00:00 PM,THEFT,$500 AND UNDER,false,false,45,41.756767255,-87.595155761,2018-02-25T15:00:00.000+02:00,2,25,15,2018,Non-Violent
11378908,07/13/2018 12:00:00 PM,THEFT,PURSE-SNATCHING,false,false,25,41.892864392,-87.770675902,2018-07-13T12:00:00.000+02:00,7,13,12,2018,Non-Violent
11390706,07/21/2018 06:30:00 PM,CRIMINAL DAMAGE,TO PROPERTY,false,true,70,41.746279672,-87.694249096,2018-07-21T18:30:00.000+02:00,7,21,18,2018,Non-Violent
11294227,04/20/2018 07:00:00 PM,MOTOR VEHICLE THEFT,AUTOMOBILE,false,false,25,41.875800743,-87.75141986,2018-04-20T19:00:00.000+02:00,4,20,19,2018,Non-Violent
11374967,07/09/2018 07:53:00 PM,BATTERY,SIMPLE,false,false,28,41.881203182,-87.647342333,2018-07-09T19:53:00.000+02:00,7,9,19,2018,Violent
11343531,06/07/2018 09:30:00 AM,THEFT,OVER $500,false,false,32,41.880848125,-87.622797937,2018-06-07T09:30:00.000+02:00,6,7,9,2018,Non-Violent
11354876,06/21/2018 01:00:00 AM,THEFT,FROM BUILDING,false,false,29,41.867163869,-87.718624876,2018-06-21T01:00:00.000+02:00,6,21,1,2018,Non-Violent
11342742,06/09/2018 08:50:00 PM,CRIMINAL DAMAGE,TO PROPERTY,false,false,25,41.873936641,-87.755618886,2018-06-09T20:50:00.000+02:00,6,9,20,2018,Non-Violent
11360612,06/26/2018 03:30:00 PM,ASSAULT,AGGRAVATED: OTHER FIREARM,false,false,49,41.727094264,-87.632151109,2018-06-26T15:30:00.000+02:00,6,26,15,2018,Violent
11388921,07/22/2018 10:52:00 PM,BURGLARY,FORCIBLE ENTRY,false,false,28,41.879879647,-87.6845069,2018-07-22T22:52:00.000+02:00,7,22,22,2018,Non-Violent
11283834,04/13/2018 01:15:00 AM,THEFT,$500 AND UNDER,true,false,49,41.702788079,-87.624589594,2018-04-13T01:15:00.000+02:00,4,13,1,2018,Non-Violent
11351577,06/18/2018 07:00:00 AM,CRIMINAL DAMAGE,TO PROPERTY,false,false,2,42.009291171,-87.70318793,2018-06-18T07:00:00.000+02:00,6,18,7,2018,Non-Violent
11254171,03/12/2018 05:30:00 PM,CRIMINAL TRESPASS,TO LAND,false,false,32,41.884497529,-87.625838595,2018-03-12T17:30:00.000+02:00,3,12,17,2018,Non-Violent
11296577,04/16/2018 11:15:00 AM,BATTERY,PRO EMP HANDS NO/MIN INJURY,false,false,50,41.688610361,-87.609536712,2018-04-16T11:15:00.000+02:00,4,16,11,2018,Violent
11365377,06/12/2018 03:30:00 PM,THEFT,$500 AND UNDER,false,false,43,41.754728984,-87.561443469,2018-06-12T15:30:00.000+02:00,6,12,15,2018,Non-Violent
11377311,07/11/2018 11:48:00 PM,MOTOR VEHICLE THEFT,AUTOMOBILE,false,false,28,41.864355965,-87.646835942,2018-07-11T23:48:00.000+02:00,7,11,23,2018,Non-Violent
11262621,03/19/2018 01:00:00 AM,BATTERY,AGGRAVATED: OTHER DANG WEAPON,false,false,25,41.878058584,-87.743754315,2018-03-19T01:00:00.000+02:00,3,19,1,2018,Violent
11371691,07/06/2018 10:00:00 AM,THEFT,POCKET-PICKING,false,false,1,42.018498254,-87.672983233,2018-07-06T10:00:00.000+02:00,7,6,10,2018,Non-Violent
11368759,07/04/2018 03:52:00 AM,WEAPONS VIOLATION,RECKLESS FIREARM DISCHARGE,false,false,19,41.917473898,-87.785255949,2018-07-04T03:52:00.000+02:00,7,4,3,2018,Non-Violent
11316574,05/15/2018 04:30:00 PM,THEFT,PURSE-SNATCHING,false,false,6,41.947252263,-87.65350869,2018-05-15T16:30:00.000+02:00,5,15,16,2018,Non-Violent
11376691,07/06/2018 12:00:00 PM,DECEPTIVE PRACTICE,CREDIT CARD FRAUD,false,false,10,41.987907721,-87.820453003,2018-07-06T12:00:00.000+02:00,7,6,12,2018,Non-Violent
11311395,05/10/2018 07:00:00 PM,ASSAULT,SIMPLE,false,false,26,41.870927767,-87.726133891,2018-05-10T19:00:00.000+02:00,5,10,19,2018,Violent
11299906,04/26/2018 08:00:00 AM,BURGLARY,FORCIBLE ENTRY,false,false,19,41.937243119,-87.77496105,2018-04-26T08:00:00.000+02:00,4,26,8,2018,Non-Violent
11239566,02/24/2018 03:00:00 PM,THEFT,FROM BUILDING,false,false,8,41.89043914,-87.624112982,2018-02-24T15:00:00.000+02:00,2,24,15,2018,Non-Violent
11255571,03/14/2018 01:14:00 AM,WEAPONS VIOLATION,UNLAWFUL USE OTHER DANG WEAPON,true,false,58,41.816463213,-87.699377327,2018-03-14T01:14:00.000+02:00,3,14,1,2018,Non-Violent
11305764,04/05/2018 10:00:00 AM,DECEPTIVE PRACTICE,FORGERY,false,false,63,41.789366258,-87.685134416,2018-04-05T10:00:00.000+02:00,4,5,10,2018,Non-Violent
11349854,06/15/2018 02:00:00 PM,DECEPTIVE PRACTICE,ILLEGAL USE CASH CARD,false,false,66,41.764402793,-87.701143671,2018-06-15T14:00:00.000+02:00,6,15,14,2018,Non-Violent
11268037,03/21/2018 06:00:00 AM,DECEPTIVE PRACTICE,FINANCIAL IDENTITY THEFT OVER $ 300,false,false,4,41.965814102,-87.697078833,2018-03-21T06:00:00.000+02:00,3,21,6,2018,Non-Violent
11253004,03/11/2018 08:30:00 AM,THEFT,FROM BUILDING,false,false,61,41.815418448,-87.66514317,2018-03-11T08:30:00.000+02:00,3,11,8,2018,Non-Violent
11395638,07/28/2018 07:00:00 PM,MOTOR VEHICLE THEFT,AUTOMOBILE,false,false,32,41.874050049,-87.627598768,2018-07-28T19:00:00.000+02:00,7,28,19,2018,Non-Violent
11347725,06/14/2018 02:54:00 PM,NARCOTICS,FOUND SUSPECT NARCOTICS,true,false,40,41.783084356,-87.618924839,2018-06-14T14:54:00.000+02:00,6,14,14,2018,Non-Violent
11370666,07/05/2018 07:33:00 PM,ROBBERY,STRONGARM - NO WEAPON,false,false,43,41.759360805,-87.588382086,2018-07-05T19:33:00.000+02:00,7,5,19,2018,Violent
11234984,02/19/2018 03:25:00 PM,THEFT,FROM BUILDING,false,false,8,41.897895128,-87.624096605,2018-02-19T15:25:00.000+02:00,2,19,15,2018,Non-Violent
11351304,06/15/2018 11:00:00 AM,MOTOR VEHICLE THEFT,"THEFT/RECOVERY: TRUCK,BUS,MHOME",false,false,70,41.749714619,-87.682836286,2018-06-15T11:00:00.000+02:00,6,15,11,2018,Non-Violent
11313525,05/13/2018 02:05:00 AM,BATTERY,DOMESTIC BATTERY SIMPLE,false,true,70,41.744276641,-87.725668721,2018-05-13T02:05:00.000+02:00,5,13,2,2018,Violent
11394679,07/28/2018 01:50:00 AM,SEX OFFENSE,PUBLIC INDECENCY,true,false,24,41.895900233,-87.677689298,2018-07-28T01:50:00.000+02:00,7,28,1,2018,Non-Violent
11362985,06/28/2018 05:11:00 PM,THEFT,RETAIL THEFT,true,false,8,41.895140898,-87.624255632,2018-06-28T17:11:00.000+02:00,6,28,17,2018,Non-Violent
11401909,06/15/2018 04:00:00 AM,THEFT,PURSE-SNATCHING,false,false,43,41.76587359,-87.576294705,2018-06-15T04:00:00.000+02:00,6,15,4,2018,Non-Violent
11293324,04/22/2018 04:00:00 PM,THEFT,OVER $500,false,false,24,41.910423933,-87.680792032,2018-04-22T16:00:00.000+02:00,4,22,16,2018,Non-Violent
11339895,06/05/2018 09:00:00 AM,OTHER OFFENSE,TELEPHONE THREAT,false,true,71,41.755013292,-87.665986312,2018-06-05T09:00:00.000+02:00,6,5,9,2018,Non-Violent
11349348,06/16/2018 02:00:00 AM,BATTERY,DOMESTIC BATTERY SIMPLE,false,true,43,41.757564354,-87.556227061,2018-06-16T02:00:00.000+02:00,6,16,2,2018,Violent
11343157,06/10/2018 12:01:00 AM,THEFT,OVER $500,false,false,40,41.801110812,-87.607424852,2018-06-10T00:01:00.000+02:00,6,10,0,2018,Non-Violent
11255470,03/13/2018 10:58:00 PM,DECEPTIVE PRACTICE,THEFT OF LABOR/SERVICES,false,false,8,41.891475999,-87.62537228,2018-03-13T22:58:00.000+02:00,3,13,22,2018,Non-Violent
11235899,02/20/2018 06:00:00 PM,INTIMIDATION,INTIMIDATION OF LAW ENFORCEMENT OFFICIAL,false,false,4,41.979738594,-87.692710749,2018-02-20T18:00:00.000+02:00,2,20,18,2018,Non-Violent
11244331,03/01/2018 01:00:00 PM,DECEPTIVE PRACTICE,CREDIT CARD FRAUD,false,false,32,41.879686828,-87.635248082,2018-03-01T13:00:00.000+02:00,3,1,13,2018,Non-Violent
11261279,03/20/2018 08:26:00 AM,OTHER OFFENSE,TELEPHONE THREAT,false,true,66,41.774974433,-87.688413854,2018-03-20T08:26:00.000+02:00,3,20,8,2018,Non-Violent
11238485,02/23/2018 12:31:00 PM,CRIMINAL TRESPASS,TO LAND,true,false,6,41.933606668,-87.650044614,2018-02-23T12:31:00.000+02:00,2,23,12,2018,Non-Violent
11363143,06/28/2018 09:20:00 PM,DECEPTIVE PRACTICE,CREDIT CARD FRAUD,false,false,8,41.892569522,-87.622032647,2018-06-28T21:20:00.000+02:00,6,28,21,2018,Non-Violent
11349393,06/16/2018 02:37:00 AM,BATTERY,AGGRAVATED:KNIFE/CUTTING INSTR,false,false,73,41.722493342,-87.656626684,2018-06-16T02:37:00.000+02:00,6,16,2,2018,Violent
11353183,06/19/2018 04:51:00 PM,CRIMINAL DAMAGE,TO PROPERTY,true,false,67,41.791390977,-87.656019859,2018-06-19T16:51:00.000+02:00,6,19,16,2018,Non-Violent
11356944,06/22/2018 09:31:00 PM,OTHER OFFENSE,LICENSE VIOLATION,false,false,6,41.932792438,-87.668410485,2018-06-22T21:31:00.000+02:00,6,22,21,2018,Non-Violent
11352644,04/20/2018 12:00:00 PM,THEFT,FROM BUILDING,false,false,6,41.940078259,-87.64237086,2018-04-20T12:00:00.000+02:00,4,20,12,2018,Non-Violent
11367525,07/02/2018 10:30:00 PM,BATTERY,AGGRAVATED: OTHER DANG WEAPON,false,false,68,41.769395837,-87.637255273,2018-07-02T22:30:00.000+02:00,7,2,22,2018,Violent
11349697,06/16/2018 11:30:00 AM,CRIMINAL DAMAGE,TO PROPERTY,false,true,50,41.715839527,-87.597005129,2018-06-16T11:30:00.000+02:00,6,16,11,2018,Non-Violent
11375530,07/10/2018 11:00:00 AM,BATTERY,DOMESTIC BATTERY SIMPLE,false,true,43,41.756404957,-87.55279593,2018-07-10T11:00:00.000+02:00,7,10,11,2018,Violent
11392363,07/18/2018 09:00:00 AM,CRIMINAL DAMAGE,TO PROPERTY,false,false,69,41.770070399,-87.625044516,2018-07-18T09:00:00.000+02:00,7,18,9,2018,Non-Violent
11226322,02/08/2018 06:00:00 PM,THEFT,RETAIL THEFT,false,false,8,41.892096977,-87.624164426,2018-02-08T18:00:00.000+02:00,2,8,18,2018,Non-Violent
11343816,06/11/2018 02:09:00 AM,CRIMINAL TRESPASS,TO VEHICLE,true,false,68,41.757295149,-87.642989954,2018-06-11T02:09:00.000+02:00,6,11,2,2018,Non-Violent
11400884,08/02/2018 08:17:00 PM,CRIMINAL DAMAGE,TO PROPERTY,false,false,73,41.728602941,-87.656287811,2018-08-02T20:17:00.000+02:00,8,2,20,2018,Non-Violent
11263122,03/21/2018 08:45:00 PM,ROBBERY,ATTEMPT: ARMED-KNIFE/CUT INSTR,false,false,29,41.867323587,-87.702032458,2018-03-21T20:45:00.000+02:00,3,21,20,2018,Violent
11354607,05/11/2018 08:00:00 PM,OTHER OFFENSE,HARASSMENT BY ELECTRONIC MEANS,false,false,43,41.770691146,-87.572755519,2018-05-11T20:00:00.000+02:00,5,11,20,2018,Non-Violent
11334492,06/01/2018 11:30:00 PM,BATTERY,AGGRAVATED - HANDGUN,false,false,23,41.907334727,-87.710587432,2018-06-01T23:30:00.000+02:00,6,1,23,2018,Violent
11308835,04/21/2018 09:40:00 AM,NARCOTICS,MANU/DELIVER:CRACK,true,false,49,41.689627543,-87.623016951,2018-04-21T09:40:00.000+02:00,4,21,9,2018,Non-Violent
11255449,03/13/2018 06:15:00 PM,THEFT,RETAIL THEFT,true,false,16,41.96106725,-87.718344521,2018-03-13T18:15:00.000+02:00,3,13,18,2018,Non-Violent
11395725,07/28/2018 11:15:00 PM,MOTOR VEHICLE THEFT,AUTOMOBILE,false,false,43,41.7533252,-87.584024746,2018-07-28T23:15:00.000+02:00,7,28,23,2018,Non-Violent
11301974,05/01/2018 07:13:00 PM,BATTERY,AGGRAVATED: HANDGUN,false,false,27,41.88099198,-87.704402338,2018-05-01T19:13:00.000+02:00,5,1,19,2018,Violent
11348901,06/15/2018 02:00:00 PM,DECEPTIVE PRACTICE,CREDIT CARD FRAUD,false,false,8,41.88946287,-87.624222942,2018-06-15T14:00:00.000+02:00,6,15,14,2018,Non-Violent
11258508,03/17/2018 02:22:00 AM,CRIMINAL DAMAGE,TO STATE SUP PROP,true,false,44,41.737450556,-87.617785709,2018-03-17T02:22:00.000+02:00,3,17,2,2018,Non-Violent
11285120,04/14/2018 11:30:00 AM,ROBBERY,ARMED: HANDGUN,false,false,44,41.736259849,-87.6280468,2018-04-14T11:30:00.000+02:00,4,14,11,2018,Violent
11303792,05/02/2018 07:00:00 AM,ASSAULT,SIMPLE,false,true,53,41.671572865,-87.650231491,2018-05-02T07:00:00.000+02:00,5,2,7,2018,Violent
11279008,04/08/2018 06:47:00 AM,CRIMINAL DAMAGE,TO VEHICLE,false,true,49,41.687883207,-87.632577055,2018-04-08T06:47:00.000+02:00,4,8,6,2018,Non-Violent
11259789,03/18/2018 05:00:00 AM,DECEPTIVE PRACTICE,CREDIT CARD FRAUD,false,false,8,41.891579621,-87.634674198,2018-03-18T05:00:00.000+02:00,3,18,5,2018,Non-Violent
11248672,02/12/2018 12:00:00 PM,MOTOR VEHICLE THEFT,AUTOMOBILE,false,false,4,41.973308145,-87.691587379,2018-02-12T12:00:00.000+02:00,2,12,12,2018,Non-Violent
11262172,03/21/2018 12:40:00 AM,ASSAULT,SIMPLE,true,true,43,41.760374244,-87.55984741,2018-03-21T00:40:00.000+02:00,3,21,0,2018,Violent
11314765,05/12/2018 02:42:00 AM,BURGLARY,FORCIBLE ENTRY,false,false,28,41.877905955,-87.64987086,2018-05-12T02:42:00.000+02:00,5,12,2,2018,Non-Violent
11264982,03/21/2018 11:00:00 PM,MOTOR VEHICLE THEFT,THEFT/RECOVERY: AUTOMOBILE,false,false,68,41.79017674,-87.64748131,2018-03-21T23:00:00.000+02:00,3,21,23,2018,Non-Violent
11276543,04/04/2018 11:00:00 PM,CRIMINAL DAMAGE,TO PROPERTY,false,false,49,41.688069877,-87.632586013,2018-04-04T23:00:00.000+02:00,4,4,23,2018,Non-Violent
11248142,03/05/2018 04:00:00 PM,CRIMINAL DAMAGE,TO VEHICLE,false,false,53,41.664282419,-87.633564979,2018-03-05T16:00:00.000+02:00,3,5,16,2018,Non-Violent
11345821,04/03/2018 11:15:00 AM,SEX OFFENSE,CRIMINAL SEXUAL ABUSE,true,true,75,41.691870573,-87.675258222,2018-04-03T11:15:00.000+02:00,4,3,11,2018,Non-Violent
11286497,04/13/2018 02:00:00 AM,ROBBERY,ARMED: HANDGUN,false,false,69,41.75928571,-87.621556575,2018-04-13T02:00:00.000+02:00,4,13,2,2018,Violent
11268327,03/27/2018 03:35:00 PM,ASSAULT,AGGRAVATED:KNIFE/CUTTING INSTR,false,false,1,42.016607113,-87.675302757,2018-03-27T15:35:00.000+02:00,3,27,15,2018,Violent
11373744,07/06/2018 02:30:00 PM,DECEPTIVE PRACTICE,ILLEGAL USE CASH CARD,false,false,7,41.929218212,-87.642631393,2018-07-06T14:30:00.000+02:00,7,6,14,2018,Non-Violent
11320672,05/20/2018 04:21:00 AM,BATTERY,SIMPLE,false,false,27,41.886374138,-87.709560763,2018-05-20T04:21:00.000+02:00,5,20,4,2018,Violent
11320747,05/20/2018 01:30:00 AM,THEFT,OVER $500,false,false,24,41.90558169,-87.659637609,2018-05-20T01:30:00.000+02:00,5,20,1,2018,Non-Violent
11346835,06/13/2018 04:46:00 AM,CRIMINAL DAMAGE,TO PROPERTY,false,false,66,41.767322121,-87.685759589,2018-06-13T04:46:00.000+02:00,6,13,4,2018,Non-Violent
11372402,07/06/2018 05:30:00 PM,CRIMINAL DAMAGE,TO VEHICLE,false,false,8,41.891103111,-87.61482101,2018-07-06T17:30:00.000+02:00,7,6,17,2018,Non-Violent
11406122,07/06/2018 04:00:00 PM,CRIM SEXUAL ASSAULT,AGGRAVATED: OTHER,false,true,10,41.99233654,-87.782476935,2018-07-06T16:00:00.000+02:00,7,6,16,2018,Non-Violent
11272671,04/01/2018 01:00:00 AM,THEFT,$500 AND UNDER,false,false,21,41.93465881,-87.713085458,2018-04-01T01:00:00.000+02:00,4,1,1,2018,Non-Violent
11379589,07/13/2018 11:45:00 PM,BATTERY,AGGRAVATED:KNIFE/CUTTING INSTR,false,false,35,41.837879307,-87.608414956,2018-07-13T23:45:00.000+02:00,7,13,23,2018,Violent
11386430,05/18/2018 04:00:00 PM,OTHER OFFENSE,VIOLATE ORDER OF PROTECTION,false,true,24,41.897709629,-87.653314471,2018-05-18T16:00:00.000+02:00,5,18,16,2018,Non-Violent
11404990,08/04/2018 01:30:00 PM,THEFT,$500 AND UNDER,false,false,43,41.769670335,-87.588684383,2018-08-04T13:30:00.000+02:00,8,4,13,2018,Non-Violent
11341545,06/08/2018 01:40:00 PM,THEFT,OVER $500,true,false,71,41.756442093,-87.667235947,2018-06-08T13:40:00.000+02:00,6,8,13,2018,Non-Violent
11395486,07/24/2018 12:00:00 PM,CRIMINAL DAMAGE,TO VEHICLE,false,false,7,41.920909612,-87.636423037,2018-07-24T12:00:00.000+02:00,7,24,12,2018,Non-Violent
11378831,07/13/2018 11:37:00 AM,BATTERY,SIMPLE,true,false,56,41.79896295,-87.741028795,2018-07-13T11:37:00.000+02:00,7,13,11,2018,Violent
11338377,06/04/2018 08:25:00 AM,THEFT,$500 AND UNDER,false,false,8,41.888676095,-87.636913058,2018-06-04T08:25:00.000+02:00,6,4,8,2018,Non-Violent
11377415,07/11/2018 01:30:00 PM,BATTERY,SIMPLE,false,false,49,41.721633918,-87.630492505,2018-07-11T13:30:00.000+02:00,7,11,13,2018,Violent
11377926,07/12/2018 04:15:00 PM,THEFT,RETAIL THEFT,true,false,32,41.86821682,-87.6304532,2018-07-12T16:15:00.000+02:00,7,12,16,2018,Non-Violent
11318028,05/17/2018 12:35:00 PM,NARCOTICS,FOUND SUSPECT NARCOTICS,true,false,50,41.692833841,-87.60431945,2018-05-17T12:35:00.000+02:00,5,17,12,2018,Non-Violent
11261035,03/17/2018 04:00:00 AM,CRIMINAL TRESPASS,TO LAND,false,false,70,41.744109669,-87.715457793,2018-03-17T04:00:00.000+02:00,3,17,4,2018,Non-Violent
11330290,05/28/2018 07:30:00 PM,MOTOR VEHICLE THEFT,"CYCLE, SCOOTER, BIKE W-VIN",false,false,6,41.932453401,-87.665315903,2018-05-28T19:30:00.000+02:00,5,28,19,2018,Non-Violent
11270045,03/29/2018 10:18:00 AM,THEFT,RETAIL THEFT,false,false,19,41.923976215,-87.766294416,2018-03-29T10:18:00.000+02:00,3,29,10,2018,Non-Violent
11390843,07/24/2018 06:40:00 PM,OTHER OFFENSE,TELEPHONE THREAT,false,true,23,41.90724258,-87.717928279,2018-07-24T18:40:00.000+02:00,7,24,18,2018,Non-Violent
11388295,07/20/2018 10:00:00 PM,MOTOR VEHICLE THEFT,AUTOMOBILE,false,false,65,41.753193525,-87.730997611,2018-07-20T22:00:00.000+02:00,7,20,22,2018,Non-Violent
11392173,07/25/2018 03:51:00 PM,THEFT,$500 AND UNDER,false,false,49,41.721032394,-87.625044829,2018-07-25T15:51:00.000+02:00,7,25,15,2018,Non-Violent
11293256,03/09/2018 09:00:00 AM,THEFT,$500 AND UNDER,false,false,6,41.939269993,-87.65408232,2018-03-09T09:00:00.000+02:00,3,9,9,2018,Non-Violent
11283981,04/13/2018 09:04:00 AM,CRIMINAL DAMAGE,TO PROPERTY,false,true,66,41.764013407,-87.686896165,2018-04-13T09:04:00.000+02:00,4,13,9,2018,Non-Violent
11258361,03/15/2018 10:13:00 PM,ROBBERY,ARMED: HANDGUN,false,false,1,42.00820667,-87.673781419,2018-03-15T22:13:00.000+02:00,3,15,22,2018,Violent
11387476,07/19/2018 09:29:00 AM,OTHER OFFENSE,VIOLATE ORDER OF PROTECTION,true,true,71,41.74970659,-87.667067379,2018-07-19T09:29:00.000+02:00,7,19,9,2018,Non-Violent
11270182,03/29/2018 08:20:00 AM,BATTERY,AGGRAVATED DOMESTIC BATTERY: OTHER DANG WEAPON,false,true,43,41.766889653,-87.572657463,2018-03-29T08:20:00.000+02:00,3,29,8,2018,Violent
11402931,08/04/2018 04:00:00 PM,THEFT,OVER $500,false,false,62,41.79826919,-87.723303209,2018-08-04T16:00:00.000+02:00,8,4,16,2018,Non-Violent
11390189,07/24/2018 01:10:00 AM,BATTERY,AGGRAVATED: OTHER DANG WEAPON,false,false,27,41.87270939,-87.711881958,2018-07-24T01:10:00.000+02:00,7,24,1,2018,Violent
11327112,05/22/2018 09:00:00 AM,BATTERY,DOMESTIC BATTERY SIMPLE,false,true,61,41.802374896,-87.668454888,2018-05-22T09:00:00.000+02:00,5,22,9,2018,Violent
11397897,07/30/2018 05:00:00 PM,THEFT,$500 AND UNDER,false,false,77,41.989759395,-87.673158965,2018-07-30T17:00:00.000+02:00,7,30,17,2018,Non-Violent
11296925,04/26/2018 07:40:00 PM,THEFT,OVER $500,false,false,28,41.884263949,-87.657683918,2018-04-26T19:40:00.000+02:00,4,26,19,2018,Non-Violent
11256955,03/15/2018 02:00:00 PM,MOTOR VEHICLE THEFT,AUTOMOBILE,false,false,66,41.769402616,-87.685815646,2018-03-15T14:00:00.000+02:00,3,15,14,2018,Non-Violent
11238148,02/22/2018 10:46:00 PM,BATTERY,DOMESTIC BATTERY SIMPLE,false,true,67,41.785053856,-87.655459563,2018-02-22T22:46:00.000+02:00,2,22,22,2018,Violent
11281611,04/10/2018 10:13:00 PM,NARCOTICS,POSS: COCAINE,true,false,23,41.909919446,-87.723303059,2018-04-10T22:13:00.000+02:00,4,10,22,2018,Non-Violent
11389209,07/23/2018 09:54:00 AM,WEAPONS VIOLATION,UNLAWFUL USE HANDGUN,false,false,23,41.890330313,-87.724712481,2018-07-23T09:54:00.000+02:00,7,23,9,2018,Non-Violent
11310964,05/10/2018 11:00:00 AM,CRIMINAL DAMAGE,TO PROPERTY,false,false,53,41.685389871,-87.616320016,2018-05-10T11:00:00.000+02:00,5,10,11,2018,Non-Violent
11273089,04/01/2018 09:30:00 AM,CRIMINAL DAMAGE,TO VEHICLE,false,false,15,41.957194852,-87.776915623,2018-04-01T09:30:00.000+02:00,4,1,9,2018,Non-Violent
11399132,07/28/2018 04:00:00 PM,THEFT,FROM BUILDING,false,false,49,41.697086882,-87.620840409,2018-07-28T16:00:00.000+02:00,7,28,16,2018,Non-Violent
11404945,08/05/2018 05:55:00 PM,PROSTITUTION,SOLICIT FOR BUSINESS,true,false,66,41.764429724,-87.69955625,2018-08-05T17:55:00.000+02:00,8,5,17,2018,Non-Violent
11254428,03/12/2018 09:00:00 PM,BURGLARY,UNLAWFUL ENTRY,true,false,43,41.772410563,-87.583839318,2018-03-12T21:00:00.000+02:00,3,12,21,2018,Non-Violent
11330321,05/29/2018 11:10:00 AM,OTHER OFFENSE,VEHICLE TITLE/REG OFFENSE,true,false,24,41.899898549,-87.661071135,2018-05-29T11:10:00.000+02:00,5,29,11,2018,Non-Violent
11292736,04/22/2018 05:22:00 PM,THEFT,OVER $500,false,false,50,41.707535018,-87.600839053,2018-04-22T17:22:00.000+02:00,4,22,17,2018,Non-Violent
11243201,02/28/2018 09:10:00 AM,THEFT,$500 AND UNDER,false,false,1,41.999533347,-87.671104423,2018-02-28T09:10:00.000+02:00,2,28,9,2018,Non-Violent
11396512,07/28/2018 08:00:00 PM,CRIMINAL DAMAGE,TO VEHICLE,false,false,27,41.872844206,-87.699393275,2018-07-28T20:00:00.000+02:00,7,28,20,2018,Non-Violent
11275892,04/04/2018 06:08:00 PM,BATTERY,SIMPLE,false,false,7,41.918101097,-87.653623444,2018-04-04T18:08:00.000+02:00,4,4,18,2018,Violent
11282347,04/11/2018 04:45:00 PM,ASSAULT,AGGRAVATED: HANDGUN,false,false,14,41.963433489,-87.708316987,2018-04-11T16:45:00.000+02:00,4,11,16,2018,Violent
11402315,08/04/2018 02:30:00 AM,BATTERY,AGGRAVATED DOMESTIC BATTERY: HANDS/FIST/FEET SERIOUS INJURY,false,true,43,41.77258072,-87.583841003,2018-08-04T02:30:00.000+02:00,8,4,2,2018,Violent
11278026,04/06/2018 07:55:00 PM,OTHER OFFENSE,BOARD PLANE WITH WEAPON,true,false,76,41.976762981,-87.900983721,2018-04-06T19:55:00.000+02:00,4,6,19,2018,Non-Violent
11301802,04/29/2018 05:56:00 PM,THEFT,RETAIL THEFT,false,false,30,41.844324387,-87.718810515,2018-04-29T17:56:00.000+02:00,4,29,17,2018,Non-Violent
11323904,05/18/2018 04:00:00 PM,DECEPTIVE PRACTICE,ATTEMPT - FINANCIAL IDENTITY THEFT,false,false,61,41.808612776,-87.664223537,2018-05-18T16:00:00.000+02:00,5,18,16,2018,Non-Violent
11286821,04/16/2018 02:19:00 PM,THEFT,RETAIL THEFT,false,false,61,41.811551206,-87.665047641,2018-04-16T14:19:00.000+02:00,4,16,14,2018,Non-Violent
11242446,02/27/2018 02:30:00 PM,OTHER OFFENSE,SEX OFFENDER: FAIL TO REGISTER,true,false,67,41.764828675,-87.654110993,2018-02-27T14:30:00.000+02:00,2,27,14,2018,Non-Violent
11358045,06/22/2018 11:00:00 AM,BURGLARY,FORCIBLE ENTRY,false,false,71,41.743137547,-87.658744105,2018-06-22T11:00:00.000+02:00,6,22,11,2018,Non-Violent
11253101,03/11/2018 12:00:00 PM,THEFT,FROM BUILDING,false,false,6,41.939923405,-87.668667203,2018-03-11T12:00:00.000+02:00,3,11,12,2018,Non-Violent
11290037,04/19/2018 05:30:00 PM,THEFT,POCKET-PICKING,false,false,32,41.883500187,-87.627876698,2018-04-19T17:30:00.000+02:00,4,19,17,2018,Non-Violent
11275784,03/30/2018 12:00:00 PM,OTHER OFFENSE,HARASSMENT BY ELECTRONIC MEANS,false,false,30,41.847317173,-87.703891798,2018-03-30T12:00:00.000+02:00,3,30,12,2018,Non-Violent
11306942,05/06/2018 05:44:00 PM,ASSAULT,SIMPLE,false,true,71,41.735088991,-87.656963451,2018-05-06T17:44:00.000+02:00,5,6,17,2018,Violent
11361151,06/25/2018 11:00:00 AM,BATTERY,SIMPLE,false,false,34,41.834011289,-87.635219909,2018-06-25T11:00:00.000+02:00,6,25,11,2018,Violent
11261224,03/19/2018 06:20:00 PM,CRIMINAL DAMAGE,TO VEHICLE,false,false,39,41.805470526,-87.603810519,2018-03-19T18:20:00.000+02:00,3,19,18,2018,Non-Violent
11325275,05/24/2018 06:14:00 PM,CRIMINAL TRESPASS,TO LAND,true,false,28,41.868447451,-87.642228591,2018-05-24T18:14:00.000+02:00,5,24,18,2018,Non-Violent
11290072,04/19/2018 08:30:00 PM,ROBBERY,STRONGARM - NO WEAPON,false,false,22,41.917061131,-87.687393113,2018-04-19T20:30:00.000+02:00,4,19,20,2018,Violent
11373288,07/08/2018 10:50:00 AM,BATTERY,DOMESTIC BATTERY SIMPLE,false,true,23,41.911096315,-87.703405194,2018-07-08T10:50:00.000+02:00,7,8,10,2018,Violent
11396113,03/19/2018 05:07:00 PM,OTHER OFFENSE,HARASSMENT BY ELECTRONIC MEANS,false,false,52,41.698307455,-87.529243646,2018-03-19T17:07:00.000+02:00,3,19,17,2018,Non-Violent
11369181,07/04/2018 02:40:00 PM,ASSAULT,SIMPLE,false,false,39,41.807343082,-87.599222706,2018-07-04T14:40:00.000+02:00,7,4,14,2018,Violent
11374499,05/20/2018 11:34:00 AM,NARCOTICS,MANU/DELIVER:CRACK,true,false,25,41.88001597,-87.761814033,2018-05-20T11:34:00.000+02:00,5,20,11,2018,Non-Violent
11297080,04/26/2018 12:00:00 PM,BATTERY,PRO EMP HANDS NO/MIN INJURY,false,false,44,41.741949408,-87.617054222,2018-04-26T12:00:00.000+02:00,4,26,12,2018,Violent
11297219,04/15/2018 10:00:00 PM,THEFT,FROM BUILDING,false,false,35,41.831066839,-87.6209417,2018-04-15T22:00:00.000+02:00,4,15,22,2018,Non-Violent
11277187,04/05/2018 03:00:00 PM,MOTOR VEHICLE THEFT,AUTOMOBILE,false,false,49,41.723360012,-87.623781123,2018-04-05T15:00:00.000+02:00,4,5,15,2018,Non-Violent
11396506,07/29/2018 11:15:00 AM,THEFT,$500 AND UNDER,false,false,12,41.991797104,-87.742429954,2018-07-29T11:15:00.000+02:00,7,29,11,2018,Non-Violent
11389708,07/22/2018 10:40:00 PM,ASSAULT,AGGRAVATED:KNIFE/CUTTING INSTR,false,true,2,42.018244679,-87.690186314,2018-07-22T22:40:00.000+02:00,7,22,22,2018,Violent
11386070,07/19/2018 09:45:00 PM,BATTERY,DOMESTIC BATTERY SIMPLE,false,true,66,41.769583785,-87.690711309,2018-07-19T21:45:00.000+02:00,7,19,21,2018,Violent
11320241,05/19/2018 06:30:00 PM,OTHER OFFENSE,TELEPHONE THREAT,false,false,60,41.837178395,-87.647097119,2018-05-19T18:30:00.000+02:00,5,19,18,2018,Non-Violent
11226990,02/09/2018 08:00:00 PM,NARCOTICS,POSS: CRACK,true,false,27,41.88534469,-87.710000447,2018-02-09T20:00:00.000+02:00,2,9,20,2018,Non-Violent
11332764,05/31/2018 08:00:00 AM,BURGLARY,ATTEMPT FORCIBLE ENTRY,false,false,2,41.999960038,-87.707036239,2018-05-31T08:00:00.000+02:00,5,31,8,2018,Non-Violent
11381749,07/16/2018 09:55:00 AM,BATTERY,DOMESTIC BATTERY SIMPLE,false,true,66,41.774640959,-87.687185395,2018-07-16T09:55:00.000+02:00,7,16,9,2018,Violent
11328491,05/27/2018 10:35:00 PM,NARCOTICS,POSS: CRACK,true,false,29,41.858706132,-87.7054467,2018-05-27T22:35:00.000+02:00,5,27,22,2018,Non-Violent
11263532,03/21/2018 10:30:00 AM,BATTERY,SIMPLE,false,false,24,41.891700115,-87.665535033,2018-03-21T10:30:00.000+02:00,3,21,10,2018,Violent
11368160,07/01/2018 07:00:00 PM,THEFT,FROM BUILDING,false,false,3,41.958457273,-87.652187364,2018-07-01T19:00:00.000+02:00,7,1,19,2018,Non-Violent
11269337,03/28/2018 01:00:00 PM,CRIMINAL TRESPASS,TO LAND,false,false,66,41.786279005,-87.70140181,2018-03-28T13:00:00.000+02:00,3,28,13,2018,Non-Violent
11255051,03/13/2018 01:30:00 PM,THEFT,RETAIL THEFT,true,false,21,41.946542649,-87.714356095,2018-03-13T13:30:00.000+02:00,3,13,13,2018,Non-Violent
11379530,07/13/2018 06:21:00 PM,DECEPTIVE PRACTICE,FRAUD OR CONFIDENCE GAME,false,false,34,41.854379595,-87.631683886,2018-07-13T18:21:00.000+02:00,7,13,18,2018,Non-Violent
11341747,06/07/2018 09:20:00 PM,CRIMINAL DAMAGE,TO VEHICLE,false,false,23,41.908134458,-87.735064878,2018-06-07T21:20:00.000+02:00,6,7,21,2018,Non-Violent
11342832,06/09/2018 09:37:00 PM,MOTOR VEHICLE THEFT,AUTOMOBILE,false,false,28,41.86609917,-87.659916448,2018-06-09T21:37:00.000+02:00,6,9,21,2018,Non-Violent
11234286,02/18/2018 08:30:00 PM,INTIMIDATION,EXTORTION,false,false,2,41.998372452,-87.687461742,2018-02-18T20:30:00.000+02:00,2,18,20,2018,Non-Violent
11321177,05/19/2018 04:35:00 PM,THEFT,RETAIL THEFT,false,false,8,41.900752739,-87.627800699,2018-05-19T16:35:00.000+02:00,5,19,16,2018,Non-Violent
11302884,05/01/2018 08:02:00 AM,THEFT,RETAIL THEFT,false,false,6,41.94044868,-87.651081589,2018-05-01T08:02:00.000+02:00,5,1,8,2018,Non-Violent
11321984,05/20/2018 11:25:00 PM,DECEPTIVE PRACTICE,ILLEGAL USE CASH CARD,false,false,5,41.951912521,-87.677192781,2018-05-20T23:25:00.000+02:00,5,20,23,2018,Non-Violent
11401062,08/02/2018 01:00:00 PM,THEFT,OVER $500,false,false,62,41.797740707,-87.728193183,2018-08-02T13:00:00.000+02:00,8,2,13,2018,Non-Violent
11301376,04/30/2018 07:00:00 PM,BATTERY,SIMPLE,false,false,46,41.732942865,-87.555472437,2018-04-30T19:00:00.000+02:00,4,30,19,2018,Violent
11344495,06/11/2018 12:30:00 PM,THEFT,$500 AND UNDER,false,false,26,41.884589375,-87.733584288,2018-06-11T12:30:00.000+02:00,6,11,12,2018,Non-Violent
11354281,06/19/2018 09:40:00 PM,THEFT,$500 AND UNDER,false,false,14,41.971189885,-87.70855006,2018-06-19T21:40:00.000+02:00,6,19,21,2018,Non-Violent
11379294,07/13/2018 07:00:00 AM,DECEPTIVE PRACTICE,FORGERY,false,false,8,41.898680349,-87.643985382,2018-07-13T07:00:00.000+02:00,7,13,7,2018,Non-Violent
11366732,07/02/2018 09:30:00 AM,THEFT,FROM BUILDING,false,false,41,41.800483161,-87.587414531,2018-07-02T09:30:00.000+02:00,7,2,9,2018,Non-Violent
11318385,05/11/2018 07:05:00 PM,DECEPTIVE PRACTICE,CREDIT CARD FRAUD,false,false,39,41.807101267,-87.586402447,2018-05-11T19:05:00.000+02:00,5,11,19,2018,Non-Violent
11231312,02/15/2018 08:30:00 AM,CRIMINAL DAMAGE,TO PROPERTY,false,false,46,41.730127277,-87.546615031,2018-02-15T08:30:00.000+02:00,2,15,8,2018,Non-Violent
11234394,02/19/2018 04:03:00 AM,CRIMINAL DAMAGE,TO PROPERTY,false,false,56,41.807196856,-87.740699871,2018-02-19T04:03:00.000+02:00,2,19,4,2018,Non-Violent
11285716,04/15/2018 07:24:00 AM,BATTERY,SIMPLE,false,false,35,41.845577671,-87.627475027,2018-04-15T07:24:00.000+02:00,4,15,7,2018,Violent
11337706,06/01/2018 02:45:00 PM,BURGLARY,FORCIBLE ENTRY,false,false,71,41.751495958,-87.658616285,2018-06-01T14:45:00.000+02:00,6,1,14,2018,Non-Violent
11401124,08/02/2018 11:30:00 PM,BATTERY,DOMESTIC BATTERY SIMPLE,false,true,54,41.655796679,-87.59621107,2018-08-02T23:30:00.000+02:00,8,2,23,2018,Violent
11260246,03/18/2018 04:00:00 PM,THEFT,$500 AND UNDER,false,false,6,41.950241654,-87.653204894,2018-03-18T16:00:00.000+02:00,3,18,16,2018,Non-Violent
11361025,06/27/2018 04:00:00 AM,ROBBERY,ARMED: HANDGUN,false,false,69,41.763238704,-87.624859412,2018-06-27T04:00:00.000+02:00,6,27,4,2018,Violent
11338048,05/26/2018 10:00:00 PM,THEFT,OVER $500,false,false,5,41.944928368,-87.687332442,2018-05-26T22:00:00.000+02:00,5,26,22,2018,Non-Violent
11251414,03/09/2018 04:30:00 AM,THEFT,$500 AND UNDER,false,false,21,41.946071139,-87.70535108,2018-03-09T04:30:00.000+02:00,3,9,4,2018,Non-Violent
11304309,05/03/2018 07:00:00 PM,CRIMINAL DAMAGE,TO VEHICLE,false,false,29,41.852570602,-87.71364792,2018-05-03T19:00:00.000+02:00,5,3,19,2018,Non-Violent
11375103,07/09/2018 09:00:00 AM,OTHER OFFENSE,TELEPHONE THREAT,false,false,43,41.77113044,-87.571544262,2018-07-09T09:00:00.000+02:00,7,9,9,2018,Non-Violent
11241190,02/26/2018 12:01:00 PM,NARCOTICS,MANU/DEL:CANNABIS OVER 10 GMS,true,false,30,41.851401622,-87.716210168,2018-02-26T12:01:00.000+02:00,2,26,12,2018,Non-Violent
11346298,06/13/2018 10:35:00 AM,BATTERY,SIMPLE,false,false,8,41.889524437,-87.616899045,2018-06-13T10:35:00.000+02:00,6,13,10,2018,Violent
11378073,07/12/2018 04:00:00 PM,CRIMINAL DAMAGE,TO VEHICLE,false,true,29,41.865961882,-87.704432189,2018-07-12T16:00:00.000+02:00,7,12,16,2018,Non-Violent
11227951,02/11/2018 10:30:00 AM,CRIMINAL DAMAGE,TO STATE SUP PROP,true,false,61,41.801358629,-87.661698689,2018-02-11T10:30:00.000+02:00,2,11,10,2018,Non-Violent
11329556,05/28/2018 10:15:00 PM,ASSAULT,SIMPLE,false,false,2,41.992227939,-87.68110483,2018-05-28T22:15:00.000+02:00,5,28,22,2018,Violent
11334274,05/31/2018 06:40:00 PM,BATTERY,DOMESTIC BATTERY SIMPLE,false,true,1,42.015139187,-87.682559835,2018-05-31T18:40:00.000+02:00,5,31,18,2018,Violent
11289304,04/18/2018 07:30:00 PM,BURGLARY,UNLAWFUL ENTRY,false,false,16,41.950190433,-87.714489907,2018-04-18T19:30:00.000+02:00,4,18,19,2018,Non-Violent
11320800,05/13/2018 10:52:00 AM,BATTERY,DOMESTIC BATTERY SIMPLE,false,true,49,41.726673074,-87.628796409,2018-05-13T10:52:00.000+02:00,5,13,10,2018,Violent
11278616,04/05/2018 09:00:00 AM,BURGLARY,FORCIBLE ENTRY,false,false,60,41.842098247,-87.651602587,2018-04-05T09:00:00.000+02:00,4,5,9,2018,Non-Violent
11400448,07/28/2018 12:30:00 PM,ASSAULT,AGGRAVATED: HANDGUN,false,true,49,41.723340547,-87.625074428,2018-07-28T12:30:00.000+02:00,7,28,12,2018,Violent
11320752,05/15/2018 07:05:00 AM,ASSAULT,SIMPLE,false,false,20,41.928616229,-87.740128615,2018-05-15T07:05:00.000+02:00,5,15,7,2018,Violent
11293176,04/19/2018 10:00:00 AM,THEFT,OVER $500,false,false,28,41.887084037,-87.651018015,2018-04-19T10:00:00.000+02:00,4,19,10,2018,Non-Violent
11330501,05/29/2018 05:50:00 PM,THEFT,RETAIL THEFT,false,false,67,41.760065748,-87.663661519,2018-05-29T17:50:00.000+02:00,5,29,17,2018,Non-Violent
11379573,07/14/2018 02:20:00 AM,BATTERY,DOMESTIC BATTERY SIMPLE,false,true,43,41.753682327,-87.555991696,2018-07-14T02:20:00.000+02:00,7,14,2,2018,Violent
11227283,02/10/2018 09:50:00 AM,NARCOTICS,POSS: CANNABIS 30GMS OR LESS,true,false,26,41.876227655,-87.721618728,2018-02-10T09:50:00.000+02:00,2,10,9,2018,Non-Violent
11256495,03/15/2018 12:10:00 AM,BATTERY,SIMPLE,false,false,19,41.916169971,-87.751699931,2018-03-15T00:10:00.000+02:00,3,15,0,2018,Violent
11405683,08/07/2018 12:25:00 AM,CRIMINAL DAMAGE,TO VEHICLE,false,false,55,41.651061272,-87.545927607,2018-08-07T00:25:00.000+02:00,8,7,0,2018,Non-Violent
11398726,07/31/2018 12:55:00 PM,THEFT,$500 AND UNDER,false,false,69,41.769087378,-87.628970349,2018-07-31T12:55:00.000+02:00,7,31,12,2018,Non-Violent
11264805,03/22/2018 06:00:00 PM,CRIMINAL DAMAGE,TO VEHICLE,false,false,18,41.922746962,-87.800713727,2018-03-22T18:00:00.000+02:00,3,22,18,2018,Non-Violent
11282334,04/11/2018 02:00:00 PM,BATTERY,AGGRAVATED:KNIFE/CUTTING INSTR,false,false,48,41.736582312,-87.57692092,2018-04-11T14:00:00.000+02:00,4,11,14,2018,Violent
11310527,05/10/2018 12:10:00 AM,BATTERY,DOMESTIC BATTERY SIMPLE,false,true,25,41.876711335,-87.750780032,2018-05-10T00:10:00.000+02:00,5,10,0,2018,Violent
11284776,04/14/2018 01:20:00 AM,BATTERY,DOMESTIC BATTERY SIMPLE,true,true,61,41.808614751,-87.664091468,2018-04-14T01:20:00.000+02:00,4,14,1,2018,Violent
11286310,04/15/2018 07:30:00 PM,BATTERY,SIMPLE,false,false,61,41.800339889,-87.669620195,2018-04-15T19:30:00.000+02:00,4,15,19,2018,Violent
11335025,06/02/2018 03:00:00 PM,ROBBERY,STRONGARM - NO WEAPON,false,false,34,41.845095181,-87.63654544,2018-06-02T15:00:00.000+02:00,6,2,15,2018,Violent
11244639,03/01/2018 11:14:00 PM,WEAPONS VIOLATION,UNLAWFUL POSS OF HANDGUN,true,false,67,41.763179584,-87.65787444,2018-03-01T23:14:00.000+02:00,3,1,23,2018,Non-Violent
11344750,06/11/2018 06:05:00 PM,CRIMINAL DAMAGE,TO VEHICLE,false,false,42,41.7799566,-87.605921959,2018-06-11T18:05:00.000+02:00,6,11,18,2018,Non-Violent
11383693,07/17/2018 09:07:00 PM,BATTERY,DOMESTIC BATTERY SIMPLE,false,true,73,41.729799548,-87.65073601,2018-07-17T21:07:00.000+02:00,7,17,21,2018,Violent
11258730,03/17/2018 11:50:00 AM,NARCOTICS,POSS: HEROIN(WHITE),true,false,29,41.851394321,-87.735058012,2018-03-17T11:50:00.000+02:00,3,17,11,2018,Non-Violent
11256310,03/14/2018 04:21:00 PM,ASSAULT,AGGRAVATED: HANDGUN,false,false,29,41.855002742,-87.724041772,2018-03-14T16:21:00.000+02:00,3,14,16,2018,Violent
11245888,03/03/2018 01:00:00 PM,CRIMINAL DAMAGE,TO PROPERTY,false,false,19,41.916860912,-87.754294994,2018-03-03T13:00:00.000+02:00,3,3,13,2018,Non-Violent
11328563,05/27/2018 11:50:00 PM,INTERFERENCE WITH PUBLIC OFFICER,OBSTRUCTING IDENTIFICATION,true,false,71,41.735269365,-87.666696348,2018-05-27T23:50:00.000+02:00,5,27,23,2018,Non-Violent
11331486,05/30/2018 12:20:00 PM,CRIMINAL TRESPASS,TO RESIDENCE,true,false,53,41.666277385,-87.629491857,2018-05-30T12:20:00.000+02:00,5,30,12,2018,Non-Violent
11400470,08/02/2018 11:28:00 AM,CRIMINAL TRESPASS,TO LAND,true,false,6,41.948279589,-87.649516667,2018-08-02T11:28:00.000+02:00,8,2,11,2018,Non-Violent
11389726,06/23/2018 07:43:00 PM,DECEPTIVE PRACTICE,FINANCIAL IDENTITY THEFT OVER $ 300,false,false,59,41.826312469,-87.667851375,2018-06-23T19:43:00.000+02:00,6,23,19,2018,Non-Violent
11237896,02/22/2018 05:30:00 PM,ASSAULT,SIMPLE,true,false,31,41.855793593,-87.679710534,2018-02-22T17:30:00.000+02:00,2,22,17,2018,Violent
11276349,04/04/2018 05:45:00 PM,CRIMINAL DAMAGE,TO VEHICLE,false,false,8,41.889369287,-87.634022523,2018-04-04T17:45:00.000+02:00,4,4,17,2018,Non-Violent
11286652,04/16/2018 09:40:00 AM,BATTERY,DOMESTIC BATTERY SIMPLE,false,true,53,41.68373141,-87.645358377,2018-04-16T09:40:00.000+02:00,4,16,9,2018,Violent
11338437,06/04/2018 07:00:00 PM,ASSAULT,SIMPLE,false,false,2,41.987767302,-87.702973567,2018-06-04T19:00:00.000+02:00,6,4,19,2018,Violent
11327823,05/26/2018 11:30:00 PM,OFFENSE INVOLVING CHILDREN,CRIM SEX ABUSE BY FAM MEMBER,true,true,68,41.777142114,-87.647147267,2018-05-26T23:30:00.000+02:00,5,26,23,2018,Non-Violent
11275635,04/04/2018 01:00:00 PM,DECEPTIVE PRACTICE,STOLEN PROP: BUY/RECEIVE/POS.,false,false,19,41.918711651,-87.76551063,2018-04-04T13:00:00.000+02:00,4,4,13,2018,Non-Violent
11227379,02/10/2018 11:50:00 AM,BATTERY,DOMESTIC BATTERY SIMPLE,false,true,71,41.756889607,-87.649056302,2018-02-10T11:50:00.000+02:00,2,10,11,2018,Violent
11254184,03/12/2018 05:00:00 PM,BATTERY,SIMPLE,false,false,66,41.786340696,-87.697661133,2018-03-12T17:00:00.000+02:00,3,12,17,2018,Violent
11255020,03/12/2018 08:45:00 AM,BATTERY,DOMESTIC BATTERY SIMPLE,false,true,38,41.8087017,-87.622821809,2018-03-12T08:45:00.000+02:00,3,12,8,2018,Violent
11261676,03/20/2018 07:50:00 AM,BATTERY,DOMESTIC BATTERY SIMPLE,false,true,60,41.832008871,-87.641263051,2018-03-20T07:50:00.000+02:00,3,20,7,2018,Violent
11368626,07/03/2018 08:40:00 PM,ASSAULT,SIMPLE,false,false,42,41.77268594,-87.605758495,2018-07-03T20:40:00.000+02:00,7,3,20,2018,Violent
11319950,05/18/2018 11:00:00 PM,BURGLARY,FORCIBLE ENTRY,true,false,34,41.848653722,-87.631911623,2018-05-18T23:00:00.000+02:00,5,18,23,2018,Non-Violent
11362175,06/28/2018 03:26:00 AM,BATTERY,SIMPLE,true,false,67,41.784204922,-87.667971654,2018-06-28T03:26:00.000+02:00,6,28,3,2018,Violent
11239972,02/25/2018 03:00:00 AM,BATTERY,DOMESTIC BATTERY SIMPLE,false,true,43,41.752755244,-87.565040309,2018-02-25T03:00:00.000+02:00,2,25,3,2018,Violent
11258150,03/15/2018 02:00:00 PM,BATTERY,AGG PRO.EMP: OTHER DANG WEAPON,false,false,23,41.897524786,-87.704673571,2018-03-15T14:00:00.000+02:00,3,15,14,2018,Violent
11232472,02/13/2018 02:00:00 PM,OFFENSE INVOLVING CHILDREN,ENDANGERING LIFE/HEALTH CHILD,false,true,46,41.729372753,-87.549851765,2018-02-13T14:00:00.000+02:00,2,13,14,2018,Non-Violent
11321022,05/18/2018 08:00:00 PM,BATTERY,DOMESTIC BATTERY SIMPLE,false,true,17,41.938757068,-87.805527697,2018-05-18T20:00:00.000+02:00,5,18,20,2018,Violent
11302111,05/01/2018 10:25:00 PM,BATTERY,AGGRAVATED DOMESTIC BATTERY: KNIFE/CUTTING INST,false,true,43,41.766060686,-87.577201567,2018-05-01T22:25:00.000+02:00,5,1,22,2018,Violent
11328275,05/27/2018 06:40:00 PM,NARCOTICS,MANU/DEL:CANNABIS OVER 10 GMS,true,false,68,41.786947994,-87.650460139,2018-05-27T18:40:00.000+02:00,5,27,18,2018,Non-Violent
11384290,07/17/2018 09:00:00 AM,CRIMINAL DAMAGE,TO PROPERTY,false,false,46,41.74933584,-87.560130184,2018-07-17T09:00:00.000+02:00,7,17,9,2018,Non-Violent
11380957,07/12/2018 06:00:00 PM,THEFT,$500 AND UNDER,false,false,6,41.959715934,-87.673167678,2018-07-12T18:00:00.000+02:00,7,12,18,2018,Non-Violent
11395987,07/28/2018 08:00:00 PM,THEFT,$500 AND UNDER,false,false,66,41.778257507,-87.679831207,2018-07-28T20:00:00.000+02:00,7,28,20,2018,Non-Violent
11258473,03/14/2018 11:00:00 AM,THEFT,$500 AND UNDER,false,false,63,41.800532986,-87.693989039,2018-03-14T11:00:00.000+02:00,3,14,11,2018,Non-Violent
11336167,06/02/2018 12:00:00 AM,THEFT,OVER $500,false,false,8,41.909152038,-87.652675042,2018-06-02T00:00:00.000+02:00,6,2,0,2018,Non-Violent
11372329,07/07/2018 11:15:00 AM,ASSAULT,SIMPLE,false,false,49,41.712193757,-87.616326201,2018-07-07T11:15:00.000+02:00,7,7,11,2018,Violent
11400512,07/30/2018 10:55:00 PM,DECEPTIVE PRACTICE,FRAUD OR CONFIDENCE GAME,false,false,14,41.970938147,-87.731807816,2018-07-30T22:55:00.000+02:00,7,30,22,2018,Non-Violent
11240744,02/26/2018 02:00:00 AM,BATTERY,SIMPLE,false,false,8,41.889179572,-87.633062369,2018-02-26T02:00:00.000+02:00,2,26,2,2018,Violent
11357645,06/23/2018 05:45:00 PM,BATTERY,SIMPLE,false,false,54,41.657196777,-87.601870823,2018-06-23T17:45:00.000+02:00,6,23,17,2018,Violent
11224245,02/06/2018 01:30:00 PM,THEFT,FROM BUILDING,true,false,41,41.789364553,-87.599534207,2018-02-06T13:30:00.000+02:00,2,6,13,2018,Non-Violent
11227087,02/09/2018 11:40:00 PM,ASSAULT,AGGRAVATED:KNIFE/CUTTING INSTR,true,true,21,41.934605758,-87.716481875,2018-02-09T23:40:00.000+02:00,2,9,23,2018,Violent
11367767,07/03/2018 07:05:00 AM,THEFT,ATTEMPT THEFT,false,false,32,41.867405488,-87.627925177,2018-07-03T07:05:00.000+02:00,7,3,7,2018,Non-Violent
11394284,07/27/2018 04:21:00 PM,MOTOR VEHICLE THEFT,ATT: AUTOMOBILE,false,false,25,41.873795037,-87.745023531,2018-07-27T16:21:00.000+02:00,7,27,16,2018,Non-Violent
11260534,03/18/2018 12:15:00 PM,CRIMINAL DAMAGE,TO PROPERTY,false,false,71,41.74959482,-87.651292252,2018-03-18T12:15:00.000+02:00,3,18,12,2018,Non-Violent
11293581,04/23/2018 03:14:00 PM,PUBLIC PEACE VIOLATION,RECKLESS CONDUCT,true,false,23,41.895420644,-87.720539406,2018-04-23T15:14:00.000+02:00,4,23,15,2018,Non-Violent
11302788,05/02/2018 05:30:00 PM,BATTERY,DOMESTIC BATTERY SIMPLE,false,true,71,41.748596101,-87.659232985,2018-05-02T17:30:00.000+02:00,5,2,17,2018,Violent
11337646,06/03/2018 10:30:00 PM,CRIMINAL TRESPASS,TO VEHICLE,false,false,6,,,2018-06-03T22:30:00.000+02:00,6,3,22,2018,Non-Violent
11399641,07/20/2018 08:00:00 PM,THEFT,OVER $500,false,false,28,41.879551283,-87.668360502,2018-07-20T20:00:00.000+02:00,7,20,20,2018,Non-Violent
11336080,06/03/2018 07:30:00 AM,CRIMINAL DAMAGE,TO PROPERTY,false,false,73,41.707855985,-87.652590571,2018-06-03T07:30:00.000+02:00,6,3,7,2018,Non-Violent
11347581,06/12/2018 10:30:00 PM,THEFT,$500 AND UNDER,false,true,43,41.765510452,-87.582431423,2018-06-12T22:30:00.000+02:00,6,12,22,2018,Non-Violent
11296185,04/25/2018 12:00:00 PM,THEFT,$500 AND UNDER,false,false,33,41.853931339,-87.619065628,2018-04-25T12:00:00.000+02:00,4,25,12,2018,Non-Violent
11389112,07/16/2018 09:00:00 AM,DECEPTIVE PRACTICE,FRAUD OR CONFIDENCE GAME,false,false,77,41.980389064,-87.662461281,2018-07-16T09:00:00.000+02:00,7,16,9,2018,Non-Violent
11291862,04/21/2018 03:17:00 PM,BATTERY,DOMESTIC BATTERY SIMPLE,false,true,35,41.825485402,-87.614399445,2018-04-21T15:17:00.000+02:00,4,21,15,2018,Violent
11336552,06/01/2018 12:00:00 PM,DECEPTIVE PRACTICE,CREDIT CARD FRAUD,false,false,8,41.910914175,-87.648578343,2018-06-01T12:00:00.000+02:00,6,1,12,2018,Non-Violent
11376943,07/10/2018 02:30:00 PM,BURGLARY,FORCIBLE ENTRY,false,false,2,41.994694198,-87.697103949,2018-07-10T14:30:00.000+02:00,7,10,14,2018,Non-Violent
11262152,03/17/2018 04:10:00 AM,CRIMINAL DAMAGE,TO PROPERTY,false,true,42,41.783373035,-87.594707671,2018-03-17T04:10:00.000+02:00,3,17,4,2018,Non-Violent
11356445,06/22/2018 04:40:00 PM,ROBBERY,AGGRAVATED VEHICULAR HIJACKING,true,false,27,41.870926294,-87.708969318,2018-06-22T16:40:00.000+02:00,6,22,16,2018,Violent
11328768,05/28/2018 05:15:00 AM,ASSAULT,SIMPLE,false,false,25,41.882171643,-87.770439221,2018-05-28T05:15:00.000+02:00,5,28,5,2018,Violent
11342045,06/09/2018 04:49:00 AM,WEAPONS VIOLATION,RECKLESS FIREARM DISCHARGE,false,false,49,41.694393036,-87.624121555,2018-06-09T04:49:00.000+02:00,6,9,4,2018,Non-Violent
11284199,04/13/2018 12:15:00 PM,ROBBERY,STRONGARM - NO WEAPON,false,false,17,41.938153064,-87.79600229,2018-04-13T12:15:00.000+02:00,4,13,12,2018,Violent
11398632,07/29/2018 12:00:00 AM,THEFT,$500 AND UNDER,false,false,41,41.801797893,-87.589141397,2018-07-29T00:00:00.000+02:00,7,29,0,2018,Non-Violent
11291050,04/20/2018 06:20:00 PM,THEFT,RETAIL THEFT,true,false,32,41.883500187,-87.627876698,2018-04-20T18:20:00.000+02:00,4,20,18,2018,Non-Violent
11347691,06/12/2018 04:14:00 PM,THEFT,FROM BUILDING,false,false,28,41.881606952,-87.657587056,2018-06-12T16:14:00.000+02:00,6,12,16,2018,Non-Violent
11224793,02/06/2018 09:17:00 PM,BATTERY,DOMESTIC BATTERY SIMPLE,true,true,29,41.853414658,-87.730964854,2018-02-06T21:17:00.000+02:00,2,6,21,2018,Violent
11316299,05/06/2018 02:30:00 PM,BATTERY,SIMPLE,false,false,15,41.961762336,-87.764819713,2018-05-06T14:30:00.000+02:00,5,6,14,2018,Violent
11349311,06/16/2018 01:20:00 AM,BATTERY,SIMPLE,false,false,33,41.866843668,-87.625816668,2018-06-16T01:20:00.000+02:00,6,16,1,2018,Violent
11306594,04/09/2018 05:00:00 PM,DECEPTIVE PRACTICE,FINANCIAL IDENTITY THEFT OVER $ 300,false,false,25,41.904890161,-87.762437156,2018-04-09T17:00:00.000+02:00,4,9,17,2018,Non-Violent
11278469,04/07/2018 12:30:00 PM,MOTOR VEHICLE THEFT,AUTOMOBILE,false,false,61,41.794852216,-87.673109334,2018-04-07T12:30:00.000+02:00,4,7,12,2018,Non-Violent
11406671,08/07/2018 10:00:00 PM,OTHER OFFENSE,HARASSMENT BY TELEPHONE,false,false,2,41.994546335,-87.689777521,2018-08-07T22:00:00.000+02:00,8,7,22,2018,Non-Violent
11280745,04/10/2018 07:00:00 AM,OTHER OFFENSE,TELEPHONE THREAT,false,false,59,41.835194375,-87.679090857,2018-04-10T07:00:00.000+02:00,4,10,7,2018,Non-Violent
11347716,06/14/2018 03:05:00 PM,NARCOTICS,POSS: CANNABIS 30GMS OR LESS,true,false,66,41.767802504,-87.68822176,2018-06-14T15:05:00.000+02:00,6,14,15,2018,Non-Violent
11385344,07/14/2018 12:01:00 AM,THEFT,$500 AND UNDER,false,false,22,41.929350555,-87.693906043,2018-07-14T00:01:00.000+02:00,7,14,0,2018,Non-Violent
11271320,03/30/2018 12:00:00 PM,DECEPTIVE PRACTICE,ILLEGAL USE CASH CARD,false,false,68,41.77543953,-87.633314847,2018-03-30T12:00:00.000+02:00,3,30,12,2018,Non-Violent
11381507,07/11/2018 08:00:00 PM,DECEPTIVE PRACTICE,FINANCIAL IDENTITY THEFT OVER $ 300,false,false,40,41.792966839,-87.618092689,2018-07-11T20:00:00.000+02:00,7,11,20,2018,Non-Violent
11311446,05/08/2018 12:30:00 AM,OTHER OFFENSE,HARASSMENT BY ELECTRONIC MEANS,false,false,25,41.881010814,-87.766531225,2018-05-08T00:30:00.000+02:00,5,8,0,2018,Non-Violent
11361420,06/27/2018 06:15:00 AM,CRIMINAL TRESPASS,TO VEHICLE,false,false,15,41.968598467,-87.774382105,2018-06-27T06:15:00.000+02:00,6,27,6,2018,Non-Violent
11382397,07/16/2018 02:30:00 PM,CRIMINAL DAMAGE,TO PROPERTY,false,false,32,41.887701129,-87.626012582,2018-07-16T14:30:00.000+02:00,7,16,14,2018,Non-Violent
11321718,05/21/2018 08:15:00 AM,CRIMINAL DAMAGE,TO PROPERTY,false,false,71,41.747227391,-87.673058833,2018-05-21T08:15:00.000+02:00,5,21,8,2018,Non-Violent
11349172,06/15/2018 09:41:00 PM,BATTERY,SIMPLE,false,false,4,41.976403906,-87.703034154,2018-06-15T21:41:00.000+02:00,6,15,21,2018,Violent
11306266,05/06/2018 04:00:00 AM,THEFT,$500 AND UNDER,false,false,30,41.844216399,-87.727410458,2018-05-06T04:00:00.000+02:00,5,6,4,2018,Non-Violent
11256919,03/10/2018 11:15:00 AM,THEFT,$500 AND UNDER,false,false,25,41.883146202,-87.743711218,2018-03-10T11:15:00.000+02:00,3,10,11,2018,Non-Violent
11323258,05/22/2018 06:31:00 PM,CRIMINAL DAMAGE,CRIMINAL DEFACEMENT,true,false,30,41.848963388,-87.69290877,2018-05-22T18:31:00.000+02:00,5,22,18,2018,Non-Violent
11320142,05/19/2018 02:00:00 PM,ROBBERY,STRONGARM - NO WEAPON,false,false,63,41.80462016,-87.684368169,2018-05-19T14:00:00.000+02:00,5,19,14,2018,Violent
11281653,04/10/2018 06:00:00 PM,BATTERY,AGG: HANDS/FIST/FEET SERIOUS INJURY,false,false,53,41.67136538,-87.641694439,2018-04-10T18:00:00.000+02:00,4,10,18,2018,Violent
11270417,03/29/2018 08:30:00 AM,OTHER OFFENSE,HARASSMENT BY TELEPHONE,false,false,37,41.797611946,-87.633080939,2018-03-29T08:30:00.000+02:00,3,29,8,2018,Non-Violent
11273374,04/01/2018 07:00:00 PM,CRIMINAL DAMAGE,TO PROPERTY,false,false,7,41.919790638,-87.661865485,2018-04-01T19:00:00.000+02:00,4,1,19,2018,Non-Violent
11398158,05/02/2018 12:00:00 AM,OFFENSE INVOLVING CHILDREN,ENDANGERING LIFE/HEALTH CHILD,true,true,29,41.867766995,-87.70082388,2018-05-02T00:00:00.000+02:00,5,2,0,2018,Non-Violent
11325432,05/24/2018 06:38:00 PM,INTIMIDATION,INTIMIDATION,false,false,45,41.742429182,-87.582169094,2018-05-24T18:38:00.000+02:00,5,24,18,2018,Non-Violent
11297799,04/27/2018 03:30:00 PM,THEFT,$500 AND UNDER,false,false,25,41.883200275,-87.757613952,2018-04-27T15:30:00.000+02:00,4,27,15,2018,Non-Violent
11369372,07/04/2018 06:36:00 PM,BATTERY,SIMPLE,false,false,1,41.999704773,-87.668004962,2018-07-04T18:36:00.000+02:00,7,4,18,2018,Violent
11228818,02/09/2018 02:00:00 PM,BURGLARY,FORCIBLE ENTRY,false,false,7,41.93252907,-87.66041621,2018-02-09T14:00:00.000+02:00,2,9,14,2018,Non-Violent
11377173,07/11/2018 05:00:00 PM,THEFT,FROM BUILDING,false,false,32,41.881722193,-87.624356274,2018-07-11T17:00:00.000+02:00,7,11,17,2018,Non-Violent
11360396,06/22/2018 05:00:00 PM,DECEPTIVE PRACTICE,FRAUD OR CONFIDENCE GAME,false,false,12,41.99682593,-87.74592244,2018-06-22T17:00:00.000+02:00,6,22,17,2018,Non-Violent
11379051,07/13/2018 03:34:00 PM,MOTOR VEHICLE THEFT,AUTOMOBILE,false,false,43,41.770969165,-87.586268228,2018-07-13T15:34:00.000+02:00,7,13,15,2018,Non-Violent
11377830,07/06/2018 09:00:00 AM,DECEPTIVE PRACTICE,FORGERY,false,false,25,41.891132061,-87.761090589,2018-07-06T09:00:00.000+02:00,7,6,9,2018,Non-Violent
11382931,07/01/2018 12:00:00 AM,THEFT,OVER $500,false,false,73,41.725807263,-87.65548926,2018-07-01T00:00:00.000+02:00,7,1,0,2018,Non-Violent
11265514,03/23/2018 06:00:00 AM,BURGLARY,FORCIBLE ENTRY,false,false,72,41.706324154,-87.690631191,2018-03-23T06:00:00.000+02:00,3,23,6,2018,Non-Violent
11350725,06/17/2018 01:45:00 PM,DECEPTIVE PRACTICE,CREDIT CARD FRAUD,false,false,32,41.885481891,-87.627935689,2018-06-17T13:45:00.000+02:00,6,17,13,2018,Non-Violent
11298168,04/26/2018 08:00:00 AM,CRIMINAL DAMAGE,TO VEHICLE,false,false,43,41.756524864,-87.585680772,2018-04-26T08:00:00.000+02:00,4,26,8,2018,Non-Violent
11370679,07/05/2018 07:55:00 PM,BATTERY,DOMESTIC BATTERY SIMPLE,false,true,6,41.947295978,-87.651162974,2018-07-05T19:55:00.000+02:00,7,5,19,2018,Violent
11365108,06/30/2018 06:45:00 PM,WEAPONS VIOLATION,UNLAWFUL POSS OF HANDGUN,true,false,25,41.881863282,-87.741314051,2018-06-30T18:45:00.000+02:00,6,30,18,2018,Non-Violent
11359473,06/24/2018 09:00:00 PM,THEFT,POCKET-PICKING,false,false,28,41.863375231,-87.659636657,2018-06-24T21:00:00.000+02:00,6,24,21,2018,Non-Violent
11345216,06/11/2018 09:00:00 AM,THEFT,OVER $500,false,false,15,41.958349988,-87.752500389,2018-06-11T09:00:00.000+02:00,6,11,9,2018,Non-Violent
11325229,05/24/2018 05:00:00 PM,THEFT,FROM BUILDING,false,false,32,41.882429735,-87.627844406,2018-05-24T17:00:00.000+02:00,5,24,17,2018,Non-Violent
11402208,08/04/2018 12:04:00 AM,THEFT,RETAIL THEFT,true,false,7,41.932012618,-87.640940116,2018-08-04T00:04:00.000+02:00,8,4,0,2018,Non-Violent
11339338,06/05/2018 04:05:00 PM,ASSAULT,PRO EMP HANDS NO/MIN INJURY,false,true,69,41.762719954,-87.624846791,2018-06-05T16:05:00.000+02:00,6,5,16,2018,Violent
11294909,04/24/2018 10:24:00 PM,NARCOTICS,POSS: BARBITUATES,true,false,59,41.83651758,-87.670556573,2018-04-24T22:24:00.000+02:00,4,24,22,2018,Non-Violent
11314011,05/13/2018 06:01:00 PM,BATTERY,DOMESTIC BATTERY SIMPLE,false,true,16,41.956266704,-87.71053775,2018-05-13T18:01:00.000+02:00,5,13,18,2018,Violent
11320224,05/19/2018 06:12:00 PM,INTERFERENCE WITH PUBLIC OFFICER,OBSTRUCTING IDENTIFICATION,true,false,27,41.88535037,-87.709530325,2018-05-19T18:12:00.000+02:00,5,19,18,2018,Non-Violent
11224094,02/02/2018 05:00:00 PM,BURGLARY,FORCIBLE ENTRY,false,false,44,41.729327222,-87.606390838,2018-02-02T17:00:00.000+02:00,2,2,17,2018,Non-Violent
11377323,07/11/2018 05:30:00 PM,OFFENSE INVOLVING CHILDREN,OTHER OFFENSE,false,true,69,41.765132826,-87.610411078,2018-07-11T17:30:00.000+02:00,7,11,17,2018,Non-Violent
11280208,04/09/2018 02:41:00 PM,NARCOTICS,POSS: CANNABIS 30GMS OR LESS,true,false,52,41.699961235,-87.541343636,2018-04-09T14:41:00.000+02:00,4,9,14,2018,Non-Violent
11258858,03/17/2018 01:45:00 AM,BATTERY,DOMESTIC BATTERY SIMPLE,true,true,19,41.934435237,-87.756532296,2018-03-17T01:45:00.000+02:00,3,17,1,2018,Violent
11383918,07/18/2018 07:00:00 AM,CRIMINAL DAMAGE,TO VEHICLE,false,false,24,41.897242704,-87.656963111,2018-07-18T07:00:00.000+02:00,7,18,7,2018,Non-Violent
11340506,06/07/2018 03:05:00 PM,THEFT,OVER $500,false,false,67,41.778987251,-87.665473836,2018-06-07T15:05:00.000+02:00,6,7,15,2018,Non-Violent
11368394,07/03/2018 12:00:00 PM,CRIMINAL TRESPASS,TO LAND,false,false,32,41.885729587,-87.625821329,2018-07-03T12:00:00.000+02:00,7,3,12,2018,Non-Violent
11335909,06/03/2018 08:30:00 AM,CRIMINAL DAMAGE,TO VEHICLE,false,false,2,41.996491973,-87.697163297,2018-06-03T08:30:00.000+02:00,6,3,8,2018,Non-Violent
11361535,06/27/2018 01:27:00 PM,NARCOTICS,MANU/DEL:CANNABIS OVER 10 GMS,true,false,67,41.789850121,-87.657194831,2018-06-27T13:27:00.000+02:00,6,27,13,2018,Non-Violent
11398476,07/27/2018 09:03:00 PM,THEFT,RETAIL THEFT,false,false,5,41.943552694,-87.688162342,2018-07-27T21:03:00.000+02:00,7,27,21,2018,Non-Violent
11367310,06/29/2018 02:30:00 PM,DECEPTIVE PRACTICE,FINANCIAL IDENTITY THEFT $300 AND UNDER,false,false,67,41.76312992,-87.661104189,2018-06-29T14:30:00.000+02:00,6,29,14,2018,Non-Violent
11338173,06/02/2018 12:00:00 AM,DECEPTIVE PRACTICE,FINANCIAL IDENTITY THEFT $300 AND UNDER,false,false,66,41.783656285,-87.702050884,2018-06-02T00:00:00.000+02:00,6,2,0,2018,Non-Violent
11399805,08/01/2018 03:00:00 PM,THEFT,OVER $500,false,false,34,41.82862242,-87.632658693,2018-08-01T15:00:00.000+02:00,8,1,15,2018,Non-Violent
11230391,02/14/2018 08:05:00 AM,ASSAULT,SIMPLE,false,true,71,41.74075292,-87.652261554,2018-02-14T08:05:00.000+02:00,2,14,8,2018,Violent
11398010,07/22/2018 05:30:00 PM,DECEPTIVE PRACTICE,CREDIT CARD FRAUD,false,false,6,41.94631018,-87.654297987,2018-07-22T17:30:00.000+02:00,7,22,17,2018,Non-Violent
11226552,02/07/2018 08:40:00 PM,BATTERY,SIMPLE,false,false,28,41.883411617,-87.658809271,2018-02-07T20:40:00.000+02:00,2,7,20,2018,Violent
11389290,07/23/2018 12:00:00 PM,OTHER OFFENSE,HARASSMENT BY TELEPHONE,false,false,46,41.747193714,-87.573469006,2018-07-23T12:00:00.000+02:00,7,23,12,2018,Non-Violent
11379845,07/02/2018 09:00:00 AM,OTHER OFFENSE,HARASSMENT BY ELECTRONIC MEANS,false,false,2,41.998413647,-87.68503326,2018-07-02T09:00:00.000+02:00,7,2,9,2018,Non-Violent
11268323,03/24/2018 03:00:00 PM,CRIMINAL TRESPASS,TO RESIDENCE,false,false,1,42.016521386,-87.680473942,2018-03-24T15:00:00.000+02:00,3,24,15,2018,Non-Violent
11353302,06/19/2018 08:41:00 PM,THEFT,RETAIL THEFT,false,false,27,41.873789876,-87.696714581,2018-06-19T20:41:00.000+02:00,6,19,20,2018,Non-Violent
11287173,04/16/2018 05:50:00 PM,ASSAULT,AGGRAVATED: HANDGUN,false,false,53,41.682828519,-87.644899406,2018-04-16T17:50:00.000+02:00,4,16,17,2018,Violent
11253074,03/09/2018 03:00:00 AM,BATTERY,DOMESTIC BATTERY SIMPLE,false,true,11,41.979982331,-87.768398028,2018-03-09T03:00:00.000+02:00,3,9,3,2018,Violent
11552057,12/31/2018 05:52:00 AM,BURGLARY,UNLAWFUL ENTRY,true,false,24,41.893635093,-87.665584661,2018-12-31T05:52:00.000+02:00,12,31,5,2018,Non-Violent
11588751,11/25/2018 10:00:00 AM,DECEPTIVE PRACTICE,CREDIT CARD FRAUD,false,false,68,,,2018-11-25T10:00:00.000+02:00,11,25,10,2018,Non-Violent
11461106,09/28/2018 04:30:00 AM,BURGLARY,FORCIBLE ENTRY,false,false,57,41.807889242,-87.72200519,2018-09-28T04:30:00.000+02:00,9,28,4,2018,Non-Violent
11458845,09/10/2018 09:00:00 AM,THEFT,$500 AND UNDER,false,false,33,41.867013845,-87.625822134,2018-09-10T09:00:00.000+02:00,9,10,9,2018,Non-Violent
11518204,11/27/2018 09:15:00 AM,ASSAULT,SIMPLE,false,false,28,41.880075611,-87.639628321,2018-11-27T09:15:00.000+02:00,11,27,9,2018,Violent
11538527,12/17/2018 08:20:00 AM,NARCOTICS,POSS: CRACK,true,false,23,41.894591453,-87.719944973,2018-12-17T08:20:00.000+02:00,12,17,8,2018,Non-Violent
11461271,09/28/2018 08:35:00 PM,BATTERY,SIMPLE,false,false,6,41.937919992,-87.649024588,2018-09-28T20:35:00.000+02:00,9,28,20,2018,Violent
11549267,12/03/2018 09:00:00 AM,DECEPTIVE PRACTICE,CREDIT CARD FRAUD,false,false,13,41.975124523,-87.707441438,2018-12-03T09:00:00.000+02:00,12,3,9,2018,Non-Violent
11512029,11/19/2018 08:30:00 AM,ASSAULT,SIMPLE,false,false,76,41.973797081,-87.841156435,2018-11-19T08:30:00.000+02:00,11,19,8,2018,Violent
11523144,12/01/2018 12:00:00 PM,DECEPTIVE PRACTICE,FINANCIAL IDENTITY THEFT OVER $ 300,false,false,8,41.90635423,-87.627437793,2018-12-01T12:00:00.000+02:00,12,1,12,2018,Non-Violent
11417302,08/17/2018 04:34:00 PM,NARCOTICS,MANU/DEL:CANNABIS OVER 10 GMS,true,false,69,41.764585631,-87.621666613,2018-08-17T16:34:00.000+02:00,8,17,16,2018,Non-Violent
11472473,05/02/2018 12:00:00 AM,DECEPTIVE PRACTICE,COUNTERFEIT CHECK,false,false,41,41.792399251,-87.586683174,2018-05-02T00:00:00.000+02:00,5,2,0,2018,Non-Violent
11501688,08/13/2018 10:20:00 AM,NARCOTICS,MANU/DELIVER: HEROIN (WHITE),true,false,69,,,2018-08-13T10:20:00.000+02:00,8,13,10,2018,Non-Violent
11459542,09/21/2018 08:30:00 PM,THEFT,FROM BUILDING,false,false,43,41.756599464,-87.574871723,2018-09-21T20:30:00.000+02:00,9,21,20,2018,Non-Violent
11428603,08/27/2018 10:30:00 PM,CRIMINAL DAMAGE,TO PROPERTY,false,false,23,41.8923075,-87.716220576,2018-08-27T22:30:00.000+02:00,8,27,22,2018,Non-Violent
11442561,09/10/2018 03:00:00 PM,BATTERY,SIMPLE,false,false,27,41.879548773,-87.714555054,2018-09-10T15:00:00.000+02:00,9,10,15,2018,Violent
11463433,09/28/2018 09:00:00 PM,CRIMINAL DAMAGE,TO VEHICLE,false,false,43,41.76906896,-87.572708698,2018-09-28T21:00:00.000+02:00,9,28,21,2018,Non-Violent
11534457,12/07/2018 08:50:00 PM,BURGLARY,UNLAWFUL ENTRY,false,false,31,41.857599406,-87.643138296,2018-12-07T20:50:00.000+02:00,12,7,20,2018,Non-Violent
11439689,09/05/2018 07:30:00 PM,DECEPTIVE PRACTICE,FRAUD OR CONFIDENCE GAME,false,false,74,41.701384786,-87.712168446,2018-09-05T19:30:00.000+02:00,9,5,19,2018,Non-Violent
11454234,09/22/2018 05:45:00 AM,BURGLARY,FORCIBLE ENTRY,false,false,71,41.755382196,-87.661947357,2018-09-22T05:45:00.000+02:00,9,22,5,2018,Non-Violent
11462527,09/30/2018 09:09:00 AM,WEAPONS VIOLATION,UNLAWFUL POSS AMMUNITION,true,false,23,41.894674537,-87.711411964,2018-09-30T09:09:00.000+02:00,9,30,9,2018,Non-Violent
11489087,10/26/2018 12:40:00 PM,PUBLIC PEACE VIOLATION,BOMB THREAT,false,false,8,41.891694878,-87.626155832,2018-10-26T12:40:00.000+02:00,10,26,12,2018,Non-Violent
11551652,12/31/2018 12:08:00 AM,WEAPONS VIOLATION,UNLAWFUL POSS OF HANDGUN,true,false,69,41.768596044,-87.6249361,2018-12-31T00:08:00.000+02:00,12,31,0,2018,Non-Violent
11424495,08/24/2018 09:30:00 AM,THEFT,POCKET-PICKING,false,false,25,41.874621573,-87.754848987,2018-08-24T09:30:00.000+02:00,8,24,9,2018,Non-Violent
11462723,09/29/2018 05:15:00 PM,BURGLARY,FORCIBLE ENTRY,false,false,76,41.971514895,-87.846539257,2018-09-29T17:15:00.000+02:00,9,29,17,2018,Non-Violent
11425647,08/25/2018 12:54:00 PM,ASSAULT,SIMPLE,false,false,23,41.900675948,-87.73671034,2018-08-25T12:54:00.000+02:00,8,25,12,2018,Violent
11429371,08/29/2018 03:26:00 AM,CRIMINAL DAMAGE,TO PROPERTY,false,false,40,41.781560138,-87.615660279,2018-08-29T03:26:00.000+02:00,8,29,3,2018,Non-Violent
11537168,12/16/2018 02:20:00 AM,CRIMINAL DAMAGE,TO PROPERTY,false,false,67,41.791593204,-87.676670466,2018-12-16T02:20:00.000+02:00,12,16,2,2018,Non-Violent
11480006,10/18/2018 09:00:00 AM,BURGLARY,UNLAWFUL ENTRY,false,false,25,41.876554708,-87.763317302,2018-10-18T09:00:00.000+02:00,10,18,9,2018,Non-Violent
11481346,10/19/2018 02:40:00 PM,BATTERY,AGGRAVATED:KNIFE/CUTTING INSTR,false,true,28,41.868980135,-87.657962371,2018-10-19T14:40:00.000+02:00,10,19,14,2018,Violent
11465461,10/02/2018 07:30:00 AM,BATTERY,SIMPLE,false,false,27,41.882864085,-87.699507229,2018-10-02T07:30:00.000+02:00,10,2,7,2018,Violent
11450127,09/18/2018 02:18:00 PM,BATTERY,SIMPLE,false,false,20,41.923431887,-87.738971377,2018-09-18T14:18:00.000+02:00,9,18,14,2018,Violent
11446396,09/14/2018 08:00:00 PM,PROSTITUTION,SOLICIT ON PUBLIC WAY,true,false,26,41.869087509,-87.739471382,2018-09-14T20:00:00.000+02:00,9,14,20,2018,Non-Violent
11530017,12/06/2018 12:00:00 PM,DECEPTIVE PRACTICE,FRAUD OR CONFIDENCE GAME,false,false,73,41.720338651,-87.635905847,2018-12-06T12:00:00.000+02:00,12,6,12,2018,Non-Violent
11443334,09/11/2018 05:50:00 PM,BATTERY,DOMESTIC BATTERY SIMPLE,false,true,8,41.894410845,-87.62424167,2018-09-11T17:50:00.000+02:00,9,11,17,2018,Violent
11524579,12/03/2018 07:05:00 PM,ASSAULT,AGGRAVATED:KNIFE/CUTTING INSTR,false,true,72,41.701829524,-87.681477181,2018-12-03T19:05:00.000+02:00,12,3,19,2018,Violent
11452882,09/20/2018 06:47:00 PM,BURGLARY,FORCIBLE ENTRY,false,false,71,41.754204588,-87.649334036,2018-09-20T18:47:00.000+02:00,9,20,18,2018,Non-Violent
11436355,09/04/2018 06:11:00 PM,PUBLIC PEACE VIOLATION,RECKLESS CONDUCT,true,false,49,41.700783375,-87.622150834,2018-09-04T18:11:00.000+02:00,9,4,18,2018,Non-Violent
11413930,08/02/2018 08:00:00 AM,DECEPTIVE PRACTICE,FINANCIAL IDENTITY THEFT OVER $ 300,false,false,24,41.891926411,-87.66717073,2018-08-02T08:00:00.000+02:00,8,2,8,2018,Non-Violent
11428042,08/27/2018 01:00:00 AM,THEFT,OVER $500,true,false,17,41.937881468,-87.81939858,2018-08-27T01:00:00.000+02:00,8,27,1,2018,Non-Violent
11457297,09/23/2018 03:00:00 PM,THEFT,$500 AND UNDER,false,false,68,41.776809356,-87.637450077,2018-09-23T15:00:00.000+02:00,9,23,15,2018,Non-Violent
11471222,10/09/2018 08:32:00 AM,THEFT,RETAIL THEFT,false,false,41,41.799490663,-87.593499384,2018-10-09T08:32:00.000+02:00,10,9,8,2018,Non-Violent
11422748,08/21/2018 12:30:00 PM,THEFT,FROM BUILDING,false,false,41,41.790894592,-87.604940233,2018-08-21T12:30:00.000+02:00,8,21,12,2018,Non-Violent
11516994,11/24/2018 08:15:00 AM,DECEPTIVE PRACTICE,CREDIT CARD FRAUD,false,false,31,41.855312226,-87.648896475,2018-11-24T08:15:00.000+02:00,11,24,8,2018,Non-Violent
11412325,08/10/2018 05:00:00 AM,THEFT,$500 AND UNDER,false,false,49,41.691955406,-87.618257196,2018-08-10T05:00:00.000+02:00,8,10,5,2018,Non-Violent
11536500,12/09/2018 03:30:00 PM,THEFT,$500 AND UNDER,false,false,32,41.886863814,-87.626851797,2018-12-09T15:30:00.000+02:00,12,9,15,2018,Non-Violent
11486473,10/24/2018 03:00:00 PM,THEFT,$500 AND UNDER,false,false,29,41.860911204,-87.695744714,2018-10-24T15:00:00.000+02:00,10,24,15,2018,Non-Violent
11436141,04/25/2018 12:01:00 AM,DECEPTIVE PRACTICE,ATTEMPT - FINANCIAL IDENTITY THEFT,false,false,8,41.906965938,-87.630079739,2018-04-25T00:01:00.000+02:00,4,25,0,2018,Non-Violent
11421461,08/21/2018 02:07:00 PM,OTHER OFFENSE,HARASSMENT BY TELEPHONE,false,false,48,41.736936818,-87.584116352,2018-08-21T14:07:00.000+02:00,8,21,14,2018,Non-Violent
11524867,11/19/2018 10:40:00 PM,DECEPTIVE PRACTICE,FRAUD OR CONFIDENCE GAME,false,false,7,41.922420892,-87.652298866,2018-11-19T22:40:00.000+02:00,11,19,22,2018,Non-Violent
11507597,11/14/2018 11:45:00 PM,SEX OFFENSE,CRIMINAL SEXUAL ABUSE,true,false,8,41.901794019,-87.627998616,2018-11-14T23:45:00.000+02:00,11,14,23,2018,Non-Violent
11501035,11/06/2018 06:18:00 AM,DECEPTIVE PRACTICE,FORGERY,false,false,32,41.88065447,-87.634168963,2018-11-06T06:18:00.000+02:00,11,6,6,2018,Non-Violent
11472218,10/10/2018 09:40:00 AM,CRIMINAL DAMAGE,TO PROPERTY,false,false,45,41.742358976,-87.586977374,2018-10-10T09:40:00.000+02:00,10,10,9,2018,Non-Violent
11437364,09/05/2018 02:41:00 PM,THEFT,OVER $500,false,false,69,41.759331691,-87.630810679,2018-09-05T14:41:00.000+02:00,9,5,14,2018,Non-Violent
11428066,08/27/2018 09:34:00 PM,BATTERY,SIMPLE,true,false,44,41.751056146,-87.618558137,2018-08-27T21:34:00.000+02:00,8,27,21,2018,Violent
11466737,10/04/2018 02:17:00 PM,OTHER OFFENSE,FALSE/STOLEN/ALTERED TRP,false,false,38,41.814877025,-87.613678043,2018-10-04T14:17:00.000+02:00,10,4,14,2018,Non-Violent
11473163,10/11/2018 02:48:00 AM,WEAPONS VIOLATION,UNLAWFUL USE OTHER FIREARM,false,false,51,41.719778291,-87.571015561,2018-10-11T02:48:00.000+02:00,10,11,2,2018,Non-Violent
11493985,10/31/2018 03:45:00 PM,CRIMINAL DAMAGE,TO PROPERTY,false,false,12,42.00811647,-87.773006046,2018-10-31T15:45:00.000+02:00,10,31,15,2018,Non-Violent
11511601,11/19/2018 12:25:00 PM,BATTERY,SIMPLE,false,false,28,41.884600448,-87.666897965,2018-11-19T12:25:00.000+02:00,11,19,12,2018,Violent
11549030,12/28/2018 11:40:00 AM,THEFT,FROM BUILDING,false,false,32,41.884483968,-87.628989611,2018-12-28T11:40:00.000+02:00,12,28,11,2018,Non-Violent
11412309,08/10/2018 07:00:00 PM,MOTOR VEHICLE THEFT,AUTOMOBILE,false,false,68,41.793126696,-87.65485011,2018-08-10T19:00:00.000+02:00,8,10,19,2018,Non-Violent
11518499,11/27/2018 01:23:00 PM,THEFT,RETAIL THEFT,true,false,44,41.742710224,-87.634088181,2018-11-27T13:23:00.000+02:00,11,27,13,2018,Non-Violent
11430782,08/30/2018 11:20:00 AM,MOTOR VEHICLE THEFT,THEFT/RECOVERY: AUTOMOBILE,false,false,23,41.891829177,-87.71301151,2018-08-30T11:20:00.000+02:00,8,30,11,2018,Non-Violent
11425911,08/25/2018 06:25:00 PM,THEFT,RETAIL THEFT,true,false,43,41.764728804,-87.586292974,2018-08-25T18:25:00.000+02:00,8,25,18,2018,Non-Violent
11458898,09/26/2018 05:50:00 PM,BATTERY,SIMPLE,false,false,35,41.844074267,-87.628442088,2018-09-26T17:50:00.000+02:00,9,26,17,2018,Violent
11419402,08/19/2018 05:58:00 PM,CRIMINAL DAMAGE,TO PROPERTY,false,true,23,41.89254873,-87.722329806,2018-08-19T17:58:00.000+02:00,8,19,17,2018,Non-Violent
11472609,10/10/2018 11:41:00 AM,NARCOTICS,SOLICIT NARCOTICS ON PUBLICWAY,true,false,26,41.87623146,-87.721302911,2018-10-10T11:41:00.000+02:00,10,10,11,2018,Non-Violent
11500713,11/07/2018 09:00:00 AM,THEFT,$500 AND UNDER,false,false,54,41.653790327,-87.599175942,2018-11-07T09:00:00.000+02:00,11,7,9,2018,Non-Violent
11476661,10/14/2018 10:00:00 PM,BATTERY,DOMESTIC BATTERY SIMPLE,false,true,44,41.739146833,-87.617832832,2018-10-14T22:00:00.000+02:00,10,14,22,2018,Violent
11429354,08/28/2018 09:31:00 PM,CRIMINAL DAMAGE,TO VEHICLE,false,false,53,41.677516669,-87.627451282,2018-08-28T21:31:00.000+02:00,8,28,21,2018,Non-Violent
11441269,09/09/2018 10:00:00 AM,THEFT,OVER $500,false,false,32,41.87815451,-87.630131336,2018-09-09T10:00:00.000+02:00,9,9,10,2018,Non-Violent
11435247,09/03/2018 03:59:00 PM,MOTOR VEHICLE THEFT,THEFT/RECOVERY: AUTOMOBILE,true,false,69,41.758382737,-87.599297178,2018-09-03T15:59:00.000+02:00,9,3,15,2018,Non-Violent
11452318,09/04/2018 12:01:00 AM,DECEPTIVE PRACTICE,ILLEGAL USE CASH CARD,false,false,49,41.698182271,-87.614295814,2018-09-04T00:01:00.000+02:00,9,4,0,2018,Non-Violent
11420042,08/20/2018 11:06:00 AM,ASSAULT,PRO EMP HANDS NO/MIN INJURY,false,false,1,42.018748975,-87.673157281,2018-08-20T11:06:00.000+02:00,8,20,11,2018,Violent
11411147,08/12/2018 02:00:00 AM,THEFT,$500 AND UNDER,false,false,24,41.889048224,-87.647677081,2018-08-12T02:00:00.000+02:00,8,12,2,2018,Non-Violent
11551985,12/31/2018 09:30:00 AM,OTHER OFFENSE,HARASSMENT BY ELECTRONIC MEANS,false,true,66,41.763887643,-87.680669815,2018-12-31T09:30:00.000+02:00,12,31,9,2018,Non-Violent
11436283,09/02/2018 10:00:00 PM,BATTERY,SIMPLE,false,false,38,41.81857932,-87.608049363,2018-09-02T22:00:00.000+02:00,9,2,22,2018,Violent
11421850,08/21/2018 10:00:00 PM,THEFT,OVER $500,false,false,28,41.884292567,-87.66115764,2018-08-21T22:00:00.000+02:00,8,21,22,2018,Non-Violent
11458185,09/25/2018 06:19:00 PM,DECEPTIVE PRACTICE,CREDIT CARD FRAUD,false,false,8,41.897895128,-87.624096605,2018-09-25T18:19:00.000+02:00,9,25,18,2018,Non-Violent
11462154,09/29/2018 11:30:00 PM,THEFT,$500 AND UNDER,false,false,61,41.807981953,-87.643865546,2018-09-29T23:30:00.000+02:00,9,29,23,2018,Non-Violent
11537102,12/16/2018 12:30:00 PM,THEFT,$500 AND UNDER,false,false,41,41.799533532,-87.589937768,2018-12-16T12:30:00.000+02:00,12,16,12,2018,Non-Violent
11546611,12/25/2018 11:30:00 PM,MOTOR VEHICLE THEFT,AUTOMOBILE,false,false,29,41.851668626,-87.714320981,2018-12-25T23:30:00.000+02:00,12,25,23,2018,Non-Violent
11471362,06/16/2018 03:00:00 PM,MOTOR VEHICLE THEFT,AUTOMOBILE,false,false,56,41.79290166,-87.751396529,2018-06-16T15:00:00.000+02:00,6,16,15,2018,Non-Violent
11431193,08/30/2018 12:30:00 PM,THEFT,$500 AND UNDER,false,false,32,41.881928906,-87.635704735,2018-08-30T12:30:00.000+02:00,8,30,12,2018,Non-Violent
11486804,10/24/2018 06:35:00 PM,BATTERY,AGGRAVATED DOMESTIC BATTERY: KNIFE/CUTTING INST,true,true,23,41.90387002,-87.728797365,2018-10-24T18:35:00.000+02:00,10,24,18,2018,Violent
11528305,12/07/2018 09:30:00 AM,DECEPTIVE PRACTICE,CREDIT CARD FRAUD,false,false,32,41.885191719,-87.624486846,2018-12-07T09:30:00.000+02:00,12,7,9,2018,Non-Violent
11497893,11/01/2018 06:50:00 PM,ROBBERY,STRONGARM - NO WEAPON,false,false,29,41.866359276,-87.709872843,2018-11-01T18:50:00.000+02:00,11,1,18,2018,Violent
11407745,08/08/2018 07:50:00 PM,ASSAULT,SIMPLE,false,true,31,41.850242938,-87.68375308,2018-08-08T19:50:00.000+02:00,8,8,19,2018,Violent
11410208,08/10/2018 07:46:00 PM,BATTERY,DOMESTIC BATTERY SIMPLE,false,true,42,41.772588844,-87.608197446,2018-08-10T19:46:00.000+02:00,8,10,19,2018,Violent
11424778,07/31/2018 12:00:00 PM,DECEPTIVE PRACTICE,FINANCIAL IDENTITY THEFT OVER $ 300,false,false,66,41.781763959,-87.700778845,2018-07-31T12:00:00.000+02:00,7,31,12,2018,Non-Violent
11454866,09/22/2018 04:53:00 PM,BATTERY,SIMPLE,false,false,29,41.857157258,-87.710281586,2018-09-22T16:53:00.000+02:00,9,22,16,2018,Violent
11432044,08/31/2018 02:48:00 PM,ROBBERY,STRONGARM - NO WEAPON,false,false,19,41.936292055,-87.754148659,2018-08-31T14:48:00.000+02:00,8,31,14,2018,Violent
11525713,12/04/2018 08:35:00 PM,ASSAULT,SIMPLE,true,false,16,41.944872304,-87.731556663,2018-12-04T20:35:00.000+02:00,12,4,20,2018,Violent
11431367,08/30/2018 07:30:00 PM,DECEPTIVE PRACTICE,CREDIT CARD FRAUD,false,false,35,41.84528672,-87.622127226,2018-08-30T19:30:00.000+02:00,8,30,19,2018,Non-Violent
11429560,08/28/2018 05:00:00 PM,CRIMINAL DAMAGE,TO VEHICLE,false,false,26,41.886814875,-87.721602207,2018-08-28T17:00:00.000+02:00,8,28,17,2018,Non-Violent
11504146,11/10/2018 10:57:00 AM,OTHER OFFENSE,SEX OFFENDER: FAIL REG NEW ADD,false,false,46,41.749607706,-87.555278612,2018-11-10T10:57:00.000+02:00,11,10,10,2018,Non-Violent
11550078,12/28/2018 12:00:00 PM,DECEPTIVE PRACTICE,ILLEGAL USE CASH CARD,false,false,4,41.9727514,-87.700047335,2018-12-28T12:00:00.000+02:00,12,28,12,2018,Non-Violent
11562864,12/28/2018 11:25:00 PM,DECEPTIVE PRACTICE,FINANCIAL IDENTITY THEFT $300 AND UNDER,false,false,24,41.905957915,-87.663906017,2018-12-28T23:25:00.000+02:00,12,28,23,2018,Non-Violent
11470089,10/04/2018 03:00:00 PM,THEFT,OVER $500,false,false,58,41.809122508,-87.695455217,2018-10-04T15:00:00.000+02:00,10,4,15,2018,Non-Violent
11420259,08/18/2018 01:00:00 PM,OFFENSE INVOLVING CHILDREN,CHILD ABDUCTION,false,true,42,41.775898721,-87.602177032,2018-08-18T13:00:00.000+02:00,8,18,13,2018,Non-Violent
11541710,12/20/2018 05:45:00 PM,CRIMINAL TRESPASS,TO LAND,true,false,53,41.673554115,-87.616411124,2018-12-20T17:45:00.000+02:00,12,20,17,2018,Non-Violent
11547076,12/26/2018 01:10:00 PM,NARCOTICS,POSS: HEROIN(WHITE),true,false,29,41.858832381,-87.705449136,2018-12-26T13:10:00.000+02:00,12,26,13,2018,Non-Violent
11511789,11/17/2018 12:10:00 PM,CRIMINAL TRESPASS,TO RESIDENCE,false,true,3,41.967751324,-87.66422286,2018-11-17T12:10:00.000+02:00,11,17,12,2018,Non-Violent
11539365,12/18/2018 03:15:00 PM,THEFT,FROM BUILDING,false,false,7,41.92510186,-87.671992307,2018-12-18T15:15:00.000+02:00,12,18,15,2018,Non-Violent
11512778,11/20/2018 04:11:00 PM,THEFT,OVER $500,false,false,24,41.910623447,-87.668214445,2018-11-20T16:11:00.000+02:00,11,20,16,2018,Non-Violent
11483042,10/20/2018 08:00:00 PM,THEFT,$500 AND UNDER,false,false,31,41.857742251,-87.669702413,2018-10-20T20:00:00.000+02:00,10,20,20,2018,Non-Violent
11431680,08/29/2018 03:00:00 PM,THEFT,OVER $500,false,false,53,41.671364454,-87.642909635,2018-08-29T15:00:00.000+02:00,8,29,15,2018,Non-Violent
11414408,08/15/2018 03:20:00 AM,BATTERY,DOMESTIC BATTERY SIMPLE,true,true,26,41.870737693,-87.723925411,2018-08-15T03:20:00.000+02:00,8,15,3,2018,Violent
11513562,11/21/2018 03:00:00 PM,OTHER OFFENSE,TELEPHONE THREAT,false,false,53,41.664318324,-87.628213964,2018-11-21T15:00:00.000+02:00,11,21,15,2018,Non-Violent
11500204,11/06/2018 10:33:00 PM,BATTERY,DOMESTIC BATTERY SIMPLE,false,true,30,41.847591274,-87.726262861,2018-11-06T22:33:00.000+02:00,11,6,22,2018,Violent
11467452,10/05/2018 09:00:00 AM,CRIMINAL DAMAGE,TO PROPERTY,false,true,44,41.745394001,-87.600163368,2018-10-05T09:00:00.000+02:00,10,5,9,2018,Non-Violent
11506578,11/13/2018 09:50:00 PM,ROBBERY,STRONGARM - NO WEAPON,false,false,71,41.732403229,-87.652935952,2018-11-13T21:50:00.000+02:00,11,13,21,2018,Violent
11481052,10/18/2018 11:00:00 AM,THEFT,OVER $500,false,false,30,41.844542724,-87.702891376,2018-10-18T11:00:00.000+02:00,10,18,11,2018,Non-Violent
11497818,11/03/2018 10:10:00 PM,OTHER OFFENSE,FALSE/STOLEN/ALTERED TRP,false,false,27,41.87328131,-87.71974488,2018-11-03T22:10:00.000+02:00,11,3,22,2018,Non-Violent
11421927,08/22/2018 04:38:00 AM,THEFT,$500 AND UNDER,false,false,15,41.948697403,-87.760458406,2018-08-22T04:38:00.000+02:00,8,22,4,2018,Non-Violent
11549642,12/15/2018 09:00:00 AM,THEFT,$500 AND UNDER,false,false,71,41.744489768,-87.657220238,2018-12-15T09:00:00.000+02:00,12,15,9,2018,Non-Violent
11471332,10/09/2018 11:39:00 AM,ASSAULT,SIMPLE,false,true,68,41.793459182,-87.632972123,2018-10-09T11:39:00.000+02:00,10,9,11,2018,Violent
11527145,12/05/2018 02:00:00 PM,DECEPTIVE PRACTICE,CREDIT CARD FRAUD,false,false,7,41.927220974,-87.651909734,2018-12-05T14:00:00.000+02:00,12,5,14,2018,Non-Violent
11448538,09/17/2018 02:10:00 AM,BATTERY,DOMESTIC BATTERY SIMPLE,false,true,69,41.768195354,-87.629845212,2018-09-17T02:10:00.000+02:00,9,17,2,2018,Violent
11420069,08/19/2018 10:00:00 AM,ASSAULT,SIMPLE,false,true,35,41.836600771,-87.61677038,2018-08-19T10:00:00.000+02:00,8,19,10,2018,Violent
11431901,07/30/2018 06:00:00 PM,DECEPTIVE PRACTICE,"THEFT BY LESSEE,MOTOR VEH",false,false,33,41.857338981,-87.625598414,2018-07-30T18:00:00.000+02:00,7,30,18,2018,Non-Violent
11472075,10/09/2018 06:00:00 PM,BATTERY,DOMESTIC BATTERY SIMPLE,false,true,69,41.768039718,-87.620180492,2018-10-09T18:00:00.000+02:00,10,9,18,2018,Violent
11481136,10/19/2018 06:21:00 AM,BURGLARY,FORCIBLE ENTRY,false,false,25,41.909407901,-87.763135333,2018-10-19T06:21:00.000+02:00,10,19,6,2018,Non-Violent
11550532,12/23/2018 08:30:00 PM,OTHER OFFENSE,OTHER CRIME INVOLVING PROPERTY,false,false,67,41.779292747,-87.675615411,2018-12-23T20:30:00.000+02:00,12,23,20,2018,Non-Violent
11465954,10/03/2018 05:30:00 PM,BATTERY,DOMESTIC BATTERY SIMPLE,false,true,23,41.899738489,-87.717677093,2018-10-03T17:30:00.000+02:00,10,3,17,2018,Violent
11507839,11/15/2018 08:04:00 AM,SEX OFFENSE,CRIMINAL SEXUAL ABUSE,false,false,21,41.939300539,-87.711794487,2018-11-15T08:04:00.000+02:00,11,15,8,2018,Non-Violent
11456611,09/24/2018 12:26:00 AM,OTHER OFFENSE,HARASSMENT BY TELEPHONE,false,false,6,41.942276184,-87.640972435,2018-09-24T00:26:00.000+02:00,9,24,0,2018,Non-Violent
11437827,09/04/2018 03:20:00 PM,THEFT,$500 AND UNDER,false,false,76,41.977501441,-87.903979727,2018-09-04T15:20:00.000+02:00,9,4,15,2018,Non-Violent
11456769,09/24/2018 07:10:00 PM,NARCOTICS,MANU/DELIVER: HEROIN (WHITE),true,false,27,41.87190846,-87.701891882,2018-09-24T19:10:00.000+02:00,9,24,19,2018,Non-Violent
11458903,09/26/2018 04:15:00 PM,BATTERY,SIMPLE,false,false,23,41.895445293,-87.717964416,2018-09-26T16:15:00.000+02:00,9,26,16,2018,Violent
11437225,09/05/2018 01:55:00 PM,THEFT,RETAIL THEFT,false,false,31,41.851804072,-87.68563492,2018-09-05T13:55:00.000+02:00,9,5,13,2018,Non-Violent
11535760,12/14/2018 11:47:00 PM,ASSAULT,SIMPLE,true,false,61,41.815327389,-87.64233042,2018-12-14T23:47:00.000+02:00,12,14,23,2018,Violent
11427959,08/24/2018 01:28:00 PM,THEFT,OVER $500,false,false,24,,,2018-08-24T13:28:00.000+02:00,8,24,13,2018,Non-Violent
11460004,09/17/2018 03:55:00 PM,DECEPTIVE PRACTICE,ILLEGAL USE CASH CARD,false,false,43,41.754604525,-87.571164323,2018-09-17T15:55:00.000+02:00,9,17,15,2018,Non-Violent
11549370,12/28/2018 12:43:00 PM,NARCOTICS,POSS: PCP,true,false,68,41.778099133,-87.633828531,2018-12-28T12:43:00.000+02:00,12,28,12,2018,Non-Violent
11543142,12/21/2018 06:00:00 PM,OFFENSE INVOLVING CHILDREN,OTHER OFFENSE,false,true,30,41.836123843,-87.72798586,2018-12-21T18:00:00.000+02:00,12,21,18,2018,Non-Violent
11472914,10/07/2018 02:00:00 PM,THEFT,OVER $500,false,false,39,41.809297059,-87.591967028,2018-10-07T14:00:00.000+02:00,10,7,14,2018,Non-Violent
11524026,12/03/2018 12:20:00 PM,BATTERY,DOMESTIC BATTERY SIMPLE,false,true,21,41.933030902,-87.689058542,2018-12-03T12:20:00.000+02:00,12,3,12,2018,Violent
11524975,11/17/2018 04:45:00 AM,THEFT,FROM BUILDING,false,false,66,41.771276537,-87.68088819,2018-11-17T04:45:00.000+02:00,11,17,4,2018,Non-Violent
11551087,11/01/2018 10:30:00 PM,THEFT,FROM BUILDING,false,false,8,41.903203253,-87.627340259,2018-11-01T22:30:00.000+02:00,11,1,22,2018,Non-Violent
11432002,08/31/2018 02:00:00 PM,ASSAULT,SIMPLE,false,false,55,41.658218532,-87.547132212,2018-08-31T14:00:00.000+02:00,8,31,14,2018,Violent
11448965,09/13/2018 01:00:00 PM,ASSAULT,AGG PO HANDS NO/MIN INJURY,true,false,69,41.754168689,-87.601635756,2018-09-13T13:00:00.000+02:00,9,13,13,2018,Violent
11537910,10/29/2018 09:00:00 AM,DECEPTIVE PRACTICE,FINANCIAL IDENTITY THEFT OVER $ 300,false,false,75,41.696433271,-87.647376059,2018-10-29T09:00:00.000+02:00,10,29,9,2018,Non-Violent
11446339,09/14/2018 03:55:00 PM,BATTERY,SIMPLE,false,false,28,41.879648794,-87.686393005,2018-09-14T15:55:00.000+02:00,9,14,15,2018,Violent
11421849,08/20/2018 10:00:00 AM,BURGLARY,UNLAWFUL ENTRY,false,false,67,41.774873231,-87.661652469,2018-08-20T10:00:00.000+02:00,8,20,10,2018,Non-Violent
11433732,09/01/2018 07:30:00 PM,THEFT,$500 AND UNDER,false,false,14,41.967476777,-87.705997659,2018-09-01T19:30:00.000+02:00,9,1,19,2018,Non-Violent
11462724,09/30/2018 10:00:00 AM,CRIMINAL DAMAGE,TO PROPERTY,false,false,67,41.769340154,-87.674826304,2018-09-30T10:00:00.000+02:00,9,30,10,2018,Non-Violent
11464910,10/02/2018 04:45:00 PM,THEFT,FROM BUILDING,false,false,24,41.903316225,-87.66927844,2018-10-02T16:45:00.000+02:00,10,2,16,2018,Non-Violent
11462452,09/27/2018 01:00:00 PM,BATTERY,DOMESTIC BATTERY SIMPLE,false,true,72,41.708202534,-87.659237633,2018-09-27T13:00:00.000+02:00,9,27,13,2018,Violent
11456000,09/24/2018 12:10:00 AM,CRIM SEXUAL ASSAULT,NON-AGGRAVATED,false,false,26,41.876959033,-87.735961599,2018-09-24T00:10:00.000+02:00,9,24,0,2018,Non-Violent
11508809,11/16/2018 06:30:00 AM,CRIMINAL TRESPASS,TO LAND,false,false,33,41.863160559,-87.621323445,2018-11-16T06:30:00.000+02:00,11,16,6,2018,Non-Violent
11434880,09/03/2018 05:00:00 AM,MOTOR VEHICLE THEFT,AUTOMOBILE,false,false,8,41.893962515,-87.636176148,2018-09-03T05:00:00.000+02:00,9,3,5,2018,Non-Violent
11513833,11/18/2018 03:23:00 PM,THEFT,FROM BUILDING,false,false,22,41.918231032,-87.713946349,2018-11-18T15:23:00.000+02:00,11,18,15,2018,Non-Violent
11494880,11/01/2018 06:40:00 PM,NARCOTICS,MANU/DEL:CANNABIS 10GM OR LESS,true,false,29,41.86181223,-87.710412608,2018-11-01T18:40:00.000+02:00,11,1,18,2018,Non-Violent
11457525,09/25/2018 07:50:00 AM,ASSAULT,SIMPLE,false,false,68,41.773842159,-87.644634557,2018-09-25T07:50:00.000+02:00,9,25,7,2018,Violent
11423737,08/23/2018 04:15:00 PM,THEFT,$500 AND UNDER,false,false,33,41.858633393,-87.622346444,2018-08-23T16:15:00.000+02:00,8,23,16,2018,Non-Violent
11462115,09/29/2018 07:01:00 PM,ASSAULT,SIMPLE,true,false,75,41.691790031,-87.642365396,2018-09-29T19:01:00.000+02:00,9,29,19,2018,Violent
11410564,08/11/2018 10:33:00 AM,CRIMINAL DAMAGE,TO PROPERTY,false,false,43,41.759012808,-87.560215615,2018-08-11T10:33:00.000+02:00,8,11,10,2018,Non-Violent
11457677,09/25/2018 01:30:00 PM,THEFT,FROM BUILDING,false,false,6,41.938789834,-87.668631194,2018-09-25T13:30:00.000+02:00,9,25,13,2018,Non-Violent
11486560,10/24/2018 07:15:00 PM,DECEPTIVE PRACTICE,THEFT OF LABOR/SERVICES,false,false,38,41.809347098,-87.618919216,2018-10-24T19:15:00.000+02:00,10,24,19,2018,Non-Violent
11427917,08/27/2018 04:35:00 AM,THEFT,$500 AND UNDER,false,false,3,41.974567632,-87.663232139,2018-08-27T04:35:00.000+02:00,8,27,4,2018,Non-Violent
11538871,12/17/2018 07:15:00 PM,CRIMINAL DAMAGE,TO VEHICLE,false,false,51,41.712390419,-87.571403187,2018-12-17T19:15:00.000+02:00,12,17,19,2018,Non-Violent
11538434,12/15/2018 03:45:00 AM,THEFT,OVER $500,false,false,8,41.903916987,-87.630509932,2018-12-15T03:45:00.000+02:00,12,15,3,2018,Non-Violent
11406900,08/07/2018 10:00:00 PM,THEFT,OVER $500,false,false,32,41.872910562,-87.63062942,2018-08-07T22:00:00.000+02:00,8,7,22,2018,Non-Violent
11495579,10/31/2018 08:15:00 PM,THEFT,RETAIL THEFT,false,false,6,41.940573534,-87.644416473,2018-10-31T20:15:00.000+02:00,10,31,20,2018,Non-Violent
11550955,12/30/2018 08:00:00 AM,BATTERY,DOMESTIC BATTERY SIMPLE,false,true,35,41.843892459,-87.622098627,2018-12-30T08:00:00.000+02:00,12,30,8,2018,Violent
11501045,11/06/2018 07:00:00 AM,THEFT,OVER $500,false,false,24,,,2018-11-06T07:00:00.000+02:00,11,6,7,2018,Non-Violent
11524609,12/01/2018 06:21:00 PM,THEFT,$500 AND UNDER,false,false,61,41.808659359,-87.660921846,2018-12-01T18:21:00.000+02:00,12,1,18,2018,Non-Violent
11490656,10/28/2018 04:45:00 PM,THEFT,OVER $500,true,true,73,41.728064071,-87.657985968,2018-10-28T16:45:00.000+02:00,10,28,16,2018,Non-Violent
11450701,09/19/2018 12:25:00 AM,CRIMINAL DAMAGE,TO VEHICLE,false,false,23,41.901644368,-87.718959143,2018-09-19T00:25:00.000+02:00,9,19,0,2018,Non-Violent
11471118,10/05/2018 08:00:00 AM,NARCOTICS,FOUND SUSPECT NARCOTICS,true,false,68,41.778099133,-87.633828531,2018-10-05T08:00:00.000+02:00,10,5,8,2018,Non-Violent
11513170,11/20/2018 07:50:00 PM,THEFT,$500 AND UNDER,false,false,29,41.858347639,-87.695667396,2018-11-20T19:50:00.000+02:00,11,20,19,2018,Non-Violent
11517076,11/25/2018 04:00:00 PM,THEFT,$500 AND UNDER,false,false,28,41.887347825,-87.65015217,2018-11-25T16:00:00.000+02:00,11,25,16,2018,Non-Violent
11526705,12/03/2018 09:00:00 PM,BATTERY,DOMESTIC BATTERY SIMPLE,false,true,59,41.830676898,-87.67040401,2018-12-03T21:00:00.000+02:00,12,3,21,2018,Violent
11413362,08/13/2018 06:30:00 PM,THEFT,$500 AND UNDER,false,false,29,41.850500316,-87.724730491,2018-08-13T18:30:00.000+02:00,8,13,18,2018,Non-Violent
11530643,12/09/2018 11:35:00 PM,ASSAULT,PRO EMP HANDS NO/MIN INJURY,true,false,8,41.896561044,-87.636584978,2018-12-09T23:35:00.000+02:00,12,9,23,2018,Violent
11456371,09/15/2018 09:00:00 AM,NARCOTICS,FOUND SUSPECT NARCOTICS,true,false,29,41.868180939,-87.709271389,2018-09-15T09:00:00.000+02:00,9,15,9,2018,Non-Violent
11477577,10/15/2018 05:00:00 PM,THEFT,OVER $500,false,false,32,41.86850963,-87.625849698,2018-10-15T17:00:00.000+02:00,10,15,17,2018,Non-Violent
11529746,12/09/2018 12:30:00 AM,BATTERY,AGGRAVATED: HANDGUN,false,false,71,41.73887651,-87.650991641,2018-12-09T00:30:00.000+02:00,12,9,0,2018,Violent
11417678,08/17/2018 10:45:00 PM,CRIMINAL DAMAGE,TO PROPERTY,false,false,52,41.717781046,-87.533557491,2018-08-17T22:45:00.000+02:00,8,17,22,2018,Non-Violent
11492466,10/30/2018 04:30:00 PM,CRIMINAL DAMAGE,TO VEHICLE,false,false,25,41.894885819,-87.761016679,2018-10-30T16:30:00.000+02:00,10,30,16,2018,Non-Violent
11495956,11/02/2018 11:00:00 AM,ASSAULT,SIMPLE,false,false,3,41.957958211,-87.65271475,2018-11-02T11:00:00.000+02:00,11,2,11,2018,Violent
11468829,10/06/2018 06:00:00 PM,CRIMINAL DAMAGE,TO PROPERTY,false,false,56,41.810593368,-87.751797653,2018-10-06T18:00:00.000+02:00,10,6,18,2018,Non-Violent
11492225,10/29/2018 10:00:00 PM,CRIMINAL DAMAGE,TO PROPERTY,false,false,32,41.887060789,-87.62853897,2018-10-29T22:00:00.000+02:00,10,29,22,2018,Non-Violent
11508192,11/15/2018 06:14:00 AM,BURGLARY,UNLAWFUL ENTRY,true,false,41,41.795215861,-87.584725186,2018-11-15T06:14:00.000+02:00,11,15,6,2018,Non-Violent
11528482,12/07/2018 04:20:00 PM,ASSAULT,SIMPLE,false,false,6,41.939956885,-87.650983917,2018-12-07T16:20:00.000+02:00,12,7,16,2018,Violent
11416166,08/11/2018 12:00:00 PM,THEFT,OVER $500,false,false,30,41.851785907,-87.703587385,2018-08-11T12:00:00.000+02:00,8,11,12,2018,Non-Violent
11481226,10/17/2018 03:00:00 PM,CRIMINAL TRESPASS,TO VEHICLE,false,false,2,42.000107009,-87.682643126,2018-10-17T15:00:00.000+02:00,10,17,15,2018,Non-Violent
11548533,12/27/2018 08:00:00 PM,THEFT,$500 AND UNDER,false,false,23,41.895736721,-87.711442061,2018-12-27T20:00:00.000+02:00,12,27,20,2018,Non-Violent
11517979,11/26/2018 07:30:00 PM,MOTOR VEHICLE THEFT,AUTOMOBILE,false,false,31,41.854812268,-87.66606573,2018-11-26T19:30:00.000+02:00,11,26,19,2018,Non-Violent
11498959,11/05/2018 08:13:00 PM,THEFT,RETAIL THEFT,true,false,23,41.912437783,-87.736189335,2018-11-05T20:13:00.000+02:00,11,5,20,2018,Non-Violent
11425205,08/25/2018 05:35:00 AM,PROSTITUTION,SOLICIT ON PUBLIC WAY,true,false,58,41.808156142,-87.701843422,2018-08-25T05:35:00.000+02:00,8,25,5,2018,Non-Violent
11528299,12/07/2018 04:00:00 AM,CRIMINAL DAMAGE,TO VEHICLE,false,false,60,41.844511884,-87.639014374,2018-12-07T04:00:00.000+02:00,12,7,4,2018,Non-Violent
11508828,11/07/2018 11:00:00 AM,DECEPTIVE PRACTICE,CREDIT CARD FRAUD,false,false,25,41.867395821,-87.767492249,2018-11-07T11:00:00.000+02:00,11,7,11,2018,Non-Violent
11424383,08/21/2018 10:30:00 PM,THEFT,FROM BUILDING,false,false,6,41.938323218,-87.668613987,2018-08-21T22:30:00.000+02:00,8,21,22,2018,Non-Violent
11436559,09/04/2018 06:00:00 AM,BURGLARY,FORCIBLE ENTRY,false,false,15,41.961373748,-87.74756813,2018-09-04T06:00:00.000+02:00,9,4,6,2018,Non-Violent
11538597,12/17/2018 08:50:00 PM,THEFT,$500 AND UNDER,false,true,40,41.792283676,-87.615918378,2018-12-17T20:50:00.000+02:00,12,17,20,2018,Non-Violent
11536027,12/15/2018 11:00:00 AM,BATTERY,DOMESTIC BATTERY SIMPLE,false,true,29,41.865302446,-87.719498108,2018-12-15T11:00:00.000+02:00,12,15,11,2018,Violent
11509469,11/16/2018 07:30:00 PM,NARCOTICS,MANU/DEL:CANNABIS OVER 10 GMS,true,false,75,41.687257014,-87.650735585,2018-11-16T19:30:00.000+02:00,11,16,19,2018,Non-Violent
11462865,09/30/2018 03:01:00 PM,DECEPTIVE PRACTICE,CREDIT CARD FRAUD,false,false,32,41.878222138,-87.627288482,2018-09-30T15:01:00.000+02:00,9,30,15,2018,Non-Violent
11431951,08/31/2018 12:30:00 PM,THEFT,$500 AND UNDER,false,false,32,41.882381731,-87.629412971,2018-08-31T12:30:00.000+02:00,8,31,12,2018,Non-Violent
11466923,10/04/2018 07:30:00 AM,CRIMINAL DAMAGE,TO VEHICLE,false,false,31,41.85654051,-87.648244669,2018-10-04T07:30:00.000+02:00,10,4,7,2018,Non-Violent
11509412,11/16/2018 05:57:00 PM,NARCOTICS,POSS: METHAMPHETAMINES,true,false,52,41.694734943,-87.525806046,2018-11-16T17:57:00.000+02:00,11,16,17,2018,Non-Violent
11481278,07/01/2018 12:00:00 PM,DECEPTIVE PRACTICE,THEFT OF LABOR/SERVICES,false,false,53,41.679783379,-87.628327037,2018-07-01T12:00:00.000+02:00,7,1,12,2018,Non-Violent
11528030,11/29/2018 06:00:00 PM,THEFT,FROM BUILDING,false,false,8,41.894821547,-87.632133928,2018-11-29T18:00:00.000+02:00,11,29,18,2018,Non-Violent
11547851,12/26/2018 11:00:00 PM,THEFT,OVER $500,false,false,56,41.797480158,-87.769765343,2018-12-26T23:00:00.000+02:00,12,26,23,2018,Non-Violent
11454306,09/22/2018 10:00:00 AM,BATTERY,SIMPLE,false,false,8,41.889530538,-87.616557422,2018-09-22T10:00:00.000+02:00,9,22,10,2018,Violent
11529133,12/08/2018 10:09:00 AM,THEFT,RETAIL THEFT,true,false,50,41.695982095,-87.596653142,2018-12-08T10:09:00.000+02:00,12,8,10,2018,Non-Violent
11454973,09/22/2018 05:00:00 PM,THEFT,OVER $500,false,false,8,41.908068111,-87.633058026,2018-09-22T17:00:00.000+02:00,9,22,17,2018,Non-Violent
11532127,12/10/2018 01:40:00 PM,CRIMINAL DAMAGE,TO VEHICLE,false,false,16,41.949130788,-87.716459493,2018-12-10T13:40:00.000+02:00,12,10,13,2018,Non-Violent
11475329,09/17/2018 10:00:00 AM,DECEPTIVE PRACTICE,"THEFT BY LESSEE,MOTOR VEH",false,false,6,41.933582379,-87.645517082,2018-09-17T10:00:00.000+02:00,9,17,10,2018,Non-Violent
11418083,07/26/2018 05:58:00 AM,DECEPTIVE PRACTICE,FINANCIAL IDENTITY THEFT OVER $ 300,false,false,66,41.778619322,-87.683625816,2018-07-26T05:58:00.000+02:00,7,26,5,2018,Non-Violent
11473170,10/11/2018 01:30:00 AM,OTHER OFFENSE,VIOLATE ORDER OF PROTECTION,true,true,28,41.87115403,-87.664133439,2018-10-11T01:30:00.000+02:00,10,11,1,2018,Non-Violent
11443619,09/11/2018 06:08:00 PM,CRIMINAL DAMAGE,TO PROPERTY,false,false,43,41.763467387,-87.567679923,2018-09-11T18:08:00.000+02:00,9,11,18,2018,Non-Violent
11468548,10/05/2018 08:30:00 AM,BURGLARY,FORCIBLE ENTRY,false,false,23,41.890404632,-87.716525361,2018-10-05T08:30:00.000+02:00,10,5,8,2018,Non-Violent
11481666,10/19/2018 06:15:00 PM,MOTOR VEHICLE THEFT,AUTOMOBILE,false,false,7,41.918248964,-87.643903416,2018-10-19T18:15:00.000+02:00,10,19,18,2018,Non-Violent
11435350,09/03/2018 05:29:00 PM,BATTERY,SIMPLE,false,false,32,41.869710651,-87.627477612,2018-09-03T17:29:00.000+02:00,9,3,17,2018,Violent
11543047,12/21/2018 07:30:00 PM,ROBBERY,STRONGARM - NO WEAPON,false,false,29,41.862382133,-87.716857164,2018-12-21T19:30:00.000+02:00,12,21,19,2018,Violent
11481489,10/17/2018 07:00:00 AM,BATTERY,PRO EMP HANDS NO/MIN INJURY,false,false,8,41.908185345,-87.639713484,2018-10-17T07:00:00.000+02:00,10,17,7,2018,Violent
11419786,08/20/2018 02:20:00 AM,BATTERY,AGGRAVATED: OTHER DANG WEAPON,true,false,32,41.871489164,-87.627516791,2018-08-20T02:20:00.000+02:00,8,20,2,2018,Violent
11539860,12/18/2018 09:50:00 PM,WEAPONS VIOLATION,UNLAWFUL POSS OF HANDGUN,true,false,69,41.757709956,-87.626360608,2018-12-18T21:50:00.000+02:00,12,18,21,2018,Non-Violent
11519596,11/28/2018 11:30:00 AM,THEFT,POCKET-PICKING,false,false,24,41.910699488,-87.662886582,2018-11-28T11:30:00.000+02:00,11,28,11,2018,Non-Violent
11536626,12/15/2018 08:30:00 PM,THEFT,OVER $500,false,false,46,41.75059921,-87.577185152,2018-12-15T20:30:00.000+02:00,12,15,20,2018,Non-Violent
11431794,08/30/2018 07:00:00 PM,MOTOR VEHICLE THEFT,AUTOMOBILE,false,false,21,41.940154319,-87.715413952,2018-08-30T19:00:00.000+02:00,8,30,19,2018,Non-Violent
11476190,10/14/2018 10:42:00 AM,ASSAULT,AGG PO HANDS NO/MIN INJURY,true,false,25,41.87568405,-87.760413266,2018-10-14T10:42:00.000+02:00,10,14,10,2018,Violent
11482139,10/20/2018 04:00:00 AM,CRIM SEXUAL ASSAULT,ATTEMPT AGG: OTHER,false,true,43,41.754758711,-87.566291811,2018-10-20T04:00:00.000+02:00,10,20,4,2018,Non-Violent
11523342,12/02/2018 05:42:00 PM,THEFT,$500 AND UNDER,false,false,25,41.896810209,-87.749161243,2018-12-02T17:42:00.000+02:00,12,2,17,2018,Non-Violent
11510934,11/17/2018 02:41:00 PM,DECEPTIVE PRACTICE,FINANCIAL IDENTITY THEFT OVER $ 300,false,false,6,41.933796108,-87.644548217,2018-11-17T14:41:00.000+02:00,11,17,14,2018,Non-Violent
11433178,08/31/2018 10:30:00 PM,THEFT,$500 AND UNDER,false,false,25,41.884739981,-87.747879385,2018-08-31T22:30:00.000+02:00,8,31,22,2018,Non-Violent
11456692,09/24/2018 05:00:00 PM,PUBLIC PEACE VIOLATION,RECKLESS CONDUCT,true,false,26,41.873907046,-87.725430093,2018-09-24T17:00:00.000+02:00,9,24,17,2018,Non-Violent
11444091,09/10/2018 10:00:00 AM,THEFT,$500 AND UNDER,false,false,29,41.856299064,-87.705382147,2018-09-10T10:00:00.000+02:00,9,10,10,2018,Non-Violent
11421040,01/13/2018 05:26:00 PM,DECEPTIVE PRACTICE,ILLEGAL USE CASH CARD,false,false,32,41.881776822,-87.620767948,2018-01-13T17:26:00.000+02:00,1,13,17,2018,Non-Violent
11434618,09/03/2018 01:15:00 AM,BATTERY,SIMPLE,false,false,30,41.841759567,-87.715939505,2018-09-03T01:15:00.000+02:00,9,3,1,2018,Violent
11491979,08/27/2018 12:00:00 PM,DECEPTIVE PRACTICE,FORGERY,true,false,73,41.726123768,-87.640913299,2018-08-27T12:00:00.000+02:00,8,27,12,2018,Non-Violent
11495711,11/02/2018 12:45:00 PM,BATTERY,SIMPLE,true,false,28,41.868525427,-87.639231868,2018-11-02T12:45:00.000+02:00,11,2,12,2018,Violent
11552018,12/30/2018 06:00:00 PM,BATTERY,SIMPLE,false,false,17,41.947483095,-87.815641826,2018-12-30T18:00:00.000+02:00,12,30,18,2018,Violent
11407943,08/03/2018 02:58:00 AM,CRIMINAL DAMAGE,TO PROPERTY,false,false,42,41.774246451,-87.602144473,2018-08-03T02:58:00.000+02:00,8,3,2,2018,Non-Violent
11412407,08/13/2018 11:20:00 AM,NARCOTICS,POSS: COCAINE,true,false,60,41.844583139,-87.657866687,2018-08-13T11:20:00.000+02:00,8,13,11,2018,Non-Violent
11412102,08/12/2018 10:45:00 PM,BATTERY,DOMESTIC BATTERY SIMPLE,false,true,53,41.673727949,-87.628543194,2018-08-12T22:45:00.000+02:00,8,12,22,2018,Violent
11470676,10/08/2018 06:27:00 PM,CRIMINAL TRESPASS,TO STATE SUP LAND,true,false,32,41.875200014,-87.627619163,2018-10-08T18:27:00.000+02:00,10,8,18,2018,Non-Violent
11501697,07/21/2018 08:49:00 AM,NARCOTICS,MANU/DELIVER:CRACK,true,false,27,,,2018-07-21T08:49:00.000+02:00,7,21,8,2018,Non-Violent
11436062,09/04/2018 12:50:00 PM,BATTERY,AGGRAVATED DOMESTIC BATTERY: OTHER DANG WEAPON,false,true,25,41.88791087,-87.771204147,2018-09-04T12:50:00.000+02:00,9,4,12,2018,Violent
11475665,10/13/2018 06:03:00 PM,NARCOTICS,POSS: CANNABIS MORE THAN 30GMS,true,false,48,41.724325923,-87.553880322,2018-10-13T18:03:00.000+02:00,10,13,18,2018,Non-Violent
11459168,09/26/2018 08:10:00 PM,CRIMINAL DAMAGE,TO PROPERTY,false,false,8,41.896083132,-87.629765732,2018-09-26T20:10:00.000+02:00,9,26,20,2018,Non-Violent
11422200,08/22/2018 10:00:00 AM,CRIMINAL DAMAGE,TO VEHICLE,false,false,7,41.91091257,-87.6487694,2018-08-22T10:00:00.000+02:00,8,22,10,2018,Non-Violent
11438029,09/06/2018 08:30:00 AM,BATTERY,AGG PO HANDS NO/MIN INJURY,false,false,63,41.787280859,-87.70093729,2018-09-06T08:30:00.000+02:00,9,6,8,2018,Violent
11480510,10/18/2018 05:45:00 PM,NARCOTICS,POSS: CRACK,true,false,23,41.888806747,-87.721002933,2018-10-18T17:45:00.000+02:00,10,18,17,2018,Non-Violent
11535216,12/14/2018 01:23:00 PM,WEAPONS VIOLATION,UNLAWFUL POSS OF HANDGUN,true,false,75,41.689831688,-87.663881535,2018-12-14T13:23:00.000+02:00,12,14,13,2018,Non-Violent
11514070,11/21/2018 09:30:00 PM,ASSAULT,SIMPLE,false,true,28,41.861698243,-87.651688112,2018-11-21T21:30:00.000+02:00,11,21,21,2018,Violent
11434620,09/03/2018 12:00:00 AM,CRIM SEXUAL ASSAULT,NON-AGGRAVATED,false,false,67,41.768213543,-87.673617146,2018-09-03T00:00:00.000+02:00,9,3,0,2018,Non-Violent
11473238,10/10/2018 11:00:00 PM,THEFT,$500 AND UNDER,false,false,43,41.7548025,-87.558503315,2018-10-10T23:00:00.000+02:00,10,10,23,2018,Non-Violent
11421825,08/21/2018 07:00:00 PM,THEFT,$500 AND UNDER,false,false,43,41.769832606,-87.573649116,2018-08-21T19:00:00.000+02:00,8,21,19,2018,Non-Violent
11527314,12/06/2018 12:30:00 PM,THEFT,$500 AND UNDER,false,false,7,41.911669895,-87.631931184,2018-12-06T12:30:00.000+02:00,12,6,12,2018,Non-Violent
11462757,09/28/2018 12:00:00 PM,THEFT,$500 AND UNDER,false,false,5,41.94368716,-87.678468063,2018-09-28T12:00:00.000+02:00,9,28,12,2018,Non-Violent
11558963,12/18/2018 06:00:00 PM,THEFT,FROM BUILDING,false,false,24,41.894079339,-87.677913604,2018-12-18T18:00:00.000+02:00,12,18,18,2018,Non-Violent
11549877,12/29/2018 03:00:00 AM,DECEPTIVE PRACTICE,THEFT OF LABOR/SERVICES,false,false,6,41.950669614,-87.666750589,2018-12-29T03:00:00.000+02:00,12,29,3,2018,Non-Violent
11530797,11/28/2018 01:30:00 PM,THEFT,OVER $500,false,false,32,41.87766908,-87.629284766,2018-11-28T13:30:00.000+02:00,11,28,13,2018,Non-Violent
11473323,10/10/2018 02:00:00 AM,ROBBERY,ATTEMPT: ARMED-OTHER DANG WEAP,false,false,49,41.722248248,-87.625064445,2018-10-10T02:00:00.000+02:00,10,10,2,2018,Violent
11418382,08/18/2018 03:30:00 PM,CRIMINAL DAMAGE,TO VEHICLE,false,false,26,41.88363012,-87.73434608,2018-08-18T15:30:00.000+02:00,8,18,15,2018,Non-Violent
11550352,12/06/2018 02:50:00 PM,THEFT,OVER $500,false,false,46,41.73365047,-87.557845321,2018-12-06T14:50:00.000+02:00,12,6,14,2018,Non-Violent
11544023,12/18/2018 03:30:00 PM,THEFT,$500 AND UNDER,false,false,8,41.900424796,-87.642467932,2018-12-18T15:30:00.000+02:00,12,18,15,2018,Non-Violent
11475111,10/12/2018 11:24:00 PM,BATTERY,AGGRAVATED: HANDGUN,false,false,24,41.906433438,-87.677353771,2018-10-12T23:24:00.000+02:00,10,12,23,2018,Violent
11459702,09/24/2018 11:15:00 AM,BATTERY,SIMPLE,false,false,3,41.96203391,-87.645898728,2018-09-24T11:15:00.000+02:00,9,24,11,2018,Violent
11473765,10/10/2018 07:00:00 PM,CRIMINAL DAMAGE,TO VEHICLE,false,false,68,41.773539841,-87.635465451,2018-10-10T19:00:00.000+02:00,10,10,19,2018,Non-Violent
11409105,08/08/2018 01:00:00 AM,THEFT,$500 AND UNDER,false,false,21,41.939961934,-87.702742594,2018-08-08T01:00:00.000+02:00,8,8,1,2018,Non-Violent
11504661,11/11/2018 10:36:00 PM,BATTERY,DOMESTIC BATTERY SIMPLE,false,true,63,41.794937638,-87.697495512,2018-11-11T22:36:00.000+02:00,11,11,22,2018,Violent
11423278,08/22/2018 06:00:00 PM,BURGLARY,FORCIBLE ENTRY,false,false,73,41.718520732,-87.644353776,2018-08-22T18:00:00.000+02:00,8,22,18,2018,Non-Violent
11434938,09/01/2018 12:00:00 AM,ROBBERY,STRONGARM - NO WEAPON,false,false,40,41.794766069,-87.618369729,2018-09-01T00:00:00.000+02:00,9,1,0,2018,Violent
11408589,08/08/2018 07:00:00 PM,MOTOR VEHICLE THEFT,AUTOMOBILE,false,false,61,41.800346189,-87.665970935,2018-08-08T19:00:00.000+02:00,8,8,19,2018,Non-Violent
11502075,11/08/2018 07:57:00 PM,ROBBERY,AGGRAVATED,true,false,22,41.920394271,-87.66845103,2018-11-08T19:57:00.000+02:00,11,8,19,2018,Violent
11409602,08/10/2018 03:30:00 PM,THEFT,$500 AND UNDER,false,false,65,41.777874488,-87.734949916,2018-08-10T15:30:00.000+02:00,8,10,15,2018,Non-Violent
11419598,06/04/2018 08:00:00 PM,CRIM SEXUAL ASSAULT,NON-AGGRAVATED,false,false,61,41.803022253,-87.677954838,2018-06-04T20:00:00.000+02:00,6,4,20,2018,Non-Violent
11439924,09/07/2018 08:00:00 PM,BURGLARY,FORCIBLE ENTRY,false,false,55,41.654593487,-87.551995518,2018-09-07T20:00:00.000+02:00,9,7,20,2018,Non-Violent
11500202,10/30/2018 01:30:00 PM,BATTERY,SIMPLE,false,false,10,41.99732203,-87.792716276,2018-10-30T13:30:00.000+02:00,10,30,13,2018,Violent
11413734,08/01/2018 08:30:00 AM,OTHER OFFENSE,LICENSE VIOLATION,false,false,31,41.85836391,-87.666164631,2018-08-01T08:30:00.000+02:00,8,1,8,2018,Non-Violent
11421843,08/21/2018 09:30:00 PM,BATTERY,AGGRAVATED: OTHER DANG WEAPON,false,false,25,41.874741802,-87.763528016,2018-08-21T21:30:00.000+02:00,8,21,21,2018,Violent
11524513,12/03/2018 03:53:00 PM,CRIMINAL DAMAGE,TO PROPERTY,false,true,26,41.879784993,-87.723832113,2018-12-03T15:53:00.000+02:00,12,3,15,2018,Non-Violent
11497294,11/03/2018 07:50:00 PM,ROBBERY,STRONGARM - NO WEAPON,false,false,28,41.874167643,-87.686235321,2018-11-03T19:50:00.000+02:00,11,3,19,2018,Violent
11517718,11/26/2018 06:00:00 PM,NARCOTICS,POSS: HEROIN(WHITE),true,false,25,41.872274452,-87.764581664,2018-11-26T18:00:00.000+02:00,11,26,18,2018,Non-Violent
11494416,10/31/2018 02:15:00 PM,BATTERY,SIMPLE,false,false,8,41.907148528,-87.649404745,2018-10-31T14:15:00.000+02:00,10,31,14,2018,Violent
11435251,06/22/2018 05:45:00 PM,DECEPTIVE PRACTICE,FINANCIAL IDENTITY THEFT OVER $ 300,false,false,60,41.839091659,-87.652254686,2018-06-22T17:45:00.000+02:00,6,22,17,2018,Non-Violent
11455618,09/21/2018 11:00:00 AM,THEFT,OVER $500,false,false,28,41.865397377,-87.640660777,2018-09-21T11:00:00.000+02:00,9,21,11,2018,Non-Violent
11497365,11/04/2018 08:50:00 AM,ASSAULT,SIMPLE,true,false,50,41.702982867,-87.602670447,2018-11-04T08:50:00.000+02:00,11,4,8,2018,Violent
11536087,12/13/2018 02:39:00 PM,DECEPTIVE PRACTICE,COUNTERFEITING DOCUMENT,false,false,7,41.910857665,-87.651995629,2018-12-13T14:39:00.000+02:00,12,13,14,2018,Non-Violent
11443320,09/10/2018 11:15:00 PM,THEFT,OVER $500,false,false,24,41.910760821,-87.688448576,2018-09-10T23:15:00.000+02:00,9,10,23,2018,Non-Violent
11474557,10/09/2018 11:30:00 PM,THEFT,OVER $500,false,false,8,41.908374097,-87.628796854,2018-10-09T23:30:00.000+02:00,10,9,23,2018,Non-Violent
11414164,08/14/2018 07:59:00 PM,NARCOTICS,MANU/DELIVER: HEROIN (WHITE),true,false,29,41.849473819,-87.724703518,2018-08-14T19:59:00.000+02:00,8,14,19,2018,Non-Violent
11501904,11/08/2018 04:30:00 PM,THEFT,RETAIL THEFT,true,false,3,41.963070794,-87.655984213,2018-11-08T16:30:00.000+02:00,11,8,16,2018,Non-Violent
11502150,11/08/2018 11:59:00 PM,OTHER OFFENSE,VEHICLE TITLE/REG OFFENSE,true,false,19,41.92129584,-87.765888236,2018-11-08T23:59:00.000+02:00,11,8,23,2018,Non-Violent
11442386,09/10/2018 04:06:00 PM,BATTERY,AGGRAVATED: HANDGUN,false,false,44,41.729329016,-87.606240614,2018-09-10T16:06:00.000+02:00,9,10,16,2018,Violent
11457801,09/21/2018 05:45:00 PM,BATTERY,SIMPLE,false,false,44,41.750940757,-87.625185222,2018-09-21T17:45:00.000+02:00,9,21,17,2018,Violent
11556478,11/07/2018 12:30:00 PM,OTHER OFFENSE,VEHICLE TITLE/REG OFFENSE,false,false,8,41.893255699,-87.629176054,2018-11-07T12:30:00.000+02:00,11,7,12,2018,Non-Violent
11482921,10/20/2018 11:50:00 PM,BURGLARY,FORCIBLE ENTRY,false,false,31,41.859096449,-87.657684607,2018-10-20T23:50:00.000+02:00,10,20,23,2018,Non-Violent
11524315,12/02/2018 02:57:00 PM,ROBBERY,VEHICULAR HIJACKING,false,false,43,41.754620386,-87.576053139,2018-12-02T14:57:00.000+02:00,12,2,14,2018,Violent
11476125,10/14/2018 11:12:00 AM,OTHER OFFENSE,FALSE/STOLEN/ALTERED TRP,true,false,53,41.684809877,-87.642147208,2018-10-14T11:12:00.000+02:00,10,14,11,2018,Non-Violent
11517560,11/26/2018 08:50:00 AM,CRIMINAL DAMAGE,TO VEHICLE,false,false,29,41.862379685,-87.716912254,2018-11-26T08:50:00.000+02:00,11,26,8,2018,Non-Violent
11505350,11/12/2018 05:15:00 PM,CRIMINAL DAMAGE,TO PROPERTY,false,false,24,41.910334976,-87.686410216,2018-11-12T17:15:00.000+02:00,11,12,17,2018,Non-Violent
11468626,10/06/2018 11:20:00 AM,ASSAULT,SIMPLE,false,true,21,41.941950292,-87.704024179,2018-10-06T11:20:00.000+02:00,10,6,11,2018,Violent
11472835,10/10/2018 04:45:00 PM,CRIMINAL DAMAGE,TO PROPERTY,false,false,70,41.748734439,-87.708465372,2018-10-10T16:45:00.000+02:00,10,10,16,2018,Non-Violent
11426754,08/25/2018 03:00:00 PM,THEFT,OVER $500,false,false,72,41.715151093,-87.673409213,2018-08-25T15:00:00.000+02:00,8,25,15,2018,Non-Violent
11476328,10/13/2018 12:00:00 AM,BATTERY,DOMESTIC BATTERY SIMPLE,false,true,59,41.83303829,-87.677806508,2018-10-13T00:00:00.000+02:00,10,13,0,2018,Violent
11548366,12/27/2018 05:00:00 PM,THEFT,RETAIL THEFT,true,false,44,41.737473519,-87.604844389,2018-12-27T17:00:00.000+02:00,12,27,17,2018,Non-Violent
11484353,10/19/2018 04:00:00 PM,ASSAULT,SIMPLE,false,true,71,41.742900733,-87.643814722,2018-10-19T16:00:00.000+02:00,10,19,16,2018,Violent
11491032,09/04/2018 02:18:00 PM,NARCOTICS,MANU/DELIVER:CRACK,true,false,29,,,2018-09-04T14:18:00.000+02:00,9,4,14,2018,Non-Violent
11496512,11/03/2018 09:40:00 AM,ASSAULT,SIMPLE,true,true,25,41.87403204,-87.747903681,2018-11-03T09:40:00.000+02:00,11,3,9,2018,Violent
11542403,12/21/2018 08:00:00 AM,NON-CRIMINAL,LOST PASSPORT,false,false,25,41.89189637,-87.773626289,2018-12-21T08:00:00.000+02:00,12,21,8,2018,Non-Violent
11489992,10/26/2018 11:14:00 AM,ROBBERY,STRONGARM - NO WEAPON,false,false,28,41.876314996,-87.649527968,2018-10-26T11:14:00.000+02:00,10,26,11,2018,Violent
11533242,12/12/2018 03:57:00 PM,NARCOTICS,POSS: CANNABIS MORE THAN 30GMS,true,false,23,41.894214538,-87.712617465,2018-12-12T15:57:00.000+02:00,12,12,15,2018,Non-Violent
11517924,11/26/2018 09:59:00 PM,NARCOTICS,MANU/DEL:CANNABIS OVER 10 GMS,true,false,44,41.751019136,-87.620552155,2018-11-26T21:59:00.000+02:00,11,26,21,2018,Non-Violent
11470084,10/07/2018 06:48:00 AM,THEFT,OVER $500,false,false,31,41.856618285,-87.666116701,2018-10-07T06:48:00.000+02:00,10,7,6,2018,Non-Violent
11509362,11/16/2018 06:45:00 PM,DECEPTIVE PRACTICE,THEFT OF LABOR/SERVICES,false,false,2,41.984437737,-87.697345842,2018-11-16T18:45:00.000+02:00,11,16,18,2018,Non-Violent
11418237,08/16/2018 02:30:00 PM,THEFT,OVER $500,false,false,24,41.899257407,-87.699863063,2018-08-16T14:30:00.000+02:00,8,16,14,2018,Non-Violent
11436302,08/31/2018 08:00:00 AM,CRIMINAL DAMAGE,TO PROPERTY,false,false,62,41.788557927,-87.732826465,2018-08-31T08:00:00.000+02:00,8,31,8,2018,Non-Violent
11472730,10/10/2018 04:00:00 PM,ASSAULT,SIMPLE,false,false,18,41.923648302,-87.803947225,2018-10-10T16:00:00.000+02:00,10,10,16,2018,Violent
11466795,10/04/2018 02:22:00 PM,NARCOTICS,POSS: HEROIN(WHITE),true,false,71,41.747506246,-87.67382919,2018-10-04T14:22:00.000+02:00,10,4,14,2018,Non-Violent
11554317,12/27/2018 05:31:00 PM,OTHER OFFENSE,TELEPHONE THREAT,false,false,2,42.005604761,-87.681877001,2018-12-27T17:31:00.000+02:00,12,27,17,2018,Non-Violent
11528866,12/08/2018 02:00:00 AM,THEFT,OVER $500,false,false,8,41.901073698,-87.63136393,2018-12-08T02:00:00.000+02:00,12,8,2,2018,Non-Violent
11411400,08/11/2018 08:00:00 PM,SEX OFFENSE,AGG CRIMINAL SEXUAL ABUSE,true,false,61,41.796684726,-87.665869564,2018-08-11T20:00:00.000+02:00,8,11,20,2018,Non-Violent
11447696,09/16/2018 02:30:00 AM,BATTERY,DOMESTIC BATTERY SIMPLE,false,true,69,41.765688442,-87.616306382,2018-09-16T02:30:00.000+02:00,9,16,2,2018,Violent
11547388,12/26/2018 02:20:00 PM,BATTERY,DOMESTIC BATTERY SIMPLE,false,true,66,41.77265186,-87.698104249,2018-12-26T14:20:00.000+02:00,12,26,14,2018,Violent
11473721,10/09/2018 08:30:00 PM,THEFT,FROM BUILDING,false,false,32,41.873944069,-87.62598437,2018-10-09T20:30:00.000+02:00,10,9,20,2018,Non-Violent
11555441,09/15/2018 04:00:00 PM,CRIMINAL DAMAGE,TO PROPERTY,false,false,53,41.675457788,-87.623784066,2018-09-15T16:00:00.000+02:00,9,15,16,2018,Non-Violent
11555935,12/31/2018 05:00:00 AM,BATTERY,DOMESTIC BATTERY SIMPLE,false,true,40,41.790109016,-87.622348779,2018-12-31T05:00:00.000+02:00,12,31,5,2018,Violent
11482810,10/21/2018 01:27:00 AM,BATTERY,DOMESTIC BATTERY SIMPLE,true,true,25,41.8822953,-87.761033571,2018-10-21T01:27:00.000+02:00,10,21,1,2018,Violent
11538332,12/17/2018 03:00:00 PM,DECEPTIVE PRACTICE,CREDIT CARD FRAUD,false,false,28,41.877048729,-87.690076459,2018-12-17T15:00:00.000+02:00,12,17,15,2018,Non-Violent
11528438,12/07/2018 05:05:00 PM,THEFT,OVER $500,false,false,7,41.929419611,-87.646469508,2018-12-07T17:05:00.000+02:00,12,7,17,2018,Non-Violent
11414411,08/15/2018 02:20:00 AM,ROBBERY,STRONGARM - NO WEAPON,false,false,27,41.88093546,-87.709132611,2018-08-15T02:20:00.000+02:00,8,15,2,2018,Violent
11414257,08/14/2018 11:34:00 PM,BATTERY,DOMESTIC BATTERY SIMPLE,true,true,29,41.850587211,-87.734474598,2018-08-14T23:34:00.000+02:00,8,14,23,2018,Violent
11416432,08/11/2018 08:00:00 AM,CRIMINAL TRESPASS,TO LAND,false,false,77,41.997351215,-87.671969499,2018-08-11T08:00:00.000+02:00,8,11,8,2018,Non-Violent
11444899,09/13/2018 10:00:00 AM,THEFT,OVER $500,false,false,23,41.91000536,-87.715759913,2018-09-13T10:00:00.000+02:00,9,13,10,2018,Non-Violent
11427735,08/27/2018 03:35:00 PM,THEFT,RETAIL THEFT,true,false,66,41.778340981,-87.703122242,2018-08-27T15:35:00.000+02:00,8,27,15,2018,Non-Violent
11509136,11/16/2018 02:50:00 PM,CRIMINAL DAMAGE,TO VEHICLE,false,true,68,41.78652376,-87.643758167,2018-11-16T14:50:00.000+02:00,11,16,14,2018,Non-Violent
11418817,08/18/2018 03:19:00 PM,ASSAULT,SIMPLE,false,false,7,41.923805173,-87.63739469,2018-08-18T15:19:00.000+02:00,8,18,15,2018,Violent
11488615,10/25/2018 03:05:00 PM,ASSAULT,AGGRAVATED: OTHER DANG WEAPON,false,false,59,41.830453068,-87.669661461,2018-10-25T15:05:00.000+02:00,10,25,15,2018,Violent
11466244,10/03/2018 07:30:00 PM,ROBBERY,STRONGARM - NO WEAPON,false,false,68,41.77974142,-87.645389036,2018-10-03T19:30:00.000+02:00,10,3,19,2018,Violent
11453955,09/21/2018 10:09:00 PM,CONCEALED CARRY LICENSE VIOLATION,ARMED WHILE UNDER THE INFLUENCE,true,false,29,41.860062743,-87.709144756,2018-09-21T22:09:00.000+02:00,9,21,22,2018,Non-Violent
11439937,09/08/2018 05:20:00 AM,BATTERY,DOMESTIC BATTERY SIMPLE,false,true,71,41.752190204,-87.66235443,2018-09-08T05:20:00.000+02:00,9,8,5,2018,Violent
11411853,08/12/2018 09:03:00 PM,CRIMINAL DAMAGE,TO PROPERTY,false,false,25,41.908532113,-87.75592058,2018-08-12T21:03:00.000+02:00,8,12,21,2018,Non-Violent
11513449,11/20/2018 02:00:00 PM,THEFT,OVER $500,false,false,56,41.805355995,-87.741872201,2018-11-20T14:00:00.000+02:00,11,20,14,2018,Non-Violent
11432961,09/01/2018 11:30:00 AM,BATTERY,SIMPLE,false,false,57,41.803095786,-87.72215712,2018-09-01T11:30:00.000+02:00,9,1,11,2018,Violent
11460219,09/28/2018 02:30:00 AM,OTHER OFFENSE,TELEPHONE THREAT,false,true,27,41.873761627,-87.699545765,2018-09-28T02:30:00.000+02:00,9,28,2,2018,Non-Violent
11495263,10/30/2018 07:15:00 AM,BATTERY,AGG PRO.EMP: OTHER DANG WEAPON,false,false,69,41.77048403,-87.626704252,2018-10-30T07:15:00.000+02:00,10,30,7,2018,Violent
11478051,10/16/2018 08:30:00 AM,BATTERY,DOMESTIC BATTERY SIMPLE,false,true,73,41.729792628,-87.655593905,2018-10-16T08:30:00.000+02:00,10,16,8,2018,Violent
11477984,10/15/2018 11:00:00 PM,CRIMINAL DAMAGE,TO VEHICLE,false,false,77,41.987294752,-87.658934909,2018-10-15T23:00:00.000+02:00,10,15,23,2018,Non-Violent
11454789,09/10/2018 09:00:00 AM,THEFT,$500 AND UNDER,false,false,44,41.748809737,-87.603899033,2018-09-10T09:00:00.000+02:00,9,10,9,2018,Non-Violent
11418543,08/18/2018 07:10:00 PM,NARCOTICS,FOUND SUSPECT NARCOTICS,true,false,68,41.763506117,-87.636274287,2018-08-18T19:10:00.000+02:00,8,18,19,2018,Non-Violent
11547837,12/26/2018 09:27:00 PM,BATTERY,AGGRAVATED DOMESTIC BATTERY: OTHER DANG WEAPON,false,true,29,41.857986059,-87.729817036,2018-12-26T21:27:00.000+02:00,12,26,21,2018,Violent
11521219,11/30/2018 11:00:00 AM,OTHER OFFENSE,LICENSE VIOLATION,true,false,66,41.786550665,-87.684656768,2018-11-30T11:00:00.000+02:00,11,30,11,2018,Non-Violent
11430143,08/29/2018 05:00:00 PM,DECEPTIVE PRACTICE,CREDIT CARD FRAUD,false,false,32,41.883500187,-87.627876698,2018-08-29T17:00:00.000+02:00,8,29,17,2018,Non-Violent
11409881,08/10/2018 06:14:00 PM,BATTERY,AGGRAVATED: HANDGUN,false,false,42,41.777783389,-87.615563072,2018-08-10T18:14:00.000+02:00,8,10,18,2018,Violent
11478393,10/16/2018 03:00:00 PM,BATTERY,AGGRAVATED: OTHER DANG WEAPON,false,false,71,41.75427046,-87.644741208,2018-10-16T15:00:00.000+02:00,10,16,15,2018,Violent
11504680,11/11/2018 12:23:00 PM,OTHER OFFENSE,HARASSMENT BY ELECTRONIC MEANS,false,false,22,41.92500885,-87.700780605,2018-11-11T12:23:00.000+02:00,11,11,12,2018,Non-Violent
11476020,10/13/2018 10:00:00 PM,THEFT,$500 AND UNDER,false,false,28,41.875050794,-87.640975136,2018-10-13T22:00:00.000+02:00,10,13,22,2018,Non-Violent
11427082,08/26/2018 10:00:00 PM,ROBBERY,STRONGARM - NO WEAPON,false,false,5,41.952327266,-87.679181047,2018-08-26T22:00:00.000+02:00,8,26,22,2018,Violent
11425232,08/24/2018 11:30:00 PM,MOTOR VEHICLE THEFT,AUTOMOBILE,false,false,68,41.760940791,-87.64915621,2018-08-24T23:30:00.000+02:00,8,24,23,2018,Non-Violent
11549898,12/22/2018 05:00:00 PM,BATTERY,DOMESTIC BATTERY SIMPLE,false,true,22,41.924655924,-87.712542963,2018-12-22T17:00:00.000+02:00,12,22,17,2018,Violent
11423257,08/22/2018 02:50:00 PM,THEFT,OVER $500,false,false,68,41.779220641,-87.649632877,2018-08-22T14:50:00.000+02:00,8,22,14,2018,Non-Violent
11485134,10/19/2018 06:00:00 PM,THEFT,OVER $500,false,false,61,41.820511441,-87.640983312,2018-10-19T18:00:00.000+02:00,10,19,18,2018,Non-Violent
11412100,08/13/2018 03:30:00 AM,BATTERY,SIMPLE,false,false,51,41.710961658,-87.564552989,2018-08-13T03:30:00.000+02:00,8,13,3,2018,Violent
11471969,10/09/2018 09:09:00 PM,ROBBERY,ARMED: HANDGUN,false,false,25,41.895074928,-87.742011123,2018-10-09T21:09:00.000+02:00,10,9,21,2018,Violent
11559142,12/13/2018 01:00:00 PM,BATTERY,SIMPLE,false,false,35,41.823798151,-87.619756522,2018-12-13T13:00:00.000+02:00,12,13,13,2018,Violent
11455870,09/23/2018 09:15:00 PM,OTHER OFFENSE,HARASSMENT BY TELEPHONE,false,true,43,41.770022645,-87.58799847,2018-09-23T21:15:00.000+02:00,9,23,21,2018,Non-Violent
11503424,11/10/2018 11:40:00 AM,NARCOTICS,POSS: HEROIN(WHITE),true,false,25,41.884828707,-87.754011429,2018-11-10T11:40:00.000+02:00,11,10,11,2018,Non-Violent
11547430,12/19/2018 10:00:00 PM,THEFT,OVER $500,false,false,28,41.86074224,-87.658955797,2018-12-19T22:00:00.000+02:00,12,19,22,2018,Non-Violent
11424710,08/24/2018 04:45:00 PM,CRIMINAL TRESPASS,TO LAND,true,false,35,41.838295721,-87.627243131,2018-08-24T16:45:00.000+02:00,8,24,16,2018,Non-Violent
11438177,09/04/2018 09:00:00 AM,THEFT,FROM BUILDING,false,false,67,41.77176902,-87.655507807,2018-09-04T09:00:00.000+02:00,9,4,9,2018,Non-Violent
11551538,12/30/2018 09:35:00 PM,WEAPONS VIOLATION,RECKLESS FIREARM DISCHARGE,false,false,27,41.886307106,-87.714416394,2018-12-30T21:35:00.000+02:00,12,30,21,2018,Non-Violent
11429080,08/28/2018 07:00:00 AM,DECEPTIVE PRACTICE,FINANCIAL IDENTITY THEFT OVER $ 300,false,false,25,41.87852961,-87.750550542,2018-08-28T07:00:00.000+02:00,8,28,7,2018,Non-Violent
11433017,08/28/2018 11:30:00 PM,ASSAULT,SIMPLE,false,true,65,41.768645123,-87.728605998,2018-08-28T23:30:00.000+02:00,8,28,23,2018,Violent
11469815,10/07/2018 09:01:00 PM,NARCOTICS,POSS: HEROIN(WHITE),true,false,26,41.878862243,-87.726293793,2018-10-07T21:01:00.000+02:00,10,7,21,2018,Non-Violent
11503203,11/10/2018 03:24:00 AM,NARCOTICS,POSS: HEROIN(WHITE),true,false,6,41.941034149,-87.639335535,2018-11-10T03:24:00.000+02:00,11,10,3,2018,Non-Violent
11463724,10/01/2018 01:22:00 PM,NARCOTICS,MANU/DEL:CANNABIS 10GM OR LESS,true,false,68,41.791909085,-87.653601485,2018-10-01T13:22:00.000+02:00,10,1,13,2018,Non-Violent
11484533,10/22/2018 09:30:00 PM,ROBBERY,ARMED: HANDGUN,false,false,26,41.871399151,-87.722909439,2018-10-22T21:30:00.000+02:00,10,22,21,2018,Violent
11488696,10/22/2018 04:30:00 PM,CRIMINAL DAMAGE,TO PROPERTY,false,false,63,41.79384675,-87.680608,2018-10-22T16:30:00.000+02:00,10,22,16,2018,Non-Violent
11544399,12/23/2018 04:00:00 AM,BATTERY,DOMESTIC BATTERY SIMPLE,false,true,17,41.94026507,-87.777338496,2018-12-23T04:00:00.000+02:00,12,23,4,2018,Violent
11534732,12/14/2018 12:28:00 AM,OTHER OFFENSE,GUN OFFENDER: DUTY TO REGISTER,true,false,59,41.830384116,-87.675804495,2018-12-14T00:28:00.000+02:00,12,14,0,2018,Non-Violent
11455030,09/23/2018 12:07:00 AM,NARCOTICS,POSS: SYNTHETIC DRUGS,true,false,25,41.884080698,-87.760261139,2018-09-23T00:07:00.000+02:00,9,23,0,2018,Non-Violent
11519014,11/28/2018 12:40:00 AM,CRIMINAL DAMAGE,TO STATE SUP PROP,true,false,21,41.943059047,-87.712610749,2018-11-28T00:40:00.000+02:00,11,28,0,2018,Non-Violent
11417856,08/18/2018 06:15:00 AM,BATTERY,SIMPLE,false,false,27,41.878344478,-87.709561745,2018-08-18T06:15:00.000+02:00,8,18,6,2018,Violent
11549026,12/28/2018 09:45:00 AM,OTHER OFFENSE,OTHER VEHICLE OFFENSE,false,false,49,41.691653719,-87.641147626,2018-12-28T09:45:00.000+02:00,12,28,9,2018,Non-Violent
11478879,10/11/2018 12:50:00 AM,CRIMINAL DAMAGE,TO VEHICLE,false,false,13,41.97571075,-87.71179731,2018-10-11T00:50:00.000+02:00,10,11,0,2018,Non-Violent
11451322,09/19/2018 03:30:00 PM,BATTERY,SIMPLE,false,false,8,41.90002373,-87.62305924,2018-09-19T15:30:00.000+02:00,9,19,15,2018,Violent
11472418,10/10/2018 09:20:00 AM,CRIMINAL DAMAGE,TO VEHICLE,false,false,39,41.802527319,-87.583990911,2018-10-10T09:20:00.000+02:00,10,10,9,2018,Non-Violent
11421560,08/21/2018 05:05:00 PM,CRIMINAL TRESPASS,TO STATE SUP LAND,true,false,26,41.873907046,-87.725430093,2018-08-21T17:05:00.000+02:00,8,21,17,2018,Non-Violent
11551568,12/30/2018 08:59:00 PM,WEAPONS VIOLATION,UNLAWFUL POSS OF HANDGUN,true,false,30,41.851025562,-87.699065532,2018-12-30T20:59:00.000+02:00,12,30,20,2018,Non-Violent
11479379,10/15/2018 08:30:00 PM,THEFT,OVER $500,false,false,28,41.884350397,-87.656985264,2018-10-15T20:30:00.000+02:00,10,15,20,2018,Non-Violent
11519492,11/25/2018 08:00:00 AM,THEFT,OVER $500,false,false,58,41.824500066,-87.700167583,2018-11-25T08:00:00.000+02:00,11,25,8,2018,Non-Violent
11534729,12/13/2018 11:39:00 PM,OTHER OFFENSE,HARASSMENT BY ELECTRONIC MEANS,false,false,36,41.829389915,-87.606892634,2018-12-13T23:39:00.000+02:00,12,13,23,2018,Non-Violent
11545197,12/24/2018 01:37:00 AM,ASSAULT,SIMPLE,true,false,25,41.904728506,-87.759734893,2018-12-24T01:37:00.000+02:00,12,24,1,2018,Violent
11482133,10/20/2018 11:55:00 AM,ASSAULT,SIMPLE,false,false,20,41.924420181,-87.73218985,2018-10-20T11:55:00.000+02:00,10,20,11,2018,Violent
11499323,11/06/2018 07:30:00 AM,ASSAULT,AGGRAVATED: OTHER DANG WEAPON,false,true,22,41.931890201,-87.718757179,2018-11-06T07:30:00.000+02:00,11,6,7,2018,Violent
11494768,11/01/2018 02:25:00 PM,BATTERY,SIMPLE,false,false,32,41.878638996,-87.627691486,2018-11-01T14:25:00.000+02:00,11,1,14,2018,Violent
11528001,12/07/2018 05:29:00 AM,BURGLARY,FORCIBLE ENTRY,false,false,69,41.765784606,-87.611067227,2018-12-07T05:29:00.000+02:00,12,7,5,2018,Non-Violent
11412374,08/12/2018 05:30:00 PM,BATTERY,DOMESTIC BATTERY SIMPLE,false,true,69,41.760874512,-87.630896479,2018-08-12T17:30:00.000+02:00,8,12,17,2018,Violent
11521862,11/29/2018 09:48:00 PM,MOTOR VEHICLE THEFT,AUTOMOBILE,false,false,66,41.778457871,-87.679836505,2018-11-29T21:48:00.000+02:00,11,29,21,2018,Non-Violent
11457608,09/25/2018 12:24:00 PM,BATTERY,AGGRAVATED: HANDGUN,false,false,25,41.888655236,-87.749342052,2018-09-25T12:24:00.000+02:00,9,25,12,2018,Violent
11499401,10/27/2018 07:20:00 PM,DECEPTIVE PRACTICE,CREDIT CARD FRAUD,false,false,3,41.964554554,-87.662381073,2018-10-27T19:20:00.000+02:00,10,27,19,2018,Non-Violent
11506139,11/13/2018 11:00:00 AM,DECEPTIVE PRACTICE,CREDIT CARD FRAUD,false,false,58,41.80779181,-87.703963414,2018-11-13T11:00:00.000+02:00,11,13,11,2018,Non-Violent
11497734,09/06/2018 02:00:00 PM,MOTOR VEHICLE THEFT,AUTOMOBILE,false,true,14,41.96912734,-87.725625085,2018-09-06T14:00:00.000+02:00,9,6,14,2018,Non-Violent
11446384,09/14/2018 09:30:00 AM,BURGLARY,FORCIBLE ENTRY,false,false,66,41.77556914,-87.6868058,2018-09-14T09:30:00.000+02:00,9,14,9,2018,Non-Violent
11420049,08/18/2018 12:20:00 PM,BURGLARY,UNLAWFUL ENTRY,false,false,2,42.003020116,-87.70008942,2018-08-18T12:20:00.000+02:00,8,18,12,2018,Non-Violent
11476730,10/14/2018 04:55:00 AM,BATTERY,DOMESTIC BATTERY SIMPLE,false,true,43,41.766102387,-87.573539169,2018-10-14T04:55:00.000+02:00,10,14,4,2018,Violent
11467632,10/05/2018 11:15:00 AM,ASSAULT,SIMPLE,false,false,42,41.774306328,-87.60336092,2018-10-05T11:15:00.000+02:00,10,5,11,2018,Violent
11526268,12/05/2018 08:30:00 AM,THEFT,OVER $500,false,false,32,41.88681815,-87.630590877,2018-12-05T08:30:00.000+02:00,12,5,8,2018,Non-Violent
11533594,12/12/2018 08:18:00 PM,CRIMINAL DAMAGE,TO PROPERTY,false,false,46,41.750987905,-87.562580374,2018-12-12T20:18:00.000+02:00,12,12,20,2018,Non-Violent
11505905,09/20/2018 09:00:00 AM,OTHER OFFENSE,HARASSMENT BY TELEPHONE,false,true,9,42.002934315,-87.817859947,2018-09-20T09:00:00.000+02:00,9,20,9,2018,Non-Violent
11460094,09/27/2018 06:19:00 PM,PROSTITUTION,SOLICIT ON PUBLIC WAY,true,false,25,41.865916835,-87.742992118,2018-09-27T18:19:00.000+02:00,9,27,18,2018,Non-Violent
11544496,12/22/2018 10:45:00 PM,DECEPTIVE PRACTICE,CREDIT CARD FRAUD,false,false,31,41.855757814,-87.682107865,2018-12-22T22:45:00.000+02:00,12,22,22,2018,Non-Violent
11415402,08/15/2018 09:00:00 PM,ROBBERY,ARMED: HANDGUN,false,false,61,41.797999294,-87.67731288,2018-08-15T21:00:00.000+02:00,8,15,21,2018,Violent
11465045,10/02/2018 08:50:00 PM,BATTERY,DOMESTIC BATTERY SIMPLE,false,true,67,41.782690172,-87.661856882,2018-10-02T20:50:00.000+02:00,10,2,20,2018,Violent
11449737,09/17/2018 11:00:00 PM,BURGLARY,UNLAWFUL ENTRY,false,false,6,41.94238589,-87.656611186,2018-09-17T23:00:00.000+02:00,9,17,23,2018,Non-Violent
11547449,12/26/2018 06:50:00 PM,BATTERY,DOMESTIC BATTERY SIMPLE,false,true,56,41.80755014,-87.748590044,2018-12-26T18:50:00.000+02:00,12,26,18,2018,Violent
11467650,08/16/2018 12:00:00 PM,DECEPTIVE PRACTICE,ILLEGAL USE CASH CARD,false,false,67,41.765997125,-87.66382344,2018-08-16T12:00:00.000+02:00,8,16,12,2018,Non-Violent
11434987,09/03/2018 01:00:00 PM,ASSAULT,SIMPLE,false,false,1,42.018736516,-87.669569355,2018-09-03T13:00:00.000+02:00,9,3,13,2018,Violent
11541088,12/20/2018 12:25:00 AM,ASSAULT,AGGRAVATED:KNIFE/CUTTING INSTR,true,true,25,41.891774905,-87.757933618,2018-12-20T00:25:00.000+02:00,12,20,0,2018,Violent
11448071,08/15/2018 07:17:00 AM,THEFT,RETAIL THEFT,false,false,10,41.97443857,-87.81119077,2018-08-15T07:17:00.000+02:00,8,15,7,2018,Non-Violent
11537375,12/14/2018 04:00:00 PM,BATTERY,SIMPLE,false,false,23,41.910091012,-87.708764148,2018-12-14T16:00:00.000+02:00,12,14,16,2018,Violent
11444105,09/12/2018 11:40:00 AM,ASSAULT,PRO EMP HANDS NO/MIN INJURY,false,false,27,41.871025414,-87.699510379,2018-09-12T11:40:00.000+02:00,9,12,11,2018,Violent
11531848,11/29/2018 03:30:00 PM,DECEPTIVE PRACTICE,FRAUD OR CONFIDENCE GAME,false,false,1,42.016155911,-87.684256947,2018-11-29T15:30:00.000+02:00,11,29,15,2018,Non-Violent
11503669,11/10/2018 05:56:00 PM,CRIMINAL TRESPASS,TO LAND,true,false,28,41.881883933,-87.640060441,2018-11-10T17:56:00.000+02:00,11,10,17,2018,Non-Violent
11428330,08/28/2018 06:00:00 AM,THEFT,$500 AND UNDER,false,false,64,41.772255846,-87.738444455,2018-08-28T06:00:00.000+02:00,8,28,6,2018,Non-Violent
11534259,12/13/2018 01:15:00 PM,ASSAULT,SIMPLE,false,false,71,41.752167383,-87.664088112,2018-12-13T13:15:00.000+02:00,12,13,13,2018,Violent
11462184,09/29/2018 06:26:00 PM,ASSAULT,SIMPLE,false,false,23,41.912926725,-87.715019001,2018-09-29T18:26:00.000+02:00,9,29,18,2018,Violent
11537727,12/16/2018 07:00:00 PM,MOTOR VEHICLE THEFT,AUTOMOBILE,false,false,74,41.703877298,-87.697734297,2018-12-16T19:00:00.000+02:00,12,16,19,2018,Non-Violent
11407670,08/03/2018 04:00:00 PM,DECEPTIVE PRACTICE,FORGERY,false,false,6,41.94044868,-87.651081589,2018-08-03T16:00:00.000+02:00,8,3,16,2018,Non-Violent
11426375,08/25/2018 10:30:00 AM,DECEPTIVE PRACTICE,FINANCIAL IDENTITY THEFT $300 AND UNDER,false,false,67,41.7624911,-87.664970497,2018-08-25T10:30:00.000+02:00,8,25,10,2018,Non-Violent
11552338,12/23/2018 06:00:00 PM,ASSAULT,SIMPLE,false,false,34,41.853758976,-87.63296436,2018-12-23T18:00:00.000+02:00,12,23,18,2018,Violent
11484571,10/22/2018 09:23:00 PM,ASSAULT,AGGRAVATED: OTHER FIREARM,true,true,68,41.788383373,-87.629114847,2018-10-22T21:23:00.000+02:00,10,22,21,2018,Violent
11512857,11/09/2018 07:15:00 PM,THEFT,OVER $500,false,false,28,41.886818777,-87.640176023,2018-11-09T19:15:00.000+02:00,11,9,19,2018,Non-Violent
11409923,08/10/2018 07:56:00 PM,WEAPONS VIOLATION,UNLAWFUL POSS OF HANDGUN,true,false,26,41.870397674,-87.730214317,2018-08-10T19:56:00.000+02:00,8,10,19,2018,Non-Violent
11437307,09/04/2018 11:00:00 AM,THEFT,$500 AND UNDER,false,false,26,41.881088655,-87.720764494,2018-09-04T11:00:00.000+02:00,9,4,11,2018,Non-Violent
11527874,12/02/2018 12:30:00 PM,ASSAULT,SIMPLE,false,false,20,41.924452852,-87.729525431,2018-12-02T12:30:00.000+02:00,12,2,12,2018,Violent
11409605,08/09/2018 03:00:00 PM,THEFT,$500 AND UNDER,false,false,65,41.777795743,-87.725180084,2018-08-09T15:00:00.000+02:00,8,9,15,2018,Non-Violent
11478061,10/16/2018 09:00:00 AM,THEFT,FROM BUILDING,false,false,28,41.887704163,-87.674981991,2018-10-16T09:00:00.000+02:00,10,16,9,2018,Non-Violent
11454459,09/06/2018 05:00:00 PM,OTHER OFFENSE,OTHER VEHICLE OFFENSE,false,false,14,41.970058502,-87.728388887,2018-09-06T17:00:00.000+02:00,9,6,17,2018,Non-Violent
11519739,11/25/2018 10:00:00 PM,CRIMINAL DAMAGE,TO VEHICLE,false,false,30,41.83453361,-87.723072721,2018-11-25T22:00:00.000+02:00,11,25,22,2018,Non-Violent
11550210,12/24/2018 01:11:00 PM,MOTOR VEHICLE THEFT,ATT: AUTOMOBILE,false,false,4,41.982229088,-87.694951405,2018-12-24T13:11:00.000+02:00,12,24,13,2018,Non-Violent
11505439,11/12/2018 01:05:00 PM,OTHER OFFENSE,LICENSE VIOLATION,false,false,69,41.764797653,-87.624889913,2018-11-12T13:05:00.000+02:00,11,12,13,2018,Non-Violent
11503682,11/10/2018 05:00:00 AM,CRIM SEXUAL ASSAULT,NON-AGGRAVATED,false,false,36,41.830676853,-87.610352872,2018-11-10T05:00:00.000+02:00,11,10,5,2018,Non-Violent
11463385,09/21/2018 06:40:00 PM,DECEPTIVE PRACTICE,ILLEGAL USE CASH CARD,false,false,8,41.896726821,-87.624660488,2018-09-21T18:40:00.000+02:00,9,21,18,2018,Non-Violent
11435174,08/24/2018 09:00:00 AM,THEFT,OVER $500,false,false,1,42.005359432,-87.671610616,2018-08-24T09:00:00.000+02:00,8,24,9,2018,Non-Violent
11517554,11/26/2018 04:15:00 PM,ASSAULT,SIMPLE,false,false,16,41.953585669,-87.733220953,2018-11-26T16:15:00.000+02:00,11,26,16,2018,Violent
11542966,12/20/2018 01:13:00 PM,THEFT,FROM BUILDING,false,false,30,41.854573555,-87.695536037,2018-12-20T13:13:00.000+02:00,12,20,13,2018,Non-Violent
11477933,10/15/2018 04:00:00 PM,THEFT,POCKET-PICKING,false,false,35,41.830750796,-87.626643572,2018-10-15T16:00:00.000+02:00,10,15,16,2018,Non-Violent
11528251,12/07/2018 10:20:00 AM,NARCOTICS,MANU/DEL:CANNABIS OVER 10 GMS,true,false,23,41.894674537,-87.711411964,2018-12-07T10:20:00.000+02:00,12,7,10,2018,Non-Violent
11525668,12/04/2018 06:00:00 PM,ROBBERY,STRONGARM - NO WEAPON,false,false,24,41.895763771,-87.685558236,2018-12-04T18:00:00.000+02:00,12,4,18,2018,Violent
11511298,11/19/2018 05:20:00 AM,MOTOR VEHICLE THEFT,AUTOMOBILE,false,false,65,41.776290672,-87.723918477,2018-11-19T05:20:00.000+02:00,11,19,5,2018,Non-Violent
11470317,10/06/2018 10:00:00 AM,CRIMINAL DAMAGE,TO VEHICLE,false,false,16,41.96073113,-87.746937943,2018-10-06T10:00:00.000+02:00,10,6,10,2018,Non-Violent
11477102,10/15/2018 11:05:00 AM,NARCOTICS,MANU/DEL:CANNABIS OVER 10 GMS,true,false,23,41.90174764,-87.717745953,2018-10-15T11:05:00.000+02:00,10,15,11,2018,Non-Violent
11427614,07/04/2018 02:40:00 PM,NARCOTICS,POSS: CRACK,true,false,27,,,2018-07-04T14:40:00.000+02:00,7,4,14,2018,Non-Violent
11549605,12/28/2018 07:00:00 PM,ROBBERY,ARMED: HANDGUN,false,false,14,41.963618682,-87.715661596,2018-12-28T19:00:00.000+02:00,12,28,19,2018,Violent
11536657,12/15/2018 10:33:00 PM,CRIMINAL DAMAGE,CRIMINAL DEFACEMENT,true,false,30,41.841649646,-87.732994566,2018-12-15T22:33:00.000+02:00,12,15,22,2018,Non-Violent
11490043,10/27/2018 11:00:00 PM,THEFT,OVER $500,false,false,68,41.779975054,-87.630937377,2018-10-27T23:00:00.000+02:00,10,27,23,2018,Non-Violent
11422708,08/17/2018 12:01:00 AM,OTHER OFFENSE,HARASSMENT BY TELEPHONE,false,true,49,41.693782648,-87.619503826,2018-08-17T00:01:00.000+02:00,8,17,0,2018,Non-Violent
11464533,10/02/2018 11:44:00 AM,THEFT,$500 AND UNDER,false,false,17,41.944431918,-87.798368241,2018-10-02T11:44:00.000+02:00,10,2,11,2018,Non-Violent
11543443,12/22/2018 06:30:00 AM,CRIMINAL DAMAGE,TO VEHICLE,false,false,68,41.783446273,-87.641286877,2018-12-22T06:30:00.000+02:00,12,22,6,2018,Non-Violent
11517747,11/13/2018 08:30:00 AM,THEFT,POCKET-PICKING,false,false,22,41.93202555,-87.708245176,2018-11-13T08:30:00.000+02:00,11,13,8,2018,Non-Violent
11418724,08/18/2018 11:15:00 PM,MOTOR VEHICLE THEFT,AUTOMOBILE,true,false,58,41.819622584,-87.69702392,2018-08-18T23:15:00.000+02:00,8,18,23,2018,Non-Violent
11433147,09/01/2018 12:30:00 PM,THEFT,OVER $500,false,false,24,41.910619214,-87.668431245,2018-09-01T12:30:00.000+02:00,9,1,12,2018,Non-Violent
11457130,09/25/2018 03:20:00 AM,BATTERY,DOMESTIC BATTERY SIMPLE,false,true,29,41.865500494,-87.7200983,2018-09-25T03:20:00.000+02:00,9,25,3,2018,Violent
11488440,10/21/2018 12:30:00 PM,DECEPTIVE PRACTICE,CREDIT CARD FRAUD,false,false,3,41.974605964,-87.660870773,2018-10-21T12:30:00.000+02:00,10,21,12,2018,Non-Violent
11452543,09/07/2018 04:30:00 PM,ASSAULT,SIMPLE,false,false,41,41.793364184,-87.586943342,2018-09-07T16:30:00.000+02:00,9,7,16,2018,Violent
11537640,12/17/2018 02:46:00 AM,CRIMINAL DAMAGE,TO VEHICLE,false,false,8,41.890309516,-87.628018466,2018-12-17T02:46:00.000+02:00,12,17,2,2018,Non-Violent
11509488,11/10/2018 11:00:00 PM,BATTERY,AGGRAVATED DOMESTIC BATTERY: HANDS/FIST/FEET SERIOUS INJURY,false,true,19,41.919239668,-87.749860607,2018-11-10T23:00:00.000+02:00,11,10,23,2018,Violent
11464400,10/01/2018 08:01:00 AM,MOTOR VEHICLE THEFT,THEFT/RECOVERY: AUTOMOBILE,false,false,62,41.797201502,-87.723272993,2018-10-01T08:01:00.000+02:00,10,1,8,2018,Non-Violent
11447607,09/15/2018 06:00:00 PM,THEFT,OVER $500,false,false,32,41.884463099,-87.635008801,2018-09-15T18:00:00.000+02:00,9,15,18,2018,Non-Violent
11439955,09/08/2018 07:00:00 AM,THEFT,POCKET-PICKING,false,false,37,41.808677362,-87.631361193,2018-09-08T07:00:00.000+02:00,9,8,7,2018,Non-Violent
11462223,09/30/2018 02:14:00 AM,BATTERY,DOMESTIC BATTERY SIMPLE,true,true,25,41.891183004,-87.757009729,2018-09-30T02:14:00.000+02:00,9,30,2,2018,Violent
11552756,12/31/2018 09:26:00 PM,ROBBERY,ARMED: HANDGUN,false,false,24,41.902705634,-87.672370411,2018-12-31T21:26:00.000+02:00,12,31,21,2018,Violent
11430278,08/29/2018 08:00:00 PM,WEAPONS VIOLATION,UNLAWFUL POSS OF HANDGUN,true,false,25,41.877473065,-87.745166052,2018-08-29T20:00:00.000+02:00,8,29,20,2018,Non-Violent
11501212,11/07/2018 04:47:00 PM,THEFT,RETAIL THEFT,false,false,32,41.88635374,-87.620691382,2018-11-07T16:47:00.000+02:00,11,7,16,2018,Non-Violent
11525827,12/04/2018 08:30:00 PM,BATTERY,SIMPLE,false,false,44,41.736148121,-87.629070243,2018-12-04T20:30:00.000+02:00,12,4,20,2018,Violent
11466689,10/03/2018 08:25:00 AM,ASSAULT,AGGRAVATED: OTHER DANG WEAPON,false,false,68,41.772972076,-87.644610871,2018-10-03T08:25:00.000+02:00,10,3,8,2018,Violent
11484978,10/23/2018 10:19:00 AM,NARCOTICS,POSS: HEROIN(WHITE),true,false,23,41.895501483,-87.712090787,2018-10-23T10:19:00.000+02:00,10,23,10,2018,Non-Violent
11503135,11/10/2018 01:35:00 AM,THEFT,FROM BUILDING,false,false,32,41.877578503,-87.629282088,2018-11-10T01:35:00.000+02:00,11,10,1,2018,Non-Violent
11500503,11/07/2018 09:00:00 AM,BATTERY,DOMESTIC BATTERY SIMPLE,true,true,23,41.89065769,-87.722281719,2018-11-07T09:00:00.000+02:00,11,7,9,2018,Violent
11446298,09/04/2018 10:00:00 PM,DECEPTIVE PRACTICE,FRAUD OR CONFIDENCE GAME,false,false,11,41.97249664,-87.755813924,2018-09-04T22:00:00.000+02:00,9,4,22,2018,Non-Violent
11431328,08/30/2018 12:00:00 AM,THEFT,$500 AND UNDER,false,false,44,41.747598268,-87.607170509,2018-08-30T00:00:00.000+02:00,8,30,0,2018,Non-Violent
11414077,08/14/2018 12:30:00 PM,ROBBERY,ARMED: HANDGUN,false,false,69,41.766282991,-87.615273397,2018-08-14T12:30:00.000+02:00,8,14,12,2018,Violent
11429040,08/25/2018 04:00:00 PM,THEFT,POCKET-PICKING,false,false,32,41.885191719,-87.624486846,2018-08-25T16:00:00.000+02:00,8,25,16,2018,Non-Violent
11407180,07/30/2018 06:00:00 PM,DECEPTIVE PRACTICE,FINANCIAL IDENTITY THEFT OVER $ 300,false,false,63,41.798819032,-87.685391241,2018-07-30T18:00:00.000+02:00,7,30,18,2018,Non-Violent
11499592,11/06/2018 10:00:00 AM,THEFT,$500 AND UNDER,false,false,29,41.866335979,-87.711649982,2018-11-06T10:00:00.000+02:00,11,6,10,2018,Non-Violent
11519495,11/28/2018 02:00:00 PM,THEFT,OVER $500,false,false,41,41.799248277,-87.584047451,2018-11-28T14:00:00.000+02:00,11,28,14,2018,Non-Violent
11447217,09/09/2018 05:45:00 PM,BATTERY,DOMESTIC BATTERY SIMPLE,false,true,12,41.992728477,-87.76548226,2018-09-09T17:45:00.000+02:00,9,9,17,2018,Violent
11518936,11/28/2018 01:20:00 AM,CRIMINAL DAMAGE,TO VEHICLE,false,true,66,41.785309837,-87.703321667,2018-11-28T01:20:00.000+02:00,11,28,1,2018,Non-Violent
11430695,08/29/2018 04:00:00 PM,CRIMINAL DAMAGE,TO VEHICLE,false,false,64,41.782341255,-87.789986765,2018-08-29T16:00:00.000+02:00,8,29,16,2018,Non-Violent
11514927,11/07/2018 10:00:00 AM,DECEPTIVE PRACTICE,FINANCIAL IDENTITY THEFT OVER $ 300,false,false,71,41.744337567,-87.652359252,2018-11-07T10:00:00.000+02:00,11,7,10,2018,Non-Violent
11546060,12/24/2018 09:30:00 PM,BATTERY,DOMESTIC BATTERY SIMPLE,false,true,30,41.84421831,-87.727252628,2018-12-24T21:30:00.000+02:00,12,24,21,2018,Violent
11459910,09/27/2018 04:20:00 PM,DECEPTIVE PRACTICE,THEFT OF LOST/MISLAID PROP,true,false,44,41.750940757,-87.625185222,2018-09-27T16:20:00.000+02:00,9,27,16,2018,Non-Violent
11411504,08/11/2018 09:30:00 PM,CRIMINAL DAMAGE,TO VEHICLE,false,false,53,41.680707615,-87.660267792,2018-08-11T21:30:00.000+02:00,8,11,21,2018,Non-Violent
11496933,11/03/2018 01:00:00 AM,OTHER OFFENSE,VIOLATE ORDER OF PROTECTION,true,true,66,41.762345844,-87.683177891,2018-11-03T01:00:00.000+02:00,11,3,1,2018,Non-Violent
11519125,11/27/2018 05:00:00 PM,ASSAULT,SIMPLE,false,false,8,41.900546929,-87.633632427,2018-11-27T17:00:00.000+02:00,11,27,17,2018,Violent
11416911,08/16/2018 12:00:00 AM,THEFT,$500 AND UNDER,false,false,64,41.7779031,-87.769357507,2018-08-16T00:00:00.000+02:00,8,16,0,2018,Non-Violent
11513485,11/21/2018 01:25:00 PM,CRIMINAL DAMAGE,TO VEHICLE,false,false,22,41.916772325,-87.677593277,2018-11-21T13:25:00.000+02:00,11,21,13,2018,Non-Violent
11516246,11/24/2018 08:58:00 PM,OTHER OFFENSE,GUN OFFENDER: DUTY TO REGISTER,true,false,61,41.80153669,-87.648629171,2018-11-24T20:58:00.000+02:00,11,24,20,2018,Non-Violent
11543560,12/21/2018 04:30:00 PM,THEFT,RETAIL THEFT,false,false,32,41.884650262,-87.627915459,2018-12-21T16:30:00.000+02:00,12,21,16,2018,Non-Violent
11448911,09/13/2018 02:00:00 PM,BATTERY,SIMPLE,false,false,32,41.879297705,-87.627706271,2018-09-13T14:00:00.000+02:00,9,13,14,2018,Violent
11489982,10/15/2018 02:30:00 AM,CRIMINAL DAMAGE,TO PROPERTY,false,false,68,41.766161253,-87.649291358,2018-10-15T02:30:00.000+02:00,10,15,2,2018,Non-Violent
11482229,10/20/2018 10:45:00 AM,CRIM SEXUAL ASSAULT,ATTEMPT AGG: OTHER,false,false,33,41.857533855,-87.625603607,2018-10-20T10:45:00.000+02:00,10,20,10,2018,Non-Violent
11549691,12/28/2018 08:17:00 PM,PUBLIC PEACE VIOLATION,RECKLESS CONDUCT,true,false,25,41.899363249,-87.767981496,2018-12-28T20:17:00.000+02:00,12,28,20,2018,Non-Violent
11525079,11/30/2018 08:30:00 AM,OFFENSE INVOLVING CHILDREN,CHILD ABDUCTION,false,false,70,41.746139881,-87.688874737,2018-11-30T08:30:00.000+02:00,11,30,8,2018,Non-Violent
11448861,09/16/2018 04:46:00 AM,THEFT,OVER $500,false,false,77,41.989381463,-87.656794145,2018-09-16T04:46:00.000+02:00,9,16,4,2018,Non-Violent
11524616,12/03/2018 03:00:00 AM,ROBBERY,ATTEMPT: STRONGARM-NO WEAPON,false,false,8,41.904370109,-87.631460067,2018-12-03T03:00:00.000+02:00,12,3,3,2018,Violent
11535991,12/12/2018 12:00:00 PM,MOTOR VEHICLE THEFT,AUTOMOBILE,false,false,28,41.887424092,-87.641348355,2018-12-12T12:00:00.000+02:00,12,12,12,2018,Non-Violent
11420053,08/20/2018 10:36:00 AM,BATTERY,AGGRAVATED: HANDGUN,false,false,67,41.78077994,-87.661821815,2018-08-20T10:36:00.000+02:00,8,20,10,2018,Violent
11443235,09/11/2018 05:34:00 PM,NARCOTICS,POSS: HEROIN(WHITE),true,false,68,41.78744071,-87.65348735,2018-09-11T17:34:00.000+02:00,9,11,17,2018,Non-Violent
11474034,10/11/2018 03:30:00 PM,CRIMINAL DAMAGE,TO VEHICLE,false,false,38,41.812613963,-87.609899424,2018-10-11T15:30:00.000+02:00,10,11,15,2018,Non-Violent
11510543,11/18/2018 05:34:00 AM,CRIMINAL DAMAGE,TO PROPERTY,true,true,38,41.816058923,-87.609170991,2018-11-18T05:34:00.000+02:00,11,18,5,2018,Non-Violent
11414479,08/14/2018 07:00:00 PM,THEFT,OVER $500,false,false,21,41.935735985,-87.699281681,2018-08-14T19:00:00.000+02:00,8,14,19,2018,Non-Violent
11492128,10/02/2018 10:00:00 AM,THEFT,$500 AND UNDER,false,false,7,41.918646522,-87.64613311,2018-10-02T10:00:00.000+02:00,10,2,10,2018,Non-Violent
11418898,08/19/2018 05:30:00 AM,THEFT,RETAIL THEFT,false,false,8,41.892569818,-87.62208039,2018-08-19T05:30:00.000+02:00,8,19,5,2018,Non-Violent
11490292,10/28/2018 11:20:00 AM,THEFT,RETAIL THEFT,true,false,32,41.883475491,-87.627876969,2018-10-28T11:20:00.000+02:00,10,28,11,2018,Non-Violent
11471053,10/09/2018 03:50:00 AM,CRIMINAL DAMAGE,TO PROPERTY,false,false,8,41.8926701,-87.628106353,2018-10-09T03:50:00.000+02:00,10,9,3,2018,Non-Violent
11494412,10/20/2018 04:57:00 PM,OTHER OFFENSE,HARASSMENT BY ELECTRONIC MEANS,false,false,68,41.764397089,-87.651670668,2018-10-20T16:57:00.000+02:00,10,20,16,2018,Non-Violent
11530686,12/10/2018 01:00:00 AM,BURGLARY,FORCIBLE ENTRY,false,false,24,41.891198474,-87.646552268,2018-12-10T01:00:00.000+02:00,12,10,1,2018,Non-Violent
11422840,08/22/2018 12:50:00 AM,ROBBERY,STRONGARM - NO WEAPON,false,false,27,41.882880585,-87.698023476,2018-08-22T00:50:00.000+02:00,8,22,0,2018,Violent
11480339,10/18/2018 10:00:00 AM,THEFT,$500 AND UNDER,false,false,12,41.984415675,-87.742520282,2018-10-18T10:00:00.000+02:00,10,18,10,2018,Non-Violent
11453924,09/21/2018 08:52:00 PM,THEFT,OVER $500,false,false,16,41.967477901,-87.739224006,2018-09-21T20:52:00.000+02:00,9,21,20,2018,Non-Violent
11541773,12/20/2018 05:00:00 PM,BATTERY,DOMESTIC BATTERY SIMPLE,false,true,32,41.874233514,-87.630666333,2018-12-20T17:00:00.000+02:00,12,20,17,2018,Violent
11429549,08/28/2018 02:00:00 PM,THEFT,$500 AND UNDER,false,false,15,41.961847421,-87.764822633,2018-08-28T14:00:00.000+02:00,8,28,14,2018,Non-Violent
11438349,09/05/2018 09:24:00 PM,OTHER OFFENSE,TELEPHONE THREAT,false,true,66,41.785252252,-87.708858912,2018-09-05T21:24:00.000+02:00,9,5,21,2018,Non-Violent
11541141,12/19/2018 11:36:00 PM,BATTERY,DOMESTIC BATTERY SIMPLE,true,true,68,41.793542821,-87.642707476,2018-12-19T23:36:00.000+02:00,12,19,23,2018,Violent
11481143,10/19/2018 12:10:00 PM,CRIMINAL TRESPASS,TO LAND,true,false,8,41.896690521,-87.627232016,2018-10-19T12:10:00.000+02:00,10,19,12,2018,Non-Violent
11412607,08/08/2018 02:00:00 PM,DECEPTIVE PRACTICE,FINANCIAL IDENTITY THEFT $300 AND UNDER,false,false,35,41.841622651,-87.617191438,2018-08-08T14:00:00.000+02:00,8,8,14,2018,Non-Violent
11541621,12/20/2018 05:00:00 AM,CRIMINAL DAMAGE,TO VEHICLE,false,false,61,41.817219532,-87.645754796,2018-12-20T05:00:00.000+02:00,12,20,5,2018,Non-Violent
11408880,08/09/2018 09:25:00 PM,CRIMINAL DAMAGE,TO PROPERTY,false,false,65,41.770606444,-87.72377066,2018-08-09T21:25:00.000+02:00,8,9,21,2018,Non-Violent
11431057,08/30/2018 12:50:00 PM,ASSAULT,SIMPLE,false,false,19,41.924902436,-87.766025313,2018-08-30T12:50:00.000+02:00,8,30,12,2018,Violent
11545338,12/23/2018 12:01:00 AM,BURGLARY,FORCIBLE ENTRY,false,false,69,41.769323968,-87.616199914,2018-12-23T00:01:00.000+02:00,12,23,0,2018,Non-Violent
11476228,10/14/2018 01:40:00 PM,ASSAULT,SIMPLE,true,false,8,41.892569522,-87.622032647,2018-10-14T13:40:00.000+02:00,10,14,13,2018,Violent
11493415,10/22/2018 10:00:00 PM,DECEPTIVE PRACTICE,COUNTERFEIT CHECK,false,false,8,41.896703809,-87.626269533,2018-10-22T22:00:00.000+02:00,10,22,22,2018,Non-Violent
11539546,12/18/2018 05:50:00 PM,THEFT,$500 AND UNDER,false,false,22,41.929743818,-87.684273777,2018-12-18T17:50:00.000+02:00,12,18,17,2018,Non-Violent
11439489,09/07/2018 05:00:00 PM,THEFT,OVER $500,false,false,25,41.894828122,-87.76709224,2018-09-07T17:00:00.000+02:00,9,7,17,2018,Non-Violent
11441612,09/10/2018 03:00:00 AM,CRIMINAL DAMAGE,TO PROPERTY,false,false,1,42.022062685,-87.67484904,2018-09-10T03:00:00.000+02:00,9,10,3,2018,Non-Violent
11454936,09/22/2018 01:20:00 PM,OTHER OFFENSE,HARASSMENT BY ELECTRONIC MEANS,false,true,44,41.750744127,-87.599105692,2018-09-22T13:20:00.000+02:00,9,22,13,2018,Non-Violent
11521406,11/30/2018 10:53:00 AM,ASSAULT,PRO EMP HANDS NO/MIN INJURY,false,false,70,41.749460005,-87.72089612,2018-11-30T10:53:00.000+02:00,11,30,10,2018,Violent
11519861,11/28/2018 06:45:00 PM,CRIMINAL DAMAGE,TO PROPERTY,false,false,30,41.835926135,-87.724329163,2018-11-28T18:45:00.000+02:00,11,28,18,2018,Non-Violent
11517956,11/25/2018 04:50:00 AM,ASSAULT,AGGRAVATED: HANDGUN,false,false,29,41.863562389,-87.732433523,2018-11-25T04:50:00.000+02:00,11,25,4,2018,Violent
11491690,10/26/2018 01:00:00 PM,DECEPTIVE PRACTICE,FINANCIAL IDENTITY THEFT OVER $ 300,false,false,17,41.949354468,-87.80714966,2018-10-26T13:00:00.000+02:00,10,26,13,2018,Non-Violent
11487697,10/22/2018 07:50:00 PM,THEFT,$500 AND UNDER,false,false,24,,,2018-10-22T19:50:00.000+02:00,10,22,19,2018,Non-Violent
11552861,12/31/2018 05:00:00 PM,ASSAULT,SIMPLE,false,true,44,41.741113895,-87.619500171,2018-12-31T17:00:00.000+02:00,12,31,17,2018,Violent
11412481,07/10/2018 03:51:00 PM,THEFT,RETAIL THEFT,false,false,44,41.740918989,-87.631967753,2018-07-10T15:51:00.000+02:00,7,10,15,2018,Non-Violent
11431185,08/30/2018 05:15:00 PM,CRIMINAL TRESPASS,TO LAND,true,false,71,41.736711088,-87.663087144,2018-08-30T17:15:00.000+02:00,8,30,17,2018,Non-Violent
11529290,11/29/2018 02:19:00 PM,THEFT,OVER $500,false,false,20,41.928616438,-87.740169036,2018-11-29T14:19:00.000+02:00,11,29,14,2018,Non-Violent
11409774,08/10/2018 05:20:00 PM,OTHER OFFENSE,HARASSMENT BY ELECTRONIC MEANS,false,false,32,41.88171846,-87.627760426,2018-08-10T17:20:00.000+02:00,8,10,17,2018,Non-Violent
11443953,09/12/2018 09:30:00 AM,THEFT,$500 AND UNDER,false,true,73,41.729486347,-87.660447596,2018-09-12T09:30:00.000+02:00,9,12,9,2018,Non-Violent
11408687,08/09/2018 05:00:00 PM,THEFT,$500 AND UNDER,false,false,32,41.885741529,-87.631344503,2018-08-09T17:00:00.000+02:00,8,9,17,2018,Non-Violent
11551273,12/30/2018 02:43:00 PM,BATTERY,AGGRAVATED: HANDGUN,false,false,73,41.729324813,-87.665688072,2018-12-30T14:43:00.000+02:00,12,30,14,2018,Violent
11460475,09/27/2018 06:00:00 PM,ASSAULT,SIMPLE,false,true,49,41.725047387,-87.616644876,2018-09-27T18:00:00.000+02:00,9,27,18,2018,Violent
11542647,12/21/2018 11:55:00 AM,CRIMINAL TRESPASS,TO LAND,true,false,37,41.794530106,-87.632179351,2018-12-21T11:55:00.000+02:00,12,21,11,2018,Non-Violent
11473720,06/27/2018 08:00:00 AM,DECEPTIVE PRACTICE,CREDIT CARD FRAUD,false,false,36,41.826502965,-87.608198422,2018-06-27T08:00:00.000+02:00,6,27,8,2018,Non-Violent
11468455,10/06/2018 08:50:00 AM,OTHER OFFENSE,BOARD PLANE WITH WEAPON,true,false,56,41.792558645,-87.741729501,2018-10-06T08:50:00.000+02:00,10,6,8,2018,Non-Violent
11497552,11/04/2018 12:16:00 PM,DECEPTIVE PRACTICE,COUNTERFEITING DOCUMENT,false,false,43,41.751897254,-87.553777728,2018-11-04T12:16:00.000+02:00,11,4,12,2018,Non-Violent
11426963,08/26/2018 10:36:00 PM,CRIMINAL DAMAGE,TO PROPERTY,false,false,68,41.77619685,-87.637815981,2018-08-26T22:36:00.000+02:00,8,26,22,2018,Non-Violent
11530327,11/17/2018 12:01:00 AM,THEFT,FROM BUILDING,false,false,8,41.903927445,-87.629529005,2018-11-17T00:01:00.000+02:00,11,17,0,2018,Non-Violent
11517990,11/27/2018 02:47:00 AM,CRIM SEXUAL ASSAULT,NON-AGGRAVATED,false,false,41,41.792195498,-87.604958508,2018-11-27T02:47:00.000+02:00,11,27,2,2018,Non-Violent
11430838,08/30/2018 11:45:00 AM,BATTERY,DOMESTIC BATTERY SIMPLE,false,true,58,41.81436846,-87.710252591,2018-08-30T11:45:00.000+02:00,8,30,11,2018,Violent
11572399,12/12/2018 04:30:00 PM,DECEPTIVE PRACTICE,FINANCIAL IDENTITY THEFT OVER $ 300,false,false,6,,,2018-12-12T16:30:00.000+02:00,12,12,16,2018,Non-Violent
11498908,11/05/2018 02:00:00 AM,OTHER OFFENSE,HARASSMENT BY ELECTRONIC MEANS,false,false,14,41.963382081,-87.718105325,2018-11-05T02:00:00.000+02:00,11,5,2,2018,Non-Violent
11531121,12/10/2018 03:00:00 AM,CRIM SEXUAL ASSAULT,NON-AGGRAVATED,false,true,54,41.653266466,-87.604831651,2018-12-10T03:00:00.000+02:00,12,10,3,2018,Non-Violent
11480715,10/18/2018 09:25:00 PM,THEFT,OVER $500,false,false,7,41.913463243,-87.631705806,2018-10-18T21:25:00.000+02:00,10,18,21,2018,Non-Violent
11412158,08/13/2018 12:01:00 AM,THEFT,$500 AND UNDER,false,false,25,41.880425216,-87.750959284,2018-08-13T00:01:00.000+02:00,8,13,0,2018,Non-Violent
11513390,11/21/2018 07:00:00 AM,MOTOR VEHICLE THEFT,AUTOMOBILE,false,false,23,41.896393689,-87.718781743,2018-11-21T07:00:00.000+02:00,11,21,7,2018,Non-Violent
11454730,09/22/2018 02:30:00 PM,ASSAULT,SIMPLE,false,false,39,41.809569293,-87.603624629,2018-09-22T14:30:00.000+02:00,9,22,14,2018,Violent
11538499,11/24/2018 01:45:00 PM,DECEPTIVE PRACTICE,FRAUD OR CONFIDENCE GAME,false,false,77,41.986685746,-87.673610038,2018-11-24T13:45:00.000+02:00,11,24,13,2018,Non-Violent
11424327,04/01/2018 09:00:00 AM,OTHER OFFENSE,HARASSMENT BY TELEPHONE,false,false,61,41.803834877,-87.659978337,2018-04-01T09:00:00.000+02:00,4,1,9,2018,Non-Violent
11513799,11/21/2018 04:01:00 PM,THEFT,RETAIL THEFT,true,false,30,41.844334316,-87.718102101,2018-11-21T16:01:00.000+02:00,11,21,16,2018,Non-Violent
11530521,12/09/2018 07:30:00 PM,BATTERY,DOMESTIC BATTERY SIMPLE,true,true,42,41.772324029,-87.610594282,2018-12-09T19:30:00.000+02:00,12,9,19,2018,Violent
11525343,12/03/2018 07:00:00 AM,MOTOR VEHICLE THEFT,AUTOMOBILE,false,false,71,41.735507153,-87.638735124,2018-12-03T07:00:00.000+02:00,12,3,7,2018,Non-Violent
11413814,08/14/2018 01:00:00 PM,BATTERY,SIMPLE,false,false,71,41.731682803,-87.639846104,2018-08-14T13:00:00.000+02:00,8,14,13,2018,Violent
11482291,10/20/2018 01:30:00 PM,BATTERY,AGGRAVATED DOMESTIC BATTERY: OTHER DANG WEAPON,false,true,23,41.901527611,-87.723827415,2018-10-20T13:30:00.000+02:00,10,20,13,2018,Violent
11444370,09/12/2018 02:32:00 PM,WEAPONS VIOLATION,UNLAWFUL POSS OF HANDGUN,true,false,49,41.72294285,-87.615382508,2018-09-12T14:32:00.000+02:00,9,12,14,2018,Non-Violent
11511235,11/19/2018 01:25:00 AM,BATTERY,SIMPLE,false,false,6,41.944315717,-87.644262239,2018-11-19T01:25:00.000+02:00,11,19,1,2018,Violent
11431894,08/31/2018 12:25:00 PM,CRIMINAL DAMAGE,TO PROPERTY,false,false,73,41.718827163,-87.651559075,2018-08-31T12:25:00.000+02:00,8,31,12,2018,Non-Violent
11481383,10/19/2018 11:30:00 AM,THEFT,FROM BUILDING,false,false,28,41.874420378,-87.638374988,2018-10-19T11:30:00.000+02:00,10,19,11,2018,Non-Violent
11494279,10/31/2018 09:57:00 PM,OTHER OFFENSE,HARASSMENT BY TELEPHONE,false,false,16,41.956042847,-87.727683223,2018-10-31T21:57:00.000+02:00,10,31,21,2018,Non-Violent
11447413,09/15/2018 05:22:00 AM,BURGLARY,HOME INVASION,false,false,38,41.810624238,-87.609008452,2018-09-15T05:22:00.000+02:00,9,15,5,2018,Non-Violent
11505220,11/12/2018 03:50:00 PM,CRIMINAL DAMAGE,TO VEHICLE,false,false,43,41.76015578,-87.556752911,2018-11-12T15:50:00.000+02:00,11,12,15,2018,Non-Violent
11432145,08/30/2018 09:00:00 PM,ASSAULT,SIMPLE,false,false,22,41.91454,-87.695887257,2018-08-30T21:00:00.000+02:00,8,30,21,2018,Violent
11517398,11/25/2018 09:38:00 AM,OTHER OFFENSE,HARASSMENT BY TELEPHONE,false,false,48,41.730970294,-87.570707395,2018-11-25T09:38:00.000+02:00,11,25,9,2018,Non-Violent
11523262,12/01/2018 10:00:00 PM,THEFT,OVER $500,false,false,12,41.994342355,-87.737388723,2018-12-01T22:00:00.000+02:00,12,1,22,2018,Non-Violent
11464636,08/24/2018 12:00:00 PM,DECEPTIVE PRACTICE,ILLEGAL USE CASH CARD,false,false,71,41.745627013,-87.670598085,2018-08-24T12:00:00.000+02:00,8,24,12,2018,Non-Violent
11512184,11/20/2018 12:50:00 AM,THEFT,OVER $500,false,true,68,41.791703233,-87.653596326,2018-11-20T00:50:00.000+02:00,11,20,0,2018,Non-Violent
11476405,10/14/2018 10:30:00 AM,OTHER OFFENSE,VIOLATE ORDER OF PROTECTION,false,true,66,41.76787033,-87.680794405,2018-10-14T10:30:00.000+02:00,10,14,10,2018,Non-Violent
11508194,11/15/2018 03:50:00 PM,ROBBERY,AGGRAVATED,false,false,44,41.725723692,-87.608959124,2018-11-15T15:50:00.000+02:00,11,15,15,2018,Violent
11528516,12/07/2018 06:12:00 PM,NARCOTICS,MANU/DELIVER: HEROIN (WHITE),true,false,27,41.881826552,-87.70999792,2018-12-07T18:12:00.000+02:00,12,7,18,2018,Non-Violent
11411595,08/12/2018 04:00:00 PM,BATTERY,DOMESTIC BATTERY SIMPLE,false,true,44,41.744962071,-87.60257944,2018-08-12T16:00:00.000+02:00,8,12,16,2018,Violent
11512225,11/20/2018 02:24:00 AM,BATTERY,AGGRAVATED: OTHER DANG WEAPON,true,false,22,41.924142132,-87.699370763,2018-11-20T02:24:00.000+02:00,11,20,2,2018,Violent
11454392,09/22/2018 12:00:00 PM,CRIMINAL DAMAGE,TO PROPERTY,false,false,46,41.747409051,-87.56131129,2018-09-22T12:00:00.000+02:00,9,22,12,2018,Non-Violent
11535447,12/14/2018 12:00:00 AM,MOTOR VEHICLE THEFT,AUTOMOBILE,false,false,29,41.867071507,-87.726023529,2018-12-14T00:00:00.000+02:00,12,14,0,2018,Non-Violent
11425392,08/25/2018 01:45:00 AM,BURGLARY,FORCIBLE ENTRY,false,false,8,41.890389063,-87.626673392,2018-08-25T01:45:00.000+02:00,8,25,1,2018,Non-Violent
11467313,09/01/2018 11:00:00 PM,BURGLARY,UNLAWFUL ENTRY,false,false,71,41.747509235,-87.665792858,2018-09-01T23:00:00.000+02:00,9,1,23,2018,Non-Violent
11483751,10/20/2018 02:23:00 PM,DECEPTIVE PRACTICE,CREDIT CARD FRAUD,false,false,6,41.94044868,-87.651081589,2018-10-20T14:23:00.000+02:00,10,20,14,2018,Non-Violent
11410431,08/10/2018 03:56:00 PM,THEFT,OVER $500,true,false,32,41.885325435,-87.627930066,2018-08-10T15:56:00.000+02:00,8,10,15,2018,Non-Violent
11446063,09/14/2018 10:45:00 AM,BURGLARY,UNLAWFUL ENTRY,false,false,66,41.774812292,-87.693280366,2018-09-14T10:45:00.000+02:00,9,14,10,2018,Non-Violent
11430652,08/29/2018 08:00:00 PM,CRIMINAL DAMAGE,TO VEHICLE,false,false,65,41.773951784,-87.735792905,2018-08-29T20:00:00.000+02:00,8,29,20,2018,Non-Violent
11492646,10/30/2018 07:20:00 PM,THEFT,FROM BUILDING,false,false,28,41.874180626,-87.66785807,2018-10-30T19:20:00.000+02:00,10,30,19,2018,Non-Violent
11514564,11/22/2018 08:20:00 PM,BATTERY,DOMESTIC BATTERY SIMPLE,false,true,68,41.759327879,-87.636946254,2018-11-22T20:20:00.000+02:00,11,22,20,2018,Violent
11543489,12/22/2018 01:00:00 AM,MOTOR VEHICLE THEFT,AUTOMOBILE,false,false,25,41.880058471,-87.757686219,2018-12-22T01:00:00.000+02:00,12,22,1,2018,Non-Violent
11516978,09/24/2018 07:25:00 AM,DECEPTIVE PRACTICE,FINANCIAL IDENTITY THEFT OVER $ 300,false,false,35,41.841164277,-87.6171782,2018-09-24T07:25:00.000+02:00,9,24,7,2018,Non-Violent
11421389,08/18/2018 11:30:00 PM,ASSAULT,SIMPLE,false,true,44,41.733588666,-87.617682025,2018-08-18T23:30:00.000+02:00,8,18,23,2018,Violent
11513767,11/21/2018 03:45:00 PM,THEFT,POCKET-PICKING,false,false,32,41.883210775,-87.629906972,2018-11-21T15:45:00.000+02:00,11,21,15,2018,Non-Violent
11464372,09/26/2018 03:56:00 PM,ASSAULT,SIMPLE,false,false,28,41.881230117,-87.682135713,2018-09-26T15:56:00.000+02:00,9,26,15,2018,Violent
11462758,09/30/2018 03:00:00 PM,THEFT,$500 AND UNDER,false,false,8,41.905601029,-87.632155579,2018-09-30T15:00:00.000+02:00,9,30,15,2018,Non-Violent
11429562,08/28/2018 04:00:00 PM,THEFT,$500 AND UNDER,false,false,44,41.730072952,-87.616761204,2018-08-28T16:00:00.000+02:00,8,28,16,2018,Non-Violent
11412966,08/11/2018 08:47:00 PM,THEFT,OVER $500,false,false,22,41.930049492,-87.685920733,2018-08-11T20:47:00.000+02:00,8,11,20,2018,Non-Violent
11474586,10/12/2018 12:04:00 PM,THEFT,FROM BUILDING,true,false,77,41.992508755,-87.66034393,2018-10-12T12:04:00.000+02:00,10,12,12,2018,Non-Violent
11503267,11/10/2018 01:00:00 AM,CRIMINAL DAMAGE,TO VEHICLE,false,false,70,41.738666286,-87.739655906,2018-11-10T01:00:00.000+02:00,11,10,1,2018,Non-Violent
11504779,11/12/2018 03:35:00 AM,ROBBERY,ARMED: HANDGUN,false,false,19,41.93318414,-87.759873246,2018-11-12T03:35:00.000+02:00,11,12,3,2018,Violent
11539403,12/17/2018 05:00:00 PM,THEFT,$500 AND UNDER,false,false,31,41.858730372,-87.664530957,2018-12-17T17:00:00.000+02:00,12,17,17,2018,Non-Violent
11467694,10/04/2018 06:30:00 PM,THEFT,$500 AND UNDER,false,false,22,41.918431595,-87.690032129,2018-10-04T18:30:00.000+02:00,10,4,18,2018,Non-Violent
11464843,10/02/2018 04:30:00 PM,DECEPTIVE PRACTICE,COUNTERFEITING DOCUMENT,false,false,5,41.961308623,-87.689295852,2018-10-02T16:30:00.000+02:00,10,2,16,2018,Non-Violent
11413548,08/11/2018 10:56:00 AM,THEFT,OVER $500,false,false,60,41.84097894,-87.649353839,2018-08-11T10:56:00.000+02:00,8,11,10,2018,Non-Violent
11495652,10/31/2018 08:00:00 AM,OTHER OFFENSE,OTHER CRIME AGAINST PERSON,false,false,23,41.908628492,-87.735078634,2018-10-31T08:00:00.000+02:00,10,31,8,2018,Non-Violent
11444365,04/29/2018 08:17:00 PM,DECEPTIVE PRACTICE,BOGUS CHECK,false,false,29,41.858213965,-87.704772409,2018-04-29T20:17:00.000+02:00,4,29,20,2018,Non-Violent
11522463,11/29/2018 01:30:00 PM,DECEPTIVE PRACTICE,CREDIT CARD FRAUD,false,false,8,41.891162264,-87.639614884,2018-11-29T13:30:00.000+02:00,11,29,13,2018,Non-Violent
11465258,10/02/2018 06:00:00 PM,MOTOR VEHICLE THEFT,AUTOMOBILE,false,false,56,41.788296261,-87.769460766,2018-10-02T18:00:00.000+02:00,10,2,18,2018,Non-Violent
11548411,12/18/2018 12:00:00 AM,DECEPTIVE PRACTICE,ATTEMPT - FINANCIAL IDENTITY THEFT,false,false,77,41.991395865,-87.65542649,2018-12-18T00:00:00.000+02:00,12,18,0,2018,Non-Violent
11422112,08/20/2018 09:17:00 PM,DECEPTIVE PRACTICE,FRAUD OR CONFIDENCE GAME,false,false,25,41.909785045,-87.791141026,2018-08-20T21:17:00.000+02:00,8,20,21,2018,Non-Violent
11535700,12/14/2018 11:15:00 PM,NARCOTICS,MANU/DEL:CANNABIS OVER 10 GMS,true,false,44,41.745230349,-87.605068182,2018-12-14T23:15:00.000+02:00,12,14,23,2018,Non-Violent
11476453,10/14/2018 02:00:00 AM,DECEPTIVE PRACTICE,CREDIT CARD FRAUD,false,false,8,41.903931582,-87.629308553,2018-10-14T02:00:00.000+02:00,10,14,2,2018,Non-Violent
11515089,11/20/2018 12:01:00 AM,THEFT,FROM BUILDING,false,false,28,41.862218265,-87.639087164,2018-11-20T00:01:00.000+02:00,11,20,0,2018,Non-Violent
11543285,12/05/2018 04:00:00 PM,OFFENSE INVOLVING CHILDREN,ENDANGERING LIFE/HEALTH CHILD,true,true,21,41.935975003,-87.721588371,2018-12-05T16:00:00.000+02:00,12,5,16,2018,Non-Violent
11477010,10/14/2018 01:00:00 PM,CRIMINAL DAMAGE,TO PROPERTY,false,true,73,41.709717958,-87.651424604,2018-10-14T13:00:00.000+02:00,10,14,13,2018,Non-Violent
11407789,08/08/2018 05:45:00 PM,ASSAULT,SIMPLE,false,false,30,41.851957226,-87.691407043,2018-08-08T17:45:00.000+02:00,8,8,17,2018,Violent
11428807,08/28/2018 12:30:00 PM,THEFT,FROM BUILDING,false,false,77,41.986108117,-87.66014284,2018-08-28T12:30:00.000+02:00,8,28,12,2018,Non-Violent
11550584,12/29/2018 08:00:00 PM,CRIMINAL DAMAGE,TO VEHICLE,false,true,70,41.755677483,-87.721199848,2018-12-29T20:00:00.000+02:00,12,29,20,2018,Non-Violent
11446532,09/14/2018 11:50:00 PM,MOTOR VEHICLE THEFT,AUTOMOBILE,false,false,3,41.966430564,-87.651032417,2018-09-14T23:50:00.000+02:00,9,14,23,2018,Non-Violent
11512852,11/19/2018 01:30:00 PM,DECEPTIVE PRACTICE,FRAUD OR CONFIDENCE GAME,false,false,77,41.97611895,-87.673325604,2018-11-19T13:30:00.000+02:00,11,19,13,2018,Non-Violent
11548255,12/27/2018 03:50:00 PM,CRIMINAL DAMAGE,TO CITY OF CHICAGO PROPERTY,false,false,73,41.713490374,-87.64297909,2018-12-27T15:50:00.000+02:00,12,27,15,2018,Non-Violent
11429816,08/28/2018 06:30:00 PM,THEFT,OVER $500,false,false,13,41.981734109,-87.711260604,2018-08-28T18:30:00.000+02:00,8,28,18,2018,Non-Violent
11539444,12/18/2018 03:00:00 PM,DECEPTIVE PRACTICE,FINANCIAL IDENTITY THEFT OVER $ 300,false,false,72,41.712284862,-87.660901717,2018-12-18T15:00:00.000+02:00,12,18,15,2018,Non-Violent
11492042,10/26/2018 03:52:00 PM,OTHER OFFENSE,VIOLATE ORDER OF PROTECTION,false,true,49,41.69998257,-87.615615985,2018-10-26T15:52:00.000+02:00,10,26,15,2018,Non-Violent
11447102,09/14/2018 02:52:00 PM,DECEPTIVE PRACTICE,ATTEMPT - FINANCIAL IDENTITY THEFT,false,false,53,41.679304154,-87.622702191,2018-09-14T14:52:00.000+02:00,9,14,14,2018,Non-Violent
11410920,08/11/2018 08:00:00 PM,NARCOTICS,MANU/DEL:CANNABIS 10GM OR LESS,true,false,25,41.894947554,-87.754717022,2018-08-11T20:00:00.000+02:00,8,11,20,2018,Non-Violent
11465872,10/03/2018 04:15:00 PM,THEFT,OVER $500,false,false,7,41.914217864,-87.633497822,2018-10-03T16:15:00.000+02:00,10,3,16,2018,Non-Violent
11432859,08/31/2018 08:00:00 PM,THEFT,$500 AND UNDER,false,false,38,41.807579953,-87.615424963,2018-08-31T20:00:00.000+02:00,8,31,20,2018,Non-Violent
11428160,08/26/2018 04:12:00 AM,CRIMINAL TRESPASS,TO LAND,false,false,32,41.872879259,-87.633592804,2018-08-26T04:12:00.000+02:00,8,26,4,2018,Non-Violent
11538495,12/17/2018 12:36:00 PM,THEFT,OVER $500,false,false,25,,,2018-12-17T12:36:00.000+02:00,12,17,12,2018,Non-Violent
11416103,08/15/2018 03:00:00 PM,CRIMINAL DAMAGE,TO VEHICLE,false,false,42,41.785011157,-87.613260468,2018-08-15T15:00:00.000+02:00,8,15,15,2018,Non-Violent
11523608,12/02/2018 08:58:00 PM,NARCOTICS,MANU/DELIVER:CRACK,true,false,43,41.759540875,-87.592037875,2018-12-02T20:58:00.000+02:00,12,2,20,2018,Non-Violent
11455466,09/23/2018 01:18:00 PM,CRIMINAL TRESPASS,TO STATE SUP LAND,true,false,69,41.769185486,-87.625732415,2018-09-23T13:18:00.000+02:00,9,23,13,2018,Non-Violent
11508231,11/08/2018 03:40:00 PM,SEX OFFENSE,CRIMINAL SEXUAL ABUSE,false,false,61,41.806697756,-87.673798332,2018-11-08T15:40:00.000+02:00,11,8,15,2018,Non-Violent
11506014,11/12/2018 11:00:00 PM,THEFT,$500 AND UNDER,false,false,65,41.770491393,-87.720714442,2018-11-12T23:00:00.000+02:00,11,12,23,2018,Non-Violent
11550488,12/27/2018 01:00:00 PM,THEFT,OVER $500,false,false,25,41.895624452,-87.766637101,2018-12-27T13:00:00.000+02:00,12,27,13,2018,Non-Violent
11529580,12/08/2018 07:00:00 PM,OTHER OFFENSE,HARASSMENT BY ELECTRONIC MEANS,false,true,68,41.779115326,-87.650843882,2018-12-08T19:00:00.000+02:00,12,8,19,2018,Non-Violent
11518728,11/27/2018 03:00:00 PM,THEFT,$500 AND UNDER,false,false,43,41.754297269,-87.569940217,2018-11-27T15:00:00.000+02:00,11,27,15,2018,Non-Violent
11476555,10/14/2018 07:35:00 PM,CRIMINAL TRESPASS,TO LAND,false,false,32,41.885888079,-87.627942238,2018-10-14T19:35:00.000+02:00,10,14,19,2018,Non-Violent
11488621,10/26/2018 03:22:00 PM,OTHER OFFENSE,OTHER WEAPONS VIOLATION,true,false,71,41.739679343,-87.645259854,2018-10-26T15:22:00.000+02:00,10,26,15,2018,Non-Violent
11513676,11/20/2018 10:58:00 PM,OTHER OFFENSE,TELEPHONE THREAT,false,true,25,41.906625407,-87.757120666,2018-11-20T22:58:00.000+02:00,11,20,22,2018,Non-Violent
11444127,08/31/2018 06:00:00 PM,CRIMINAL DAMAGE,TO PROPERTY,false,false,55,41.662283069,-87.553198089,2018-08-31T18:00:00.000+02:00,8,31,18,2018,Non-Violent
11529469,12/08/2018 04:59:00 PM,BATTERY,SIMPLE,false,true,25,41.897195665,-87.758109018,2018-12-08T16:59:00.000+02:00,12,8,16,2018,Violent
11495427,11/02/2018 01:00:00 AM,THEFT,OVER $500,false,false,30,41.8456778,-87.708726741,2018-11-02T01:00:00.000+02:00,11,2,1,2018,Non-Violent
11413171,08/13/2018 10:10:00 PM,CRIMINAL DAMAGE,TO VEHICLE,false,false,22,41.925007439,-87.679463877,2018-08-13T22:10:00.000+02:00,8,13,22,2018,Non-Violent
11446092,09/14/2018 01:10:00 PM,THEFT,FROM BUILDING,false,false,41,41.799248277,-87.584047451,2018-09-14T13:10:00.000+02:00,9,14,13,2018,Non-Violent
11487168,10/23/2018 06:00:00 PM,BATTERY,SIMPLE,false,false,3,41.972843435,-87.671127232,2018-10-23T18:00:00.000+02:00,10,23,18,2018,Violent
11496903,11/03/2018 06:06:00 PM,BATTERY,SIMPLE,false,false,32,41.880579428,-87.627732563,2018-11-03T18:06:00.000+02:00,11,3,18,2018,Violent
11504885,11/09/2018 11:30:00 AM,CRIMINAL DAMAGE,TO PROPERTY,false,false,25,41.897499211,-87.77119353,2018-11-09T11:30:00.000+02:00,11,9,11,2018,Non-Violent
11451404,05/02/2018 09:00:00 AM,DECEPTIVE PRACTICE,FINANCIAL IDENTITY THEFT OVER $ 300,false,false,17,41.939283846,-87.787311281,2018-05-02T09:00:00.000+02:00,5,2,9,2018,Non-Violent
11486410,10/20/2018 01:11:00 PM,DECEPTIVE PRACTICE,FRAUD OR CONFIDENCE GAME,false,false,28,41.88007433,-87.642602726,2018-10-20T13:11:00.000+02:00,10,20,13,2018,Non-Violent
11462134,09/29/2018 09:10:00 PM,BATTERY,DOMESTIC BATTERY SIMPLE,false,true,19,41.934469441,-87.758976005,2018-09-29T21:10:00.000+02:00,9,29,21,2018,Violent
11445260,08/09/2018 12:00:00 PM,THEFT,OVER $500,false,false,72,41.711041071,-87.679340476,2018-08-09T12:00:00.000+02:00,8,9,12,2018,Non-Violent
11480172,10/18/2018 12:00:00 PM,THEFT,RETAIL THEFT,true,false,25,41.909664252,-87.742728815,2018-10-18T12:00:00.000+02:00,10,18,12,2018,Non-Violent
11548629,12/23/2018 06:30:00 PM,BURGLARY,FORCIBLE ENTRY,false,false,43,41.754023313,-87.553664045,2018-12-23T18:30:00.000+02:00,12,23,18,2018,Non-Violent
11465436,08/01/2018 08:00:00 AM,OTHER OFFENSE,HARASSMENT BY TELEPHONE,false,true,37,41.795614844,-87.631852144,2018-08-01T08:00:00.000+02:00,8,1,8,2018,Non-Violent
11454377,09/22/2018 10:55:00 AM,BATTERY,DOMESTIC BATTERY SIMPLE,false,true,49,41.686879951,-87.622933681,2018-09-22T10:55:00.000+02:00,9,22,10,2018,Violent
11457451,09/23/2018 11:30:00 PM,THEFT,$500 AND UNDER,false,false,26,41.873907046,-87.725430093,2018-09-23T23:30:00.000+02:00,9,23,23,2018,Non-Violent
11428640,08/28/2018 09:15:00 AM,OFFENSE INVOLVING CHILDREN,CHILD ABANDONMENT,false,false,46,41.730147369,-87.545142049,2018-08-28T09:15:00.000+02:00,8,28,9,2018,Non-Violent
11480975,10/17/2018 09:00:00 PM,THEFT,$500 AND UNDER,false,false,44,41.748359161,-87.616462606,2018-10-17T21:00:00.000+02:00,10,17,21,2018,Non-Violent
11467963,10/05/2018 12:00:00 PM,OTHER OFFENSE,HARASSMENT BY TELEPHONE,false,true,22,41.932013304,-87.709020735,2018-10-05T12:00:00.000+02:00,10,5,12,2018,Non-Violent
11474770,10/12/2018 06:10:00 PM,BATTERY,DOMESTIC BATTERY SIMPLE,false,true,23,41.907338601,-87.710289828,2018-10-12T18:10:00.000+02:00,10,12,18,2018,Violent
11475847,10/13/2018 11:20:00 PM,THEFT,OVER $500,false,false,8,41.890851747,-87.628728678,2018-10-13T23:20:00.000+02:00,10,13,23,2018,Non-Violent
11547173,12/26/2018 05:30:00 AM,THEFT,$500 AND UNDER,false,false,28,41.861163499,-87.686876722,2018-12-26T05:30:00.000+02:00,12,26,5,2018,Non-Violent
11568528,11/20/2018 04:30:00 PM,THEFT,FROM BUILDING,false,false,32,,,2018-11-20T16:30:00.000+02:00,11,20,16,2018,Non-Violent
11434814,09/01/2018 12:40:00 PM,ASSAULT,AGGRAVATED: OTHER DANG WEAPON,false,true,29,41.853451881,-87.728127153,2018-09-01T12:40:00.000+02:00,9,1,12,2018,Violent
11435836,09/02/2018 12:00:00 PM,ASSAULT,SIMPLE,false,false,76,41.986989467,-87.840745861,2018-09-02T12:00:00.000+02:00,9,2,12,2018,Violent
11487831,10/25/2018 09:00:00 PM,DECEPTIVE PRACTICE,THEFT OF LOST/MISLAID PROP,true,false,32,41.879819189,-87.627718895,2018-10-25T21:00:00.000+02:00,10,25,21,2018,Non-Violent
11493036,10/31/2018 02:50:00 AM,ROBBERY,ARMED: HANDGUN,false,false,39,41.811277012,-87.596866854,2018-10-31T02:50:00.000+02:00,10,31,2,2018,Violent
11408164,08/09/2018 09:39:00 AM,MOTOR VEHICLE THEFT,THEFT/RECOVERY: AUTOMOBILE,false,false,19,41.931664582,-87.771121498,2018-08-09T09:39:00.000+02:00,8,9,9,2018,Non-Violent
11449049,09/13/2018 04:00:00 PM,THEFT,$500 AND UNDER,false,false,58,41.80779181,-87.703963414,2018-09-13T16:00:00.000+02:00,9,13,16,2018,Non-Violent
11431571,08/31/2018 01:52:00 AM,BURGLARY,FORCIBLE ENTRY,false,false,51,41.722472022,-87.574983819,2018-08-31T01:52:00.000+02:00,8,31,1,2018,Non-Violent
11455702,09/22/2018 10:30:00 PM,DECEPTIVE PRACTICE,CREDIT CARD FRAUD,false,false,6,41.932738985,-87.648117094,2018-09-22T22:30:00.000+02:00,9,22,22,2018,Non-Violent
11535009,10/28/2018 09:19:54 PM,NARCOTICS,POSS: CRACK,true,false,25,,,2018-10-28T21:19:54.000+02:00,10,28,21,2018,Non-Violent
11495510,11/02/2018 12:00:00 PM,OTHER OFFENSE,HARASSMENT BY TELEPHONE,false,true,61,41.811743802,-87.667495986,2018-11-02T12:00:00.000+02:00,11,2,12,2018,Non-Violent
11413928,08/07/2018 03:00:00 PM,OTHER OFFENSE,OTHER VEHICLE OFFENSE,false,false,19,41.918772718,-87.770668827,2018-08-07T15:00:00.000+02:00,8,7,15,2018,Non-Violent
11540468,12/19/2018 02:10:00 PM,THEFT,POCKET-PICKING,false,false,32,41.884013483,-87.627896757,2018-12-19T14:10:00.000+02:00,12,19,14,2018,Non-Violent
11431924,08/30/2018 12:01:00 AM,THEFT,FROM BUILDING,false,false,76,41.979006297,-87.906463155,2018-08-30T00:01:00.000+02:00,8,30,0,2018,Non-Violent
11492699,10/26/2018 12:05:00 PM,DECEPTIVE PRACTICE,CREDIT CARD FRAUD,false,false,8,41.893298783,-87.626362183,2018-10-26T12:05:00.000+02:00,10,26,12,2018,Non-Violent
11417246,08/17/2018 04:30:00 PM,ASSAULT,SIMPLE,false,false,32,41.884162337,-87.624439467,2018-08-17T16:30:00.000+02:00,8,17,16,2018,Violent
11463498,09/27/2018 10:00:00 AM,THEFT,$500 AND UNDER,false,false,66,41.775490694,-87.688962266,2018-09-27T10:00:00.000+02:00,9,27,10,2018,Non-Violent
11521736,11/22/2018 11:30:00 AM,THEFT,FROM BUILDING,false,false,22,,,2018-11-22T11:30:00.000+02:00,11,22,11,2018,Non-Violent
11465262,10/03/2018 06:45:00 AM,CRIMINAL DAMAGE,TO VEHICLE,false,false,25,41.869349499,-87.745589316,2018-10-03T06:45:00.000+02:00,10,3,6,2018,Non-Violent
11520551,11/27/2018 12:00:00 AM,BATTERY,DOMESTIC BATTERY SIMPLE,false,true,25,41.879036097,-87.7617787,2018-11-27T00:00:00.000+02:00,11,27,0,2018,Violent
11573049,12/21/2018 07:00:00 PM,THEFT,FROM BUILDING,false,false,28,,,2018-12-21T19:00:00.000+02:00,12,21,19,2018,Non-Violent
11520224,11/24/2018 12:01:00 AM,DECEPTIVE PRACTICE,FINANCIAL IDENTITY THEFT OVER $ 300,false,false,49,41.695212227,-87.631948272,2018-11-24T00:01:00.000+02:00,11,24,0,2018,Non-Violent
11506775,11/13/2018 01:51:00 PM,OTHER OFFENSE,VEHICLE TITLE/REG OFFENSE,false,false,25,41.906474562,-87.762081394,2018-11-13T13:51:00.000+02:00,11,13,13,2018,Non-Violent
11493638,10/31/2018 02:23:00 PM,BATTERY,SIMPLE,true,false,49,41.6979571,-87.631138505,2018-10-31T14:23:00.000+02:00,10,31,14,2018,Violent
11469310,10/07/2018 08:36:00 AM,NARCOTICS,POSS: HEROIN(WHITE),true,false,23,41.89413383,-87.711395172,2018-10-07T08:36:00.000+02:00,10,7,8,2018,Non-Violent
11435792,09/04/2018 03:00:00 AM,CRIMINAL DAMAGE,TO VEHICLE,false,false,77,41.976923409,-87.656429538,2018-09-04T03:00:00.000+02:00,9,4,3,2018,Non-Violent
11462981,09/30/2018 10:25:00 PM,NARCOTICS,POSS: CRACK,true,false,26,41.871545872,-87.735674216,2018-09-30T22:25:00.000+02:00,9,30,22,2018,Non-Violent
11417226,05/15/2018 09:00:00 AM,THEFT,OVER $500,false,false,77,41.991955782,-87.673338586,2018-05-15T09:00:00.000+02:00,5,15,9,2018,Non-Violent
11494916,11/01/2018 11:45:00 AM,THEFT,RETAIL THEFT,false,false,24,41.906132875,-87.667566751,2018-11-01T11:45:00.000+02:00,11,1,11,2018,Non-Violent
11432993,09/01/2018 01:30:00 PM,NARCOTICS,POSS: HEROIN(WHITE),true,false,23,41.897561962,-87.711501488,2018-09-01T13:30:00.000+02:00,9,1,13,2018,Non-Violent
11507805,11/14/2018 05:00:00 PM,MOTOR VEHICLE THEFT,AUTOMOBILE,false,false,61,41.818426719,-87.661942259,2018-11-14T17:00:00.000+02:00,11,14,17,2018,Non-Violent
11443468,09/11/2018 09:28:00 PM,OTHER OFFENSE,TELEPHONE THREAT,false,false,61,41.798830203,-87.661068619,2018-09-11T21:28:00.000+02:00,9,11,21,2018,Non-Violent
11537811,12/16/2018 03:05:00 PM,THEFT,$500 AND UNDER,false,false,77,41.988008918,-87.655322651,2018-12-16T15:05:00.000+02:00,12,16,15,2018,Non-Violent
11431175,08/30/2018 04:30:00 PM,BATTERY,DOMESTIC BATTERY SIMPLE,false,true,25,41.890501611,-87.7444075,2018-08-30T16:30:00.000+02:00,8,30,16,2018,Violent
11486405,10/13/2018 05:10:00 AM,SEX OFFENSE,PUBLIC INDECENCY,false,false,32,41.87532588,-87.642451908,2018-10-13T05:10:00.000+02:00,10,13,5,2018,Non-Violent
11516540,11/25/2018 06:59:00 AM,BATTERY,PRO EMP HANDS NO/MIN INJURY,false,false,35,41.829651528,-87.614451899,2018-11-25T06:59:00.000+02:00,11,25,6,2018,Violent
11488288,06/25/2018 09:00:00 AM,THEFT,$500 AND UNDER,false,false,25,41.895036238,-87.744094044,2018-06-25T09:00:00.000+02:00,6,25,9,2018,Non-Violent
11494087,11/01/2018 02:51:00 AM,BATTERY,DOMESTIC BATTERY SIMPLE,false,true,43,41.759969049,-87.592047608,2018-11-01T02:51:00.000+02:00,11,1,2,2018,Violent
11487501,10/24/2018 10:00:00 PM,CRIMINAL DAMAGE,TO VEHICLE,false,false,73,41.714994436,-87.660122626,2018-10-24T22:00:00.000+02:00,10,24,22,2018,Non-Violent
11472033,10/10/2018 12:51:00 AM,BATTERY,AGGRAVATED DOMESTIC BATTERY: OTHER DANG WEAPON,false,true,25,41.900449563,-87.752503802,2018-10-10T00:51:00.000+02:00,10,10,0,2018,Violent
11505925,10/29/2018 09:00:00 AM,CRIMINAL DAMAGE,TO PROPERTY,false,false,23,41.908792653,-87.720415207,2018-10-29T09:00:00.000+02:00,10,29,9,2018,Non-Violent
11494792,11/01/2018 02:49:00 PM,ASSAULT,AGGRAVATED: HANDGUN,false,false,28,41.88365976,-87.669368178,2018-11-01T14:49:00.000+02:00,11,1,14,2018,Violent
11508178,10/30/2018 09:00:00 AM,DECEPTIVE PRACTICE,COUNTERFEIT CHECK,false,false,32,41.883211584,-87.630039164,2018-10-30T09:00:00.000+02:00,10,30,9,2018,Non-Violent
11441408,09/08/2018 01:00:00 PM,THEFT,OVER $500,false,false,35,41.835659225,-87.623356707,2018-09-08T13:00:00.000+02:00,9,8,13,2018,Non-Violent
11537041,12/16/2018 05:00:00 AM,THEFT,$500 AND UNDER,false,false,19,41.917768604,-87.749829916,2018-12-16T05:00:00.000+02:00,12,16,5,2018,Non-Violent
11535718,12/14/2018 11:48:00 PM,OTHER OFFENSE,FALSE/STOLEN/ALTERED TRP,true,false,68,41.765279354,-87.639517417,2018-12-14T23:48:00.000+02:00,12,14,23,2018,Non-Violent
11491858,10/30/2018 12:00:00 AM,THEFT,$500 AND UNDER,false,false,68,41.773727686,-87.647059017,2018-10-30T00:00:00.000+02:00,10,30,0,2018,Non-Violent
11518596,11/27/2018 02:09:00 PM,CRIMINAL TRESPASS,TO RESIDENCE,false,false,3,41.975254247,-87.656778193,2018-11-27T14:09:00.000+02:00,11,27,14,2018,Non-Violent
11511484,11/19/2018 08:55:00 AM,INTERFERENCE WITH PUBLIC OFFICER,OBSTRUCTING IDENTIFICATION,true,false,38,41.808809838,-87.618136563,2018-11-19T08:55:00.000+02:00,11,19,8,2018,Non-Violent
11415307,08/14/2018 03:30:00 PM,THEFT,$500 AND UNDER,false,false,69,41.754391927,-87.599203385,2018-08-14T15:30:00.000+02:00,8,14,15,2018,Non-Violent
11465889,10/03/2018 09:00:00 AM,CRIMINAL TRESPASS,TO LAND,false,false,32,41.881776822,-87.620767948,2018-10-03T09:00:00.000+02:00,10,3,9,2018,Non-Violent
11439488,09/07/2018 04:10:00 PM,ASSAULT,AGGRAVATED:KNIFE/CUTTING INSTR,true,false,35,41.831069037,-87.620853613,2018-09-07T16:10:00.000+02:00,9,7,16,2018,Violent
11450234,09/18/2018 11:00:00 AM,THEFT,FROM BUILDING,false,false,32,41.884470703,-87.633102775,2018-09-18T11:00:00.000+02:00,9,18,11,2018,Non-Violent
11500190,11/06/2018 11:02:00 PM,NARCOTICS,POSS: CANNABIS 30GMS OR LESS,true,false,25,41.908674155,-87.75469962,2018-11-06T23:02:00.000+02:00,11,6,23,2018,Non-Violent
11415769,08/13/2018 02:00:00 PM,BURGLARY,FORCIBLE ENTRY,false,false,44,41.725679687,-87.606336711,2018-08-13T14:00:00.000+02:00,8,13,14,2018,Non-Violent
11495424,11/01/2018 07:00:00 PM,MOTOR VEHICLE THEFT,AUTOMOBILE,false,false,16,41.943577947,-87.735935609,2018-11-01T19:00:00.000+02:00,11,1,19,2018,Non-Violent
11430169,08/24/2018 08:30:00 AM,CRIMINAL TRESPASS,TO RESIDENCE,false,false,24,41.903866454,-87.690744072,2018-08-24T08:30:00.000+02:00,8,24,8,2018,Non-Violent
11462688,09/30/2018 01:35:00 PM,THEFT,RETAIL THEFT,true,false,70,41.73910936,-87.721580723,2018-09-30T13:35:00.000+02:00,9,30,13,2018,Non-Violent
11408256,08/09/2018 08:30:00 AM,THEFT,OVER $500,false,false,30,41.850919765,-87.702777376,2018-08-09T08:30:00.000+02:00,8,9,8,2018,Non-Violent
11496005,11/02/2018 07:30:00 PM,THEFT,$500 AND UNDER,false,false,6,41.95019775,-87.653205361,2018-11-02T19:30:00.000+02:00,11,2,19,2018,Non-Violent
11442315,09/10/2018 05:55:00 PM,BATTERY,DOMESTIC BATTERY SIMPLE,false,true,40,41.785027554,-87.623834919,2018-09-10T17:55:00.000+02:00,9,10,17,2018,Violent
11519700,11/28/2018 05:32:00 PM,OTHER OFFENSE,FALSE/STOLEN/ALTERED TRP,true,false,49,41.686105347,-87.627719851,2018-11-28T17:32:00.000+02:00,11,28,17,2018,Non-Violent
11512743,11/03/2018 12:30:00 PM,ROBBERY,ARMED: HANDGUN,false,false,8,41.908185345,-87.639713484,2018-11-03T12:30:00.000+02:00,11,3,12,2018,Violent
11488843,10/26/2018 10:25:00 PM,BATTERY,SIMPLE,true,false,24,41.912294007,-87.678120403,2018-10-26T22:25:00.000+02:00,10,26,22,2018,Violent
11545024,12/23/2018 07:50:00 PM,BATTERY,SIMPLE,false,false,66,41.784343341,-87.708757733,2018-12-23T19:50:00.000+02:00,12,23,19,2018,Violent
11414405,08/15/2018 03:15:00 AM,THEFT,$500 AND UNDER,false,false,28,41.877609409,-87.667594837,2018-08-15T03:15:00.000+02:00,8,15,3,2018,Non-Violent
11544486,12/23/2018 07:35:00 AM,THEFT,$500 AND UNDER,false,false,77,41.986392486,-87.656700734,2018-12-23T07:35:00.000+02:00,12,23,7,2018,Non-Violent
11551002,12/30/2018 10:40:00 AM,NARCOTICS,POSS: HEROIN(WHITE),true,false,29,41.8665066,-87.696214119,2018-12-30T10:40:00.000+02:00,12,30,10,2018,Non-Violent
11455725,09/21/2018 02:04:00 PM,THEFT,$500 AND UNDER,false,false,1,42.009145091,-87.664753261,2018-09-21T14:04:00.000+02:00,9,21,14,2018,Non-Violent
11408227,07/17/2018 04:20:00 PM,THEFT,FROM BUILDING,false,false,22,41.914717384,-87.671460237,2018-07-17T16:20:00.000+02:00,7,17,16,2018,Non-Violent
11435184,09/03/2018 10:15:00 AM,BURGLARY,FORCIBLE ENTRY,false,false,2,42.00767721,-87.693692554,2018-09-03T10:15:00.000+02:00,9,3,10,2018,Non-Violent
11407233,08/08/2018 01:00:00 PM,THEFT,FROM BUILDING,false,false,31,41.85199252,-87.688888738,2018-08-08T13:00:00.000+02:00,8,8,13,2018,Non-Violent
11521174,11/29/2018 12:30:00 PM,ASSAULT,SIMPLE,false,false,3,41.96538061,-87.659110921,2018-11-29T12:30:00.000+02:00,11,29,12,2018,Violent
11501888,11/02/2018 04:00:00 PM,MOTOR VEHICLE THEFT,AUTOMOBILE,false,false,66,41.78208323,-87.686164728,2018-11-02T16:00:00.000+02:00,11,2,16,2018,Non-Violent
11409735,08/10/2018 11:00:00 AM,WEAPONS VIOLATION,UNLAWFUL POSS OF HANDGUN,true,false,13,41.995376421,-87.7154944,2018-08-10T11:00:00.000+02:00,8,10,11,2018,Non-Violent
11499003,11/05/2018 01:30:00 PM,ASSAULT,PRO EMP HANDS NO/MIN INJURY,false,false,61,41.806695917,-87.67395607,2018-11-05T13:30:00.000+02:00,11,5,13,2018,Violent
11475942,10/14/2018 01:28:00 AM,WEAPONS VIOLATION,UNLAWFUL POSS OF HANDGUN,true,false,25,41.880238942,-87.76527117,2018-10-14T01:28:00.000+02:00,10,14,1,2018,Non-Violent
11509364,11/16/2018 10:45:00 AM,BURGLARY,UNLAWFUL ENTRY,false,false,23,41.899690118,-87.718893392,2018-11-16T10:45:00.000+02:00,11,16,10,2018,Non-Violent
11527393,12/06/2018 01:30:00 PM,DECEPTIVE PRACTICE,CREDIT CARD FRAUD,false,false,8,41.893454941,-87.617020399,2018-12-06T13:30:00.000+02:00,12,6,13,2018,Non-Violent
11413264,08/13/2018 10:50:00 AM,CRIMINAL DAMAGE,TO VEHICLE,false,false,43,41.773448181,-87.577180794,2018-08-13T10:50:00.000+02:00,8,13,10,2018,Non-Violent
11464961,10/01/2018 01:00:00 PM,THEFT,$500 AND UNDER,false,false,24,41.898056654,-87.6771126,2018-10-01T13:00:00.000+02:00,10,1,13,2018,Non-Violent
11422622,08/18/2018 04:30:00 PM,CRIMINAL DAMAGE,TO PROPERTY,false,false,61,41.811925112,-87.64197816,2018-08-18T16:30:00.000+02:00,8,18,16,2018,Non-Violent
11409420,08/10/2018 07:30:00 AM,BURGLARY,FORCIBLE ENTRY,false,false,1,42.010996301,-87.662680653,2018-08-10T07:30:00.000+02:00,8,10,7,2018,Non-Violent
11450236,09/16/2018 12:04:00 PM,DECEPTIVE PRACTICE,CREDIT CARD FRAUD,false,false,27,41.877476779,-87.692521351,2018-09-16T12:04:00.000+02:00,9,16,12,2018,Non-Violent
11537051,12/16/2018 04:26:00 AM,NARCOTICS,FOUND SUSPECT NARCOTICS,true,false,26,41.872993338,-87.732756426,2018-12-16T04:26:00.000+02:00,12,16,4,2018,Non-Violent
11494430,10/31/2018 11:30:00 PM,BURGLARY,ATTEMPT FORCIBLE ENTRY,false,false,20,41.937709858,-87.739456282,2018-10-31T23:30:00.000+02:00,10,31,23,2018,Non-Violent
11411945,08/12/2018 09:09:00 PM,THEFT,$500 AND UNDER,true,false,43,41.75890155,-87.573983302,2018-08-12T21:09:00.000+02:00,8,12,21,2018,Non-Violent
11502121,11/08/2018 10:25:00 PM,ROBBERY,ARMED: HANDGUN,false,false,32,41.878304046,-87.62277104,2018-11-08T22:25:00.000+02:00,11,8,22,2018,Violent
11448452,09/16/2018 11:30:00 PM,ROBBERY,STRONGARM - NO WEAPON,false,false,29,41.866256608,-87.718828146,2018-09-16T23:30:00.000+02:00,9,16,23,2018,Violent
11524743,12/04/2018 01:00:00 AM,BATTERY,AGGRAVATED DOMESTIC BATTERY: HANDS/FIST/FEET SERIOUS INJURY,true,true,42,41.772292574,-87.613014149,2018-12-04T01:00:00.000+02:00,12,4,1,2018,Violent
11462616,09/29/2018 11:30:00 PM,CRIMINAL DAMAGE,TO VEHICLE,false,false,60,41.82539977,-87.637026874,2018-09-29T23:30:00.000+02:00,9,29,23,2018,Non-Violent
11439616,09/07/2018 07:40:00 PM,ASSAULT,AGG PRO.EMP: OTHER DANG WEAPON,true,false,25,41.87686027,-87.743934237,2018-09-07T19:40:00.000+02:00,9,7,19,2018,Violent
11533937,12/13/2018 09:30:00 AM,BATTERY,DOMESTIC BATTERY SIMPLE,false,true,39,41.808804086,-87.596814484,2018-12-13T09:30:00.000+02:00,12,13,9,2018,Violent
11490823,10/26/2018 02:00:00 PM,INTIMIDATION,INTIMIDATION,false,false,69,41.768091856,-87.620179914,2018-10-26T14:00:00.000+02:00,10,26,14,2018,Non-Violent
11436554,09/04/2018 08:00:00 PM,DECEPTIVE PRACTICE,CREDIT CARD FRAUD,false,false,28,41.880108035,-87.647309981,2018-09-04T20:00:00.000+02:00,9,4,20,2018,Non-Violent
11465555,09/26/2018 03:00:00 PM,THEFT,OVER $500,false,false,36,41.82485366,-87.611247567,2018-09-26T15:00:00.000+02:00,9,26,15,2018,Non-Violent
11462739,09/29/2018 10:00:00 PM,THEFT,OVER $500,false,false,42,41.775972835,-87.602179856,2018-09-29T22:00:00.000+02:00,9,29,22,2018,Non-Violent
11471874,10/09/2018 07:40:00 PM,THEFT,OVER $500,false,false,28,41.886792762,-87.675406338,2018-10-09T19:40:00.000+02:00,10,9,19,2018,Non-Violent
11429143,08/25/2018 08:00:00 AM,THEFT,OVER $500,false,false,71,41.754734911,-87.655467169,2018-08-25T08:00:00.000+02:00,8,25,8,2018,Non-Violent
11534776,12/13/2018 10:59:00 PM,CRIM SEXUAL ASSAULT,NON-AGGRAVATED,false,false,29,41.854399495,-87.725688266,2018-12-13T22:59:00.000+02:00,12,13,22,2018,Non-Violent
11410781,08/11/2018 06:58:00 PM,CRIMINAL DAMAGE,TO VEHICLE,false,false,8,41.905601029,-87.632155579,2018-08-11T18:58:00.000+02:00,8,11,18,2018,Non-Violent
11452459,09/20/2018 05:00:00 PM,CRIMINAL DAMAGE,TO VEHICLE,false,false,71,41.749251504,-87.671898394,2018-09-20T17:00:00.000+02:00,9,20,17,2018,Non-Violent
11523707,12/03/2018 12:23:00 AM,ROBBERY,STRONGARM - NO WEAPON,false,false,63,41.794172544,-87.70357593,2018-12-03T00:23:00.000+02:00,12,3,0,2018,Violent
11471573,10/08/2018 06:00:00 PM,THEFT,OVER $500,false,false,67,41.784113682,-87.657046107,2018-10-08T18:00:00.000+02:00,10,8,18,2018,Non-Violent
11419870,08/19/2018 08:00:00 PM,THEFT,$500 AND UNDER,false,false,28,41.881183104,-87.68498211,2018-08-19T20:00:00.000+02:00,8,19,20,2018,Non-Violent
11528621,12/05/2018 11:50:00 PM,THEFT,FROM BUILDING,false,false,41,41.790546107,-87.598053945,2018-12-05T23:50:00.000+02:00,12,5,23,2018,Non-Violent
11513666,11/20/2018 09:00:00 PM,PUBLIC PEACE VIOLATION,BOMB THREAT,false,false,22,41.917233718,-87.720892926,2018-11-20T21:00:00.000+02:00,11,20,21,2018,Non-Violent
11491533,10/28/2018 01:45:00 PM,THEFT,$500 AND UNDER,false,false,31,41.851994976,-87.688837326,2018-10-28T13:45:00.000+02:00,10,28,13,2018,Non-Violent
11415341,08/15/2018 10:30:00 PM,CRIMINAL DAMAGE,TO PROPERTY,false,false,30,41.846416034,-87.698222884,2018-08-15T22:30:00.000+02:00,8,15,22,2018,Non-Violent
11517502,11/18/2018 10:30:00 PM,MOTOR VEHICLE THEFT,AUTOMOBILE,false,false,24,41.907172947,-87.675663672,2018-11-18T22:30:00.000+02:00,11,18,22,2018,Non-Violent
11511234,11/17/2018 04:00:00 AM,BURGLARY,ATTEMPT FORCIBLE ENTRY,false,false,2,41.996810668,-87.692296755,2018-11-17T04:00:00.000+02:00,11,17,4,2018,Non-Violent
11440245,09/08/2018 12:47:00 PM,BATTERY,DOMESTIC BATTERY SIMPLE,false,true,67,41.771416627,-87.656713927,2018-09-08T12:47:00.000+02:00,9,8,12,2018,Violent
11422188,08/22/2018 12:05:00 AM,THEFT,$500 AND UNDER,false,false,69,41.773424557,-87.625146923,2018-08-22T00:05:00.000+02:00,8,22,0,2018,Non-Violent
11490047,10/26/2018 02:30:00 PM,THEFT,$500 AND UNDER,false,false,66,41.773461627,-87.706132139,2018-10-26T14:30:00.000+02:00,10,26,14,2018,Non-Violent
11497638,11/04/2018 10:00:00 AM,THEFT,$500 AND UNDER,false,true,69,41.763599764,-87.630474553,2018-11-04T10:00:00.000+02:00,11,4,10,2018,Non-Violent
11504940,10/28/2018 01:00:00 PM,THEFT,FROM BUILDING,false,false,24,41.8984581,-87.687903858,2018-10-28T13:00:00.000+02:00,10,28,13,2018,Non-Violent
11431132,08/29/2018 02:00:00 PM,THEFT,$500 AND UNDER,false,false,6,41.945306593,-87.660024552,2018-08-29T14:00:00.000+02:00,8,29,14,2018,Non-Violent
11511060,11/18/2018 08:13:00 PM,WEAPONS VIOLATION,UNLAWFUL USE HANDGUN,false,false,49,41.708346383,-87.624759271,2018-11-18T20:13:00.000+02:00,11,18,20,2018,Non-Violent
11497439,11/03/2018 06:45:00 PM,BATTERY,SIMPLE,false,false,54,41.654880566,-87.615805888,2018-11-03T18:45:00.000+02:00,11,3,18,2018,Violent
11442113,09/10/2018 11:30:00 AM,DECEPTIVE PRACTICE,FINAN EXPLOIT-ELDERLY/DISABLED,false,false,69,41.76907549,-87.630165513,2018-09-10T11:30:00.000+02:00,9,10,11,2018,Non-Violent
11470315,10/04/2018 10:30:00 PM,CRIM SEXUAL ASSAULT,PREDATORY,false,false,61,41.807108882,-87.683822208,2018-10-04T22:30:00.000+02:00,10,4,22,2018,Non-Violent
11415036,08/14/2018 07:00:00 PM,CRIMINAL DAMAGE,TO PROPERTY,false,false,11,41.967810369,-87.765332219,2018-08-14T19:00:00.000+02:00,8,14,19,2018,Non-Violent
11535652,12/14/2018 08:19:00 PM,BATTERY,SIMPLE,false,false,23,41.89278947,-87.715011251,2018-12-14T20:19:00.000+02:00,12,14,20,2018,Violent
11497469,11/04/2018 11:16:00 AM,OTHER OFFENSE,VIOLATE ORDER OF PROTECTION,false,true,3,41.957333828,-87.650622101,2018-11-04T11:16:00.000+02:00,11,4,11,2018,Non-Violent
11546873,12/23/2018 04:09:00 PM,DECEPTIVE PRACTICE,ILLEGAL USE CASH CARD,false,false,8,41.897895128,-87.624096605,2018-12-23T16:09:00.000+02:00,12,23,16,2018,Non-Violent
11514252,11/22/2018 09:53:00 AM,BATTERY,DOMESTIC BATTERY SIMPLE,false,true,27,41.877416438,-87.697960096,2018-11-22T09:53:00.000+02:00,11,22,9,2018,Violent
11459053,09/18/2018 02:19:00 PM,THEFT,$500 AND UNDER,false,false,27,41.884231489,-87.696669693,2018-09-18T14:19:00.000+02:00,9,18,14,2018,Non-Violent
11544422,12/23/2018 07:04:00 AM,CRIMINAL DAMAGE,TO VEHICLE,false,false,23,41.894291393,-87.712620394,2018-12-23T07:04:00.000+02:00,12,23,7,2018,Non-Violent
11479502,10/17/2018 06:00:00 PM,OFFENSE INVOLVING CHILDREN,OTHER OFFENSE,false,true,42,41.76680404,-87.605619683,2018-10-17T18:00:00.000+02:00,10,17,18,2018,Non-Violent
11411716,08/12/2018 04:15:00 PM,BATTERY,AGGRAVATED DOMESTIC BATTERY: HANDS/FIST/FEET SERIOUS INJURY,false,true,68,41.79160048,-87.641441198,2018-08-12T16:15:00.000+02:00,8,12,16,2018,Violent
11533481,12/12/2018 12:00:00 PM,CRIMINAL DAMAGE,TO VEHICLE,false,false,70,41.737727691,-87.702064868,2018-12-12T12:00:00.000+02:00,12,12,12,2018,Non-Violent
11474412,10/11/2018 09:00:00 PM,THEFT,$500 AND UNDER,false,false,25,41.883110703,-87.746961502,2018-10-11T21:00:00.000+02:00,10,11,21,2018,Non-Violent
11525742,12/04/2018 08:10:00 PM,BATTERY,AGGRAVATED: OTHER DANG WEAPON,false,false,8,41.895729959,-87.624991059,2018-12-04T20:10:00.000+02:00,12,4,20,2018,Violent
11519310,11/28/2018 11:22:00 AM,THEFT,RETAIL THEFT,true,false,51,41.722476277,-87.574796951,2018-11-28T11:22:00.000+02:00,11,28,11,2018,Non-Violent
11463178,09/11/2018 08:45:00 AM,BATTERY,DOMESTIC BATTERY SIMPLE,false,true,43,41.770770047,-87.591113114,2018-09-11T08:45:00.000+02:00,9,11,8,2018,Violent
11493737,10/31/2018 05:00:00 PM,CRIMINAL DAMAGE,TO PROPERTY,false,false,56,41.794992836,-87.795314768,2018-10-31T17:00:00.000+02:00,10,31,17,2018,Non-Violent
11451007,09/19/2018 10:42:00 AM,OTHER OFFENSE,TELEPHONE THREAT,false,false,41,41.797936811,-87.606301777,2018-09-19T10:42:00.000+02:00,9,19,10,2018,Non-Violent
11517829,11/26/2018 07:30:00 PM,BATTERY,AGGRAVATED DOMESTIC BATTERY: KNIFE/CUTTING INST,false,true,25,41.876646666,-87.755906591,2018-11-26T19:30:00.000+02:00,11,26,19,2018,Violent
11505589,11/12/2018 08:00:00 PM,BATTERY,DOMESTIC BATTERY SIMPLE,true,true,24,41.898992594,-87.677139749,2018-11-12T20:00:00.000+02:00,11,12,20,2018,Violent
11426730,08/26/2018 04:04:00 PM,BATTERY,DOMESTIC BATTERY SIMPLE,true,true,43,41.758991698,-87.566072806,2018-08-26T16:04:00.000+02:00,8,26,16,2018,Violent
11543020,12/21/2018 06:35:00 PM,BATTERY,DOMESTIC BATTERY SIMPLE,true,true,3,41.961063743,-87.65117424,2018-12-21T18:35:00.000+02:00,12,21,18,2018,Violent
11419447,08/19/2018 07:30:00 PM,THEFT,$500 AND UNDER,false,true,40,41.792100765,-87.619154763,2018-08-19T19:30:00.000+02:00,8,19,19,2018,Non-Violent
11509183,11/16/2018 12:00:00 AM,CRIMINAL DAMAGE,TO VEHICLE,false,false,25,41.873853214,-87.762533524,2018-11-16T00:00:00.000+02:00,11,16,0,2018,Non-Violent
11424732,08/23/2018 10:30:00 AM,BURGLARY,UNLAWFUL ENTRY,false,false,7,41.930844012,-87.670779046,2018-08-23T10:30:00.000+02:00,8,23,10,2018,Non-Violent
11542130,12/21/2018 12:12:00 AM,OTHER OFFENSE,HARASSMENT BY TELEPHONE,false,false,21,41.946461543,-87.72072354,2018-12-21T00:12:00.000+02:00,12,21,0,2018,Non-Violent
11432368,08/31/2018 05:00:00 PM,BURGLARY,FORCIBLE ENTRY,false,false,23,41.897360847,-87.733538268,2018-08-31T17:00:00.000+02:00,8,31,17,2018,Non-Violent
11463066,09/30/2018 11:30:00 PM,BATTERY,DOMESTIC BATTERY SIMPLE,false,true,6,41.939943264,-87.651924995,2018-09-30T23:30:00.000+02:00,9,30,23,2018,Violent
11408207,02/28/2018 02:27:42 PM,NARCOTICS,POSS: CRACK,true,false,49,41.704601425,-87.622262568,2018-02-28T14:27:42.000+02:00,2,28,14,2018,Non-Violent
11539351,12/18/2018 03:30:00 PM,THEFT,$500 AND UNDER,false,false,20,41.924349755,-87.738161788,2018-12-18T15:30:00.000+02:00,12,18,15,2018,Non-Violent
11510752,11/18/2018 11:00:00 AM,THEFT,FROM BUILDING,false,false,28,41.886778491,-87.649016097,2018-11-18T11:00:00.000+02:00,11,18,11,2018,Non-Violent
11459806,09/27/2018 02:15:00 PM,CRIMINAL DAMAGE,TO PROPERTY,false,false,73,41.721359294,-87.651411429,2018-09-27T14:15:00.000+02:00,9,27,14,2018,Non-Violent
11486569,10/24/2018 11:00:00 AM,BATTERY,SIMPLE,false,false,25,41.913541176,-87.798593209,2018-10-24T11:00:00.000+02:00,10,24,11,2018,Violent
11432485,08/31/2018 05:45:00 PM,MOTOR VEHICLE THEFT,THEFT/RECOVERY: AUTOMOBILE,true,false,16,41.944913678,-87.734746879,2018-08-31T17:45:00.000+02:00,8,31,17,2018,Non-Violent
11451867,09/19/2018 02:00:00 AM,THEFT,FROM BUILDING,false,false,46,41.751007325,-87.581665974,2018-09-19T02:00:00.000+02:00,9,19,2,2018,Non-Violent
11481741,10/17/2018 03:40:00 AM,BATTERY,SIMPLE,false,false,58,41.80800325,-87.713068922,2018-10-17T03:40:00.000+02:00,10,17,3,2018,Violent
11457281,09/24/2018 12:45:00 PM,THEFT,FROM BUILDING,false,false,28,41.878874134,-87.668003992,2018-09-24T12:45:00.000+02:00,9,24,12,2018,Non-Violent
11413093,08/13/2018 10:35:00 PM,THEFT,OVER $500,false,false,7,41.92978357,-87.643095686,2018-08-13T22:35:00.000+02:00,8,13,22,2018,Non-Violent
11414935,08/13/2018 11:00:00 PM,ROBBERY,ATTEMPT: STRONGARM-NO WEAPON,false,false,38,41.808929094,-87.616576329,2018-08-13T23:00:00.000+02:00,8,13,23,2018,Violent
11415189,08/13/2018 02:35:00 PM,DECEPTIVE PRACTICE,CREDIT CARD FRAUD,false,false,24,,,2018-08-13T14:35:00.000+02:00,8,13,14,2018,Non-Violent
11486132,09/03/2018 01:09:00 PM,NARCOTICS,MANU/DELIVER: HEROIN (WHITE),true,false,67,,,2018-09-03T13:09:00.000+02:00,9,3,13,2018,Non-Violent
11463258,09/23/2018 03:00:00 PM,CRIMINAL DAMAGE,TO VEHICLE,false,false,21,41.933885373,-87.708105735,2018-09-23T15:00:00.000+02:00,9,23,15,2018,Non-Violent
11540567,12/19/2018 01:00:00 PM,BATTERY,SIMPLE,false,false,28,41.881712524,-87.651306513,2018-12-19T13:00:00.000+02:00,12,19,13,2018,Violent
11466431,10/03/2018 03:30:00 PM,THEFT,FROM BUILDING,false,true,20,41.919610607,-87.730298605,2018-10-03T15:30:00.000+02:00,10,3,15,2018,Non-Violent
11480280,10/18/2018 01:37:00 PM,OTHER OFFENSE,HARASSMENT BY ELECTRONIC MEANS,false,false,38,41.81557542,-87.621381196,2018-10-18T13:37:00.000+02:00,10,18,13,2018,Non-Violent
11431681,08/31/2018 06:58:00 AM,CRIMINAL TRESPASS,TO RESIDENCE,true,false,73,41.72274305,-87.635967761,2018-08-31T06:58:00.000+02:00,8,31,6,2018,Non-Violent
11448752,09/17/2018 04:17:00 AM,BATTERY,SIMPLE,false,false,10,41.969425592,-87.807135279,2018-09-17T04:17:00.000+02:00,9,17,4,2018,Violent
11435506,09/04/2018 12:43:00 AM,BATTERY,DOMESTIC BATTERY SIMPLE,false,true,23,41.905290267,-87.732215052,2018-09-04T00:43:00.000+02:00,9,4,0,2018,Violent
11428398,07/31/2018 12:00:00 AM,OTHER OFFENSE,VIOLATE ORDER OF PROTECTION,true,true,22,41.932027273,-87.70805773,2018-07-31T00:00:00.000+02:00,7,31,0,2018,Non-Violent
11454496,09/21/2018 02:29:00 PM,ASSAULT,AGGRAVATED: OTHER DANG WEAPON,false,false,8,41.891316439,-87.631118191,2018-09-21T14:29:00.000+02:00,9,21,14,2018,Violent
11519498,10/31/2018 02:00:00 AM,THEFT,$500 AND UNDER,false,false,44,41.74684719,-87.603840631,2018-10-31T02:00:00.000+02:00,10,31,2,2018,Non-Violent
11469776,10/07/2018 07:18:00 PM,NARCOTICS,POSS: HEROIN(WHITE),true,false,29,41.86175359,-87.728709664,2018-10-07T19:18:00.000+02:00,10,7,19,2018,Non-Violent
11460826,09/28/2018 12:30:00 PM,ASSAULT,PRO EMP HANDS NO/MIN INJURY,false,false,68,41.790882702,-87.632138427,2018-09-28T12:30:00.000+02:00,9,28,12,2018,Violent
11493002,10/19/2018 01:29:00 AM,BATTERY,AGGRAVATED DOMESTIC BATTERY: OTHER DANG WEAPON,false,true,50,41.721323348,-87.598396749,2018-10-19T01:29:00.000+02:00,10,19,1,2018,Violent
11408774,08/08/2018 12:47:00 PM,THEFT,OVER $500,false,false,70,41.739490064,-87.724021047,2018-08-08T12:47:00.000+02:00,8,8,12,2018,Non-Violent
11515475,11/23/2018 08:34:00 PM,NARCOTICS,POSS: HALLUCINOGENS,true,false,28,41.882360456,-87.668199175,2018-11-23T20:34:00.000+02:00,11,23,20,2018,Non-Violent
11451742,09/20/2018 12:01:00 AM,ROBBERY,ARMED: HANDGUN,false,false,46,41.74728445,-87.572251321,2018-09-20T00:01:00.000+02:00,9,20,0,2018,Violent
11518705,11/27/2018 06:23:00 PM,NARCOTICS,MANU/DEL:CANNABIS 10GM OR LESS,true,false,23,41.902365801,-87.716854733,2018-11-27T18:23:00.000+02:00,11,27,18,2018,Non-Violent
11548944,12/15/2018 09:30:00 AM,THEFT,$500 AND UNDER,false,false,21,41.939288947,-87.712187877,2018-12-15T09:30:00.000+02:00,12,15,9,2018,Non-Violent
11433693,09/01/2018 10:00:00 PM,THEFT,OVER $500,false,false,29,41.851560735,-87.723909267,2018-09-01T22:00:00.000+02:00,9,1,22,2018,Non-Violent
11528537,12/07/2018 05:30:00 PM,BATTERY,DOMESTIC BATTERY SIMPLE,false,true,29,41.866395754,-87.706491213,2018-12-07T17:30:00.000+02:00,12,7,17,2018,Violent
11464279,09/25/2018 08:00:00 AM,DECEPTIVE PRACTICE,FORGERY,false,false,30,41.844425687,-87.711627251,2018-09-25T08:00:00.000+02:00,9,25,8,2018,Non-Violent
11536358,12/15/2018 05:30:00 PM,THEFT,RETAIL THEFT,false,false,3,41.965781301,-87.657716788,2018-12-15T17:30:00.000+02:00,12,15,17,2018,Non-Violent
11430167,08/29/2018 12:01:00 AM,THEFT,$500 AND UNDER,false,false,7,,,2018-08-29T00:01:00.000+02:00,8,29,0,2018,Non-Violent
11489463,10/24/2018 06:30:00 PM,CRIMINAL DAMAGE,TO VEHICLE,false,false,6,41.951574531,-87.65445901,2018-10-24T18:30:00.000+02:00,10,24,18,2018,Non-Violent
11429839,08/29/2018 11:40:00 AM,ROBBERY,ARMED:KNIFE/CUTTING INSTRUMENT,false,false,43,41.757548551,-87.586112366,2018-08-29T11:40:00.000+02:00,8,29,11,2018,Violent
11514125,11/22/2018 04:42:00 AM,CRIMINAL DAMAGE,TO PROPERTY,false,false,43,41.754328122,-87.583375388,2018-11-22T04:42:00.000+02:00,11,22,4,2018,Non-Violent
11464355,10/01/2018 08:00:00 PM,THEFT,$500 AND UNDER,false,false,28,41.883498855,-87.692244515,2018-10-01T20:00:00.000+02:00,10,1,20,2018,Non-Violent
11503108,11/10/2018 12:24:00 AM,BATTERY,AGGRAVATED DOMESTIC BATTERY: KNIFE/CUTTING INST,true,true,68,41.759738866,-87.644576459,2018-11-10T00:24:00.000+02:00,11,10,0,2018,Violent
11475467,10/12/2018 08:30:00 AM,THEFT,OVER $500,false,false,39,41.810453067,-87.593347577,2018-10-12T08:30:00.000+02:00,10,12,8,2018,Non-Violent
11496041,11/02/2018 07:11:00 PM,BATTERY,SIMPLE,false,false,43,41.758536614,-87.586130225,2018-11-02T19:11:00.000+02:00,11,2,19,2018,Violent
11451996,09/01/2018 11:20:00 AM,OTHER OFFENSE,HARASSMENT BY TELEPHONE,false,false,76,41.980958608,-87.845455914,2018-09-01T11:20:00.000+02:00,9,1,11,2018,Non-Violent
11505693,11/12/2018 10:03:00 PM,CRIMINAL TRESPASS,TO LAND,false,false,8,41.904674107,-87.634509412,2018-11-12T22:03:00.000+02:00,11,12,22,2018,Non-Violent
11423332,08/23/2018 11:35:00 AM,NARCOTICS,POSS: CRACK,true,false,23,41.894321059,-87.724828857,2018-08-23T11:35:00.000+02:00,8,23,11,2018,Non-Violent
11421416,08/21/2018 03:35:00 PM,DECEPTIVE PRACTICE,CREDIT CARD FRAUD,false,false,32,41.885369466,-87.63243193,2018-08-21T15:35:00.000+02:00,8,21,15,2018,Non-Violent
11434297,09/01/2018 01:15:00 AM,THEFT,FROM BUILDING,false,false,8,41.890013524,-87.631664996,2018-09-01T01:15:00.000+02:00,9,1,1,2018,Non-Violent
11446269,09/13/2018 08:15:00 PM,DECEPTIVE PRACTICE,FRAUD OR CONFIDENCE GAME,false,false,33,41.866843668,-87.625816668,2018-09-13T20:15:00.000+02:00,9,13,20,2018,Non-Violent
11534549,12/13/2018 05:30:00 PM,THEFT,RETAIL THEFT,false,false,24,41.896358373,-87.686859824,2018-12-13T17:30:00.000+02:00,12,13,17,2018,Non-Violent
11531126,12/08/2018 11:30:00 PM,THEFT,POCKET-PICKING,false,false,24,41.909829291,-87.676609962,2018-12-08T23:30:00.000+02:00,12,8,23,2018,Non-Violent
11538677,12/17/2018 10:30:00 AM,OTHER OFFENSE,HARASSMENT BY TELEPHONE,false,true,53,41.673816377,-87.623736207,2018-12-17T10:30:00.000+02:00,12,17,10,2018,Non-Violent
11437113,09/05/2018 11:55:00 AM,BATTERY,DOMESTIC BATTERY SIMPLE,false,true,19,41.928367748,-87.769794422,2018-09-05T11:55:00.000+02:00,9,5,11,2018,Violent
11535854,12/15/2018 12:35:00 AM,ASSAULT,SIMPLE,false,false,43,41.766938864,-87.573873868,2018-12-15T00:35:00.000+02:00,12,15,0,2018,Violent
11409622,08/02/2018 07:00:00 PM,CRIMINAL DAMAGE,TO PROPERTY,false,false,73,41.727510312,-87.666073198,2018-08-02T19:00:00.000+02:00,8,2,19,2018,Non-Violent
11455686,09/22/2018 03:00:00 PM,THEFT,$500 AND UNDER,false,false,38,41.802882762,-87.606421915,2018-09-22T15:00:00.000+02:00,9,22,15,2018,Non-Violent
11540999,12/17/2018 12:30:00 PM,BURGLARY,UNLAWFUL ENTRY,true,false,19,41.937860865,-87.743196446,2018-12-17T12:30:00.000+02:00,12,17,12,2018,Non-Violent
11462966,09/30/2018 09:10:00 PM,CRIMINAL DAMAGE,TO PROPERTY,false,true,34,41.825134315,-87.633085635,2018-09-30T21:10:00.000+02:00,9,30,21,2018,Non-Violent
11438375,09/06/2018 03:25:00 PM,OTHER OFFENSE,GUN OFFENDER: ANNUAL REGISTRATION,true,false,44,41.750857878,-87.602743451,2018-09-06T15:25:00.000+02:00,9,6,15,2018,Non-Violent
11425116,08/25/2018 01:55:00 AM,THEFT,RETAIL THEFT,false,false,25,41.909023481,-87.794924093,2018-08-25T01:55:00.000+02:00,8,25,1,2018,Non-Violent
11507933,11/13/2018 01:30:00 PM,OTHER OFFENSE,OTHER CRIME AGAINST PERSON,false,false,28,41.866706758,-87.679581027,2018-11-13T13:30:00.000+02:00,11,13,13,2018,Non-Violent
11545751,12/24/2018 11:46:00 AM,BURGLARY,FORCIBLE ENTRY,false,false,61,41.796628383,-87.677528564,2018-12-24T11:46:00.000+02:00,12,24,11,2018,Non-Violent
11497558,11/04/2018 11:30:00 AM,THEFT,RETAIL THEFT,false,false,41,41.800455673,-87.587407515,2018-11-04T11:30:00.000+02:00,11,4,11,2018,Non-Violent
11459093,09/05/2018 09:30:00 PM,DECEPTIVE PRACTICE,"THEFT BY LESSEE,MOTOR VEH",false,false,76,41.980826277,-87.883611316,2018-09-05T21:30:00.000+02:00,9,5,21,2018,Non-Violent
11430404,08/29/2018 10:50:00 PM,THEFT,RETAIL THEFT,true,false,4,41.975334679,-87.692313579,2018-08-29T22:50:00.000+02:00,8,29,22,2018,Non-Violent
11458897,09/26/2018 04:00:00 PM,THEFT,OVER $500,false,false,41,41.79107391,-87.586705889,2018-09-26T16:00:00.000+02:00,9,26,16,2018,Non-Violent
11422933,08/23/2018 12:25:00 AM,NARCOTICS,POSS: COCAINE,true,false,24,41.910470499,-87.678366829,2018-08-23T00:25:00.000+02:00,8,23,0,2018,Non-Violent
11519105,10/03/2018 11:00:00 AM,NARCOTICS,FOUND SUSPECT NARCOTICS,true,false,76,,,2018-10-03T11:00:00.000+02:00,10,3,11,2018,Non-Violent
11463391,10/01/2018 09:55:00 AM,THEFT,RETAIL THEFT,true,false,26,41.88065283,-87.731763004,2018-10-01T09:55:00.000+02:00,10,1,9,2018,Non-Violent
11415438,08/15/2018 10:30:00 PM,BATTERY,DOMESTIC BATTERY SIMPLE,false,true,66,41.783791667,-87.692303754,2018-08-15T22:30:00.000+02:00,8,15,22,2018,Violent
11478493,10/16/2018 04:22:00 PM,BATTERY,AGGRAVATED: HANDGUN,false,false,44,41.744554117,-87.626864057,2018-10-16T16:22:00.000+02:00,10,16,16,2018,Violent
11486028,10/24/2018 10:10:00 AM,OTHER OFFENSE,OTHER CRIME AGAINST PERSON,false,false,32,41.878802294,-87.627917354,2018-10-24T10:10:00.000+02:00,10,24,10,2018,Non-Violent
11507871,11/14/2018 09:30:00 AM,ASSAULT,SIMPLE,false,false,69,41.767272487,-87.628821582,2018-11-14T09:30:00.000+02:00,11,14,9,2018,Violent
11455431,09/23/2018 08:50:00 AM,THEFT,$500 AND UNDER,false,false,25,41.880399914,-87.753008553,2018-09-23T08:50:00.000+02:00,9,23,8,2018,Non-Violent
11513314,11/14/2018 04:00:00 AM,CRIMINAL DAMAGE,TO PROPERTY,false,false,8,41.898711539,-87.626544911,2018-11-14T04:00:00.000+02:00,11,14,4,2018,Non-Violent
11433579,08/31/2018 05:00:00 PM,CRIMINAL DAMAGE,TO PROPERTY,false,false,1,42.01608781,-87.680474697,2018-08-31T17:00:00.000+02:00,8,31,17,2018,Non-Violent
11446781,09/14/2018 10:00:00 PM,MOTOR VEHICLE THEFT,AUTOMOBILE,false,false,43,41.752445728,-87.580886914,2018-09-14T22:00:00.000+02:00,9,14,22,2018,Non-Violent
11477435,10/14/2018 06:00:00 PM,THEFT,OVER $500,false,false,1,42.00886185,-87.680865025,2018-10-14T18:00:00.000+02:00,10,14,18,2018,Non-Violent
11446423,09/14/2018 06:30:00 PM,BATTERY,DOMESTIC BATTERY SIMPLE,false,true,19,41.922435963,-87.744341749,2018-09-14T18:30:00.000+02:00,9,14,18,2018,Violent
11451231,09/19/2018 02:00:00 PM,INTERFERENCE WITH PUBLIC OFFICER,OBSTRUCTING IDENTIFICATION,true,false,27,41.873336203,-87.698540249,2018-09-19T14:00:00.000+02:00,9,19,14,2018,Non-Violent
11500787,10/31/2018 09:00:00 AM,THEFT,$500 AND UNDER,false,false,72,41.709045633,-87.681700936,2018-10-31T09:00:00.000+02:00,10,31,9,2018,Non-Violent
11487398,10/25/2018 12:25:00 PM,BATTERY,SIMPLE,false,false,50,41.690640989,-87.605164338,2018-10-25T12:25:00.000+02:00,10,25,12,2018,Violent
11443800,08/23/2018 10:52:00 AM,DECEPTIVE PRACTICE,FINANCIAL IDENTITY THEFT $300 AND UNDER,false,false,42,41.780419124,-87.605289779,2018-08-23T10:52:00.000+02:00,8,23,10,2018,Non-Violent
11494906,10/29/2018 08:40:00 PM,DECEPTIVE PRACTICE,FINANCIAL IDENTITY THEFT OVER $ 300,false,false,71,41.754867225,-87.672049641,2018-10-29T20:40:00.000+02:00,10,29,20,2018,Non-Violent
11521672,11/30/2018 03:46:00 PM,THEFT,$500 AND UNDER,true,false,32,41.877661886,-87.627665516,2018-11-30T15:46:00.000+02:00,11,30,15,2018,Non-Violent
11409984,07/31/2018 06:00:00 AM,DECEPTIVE PRACTICE,FRAUD OR CONFIDENCE GAME,false,false,15,41.960911954,-87.779482738,2018-07-31T06:00:00.000+02:00,7,31,6,2018,Non-Violent
11444337,09/12/2018 06:50:00 PM,NARCOTICS,POSS: HEROIN(WHITE),true,false,29,41.862393102,-87.7339643,2018-09-12T18:50:00.000+02:00,9,12,18,2018,Non-Violent
11465566,09/28/2018 02:55:00 PM,BATTERY,PRO EMP HANDS NO/MIN INJURY,false,false,25,41.873709176,-87.749169703,2018-09-28T14:55:00.000+02:00,9,28,14,2018,Violent
11503141,11/09/2018 11:35:00 PM,OTHER OFFENSE,GUN OFFENDER: DUTY TO REPORT CHANGE OF INFORMATION,false,false,43,41.758174759,-87.549934016,2018-11-09T23:35:00.000+02:00,11,9,23,2018,Non-Violent
11434972,09/03/2018 12:59:00 PM,CRIMINAL TRESPASS,TO LAND,false,false,25,41.907834248,-87.744409863,2018-09-03T12:59:00.000+02:00,9,3,12,2018,Non-Violent
11515514,11/23/2018 08:55:00 PM,WEAPONS VIOLATION,UNLAWFUL POSS OF HANDGUN,false,false,29,41.860911204,-87.695744714,2018-11-23T20:55:00.000+02:00,11,23,20,2018,Non-Violent
11414090,08/14/2018 06:32:00 PM,NARCOTICS,POSS: CANNABIS MORE THAN 30GMS,true,false,23,41.901469184,-87.726267054,2018-08-14T18:32:00.000+02:00,8,14,18,2018,Non-Violent
11419119,08/19/2018 05:17:00 AM,ASSAULT,AGGRAVATED: HANDGUN,false,true,69,41.759515663,-87.607864503,2018-08-19T05:17:00.000+02:00,8,19,5,2018,Violent
11490136,10/28/2018 10:15:00 AM,CRIMINAL DAMAGE,TO PROPERTY,false,false,67,41.771736514,-87.66400571,2018-10-28T10:15:00.000+02:00,10,28,10,2018,Non-Violent
11449872,09/17/2018 06:00:00 PM,THEFT,$500 AND UNDER,false,false,23,41.904447804,-87.725441691,2018-09-17T18:00:00.000+02:00,9,17,18,2018,Non-Violent
11546680,12/24/2018 11:00:00 PM,BATTERY,SIMPLE,false,true,24,41.911473069,-87.684815277,2018-12-24T23:00:00.000+02:00,12,24,23,2018,Violent
11552724,12/31/2018 11:56:00 PM,BATTERY,AGG: HANDS/FIST/FEET NO/MINOR INJURY,true,false,31,41.857068095,-87.657625201,2018-12-31T23:56:00.000+02:00,12,31,23,2018,Violent
11451067,05/18/2018 12:00:00 AM,DECEPTIVE PRACTICE,FINANCIAL IDENTITY THEFT $300 AND UNDER,false,false,2,42.003426372,-87.704603421,2018-05-18T00:00:00.000+02:00,5,18,0,2018,Non-Violent
11518274,11/22/2018 11:00:00 AM,DECEPTIVE PRACTICE,"THEFT BY LESSEE,MOTOR VEH",false,false,20,41.924452852,-87.729525431,2018-11-22T11:00:00.000+02:00,11,22,11,2018,Non-Violent
11410261,08/10/2018 08:30:00 PM,CRIMINAL DAMAGE,TO VEHICLE,false,false,5,41.942022607,-87.68690967,2018-08-10T20:30:00.000+02:00,8,10,20,2018,Non-Violent
11459426,09/21/2018 06:00:00 AM,OTHER OFFENSE,HARASSMENT BY TELEPHONE,false,true,43,41.752999364,-87.566254121,2018-09-21T06:00:00.000+02:00,9,21,6,2018,Non-Violent
11448756,09/17/2018 08:28:00 AM,ASSAULT,PRO EMP HANDS NO/MIN INJURY,false,false,66,41.764328821,-87.706173442,2018-09-17T08:28:00.000+02:00,9,17,8,2018,Violent
11427598,08/27/2018 02:00:00 PM,THEFT,FROM BUILDING,false,false,16,41.949640324,-87.713238008,2018-08-27T14:00:00.000+02:00,8,27,14,2018,Non-Violent
11519532,10/11/2018 04:00:00 AM,THEFT,$500 AND UNDER,false,false,22,41.91508634,-87.706900442,2018-10-11T04:00:00.000+02:00,10,11,4,2018,Non-Violent
11488957,10/27/2018 02:10:00 AM,BATTERY,DOMESTIC BATTERY SIMPLE,true,true,1,42.011442705,-87.672938469,2018-10-27T02:10:00.000+02:00,10,27,2,2018,Violent
11455145,09/23/2018 04:40:00 AM,ROBBERY,AGGRAVATED VEHICULAR HIJACKING,false,false,49,41.710019614,-87.611402474,2018-09-23T04:40:00.000+02:00,9,23,4,2018,Violent
11512096,11/19/2018 06:31:00 PM,BATTERY,AGGRAVATED PO: KNIFE/CUT INSTR,true,false,38,41.821092112,-87.626382913,2018-11-19T18:31:00.000+02:00,11,19,18,2018,Violent
11407065,08/07/2018 09:00:00 AM,CRIMINAL DAMAGE,TO CITY OF CHICAGO PROPERTY,false,false,10,41.98818957,-87.80276544,2018-08-07T09:00:00.000+02:00,8,7,9,2018,Non-Violent
11507062,11/14/2018 01:45:00 PM,NARCOTICS,POSS: CANNABIS MORE THAN 30GMS,true,false,29,41.863652779,-87.709245672,2018-11-14T13:45:00.000+02:00,11,14,13,2018,Non-Violent
11409844,07/13/2018 01:00:00 PM,DECEPTIVE PRACTICE,ILLEGAL USE CASH CARD,false,false,33,41.856083523,-87.627164967,2018-07-13T13:00:00.000+02:00,7,13,13,2018,Non-Violent
11475946,10/14/2018 03:26:00 AM,BATTERY,SIMPLE,false,false,8,41.903917122,-87.630531971,2018-10-14T03:26:00.000+02:00,10,14,3,2018,Violent
11537317,12/16/2018 03:00:00 PM,ASSAULT,SIMPLE,false,true,44,41.746884471,-87.600212371,2018-12-16T15:00:00.000+02:00,12,16,15,2018,Violent
11509152,11/15/2018 09:55:00 PM,CRIMINAL DAMAGE,TO PROPERTY,false,false,15,41.942888842,-87.751912947,2018-11-15T21:55:00.000+02:00,11,15,21,2018,Non-Violent
11464064,09/07/2018 01:30:00 AM,BATTERY,SIMPLE,false,false,6,41.936335635,-87.650710119,2018-09-07T01:30:00.000+02:00,9,7,1,2018,Violent
11534907,12/13/2018 12:54:00 PM,OTHER OFFENSE,VIOLATE ORDER OF PROTECTION,false,true,28,41.874381838,-87.641536792,2018-12-13T12:54:00.000+02:00,12,13,12,2018,Non-Violent
11454488,09/22/2018 02:00:00 AM,THEFT,OVER $500,false,false,7,41.92527195,-87.65970977,2018-09-22T02:00:00.000+02:00,9,22,2,2018,Non-Violent
11517820,11/24/2018 05:00:00 PM,BATTERY,DOMESTIC BATTERY SIMPLE,false,true,1,42.021156986,-87.671012579,2018-11-24T17:00:00.000+02:00,11,24,17,2018,Violent
11515401,11/23/2018 09:00:00 AM,BURGLARY,FORCIBLE ENTRY,false,false,60,41.83143706,-87.646123702,2018-11-23T09:00:00.000+02:00,11,23,9,2018,Non-Violent
11483069,10/21/2018 11:30:00 AM,ROBBERY,ARMED: OTHER DANGEROUS WEAPON,true,false,25,41.870364073,-87.744897116,2018-10-21T11:30:00.000+02:00,10,21,11,2018,Violent
11418629,08/18/2018 08:38:00 PM,CRIMINAL TRESPASS,TO RESIDENCE,false,false,71,41.749927951,-87.650086717,2018-08-18T20:38:00.000+02:00,8,18,20,2018,Non-Violent
11527772,12/06/2018 11:46:00 PM,BATTERY,DOMESTIC BATTERY SIMPLE,false,true,58,41.824203178,-87.697095972,2018-12-06T23:46:00.000+02:00,12,6,23,2018,Violent
11532586,12/11/2018 10:00:00 PM,THEFT,$500 AND UNDER,false,false,24,41.910425988,-87.680670775,2018-12-11T22:00:00.000+02:00,12,11,22,2018,Non-Violent
11423996,08/23/2018 06:00:00 PM,ROBBERY,STRONGARM - NO WEAPON,false,false,73,41.721224218,-87.662028315,2018-08-23T18:00:00.000+02:00,8,23,18,2018,Violent
11430778,08/30/2018 12:00:00 PM,BATTERY,SIMPLE,false,false,27,41.870824614,-87.718608161,2018-08-30T12:00:00.000+02:00,8,30,12,2018,Violent
11429514,08/29/2018 09:00:00 AM,THEFT,FROM BUILDING,false,false,8,41.908255796,-87.640928716,2018-08-29T09:00:00.000+02:00,8,29,9,2018,Non-Violent
11464488,10/02/2018 08:00:00 AM,OFFENSE INVOLVING CHILDREN,OTHER OFFENSE,false,true,40,41.797602099,-87.622541016,2018-10-02T08:00:00.000+02:00,10,2,8,2018,Non-Violent
11416990,08/17/2018 09:00:00 AM,THEFT,$500 AND UNDER,false,false,32,41.884790951,-87.624469241,2018-08-17T09:00:00.000+02:00,8,17,9,2018,Non-Violent
11422307,08/17/2018 03:24:00 PM,MOTOR VEHICLE THEFT,"TRUCK, BUS, MOTOR HOME",false,false,68,41.760645545,-87.644295533,2018-08-17T15:24:00.000+02:00,8,17,15,2018,Non-Violent
11436929,09/04/2018 09:30:00 PM,OTHER OFFENSE,HARASSMENT BY ELECTRONIC MEANS,false,false,11,41.968510876,-87.780093519,2018-09-04T21:30:00.000+02:00,9,4,21,2018,Non-Violent
11502852,11/09/2018 07:45:00 PM,NARCOTICS,SOLICIT NARCOTICS ON PUBLICWAY,true,false,23,41.896006811,-87.712669898,2018-11-09T19:45:00.000+02:00,11,9,19,2018,Non-Violent
11413914,08/14/2018 06:00:00 PM,CRIMINAL DAMAGE,TO PROPERTY,false,false,71,41.744036934,-87.647492541,2018-08-14T18:00:00.000+02:00,8,14,18,2018,Non-Violent
11489594,10/25/2018 12:00:00 PM,BURGLARY,UNLAWFUL ENTRY,false,false,21,41.935703007,-87.704262014,2018-10-25T12:00:00.000+02:00,10,25,12,2018,Non-Violent
11454823,09/22/2018 05:17:00 PM,CRIMINAL TRESPASS,TO RESIDENCE,true,false,29,41.867595589,-87.69959933,2018-09-22T17:17:00.000+02:00,9,22,17,2018,Non-Violent
11480687,09/30/2018 12:01:00 AM,OFFENSE INVOLVING CHILDREN,CHILD ABUSE,false,true,40,41.79595528,-87.622500536,2018-09-30T00:01:00.000+02:00,9,30,0,2018,Non-Violent
11526345,12/05/2018 09:30:00 AM,BATTERY,SIMPLE,false,false,28,41.874997972,-87.686513346,2018-12-05T09:30:00.000+02:00,12,5,9,2018,Violent
11487326,10/24/2018 01:10:00 PM,ASSAULT,SIMPLE,false,false,56,41.812306287,-87.74328289,2018-10-24T13:10:00.000+02:00,10,24,13,2018,Violent
11515973,11/24/2018 04:55:00 PM,THEFT,RETAIL THEFT,false,false,20,41.931578463,-87.743026506,2018-11-24T16:55:00.000+02:00,11,24,16,2018,Non-Violent
11521469,11/29/2018 08:18:00 PM,PUBLIC PEACE VIOLATION,MOB ACTION,false,false,49,41.71902307,-87.620528559,2018-11-29T20:18:00.000+02:00,11,29,20,2018,Non-Violent
11478109,10/16/2018 12:00:00 PM,THEFT,RETAIL THEFT,false,false,3,41.962997708,-87.654760597,2018-10-16T12:00:00.000+02:00,10,16,12,2018,Non-Violent
11427495,08/26/2018 10:00:00 PM,MOTOR VEHICLE THEFT,ATT: AUTOMOBILE,false,false,30,41.842581865,-87.712702046,2018-08-26T22:00:00.000+02:00,8,26,22,2018,Non-Violent
11448490,09/16/2018 11:41:00 PM,DECEPTIVE PRACTICE,THEFT OF LABOR/SERVICES,false,false,44,41.743205726,-87.602581034,2018-09-16T23:41:00.000+02:00,9,16,23,2018,Non-Violent
11523687,12/02/2018 10:45:00 PM,CRIMINAL DAMAGE,TO VEHICLE,false,false,32,41.885303483,-87.627930307,2018-12-02T22:45:00.000+02:00,12,2,22,2018,Non-Violent
11552546,12/31/2018 09:12:00 PM,BATTERY,SIMPLE,false,false,49,41.726924239,-87.632171275,2018-12-31T21:12:00.000+02:00,12,31,21,2018,Violent
11461100,09/28/2018 08:04:00 AM,THEFT,$500 AND UNDER,false,false,63,41.80462016,-87.684368169,2018-09-28T08:04:00.000+02:00,9,28,8,2018,Non-Violent
11459880,09/27/2018 04:35:00 PM,ROBBERY,ARMED: OTHER DANGEROUS WEAPON,false,false,28,41.872219362,-87.655339767,2018-09-27T16:35:00.000+02:00,9,27,16,2018,Violent
11456783,09/24/2018 07:11:00 PM,NARCOTICS,POSS: HEROIN(WHITE),true,false,68,41.766025213,-87.644435915,2018-09-24T19:11:00.000+02:00,9,24,19,2018,Non-Violent
11521761,11/30/2018 07:00:00 PM,BATTERY,SIMPLE,true,false,6,41.943731737,-87.640703062,2018-11-30T19:00:00.000+02:00,11,30,19,2018,Violent
11488953,10/27/2018 02:30:00 AM,CRIMINAL DAMAGE,CRIMINAL DEFACEMENT,false,false,1,42.022062685,-87.67484904,2018-10-27T02:30:00.000+02:00,10,27,2,2018,Non-Violent
11441186,09/09/2018 03:15:00 PM,BATTERY,SIMPLE,true,false,71,41.747500936,-87.674338614,2018-09-09T15:15:00.000+02:00,9,9,15,2018,Violent
11583546,10/14/2018 09:00:00 AM,OTHER OFFENSE,OTHER CRIME AGAINST PERSON,false,true,74,,,2018-10-14T09:00:00.000+02:00,10,14,9,2018,Non-Violent
11409746,08/10/2018 04:30:00 PM,NARCOTICS,MANU/DELIVER: HEROIN (WHITE),true,false,23,41.901406068,-87.71444325,2018-08-10T16:30:00.000+02:00,8,10,16,2018,Non-Violent
11451791,09/19/2018 05:30:00 PM,OFFENSE INVOLVING CHILDREN,ENDANGERING LIFE/HEALTH CHILD,false,false,48,41.725695062,-87.556677167,2018-09-19T17:30:00.000+02:00,9,19,17,2018,Non-Violent
11528903,12/08/2018 01:32:00 AM,CONCEALED CARRY LICENSE VIOLATION,ARMED WHILE UNDER THE INFLUENCE,true,false,26,41.877997139,-87.724095124,2018-12-08T01:32:00.000+02:00,12,8,1,2018,Non-Violent
11433877,09/02/2018 08:00:00 AM,ASSAULT,AGGRAVATED:KNIFE/CUTTING INSTR,false,true,61,41.797143568,-87.650091532,2018-09-02T08:00:00.000+02:00,9,2,8,2018,Violent
11546231,12/24/2018 06:00:00 AM,BATTERY,DOMESTIC BATTERY SIMPLE,false,true,1,42.02025525,-87.670727526,2018-12-24T06:00:00.000+02:00,12,24,6,2018,Violent
11502994,11/09/2018 05:00:00 PM,BURGLARY,FORCIBLE ENTRY,false,false,17,41.941109615,-87.789806138,2018-11-09T17:00:00.000+02:00,11,9,17,2018,Non-Violent
11530431,12/09/2018 06:44:00 PM,NARCOTICS,MANU/DEL:CANNABIS OVER 10 GMS,true,false,49,41.706000377,-87.623488626,2018-12-09T18:44:00.000+02:00,12,9,18,2018,Non-Violent
11523456,12/02/2018 06:10:00 PM,OTHER OFFENSE,TELEPHONE THREAT,false,false,45,41.737995578,-87.578164743,2018-12-02T18:10:00.000+02:00,12,2,18,2018,Non-Violent
11447756,09/15/2018 10:00:00 AM,CRIMINAL DAMAGE,TO PROPERTY,false,false,9,41.997125876,-87.810803019,2018-09-15T10:00:00.000+02:00,9,15,10,2018,Non-Violent
11536369,12/15/2018 12:01:00 AM,BATTERY,SIMPLE,false,false,8,41.893676841,-87.631176812,2018-12-15T00:01:00.000+02:00,12,15,0,2018,Violent
11441820,09/10/2018 01:00:00 AM,MOTOR VEHICLE THEFT,AUTOMOBILE,false,false,29,41.865883058,-87.708089556,2018-09-10T01:00:00.000+02:00,9,10,1,2018,Non-Violent
11487090,10/24/2018 11:00:00 PM,THEFT,$500 AND UNDER,false,false,28,41.872214615,-87.659195037,2018-10-24T23:00:00.000+02:00,10,24,23,2018,Non-Violent
11510518,11/18/2018 03:11:00 AM,BATTERY,AGGRAVATED: HANDGUN,false,false,23,41.892249873,-87.716221131,2018-11-18T03:11:00.000+02:00,11,18,3,2018,Violent
11509052,11/10/2018 12:30:00 PM,NARCOTICS,FOUND SUSPECT NARCOTICS,true,false,10,41.988630807,-87.812829371,2018-11-10T12:30:00.000+02:00,11,10,12,2018,Non-Violent
11470545,10/08/2018 04:30:00 PM,BATTERY,SIMPLE,false,false,26,41.876196728,-87.724060818,2018-10-08T16:30:00.000+02:00,10,8,16,2018,Violent
11535987,12/10/2018 10:18:00 AM,THEFT,$500 AND UNDER,false,false,38,41.821454235,-87.610926225,2018-12-10T10:18:00.000+02:00,12,10,10,2018,Non-Violent
11475718,10/13/2018 08:00:00 PM,CRIMINAL DAMAGE,TO PROPERTY,false,false,46,41.74751081,-87.556458254,2018-10-13T20:00:00.000+02:00,10,13,20,2018,Non-Violent
11408267,08/09/2018 12:01:00 AM,CRIMINAL DAMAGE,TO VEHICLE,false,false,11,41.989429192,-87.7725851,2018-08-09T00:01:00.000+02:00,8,9,0,2018,Non-Violent
11543515,12/22/2018 07:40:00 AM,CRIMINAL TRESPASS,TO LAND,true,false,39,41.81600695,-87.601834735,2018-12-22T07:40:00.000+02:00,12,22,7,2018,Non-Violent
11537729,12/16/2018 02:00:00 PM,CRIMINAL DAMAGE,TO PROPERTY,false,false,68,41.766139436,-87.641978753,2018-12-16T14:00:00.000+02:00,12,16,14,2018,Non-Violent
11591728,11/17/2018 09:00:00 AM,THEFT,FROM BUILDING,false,false,25,,,2018-11-17T09:00:00.000+02:00,11,17,9,2018,Non-Violent
11512818,10/29/2018 01:00:00 PM,DECEPTIVE PRACTICE,FINANCIAL IDENTITY THEFT OVER $ 300,false,false,64,41.774040087,-87.779711258,2018-10-29T13:00:00.000+02:00,10,29,13,2018,Non-Violent
11496425,11/03/2018 07:40:00 AM,MOTOR VEHICLE THEFT,AUTOMOBILE,false,false,8,41.891948167,-87.628073894,2018-11-03T07:40:00.000+02:00,11,3,7,2018,Non-Violent
11514311,11/22/2018 12:25:00 PM,THEFT,RETAIL THEFT,false,false,32,41.886202772,-87.620685715,2018-11-22T12:25:00.000+02:00,11,22,12,2018,Non-Violent
11506026,11/13/2018 10:00:00 AM,THEFT,OVER $500,false,false,21,41.937354905,-87.720990798,2018-11-13T10:00:00.000+02:00,11,13,10,2018,Non-Violent
11532297,08/27/2018 12:00:00 PM,THEFT,FROM BUILDING,false,false,6,41.941034149,-87.639335535,2018-08-27T12:00:00.000+02:00,8,27,12,2018,Non-Violent
11462317,09/30/2018 03:40:00 AM,ASSAULT,SIMPLE,false,false,24,41.909688587,-87.660365922,2018-09-30T03:40:00.000+02:00,9,30,3,2018,Violent
11436005,09/04/2018 12:25:00 PM,NARCOTICS,POSS: HEROIN(WHITE),true,false,25,41.877699291,-87.742725797,2018-09-04T12:25:00.000+02:00,9,4,12,2018,Non-Violent
11454240,09/22/2018 06:15:00 AM,BATTERY,DOMESTIC BATTERY SIMPLE,false,true,61,41.805850452,-87.675831674,2018-09-22T06:15:00.000+02:00,9,22,6,2018,Violent
11467310,10/05/2018 01:45:00 AM,ROBBERY,ARMED:KNIFE/CUTTING INSTRUMENT,false,false,58,41.809644125,-87.69302545,2018-10-05T01:45:00.000+02:00,10,5,1,2018,Violent
11456664,09/24/2018 06:02:00 PM,THEFT,RETAIL THEFT,false,false,14,41.968234567,-87.728571616,2018-09-24T18:02:00.000+02:00,9,24,18,2018,Non-Violent
11439370,09/05/2018 02:00:00 PM,THEFT,$500 AND UNDER,false,false,2,42.014676885,-87.70498572,2018-09-05T14:00:00.000+02:00,9,5,14,2018,Non-Violent
11547738,12/27/2018 05:30:00 AM,THEFT,OVER $500,false,false,48,41.729219929,-87.56214824,2018-12-27T05:30:00.000+02:00,12,27,5,2018,Non-Violent
11539364,09/10/2018 12:00:00 AM,DECEPTIVE PRACTICE,ILLEGAL USE CASH CARD,false,false,28,41.876959088,-87.686332007,2018-09-10T00:00:00.000+02:00,9,10,0,2018,Non-Violent
11524206,12/03/2018 01:00:00 PM,CRIMINAL TRESPASS,TO LAND,true,false,43,41.770930748,-87.586268674,2018-12-03T13:00:00.000+02:00,12,3,13,2018,Non-Violent
11434193,09/02/2018 03:50:00 PM,BATTERY,DOMESTIC BATTERY SIMPLE,true,true,13,41.979382697,-87.711835159,2018-09-02T15:50:00.000+02:00,9,2,15,2018,Violent
11515339,11/23/2018 04:45:00 PM,BATTERY,SIMPLE,false,false,34,41.852882701,-87.635528609,2018-11-23T16:45:00.000+02:00,11,23,16,2018,Violent
11437001,09/05/2018 11:45:00 AM,NARCOTICS,POSS: CRACK,true,false,26,41.871180877,-87.735145236,2018-09-05T11:45:00.000+02:00,9,5,11,2018,Non-Violent
11481684,10/18/2018 07:00:00 PM,CRIMINAL DAMAGE,TO VEHICLE,false,false,21,41.945551372,-87.720893991,2018-10-18T19:00:00.000+02:00,10,18,19,2018,Non-Violent
11508538,11/15/2018 09:00:00 PM,THEFT,OVER $500,false,false,22,41.922961256,-87.696240713,2018-11-15T21:00:00.000+02:00,11,15,21,2018,Non-Violent
11506943,11/12/2018 08:00:00 PM,THEFT,$500 AND UNDER,false,false,11,41.976998949,-87.764974751,2018-11-12T20:00:00.000+02:00,11,12,20,2018,Non-Violent
11453669,09/17/2018 09:00:00 AM,DECEPTIVE PRACTICE,FINANCIAL IDENTITY THEFT OVER $ 300,false,false,28,41.876713396,-87.644100332,2018-09-17T09:00:00.000+02:00,9,17,9,2018,Non-Violent
11421771,08/21/2018 08:32:00 PM,BATTERY,AGGRAVATED:KNIFE/CUTTING INSTR,false,false,22,41.924773406,-87.700882146,2018-08-21T20:32:00.000+02:00,8,21,20,2018,Violent
11465620,10/03/2018 09:00:00 AM,THEFT,$500 AND UNDER,false,false,68,41.768718924,-87.65252302,2018-10-03T09:00:00.000+02:00,10,3,9,2018,Non-Violent
11434683,09/03/2018 01:23:00 AM,BATTERY,AGG PO HANDS NO/MIN INJURY,true,false,2,42.018081439,-87.688969872,2018-09-03T01:23:00.000+02:00,9,3,1,2018,Violent
11539143,12/12/2018 07:00:00 PM,DECEPTIVE PRACTICE,"THEFT BY LESSEE,MOTOR VEH",false,false,31,41.852750046,-87.640815604,2018-12-12T19:00:00.000+02:00,12,12,19,2018,Non-Violent
11518991,11/27/2018 05:15:00 PM,THEFT,$500 AND UNDER,false,false,43,41.76972749,-87.583547963,2018-11-27T17:15:00.000+02:00,11,27,17,2018,Non-Violent
11534723,12/13/2018 10:30:00 PM,MOTOR VEHICLE THEFT,AUTOMOBILE,false,false,71,41.735085853,-87.669127357,2018-12-13T22:30:00.000+02:00,12,13,22,2018,Non-Violent
11413403,08/14/2018 09:31:00 AM,OTHER OFFENSE,HARASSMENT BY TELEPHONE,false,false,69,41.754133911,-87.599195331,2018-08-14T09:31:00.000+02:00,8,14,9,2018,Non-Violent
11499255,05/19/2018 12:01:00 AM,OTHER OFFENSE,SEX OFFENDER: FAIL TO REGISTER,false,false,35,41.830611847,-87.623247369,2018-05-19T00:01:00.000+02:00,5,19,0,2018,Non-Violent
11465740,09/02/2018 02:00:00 PM,THEFT,OVER $500,false,false,8,41.899203295,-87.643785079,2018-09-02T14:00:00.000+02:00,9,2,14,2018,Non-Violent
11504816,04/13/2018 09:00:00 AM,DECEPTIVE PRACTICE,FINANCIAL IDENTITY THEFT OVER $ 300,false,false,27,41.871860592,-87.707183161,2018-04-13T09:00:00.000+02:00,4,13,9,2018,Non-Violent
11506610,11/13/2018 04:40:00 PM,KIDNAPPING,CHILD ABDUCTION/STRANGER,false,false,16,41.95384684,-87.713678833,2018-11-13T16:40:00.000+02:00,11,13,16,2018,Violent
11427649,08/27/2018 02:20:00 PM,BATTERY,DOMESTIC BATTERY SIMPLE,false,true,50,41.71767195,-87.593039354,2018-08-27T14:20:00.000+02:00,8,27,14,2018,Violent
11486524,10/23/2018 09:00:00 PM,BATTERY,DOMESTIC BATTERY SIMPLE,false,true,23,41.905248066,-87.706864379,2018-10-23T21:00:00.000+02:00,10,23,21,2018,Violent
11479229,10/17/2018 09:55:00 AM,BATTERY,SIMPLE,false,false,63,41.798225791,-87.708589947,2018-10-17T09:55:00.000+02:00,10,17,9,2018,Violent
11487394,10/12/2018 03:15:00 PM,THEFT,OVER $500,false,false,39,41.805422422,-87.58650264,2018-10-12T15:15:00.000+02:00,10,12,15,2018,Non-Violent
11416558,08/16/2018 10:28:00 PM,CRIMINAL TRESPASS,TO LAND,true,false,21,41.939362537,-87.703031512,2018-08-16T22:28:00.000+02:00,8,16,22,2018,Non-Violent
11453841,09/21/2018 01:00:00 PM,THEFT,$500 AND UNDER,false,false,7,41.914204099,-87.633490624,2018-09-21T13:00:00.000+02:00,9,21,13,2018,Non-Violent
11560700,12/24/2018 09:00:00 AM,DECEPTIVE PRACTICE,COUNTERFEIT CHECK,false,false,56,41.786113398,-87.793793984,2018-12-24T09:00:00.000+02:00,12,24,9,2018,Non-Violent
11536863,12/16/2018 04:31:00 AM,BATTERY,AGG PO HANDS NO/MIN INJURY,true,false,46,41.751184368,-87.573535549,2018-12-16T04:31:00.000+02:00,12,16,4,2018,Violent
11539841,12/18/2018 05:00:00 PM,BURGLARY,UNLAWFUL ENTRY,false,false,49,41.689796401,-87.628602149,2018-12-18T17:00:00.000+02:00,12,18,17,2018,Non-Violent
11523663,12/02/2018 11:50:00 PM,CRIMINAL DAMAGE,TO PROPERTY,false,false,60,41.844511884,-87.639014374,2018-12-02T23:50:00.000+02:00,12,2,23,2018,Non-Violent
11431460,08/23/2018 02:00:00 PM,THEFT,RETAIL THEFT,true,false,43,41.751767411,-87.563417608,2018-08-23T14:00:00.000+02:00,8,23,14,2018,Non-Violent
11430061,06/03/2018 12:00:00 AM,DECEPTIVE PRACTICE,CREDIT CARD FRAUD,false,false,25,41.872908652,-87.758025754,2018-06-03T00:00:00.000+02:00,6,3,0,2018,Non-Violent
11452065,09/19/2018 08:50:00 AM,BATTERY,SIMPLE,false,false,69,41.752151511,-87.618179506,2018-09-19T08:50:00.000+02:00,9,19,8,2018,Violent
11493704,10/31/2018 05:08:00 PM,BATTERY,SIMPLE,false,false,31,41.85775341,-87.668784595,2018-10-31T17:08:00.000+02:00,10,31,17,2018,Violent
11446858,09/15/2018 02:30:00 AM,CRIM SEXUAL ASSAULT,NON-AGGRAVATED,false,false,31,41.855914146,-87.670103066,2018-09-15T02:30:00.000+02:00,9,15,2,2018,Non-Violent
11482333,10/20/2018 04:00:00 PM,ROBBERY,STRONGARM - NO WEAPON,false,false,68,41.779220641,-87.649632877,2018-10-20T16:00:00.000+02:00,10,20,16,2018,Violent
11451075,09/18/2018 09:00:00 PM,THEFT,$500 AND UNDER,false,false,21,41.94110547,-87.695641111,2018-09-18T21:00:00.000+02:00,9,18,21,2018,Non-Violent
11533339,12/03/2018 12:00:00 AM,DECEPTIVE PRACTICE,CREDIT CARD FRAUD,false,false,29,41.86633944,-87.711275475,2018-12-03T00:00:00.000+02:00,12,3,0,2018,Non-Violent
11464154,10/01/2018 11:05:00 PM,OTHER OFFENSE,OTHER VEHICLE OFFENSE,false,false,38,41.816039143,-87.626258734,2018-10-01T23:05:00.000+02:00,10,1,23,2018,Non-Violent
11548898,12/22/2018 02:00:00 PM,MOTOR VEHICLE THEFT,THEFT/RECOVERY: AUTOMOBILE,false,false,46,41.745778658,-87.562496107,2018-12-22T14:00:00.000+02:00,12,22,14,2018,Non-Violent
11540852,12/18/2018 08:00:00 AM,CRIMINAL DAMAGE,TO VEHICLE,false,false,19,41.938011828,-87.743202405,2018-12-18T08:00:00.000+02:00,12,18,8,2018,Non-Violent
11437568,09/05/2018 08:15:00 PM,BATTERY,DOMESTIC BATTERY SIMPLE,false,true,29,41.865213688,-87.727590376,2018-09-05T20:15:00.000+02:00,9,5,20,2018,Violent
11519338,11/28/2018 08:30:00 AM,CRIMINAL DAMAGE,TO PROPERTY,false,false,57,41.809015971,-87.728523575,2018-11-28T08:30:00.000+02:00,11,28,8,2018,Non-Violent
11514237,11/20/2018 04:00:00 PM,CRIMINAL DAMAGE,TO VEHICLE,false,false,7,41.912382257,-87.636703178,2018-11-20T16:00:00.000+02:00,11,20,16,2018,Non-Violent
11420568,08/20/2018 12:00:00 PM,DECEPTIVE PRACTICE,FRAUD OR CONFIDENCE GAME,false,false,70,41.738717991,-87.710541057,2018-08-20T12:00:00.000+02:00,8,20,12,2018,Non-Violent
11431633,08/31/2018 05:45:00 AM,ARSON,BY FIRE,false,false,29,41.863648225,-87.726316577,2018-08-31T05:45:00.000+02:00,8,31,5,2018,Non-Violent
11417761,08/17/2018 03:00:00 AM,BATTERY,DOMESTIC BATTERY SIMPLE,false,true,71,41.73209814,-87.664541942,2018-08-17T03:00:00.000+02:00,8,17,3,2018,Violent
11414363,08/14/2018 08:59:00 PM,BATTERY,SIMPLE,false,false,44,41.736345248,-87.623198545,2018-08-14T20:59:00.000+02:00,8,14,20,2018,Violent
11468201,10/06/2018 12:00:00 AM,ROBBERY,AGGRAVATED,false,false,67,41.764929166,-87.662339013,2018-10-06T00:00:00.000+02:00,10,6,0,2018,Violent
11524829,11/30/2018 10:30:00 AM,BATTERY,SIMPLE,false,false,44,41.737602539,-87.604850259,2018-11-30T10:30:00.000+02:00,11,30,10,2018,Violent
11489313,10/27/2018 12:50:00 PM,BATTERY,DOMESTIC BATTERY SIMPLE,false,true,26,41.877882471,-87.733591923,2018-10-27T12:50:00.000+02:00,10,27,12,2018,Violent
11510381,11/17/2018 09:26:00 PM,BATTERY,DOMESTIC BATTERY SIMPLE,true,true,25,41.8823638,-87.755531964,2018-11-17T21:26:00.000+02:00,11,17,21,2018,Violent
11499433,11/06/2018 10:13:00 AM,ASSAULT,SIMPLE,false,true,69,41.75417078,-87.602826823,2018-11-06T10:13:00.000+02:00,11,6,10,2018,Violent
11450133,09/18/2018 12:30:00 PM,CRIMINAL DAMAGE,TO VEHICLE,false,false,28,41.877926025,-87.648633194,2018-09-18T12:30:00.000+02:00,9,18,12,2018,Non-Violent
11434877,09/02/2018 04:00:00 PM,CRIMINAL DAMAGE,TO VEHICLE,false,false,24,41.899693418,-87.668258091,2018-09-02T16:00:00.000+02:00,9,2,16,2018,Non-Violent
11542347,12/20/2018 04:01:00 PM,THEFT,$500 AND UNDER,false,false,7,41.927771163,-87.640214271,2018-12-20T16:01:00.000+02:00,12,20,16,2018,Non-Violent
11524493,11/24/2018 05:10:00 PM,THEFT,OVER $500,false,false,2,41.998395779,-87.686243795,2018-11-24T17:10:00.000+02:00,11,24,17,2018,Non-Violent
11428843,08/27/2018 08:30:00 PM,BATTERY,SIMPLE,false,false,23,41.910066171,-87.71075927,2018-08-27T20:30:00.000+02:00,8,27,20,2018,Violent
11514581,11/22/2018 09:33:00 PM,BATTERY,AGGRAVATED DOMESTIC BATTERY: OTHER DANG WEAPON,true,true,42,41.773960566,-87.609435776,2018-11-22T21:33:00.000+02:00,11,22,21,2018,Violent
11414292,08/14/2018 11:30:00 PM,ROBBERY,STRONGARM - NO WEAPON,false,false,68,41.766044422,-87.644435709,2018-08-14T23:30:00.000+02:00,8,14,23,2018,Violent
11471003,10/08/2018 08:35:00 PM,ROBBERY,AGGRAVATED,false,false,23,41.904937883,-87.736207798,2018-10-08T20:35:00.000+02:00,10,8,20,2018,Violent
11526597,12/05/2018 12:25:00 PM,DECEPTIVE PRACTICE,FINANCIAL IDENTITY THEFT OVER $ 300,false,false,8,41.907153315,-87.639680572,2018-12-05T12:25:00.000+02:00,12,5,12,2018,Non-Violent
11494484,11/01/2018 11:28:00 AM,CRIMINAL TRESPASS,TO LAND,true,true,54,41.657559722,-87.613280429,2018-11-01T11:28:00.000+02:00,11,1,11,2018,Non-Violent
11546587,12/25/2018 10:50:00 PM,BATTERY,SIMPLE,false,true,23,41.889010145,-87.724677269,2018-12-25T22:50:00.000+02:00,12,25,22,2018,Violent
11506132,11/11/2018 02:00:00 PM,CRIMINAL DAMAGE,TO PROPERTY,false,false,32,41.886816564,-87.631677946,2018-11-11T14:00:00.000+02:00,11,11,14,2018,Non-Violent
11491357,10/29/2018 02:52:00 PM,CRIMINAL DAMAGE,TO VEHICLE,false,false,32,41.880323629,-87.635270527,2018-10-29T14:52:00.000+02:00,10,29,14,2018,Non-Violent
11472934,10/04/2018 10:00:00 AM,DECEPTIVE PRACTICE,BOGUS CHECK,false,false,50,41.692493455,-87.598703055,2018-10-04T10:00:00.000+02:00,10,4,10,2018,Non-Violent
11600287,09/01/2018 08:00:00 AM,DECEPTIVE PRACTICE,FINANCIAL IDENTITY THEFT $300 AND UNDER,false,true,45,,,2018-09-01T08:00:00.000+02:00,9,1,8,2018,Non-Violent
11792798,01/17/2018 12:00:00 PM,DECEPTIVE PRACTICE,FINANCIAL IDENTITY THEFT $300 AND UNDER,false,false,6,,,2018-01-17T12:00:00.000+02:00,1,17,12,2018,Non-Violent
11697116,08/13/2018 01:00:00 AM,CRIMINAL SEXUAL ASSAULT,NON-AGGRAVATED,false,false,25,,,2018-08-13T01:00:00.000+02:00,8,13,1,2018,Violent
11727205,12/22/2018 12:00:00 AM,DECEPTIVE PRACTICE,FINANCIAL IDENTITY THEFT OVER $ 300,false,false,25,,,2018-12-22T00:00:00.000+02:00,12,22,0,2018,Non-Violent
11606752,12/28/2018 12:15:00 PM,THEFT,OVER $500,false,false,46,,,2018-12-28T12:15:00.000+02:00,12,28,12,2018,Non-Violent
11600938,12/05/2018 12:00:00 PM,OTHER OFFENSE,TELEPHONE THREAT,false,true,61,,,2018-12-05T12:00:00.000+02:00,12,5,12,2018,Non-Violent
11616008,08/15/2018 04:00:00 PM,OTHER OFFENSE,OTHER CRIME INVOLVING PROPERTY,false,true,69,,,2018-08-15T16:00:00.000+02:00,8,15,16,2018,Non-Violent
11759172,01/01/2018 12:00:00 AM,SEX OFFENSE,CRIMINAL SEXUAL ABUSE,true,true,22,,,2018-01-01T00:00:00.000+02:00,1,1,0,2018,Non-Violent
11646166,09/01/2018 12:01:00 AM,THEFT,OVER $500,false,true,44,,,2018-09-01T00:01:00.000+02:00,9,1,0,2018,Non-Violent
11617908,11/01/2018 12:00:00 PM,OTHER OFFENSE,TELEPHONE THREAT,false,false,41,,,2018-11-01T12:00:00.000+02:00,11,1,12,2018,Non-Violent
11617822,12/24/2018 01:00:00 PM,DECEPTIVE PRACTICE,CREDIT CARD FRAUD,false,false,67,,,2018-12-24T13:00:00.000+02:00,12,24,13,2018,Non-Violent
11698251,05/17/2018 08:00:00 PM,OFFENSE INVOLVING CHILDREN,AGG CRIM SEX ABUSE FAM MEMBER,true,true,2,,,2018-05-17T20:00:00.000+02:00,5,17,20,2018,Non-Violent
11612472,03/01/2018 10:00:00 AM,DECEPTIVE PRACTICE,FINANCIAL IDENTITY THEFT OVER $ 300,false,false,25,,,2018-03-01T10:00:00.000+02:00,3,1,10,2018,Non-Violent
11657339,10/09/2018 12:00:00 PM,DECEPTIVE PRACTICE,FINANCIAL IDENTITY THEFT OVER $ 300,false,false,42,,,2018-10-09T12:00:00.000+02:00,10,9,12,2018,Non-Violent
11614052,12/21/2018 09:00:00 AM,THEFT,FROM BUILDING,false,false,75,,,2018-12-21T09:00:00.000+02:00,12,21,9,2018,Non-Violent
11609217,11/15/2018 01:00:00 PM,DECEPTIVE PRACTICE,FINANCIAL IDENTITY THEFT OVER $ 300,false,false,24,,,2018-11-15T13:00:00.000+02:00,11,15,13,2018,Non-Violent
11682265,12/02/2018 10:30:00 PM,OTHER OFFENSE,OTHER CRIME INVOLVING PROPERTY,false,false,43,,,2018-12-02T22:30:00.000+02:00,12,2,22,2018,Non-Violent
11977648,04/11/2018 07:00:00 AM,OFFENSE INVOLVING CHILDREN,AGGRAVATED SEXUAL ASSAULT OF CHILD BY FAMILY MEMBER,false,true,23,,,2018-04-11T07:00:00.000+02:00,4,11,7,2018,Non-Violent
11819206,11/15/2018 12:01:00 AM,OTHER OFFENSE,HARASSMENT BY TELEPHONE,false,false,22,,,2018-11-15T00:01:00.000+02:00,11,15,0,2018,Non-Violent
11853122,10/05/2018 09:00:00 AM,DECEPTIVE PRACTICE,FINANCIAL IDENTITY THEFT OVER $ 300,false,false,71,,,2018-10-05T09:00:00.000+02:00,10,5,9,2018,Non-Violent
11820014,02/10/2018 10:00:00 AM,DECEPTIVE PRACTICE,ILLEGAL USE CASH CARD,false,false,15,,,2018-02-10T10:00:00.000+02:00,2,10,10,2018,Non-Violent
11807608,05/01/2018 12:00:00 AM,OFFENSE INVOLVING CHILDREN,AGG CRIM SEX ABUSE FAM MEMBER,true,false,2,,,2018-05-01T00:00:00.000+02:00,5,1,0,2018,Non-Violent
12006296,02/25/2017 09:15:00 AM,DECEPTIVE PRACTICE,FINANCIAL IDENTITY THEFT OVER $ 300,false,false,26,,,2017-02-25T09:15:00.000+02:00,2,25,9,2017,Non-Violent
10818765,01/12/2017 06:00:00 PM,CRIMINAL DAMAGE,TO VEHICLE,false,false,6,41.945267051,-87.662645833,2017-01-12T18:00:00.000+02:00,1,12,18,2017,Non-Violent
10825862,01/18/2017 02:25:00 PM,ASSAULT,SIMPLE,false,true,49,41.708309241,-87.608246403,2017-01-18T14:25:00.000+02:00,1,18,14,2017,Violent
10817357,01/16/2017 04:51:00 AM,ROBBERY,STRONGARM - NO WEAPON,false,false,7,41.913003475,-87.652428381,2017-01-16T04:51:00.000+02:00,1,16,4,2017,Violent
10820380,01/18/2017 12:01:00 PM,OTHER OFFENSE,ANIMAL ABUSE/NEGLECT,false,false,29,41.865417011,-87.717830262,2017-01-18T12:01:00.000+02:00,1,18,12,2017,Non-Violent
10828362,01/24/2017 07:50:00 PM,DECEPTIVE PRACTICE,CREDIT CARD FRAUD,true,false,27,41.884389103,-87.706866213,2017-01-24T19:50:00.000+02:00,1,24,19,2017,Non-Violent
10818987,01/17/2017 02:41:00 PM,CRIMINAL TRESPASS,TO VEHICLE,true,false,29,41.866213478,-87.722059303,2017-01-17T14:41:00.000+02:00,1,17,14,2017,Non-Violent
10819117,01/17/2017 05:30:00 PM,MOTOR VEHICLE THEFT,AUTOMOBILE,false,false,16,41.947559177,-87.727436369,2017-01-17T17:30:00.000+02:00,1,17,17,2017,Non-Violent
10818177,01/16/2017 09:45:00 PM,ASSAULT,SIMPLE,false,false,71,41.750185415,-87.644029945,2017-01-16T21:45:00.000+02:00,1,16,21,2017,Violent
10826673,01/24/2017 08:00:00 AM,BATTERY,AGGRAVATED DOMESTIC BATTERY: OTHER DANG WEAPON,true,true,29,41.858479031,-87.709094082,2017-01-24T08:00:00.000+02:00,1,24,8,2017,Violent
10802163,01/01/2017 08:03:00 AM,BATTERY,DOMESTIC BATTERY SIMPLE,true,true,29,41.860155012,-87.714022555,2017-01-01T08:03:00.000+02:00,1,1,8,2017,Violent
10809464,01/08/2017 10:55:00 PM,ASSAULT,AGGRAVATED:KNIFE/CUTTING INSTR,false,false,43,41.751875725,-87.555460115,2017-01-08T22:55:00.000+02:00,1,8,22,2017,Violent
10819188,01/17/2017 07:25:00 PM,THEFT,$500 AND UNDER,false,true,53,41.68398914,-87.613944992,2017-01-17T19:25:00.000+02:00,1,17,19,2017,Non-Violent
10806109,01/05/2017 12:07:00 PM,THEFT,OVER $500,false,true,29,41.860131466,-87.728658868,2017-01-05T12:07:00.000+02:00,1,5,12,2017,Non-Violent
10814335,01/12/2017 07:57:00 PM,NARCOTICS,POSS: CANNABIS MORE THAN 30GMS,true,false,23,41.895512894,-87.71065087,2017-01-12T19:57:00.000+02:00,1,12,19,2017,Non-Violent
10829424,01/19/2017 04:04:10 PM,NARCOTICS,POSS: CRACK,true,false,73,41.713821782,-87.63695788,2017-01-19T16:04:10.000+02:00,1,19,16,2017,Non-Violent
10819134,01/17/2017 01:00:00 PM,CRIMINAL DAMAGE,TO PROPERTY,false,false,30,41.837551828,-87.732875071,2017-01-17T13:00:00.000+02:00,1,17,13,2017,Non-Violent
10827242,01/12/2017 12:01:00 AM,DECEPTIVE PRACTICE,COUNTERFEIT CHECK,false,false,77,41.976947277,-87.662365011,2017-01-12T00:01:00.000+02:00,1,12,0,2017,Non-Violent
10810401,01/09/2017 03:30:00 PM,MOTOR VEHICLE THEFT,AUTOMOBILE,false,false,2,41.986351921,-87.700593026,2017-01-09T15:30:00.000+02:00,1,9,15,2017,Non-Violent
10809229,01/05/2017 12:00:00 PM,THEFT,$500 AND UNDER,false,false,43,41.757865688,-87.556553285,2017-01-05T12:00:00.000+02:00,1,5,12,2017,Non-Violent
10817495,01/16/2017 06:30:00 AM,MOTOR VEHICLE THEFT,AUTOMOBILE,false,false,18,41.933255695,-87.7979949,2017-01-16T06:30:00.000+02:00,1,16,6,2017,Non-Violent
10830701,01/27/2017 01:46:00 PM,NARCOTICS,POSS: CANNABIS MORE THAN 30GMS,true,false,71,41.734863513,-87.669118657,2017-01-27T13:46:00.000+02:00,1,27,13,2017,Non-Violent
10827613,01/25/2017 07:05:00 AM,MOTOR VEHICLE THEFT,AUTOMOBILE,false,false,57,41.807041639,-87.730907954,2017-01-25T07:05:00.000+02:00,1,25,7,2017,Non-Violent
10810435,01/09/2017 06:40:00 PM,NARCOTICS,SOLICIT NARCOTICS ON PUBLICWAY,true,false,25,41.880103494,-87.753543689,2017-01-09T18:40:00.000+02:00,1,9,18,2017,Non-Violent
10828658,01/25/2017 05:28:00 PM,OTHER OFFENSE,HARASSMENT BY ELECTRONIC MEANS,false,false,21,41.935135864,-87.721184762,2017-01-25T17:28:00.000+02:00,1,25,17,2017,Non-Violent
10816707,01/15/2017 08:06:00 AM,BATTERY,DOMESTIC BATTERY SIMPLE,true,true,71,41.749541505,-87.664632101,2017-01-15T08:06:00.000+02:00,1,15,8,2017,Violent
10809984,01/09/2017 09:15:00 AM,ASSAULT,SIMPLE,false,false,29,41.868043424,-87.720940449,2017-01-09T09:15:00.000+02:00,1,9,9,2017,Violent
10801856,01/01/2017 07:41:00 PM,ASSAULT,SIMPLE,false,false,48,41.727245641,-87.555061266,2017-01-01T19:41:00.000+02:00,1,1,19,2017,Violent
10825195,01/22/2017 01:30:00 PM,CRIMINAL DAMAGE,TO VEHICLE,false,false,59,41.835834607,-87.675869803,2017-01-22T13:30:00.000+02:00,1,22,13,2017,Non-Violent
10828824,01/25/2017 06:00:00 PM,THEFT,$500 AND UNDER,false,false,24,41.907321311,-87.667598487,2017-01-25T18:00:00.000+02:00,1,25,18,2017,Non-Violent
10818520,01/17/2017 11:00:00 AM,ASSAULT,SIMPLE,false,false,71,41.750490827,-87.654302474,2017-01-17T11:00:00.000+02:00,1,17,11,2017,Violent
10824686,01/22/2017 09:00:00 PM,CRIM SEXUAL ASSAULT,NON-AGGRAVATED,false,false,22,41.928982231,-87.722011652,2017-01-22T21:00:00.000+02:00,1,22,21,2017,Non-Violent
10811578,01/08/2017 09:00:00 AM,THEFT,OVER $500,false,false,25,41.909498816,-87.756066167,2017-01-08T09:00:00.000+02:00,1,8,9,2017,Non-Violent
10830501,01/27/2017 11:00:00 AM,THEFT,POCKET-PICKING,false,false,16,41.960778173,-87.742731337,2017-01-27T11:00:00.000+02:00,1,27,11,2017,Non-Violent
10822974,01/21/2017 12:48:00 AM,OTHER OFFENSE,HARASSMENT BY TELEPHONE,false,false,42,41.774349376,-87.592934199,2017-01-21T00:48:00.000+02:00,1,21,0,2017,Non-Violent
10806390,01/05/2017 05:00:00 PM,NARCOTICS,POSS: HEROIN(WHITE),true,false,25,41.875043672,-87.743418516,2017-01-05T17:00:00.000+02:00,1,5,17,2017,Non-Violent
10807980,01/07/2017 01:10:00 AM,BATTERY,DOMESTIC BATTERY SIMPLE,false,true,52,41.711196115,-87.538905723,2017-01-07T01:10:00.000+02:00,1,7,1,2017,Violent
10827544,01/24/2017 10:00:00 PM,BATTERY,DOMESTIC BATTERY SIMPLE,false,true,44,41.745019172,-87.603791701,2017-01-24T22:00:00.000+02:00,1,24,22,2017,Violent
10825379,01/23/2017 10:00:00 AM,DECEPTIVE PRACTICE,COUNTERFEITING DOCUMENT,false,false,8,41.895993005,-87.635683921,2017-01-23T10:00:00.000+02:00,1,23,10,2017,Non-Violent
10816318,01/13/2017 10:05:00 AM,CRIMINAL DAMAGE,TO PROPERTY,false,false,7,41.917372901,-87.642424784,2017-01-13T10:05:00.000+02:00,1,13,10,2017,Non-Violent
10819332,01/17/2017 07:00:00 PM,THEFT,OVER $500,false,false,28,41.884291199,-87.661392684,2017-01-17T19:00:00.000+02:00,1,17,19,2017,Non-Violent
10826892,01/24/2017 01:18:00 PM,THEFT,RETAIL THEFT,true,false,32,41.879876814,-87.627718261,2017-01-24T13:18:00.000+02:00,1,24,13,2017,Non-Violent
10818642,01/16/2017 08:00:00 PM,THEFT,$500 AND UNDER,false,false,18,41.930788854,-87.803366337,2017-01-16T20:00:00.000+02:00,1,16,20,2017,Non-Violent
10821542,01/19/2017 02:27:00 PM,BATTERY,SIMPLE,false,false,25,41.87851302,-87.766424778,2017-01-19T14:27:00.000+02:00,1,19,14,2017,Violent
10810161,01/05/2017 05:30:00 PM,THEFT,$500 AND UNDER,false,false,49,41.693782648,-87.619503826,2017-01-05T17:30:00.000+02:00,1,5,17,2017,Non-Violent
10822991,01/20/2017 01:30:00 AM,THEFT,OVER $500,false,false,27,41.872742303,-87.709348185,2017-01-20T01:30:00.000+02:00,1,20,1,2017,Non-Violent
10815289,01/09/2017 11:00:00 AM,BATTERY,AGGRAVATED DOMESTIC BATTERY: HANDS/FIST/FEET SERIOUS INJURY,false,true,44,41.748648932,-87.613648646,2017-01-09T11:00:00.000+02:00,1,9,11,2017,Violent
10823806,01/21/2017 09:09:00 PM,NARCOTICS,MANU/DEL:CANNABIS OVER 10 GMS,true,false,68,41.773040679,-87.644610137,2017-01-21T21:09:00.000+02:00,1,21,21,2017,Non-Violent
10829793,01/26/2017 06:30:00 PM,THEFT,OVER $500,false,false,24,41.888985987,-87.652900181,2017-01-26T18:30:00.000+02:00,1,26,18,2017,Non-Violent
10830321,01/26/2017 11:00:00 PM,MOTOR VEHICLE THEFT,AUTOMOBILE,false,false,23,41.890731781,-87.722281013,2017-01-26T23:00:00.000+02:00,1,26,23,2017,Non-Violent
10801151,01/01/2017 01:37:00 AM,CRIMINAL DAMAGE,TO PROPERTY,false,false,67,41.78006188,-87.65451122,2017-01-01T01:37:00.000+02:00,1,1,1,2017,Non-Violent
10814430,01/13/2017 12:00:00 AM,ROBBERY,STRONGARM - NO WEAPON,false,false,6,41.961532262,-87.673586464,2017-01-13T00:00:00.000+02:00,1,13,0,2017,Violent
10824235,01/22/2017 01:05:00 PM,THEFT,RETAIL THEFT,true,false,26,41.874947338,-87.72547164,2017-01-22T13:05:00.000+02:00,1,22,13,2017,Non-Violent
10819660,01/18/2017 07:03:00 AM,MOTOR VEHICLE THEFT,AUTOMOBILE,false,false,28,41.876283783,-87.68873288,2017-01-18T07:03:00.000+02:00,1,18,7,2017,Non-Violent
10803796,01/03/2017 03:38:00 PM,WEAPONS VIOLATION,UNLAWFUL POSS OF HANDGUN,true,false,23,41.911701961,-87.726695472,2017-01-03T15:38:00.000+02:00,1,3,15,2017,Non-Violent
10826454,01/23/2017 01:00:00 PM,THEFT,OVER $500,false,false,32,41.87766908,-87.629284766,2017-01-23T13:00:00.000+02:00,1,23,13,2017,Non-Violent
10821563,01/19/2017 06:20:00 PM,BATTERY,AGGRAVATED: HANDGUN,false,false,68,41.772074694,-87.637325291,2017-01-19T18:20:00.000+02:00,1,19,18,2017,Violent
10803444,01/01/2017 04:00:00 PM,BATTERY,SIMPLE,false,false,11,41.968998985,-87.778313208,2017-01-01T16:00:00.000+02:00,1,1,16,2017,Violent
10802873,01/02/2017 09:00:00 PM,CRIMINAL DAMAGE,TO PROPERTY,false,false,42,41.784878602,-87.614442612,2017-01-02T21:00:00.000+02:00,1,2,21,2017,Non-Violent
10828081,01/25/2017 12:00:00 AM,CRIMINAL DAMAGE,TO VEHICLE,false,false,31,41.853078099,-87.677055013,2017-01-25T00:00:00.000+02:00,1,25,0,2017,Non-Violent
10818638,01/17/2017 07:30:00 AM,THEFT,$500 AND UNDER,false,false,28,41.881451149,-87.659560651,2017-01-17T07:30:00.000+02:00,1,17,7,2017,Non-Violent
10827838,01/14/2017 05:56:00 PM,NARCOTICS,MANU/DELIVER:CRACK,true,false,66,41.78023736,-87.684889053,2017-01-14T17:56:00.000+02:00,1,14,17,2017,Non-Violent
10816786,01/15/2017 12:30:00 AM,THEFT,FROM BUILDING,false,false,24,41.892330847,-87.657951496,2017-01-15T00:30:00.000+02:00,1,15,0,2017,Non-Violent
10810256,01/08/2017 10:25:00 PM,THEFT,FROM BUILDING,false,false,66,41.760327809,-87.702697421,2017-01-08T22:25:00.000+02:00,1,8,22,2017,Non-Violent
10816890,01/15/2017 03:15:00 PM,THEFT,RETAIL THEFT,false,false,65,41.773811253,-87.722636843,2017-01-15T15:15:00.000+02:00,1,15,15,2017,Non-Violent
10814463,01/05/2017 09:00:00 AM,OTHER OFFENSE,OTHER VEHICLE OFFENSE,false,true,25,41.910248927,-87.773998699,2017-01-05T09:00:00.000+02:00,1,5,9,2017,Non-Violent
10821820,01/19/2017 09:30:00 PM,BURGLARY,UNLAWFUL ENTRY,false,false,16,41.965090571,-87.737131927,2017-01-19T21:30:00.000+02:00,1,19,21,2017,Non-Violent
10817202,01/15/2017 10:30:00 PM,NARCOTICS,POSSESSION OF DRUG EQUIPMENT,true,false,8,41.896485284,-87.642212878,2017-01-15T22:30:00.000+02:00,1,15,22,2017,Non-Violent
10820813,01/18/2017 12:00:00 PM,CRIMINAL DAMAGE,TO PROPERTY,false,false,25,41.880539973,-87.741733871,2017-01-18T12:00:00.000+02:00,1,18,12,2017,Non-Violent
10823515,01/21/2017 03:48:00 PM,BATTERY,DOMESTIC BATTERY SIMPLE,false,true,29,41.858475257,-87.713972687,2017-01-21T15:48:00.000+02:00,1,21,15,2017,Violent
10828551,01/25/2017 08:42:00 PM,MOTOR VEHICLE THEFT,THEFT/RECOVERY: AUTOMOBILE,false,false,8,41.89911375,-87.643040387,2017-01-25T20:42:00.000+02:00,1,25,20,2017,Non-Violent
10822473,01/20/2017 06:45:00 AM,THEFT,OVER $500,false,false,32,41.873907817,-87.632604904,2017-01-20T06:45:00.000+02:00,1,20,6,2017,Non-Violent
10830306,01/27/2017 02:00:00 AM,BURGLARY,FORCIBLE ENTRY,false,false,23,41.901467431,-87.72749396,2017-01-27T02:00:00.000+02:00,1,27,2,2017,Non-Violent
10820372,01/18/2017 12:30:00 PM,THEFT,$500 AND UNDER,false,false,71,41.756937258,-87.647842662,2017-01-18T12:30:00.000+02:00,1,18,12,2017,Non-Violent
10827226,01/24/2017 05:59:00 PM,WEAPONS VIOLATION,UNLAWFUL POSS OF HANDGUN,true,false,75,41.693107563,-87.655774107,2017-01-24T17:59:00.000+02:00,1,24,17,2017,Non-Violent
10813136,01/11/2017 04:45:00 PM,CRIMINAL DAMAGE,TO PROPERTY,false,true,69,41.762304056,-87.598823639,2017-01-11T16:45:00.000+02:00,1,11,16,2017,Non-Violent
10813797,01/12/2017 06:35:00 AM,BATTERY,DOMESTIC BATTERY SIMPLE,false,true,68,41.776958985,-87.649572577,2017-01-12T06:35:00.000+02:00,1,12,6,2017,Violent
10825400,01/23/2017 12:25:00 PM,OTHER OFFENSE,FALSE/STOLEN/ALTERED TRP,true,false,25,41.880259491,-87.763879259,2017-01-23T12:25:00.000+02:00,1,23,12,2017,Non-Violent
10814794,01/13/2017 07:30:00 AM,MOTOR VEHICLE THEFT,AUTOMOBILE,false,false,70,41.741062582,-87.737633202,2017-01-13T07:30:00.000+02:00,1,13,7,2017,Non-Violent
10825998,01/23/2017 09:35:00 PM,ASSAULT,SIMPLE,false,false,25,41.873855191,-87.762379293,2017-01-23T21:35:00.000+02:00,1,23,21,2017,Violent
10815173,01/13/2017 11:21:00 AM,OTHER OFFENSE,LICENSE VIOLATION,false,false,23,41.90174914,-87.726275422,2017-01-13T11:21:00.000+02:00,1,13,11,2017,Non-Violent
10802558,01/01/2017 07:00:00 PM,THEFT,$500 AND UNDER,false,false,28,41.882932941,-87.660011459,2017-01-01T19:00:00.000+02:00,1,1,19,2017,Non-Violent
10814283,01/12/2017 04:15:00 PM,ROBBERY,ARMED:KNIFE/CUTTING INSTRUMENT,false,false,64,41.77801887,-87.763343812,2017-01-12T16:15:00.000+02:00,1,12,16,2017,Violent
10813511,01/12/2017 12:00:00 AM,DECEPTIVE PRACTICE,ILLEGAL USE CASH CARD,false,false,61,41.8114492,-87.662613039,2017-01-12T00:00:00.000+02:00,1,12,0,2017,Non-Violent
10828475,01/22/2017 02:00:00 PM,CRIM SEXUAL ASSAULT,PREDATORY,true,true,66,41.781365201,-87.705629817,2017-01-22T14:00:00.000+02:00,1,22,14,2017,Non-Violent
10824396,01/22/2017 04:16:00 PM,THEFT,RETAIL THEFT,true,false,15,41.95347181,-87.743552438,2017-01-22T16:16:00.000+02:00,1,22,16,2017,Non-Violent
10823268,01/21/2017 08:00:00 AM,BATTERY,DOMESTIC BATTERY SIMPLE,false,true,40,41.801137262,-87.622626646,2017-01-21T08:00:00.000+02:00,1,21,8,2017,Violent
10828718,01/25/2017 11:15:00 PM,ROBBERY,ARMED: HANDGUN,false,false,70,41.748680741,-87.715791417,2017-01-25T23:15:00.000+02:00,1,25,23,2017,Violent
10825033,01/23/2017 09:00:00 AM,MOTOR VEHICLE THEFT,AUTOMOBILE,false,false,21,41.933302275,-87.685590152,2017-01-23T09:00:00.000+02:00,1,23,9,2017,Non-Violent
10825963,01/23/2017 01:15:00 PM,BURGLARY,FORCIBLE ENTRY,false,false,44,41.737474838,-87.610703027,2017-01-23T13:15:00.000+02:00,1,23,13,2017,Non-Violent
10826954,01/24/2017 12:49:00 PM,THEFT,RETAIL THEFT,true,false,68,41.789783425,-87.645039661,2017-01-24T12:49:00.000+02:00,1,24,12,2017,Non-Violent
10819115,01/17/2017 03:30:00 PM,THEFT,RETAIL THEFT,false,false,60,41.83805499,-87.645458414,2017-01-17T15:30:00.000+02:00,1,17,15,2017,Non-Violent
10826376,01/13/2017 11:30:00 AM,THEFT,$500 AND UNDER,false,false,26,41.876951683,-87.736659332,2017-01-13T11:30:00.000+02:00,1,13,11,2017,Non-Violent
10815529,01/13/2017 05:45:00 AM,BURGLARY,FORCIBLE ENTRY,false,false,17,41.942141972,-87.815449791,2017-01-13T05:45:00.000+02:00,1,13,5,2017,Non-Violent
10821287,01/16/2017 03:52:00 PM,DECEPTIVE PRACTICE,FINANCIAL IDENTITY THEFT OVER $ 300,false,false,75,41.691878614,-87.674745549,2017-01-16T15:52:00.000+02:00,1,16,15,2017,Non-Violent
10824733,01/22/2017 12:50:00 AM,CRIMINAL DAMAGE,TO VEHICLE,false,false,51,41.673312323,-87.559250831,2017-01-22T00:50:00.000+02:00,1,22,0,2017,Non-Violent
10825629,01/23/2017 02:25:00 PM,CRIMINAL DAMAGE,TO PROPERTY,false,true,58,41.82973678,-87.692366603,2017-01-23T14:25:00.000+02:00,1,23,14,2017,Non-Violent
10823997,01/21/2017 11:28:00 PM,WEAPONS VIOLATION,UNLAWFUL POSS OF HANDGUN,true,false,69,41.772333988,-87.626753601,2017-01-21T23:28:00.000+02:00,1,21,23,2017,Non-Violent
10822965,01/21/2017 01:00:00 AM,ASSAULT,SIMPLE,false,true,26,41.883322519,-87.72906087,2017-01-21T01:00:00.000+02:00,1,21,1,2017,Violent
10823592,01/21/2017 06:09:00 PM,INTERFERENCE WITH PUBLIC OFFICER,RESIST/OBSTRUCT/DISARM OFFICER,true,false,68,41.779295906,-87.644774188,2017-01-21T18:09:00.000+02:00,1,21,18,2017,Non-Violent
10805515,01/04/2017 08:35:00 PM,PROSTITUTION,SOLICIT ON PUBLIC WAY,true,false,67,41.787323718,-87.664411954,2017-01-04T20:35:00.000+02:00,1,4,20,2017,Non-Violent
10815801,01/13/2017 04:00:00 PM,THEFT,OVER $500,false,false,42,41.785049304,-87.586566792,2017-01-13T16:00:00.000+02:00,1,13,16,2017,Non-Violent
10828239,01/25/2017 01:46:00 PM,BATTERY,DOMESTIC BATTERY SIMPLE,true,true,26,41.880717301,-87.72628358,2017-01-25T13:46:00.000+02:00,1,25,13,2017,Violent
10811835,01/10/2017 09:10:00 PM,BATTERY,AGGRAVATED: HANDGUN,false,false,29,41.860115962,-87.733552393,2017-01-10T21:10:00.000+02:00,1,10,21,2017,Violent
10825206,01/22/2017 02:30:00 PM,MOTOR VEHICLE THEFT,ATT: AUTOMOBILE,false,false,71,41.735836707,-87.659981954,2017-01-22T14:30:00.000+02:00,1,22,14,2017,Non-Violent
10827768,01/25/2017 07:00:00 AM,ASSAULT,SIMPLE,true,false,71,41.74634568,-87.653627921,2017-01-25T07:00:00.000+02:00,1,25,7,2017,Violent
10822464,01/20/2017 07:00:00 AM,CRIMINAL DAMAGE,TO VEHICLE,false,false,19,41.93872052,-87.755203594,2017-01-20T07:00:00.000+02:00,1,20,7,2017,Non-Violent
10816064,01/13/2017 10:00:00 PM,BATTERY,DOMESTIC BATTERY SIMPLE,false,true,63,41.802137724,-87.703806024,2017-01-13T22:00:00.000+02:00,1,13,22,2017,Violent
10817380,01/15/2017 09:00:00 PM,CRIMINAL DAMAGE,TO VEHICLE,false,false,38,41.820155264,-87.622654854,2017-01-15T21:00:00.000+02:00,1,15,21,2017,Non-Violent
10809533,01/09/2017 03:50:00 AM,CRIMINAL DAMAGE,TO PROPERTY,false,false,22,41.932089769,-87.698443126,2017-01-09T03:50:00.000+02:00,1,9,3,2017,Non-Violent
10804217,01/03/2017 08:00:00 PM,THEFT,OVER $500,false,false,28,41.884308411,-87.660114532,2017-01-03T20:00:00.000+02:00,1,3,20,2017,Non-Violent
10828529,01/04/2017 10:00:00 AM,OTHER OFFENSE,HARASSMENT BY ELECTRONIC MEANS,false,false,45,41.748705911,-87.589417766,2017-01-04T10:00:00.000+02:00,1,4,10,2017,Non-Violent
10814494,01/09/2017 10:13:00 AM,OFFENSE INVOLVING CHILDREN,CHILD ABUSE,true,true,61,41.7953657,-87.664621717,2017-01-09T10:13:00.000+02:00,1,9,10,2017,Non-Violent
10802851,01/02/2017 08:45:00 PM,NARCOTICS,POSS: PCP,true,false,29,41.860741545,-87.721050506,2017-01-02T20:45:00.000+02:00,1,2,20,2017,Non-Violent
10802796,01/02/2017 08:30:00 PM,CRIMINAL DAMAGE,TO PROPERTY,false,true,24,41.897114739,-87.697981589,2017-01-02T20:30:00.000+02:00,1,2,20,2017,Non-Violent
10831075,01/26/2017 06:30:00 PM,ASSAULT,SIMPLE,false,false,17,41.938859279,-87.793280189,2017-01-26T18:30:00.000+02:00,1,26,18,2017,Violent
10819049,01/17/2017 03:56:00 PM,CRIMINAL DAMAGE,TO VEHICLE,false,false,24,41.909707438,-87.6764165,2017-01-17T15:56:00.000+02:00,1,17,15,2017,Non-Violent
10819728,01/18/2017 06:30:00 AM,BATTERY,DOMESTIC BATTERY SIMPLE,true,true,29,41.856918691,-87.733512523,2017-01-18T06:30:00.000+02:00,1,18,6,2017,Violent
10802281,01/01/2017 03:30:00 PM,MOTOR VEHICLE THEFT,AUTOMOBILE,false,false,60,41.828063868,-87.646042368,2017-01-01T15:30:00.000+02:00,1,1,15,2017,Non-Violent
10808294,01/07/2017 03:30:00 AM,DECEPTIVE PRACTICE,CREDIT CARD FRAUD,false,false,8,41.890389116,-87.628021263,2017-01-07T03:30:00.000+02:00,1,7,3,2017,Non-Violent
10815963,01/13/2017 08:00:00 PM,MOTOR VEHICLE THEFT,AUTOMOBILE,false,false,14,41.970809432,-87.721986956,2017-01-13T20:00:00.000+02:00,1,13,20,2017,Non-Violent
10812207,01/09/2017 06:55:00 PM,CRIMINAL DAMAGE,TO VEHICLE,false,false,28,,,2017-01-09T18:55:00.000+02:00,1,9,18,2017,Non-Violent
10810370,01/07/2017 01:05:00 AM,CRIMINAL DAMAGE,TO VEHICLE,false,false,28,41.868532411,-87.662574725,2017-01-07T01:05:00.000+02:00,1,7,1,2017,Non-Violent
10816846,01/15/2017 12:50:00 PM,BATTERY,DOMESTIC BATTERY SIMPLE,false,true,63,41.790189381,-87.685591827,2017-01-15T12:50:00.000+02:00,1,15,12,2017,Violent
10816636,01/15/2017 04:00:00 AM,BATTERY,DOMESTIC BATTERY SIMPLE,false,true,30,41.841681645,-87.714718178,2017-01-15T04:00:00.000+02:00,1,15,4,2017,Violent
10815628,01/13/2017 07:30:00 PM,THEFT,OVER $500,false,false,19,41.923646223,-87.78941054,2017-01-13T19:30:00.000+02:00,1,13,19,2017,Non-Violent
10802606,01/02/2017 04:15:00 PM,ASSAULT,SIMPLE,false,false,56,41.795807807,-87.76177065,2017-01-02T16:15:00.000+02:00,1,2,16,2017,Violent
10810516,01/09/2017 09:44:00 PM,CRIMINAL DAMAGE,TO PROPERTY,false,false,26,41.874282219,-87.731532678,2017-01-09T21:44:00.000+02:00,1,9,21,2017,Non-Violent
10820686,01/18/2017 10:42:00 PM,BATTERY,SIMPLE,false,false,21,41.933285383,-87.712334335,2017-01-18T22:42:00.000+02:00,1,18,22,2017,Violent
10825961,01/23/2017 03:00:00 PM,THEFT,POCKET-PICKING,false,false,8,41.894950514,-87.623644357,2017-01-23T15:00:00.000+02:00,1,23,15,2017,Non-Violent
10820106,01/18/2017 11:40:00 AM,ROBBERY,ARMED: HANDGUN,false,false,39,41.81416528,-87.60179333,2017-01-18T11:40:00.000+02:00,1,18,11,2017,Violent
10806608,01/05/2017 04:53:00 PM,OTHER OFFENSE,TELEPHONE THREAT,false,true,28,41.878108955,-87.688776962,2017-01-05T16:53:00.000+02:00,1,5,16,2017,Non-Violent
10803817,01/03/2017 03:40:00 PM,BATTERY,SIMPLE,true,false,25,41.878474016,-87.771330921,2017-01-03T15:40:00.000+02:00,1,3,15,2017,Violent
10809738,01/06/2017 10:00:00 PM,CRIMINAL DAMAGE,TO VEHICLE,false,false,66,41.781610473,-87.709345224,2017-01-06T22:00:00.000+02:00,1,6,22,2017,Non-Violent
10818307,01/17/2017 06:20:00 AM,ASSAULT,AGG PRO.EMP: HANDGUN,false,false,48,41.736422223,-87.588119633,2017-01-17T06:20:00.000+02:00,1,17,6,2017,Violent
10801646,01/01/2017 01:18:00 PM,INTERFERENCE WITH PUBLIC OFFICER,OBSTRUCTING IDENTIFICATION,true,false,38,41.809430883,-87.613438223,2017-01-01T13:18:00.000+02:00,1,1,13,2017,Non-Violent
10831062,01/27/2017 05:00:00 AM,CRIMINAL DAMAGE,TO PROPERTY,false,false,17,41.940636381,-87.799487937,2017-01-27T05:00:00.000+02:00,1,27,5,2017,Non-Violent
10817439,01/15/2017 10:30:00 PM,THEFT,$500 AND UNDER,false,false,75,41.69189982,-87.642367883,2017-01-15T22:30:00.000+02:00,1,15,22,2017,Non-Violent
10817687,01/16/2017 01:10:00 PM,CRIMINAL DAMAGE,TO VEHICLE,false,false,28,41.868541914,-87.639235361,2017-01-16T13:10:00.000+02:00,1,16,13,2017,Non-Violent
10816744,01/15/2017 03:00:00 AM,BURGLARY,FORCIBLE ENTRY,true,false,19,41.917202946,-87.757370901,2017-01-15T03:00:00.000+02:00,1,15,3,2017,Non-Violent
10821086,01/17/2017 04:00:00 PM,ASSAULT,PRO EMP HANDS NO/MIN INJURY,false,false,67,41.775247024,-87.664101191,2017-01-17T16:00:00.000+02:00,1,17,16,2017,Violent
10825227,01/23/2017 08:19:00 AM,DECEPTIVE PRACTICE,THEFT OF LOST/MISLAID PROP,true,false,16,41.956262838,-87.7340451,2017-01-23T08:19:00.000+02:00,1,23,8,2017,Non-Violent
10830931,01/26/2017 10:45:00 PM,THEFT,OVER $500,false,false,7,41.929669407,-87.646481528,2017-01-26T22:45:00.000+02:00,1,26,22,2017,Non-Violent
10805326,01/04/2017 03:00:00 PM,OTHER OFFENSE,HARASSMENT BY ELECTRONIC MEANS,false,true,9,42.01147296,-87.815745126,2017-01-04T15:00:00.000+02:00,1,4,15,2017,Non-Violent
10803618,01/03/2017 12:00:00 PM,DECEPTIVE PRACTICE,FRAUD OR CONFIDENCE GAME,false,false,6,41.952412439,-87.672967331,2017-01-03T12:00:00.000+02:00,1,3,12,2017,Non-Violent
10803888,01/03/2017 08:25:00 AM,BURGLARY,FORCIBLE ENTRY,false,false,62,41.785818909,-87.73436271,2017-01-03T08:25:00.000+02:00,1,3,8,2017,Non-Violent
10815734,01/14/2017 02:15:00 AM,BATTERY,SIMPLE,false,false,14,41.968491664,-87.703906426,2017-01-14T02:15:00.000+02:00,1,14,2,2017,Violent
10806254,01/05/2017 01:00:00 PM,OTHER OFFENSE,TELEPHONE THREAT,false,false,25,41.910238858,-87.763025071,2017-01-05T13:00:00.000+02:00,1,5,13,2017,Non-Violent
10825990,01/20/2017 08:00:00 PM,BURGLARY,UNLAWFUL ENTRY,false,false,6,41.933384769,-87.659863294,2017-01-20T20:00:00.000+02:00,1,20,20,2017,Non-Violent
10814028,01/08/2017 10:00:00 PM,CRIMINAL DAMAGE,TO VEHICLE,false,false,24,41.897826874,-87.689361092,2017-01-08T22:00:00.000+02:00,1,8,22,2017,Non-Violent
10808921,01/08/2017 03:30:00 AM,CRIMINAL SEXUAL ASSAULT,NON-AGGRAVATED,false,true,25,41.893193244,-87.775080434,2017-01-08T03:30:00.000+02:00,1,8,3,2017,Violent
10829938,01/26/2017 11:31:00 PM,NARCOTICS,POSS: CANNABIS 30GMS OR LESS,true,false,2,41.993124349,-87.677567918,2017-01-26T23:31:00.000+02:00,1,26,23,2017,Non-Violent
10828224,01/25/2017 01:55:00 PM,BURGLARY,UNLAWFUL ENTRY,false,false,43,41.756195017,-87.580975062,2017-01-25T13:55:00.000+02:00,1,25,13,2017,Non-Violent
10808813,01/08/2017 01:30:00 AM,CRIM SEXUAL ASSAULT,NON-AGGRAVATED,false,false,45,41.751270452,-87.585822373,2017-01-08T01:30:00.000+02:00,1,8,1,2017,Non-Violent
10820123,01/17/2017 08:00:00 PM,CRIMINAL DAMAGE,TO VEHICLE,false,false,28,41.884291199,-87.661392684,2017-01-17T20:00:00.000+02:00,1,17,20,2017,Non-Violent
10812109,01/10/2017 08:00:00 PM,CRIMINAL DAMAGE,TO PROPERTY,false,false,17,41.949800452,-87.797371246,2017-01-10T20:00:00.000+02:00,1,10,20,2017,Non-Violent
10823589,01/21/2017 12:00:00 PM,MOTOR VEHICLE THEFT,AUTOMOBILE,false,false,65,41.768710718,-87.718216689,2017-01-21T12:00:00.000+02:00,1,21,12,2017,Non-Violent
10815062,01/13/2017 11:45:00 AM,CRIMINAL DAMAGE,TO PROPERTY,false,false,44,41.746863948,-87.60996379,2017-01-13T11:45:00.000+02:00,1,13,11,2017,Non-Violent
10818890,01/17/2017 03:05:00 PM,ASSAULT,SIMPLE,false,false,22,41.924690764,-87.709856457,2017-01-17T15:05:00.000+02:00,1,17,15,2017,Violent
10823768,01/21/2017 09:23:00 PM,ASSAULT,PRO EMP HANDS NO/MIN INJURY,true,false,25,41.900478961,-87.749642063,2017-01-21T21:23:00.000+02:00,1,21,21,2017,Violent
10814149,01/12/2017 02:38:00 PM,OTHER OFFENSE,LICENSE VIOLATION,false,false,25,41.880138039,-87.771536667,2017-01-12T14:38:00.000+02:00,1,12,14,2017,Non-Violent
10827732,01/25/2017 08:30:00 AM,THEFT,$500 AND UNDER,false,false,67,41.770222086,-87.676921463,2017-01-25T08:30:00.000+02:00,1,25,8,2017,Non-Violent
10824658,01/22/2017 08:30:00 PM,BATTERY,SIMPLE,false,false,15,41.961029065,-87.754818142,2017-01-22T20:30:00.000+02:00,1,22,20,2017,Violent
10808314,01/06/2017 08:00:00 PM,CRIMINAL DAMAGE,TO VEHICLE,false,false,69,41.761181029,-87.628070856,2017-01-06T20:00:00.000+02:00,1,6,20,2017,Non-Violent
10815216,01/13/2017 01:50:00 PM,CRIMINAL DAMAGE,TO PROPERTY,false,false,19,41.917202946,-87.757370901,2017-01-13T13:50:00.000+02:00,1,13,13,2017,Non-Violent
10825542,01/23/2017 12:10:00 PM,BATTERY,SIMPLE,false,false,14,41.970599981,-87.714649091,2017-01-23T12:10:00.000+02:00,1,23,12,2017,Violent
10812123,01/10/2017 08:30:00 PM,BURGLARY,FORCIBLE ENTRY,false,false,30,41.844262683,-87.723710616,2017-01-10T20:30:00.000+02:00,1,10,20,2017,Non-Violent
10811808,01/10/2017 08:22:00 PM,OTHER OFFENSE,VIOLATE ORDER OF PROTECTION,true,true,27,41.873237392,-87.715647681,2017-01-10T20:22:00.000+02:00,1,10,20,2017,Non-Violent
10816514,01/14/2017 06:29:00 PM,NARCOTICS,MANU/DELIVER:CRACK,true,false,67,41.780335166,-87.670292155,2017-01-14T18:29:00.000+02:00,1,14,18,2017,Non-Violent
10818171,01/17/2017 12:35:00 AM,ASSAULT,SIMPLE,false,false,68,41.766178742,-87.648081529,2017-01-17T00:35:00.000+02:00,1,17,0,2017,Violent
10828350,01/25/2017 12:00:00 PM,BURGLARY,FORCIBLE ENTRY,false,false,61,41.809923565,-87.637726373,2017-01-25T12:00:00.000+02:00,1,25,12,2017,Non-Violent
10811727,01/06/2017 06:15:00 PM,THEFT,OVER $500,false,false,59,,,2017-01-06T18:15:00.000+02:00,1,6,18,2017,Non-Violent
10806461,01/05/2017 06:25:00 PM,MOTOR VEHICLE THEFT,AUTOMOBILE,false,false,2,41.997680166,-87.692714775,2017-01-05T18:25:00.000+02:00,1,5,18,2017,Non-Violent
10819250,01/17/2017 07:40:00 PM,CRIMINAL DAMAGE,TO VEHICLE,true,false,46,41.745828256,-87.558853082,2017-01-17T19:40:00.000+02:00,1,17,19,2017,Non-Violent
10823963,01/21/2017 01:05:00 PM,THEFT,FROM BUILDING,false,false,22,41.919939594,-87.698670139,2017-01-21T13:05:00.000+02:00,1,21,13,2017,Non-Violent
10830616,01/27/2017 01:45:00 PM,THEFT,OVER $500,false,false,67,41.779273063,-87.676972155,2017-01-27T13:45:00.000+02:00,1,27,13,2017,Non-Violent
10807717,01/06/2017 07:30:00 AM,BURGLARY,FORCIBLE ENTRY,false,false,21,41.932826416,-87.708667345,2017-01-06T07:30:00.000+02:00,1,6,7,2017,Non-Violent
10825993,01/23/2017 07:23:00 PM,ROBBERY,STRONGARM - NO WEAPON,false,false,27,41.886560206,-87.716062887,2017-01-23T19:23:00.000+02:00,1,23,19,2017,Violent
10827816,01/24/2017 01:30:00 PM,CRIMINAL DAMAGE,TO PROPERTY,false,false,38,41.804028098,-87.60961824,2017-01-24T13:30:00.000+02:00,1,24,13,2017,Non-Violent
10821944,01/19/2017 10:00:00 AM,ROBBERY,STRONGARM - NO WEAPON,false,true,69,41.763189739,-87.596995495,2017-01-19T10:00:00.000+02:00,1,19,10,2017,Violent
10820541,01/18/2017 07:00:00 PM,OTHER OFFENSE,LICENSE VIOLATION,false,false,25,41.894993707,-87.747043813,2017-01-18T19:00:00.000+02:00,1,18,19,2017,Non-Violent
10824103,01/22/2017 09:12:00 AM,THEFT,FROM BUILDING,false,false,32,41.872933222,-87.631642555,2017-01-22T09:12:00.000+02:00,1,22,9,2017,Non-Violent
10806904,01/06/2017 07:50:00 AM,BATTERY,DOMESTIC BATTERY SIMPLE,false,true,66,41.762160302,-87.699080094,2017-01-06T07:50:00.000+02:00,1,6,7,2017,Violent
10830936,01/24/2017 06:35:00 PM,THEFT,$500 AND UNDER,false,false,23,41.90276543,-87.715131741,2017-01-24T18:35:00.000+02:00,1,24,18,2017,Non-Violent
10814065,01/12/2017 03:00:00 PM,THEFT,FROM BUILDING,false,false,3,41.971100531,-87.667747448,2017-01-12T15:00:00.000+02:00,1,12,15,2017,Non-Violent
10815832,01/14/2017 06:31:00 AM,OTHER OFFENSE,VEHICLE TITLE/REG OFFENSE,true,false,46,41.734597261,-87.551367361,2017-01-14T06:31:00.000+02:00,1,14,6,2017,Non-Violent
11007144,07/04/2017 04:04:00 PM,BURGLARY,FORCIBLE ENTRY,false,false,38,41.808453749,-87.619567373,2017-07-04T16:04:00.000+02:00,7,4,16,2017,Non-Violent
10881738,03/18/2017 02:55:00 AM,BATTERY,DOMESTIC BATTERY SIMPLE,false,true,15,41.961134316,-87.772153053,2017-03-18T02:55:00.000+02:00,3,18,2,2017,Violent
10988185,06/19/2017 08:00:00 AM,DECEPTIVE PRACTICE,FINANCIAL IDENTITY THEFT OVER $ 300,false,false,43,41.761346904,-87.560022659,2017-06-19T08:00:00.000+02:00,6,19,8,2017,Non-Violent
11035785,07/29/2017 08:00:00 PM,MOTOR VEHICLE THEFT,AUTOMOBILE,false,false,28,41.878919349,-87.665392715,2017-07-29T20:00:00.000+02:00,7,29,20,2017,Non-Violent
10922851,04/24/2017 10:25:00 AM,BATTERY,SIMPLE,false,false,71,41.750111323,-87.644030737,2017-04-24T10:25:00.000+02:00,4,24,10,2017,Violent
10914938,04/17/2017 04:22:00 PM,THEFT,RETAIL THEFT,true,false,67,41.765997125,-87.66382344,2017-04-17T16:22:00.000+02:00,4,17,16,2017,Non-Violent
10985812,06/18/2017 03:45:00 AM,CRIMINAL DAMAGE,TO PROPERTY,false,true,68,41.786584152,-87.643761187,2017-06-18T03:45:00.000+02:00,6,18,3,2017,Non-Violent
11016684,07/13/2017 06:45:00 PM,NARCOTICS,SOLICIT NARCOTICS ON PUBLICWAY,true,false,25,41.880401861,-87.752850634,2017-07-13T18:45:00.000+02:00,7,13,18,2017,Non-Violent
10940067,03/13/2017 12:00:00 PM,DECEPTIVE PRACTICE,FORGERY,false,false,41,41.799518433,-87.590997844,2017-03-13T12:00:00.000+02:00,3,13,12,2017,Non-Violent
10928819,04/29/2017 04:00:00 AM,BATTERY,DOMESTIC BATTERY SIMPLE,false,true,24,41.909749354,-87.682330873,2017-04-29T04:00:00.000+02:00,4,29,4,2017,Violent
10885331,03/21/2017 01:10:00 PM,NARCOTICS,POSS: CRACK,true,false,29,41.860756953,-87.71931031,2017-03-21T13:10:00.000+02:00,3,21,13,2017,Non-Violent
10954114,05/22/2017 02:11:00 PM,BATTERY,AGGRAVATED: HANDGUN,false,false,40,41.801377893,-87.619389174,2017-05-22T14:11:00.000+02:00,5,22,14,2017,Violent
11016325,07/13/2017 10:30:00 AM,DECEPTIVE PRACTICE,COUNTERFEITING DOCUMENT,false,false,29,41.86625461,-87.718967674,2017-07-13T10:30:00.000+02:00,7,13,10,2017,Non-Violent
10924088,04/24/2017 11:30:00 AM,BATTERY,SIMPLE,false,false,68,41.764584045,-87.63708369,2017-04-24T11:30:00.000+02:00,4,24,11,2017,Violent
10876177,03/12/2017 11:41:00 PM,DECEPTIVE PRACTICE,THEFT OF LABOR/SERVICES,true,false,49,41.722768379,-87.624410361,2017-03-12T23:41:00.000+02:00,3,12,23,2017,Non-Violent
10946092,05/15/2017 06:45:00 AM,BURGLARY,UNLAWFUL ENTRY,false,false,39,41.803520976,-87.581925417,2017-05-15T06:45:00.000+02:00,5,15,6,2017,Non-Violent
10952111,05/20/2017 12:15:00 PM,DECEPTIVE PRACTICE,CREDIT CARD FRAUD,false,false,32,41.883500187,-87.627876698,2017-05-20T12:15:00.000+02:00,5,20,12,2017,Non-Violent
10875125,03/10/2017 11:00:00 PM,CRIMINAL DAMAGE,TO VEHICLE,false,false,15,41.953688545,-87.773130101,2017-03-10T23:00:00.000+02:00,3,10,23,2017,Non-Violent
11032723,07/27/2017 10:45:00 AM,SEX OFFENSE,PUBLIC INDECENCY,true,false,3,41.973983925,-87.65775146,2017-07-27T10:45:00.000+02:00,7,27,10,2017,Non-Violent
10912382,04/14/2017 09:30:00 PM,ASSAULT,SIMPLE,false,false,8,41.893646656,-87.631177143,2017-04-14T21:30:00.000+02:00,4,14,21,2017,Violent
10893535,03/28/2017 11:11:00 PM,BATTERY,DOMESTIC BATTERY SIMPLE,false,true,73,41.72609223,-87.659145906,2017-03-28T23:11:00.000+02:00,3,28,23,2017,Violent
10903924,04/02/2017 02:30:00 PM,CRIMINAL DAMAGE,TO PROPERTY,false,false,66,41.760222177,-87.681799203,2017-04-02T14:30:00.000+02:00,4,2,14,2017,Non-Violent
10902576,04/04/2017 08:00:00 PM,BATTERY,DOMESTIC BATTERY SIMPLE,false,true,76,41.976762981,-87.900983721,2017-04-04T20:00:00.000+02:00,4,4,20,2017,Violent
10944959,05/14/2017 11:08:00 PM,ROBBERY,STRONGARM - NO WEAPON,false,false,25,41.871530533,-87.744926805,2017-05-14T23:08:00.000+02:00,5,14,23,2017,Violent
10895140,03/30/2017 09:50:00 AM,OTHER OFFENSE,TELEPHONE THREAT,false,true,43,41.754476264,-87.563861673,2017-03-30T09:50:00.000+02:00,3,30,9,2017,Non-Violent
10915964,04/18/2017 11:47:00 AM,PUBLIC PEACE VIOLATION,RECKLESS CONDUCT,true,false,27,41.880991005,-87.704725496,2017-04-18T11:47:00.000+02:00,4,18,11,2017,Non-Violent
11000191,06/29/2017 01:17:00 PM,ASSAULT,AGGRAVATED:KNIFE/CUTTING INSTR,true,false,30,41.855524939,-87.6978538,2017-06-29T13:17:00.000+02:00,6,29,13,2017,Violent
10959129,05/26/2017 04:31:00 PM,BATTERY,DOMESTIC BATTERY SIMPLE,false,true,69,41.77337941,-87.622724199,2017-05-26T16:31:00.000+02:00,5,26,16,2017,Violent
10855552,02/20/2017 01:00:00 PM,THEFT,POCKET-PICKING,false,false,32,41.873944069,-87.62598437,2017-02-20T13:00:00.000+02:00,2,20,13,2017,Non-Violent
11002034,06/28/2017 05:35:00 PM,BURGLARY,FORCIBLE ENTRY,false,false,67,41.782370254,-87.669138239,2017-06-28T17:35:00.000+02:00,6,28,17,2017,Non-Violent
11027437,07/22/2017 01:45:00 PM,THEFT,RETAIL THEFT,false,false,32,41.880579428,-87.627732563,2017-07-22T13:45:00.000+02:00,7,22,13,2017,Non-Violent
10854013,02/18/2017 01:00:00 PM,CRIMINAL DAMAGE,TO PROPERTY,false,false,15,41.965580142,-87.761075676,2017-02-18T13:00:00.000+02:00,2,18,13,2017,Non-Violent
10873455,03/09/2017 05:40:00 PM,MOTOR VEHICLE THEFT,AUTOMOBILE,false,false,7,41.928344277,-87.642876011,2017-03-09T17:40:00.000+02:00,3,9,17,2017,Non-Violent
10894645,03/29/2017 03:09:00 AM,BATTERY,SIMPLE,false,false,40,41.785161229,-87.620603115,2017-03-29T03:09:00.000+02:00,3,29,3,2017,Violent
10910686,04/13/2017 11:18:00 AM,NARCOTICS,MANU/DELIVER: HEROIN (WHITE),true,false,23,41.894652045,-87.713851006,2017-04-13T11:18:00.000+02:00,4,13,11,2017,Non-Violent
11015678,07/12/2017 10:12:00 PM,OTHER OFFENSE,HARASSMENT BY ELECTRONIC MEANS,false,false,3,41.962735395,-87.650785049,2017-07-12T22:12:00.000+02:00,7,12,22,2017,Non-Violent
10977318,06/11/2017 06:45:00 PM,NARCOTICS,MANU/DEL:CANNABIS 10GM OR LESS,true,false,25,41.888657588,-87.749264906,2017-06-11T18:45:00.000+02:00,6,11,18,2017,Non-Violent
10845595,02/10/2017 12:30:00 PM,OFFENSE INVOLVING CHILDREN,CHILD PORNOGRAPHY,false,false,19,41.920434991,-87.757786441,2017-02-10T12:30:00.000+02:00,2,10,12,2017,Non-Violent
10936561,05/06/2017 11:00:00 AM,THEFT,FROM BUILDING,false,false,32,41.878113871,-87.634262752,2017-05-06T11:00:00.000+02:00,5,6,11,2017,Non-Violent
10906491,04/09/2017 11:45:00 PM,BATTERY,SIMPLE,false,false,24,41.910417621,-87.681130089,2017-04-09T23:45:00.000+02:00,4,9,23,2017,Violent
10976596,06/10/2017 01:10:00 PM,BATTERY,SIMPLE,false,false,1,42.019463558,-87.682478942,2017-06-10T13:10:00.000+02:00,6,10,13,2017,Violent
10865798,03/02/2017 10:10:00 AM,THEFT,RETAIL THEFT,false,false,49,41.685953051,-87.620827806,2017-03-02T10:10:00.000+02:00,3,2,10,2017,Non-Violent
10969056,06/04/2017 08:41:00 PM,THEFT,$500 AND UNDER,true,false,48,41.725603372,-87.555293556,2017-06-04T20:41:00.000+02:00,6,4,20,2017,Non-Violent
10936779,05/06/2017 07:10:00 PM,BATTERY,PRO EMP HANDS NO/MIN INJURY,true,false,36,41.830821136,-87.607991909,2017-05-06T19:10:00.000+02:00,5,6,19,2017,Violent
10881442,03/13/2017 06:40:00 PM,DECEPTIVE PRACTICE,FINANCIAL IDENTITY THEFT OVER $ 300,false,false,77,41.989431234,-87.669550197,2017-03-13T18:40:00.000+02:00,3,13,18,2017,Non-Violent
10884718,03/20/2017 12:10:00 PM,THEFT,RETAIL THEFT,false,false,77,41.976851852,-87.654999693,2017-03-20T12:10:00.000+02:00,3,20,12,2017,Non-Violent
10941113,05/02/2017 10:00:00 AM,NARCOTICS,FOUND SUSPECT NARCOTICS,true,false,29,41.868180939,-87.709271389,2017-05-02T10:00:00.000+02:00,5,2,10,2017,Non-Violent
10965756,06/01/2017 07:00:00 PM,BATTERY,DOMESTIC BATTERY SIMPLE,true,true,44,41.73443509,-87.604768811,2017-06-01T19:00:00.000+02:00,6,1,19,2017,Violent
11005684,07/04/2017 04:30:00 PM,BATTERY,SIMPLE,false,false,44,41.750538141,-87.634278086,2017-07-04T16:30:00.000+02:00,7,4,16,2017,Violent
10974093,06/06/2017 04:30:00 PM,THEFT,$500 AND UNDER,false,true,67,41.782260413,-87.660636754,2017-06-06T16:30:00.000+02:00,6,6,16,2017,Non-Violent
10993135,06/23/2017 08:28:00 PM,DECEPTIVE PRACTICE,FRAUD OR CONFIDENCE GAME,false,false,72,41.705794796,-87.682880018,2017-06-23T20:28:00.000+02:00,6,23,20,2017,Non-Violent
10987692,06/19/2017 07:05:00 PM,BATTERY,DOMESTIC BATTERY SIMPLE,false,true,42,41.777821642,-87.598177316,2017-06-19T19:05:00.000+02:00,6,19,19,2017,Violent
10853419,02/17/2017 06:00:00 PM,BATTERY,DOMESTIC BATTERY SIMPLE,false,true,30,41.845537889,-87.714820496,2017-02-17T18:00:00.000+02:00,2,17,18,2017,Violent
10907538,04/10/2017 05:30:00 PM,DECEPTIVE PRACTICE,CREDIT CARD FRAUD,false,false,32,41.875367424,-87.627620993,2017-04-10T17:30:00.000+02:00,4,10,17,2017,Non-Violent
10931968,05/02/2017 11:40:00 AM,THEFT,OVER $500,false,false,28,41.884146504,-87.655915096,2017-05-02T11:40:00.000+02:00,5,2,11,2017,Non-Violent
10903349,04/06/2017 05:20:00 AM,ROBBERY,STRONGARM - NO WEAPON,false,false,71,41.739138975,-87.652212655,2017-04-06T05:20:00.000+02:00,4,6,5,2017,Violent
10978948,06/12/2017 08:30:00 AM,THEFT,$500 AND UNDER,false,false,60,41.846820192,-87.647298713,2017-06-12T08:30:00.000+02:00,6,12,8,2017,Non-Violent
10950021,05/17/2017 10:00:00 PM,THEFT,$500 AND UNDER,false,false,30,41.849927116,-87.706930969,2017-05-17T22:00:00.000+02:00,5,17,22,2017,Non-Violent
10843296,02/08/2017 05:46:00 PM,CRIMINAL TRESPASS,TO LAND,false,false,69,41.761524101,-87.595735343,2017-02-08T17:46:00.000+02:00,2,8,17,2017,Non-Violent
10962825,05/28/2017 12:00:00 PM,CRIMINAL TRESPASS,TO RESIDENCE,false,false,49,41.702508616,-87.631370958,2017-05-28T12:00:00.000+02:00,5,28,12,2017,Non-Violent
10926329,04/27/2017 01:40:00 AM,CRIMINAL TRESPASS,TO LAND,true,false,69,41.758214815,-87.624119338,2017-04-27T01:40:00.000+02:00,4,27,1,2017,Non-Violent
10858893,02/23/2017 05:00:00 AM,CRIMINAL DAMAGE,TO VEHICLE,false,false,8,41.904461469,-87.63293948,2017-02-23T05:00:00.000+02:00,2,23,5,2017,Non-Violent
10897285,04/01/2017 04:00:00 AM,CRIMINAL TRESPASS,TO RESIDENCE,false,false,44,41.74845393,-87.631816116,2017-04-01T04:00:00.000+02:00,4,1,4,2017,Non-Violent
11015850,07/07/2017 11:00:00 PM,BURGLARY,FORCIBLE ENTRY,false,false,46,41.750872909,-87.557726016,2017-07-07T23:00:00.000+02:00,7,7,23,2017,Non-Violent
10922452,04/21/2017 11:00:00 PM,BATTERY,AGGRAVATED DOMESTIC BATTERY: HANDS/FIST/FEET SERIOUS INJURY,false,true,48,41.728748802,-87.576730736,2017-04-21T23:00:00.000+02:00,4,21,23,2017,Violent
10983054,06/09/2017 09:00:00 AM,BURGLARY,UNLAWFUL ENTRY,false,false,7,41.931463882,-87.653819694,2017-06-09T09:00:00.000+02:00,6,9,9,2017,Non-Violent
10996377,06/24/2017 08:00:00 PM,THEFT,FROM BUILDING,false,false,8,41.88817016,-87.629547745,2017-06-24T20:00:00.000+02:00,6,24,20,2017,Non-Violent
10879742,03/15/2017 05:00:00 PM,THEFT,OVER $500,false,false,24,41.902451448,-87.666378091,2017-03-15T17:00:00.000+02:00,3,15,17,2017,Non-Violent
11028613,07/23/2017 08:30:00 PM,BATTERY,SIMPLE,false,false,69,41.773405326,-87.625143469,2017-07-23T20:30:00.000+02:00,7,23,20,2017,Violent
10882193,03/17/2017 12:00:00 PM,DECEPTIVE PRACTICE,FINANCIAL IDENTITY THEFT OVER $ 300,false,false,66,41.764726295,-87.681442069,2017-03-17T12:00:00.000+02:00,3,17,12,2017,Non-Violent
11011565,07/09/2017 05:56:00 PM,BATTERY,AGGRAVATED - HANDGUN,false,false,26,41.876956938,-87.736086464,2017-07-09T17:56:00.000+02:00,7,9,17,2017,Violent
10937395,03/14/2017 03:30:00 PM,DECEPTIVE PRACTICE,FINANCIAL IDENTITY THEFT OVER $ 300,false,false,15,41.955849059,-87.774423671,2017-03-14T15:30:00.000+02:00,3,14,15,2017,Non-Violent
10849835,02/15/2017 01:35:00 AM,BATTERY,SIMPLE,false,false,44,41.746765368,-87.602624951,2017-02-15T01:35:00.000+02:00,2,15,1,2017,Violent
10868404,03/04/2017 11:40:00 PM,ROBBERY,STRONGARM - NO WEAPON,true,false,67,41.768213543,-87.673617146,2017-03-04T23:40:00.000+02:00,3,4,23,2017,Violent
10878157,03/14/2017 10:53:00 PM,CRIMINAL DAMAGE,TO PROPERTY,false,false,31,41.85008373,-87.671726875,2017-03-14T22:53:00.000+02:00,3,14,22,2017,Non-Violent
11011635,07/10/2017 12:12:00 AM,BATTERY,DOMESTIC BATTERY SIMPLE,true,true,32,41.874429485,-87.625042718,2017-07-10T00:12:00.000+02:00,7,10,0,2017,Violent
10957453,05/25/2017 09:00:00 AM,THEFT,PURSE-SNATCHING,false,false,26,41.882945767,-87.73309656,2017-05-25T09:00:00.000+02:00,5,25,9,2017,Non-Violent
11002633,06/30/2017 02:25:00 PM,BATTERY,SIMPLE,true,false,8,41.892605313,-87.619839586,2017-06-30T14:25:00.000+02:00,6,30,14,2017,Violent
11027631,07/22/2017 06:43:00 PM,NARCOTICS,MANU/DEL:CANNABIS OVER 10 GMS,true,false,32,41.876909148,-87.628426538,2017-07-22T18:43:00.000+02:00,7,22,18,2017,Non-Violent
11009112,07/06/2017 05:00:00 PM,BURGLARY,FORCIBLE ENTRY,false,false,66,41.781060939,-87.685427054,2017-07-06T17:00:00.000+02:00,7,6,17,2017,Non-Violent
10980545,04/10/2017 08:00:00 AM,DECEPTIVE PRACTICE,FORGERY,false,false,71,41.753284122,-87.665941922,2017-04-10T08:00:00.000+02:00,4,10,8,2017,Non-Violent
10862668,02/27/2017 02:18:00 PM,ASSAULT,AGG PO HANDS NO/MIN INJURY,true,false,65,41.776597082,-87.722705735,2017-02-27T14:18:00.000+02:00,2,27,14,2017,Violent
10898056,04/02/2017 12:00:00 AM,THEFT,FROM BUILDING,false,false,6,41.946159169,-87.655678044,2017-04-02T00:00:00.000+02:00,4,2,0,2017,Non-Violent
10853298,02/17/2017 07:53:00 PM,WEAPONS VIOLATION,UNLAWFUL POSS OF HANDGUN,true,false,30,41.85264504,-87.711173269,2017-02-17T19:53:00.000+02:00,2,17,19,2017,Non-Violent
10899898,04/03/2017 11:30:00 PM,BATTERY,AGGRAVATED: HANDGUN,false,false,63,41.789366258,-87.685134416,2017-04-03T23:30:00.000+02:00,4,3,23,2017,Violent
11012976,07/10/2017 10:22:00 PM,BATTERY,DOMESTIC BATTERY SIMPLE,true,true,66,41.782308311,-87.686173464,2017-07-10T22:22:00.000+02:00,7,10,22,2017,Violent
10966855,06/02/2017 04:22:00 PM,THEFT,RETAIL THEFT,true,false,32,41.88171846,-87.627760426,2017-06-02T16:22:00.000+02:00,6,2,16,2017,Non-Violent
10957143,05/24/2017 10:36:00 PM,NARCOTICS,POSS: METHAMPHETAMINES,true,false,77,41.996346744,-87.663434125,2017-05-24T22:36:00.000+02:00,5,24,22,2017,Non-Violent
10945550,05/14/2017 11:30:00 AM,BATTERY,SIMPLE,true,false,49,41.70875608,-87.623553531,2017-05-14T11:30:00.000+02:00,5,14,11,2017,Violent
11004849,07/03/2017 07:48:00 PM,THEFT,OVER $500,false,false,38,41.803365964,-87.622682706,2017-07-03T19:48:00.000+02:00,7,3,19,2017,Non-Violent
10945472,05/15/2017 01:00:00 PM,THEFT,$500 AND UNDER,false,false,6,41.946391574,-87.638093796,2017-05-15T13:00:00.000+02:00,5,15,13,2017,Non-Violent
10967834,06/02/2017 11:30:00 PM,MOTOR VEHICLE THEFT,AUTOMOBILE,false,false,38,41.812534475,-87.618241859,2017-06-02T23:30:00.000+02:00,6,2,23,2017,Non-Violent
10906361,04/09/2017 01:15:00 PM,CRIMINAL DAMAGE,TO PROPERTY,false,false,67,41.762519771,-87.674687118,2017-04-09T13:15:00.000+02:00,4,9,13,2017,Non-Violent
10987659,06/19/2017 08:30:00 PM,THEFT,$500 AND UNDER,false,true,54,41.657807539,-87.603404531,2017-06-19T20:30:00.000+02:00,6,19,20,2017,Non-Violent
10832666,01/29/2017 09:25:00 PM,BATTERY,SIMPLE,false,false,13,41.974461975,-87.728203795,2017-01-29T21:25:00.000+02:00,1,29,21,2017,Violent
10868016,03/04/2017 01:00:00 PM,NARCOTICS,POSS: HEROIN(WHITE),true,false,29,41.860412908,-87.707933603,2017-03-04T13:00:00.000+02:00,3,4,13,2017,Non-Violent
10991896,06/22/2017 10:51:00 PM,ASSAULT,AGGRAVATED:KNIFE/CUTTING INSTR,true,false,67,41.780361586,-87.673928946,2017-06-22T22:51:00.000+02:00,6,22,22,2017,Violent
10968333,06/04/2017 03:22:00 AM,ASSAULT,AGG PO HANDS NO/MIN INJURY,true,false,28,41.884152322,-87.672932576,2017-06-04T03:22:00.000+02:00,6,4,3,2017,Violent
10921418,04/22/2017 12:00:00 PM,THEFT,FROM BUILDING,false,true,77,41.989966253,-87.666219366,2017-04-22T12:00:00.000+02:00,4,22,12,2017,Non-Violent
11011046,07/09/2017 03:00:00 AM,CRIM SEXUAL ASSAULT,AGGRAVATED: KNIFE/CUT INSTR,false,false,26,41.883527335,-87.725750205,2017-07-09T03:00:00.000+02:00,7,9,3,2017,Non-Violent
11002468,07/01/2017 01:10:00 PM,BATTERY,SIMPLE,false,true,68,41.764359677,-87.650454124,2017-07-01T13:10:00.000+02:00,7,1,13,2017,Violent
10957369,05/25/2017 06:30:00 AM,MOTOR VEHICLE THEFT,AUTOMOBILE,true,false,25,41.909509901,-87.754996996,2017-05-25T06:30:00.000+02:00,5,25,6,2017,Non-Violent
10876676,02/25/2017 07:20:00 PM,NARCOTICS,MANU/DEL:CANNABIS OVER 10 GMS,true,false,67,41.79329893,-87.66456619,2017-02-25T19:20:00.000+02:00,2,25,19,2017,Non-Violent
10911013,04/13/2017 04:00:00 PM,INTERFERENCE WITH PUBLIC OFFICER,OBSTRUCTING IDENTIFICATION,true,false,26,41.882466305,-87.730625963,2017-04-13T16:00:00.000+02:00,4,13,16,2017,Non-Violent
10846744,02/10/2017 04:30:00 PM,THEFT,FROM BUILDING,false,false,41,41.791415136,-87.599199124,2017-02-10T16:30:00.000+02:00,2,10,16,2017,Non-Violent
10919620,04/21/2017 05:57:00 AM,BATTERY,DOMESTIC BATTERY SIMPLE,true,true,42,41.776248518,-87.605835547,2017-04-21T05:57:00.000+02:00,4,21,5,2017,Violent
10954619,05/18/2017 08:00:00 PM,DECEPTIVE PRACTICE,CREDIT CARD FRAUD,false,false,25,41.874778963,-87.760516816,2017-05-18T20:00:00.000+02:00,5,18,20,2017,Non-Violent
10988960,06/20/2017 08:20:00 PM,CRIMINAL DAMAGE,TO VEHICLE,false,false,24,41.912733991,-87.662123151,2017-06-20T20:20:00.000+02:00,6,20,20,2017,Non-Violent
11008632,07/06/2017 09:59:00 PM,BATTERY,SIMPLE,false,false,25,41.911463175,-87.781640823,2017-07-06T21:59:00.000+02:00,7,6,21,2017,Violent
10994194,06/25/2017 12:15:00 AM,BATTERY,DOMESTIC BATTERY SIMPLE,false,true,66,41.764277395,-87.680680527,2017-06-25T00:15:00.000+02:00,6,25,0,2017,Violent
10991763,06/22/2017 03:00:00 AM,THEFT,$500 AND UNDER,false,false,42,41.776063979,-87.594549578,2017-06-22T03:00:00.000+02:00,6,22,3,2017,Non-Violent
10926276,04/26/2017 10:00:00 PM,THEFT,OVER $500,false,false,28,41.876727916,-87.642862748,2017-04-26T22:00:00.000+02:00,4,26,22,2017,Non-Violent
11027277,07/17/2017 04:00:00 PM,DECEPTIVE PRACTICE,FINANCIAL IDENTITY THEFT OVER $ 300,false,false,25,41.882994967,-87.768213948,2017-07-17T16:00:00.000+02:00,7,17,16,2017,Non-Violent
10951882,05/20/2017 05:45:00 AM,ASSAULT,AGGRAVATED:KNIFE/CUTTING INSTR,false,false,42,41.780243493,-87.615319321,2017-05-20T05:45:00.000+02:00,5,20,5,2017,Violent
10853385,02/18/2017 12:09:00 AM,OTHER OFFENSE,FALSE/STOLEN/ALTERED TRP,false,false,27,41.873508972,-87.701005933,2017-02-18T00:09:00.000+02:00,2,18,0,2017,Non-Violent
10975583,06/07/2017 04:00:00 PM,ASSAULT,SIMPLE,false,false,8,41.891990384,-87.611461502,2017-06-07T16:00:00.000+02:00,6,7,16,2017,Violent
10841911,02/07/2017 01:45:00 PM,THEFT,FROM BUILDING,true,false,14,41.973814751,-87.722064863,2017-02-07T13:45:00.000+02:00,2,7,13,2017,Non-Violent
10993079,06/23/2017 05:20:00 PM,BURGLARY,FORCIBLE ENTRY,false,false,31,41.851211977,-87.679456204,2017-06-23T17:20:00.000+02:00,6,23,17,2017,Non-Violent
10911735,04/14/2017 10:10:00 AM,CRIMINAL DAMAGE,TO PROPERTY,false,false,30,41.853745792,-87.695716778,2017-04-14T10:10:00.000+02:00,4,14,10,2017,Non-Violent
10892688,03/24/2017 06:00:00 PM,DECEPTIVE PRACTICE,CREDIT CARD FRAUD,false,false,22,41.924903583,-87.687295639,2017-03-24T18:00:00.000+02:00,3,24,18,2017,Non-Violent
10958758,05/26/2017 02:30:00 PM,CRIMINAL DAMAGE,TO PROPERTY,false,false,10,41.989345736,-87.791202071,2017-05-26T14:30:00.000+02:00,5,26,14,2017,Non-Violent
10844985,02/09/2017 08:47:00 PM,BATTERY,DOMESTIC BATTERY SIMPLE,false,true,15,41.946229154,-87.756929594,2017-02-09T20:47:00.000+02:00,2,9,20,2017,Violent
10847371,02/12/2017 04:30:00 PM,BATTERY,DOMESTIC BATTERY SIMPLE,false,true,67,41.767982866,-87.662688425,2017-02-12T16:30:00.000+02:00,2,12,16,2017,Violent
10951544,05/19/2017 05:20:00 PM,THEFT,POCKET-PICKING,false,false,37,41.809125265,-87.631906508,2017-05-19T17:20:00.000+02:00,5,19,17,2017,Non-Violent
10994873,06/25/2017 07:48:00 PM,WEAPONS VIOLATION,UNLAWFUL POSS OF HANDGUN,true,false,71,41.736711088,-87.663087144,2017-06-25T19:48:00.000+02:00,6,25,19,2017,Non-Violent
11035272,07/29/2017 06:46:00 PM,BATTERY,DOMESTIC BATTERY SIMPLE,true,true,38,41.811265652,-87.612379593,2017-07-29T18:46:00.000+02:00,7,29,18,2017,Violent
10833644,01/30/2017 03:30:00 PM,THEFT,$500 AND UNDER,false,false,30,41.843860785,-87.695191029,2017-01-30T15:30:00.000+02:00,1,30,15,2017,Non-Violent
10880667,03/16/2017 11:45:00 PM,BATTERY,DOMESTIC BATTERY SIMPLE,true,true,6,41.938498175,-87.663775292,2017-03-16T23:45:00.000+02:00,3,16,23,2017,Violent
10853617,02/17/2017 07:00:00 PM,THEFT,$500 AND UNDER,false,false,27,41.881834358,-87.709413965,2017-02-17T19:00:00.000+02:00,2,17,19,2017,Non-Violent
10943782,05/13/2017 03:50:00 PM,THEFT,$500 AND UNDER,false,true,40,41.801448349,-87.621013135,2017-05-13T15:50:00.000+02:00,5,13,15,2017,Non-Violent
10920503,04/07/2017 09:00:00 AM,THEFT,FROM BUILDING,false,false,21,41.936843423,-87.701049579,2017-04-07T09:00:00.000+02:00,4,7,9,2017,Non-Violent
10992883,06/23/2017 02:45:00 PM,ROBBERY,STRONGARM - NO WEAPON,false,false,16,41.953619707,-87.730812648,2017-06-23T14:45:00.000+02:00,6,23,14,2017,Violent
11005917,07/05/2017 01:20:00 AM,BATTERY,DOMESTIC BATTERY SIMPLE,true,true,11,41.981779495,-87.77563503,2017-07-05T01:20:00.000+02:00,7,5,1,2017,Violent
10954487,05/22/2017 08:36:00 PM,BATTERY,SIMPLE,true,false,29,41.859986969,-87.733549927,2017-05-22T20:36:00.000+02:00,5,22,20,2017,Violent
11013998,07/11/2017 08:00:00 AM,CRIMINAL DAMAGE,TO PROPERTY,false,false,55,41.654683966,-87.549564685,2017-07-11T08:00:00.000+02:00,7,11,8,2017,Non-Violent
10872735,01/15/2017 03:00:00 PM,OTHER OFFENSE,HARASSMENT BY TELEPHONE,false,true,53,41.675544234,-87.6334064,2017-01-15T15:00:00.000+02:00,1,15,15,2017,Non-Violent
10975406,06/09/2017 04:15:00 PM,BATTERY,SIMPLE,false,false,1,42.010976521,-87.670139428,2017-06-09T16:15:00.000+02:00,6,9,16,2017,Violent
10871051,03/07/2017 07:25:00 PM,OTHER OFFENSE,LICENSE VIOLATION,false,false,2,41.986994535,-87.701675419,2017-03-07T19:25:00.000+02:00,3,7,19,2017,Non-Violent
10937434,05/07/2017 02:00:00 PM,CRIMINAL DAMAGE,TO PROPERTY,false,false,49,41.724678199,-87.6142166,2017-05-07T14:00:00.000+02:00,5,7,14,2017,Non-Violent
10959350,05/26/2017 01:06:00 PM,BATTERY,SIMPLE,false,false,3,41.965961632,-87.654791654,2017-05-26T13:06:00.000+02:00,5,26,13,2017,Violent
10964116,05/30/2017 03:00:00 PM,THEFT,FROM BUILDING,false,false,14,41.966059402,-87.737155987,2017-05-30T15:00:00.000+02:00,5,30,15,2017,Non-Violent
11019411,07/16/2017 06:00:00 AM,BATTERY,DOMESTIC BATTERY SIMPLE,false,true,42,41.773967711,-87.605788001,2017-07-16T06:00:00.000+02:00,7,16,6,2017,Violent
10898729,04/01/2017 08:00:00 PM,THEFT,OVER $500,false,true,55,41.68403521,-87.537665735,2017-04-01T20:00:00.000+02:00,4,1,20,2017,Non-Violent
10948666,05/17/2017 07:15:00 PM,CRIMINAL TRESPASS,TO LAND,true,false,65,41.774206664,-87.716004878,2017-05-17T19:15:00.000+02:00,5,17,19,2017,Non-Violent
10894806,03/29/2017 07:30:00 PM,MOTOR VEHICLE THEFT,AUTOMOBILE,false,false,4,41.967936135,-87.696226685,2017-03-29T19:30:00.000+02:00,3,29,19,2017,Non-Violent
11000718,06/29/2017 08:45:00 PM,THEFT,OVER $500,false,false,24,41.889834621,-87.670372978,2017-06-29T20:45:00.000+02:00,6,29,20,2017,Non-Violent
10921203,04/22/2017 11:52:00 AM,ASSAULT,SIMPLE,false,false,44,41.745279932,-87.603799742,2017-04-22T11:52:00.000+02:00,4,22,11,2017,Violent
10873498,03/09/2017 05:30:00 AM,BURGLARY,FORCIBLE ENTRY,false,false,1,42.009509634,-87.672259354,2017-03-09T05:30:00.000+02:00,3,9,5,2017,Non-Violent
10854283,02/18/2017 08:37:00 PM,BATTERY,AGGRAVATED - HANDGUN,false,false,68,,,2017-02-18T20:37:00.000+02:00,2,18,20,2017,Violent
10835659,02/01/2017 09:15:00 AM,ASSAULT,SIMPLE,false,true,49,41.710142658,-87.607844911,2017-02-01T09:15:00.000+02:00,2,1,9,2017,Violent
10874288,03/09/2017 12:00:00 PM,OTHER OFFENSE,HARASSMENT BY TELEPHONE,false,false,71,41.746277593,-87.662119177,2017-03-09T12:00:00.000+02:00,3,9,12,2017,Non-Violent
11002152,07/01/2017 05:36:00 AM,ASSAULT,AGGRAVATED: HANDGUN,false,false,71,41.743239572,-87.651850526,2017-07-01T05:36:00.000+02:00,7,1,5,2017,Violent
10966959,06/02/2017 07:00:00 PM,CRIMINAL TRESPASS,TO LAND,true,false,30,41.847898357,-87.725173563,2017-06-02T19:00:00.000+02:00,6,2,19,2017,Non-Violent
10963256,05/31/2017 01:20:00 AM,BATTERY,SIMPLE,false,false,6,41.943948446,-87.649386514,2017-05-31T01:20:00.000+02:00,5,31,1,2017,Violent
10939720,05/08/2017 06:30:00 PM,THEFT,$500 AND UNDER,false,false,2,42.016484192,-87.705284403,2017-05-08T18:30:00.000+02:00,5,8,18,2017,Non-Violent
10837301,02/02/2017 03:40:00 PM,THEFT,$500 AND UNDER,false,false,7,41.92526812,-87.633377068,2017-02-02T15:40:00.000+02:00,2,2,15,2017,Non-Violent
10897032,04/01/2017 01:30:00 AM,THEFT,$500 AND UNDER,false,false,62,41.788873508,-87.729160302,2017-04-01T01:30:00.000+02:00,4,1,1,2017,Non-Violent
10946459,05/12/2017 09:15:00 PM,CRIMINAL TRESPASS,TO VEHICLE,false,false,12,41.992027572,-87.739231186,2017-05-12T21:15:00.000+02:00,5,12,21,2017,Non-Violent
10969376,06/01/2017 06:00:00 PM,CRIMINAL DAMAGE,CRIMINAL DEFACEMENT,false,false,61,41.817570192,-87.665183168,2017-06-01T18:00:00.000+02:00,6,1,18,2017,Non-Violent
10973745,06/04/2017 09:00:00 AM,THEFT,FROM BUILDING,false,false,53,41.66736778,-87.621171845,2017-06-04T09:00:00.000+02:00,6,4,9,2017,Non-Violent
10868400,03/04/2017 10:00:00 PM,BATTERY,DOMESTIC BATTERY SIMPLE,false,true,69,41.764454754,-87.633419603,2017-03-04T22:00:00.000+02:00,3,4,22,2017,Violent
11007305,07/04/2017 09:00:00 PM,SEX OFFENSE,INDECENT SOLICITATION/CHILD,false,false,67,41.793703037,-87.661393568,2017-07-04T21:00:00.000+02:00,7,4,21,2017,Non-Violent
10882751,03/19/2017 07:30:00 AM,BATTERY,DOMESTIC BATTERY SIMPLE,true,true,6,41.944829501,-87.649413856,2017-03-19T07:30:00.000+02:00,3,19,7,2017,Violent
10931947,04/28/2017 06:30:00 PM,DECEPTIVE PRACTICE,FINANCIAL IDENTITY THEFT $300 AND UNDER,false,false,3,41.969694031,-87.656233968,2017-04-28T18:30:00.000+02:00,4,28,18,2017,Non-Violent
10937308,05/07/2017 12:30:00 AM,CRIMINAL DAMAGE,TO VEHICLE,false,false,9,42.000019349,-87.818943023,2017-05-07T00:30:00.000+02:00,5,7,0,2017,Non-Violent
10875667,03/12/2017 07:45:00 AM,BATTERY,DOMESTIC BATTERY SIMPLE,true,true,68,41.780921348,-87.650890727,2017-03-12T07:45:00.000+02:00,3,12,7,2017,Violent
11034715,07/01/2017 08:00:00 AM,OFFENSE INVOLVING CHILDREN,CRIM SEX ABUSE BY FAM MEMBER,false,true,43,41.76433238,-87.562834881,2017-07-01T08:00:00.000+02:00,7,1,8,2017,Non-Violent
10845859,02/08/2017 12:00:00 PM,THEFT,FROM BUILDING,false,false,33,41.85043397,-87.623743909,2017-02-08T12:00:00.000+02:00,2,8,12,2017,Non-Violent
11026345,07/21/2017 06:00:00 AM,THEFT,$500 AND UNDER,false,false,11,41.970244146,-87.770837537,2017-07-21T06:00:00.000+02:00,7,21,6,2017,Non-Violent
10953263,05/10/2017 01:00:00 PM,DECEPTIVE PRACTICE,CREDIT CARD FRAUD,false,false,6,41.935582941,-87.640500895,2017-05-10T13:00:00.000+02:00,5,10,13,2017,Non-Violent
10972932,06/07/2017 09:30:00 AM,DECEPTIVE PRACTICE,ATTEMPT - FINANCIAL IDENTITY THEFT,false,false,19,41.935605422,-87.787067012,2017-06-07T09:30:00.000+02:00,6,7,9,2017,Non-Violent
10955308,05/23/2017 12:04:00 PM,BATTERY,DOMESTIC BATTERY SIMPLE,true,true,6,41.938743235,-87.640782775,2017-05-23T12:04:00.000+02:00,5,23,12,2017,Violent
10944948,05/15/2017 02:30:00 AM,THEFT,$500 AND UNDER,false,true,53,41.684725742,-87.637301002,2017-05-15T02:30:00.000+02:00,5,15,2,2017,Non-Violent
10921155,04/22/2017 07:00:00 AM,BURGLARY,FORCIBLE ENTRY,false,false,43,41.761926845,-87.589671928,2017-04-22T07:00:00.000+02:00,4,22,7,2017,Non-Violent
10938817,05/08/2017 09:15:00 PM,THEFT,$500 AND UNDER,false,false,22,41.921724596,-87.695429932,2017-05-08T21:15:00.000+02:00,5,8,21,2017,Non-Violent
10871189,03/08/2017 01:35:00 AM,CRIMINAL DAMAGE,TO PROPERTY,false,false,68,41.782615834,-87.649717805,2017-03-08T01:35:00.000+02:00,3,8,1,2017,Non-Violent
10846403,02/11/2017 08:30:00 AM,THEFT,$500 AND UNDER,false,false,37,41.81691816,-87.633567673,2017-02-11T08:30:00.000+02:00,2,11,8,2017,Non-Violent
11008775,07/06/2017 09:30:00 AM,BATTERY,SIMPLE,false,false,12,42.008131216,-87.782859493,2017-07-06T09:30:00.000+02:00,7,6,9,2017,Violent
11001234,06/29/2017 11:30:00 PM,THEFT,OVER $500,false,false,7,41.920338859,-87.657083023,2017-06-29T23:30:00.000+02:00,6,29,23,2017,Non-Violent
10960217,05/28/2017 12:00:00 AM,MOTOR VEHICLE THEFT,THEFT/RECOVERY: AUTOMOBILE,false,false,24,41.896929372,-87.699199209,2017-05-28T00:00:00.000+02:00,5,28,0,2017,Non-Violent
10986889,06/18/2017 07:30:00 PM,BURGLARY,UNLAWFUL ENTRY,false,false,66,41.77293505,-87.685908428,2017-06-18T19:30:00.000+02:00,6,18,19,2017,Non-Violent
11030490,07/24/2017 05:00:00 PM,CRIM SEXUAL ASSAULT,NON-AGGRAVATED,false,false,31,41.850234783,-87.684252335,2017-07-24T17:00:00.000+02:00,7,24,17,2017,Non-Violent
10906597,04/08/2017 08:00:00 AM,THEFT,$500 AND UNDER,false,false,24,41.908016511,-87.672506661,2017-04-08T08:00:00.000+02:00,4,8,8,2017,Non-Violent
10875968,03/12/2017 02:00:00 PM,OTHER OFFENSE,HARASSMENT BY ELECTRONIC MEANS,false,true,21,41.937214515,-87.731286853,2017-03-12T14:00:00.000+02:00,3,12,14,2017,Non-Violent
10985031,06/16/2017 03:00:00 PM,THEFT,FROM BUILDING,false,false,61,41.796884278,-87.669523827,2017-06-16T15:00:00.000+02:00,6,16,15,2017,Non-Violent
11034311,07/28/2017 03:30:00 PM,WEAPONS VIOLATION,UNLAWFUL POSS OF HANDGUN,true,false,24,41.890926267,-87.670750997,2017-07-28T15:30:00.000+02:00,7,28,15,2017,Non-Violent
10911627,04/14/2017 09:00:00 AM,OTHER OFFENSE,TELEPHONE THREAT,false,true,35,41.828034969,-87.614422287,2017-04-14T09:00:00.000+02:00,4,14,9,2017,Non-Violent
10964286,05/31/2017 04:30:00 PM,ASSAULT,SIMPLE,false,false,22,41.914724026,-87.693449513,2017-05-31T16:30:00.000+02:00,5,31,16,2017,Violent
11013877,07/11/2017 12:45:00 PM,THEFT,RETAIL THEFT,true,false,15,41.953443342,-87.744957048,2017-07-11T12:45:00.000+02:00,7,11,12,2017,Non-Violent
10851992,02/16/2017 01:40:00 PM,BATTERY,SIMPLE,false,false,74,41.712873911,-87.721115353,2017-02-16T13:40:00.000+02:00,2,16,13,2017,Violent
10928362,04/28/2017 06:10:00 PM,ASSAULT,SIMPLE,false,false,25,41.883171809,-87.741753661,2017-04-28T18:10:00.000+02:00,4,28,18,2017,Violent
10898076,04/02/2017 06:00:00 AM,BATTERY,DOMESTIC BATTERY SIMPLE,true,true,29,41.854302497,-87.713697274,2017-04-02T06:00:00.000+02:00,4,2,6,2017,Violent
10887951,03/23/2017 01:25:00 PM,THEFT,$500 AND UNDER,false,false,45,41.737094305,-87.572998178,2017-03-23T13:25:00.000+02:00,3,23,13,2017,Non-Violent
10879604,03/16/2017 08:30:00 AM,BATTERY,DOMESTIC BATTERY SIMPLE,false,true,67,41.778586399,-87.659333289,2017-03-16T08:30:00.000+02:00,3,16,8,2017,Violent
10881989,03/18/2017 12:30:00 PM,THEFT,$500 AND UNDER,false,false,22,41.926296467,-87.702880861,2017-03-18T12:30:00.000+02:00,3,18,12,2017,Non-Violent
11035108,07/28/2017 12:00:00 PM,OFFENSE INVOLVING CHILDREN,OTHER OFFENSE,false,true,64,41.780601979,-87.767933288,2017-07-28T12:00:00.000+02:00,7,28,12,2017,Non-Violent
10992082,06/15/2017 03:30:00 AM,ROBBERY,STRONGARM - NO WEAPON,false,false,41,41.794828373,-87.580442725,2017-06-15T03:30:00.000+02:00,6,15,3,2017,Violent
10993627,06/23/2017 08:00:00 PM,CRIMINAL DAMAGE,TO VEHICLE,false,false,24,41.90699606,-87.669721551,2017-06-23T20:00:00.000+02:00,6,23,20,2017,Non-Violent
10846479,02/10/2017 10:30:00 AM,THEFT,$500 AND UNDER,false,false,73,41.710466496,-87.65177561,2017-02-10T10:30:00.000+02:00,2,10,10,2017,Non-Violent
10996736,06/27/2017 03:53:00 AM,BATTERY,DOMESTIC BATTERY SIMPLE,false,true,46,41.731893364,-87.552063273,2017-06-27T03:53:00.000+02:00,6,27,3,2017,Violent
10953647,05/17/2017 03:30:00 PM,THEFT,FROM BUILDING,false,false,26,41.877818912,-87.738784677,2017-05-17T15:30:00.000+02:00,5,17,15,2017,Non-Violent
10863849,02/28/2017 01:00:00 PM,THEFT,$500 AND UNDER,false,false,23,41.899796783,-87.734408066,2017-02-28T13:00:00.000+02:00,2,28,13,2017,Non-Violent
10948574,05/17/2017 06:30:00 PM,ASSAULT,SIMPLE,true,false,43,41.759012808,-87.560215615,2017-05-17T18:30:00.000+02:00,5,17,18,2017,Violent
10852406,02/11/2017 07:30:00 PM,BURGLARY,FORCIBLE ENTRY,false,false,44,41.746568105,-87.60874318,2017-02-11T19:30:00.000+02:00,2,11,19,2017,Non-Violent
11002244,06/30/2017 08:00:00 AM,THEFT,POCKET-PICKING,false,false,32,41.881919421,-87.636402554,2017-06-30T08:00:00.000+02:00,6,30,8,2017,Non-Violent
10961637,05/29/2017 06:05:00 PM,ASSAULT,SIMPLE,false,false,29,41.868006928,-87.72388159,2017-05-29T18:05:00.000+02:00,5,29,18,2017,Violent
10846219,02/11/2017 03:15:00 AM,BATTERY,DOMESTIC BATTERY SIMPLE,false,true,29,41.858229901,-87.712748993,2017-02-11T03:15:00.000+02:00,2,11,3,2017,Violent
10877916,03/13/2017 07:00:00 AM,ROBBERY,STRONG ARM - NO WEAPON,false,true,55,41.650910321,-87.545925786,2017-03-13T07:00:00.000+02:00,3,13,7,2017,Violent
10896631,03/30/2017 12:00:00 PM,THEFT,$500 AND UNDER,false,false,1,41.998072486,-87.670939306,2017-03-30T12:00:00.000+02:00,3,30,12,2017,Non-Violent
10947308,05/16/2017 06:20:00 PM,CRIMINAL DAMAGE,TO PROPERTY,false,false,67,41.779582665,-87.656547431,2017-05-16T18:20:00.000+02:00,5,16,18,2017,Non-Violent
10946935,05/15/2017 04:00:00 AM,THEFT,$500 AND UNDER,false,true,46,41.744071584,-87.561252336,2017-05-15T04:00:00.000+02:00,5,15,4,2017,Non-Violent
10948289,05/17/2017 12:50:00 PM,CRIMINAL TRESPASS,TO VEHICLE,true,false,40,41.790530763,-87.623983254,2017-05-17T12:50:00.000+02:00,5,17,12,2017,Non-Violent
11011262,07/08/2017 02:00:00 PM,THEFT,OVER $500,false,false,36,41.824850154,-87.611563134,2017-07-08T14:00:00.000+02:00,7,8,14,2017,Non-Violent
10940485,03/03/2017 12:15:00 PM,NARCOTICS,MANU/DELIVER: HEROIN (WHITE),true,false,27,41.880605787,-87.702037606,2017-03-03T12:15:00.000+02:00,3,3,12,2017,Non-Violent
10832015,01/28/2017 04:28:00 PM,THEFT,$500 AND UNDER,false,false,30,41.844342775,-87.717632254,2017-01-28T16:28:00.000+02:00,1,28,16,2017,Non-Violent
10872327,03/08/2017 08:37:00 PM,ROBBERY,ARMED: HANDGUN,true,false,21,41.936463017,-87.708760494,2017-03-08T20:37:00.000+02:00,3,8,20,2017,Violent
10915329,04/17/2017 04:00:00 AM,OFFENSE INVOLVING CHILDREN,CHILD ABUSE,true,true,42,41.784249699,-87.591067667,2017-04-17T04:00:00.000+02:00,4,17,4,2017,Non-Violent
10905647,04/08/2017 11:51:00 PM,WEAPONS VIOLATION,UNLAWFUL POSS OF HANDGUN,true,false,57,41.803376553,-87.733249277,2017-04-08T23:51:00.000+02:00,4,8,23,2017,Non-Violent
11000824,06/28/2017 09:30:00 PM,THEFT,OVER $500,false,false,7,41.924412182,-87.639750879,2017-06-28T21:30:00.000+02:00,6,28,21,2017,Non-Violent
11011252,07/08/2017 02:36:00 PM,DECEPTIVE PRACTICE,FINANCIAL IDENTITY THEFT $300 AND UNDER,false,false,38,41.816596232,-87.61916148,2017-07-08T14:36:00.000+02:00,7,8,14,2017,Non-Violent
11000675,06/01/2017 12:00:00 AM,SEX OFFENSE,ATT CRIM SEXUAL ABUSE,false,true,22,41.925413829,-87.712127725,2017-06-01T00:00:00.000+02:00,6,1,0,2017,Non-Violent
10975620,06/09/2017 06:00:00 PM,THEFT,OVER $500,false,false,34,41.852599058,-87.635366519,2017-06-09T18:00:00.000+02:00,6,9,18,2017,Non-Violent
10995101,06/26/2017 03:08:00 AM,BATTERY,SIMPLE,false,false,18,41.924052473,-87.795257083,2017-06-26T03:08:00.000+02:00,6,26,3,2017,Violent
10953312,05/21/2017 06:20:00 PM,BATTERY,DOMESTIC BATTERY SIMPLE,false,true,61,41.800690846,-87.667195989,2017-05-21T18:20:00.000+02:00,5,21,18,2017,Violent
10899845,04/03/2017 10:50:00 PM,ASSAULT,AGGRAVATED: HANDGUN,false,false,22,41.925565899,-87.7133536,2017-04-03T22:50:00.000+02:00,4,3,22,2017,Violent
10837909,02/03/2017 09:30:00 AM,BATTERY,SIMPLE,false,false,70,41.74806235,-87.682801662,2017-02-03T09:30:00.000+02:00,2,3,9,2017,Violent
10937954,05/05/2017 10:00:00 AM,BATTERY,DOMESTIC BATTERY SIMPLE,false,true,68,41.781353265,-87.635083754,2017-05-05T10:00:00.000+02:00,5,5,10,2017,Violent
10968643,05/28/2017 12:00:00 PM,ASSAULT,SIMPLE,false,true,67,41.792921391,-87.674265953,2017-05-28T12:00:00.000+02:00,5,28,12,2017,Violent
10919484,04/21/2017 12:00:00 AM,OTHER OFFENSE,OTHER VEHICLE OFFENSE,false,false,58,41.809155022,-87.700340721,2017-04-21T00:00:00.000+02:00,4,21,0,2017,Non-Violent
11032566,07/27/2017 06:20:00 AM,ROBBERY,STRONGARM - NO WEAPON,true,false,26,41.875112789,-87.720458052,2017-07-27T06:20:00.000+02:00,7,27,6,2017,Violent
10896859,03/30/2017 07:30:00 PM,CRIMINAL DAMAGE,TO PROPERTY,false,true,40,41.799580127,-87.619346782,2017-03-30T19:30:00.000+02:00,3,30,19,2017,Non-Violent
10972644,06/07/2017 10:06:00 AM,WEAPONS VIOLATION,UNLAWFUL POSS OF HANDGUN,true,false,61,41.798646032,-87.66714015,2017-06-07T10:06:00.000+02:00,6,7,10,2017,Non-Violent
11036877,07/18/2017 03:00:00 AM,OTHER OFFENSE,TELEPHONE THREAT,false,false,61,41.814995293,-87.671211382,2017-07-18T03:00:00.000+02:00,7,18,3,2017,Non-Violent
10962438,05/30/2017 09:00:00 AM,CRIMINAL DAMAGE,TO PROPERTY,false,false,70,41.745230529,-87.701045964,2017-05-30T09:00:00.000+02:00,5,30,9,2017,Non-Violent
10831778,01/28/2017 05:25:00 PM,THEFT,$500 AND UNDER,false,true,25,41.902160574,-87.764283459,2017-01-28T17:25:00.000+02:00,1,28,17,2017,Non-Violent
10871494,03/03/2017 05:00:00 PM,OFFENSE INVOLVING CHILDREN,CHILD ABUSE,false,false,2,41.991251401,-87.688460713,2017-03-03T17:00:00.000+02:00,3,3,17,2017,Non-Violent
10904560,01/19/2017 01:40:00 PM,THEFT,FROM BUILDING,false,false,32,41.882407782,-87.627844648,2017-01-19T13:40:00.000+02:00,1,19,13,2017,Non-Violent
11032095,01/01/2017 06:45:00 PM,DECEPTIVE PRACTICE,FINANCIAL IDENTITY THEFT OVER $ 300,false,false,5,41.959640134,-87.678139298,2017-01-01T18:45:00.000+02:00,1,1,18,2017,Non-Violent
10833894,01/30/2017 08:30:00 PM,BATTERY,DOMESTIC BATTERY SIMPLE,true,true,23,41.899569877,-87.72621158,2017-01-30T20:30:00.000+02:00,1,30,20,2017,Violent
11022780,07/18/2017 09:00:00 PM,THEFT,$500 AND UNDER,false,false,61,41.798652448,-87.674438283,2017-07-18T21:00:00.000+02:00,7,18,21,2017,Non-Violent
10875249,03/11/2017 03:00:00 PM,ASSAULT,AGGRAVATED: OTHER DANG WEAPON,false,false,62,41.794421113,-87.723193011,2017-03-11T15:00:00.000+02:00,3,11,15,2017,Violent
10996695,06/07/2017 01:19:00 PM,OFFENSE INVOLVING CHILDREN,CHILD PORNOGRAPHY,false,false,8,41.901171784,-87.645303011,2017-06-07T13:19:00.000+02:00,6,7,13,2017,Non-Violent
10890508,03/26/2017 01:00:00 PM,NARCOTICS,POSS: COCAINE,true,false,71,41.736008607,-87.643620985,2017-03-26T13:00:00.000+02:00,3,26,13,2017,Non-Violent
10930231,04/30/2017 09:30:00 PM,OTHER OFFENSE,TELEPHONE THREAT,false,false,21,41.936877924,-87.724700114,2017-04-30T21:30:00.000+02:00,4,30,21,2017,Non-Violent
11027858,07/23/2017 04:09:00 AM,BATTERY,SIMPLE,true,false,8,41.890051565,-87.62891376,2017-07-23T04:09:00.000+02:00,7,23,4,2017,Violent
10880580,03/11/2017 03:00:00 AM,THEFT,FROM BUILDING,false,false,6,41.948131367,-87.649510899,2017-03-11T03:00:00.000+02:00,3,11,3,2017,Non-Violent
10926283,04/26/2017 10:55:00 PM,BATTERY,DOMESTIC BATTERY SIMPLE,false,true,61,41.800686241,-87.644086795,2017-04-26T22:55:00.000+02:00,4,26,22,2017,Violent
10996849,06/26/2017 12:10:00 PM,THEFT,OVER $500,false,false,43,41.757630995,-87.585708249,2017-06-26T12:10:00.000+02:00,6,26,12,2017,Non-Violent
10916214,04/18/2017 03:15:00 PM,OTHER OFFENSE,TELEPHONE THREAT,false,true,40,41.799141876,-87.622579012,2017-04-18T15:15:00.000+02:00,4,18,15,2017,Non-Violent
10900191,04/03/2017 08:08:00 AM,DECEPTIVE PRACTICE,FRAUD OR CONFIDENCE GAME,false,false,3,41.967112193,-87.66521133,2017-04-03T08:08:00.000+02:00,4,3,8,2017,Non-Violent
11037068,07/27/2017 08:00:00 PM,BURGLARY,UNLAWFUL ENTRY,false,false,14,41.965556611,-87.711690105,2017-07-27T20:00:00.000+02:00,7,27,20,2017,Non-Violent
11020803,07/17/2017 12:00:00 PM,NARCOTICS,POSS: HEROIN(WHITE),true,false,25,41.88821144,-87.772060892,2017-07-17T12:00:00.000+02:00,7,17,12,2017,Non-Violent
10924794,04/25/2017 07:10:00 PM,CRIMINAL TRESPASS,TO LAND,true,false,54,41.65824289,-87.615885669,2017-04-25T19:10:00.000+02:00,4,25,19,2017,Non-Violent
10875976,03/12/2017 02:00:00 PM,BATTERY,SIMPLE,false,true,7,41.930917022,-87.644024267,2017-03-12T14:00:00.000+02:00,3,12,14,2017,Violent
10995119,06/25/2017 03:00:00 AM,BATTERY,SIMPLE,false,false,2,41.997788304,-87.686551615,2017-06-25T03:00:00.000+02:00,6,25,3,2017,Violent
10989033,06/20/2017 09:30:00 AM,THEFT,$500 AND UNDER,false,false,66,41.774441389,-87.698148914,2017-06-20T09:30:00.000+02:00,6,20,9,2017,Non-Violent
10850484,02/15/2017 10:50:00 AM,ASSAULT,PRO EMP HANDS NO/MIN INJURY,true,false,45,41.737094305,-87.572998178,2017-02-15T10:50:00.000+02:00,2,15,10,2017,Violent
10996689,06/27/2017 02:10:00 AM,BATTERY,DOMESTIC BATTERY SIMPLE,false,true,49,41.697073088,-87.628841278,2017-06-27T02:10:00.000+02:00,6,27,2,2017,Violent
11018604,05/30/2017 09:00:00 AM,DECEPTIVE PRACTICE,CREDIT CARD FRAUD,false,false,2,41.984133026,-87.69190166,2017-05-30T09:00:00.000+02:00,5,30,9,2017,Non-Violent
10959357,05/27/2017 05:30:00 AM,THEFT,RETAIL THEFT,false,false,60,41.83805499,-87.645458414,2017-05-27T05:30:00.000+02:00,5,27,5,2017,Non-Violent
10978190,06/10/2017 09:00:00 AM,DECEPTIVE PRACTICE,FINANCIAL IDENTITY THEFT OVER $ 300,false,false,24,41.911069389,-87.668926219,2017-06-10T09:00:00.000+02:00,6,10,9,2017,Non-Violent
10949871,05/18/2017 12:15:00 PM,ASSAULT,SIMPLE,false,true,68,41.773563766,-87.649483994,2017-05-18T12:15:00.000+02:00,5,18,12,2017,Violent
10966712,06/02/2017 01:30:00 PM,THEFT,$500 AND UNDER,false,false,64,41.779357492,-87.765440106,2017-06-02T13:30:00.000+02:00,6,2,13,2017,Non-Violent
10906986,04/10/2017 09:18:00 AM,CRIMINAL TRESPASS,TO RESIDENCE,true,false,67,41.762236933,-87.659980913,2017-04-10T09:18:00.000+02:00,4,10,9,2017,Non-Violent
10884328,03/20/2017 06:40:00 AM,CRIMINAL DAMAGE,TO PROPERTY,false,false,24,41.900494866,-87.673513555,2017-03-20T06:40:00.000+02:00,3,20,6,2017,Non-Violent
10857649,02/21/2017 08:00:00 PM,THEFT,OVER $500,false,false,75,41.691719131,-87.652094372,2017-02-21T20:00:00.000+02:00,2,21,20,2017,Non-Violent
10890651,02/05/2017 02:00:00 PM,MOTOR VEHICLE THEFT,AUTOMOBILE,false,true,25,41.91350472,-87.786770536,2017-02-05T14:00:00.000+02:00,2,5,14,2017,Non-Violent
10853116,02/17/2017 02:30:00 PM,THEFT,RETAIL THEFT,false,false,32,41.882457198,-87.627847776,2017-02-17T14:30:00.000+02:00,2,17,14,2017,Non-Violent
10971073,06/06/2017 12:00:00 PM,CRIMINAL DAMAGE,TO VEHICLE,false,true,45,41.744260428,-87.581451527,2017-06-06T12:00:00.000+02:00,6,6,12,2017,Non-Violent
10912032,04/14/2017 02:20:00 PM,THEFT,FROM BUILDING,false,false,8,41.897895128,-87.624096605,2017-04-14T14:20:00.000+02:00,4,14,14,2017,Non-Violent
11027933,07/22/2017 07:00:00 PM,BATTERY,DOMESTIC BATTERY SIMPLE,false,true,44,41.733811555,-87.611198394,2017-07-22T19:00:00.000+02:00,7,22,19,2017,Violent
10910149,04/12/2017 11:40:00 AM,ASSAULT,SIMPLE,false,false,48,41.734329121,-87.575654048,2017-04-12T11:40:00.000+02:00,4,12,11,2017,Violent
11031943,07/26/2017 04:30:00 PM,MOTOR VEHICLE THEFT,AUTOMOBILE,true,false,69,41.752019022,-87.614977963,2017-07-26T16:30:00.000+02:00,7,26,16,2017,Non-Violent
10877552,03/14/2017 05:30:00 AM,OTHER OFFENSE,HARASSMENT BY ELECTRONIC MEANS,false,false,65,41.775939069,-87.721274848,2017-03-14T05:30:00.000+02:00,3,14,5,2017,Non-Violent
10906065,04/09/2017 01:52:00 PM,OTHER OFFENSE,GUN OFFENDER: ANNUAL REGISTRATION,true,false,1,42.004547856,-87.669356294,2017-04-09T13:52:00.000+02:00,4,9,13,2017,Non-Violent
10839995,02/06/2017 01:05:00 AM,BATTERY,DOMESTIC BATTERY SIMPLE,true,true,25,41.881738731,-87.751307231,2017-02-06T01:05:00.000+02:00,2,6,1,2017,Violent
11015799,07/13/2017 03:25:00 AM,BATTERY,SIMPLE,false,false,8,41.904370109,-87.631460067,2017-07-13T03:25:00.000+02:00,7,13,3,2017,Violent
10995153,06/26/2017 01:20:00 AM,BURGLARY,FORCIBLE ENTRY,false,false,71,41.753134268,-87.675647982,2017-06-26T01:20:00.000+02:00,6,26,1,2017,Non-Violent
10994218,06/24/2017 11:30:00 PM,NARCOTICS,MANU/DEL:CANNABIS OVER 10 GMS,true,false,27,41.876212559,-87.709123492,2017-06-24T23:30:00.000+02:00,6,24,23,2017,Non-Violent
10933138,05/02/2017 09:34:00 PM,THEFT,OVER $500,false,false,22,41.924863777,-87.691452079,2017-05-02T21:34:00.000+02:00,5,2,21,2017,Non-Violent
10833729,01/30/2017 04:00:00 PM,CRIMINAL DAMAGE,TO VEHICLE,false,false,53,41.664028273,-87.622116272,2017-01-30T16:00:00.000+02:00,1,30,16,2017,Non-Violent
10943286,05/13/2017 01:19:00 AM,BATTERY,DOMESTIC BATTERY SIMPLE,false,true,40,41.791998321,-87.620776738,2017-05-13T01:19:00.000+02:00,5,13,1,2017,Violent
11027831,07/23/2017 01:30:00 AM,BATTERY,DOMESTIC BATTERY SIMPLE,false,true,20,41.912388453,-87.732519523,2017-07-23T01:30:00.000+02:00,7,23,1,2017,Violent
10948023,05/17/2017 10:00:00 AM,OTHER OFFENSE,TELEPHONE THREAT,false,true,1,42.01980733,-87.668248096,2017-05-17T10:00:00.000+02:00,5,17,10,2017,Non-Violent
10948716,05/17/2017 09:20:00 PM,NARCOTICS,POSS: CRACK,true,false,27,41.873520236,-87.696093065,2017-05-17T21:20:00.000+02:00,5,17,21,2017,Non-Violent
11009368,07/06/2017 01:45:00 PM,THEFT,$500 AND UNDER,false,false,1,42.002589776,-87.673383221,2017-07-06T13:45:00.000+02:00,7,6,13,2017,Non-Violent
11034777,07/29/2017 08:30:00 AM,OTHER OFFENSE,VIOLATE ORDER OF PROTECTION,false,true,54,41.657937906,-87.597595535,2017-07-29T08:30:00.000+02:00,7,29,8,2017,Non-Violent
10957490,05/24/2017 12:40:00 PM,BATTERY,DOMESTIC BATTERY SIMPLE,false,true,1,42.020171252,-87.669488191,2017-05-24T12:40:00.000+02:00,5,24,12,2017,Violent
10832218,01/27/2017 08:30:00 PM,CRIMINAL DAMAGE,TO VEHICLE,false,false,65,41.766911698,-87.716401058,2017-01-27T20:30:00.000+02:00,1,27,20,2017,Non-Violent
11014028,07/11/2017 05:00:00 PM,CRIMINAL TRESPASS,TO RESIDENCE,true,false,30,41.84928378,-87.717368326,2017-07-11T17:00:00.000+02:00,7,11,17,2017,Non-Violent
11014867,06/19/2017 12:45:00 PM,ROBBERY,STRONGARM - NO WEAPON,false,false,28,41.883012955,-87.684882821,2017-06-19T12:45:00.000+02:00,6,19,12,2017,Violent
10974955,06/08/2017 04:00:00 PM,CRIMINAL DAMAGE,TO VEHICLE,false,false,22,41.915680954,-87.696265362,2017-06-08T16:00:00.000+02:00,6,8,16,2017,Non-Violent
10843292,02/08/2017 03:50:00 PM,BATTERY,AGGRAVATED: OTHER DANG WEAPON,false,false,24,41.903203654,-87.691959272,2017-02-08T15:50:00.000+02:00,2,8,15,2017,Violent
10950028,01/03/2017 12:01:00 AM,DECEPTIVE PRACTICE,AGGRAVATED FINANCIAL IDENTITY THEFT,false,false,4,41.978495324,-87.689251423,2017-01-03T00:01:00.000+02:00,1,3,0,2017,Non-Violent
10981856,06/10/2017 08:00:00 AM,DECEPTIVE PRACTICE,FINANCIAL IDENTITY THEFT OVER $ 300,false,false,22,41.918361549,-87.685869868,2017-06-10T08:00:00.000+02:00,6,10,8,2017,Non-Violent
10856650,02/17/2017 07:27:00 PM,OTHER OFFENSE,TELEPHONE THREAT,false,false,61,41.800626532,-87.668410614,2017-02-17T19:27:00.000+02:00,2,17,19,2017,Non-Violent
10915013,04/01/2017 12:00:00 AM,CRIMINAL TRESPASS,TO RESIDENCE,false,false,3,41.964798032,-87.65478194,2017-04-01T00:00:00.000+02:00,4,1,0,2017,Non-Violent
10848119,02/13/2017 12:20:00 PM,THEFT,OVER $500,false,false,7,41.9251405,-87.63585519,2017-02-13T12:20:00.000+02:00,2,13,12,2017,Non-Violent
10942103,05/11/2017 10:48:00 PM,CRIMINAL DAMAGE,TO VEHICLE,true,false,29,41.86007723,-87.722558261,2017-05-11T22:48:00.000+02:00,5,11,22,2017,Non-Violent
10846292,02/10/2017 08:30:00 PM,CRIMINAL DAMAGE,TO VEHICLE,false,false,16,41.960079484,-87.708210051,2017-02-10T20:30:00.000+02:00,2,10,20,2017,Non-Violent
10938631,05/08/2017 12:00:00 PM,OTHER OFFENSE,HARASSMENT BY ELECTRONIC MEANS,false,false,29,41.866955241,-87.712998707,2017-05-08T12:00:00.000+02:00,5,8,12,2017,Non-Violent
10926601,04/25/2017 04:30:00 PM,THEFT,OVER $500,false,false,7,41.932354458,-87.672402503,2017-04-25T16:30:00.000+02:00,4,25,16,2017,Non-Violent
10922323,04/21/2017 10:00:00 PM,BATTERY,SIMPLE,false,false,71,41.735513537,-87.637522325,2017-04-21T22:00:00.000+02:00,4,21,22,2017,Violent
10971489,06/03/2017 10:30:00 AM,DECEPTIVE PRACTICE,FINANCIAL IDENTITY THEFT OVER $ 300,false,false,23,41.909893864,-87.725724339,2017-06-03T10:30:00.000+02:00,6,3,10,2017,Non-Violent
10863321,02/20/2017 04:00:00 PM,CRIMINAL DAMAGE,TO PROPERTY,false,false,70,41.75605824,-87.71085356,2017-02-20T16:00:00.000+02:00,2,20,16,2017,Non-Violent
10975325,06/08/2017 02:17:00 PM,OTHER OFFENSE,TELEPHONE THREAT,false,false,8,41.895003278,-87.62152816,2017-06-08T14:17:00.000+02:00,6,8,14,2017,Non-Violent
10889146,03/24/2017 07:41:00 PM,CRIMINAL DAMAGE,TO PROPERTY,false,true,70,41.741769468,-87.694015341,2017-03-24T19:41:00.000+02:00,3,24,19,2017,Non-Violent
10964771,06/01/2017 02:55:00 AM,DECEPTIVE PRACTICE,THEFT OF LABOR/SERVICES,true,false,6,41.939935646,-87.652491107,2017-06-01T02:55:00.000+02:00,6,1,2,2017,Non-Violent
10938432,05/08/2017 03:55:00 PM,ROBBERY,STRONGARM - NO WEAPON,false,false,32,41.877864969,-87.627666954,2017-05-08T15:55:00.000+02:00,5,8,15,2017,Violent
10937920,05/07/2017 09:00:00 PM,MOTOR VEHICLE THEFT,AUTOMOBILE,false,false,38,41.805865878,-87.60860724,2017-05-07T21:00:00.000+02:00,5,7,21,2017,Non-Violent
10872265,03/08/2017 08:15:00 PM,ASSAULT,SIMPLE,false,true,48,41.730965155,-87.567047545,2017-03-08T20:15:00.000+02:00,3,8,20,2017,Violent
10970186,06/02/2017 06:00:00 AM,THEFT,OVER $500,false,false,33,41.862859101,-87.624050746,2017-06-02T06:00:00.000+02:00,6,2,6,2017,Non-Violent
10981776,06/07/2017 06:00:00 PM,THEFT,RETAIL THEFT,true,false,19,41.923637978,-87.789987521,2017-06-07T18:00:00.000+02:00,6,7,18,2017,Non-Violent
10991070,06/22/2017 10:50:00 AM,BURGLARY,FORCIBLE ENTRY,false,false,66,41.785468684,-87.692349383,2017-06-22T10:50:00.000+02:00,6,22,10,2017,Non-Violent
10996531,06/22/2017 03:30:00 PM,THEFT,FROM BUILDING,false,false,32,41.871834768,-87.62615082,2017-06-22T15:30:00.000+02:00,6,22,15,2017,Non-Violent
10953352,05/21/2017 08:50:00 PM,MOTOR VEHICLE THEFT,AUTOMOBILE,false,false,25,41.88174034,-87.751083213,2017-05-21T20:50:00.000+02:00,5,21,20,2017,Non-Violent
11013679,07/11/2017 11:29:00 AM,CRIMINAL TRESPASS,TO LAND,true,false,29,41.862897469,-87.711150981,2017-07-11T11:29:00.000+02:00,7,11,11,2017,Non-Violent
10932457,05/02/2017 09:35:00 PM,ROBBERY,ARMED: HANDGUN,false,false,29,41.852390754,-87.717455974,2017-05-02T21:35:00.000+02:00,5,2,21,2017,Violent
10916109,03/10/2017 02:00:00 PM,THEFT,OVER $500,false,false,42,41.784754925,-87.588143196,2017-03-10T14:00:00.000+02:00,3,10,14,2017,Non-Violent
11007277,06/30/2017 12:00:00 AM,OTHER OFFENSE,OTHER VEHICLE OFFENSE,false,true,46,41.734823509,-87.552756858,2017-06-30T00:00:00.000+02:00,6,30,0,2017,Non-Violent
10977116,06/02/2017 03:15:00 PM,CRIMINAL DAMAGE,TO VEHICLE,false,false,67,41.784484203,-87.657053213,2017-06-02T15:15:00.000+02:00,6,2,15,2017,Non-Violent
10935540,05/05/2017 12:30:00 PM,OFFENSE INVOLVING CHILDREN,OTHER OFFENSE,false,false,31,41.848095703,-87.68063306,2017-05-05T12:30:00.000+02:00,5,5,12,2017,Non-Violent
10998611,06/27/2017 04:30:00 PM,BURGLARY,FORCIBLE ENTRY,false,false,61,41.797336922,-87.641588539,2017-06-27T16:30:00.000+02:00,6,27,16,2017,Non-Violent
10880519,03/16/2017 08:18:00 PM,BATTERY,SIMPLE,false,false,32,41.883620971,-87.627882713,2017-03-16T20:18:00.000+02:00,3,16,20,2017,Violent
10831208,01/27/2017 05:54:00 PM,MOTOR VEHICLE THEFT,AUTOMOBILE,false,false,28,41.884492443,-87.649000096,2017-01-27T17:54:00.000+02:00,1,27,17,2017,Non-Violent
11001281,06/12/2017 10:00:00 AM,DECEPTIVE PRACTICE,FINANCIAL IDENTITY THEFT $300 AND UNDER,false,false,6,41.939493089,-87.639532345,2017-06-12T10:00:00.000+02:00,6,12,10,2017,Non-Violent
10947986,05/17/2017 06:20:00 AM,BURGLARY,ATTEMPT FORCIBLE ENTRY,false,false,6,41.952700573,-87.65275966,2017-05-17T06:20:00.000+02:00,5,17,6,2017,Non-Violent
10956054,05/23/2017 10:00:00 PM,BURGLARY,FORCIBLE ENTRY,false,false,63,41.792581496,-87.707207259,2017-05-23T22:00:00.000+02:00,5,23,22,2017,Non-Violent
10838352,01/31/2017 12:00:00 PM,THEFT,$500 AND UNDER,false,false,25,41.886530422,-87.744355834,2017-01-31T12:00:00.000+02:00,1,31,12,2017,Non-Violent
11001176,06/20/2017 12:00:00 PM,MOTOR VEHICLE THEFT,AUTOMOBILE,true,false,5,41.95996579,-87.688643896,2017-06-20T12:00:00.000+02:00,6,20,12,2017,Non-Violent
11002055,07/01/2017 02:00:00 AM,BATTERY,DOMESTIC BATTERY SIMPLE,true,true,49,41.687060379,-87.62951067,2017-07-01T02:00:00.000+02:00,7,1,2,2017,Violent
10980068,06/09/2017 04:00:00 PM,THEFT,$500 AND UNDER,false,false,27,41.886368359,-87.710012531,2017-06-09T16:00:00.000+02:00,6,9,16,2017,Non-Violent
10946718,05/16/2017 12:10:00 PM,BURGLARY,FORCIBLE ENTRY,false,false,26,41.876134778,-87.728956006,2017-05-16T12:10:00.000+02:00,5,16,12,2017,Non-Violent
11009158,07/05/2017 01:43:00 PM,PUBLIC PEACE VIOLATION,ARSON THREAT,false,false,58,41.813178889,-87.70047718,2017-07-05T13:43:00.000+02:00,7,5,13,2017,Non-Violent
10911116,04/13/2017 04:00:00 PM,BATTERY,SIMPLE,false,false,1,42.00782304,-87.671018452,2017-04-13T16:00:00.000+02:00,4,13,16,2017,Violent
10852512,02/17/2017 07:45:00 AM,ASSAULT,SIMPLE,false,true,21,41.940542214,-87.694529353,2017-02-17T07:45:00.000+02:00,2,17,7,2017,Violent
10898549,04/01/2017 05:00:00 PM,BATTERY,DOMESTIC BATTERY SIMPLE,false,true,24,41.893285756,-87.656538409,2017-04-01T17:00:00.000+02:00,4,1,17,2017,Violent
10884516,03/20/2017 09:30:00 PM,THEFT,FROM BUILDING,false,false,25,41.909460992,-87.758921035,2017-03-20T21:30:00.000+02:00,3,20,21,2017,Non-Violent
10850007,02/15/2017 07:45:00 AM,CRIMINAL DAMAGE,TO VEHICLE,false,false,20,41.922993764,-87.736509817,2017-02-15T07:45:00.000+02:00,2,15,7,2017,Non-Violent
10869189,02/09/2017 08:00:00 PM,ROBBERY,ARMED: OTHER DANGEROUS WEAPON,false,false,49,41.692358646,-87.623096746,2017-02-09T20:00:00.000+02:00,2,9,20,2017,Violent
11033891,07/28/2017 06:27:00 AM,DECEPTIVE PRACTICE,FINANCIAL IDENTITY THEFT OVER $ 300,false,false,71,41.747934662,-87.665803109,2017-07-28T06:27:00.000+02:00,7,28,6,2017,Non-Violent
11018715,07/15/2017 10:00:00 AM,DECEPTIVE PRACTICE,CREDIT CARD FRAUD,false,false,8,41.903411736,-87.628667741,2017-07-15T10:00:00.000+02:00,7,15,10,2017,Non-Violent
