ID,Date,Primary Type,Description,Arrest,Domestic,Community Area,Latitude,Longitude,Date_TS,Month,Day,Hour,Year,Crime_Category
6650281,12/08/2008 08:00:00 AM,MOTOR VEHICLE THEFT,AUTOMOBILE,false,false,17,41.958902502,-87.786783523,2008-12-08T08:00:00.000+02:00,12,8,8,2008,Non-Violent
6664282,12/15/2008 05:00:00 PM,CRIMINAL DAMAGE,TO PROPERTY,false,false,46,41.73638408,-87.551407972,2008-12-15T17:00:00.000+02:00,12,15,17,2008,Non-Violent
6009968,01/04/2008 07:25:00 PM,NARCOTICS,POSS: HEROIN(WHITE),true,false,23,41.899733538,-87.724986847,2008-01-04T19:25:00.000+02:00,1,4,19,2008,Non-Violent
6012280,01/10/2008 12:01:00 AM,BURGLARY,FORCIBLE ENTRY,false,false,49,41.697823571,-87.62325266,2008-01-10T00:01:00.000+02:00,1,10,0,2008,Non-Violent
6155602,03/25/2008 03:00:00 AM,THEFT,ATTEMPT THEFT,false,false,25,41.878504627,-87.768062567,2008-03-25T03:00:00.000+02:00,3,25,3,2008,Non-Violent
6031982,01/19/2008 09:15:00 PM,CRIMINAL DAMAGE,TO PROPERTY,false,false,63,41.793659094,-87.695568224,2008-01-19T21:15:00.000+02:00,1,19,21,2008,Non-Violent
6160533,03/29/2008 03:53:51 AM,NARCOTICS,POSS: COCAINE,true,false,66,41.786012237,-87.689927602,2008-03-29T03:53:51.000+02:00,3,29,3,2008,Non-Violent
6640872,11/18/2008 08:50:00 AM,PROSTITUTION,SOLICIT ON PUBLIC WAY,true,false,67,,,2008-11-18T08:50:00.000+02:00,11,18,8,2008,Non-Violent
6750598,02/11/2008 11:10:00 PM,BATTERY,DOMESTIC BATTERY SIMPLE,false,true,49,41.700035398,-87.61178147,2008-02-11T23:10:00.000+02:00,2,11,23,2008,Violent
6143636,03/20/2008 01:15:00 AM,CRIMINAL DAMAGE,TO VEHICLE,false,false,2,42.007544685,-87.700478721,2008-03-20T01:15:00.000+02:00,3,20,1,2008,Non-Violent
6635234,11/29/2008 11:00:00 AM,THEFT,FROM BUILDING,false,false,23,41.912149595,-87.736181,2008-11-29T11:00:00.000+02:00,11,29,11,2008,Non-Violent
6628148,11/24/2008 01:15:00 PM,BURGLARY,FORCIBLE ENTRY,false,false,51,41.709833173,-87.568580396,2008-11-24T13:15:00.000+02:00,11,24,13,2008,Non-Violent
6635448,11/23/2008 10:00:00 AM,THEFT,FROM BUILDING,false,false,7,41.929881241,-87.672762454,2008-11-23T10:00:00.000+02:00,11,23,10,2008,Non-Violent
6102023,02/18/2008 02:05:00 PM,NARCOTICS,MANU/DELIVER:CRACK,true,false,23,41.911893017,-87.710609256,2008-02-18T14:05:00.000+02:00,2,18,14,2008,Non-Violent
6096577,02/22/2008 05:29:41 PM,BATTERY,SIMPLE,false,false,35,41.831014114,-87.617317037,2008-02-22T17:29:41.000+02:00,2,22,17,2008,Violent
6646985,12/05/2008 03:48:42 PM,ASSAULT,SIMPLE,false,true,67,41.766251035,-87.65657393,2008-12-05T15:48:42.000+02:00,12,5,15,2008,Violent
6607680,10/27/2008 12:45:00 PM,ASSAULT,SIMPLE,false,true,45,41.745349433,-87.595345196,2008-10-27T12:45:00.000+02:00,10,27,12,2008,Violent
6681517,12/29/2008 03:00:00 PM,THEFT,$500 AND UNDER,false,true,26,41.88577687,-87.73134035,2008-12-29T15:00:00.000+02:00,12,29,15,2008,Non-Violent
6037347,01/22/2008 10:40:00 PM,BURGLARY,FORCIBLE ENTRY,false,false,69,41.755559453,-87.619867879,2008-01-22T22:40:00.000+02:00,1,22,22,2008,Non-Violent
6113849,03/03/2008 01:00:00 PM,BATTERY,DOMESTIC BATTERY SIMPLE,false,true,77,41.989043709,-87.669922058,2008-03-03T13:00:00.000+02:00,3,3,13,2008,Violent
6674452,12/23/2008 03:13:00 AM,CRIMINAL DAMAGE,TO PROPERTY,false,false,50,41.702490996,-87.603866153,2008-12-23T03:13:00.000+02:00,12,23,3,2008,Non-Violent
6618292,11/18/2008 07:30:00 PM,THEFT,OVER $500,false,false,19,41.93180142,-87.763806922,2008-11-18T19:30:00.000+02:00,11,18,19,2008,Non-Violent
6001606,01/06/2008 07:01:25 PM,BATTERY,SIMPLE,false,false,25,41.884669511,-87.754005522,2008-01-06T19:01:25.000+02:00,1,6,19,2008,Violent
6642119,11/19/2008 09:00:00 AM,NARCOTICS,POSS: CANNABIS MORE THAN 30GMS,true,false,29,41.868180939,-87.709271389,2008-11-19T09:00:00.000+02:00,11,19,9,2008,Non-Violent
6069254,02/10/2008 03:30:00 PM,BATTERY,AGGRAVATED: OTHER DANG WEAPON,false,false,53,41.678727863,-87.617839914,2008-02-10T15:30:00.000+02:00,2,10,15,2008,Violent
6160788,03/26/2008 09:00:00 PM,PROSTITUTION,SOLICIT ON PUBLIC WAY,true,false,42,41.774792544,-87.615193152,2008-03-26T21:00:00.000+02:00,3,26,21,2008,Non-Violent
6129867,02/29/2008 01:40:00 PM,THEFT,$500 AND UNDER,false,false,71,41.750154295,-87.661008708,2008-02-29T13:40:00.000+02:00,2,29,13,2008,Non-Violent
6017415,01/12/2008 06:00:00 PM,CRIMINAL DAMAGE,TO VEHICLE,false,false,29,41.859063312,-87.707032701,2008-01-12T18:00:00.000+02:00,1,12,18,2008,Non-Violent
6118589,03/06/2008 05:10:00 PM,THEFT,RETAIL THEFT,false,false,32,41.883500187,-87.627876698,2008-03-06T17:10:00.000+02:00,3,6,17,2008,Non-Violent
6114797,03/03/2008 10:00:00 PM,BATTERY,DOMESTIC BATTERY SIMPLE,false,true,15,41.961266127,-87.751227486,2008-03-03T22:00:00.000+02:00,3,3,22,2008,Violent
6032777,01/21/2008 04:00:00 PM,CRIMINAL DAMAGE,TO PROPERTY,false,false,43,41.769467841,-87.586237993,2008-01-21T16:00:00.000+02:00,1,21,16,2008,Non-Violent
6641935,11/03/2008 12:00:00 PM,DECEPTIVE PRACTICE,"THEFT BY LESSEE,MOTOR VEH",true,false,56,41.801692642,-87.742991505,2008-11-03T12:00:00.000+02:00,11,3,12,2008,Non-Violent
6675489,12/22/2008 09:23:00 AM,BATTERY,AGGRAVATED DOMESTIC BATTERY: KNIFE/CUTTING INST,false,true,44,41.750664221,-87.612490079,2008-12-22T09:23:00.000+02:00,12,22,9,2008,Violent
6613589,11/17/2008 03:30:00 AM,NARCOTICS,POSS: CRACK,true,false,46,41.736739325,-87.55279961,2008-11-17T03:30:00.000+02:00,11,17,3,2008,Non-Violent
6654797,12/10/2008 12:00:00 PM,BURGLARY,UNLAWFUL ENTRY,false,false,58,41.812771127,-87.70168071,2008-12-10T12:00:00.000+02:00,12,10,12,2008,Non-Violent
6675851,12/19/2008 05:00:00 PM,MOTOR VEHICLE THEFT,"THEFT/RECOVERY: TRUCK,BUS,MHOME",false,false,70,41.74806235,-87.682801662,2008-12-19T17:00:00.000+02:00,12,19,17,2008,Non-Violent
6158316,03/06/2008 12:00:00 PM,THEFT,FINANCIAL ID THEFT:$300 &UNDER,false,false,5,41.947418518,-87.689490819,2008-03-06T12:00:00.000+02:00,3,6,12,2008,Non-Violent
6623056,11/21/2008 10:00:00 AM,BATTERY,DOMESTIC BATTERY SIMPLE,false,true,49,41.697126147,-87.624527265,2008-11-21T10:00:00.000+02:00,11,21,10,2008,Violent
5999734,01/03/2008 08:25:00 PM,OTHER OFFENSE,TELEPHONE THREAT,false,false,7,41.916470399,-87.641571088,2008-01-03T20:25:00.000+02:00,1,3,20,2008,Non-Violent
6679365,12/28/2008 01:00:00 AM,CRIMINAL DAMAGE,CRIMINAL DEFACEMENT,false,false,16,41.959844625,-87.709429324,2008-12-28T01:00:00.000+02:00,12,28,1,2008,Non-Violent
5993334,01/01/2008 10:22:43 AM,BATTERY,DOMESTIC BATTERY SIMPLE,false,true,1,42.00711743,-87.670006581,2008-01-01T10:22:43.000+02:00,1,1,10,2008,Violent
6642683,12/02/2008 07:10:00 PM,CRIMINAL DAMAGE,TO PROPERTY,false,false,35,41.845169197,-87.625314164,2008-12-02T19:10:00.000+02:00,12,2,19,2008,Non-Violent
6117707,03/03/2008 11:20:00 AM,NARCOTICS,POSS: CANNABIS 30GMS OR LESS,true,false,49,41.722421445,-87.604486948,2008-03-03T11:20:00.000+02:00,3,3,11,2008,Non-Violent
6630796,09/25/2008 05:00:00 PM,CRIMINAL DAMAGE,TO CITY OF CHICAGO PROPERTY,false,false,29,41.862117771,-87.703038145,2008-09-25T17:00:00.000+02:00,9,25,17,2008,Non-Violent
6101983,02/25/2008 07:00:00 PM,BATTERY,DOMESTIC BATTERY SIMPLE,false,true,4,41.96409236,-87.685590906,2008-02-25T19:00:00.000+02:00,2,25,19,2008,Violent
6086820,02/20/2008 09:00:00 PM,OTHER OFFENSE,TELEPHONE THREAT,false,true,35,41.839464759,-87.623233908,2008-02-20T21:00:00.000+02:00,2,20,21,2008,Non-Violent
6052567,01/30/2008 09:41:51 AM,ASSAULT,SIMPLE,false,false,32,41.880653112,-87.634396649,2008-01-30T09:41:51.000+02:00,1,30,9,2008,Violent
6682883,12/30/2008 12:20:00 PM,NARCOTICS,POSS: HEROIN(WHITE),true,false,25,41.889818651,-87.754190376,2008-12-30T12:20:00.000+02:00,12,30,12,2008,Non-Violent
6683261,12/30/2008 09:30:00 AM,THEFT,PURSE-SNATCHING,false,false,63,41.793325627,-87.688923014,2008-12-30T09:30:00.000+02:00,12,30,9,2008,Non-Violent
6139968,03/16/2008 10:55:00 PM,BATTERY,DOMESTIC BATTERY SIMPLE,false,true,44,41.750601338,-87.606429378,2008-03-16T22:55:00.000+02:00,3,16,22,2008,Violent
6118293,03/06/2008 11:10:00 AM,BATTERY,AGGRAVATED:KNIFE/CUTTING INSTR,true,false,39,41.811419728,-87.600731459,2008-03-06T11:10:00.000+02:00,3,6,11,2008,Violent
6668001,12/19/2008 08:00:00 AM,BURGLARY,FORCIBLE ENTRY,false,false,64,41.776268845,-87.760202737,2008-12-19T08:00:00.000+02:00,12,19,8,2008,Non-Violent
6685202,12/31/2008 06:19:52 PM,ROBBERY,ATTEMPT: ARMED-HANDGUN,false,false,67,41.76230003,-87.65577608,2008-12-31T18:19:52.000+02:00,12,31,18,2008,Violent
6045333,01/28/2008 07:33:00 PM,ROBBERY,ARMED: HANDGUN,false,false,48,41.735949053,-87.591759652,2008-01-28T19:33:00.000+02:00,1,28,19,2008,Violent
6662641,12/15/2008 01:36:07 PM,DECEPTIVE PRACTICE,BOGUS CHECK,false,false,32,41.876382676,-87.630734588,2008-12-15T13:36:07.000+02:00,12,15,13,2008,Non-Violent
6136685,03/16/2008 03:44:43 PM,WEAPONS VIOLATION,UNLAWFUL POSS OTHER FIREARM,true,false,68,41.789696851,-87.653544184,2008-03-16T15:44:43.000+02:00,3,16,15,2008,Non-Violent
6680360,12/25/2008 08:00:00 PM,THEFT,OVER $500,false,false,60,41.831891786,-87.643697079,2008-12-25T20:00:00.000+02:00,12,25,20,2008,Non-Violent
6737551,12/01/2008 12:00:00 AM,THEFT,FINANCIAL ID THEFT:$300 &UNDER,false,false,68,,,2008-12-01T00:00:00.000+02:00,12,1,0,2008,Non-Violent
6081852,02/17/2008 08:36:10 PM,NARCOTICS,POSS: HEROIN(WHITE),true,false,23,41.895422368,-87.720348395,2008-02-17T20:36:10.000+02:00,2,17,20,2008,Non-Violent
6017669,01/13/2008 08:00:00 PM,NARCOTICS,POSSESSION OF DRUG EQUIPMENT,true,false,3,41.965325805,-87.66287305,2008-01-13T20:00:00.000+02:00,1,13,20,2008,Non-Violent
6138534,03/17/2008 10:45:00 AM,ROBBERY,ARMED: HANDGUN,false,false,68,41.768928365,-87.638913575,2008-03-17T10:45:00.000+02:00,3,17,10,2008,Violent
6674113,12/23/2008 01:00:00 PM,THEFT,$500 AND UNDER,false,false,25,41.877857676,-87.754974025,2008-12-23T13:00:00.000+02:00,12,23,13,2008,Non-Violent
6616487,11/17/2008 03:30:00 PM,CRIMINAL DAMAGE,TO VEHICLE,false,false,39,41.803474876,-87.583690122,2008-11-17T15:30:00.000+02:00,11,17,15,2008,Non-Violent
6085338,02/07/2008 02:51:00 PM,NARCOTICS,POSS: METHAMPHETAMINES,true,false,11,41.972865009,-87.769748025,2008-02-07T14:51:00.000+02:00,2,7,14,2008,Non-Violent
6664501,12/16/2008 10:00:00 PM,THEFT,$500 AND UNDER,false,false,6,41.960278565,-87.670797758,2008-12-16T22:00:00.000+02:00,12,16,22,2008,Non-Violent
6158553,03/28/2008 01:50:00 AM,BATTERY,DOMESTIC BATTERY SIMPLE,false,true,11,41.969207536,-87.778311398,2008-03-28T01:50:00.000+02:00,3,28,1,2008,Violent
6665290,12/16/2008 07:00:00 PM,THEFT,OVER $500,false,false,25,41.886813294,-87.748694109,2008-12-16T19:00:00.000+02:00,12,16,19,2008,Non-Violent
6142215,03/19/2008 08:00:00 AM,MOTOR VEHICLE THEFT,AUTOMOBILE,false,false,58,41.811189396,-87.693068752,2008-03-19T08:00:00.000+02:00,3,19,8,2008,Non-Violent
6642731,12/01/2008 02:00:00 AM,THEFT,OVER $500,false,false,65,41.773968844,-87.727522172,2008-12-01T02:00:00.000+02:00,12,1,2,2008,Non-Violent
6698995,11/17/2008 10:00:00 AM,DECEPTIVE PRACTICE,FORGERY,false,false,5,41.957216272,-87.680903131,2008-11-17T10:00:00.000+02:00,11,17,10,2008,Non-Violent
6607913,10/07/2008 12:00:00 PM,DECEPTIVE PRACTICE,FRAUD OR CONFIDENCE GAME,false,false,2,42.007142825,-87.709280128,2008-10-07T12:00:00.000+02:00,10,7,12,2008,Non-Violent
6676239,12/19/2008 10:00:00 PM,THEFT,$500 AND UNDER,false,false,38,41.817419877,-87.621430469,2008-12-19T22:00:00.000+02:00,12,19,22,2008,Non-Violent
6636288,11/29/2008 04:30:00 PM,CRIMINAL DAMAGE,TO STATE SUP PROP,false,false,24,41.905965405,-87.674213984,2008-11-29T16:30:00.000+02:00,11,29,16,2008,Non-Violent
6080355,02/16/2008 08:30:00 PM,THEFT,$500 AND UNDER,false,false,69,41.757515673,-87.611445829,2008-02-16T20:30:00.000+02:00,2,16,20,2008,Non-Violent
6003029,01/01/2008 04:48:15 PM,CRIMINAL DAMAGE,TO PROPERTY,false,true,38,41.821308212,-87.623155726,2008-01-01T16:48:15.000+02:00,1,1,16,2008,Non-Violent
6159150,03/09/2008 04:14:00 PM,NARCOTICS,POSS: COCAINE,true,false,75,41.693157608,-87.682476443,2008-03-09T16:14:00.000+02:00,3,9,16,2008,Non-Violent
6097861,02/25/2008 11:45:00 AM,MOTOR VEHICLE THEFT,AUTOMOBILE,false,false,69,41.75915642,-87.626396045,2008-02-25T11:45:00.000+02:00,2,25,11,2008,Non-Violent
6135374,03/14/2008 02:53:00 AM,CRIMINAL DAMAGE,TO PROPERTY,true,false,56,41.798899349,-87.786887278,2008-03-14T02:53:00.000+02:00,3,14,2,2008,Non-Violent
6632911,11/22/2008 07:05:00 PM,CRIMINAL DAMAGE,TO VEHICLE,false,false,33,41.859936038,-87.623980263,2008-11-22T19:05:00.000+02:00,11,22,19,2008,Non-Violent
6694044,12/11/2008 05:00:00 PM,THEFT,OVER $500,false,false,73,41.709361337,-87.633643981,2008-12-11T17:00:00.000+02:00,12,11,17,2008,Non-Violent
6606968,11/12/2008 11:39:00 PM,NARCOTICS,POSS: HEROIN(WHITE),true,false,23,41.902727001,-87.71973487,2008-11-12T23:39:00.000+02:00,11,12,23,2008,Non-Violent
6011999,01/10/2008 10:15:41 AM,CRIMINAL TRESPASS,TO STATE SUP LAND,false,false,33,41.850517353,-87.627031661,2008-01-10T10:15:41.000+02:00,1,10,10,2008,Non-Violent
5999998,01/04/2008 06:30:00 PM,BURGLARY,FORCIBLE ENTRY,false,false,22,41.918758485,-87.695995923,2008-01-04T18:30:00.000+02:00,1,4,18,2008,Non-Violent
6666204,12/17/2008 11:00:00 PM,THEFT,OVER $500,false,false,27,41.886302825,-87.714640454,2008-12-17T23:00:00.000+02:00,12,17,23,2008,Non-Violent
6097751,02/23/2008 04:30:00 PM,BURGLARY,FORCIBLE ENTRY,false,false,49,41.699312157,-87.611108464,2008-02-23T16:30:00.000+02:00,2,23,16,2008,Non-Violent
6016768,01/13/2008 10:30:00 PM,ROBBERY,STRONGARM - NO WEAPON,false,false,28,41.866863357,-87.665305287,2008-01-13T22:30:00.000+02:00,1,13,22,2008,Violent
6630480,11/24/2008 05:15:17 PM,ROBBERY,ATTEMPT: ARMED-HANDGUN,false,false,42,41.773492629,-87.572275172,2008-11-24T17:15:17.000+02:00,11,24,17,2008,Violent
6135928,03/16/2008 03:00:00 AM,ROBBERY,ARMED: HANDGUN,false,false,71,41.74868991,-87.652800648,2008-03-16T03:00:00.000+02:00,3,16,3,2008,Violent
6623762,11/21/2008 09:50:20 AM,THEFT,FROM BUILDING,false,false,61,41.813601484,-87.665099694,2008-11-21T09:50:20.000+02:00,11,21,9,2008,Non-Violent
6019254,01/14/2008 11:30:00 PM,THEFT,$500 AND UNDER,false,false,28,41.868579626,-87.659857373,2008-01-14T23:30:00.000+02:00,1,14,23,2008,Non-Violent
6624129,11/20/2008 10:30:00 PM,CRIMINAL DAMAGE,TO PROPERTY,false,false,19,41.925949115,-87.75743188,2008-11-20T22:30:00.000+02:00,11,20,22,2008,Non-Violent
6009142,01/02/2008 12:00:00 PM,CRIMINAL DAMAGE,TO PROPERTY,false,false,68,41.793241202,-87.634129641,2008-01-02T12:00:00.000+02:00,1,2,12,2008,Non-Violent
6705082,10/08/2008 09:00:00 AM,THEFT,AGG: FINANCIAL ID THEFT,false,false,25,41.876749135,-87.747959666,2008-10-08T09:00:00.000+02:00,10,8,9,2008,Non-Violent
6013013,01/09/2008 08:55:00 PM,ROBBERY,ARMED: HANDGUN,false,false,41,41.788785842,-87.590193962,2008-01-09T20:55:00.000+02:00,1,9,20,2008,Violent
6647430,12/04/2008 12:00:00 PM,BURGLARY,FORCIBLE ENTRY,false,false,75,41.687053043,-87.664587644,2008-12-04T12:00:00.000+02:00,12,4,12,2008,Non-Violent
6623560,11/21/2008 09:00:00 PM,THEFT,FROM BUILDING,true,false,23,41.902819704,-87.707924015,2008-11-21T21:00:00.000+02:00,11,21,21,2008,Non-Violent
6650983,12/07/2008 04:06:00 PM,DECEPTIVE PRACTICE,COUNTERFEITING DOCUMENT,false,false,62,41.799520795,-87.723342683,2008-12-07T16:06:00.000+02:00,12,7,16,2008,Non-Violent
6610045,11/12/2008 09:45:00 PM,OTHER OFFENSE,HARASSMENT BY TELEPHONE,false,false,46,41.747076042,-87.571033507,2008-11-12T21:45:00.000+02:00,11,12,21,2008,Non-Violent
6020677,01/14/2008 08:48:51 PM,NARCOTICS,POSS: CANNABIS 30GMS OR LESS,true,false,20,41.918985343,-87.727251129,2008-01-14T20:48:51.000+02:00,1,14,20,2008,Non-Violent
6019046,01/14/2008 09:45:00 PM,CRIMINAL TRESPASS,TO LAND,true,false,28,41.881348623,-87.674525788,2008-01-14T21:45:00.000+02:00,1,14,21,2008,Non-Violent
6130974,03/13/2008 06:45:00 AM,CRIMINAL DAMAGE,TO VEHICLE,false,false,62,41.800464977,-87.723370404,2008-03-13T06:45:00.000+02:00,3,13,6,2008,Non-Violent
6007769,01/08/2008 04:21:08 PM,ROBBERY,STRONGARM - NO WEAPON,false,false,2,41.994682993,-87.699543021,2008-01-08T16:21:08.000+02:00,1,8,16,2008,Violent
6024528,01/16/2008 07:30:00 PM,ASSAULT,SIMPLE,false,false,73,41.713753878,-87.642987258,2008-01-16T19:30:00.000+02:00,1,16,19,2008,Violent
6090328,02/20/2008 05:00:00 PM,THEFT,FROM BUILDING,false,false,28,41.877745385,-87.638206774,2008-02-20T17:00:00.000+02:00,2,20,17,2008,Non-Violent
6669118,12/20/2008 03:57:00 AM,BATTERY,DOMESTIC BATTERY SIMPLE,true,true,24,41.905676731,-87.695501545,2008-12-20T03:57:00.000+02:00,12,20,3,2008,Violent
6078644,02/12/2008 11:00:00 PM,THEFT,POCKET-PICKING,false,false,8,41.897837503,-87.624097243,2008-02-12T23:00:00.000+02:00,2,12,23,2008,Non-Violent
6684091,12/30/2008 02:36:00 PM,ASSAULT,AGGRAVATED PO: HANDGUN,true,false,42,41.777945849,-87.60952661,2008-12-30T14:36:00.000+02:00,12,30,14,2008,Violent
6035101,01/18/2008 12:24:00 PM,CRIMINAL TRESPASS,TO STATE SUP LAND,false,false,8,41.899540054,-87.640009077,2008-01-18T12:24:00.000+02:00,1,18,12,2008,Non-Violent
6609876,11/12/2008 08:10:00 AM,BATTERY,SIMPLE,false,false,69,41.765316099,-87.611625977,2008-11-12T08:10:00.000+02:00,11,12,8,2008,Violent
6605383,11/11/2008 05:07:00 PM,CRIMINAL DAMAGE,TO VEHICLE,false,false,51,41.708059885,-87.56727567,2008-11-11T17:07:00.000+02:00,11,11,17,2008,Non-Violent
6643255,11/26/2008 11:50:00 AM,NARCOTICS,POSS: CANNABIS 30GMS OR LESS,true,false,60,41.833776004,-87.652252333,2008-11-26T11:50:00.000+02:00,11,26,11,2008,Non-Violent
6674894,12/23/2008 03:00:00 PM,OTHER OFFENSE,TELEPHONE THREAT,false,true,66,41.769517169,-87.680840034,2008-12-23T15:00:00.000+02:00,12,23,15,2008,Non-Violent
6615746,11/17/2008 11:10:00 PM,THEFT,OVER $500,false,false,35,41.823822003,-87.617855783,2008-11-17T23:10:00.000+02:00,11,17,23,2008,Non-Violent
6641729,12/02/2008 07:45:00 PM,THEFT,OVER $500,false,false,23,,,2008-12-02T19:45:00.000+02:00,12,2,19,2008,Non-Violent
6648534,12/07/2008 12:00:00 AM,CRIMINAL DAMAGE,TO VEHICLE,false,false,62,41.798047561,-87.720848148,2008-12-07T00:00:00.000+02:00,12,7,0,2008,Non-Violent
6669326,12/19/2008 10:54:59 AM,BATTERY,SIMPLE,false,false,43,41.754691074,-87.557038686,2008-12-19T10:54:59.000+02:00,12,19,10,2008,Violent
6006268,01/07/2008 05:00:00 PM,THEFT,$500 AND UNDER,false,false,38,41.819719964,-87.621493041,2008-01-07T17:00:00.000+02:00,1,7,17,2008,Non-Violent
6669046,12/04/2008 12:00:00 AM,DECEPTIVE PRACTICE,FORGERY,false,false,5,41.949455549,-87.694058057,2008-12-04T00:00:00.000+02:00,12,4,0,2008,Non-Violent
6156686,03/27/2008 04:01:00 AM,CRIMINAL TRESPASS,TO VEHICLE,true,false,24,41.899424408,-87.664936638,2008-03-27T04:01:00.000+02:00,3,27,4,2008,Non-Violent
6125082,03/09/2008 04:37:21 PM,THEFT,FROM BUILDING,false,false,1,42.019399237,-87.675049485,2008-03-09T16:37:21.000+02:00,3,9,16,2008,Non-Violent
6615041,11/17/2008 09:30:00 AM,THEFT,$500 AND UNDER,false,false,17,41.958902502,-87.786783523,2008-11-17T09:30:00.000+02:00,11,17,9,2008,Non-Violent
6645469,12/03/2008 04:00:00 PM,BURGLARY,FORCIBLE ENTRY,false,false,70,41.747771478,-87.685234189,2008-12-03T16:00:00.000+02:00,12,3,16,2008,Non-Violent
6147851,03/23/2008 04:25:00 AM,BATTERY,DOMESTIC BATTERY SIMPLE,false,true,47,41.72870489,-87.596151187,2008-03-23T04:25:00.000+02:00,3,23,4,2008,Violent
6611081,11/13/2008 11:00:00 AM,CRIMINAL DAMAGE,TO PROPERTY,false,false,77,41.976849298,-87.656426645,2008-11-13T11:00:00.000+02:00,11,13,11,2008,Non-Violent
6076166,02/10/2008 05:00:00 PM,OTHER OFFENSE,TELEPHONE THREAT,false,true,63,41.792671697,-87.709663337,2008-02-10T17:00:00.000+02:00,2,10,17,2008,Non-Violent
6640273,12/02/2008 10:30:00 AM,THEFT,$500 AND UNDER,false,false,13,41.980107086,-87.708786546,2008-12-02T10:30:00.000+02:00,12,2,10,2008,Non-Violent
6653800,12/08/2008 07:06:28 PM,NARCOTICS,POSS: HEROIN(WHITE),true,false,23,41.898924497,-87.731856014,2008-12-08T19:06:28.000+02:00,12,8,19,2008,Non-Violent
6022987,01/15/2008 02:25:05 PM,NARCOTICS,POSS: CANNABIS 30GMS OR LESS,true,false,1,42.011544731,-87.666851285,2008-01-15T14:25:05.000+02:00,1,15,14,2008,Non-Violent
6619636,11/20/2008 12:17:00 AM,BATTERY,SIMPLE,false,false,6,41.958644596,-87.669171245,2008-11-20T00:17:00.000+02:00,11,20,0,2008,Violent
6110750,03/02/2008 05:03:00 AM,NARCOTICS,POSS: COCAINE,true,false,66,41.786420835,-87.692820242,2008-03-02T05:03:00.000+02:00,3,2,5,2008,Non-Violent
6161134,03/26/2008 06:00:00 PM,THEFT,OVER $500,false,false,16,41.959046176,-87.734706551,2008-03-26T18:00:00.000+02:00,3,26,18,2008,Non-Violent
6065313,02/07/2008 06:15:00 PM,OTHER OFFENSE,FALSE/STOLEN/ALTERED TRP,false,false,43,41.759548331,-87.56477236,2008-02-07T18:15:00.000+02:00,2,7,18,2008,Non-Violent
6661069,12/15/2008 01:00:00 AM,THEFT,OVER $500,false,false,24,41.901307552,-87.680785681,2008-12-15T01:00:00.000+02:00,12,15,1,2008,Non-Violent
6713932,12/27/2008 12:00:00 PM,MOTOR VEHICLE THEFT,AUTOMOBILE,false,false,19,41.923954937,-87.767543972,2008-12-27T12:00:00.000+02:00,12,27,12,2008,Non-Violent
5998146,01/03/2008 02:25:00 AM,THEFT,OVER $500,false,false,45,41.747000588,-87.590518478,2008-01-03T02:25:00.000+02:00,1,3,2,2008,Non-Violent
6011164,01/10/2008 11:00:00 AM,THEFT,FROM BUILDING,false,true,25,41.876891751,-87.741517829,2008-01-10T11:00:00.000+02:00,1,10,11,2008,Non-Violent
6666563,12/17/2008 08:06:51 PM,BATTERY,DOMESTIC BATTERY SIMPLE,false,true,1,42.021640851,-87.673072164,2008-12-17T20:06:51.000+02:00,12,17,20,2008,Violent
6036542,01/23/2008 05:30:00 PM,OTHER OFFENSE,OTHER VEHICLE OFFENSE,false,true,27,41.873372456,-87.713212037,2008-01-23T17:30:00.000+02:00,1,23,17,2008,Non-Violent
6119295,03/07/2008 11:10:00 AM,THEFT,RETAIL THEFT,false,false,24,41.903695631,-87.667503909,2008-03-07T11:10:00.000+02:00,3,7,11,2008,Non-Violent
6114352,02/29/2008 10:00:00 PM,BURGLARY,FORCIBLE ENTRY,false,false,43,41.76302982,-87.590909093,2008-02-29T22:00:00.000+02:00,2,29,22,2008,Non-Violent
6691453,11/18/2008 09:09:00 PM,PROSTITUTION,SOLICIT FOR BUSINESS,true,false,30,41.851327229,-87.704017656,2008-11-18T21:09:00.000+02:00,11,18,21,2008,Non-Violent
6134781,03/15/2008 01:45:00 PM,THEFT,FROM BUILDING,false,false,8,41.909800222,-87.651841553,2008-03-15T13:45:00.000+02:00,3,15,13,2008,Non-Violent
6639946,11/23/2008 10:10:00 PM,NARCOTICS,POSS: CANNABIS 30GMS OR LESS,true,false,44,41.750588193,-87.605220177,2008-11-23T22:10:00.000+02:00,11,23,22,2008,Non-Violent
6679061,12/27/2008 06:05:00 PM,ROBBERY,AGGRAVATED VEHICULAR HIJACKING,false,false,66,41.767785899,-87.683328245,2008-12-27T18:05:00.000+02:00,12,27,18,2008,Violent
6110952,03/02/2008 08:30:00 PM,ROBBERY,ARMED: HANDGUN,false,false,35,41.84238663,-87.623553916,2008-03-02T20:30:00.000+02:00,3,2,20,2008,Violent
6680551,12/24/2008 11:45:00 PM,BATTERY,DOMESTIC BATTERY SIMPLE,false,true,71,41.746727177,-87.662506593,2008-12-24T23:45:00.000+02:00,12,24,23,2008,Violent
6035025,01/22/2008 08:45:00 PM,OTHER OFFENSE,FALSE/STOLEN/ALTERED TRP,false,false,30,41.847865644,-87.727291607,2008-01-22T20:45:00.000+02:00,1,22,20,2008,Non-Violent
6112465,02/29/2008 11:39:00 PM,OTHER OFFENSE,TELEPHONE THREAT,false,true,23,41.89986253,-87.724989296,2008-02-29T23:39:00.000+02:00,2,29,23,2008,Non-Violent
6634080,11/23/2008 04:30:00 PM,BURGLARY,FORCIBLE ENTRY,false,false,53,41.682352261,-87.656663046,2008-11-23T16:30:00.000+02:00,11,23,16,2008,Non-Violent
6633661,11/27/2008 01:30:00 PM,THEFT,OVER $500,false,false,27,41.8774751,-87.692712309,2008-11-27T13:30:00.000+02:00,11,27,13,2008,Non-Violent
6681084,12/19/2008 09:20:00 PM,CRIMINAL TRESPASS,TO LAND,true,false,42,41.777913616,-87.608331775,2008-12-19T21:20:00.000+02:00,12,19,21,2008,Non-Violent
6084217,02/17/2008 07:00:00 PM,CRIMINAL DAMAGE,TO VEHICLE,false,false,65,41.765096134,-87.716106882,2008-02-17T19:00:00.000+02:00,2,17,19,2008,Non-Violent
6660332,12/14/2008 11:15:00 AM,CRIMINAL TRESPASS,TO RESIDENCE,true,false,46,41.735050891,-87.555531269,2008-12-14T11:15:00.000+02:00,12,14,11,2008,Non-Violent
6606776,08/27/2008 12:00:00 AM,THEFT,FINANCIAL ID THEFT:$300 &UNDER,false,true,67,41.760525872,-87.664917586,2008-08-27T00:00:00.000+02:00,8,27,0,2008,Non-Violent
6613525,11/15/2008 02:40:00 PM,THEFT,RETAIL THEFT,true,false,6,41.939905846,-87.654410045,2008-11-15T14:40:00.000+02:00,11,15,14,2008,Non-Violent
6657840,12/04/2008 03:33:00 PM,NARCOTICS,POSS: CANNABIS 30GMS OR LESS,true,false,66,41.762009102,-87.701522707,2008-12-04T15:33:00.000+02:00,12,4,15,2008,Non-Violent
6680293,12/28/2008 04:50:13 PM,THEFT,RETAIL THEFT,true,false,59,41.836385231,-87.66571041,2008-12-28T16:50:13.000+02:00,12,28,16,2008,Non-Violent
6631734,11/25/2008 08:30:00 PM,MOTOR VEHICLE THEFT,AUTOMOBILE,false,false,19,41.927132835,-87.758718436,2008-11-25T20:30:00.000+02:00,11,25,20,2008,Non-Violent
6018766,01/14/2008 06:00:00 PM,CRIMINAL DAMAGE,TO VEHICLE,false,false,8,41.894257141,-87.617162024,2008-01-14T18:00:00.000+02:00,1,14,18,2008,Non-Violent
6110128,02/29/2008 07:45:00 PM,THEFT,FROM BUILDING,false,false,28,41.884910565,-87.642748943,2008-02-29T19:45:00.000+02:00,2,29,19,2008,Non-Violent
6043336,01/27/2008 03:00:00 AM,THEFT,FROM BUILDING,false,false,24,41.910494911,-87.676875003,2008-01-27T03:00:00.000+02:00,1,27,3,2008,Non-Violent
6678847,12/26/2008 10:00:00 AM,DECEPTIVE PRACTICE,COUNTERFEIT CHECK,false,false,32,41.879097968,-87.632283818,2008-12-26T10:00:00.000+02:00,12,26,10,2008,Non-Violent
6656817,12/10/2008 09:30:00 AM,DECEPTIVE PRACTICE,THEFT OF LABOR/SERVICES,false,false,32,41.885740288,-87.631590568,2008-12-10T09:30:00.000+02:00,12,10,9,2008,Non-Violent
6661616,12/14/2008 03:30:00 PM,CRIMINAL DAMAGE,TO PROPERTY,false,true,71,41.749806435,-87.647654676,2008-12-14T15:30:00.000+02:00,12,14,15,2008,Non-Violent
6121616,03/07/2008 09:04:00 AM,MOTOR VEHICLE THEFT,AUTOMOBILE,false,false,70,41.745636079,-87.705941315,2008-03-07T09:04:00.000+02:00,3,7,9,2008,Non-Violent
5991962,01/01/2008 04:00:00 AM,DECEPTIVE PRACTICE,ILLEGAL USE CASH CARD,false,false,32,41.884457946,-87.624315012,2008-01-01T04:00:00.000+02:00,1,1,4,2008,Non-Violent
6659500,12/12/2008 09:00:00 PM,OTHER OFFENSE,HARASSMENT BY TELEPHONE,false,true,51,41.7004197,-87.563990141,2008-12-12T21:00:00.000+02:00,12,12,21,2008,Non-Violent
6723289,11/20/2008 10:15:00 AM,NARCOTICS,MANU/DELIVER: HEROIN (WHITE),true,false,25,41.883436982,-87.749059068,2008-11-20T10:15:00.000+02:00,11,20,10,2008,Non-Violent
6629469,11/25/2008 01:55:00 PM,NARCOTICS,MANU/DEL:CANNABIS OVER 10 GMS,true,false,67,41.766036357,-87.660205107,2008-11-25T13:55:00.000+02:00,11,25,13,2008,Non-Violent
6659223,12/12/2008 11:00:00 PM,CRIMINAL DAMAGE,TO VEHICLE,false,false,58,41.81315055,-87.691904722,2008-12-12T23:00:00.000+02:00,12,12,23,2008,Non-Violent
6672575,12/22/2008 02:30:00 PM,NARCOTICS,MANU/DELIVER:CRACK,true,false,23,41.901753454,-87.721400865,2008-12-22T14:30:00.000+02:00,12,22,14,2008,Non-Violent
6783607,09/08/2008 06:00:00 PM,THEFT,$500 AND UNDER,false,false,67,41.764682386,-87.663785792,2008-09-08T18:00:00.000+02:00,9,8,18,2008,Non-Violent
6610979,11/11/2008 07:35:00 PM,ROBBERY,ARMED: HANDGUN,false,false,67,41.782467577,-87.657125736,2008-11-11T19:35:00.000+02:00,11,11,19,2008,Violent
6668028,12/18/2008 05:58:35 PM,CRIMINAL DAMAGE,TO PROPERTY,false,false,1,42.017140356,-87.666892219,2008-12-18T17:58:35.000+02:00,12,18,17,2008,Non-Violent
6042558,01/21/2008 01:00:00 PM,OTHER OFFENSE,HARASSMENT BY TELEPHONE,false,false,60,41.840624095,-87.636432476,2008-01-21T13:00:00.000+02:00,1,21,13,2008,Non-Violent
6648217,12/06/2008 08:50:00 AM,ASSAULT,AGGRAVATED:KNIFE/CUTTING INSTR,true,false,37,41.809125265,-87.631906508,2008-12-06T08:50:00.000+02:00,12,6,8,2008,Violent
6664672,12/16/2008 11:40:00 AM,ASSAULT,PRO EMP HANDS NO/MIN INJURY,false,false,63,41.791220341,-87.688848758,2008-12-16T11:40:00.000+02:00,12,16,11,2008,Violent
6627808,11/24/2008 08:00:00 PM,MOTOR VEHICLE THEFT,AUTOMOBILE,false,false,24,41.895925206,-87.676296977,2008-11-24T20:00:00.000+02:00,11,24,20,2008,Non-Violent
6649008,12/07/2008 11:00:00 PM,NARCOTICS,POSS: CANNABIS 30GMS OR LESS,true,false,16,41.940334475,-87.729677019,2008-12-07T23:00:00.000+02:00,12,7,23,2008,Non-Violent
6058214,02/04/2008 06:35:00 PM,THEFT,RETAIL THEFT,true,false,73,41.722578383,-87.662706548,2008-02-04T18:35:00.000+02:00,2,4,18,2008,Non-Violent
6081068,02/17/2008 04:00:00 PM,THEFT,$500 AND UNDER,false,false,6,41.935613969,-87.653959405,2008-02-17T16:00:00.000+02:00,2,17,16,2008,Non-Violent
6062467,02/06/2008 10:40:00 AM,BATTERY,DOMESTIC BATTERY SIMPLE,false,true,51,41.708029389,-87.569290282,2008-02-06T10:40:00.000+02:00,2,6,10,2008,Violent
6666059,12/16/2008 03:00:00 PM,BATTERY,PRO EMP HANDS NO/MIN INJURY,true,false,52,41.687781567,-87.540098152,2008-12-16T15:00:00.000+02:00,12,16,15,2008,Violent
6625636,11/16/2008 01:00:00 PM,THEFT,RETAIL THEFT,false,false,44,41.739265865,-87.604893749,2008-11-16T13:00:00.000+02:00,11,16,13,2008,Non-Violent
6620669,11/09/2008 09:50:00 PM,NARCOTICS,POSS: CRACK,true,false,44,41.750796402,-87.633425071,2008-11-09T21:50:00.000+02:00,11,9,21,2008,Non-Violent
6098887,02/25/2008 02:00:00 PM,THEFT,RETAIL THEFT,true,false,29,,,2008-02-25T14:00:00.000+02:00,2,25,14,2008,Non-Violent
6069243,02/10/2008 04:14:00 PM,NARCOTICS,SOLICIT NARCOTICS ON PUBLICWAY,true,false,23,41.898918381,-87.732260121,2008-02-10T16:14:00.000+02:00,2,10,16,2008,Non-Violent
5999576,01/03/2008 12:40:00 PM,BATTERY,SIMPLE,true,false,26,41.88065283,-87.731763004,2008-01-03T12:40:00.000+02:00,1,3,12,2008,Violent
6606082,11/10/2008 04:00:00 PM,BATTERY,SIMPLE,false,false,36,41.821789385,-87.601875318,2008-11-10T16:00:00.000+02:00,11,10,16,2008,Violent
6643472,12/03/2008 02:45:00 PM,BURGLARY,FORCIBLE ENTRY,false,false,15,41.958738241,-87.760408925,2008-12-03T14:45:00.000+02:00,12,3,14,2008,Non-Violent
6111195,03/03/2008 09:20:00 AM,CRIM SEXUAL ASSAULT,NON-AGGRAVATED,false,true,15,41.950653984,-87.748475037,2008-03-03T09:20:00.000+02:00,3,3,9,2008,Non-Violent
6039884,01/24/2008 05:41:00 PM,OTHER OFFENSE,TELEPHONE THREAT,false,false,19,41.929999824,-87.783223059,2008-01-24T17:41:00.000+02:00,1,24,17,2008,Non-Violent
6605193,11/11/2008 09:48:00 AM,BURGLARY,FORCIBLE ENTRY,false,false,38,41.812271636,-87.62453943,2008-11-11T09:48:00.000+02:00,11,11,9,2008,Non-Violent
6626556,11/23/2008 09:56:00 AM,BURGLARY,ATTEMPT FORCIBLE ENTRY,false,false,49,41.688180576,-87.638614729,2008-11-23T09:56:00.000+02:00,11,23,9,2008,Non-Violent
6613961,11/16/2008 02:00:00 PM,CRIMINAL DAMAGE,TO PROPERTY,true,false,61,41.794708258,-87.674324659,2008-11-16T14:00:00.000+02:00,11,16,14,2008,Non-Violent
6630965,11/20/2008 10:17:00 PM,CRIMINAL TRESPASS,TO LAND,true,false,68,41.779960201,-87.632099778,2008-11-20T22:17:00.000+02:00,11,20,22,2008,Non-Violent
6049854,01/30/2008 12:30:00 AM,MOTOR VEHICLE THEFT,AUTOMOBILE,false,false,61,41.804101217,-87.660940166,2008-01-30T00:30:00.000+02:00,1,30,0,2008,Non-Violent
6652933,12/09/2008 05:30:00 AM,BURGLARY,FORCIBLE ENTRY,false,false,38,41.823320055,-87.623203203,2008-12-09T05:30:00.000+02:00,12,9,5,2008,Non-Violent
6041922,01/26/2008 12:01:00 AM,BURGLARY,UNLAWFUL ENTRY,false,false,66,41.762029825,-87.700301941,2008-01-26T00:01:00.000+02:00,1,26,0,2008,Non-Violent
6014389,01/07/2008 02:55:00 PM,DECEPTIVE PRACTICE,FRAUD OR CONFIDENCE GAME,false,false,56,41.79953025,-87.757611642,2008-01-07T14:55:00.000+02:00,1,7,14,2008,Non-Violent
6126772,03/11/2008 01:05:00 PM,ASSAULT,PRO EMP HANDS NO/MIN INJURY,true,false,66,41.767761302,-87.690663515,2008-03-11T13:05:00.000+02:00,3,11,13,2008,Violent
6654531,11/16/2008 12:00:00 PM,OTHER OFFENSE,TELEPHONE THREAT,false,true,22,41.916221611,-87.70523964,2008-11-16T12:00:00.000+02:00,11,16,12,2008,Non-Violent
6006463,01/08/2008 08:00:00 PM,BURGLARY,FORCIBLE ENTRY,false,false,71,41.739037706,-87.64856434,2008-01-08T20:00:00.000+02:00,1,8,20,2008,Non-Violent
6651862,12/07/2008 05:03:00 PM,PUBLIC PEACE VIOLATION,FALSE POLICE REPORT,true,false,71,41.744980208,-87.657552215,2008-12-07T17:03:00.000+02:00,12,7,17,2008,Non-Violent
6017132,01/14/2008 06:50:00 AM,BURGLARY,UNLAWFUL ENTRY,false,false,72,41.703121769,-87.658129849,2008-01-14T06:50:00.000+02:00,1,14,6,2008,Non-Violent
6622162,11/11/2008 11:00:35 PM,NARCOTICS,POSS: CANNABIS 30GMS OR LESS,true,false,68,41.772016903,-87.64458443,2008-11-11T23:00:35.000+02:00,11,11,23,2008,Non-Violent
6681379,12/08/2008 12:00:00 AM,OTHER OFFENSE,OTHER VEHICLE OFFENSE,false,false,61,41.815335584,-87.641868115,2008-12-08T00:00:00.000+02:00,12,8,0,2008,Non-Violent
6161282,03/25/2008 11:42:03 PM,PUBLIC PEACE VIOLATION,RECKLESS CONDUCT,true,false,49,41.699170252,-87.620908957,2008-03-25T23:42:03.000+02:00,3,25,23,2008,Non-Violent
6151603,03/25/2008 03:50:00 AM,PROSTITUTION,SOLICIT ON PUBLIC WAY,true,false,31,41.858473695,-87.666167161,2008-03-25T03:50:00.000+02:00,3,25,3,2008,Non-Violent
6104780,02/27/2008 03:55:10 PM,BATTERY,AGGRAVATED: HANDGUN,false,false,25,41.902243139,-87.756083772,2008-02-27T15:55:10.000+02:00,2,27,15,2008,Violent
6016623,01/12/2008 11:00:00 AM,MOTOR VEHICLE THEFT,AUTOMOBILE,false,false,69,41.762927317,-87.629114698,2008-01-12T11:00:00.000+02:00,1,12,11,2008,Non-Violent
6018991,01/09/2008 01:25:00 PM,CRIMINAL DAMAGE,TO VEHICLE,false,false,56,41.818443433,-87.743465013,2008-01-09T13:25:00.000+02:00,1,9,13,2008,Non-Violent
6058738,02/04/2008 04:33:14 PM,BURGLARY,FORCIBLE ENTRY,false,false,67,41.772036129,-87.676932295,2008-02-04T16:33:14.000+02:00,2,4,16,2008,Non-Violent
6729114,12/30/2008 12:00:00 AM,MOTOR VEHICLE THEFT,AUTOMOBILE,false,false,29,41.864360941,-87.715362336,2008-12-30T00:00:00.000+02:00,12,30,0,2008,Non-Violent
6106672,03/01/2008 12:35:00 AM,CRIMINAL DAMAGE,TO VEHICLE,false,false,46,41.751457646,-87.552892516,2008-03-01T00:35:00.000+02:00,3,1,0,2008,Non-Violent
6679949,12/27/2008 01:20:00 AM,NARCOTICS,POSS: CANNABIS 30GMS OR LESS,true,false,53,41.677504805,-87.62864841,2008-12-27T01:20:00.000+02:00,12,27,1,2008,Non-Violent
6642469,11/28/2008 08:15:00 AM,PROSTITUTION,SOLICIT ON PUBLIC WAY,true,false,40,41.795592072,-87.619248025,2008-11-28T08:15:00.000+02:00,11,28,8,2008,Non-Violent
6674572,12/26/2008 12:05:00 AM,BATTERY,SIMPLE,false,false,30,41.842038937,-87.718395664,2008-12-26T00:05:00.000+02:00,12,26,0,2008,Violent
6641171,12/01/2008 04:40:00 PM,ROBBERY,ARMED: HANDGUN,false,false,60,41.836655383,-87.658405088,2008-12-01T16:40:00.000+02:00,12,1,16,2008,Violent
6091861,02/22/2008 09:39:29 AM,OTHER OFFENSE,OTHER CRIME INVOLVING PROPERTY,false,false,59,41.831516566,-87.681417962,2008-02-22T09:39:29.000+02:00,2,22,9,2008,Non-Violent
6604264,11/10/2008 05:44:10 PM,NARCOTICS,POSS: CANNABIS 30GMS OR LESS,true,false,68,41.789938409,-87.63570198,2008-11-10T17:44:10.000+02:00,11,10,17,2008,Non-Violent
6640161,11/05/2008 10:00:00 AM,THEFT,$500 AND UNDER,false,false,33,41.858629591,-87.623950651,2008-11-05T10:00:00.000+02:00,11,5,10,2008,Non-Violent
6121397,03/02/2008 11:55:00 AM,ASSAULT,PRO EMP HANDS NO/MIN INJURY,false,false,68,41.793521775,-87.641490211,2008-03-02T11:55:00.000+02:00,3,2,11,2008,Violent
6613615,11/16/2008 02:25:00 PM,MOTOR VEHICLE THEFT,AUTOMOBILE,false,false,51,41.717309191,-87.565773974,2008-11-16T14:25:00.000+02:00,11,16,14,2008,Non-Violent
6700507,10/19/2008 09:00:00 AM,THEFT,$500 AND UNDER,false,false,22,41.921037395,-87.701675975,2008-10-19T09:00:00.000+02:00,10,19,9,2008,Non-Violent
6609512,11/13/2008 03:10:00 PM,BATTERY,SIMPLE,false,false,32,41.867427987,-87.62622876,2008-11-13T15:10:00.000+02:00,11,13,15,2008,Violent
6651928,12/09/2008 11:00:00 AM,THEFT,OVER $500,false,false,8,41.905379201,-87.649522814,2008-12-09T11:00:00.000+02:00,12,9,11,2008,Non-Violent
6031137,01/20/2008 06:10:00 AM,ROBBERY,AGGRAVATED,false,false,68,41.779879362,-87.636855932,2008-01-20T06:10:00.000+02:00,1,20,6,2008,Violent
6028532,01/18/2008 09:10:00 AM,BURGLARY,HOME INVASION,false,false,70,41.752577862,-87.736603208,2008-01-18T09:10:00.000+02:00,1,18,9,2008,Non-Violent
6677143,11/01/2008 12:00:00 AM,CRIMINAL DAMAGE,TO PROPERTY,false,true,35,41.84528672,-87.622127226,2008-11-01T00:00:00.000+02:00,11,1,0,2008,Non-Violent
6650362,12/06/2008 06:00:00 PM,OFFENSE INVOLVING CHILDREN,CRIM SEX ABUSE BY FAM MEMBER,true,true,61,41.795094573,-87.654888031,2008-12-06T18:00:00.000+02:00,12,6,18,2008,Non-Violent
6665205,12/17/2008 08:00:00 AM,CRIMINAL DAMAGE,TO VEHICLE,false,false,43,41.772381955,-87.59042,2008-12-17T08:00:00.000+02:00,12,17,8,2008,Non-Violent
6656930,12/03/2008 01:10:00 PM,NARCOTICS,SOLICIT NARCOTICS ON PUBLICWAY,true,false,29,41.865127786,-87.73370747,2008-12-03T13:10:00.000+02:00,12,3,13,2008,Non-Violent
6612499,11/15/2008 03:00:00 AM,BATTERY,DOMESTIC BATTERY SIMPLE,false,true,68,41.770105636,-87.645752273,2008-11-15T03:00:00.000+02:00,11,15,3,2008,Violent
6119312,03/07/2008 12:00:00 AM,MOTOR VEHICLE THEFT,AUTOMOBILE,false,false,16,41.959844626,-87.721668957,2008-03-07T00:00:00.000+02:00,3,7,0,2008,Non-Violent
6131474,03/13/2008 02:55:00 PM,CRIMINAL DAMAGE,TO PROPERTY,false,false,73,41.70412858,-87.648792053,2008-03-13T14:55:00.000+02:00,3,13,14,2008,Non-Violent
6049632,01/11/2008 09:40:00 PM,NARCOTICS,POSS: HEROIN(WHITE),true,false,49,41.69621989,-87.623980652,2008-01-11T21:40:00.000+02:00,1,11,21,2008,Non-Violent
6035645,01/23/2008 08:30:00 AM,BATTERY,DOMESTIC BATTERY SIMPLE,false,true,46,41.74043773,-87.561193272,2008-01-23T08:30:00.000+02:00,1,23,8,2008,Violent
6076474,02/14/2008 08:20:00 PM,ROBBERY,ATTEMPT: ARMED-HANDGUN,false,false,75,41.697048243,-87.668903728,2008-02-14T20:20:00.000+02:00,2,14,20,2008,Violent
6041027,01/24/2008 03:49:07 PM,BATTERY,SIMPLE,false,false,2,41.98767052,-87.696872273,2008-01-24T15:49:07.000+02:00,1,24,15,2008,Violent
6041531,01/24/2008 07:20:10 PM,BATTERY,SIMPLE,false,false,29,41.861022663,-87.705515813,2008-01-24T19:20:10.000+02:00,1,24,19,2008,Violent
6134279,03/14/2008 11:34:48 AM,NARCOTICS,POSS: CRACK,true,false,16,41.95814145,-87.716721873,2008-03-14T11:34:48.000+02:00,3,14,11,2008,Non-Violent
6649698,11/17/2008 08:45:00 AM,CRIMINAL DAMAGE,TO PROPERTY,false,false,43,41.768031597,-87.571049401,2008-11-17T08:45:00.000+02:00,11,17,8,2008,Non-Violent
6610652,11/15/2008 09:00:00 PM,CRIMINAL DAMAGE,TO VEHICLE,false,false,66,41.780743235,-87.706816469,2008-11-15T21:00:00.000+02:00,11,15,21,2008,Non-Violent
6053851,01/31/2008 05:45:00 PM,ASSAULT,SIMPLE,false,false,56,41.79284254,-87.779974875,2008-01-31T17:45:00.000+02:00,1,31,17,2008,Violent
6078285,02/15/2008 02:15:00 PM,MOTOR VEHICLE THEFT,AUTOMOBILE,false,false,8,41.908390561,-87.628796673,2008-02-15T14:15:00.000+02:00,2,15,14,2008,Non-Violent
5996715,01/02/2008 06:00:00 PM,ROBBERY,ARMED: HANDGUN,false,false,66,41.778308621,-87.69824274,2008-01-02T18:00:00.000+02:00,1,2,18,2008,Violent
6149580,03/23/2008 12:00:00 AM,OTHER OFFENSE,HARASSMENT BY TELEPHONE,false,false,15,41.953844845,-87.755934545,2008-03-23T00:00:00.000+02:00,3,23,0,2008,Non-Violent
6026399,01/17/2008 12:45:00 AM,THEFT,$500 AND UNDER,false,true,77,41.986107062,-87.658094107,2008-01-17T00:45:00.000+02:00,1,17,0,2008,Non-Violent
6622864,11/20/2008 11:30:00 AM,ROBBERY,STRONGARM - NO WEAPON,false,false,69,41.780221321,-87.616602802,2008-11-20T11:30:00.000+02:00,11,20,11,2008,Violent
6651650,12/08/2008 02:15:00 PM,ROBBERY,STRONGARM - NO WEAPON,false,true,42,41.777739448,-87.610742456,2008-12-08T14:15:00.000+02:00,12,8,14,2008,Violent
6022683,01/11/2008 05:50:00 PM,CRIMINAL DAMAGE,TO PROPERTY,false,false,44,41.744943872,-87.626874442,2008-01-11T17:50:00.000+02:00,1,11,17,2008,Non-Violent
6639572,11/30/2008 04:15:00 AM,BATTERY,DOMESTIC BATTERY SIMPLE,true,true,60,41.839672081,-87.660872507,2008-11-30T04:15:00.000+02:00,11,30,4,2008,Violent
6126165,03/11/2008 03:30:00 PM,MOTOR VEHICLE THEFT,AUTOMOBILE,false,false,24,41.90039631,-87.680758226,2008-03-11T15:30:00.000+02:00,3,11,15,2008,Non-Violent
6666140,12/14/2008 01:50:22 AM,THEFT,$500 AND UNDER,false,false,60,41.837650931,-87.646266397,2008-12-14T01:50:22.000+02:00,12,14,1,2008,Non-Violent
6136730,03/16/2008 09:15:00 PM,NARCOTICS,POSS: HEROIN(WHITE),true,false,26,41.875253086,-87.726724504,2008-03-16T21:15:00.000+02:00,3,16,21,2008,Non-Violent
6678485,12/27/2008 09:35:00 PM,NARCOTICS,POSS: COCAINE,true,false,19,41.922116302,-87.768658893,2008-12-27T21:35:00.000+02:00,12,27,21,2008,Non-Violent
6613664,11/16/2008 04:00:00 PM,OFFENSE INVOLVING CHILDREN,OTHER OFFENSE,false,true,37,41.80171934,-87.630703621,2008-11-16T16:00:00.000+02:00,11,16,16,2008,Non-Violent
6615446,11/17/2008 09:00:00 PM,THEFT,OVER $500,false,false,26,41.878770604,-87.733925117,2008-11-17T21:00:00.000+02:00,11,17,21,2008,Non-Violent
6718022,04/15/2008 12:00:00 PM,THEFT,FINANCIAL ID THEFT: OVER $300,false,false,25,41.883467894,-87.750281658,2008-04-15T12:00:00.000+02:00,4,15,12,2008,Non-Violent
6094901,02/23/2008 09:10:00 PM,NARCOTICS,POSS: CANNABIS 30GMS OR LESS,true,false,37,41.794533814,-87.631438536,2008-02-23T21:10:00.000+02:00,2,23,21,2008,Non-Violent
6695562,12/12/2008 10:00:00 PM,THEFT,FROM BUILDING,false,false,7,41.927773204,-87.652017777,2008-12-12T22:00:00.000+02:00,12,12,22,2008,Non-Violent
6145281,03/20/2008 10:10:00 PM,BATTERY,DOMESTIC BATTERY SIMPLE,false,true,68,41.775818341,-87.644683072,2008-03-20T22:10:00.000+02:00,3,20,22,2008,Violent
6700728,11/24/2008 02:30:00 PM,THEFT,OVER $500,false,false,67,41.772994503,-87.668923367,2008-11-24T14:30:00.000+02:00,11,24,14,2008,Non-Violent
6643671,11/22/2008 03:50:00 PM,PROSTITUTION,SOLICIT ON PUBLIC WAY,false,false,25,41.880518571,-87.743441605,2008-11-22T15:50:00.000+02:00,11,22,15,2008,Non-Violent
6046657,01/28/2008 11:25:00 AM,THEFT,$500 AND UNDER,false,false,25,41.909325455,-87.769781921,2008-01-28T11:25:00.000+02:00,1,28,11,2008,Non-Violent
6629006,11/24/2008 11:00:00 PM,MOTOR VEHICLE THEFT,AUTOMOBILE,false,false,19,41.926611779,-87.764852618,2008-11-24T23:00:00.000+02:00,11,24,23,2008,Non-Violent
6691343,12/09/2008 09:10:00 PM,PROSTITUTION,SOLICIT ON PUBLIC WAY,true,false,68,41.767842217,-87.644482458,2008-12-09T21:10:00.000+02:00,12,9,21,2008,Non-Violent
6689752,12/27/2008 03:20:00 PM,THEFT,RETAIL THEFT,true,false,25,41.909664252,-87.742728815,2008-12-27T15:20:00.000+02:00,12,27,15,2008,Non-Violent
6647861,12/04/2008 02:20:00 AM,CRIMINAL DAMAGE,TO PROPERTY,false,true,27,41.876005082,-87.71084027,2008-12-04T02:20:00.000+02:00,12,4,2,2008,Non-Violent
6080684,02/15/2008 02:00:00 AM,CRIMINAL DAMAGE,TO PROPERTY,false,true,71,41.755777588,-87.666696733,2008-02-15T02:00:00.000+02:00,2,15,2,2008,Non-Violent
6681296,12/20/2008 12:30:00 AM,THEFT,FROM BUILDING,false,false,4,41.983571356,-87.674613191,2008-12-20T00:30:00.000+02:00,12,20,0,2008,Non-Violent
6029538,01/16/2008 04:00:00 PM,THEFT,RETAIL THEFT,false,false,25,41.913157898,-87.805911332,2008-01-16T16:00:00.000+02:00,1,16,16,2008,Non-Violent
6008126,01/08/2008 10:40:00 AM,THEFT,RETAIL THEFT,false,false,41,41.799546886,-87.588609986,2008-01-08T10:40:00.000+02:00,1,8,10,2008,Non-Violent
6054283,02/01/2008 11:15:00 AM,WEAPONS VIOLATION,UNLAWFUL USE/SALE AIR RIFLE,false,false,27,41.871546474,-87.700940828,2008-02-01T11:15:00.000+02:00,2,1,11,2008,Non-Violent
6085117,02/18/2008 07:49:00 PM,OTHER OFFENSE,TELEPHONE THREAT,false,false,28,41.885271986,-87.668653732,2008-02-18T19:49:00.000+02:00,2,18,19,2008,Non-Violent
6083430,02/17/2008 11:15:00 PM,BATTERY,SIMPLE,false,false,8,41.908430535,-87.638509526,2008-02-17T23:15:00.000+02:00,2,17,23,2008,Violent
6129915,03/10/2008 05:00:00 PM,OTHER OFFENSE,TELEPHONE THREAT,false,true,71,41.753681021,-87.648973107,2008-03-10T17:00:00.000+02:00,3,10,17,2008,Non-Violent
6079435,02/16/2008 10:01:00 PM,NARCOTICS,POSS: CANNABIS 30GMS OR LESS,true,false,25,41.904931589,-87.759736749,2008-02-16T22:01:00.000+02:00,2,16,22,2008,Non-Violent
6681333,12/19/2008 03:00:00 PM,CRIMINAL DAMAGE,TO VEHICLE,false,false,76,41.980967223,-87.844900486,2008-12-19T15:00:00.000+02:00,12,19,15,2008,Non-Violent
6103012,02/25/2008 09:00:00 AM,BURGLARY,FORCIBLE ENTRY,false,false,23,41.907164247,-87.722789264,2008-02-25T09:00:00.000+02:00,2,25,9,2008,Non-Violent
6046174,01/28/2008 01:15:00 PM,CRIMINAL TRESPASS,TO LAND,false,false,32,41.876295595,-87.63175265,2008-01-28T13:15:00.000+02:00,1,28,13,2008,Non-Violent
6626074,11/21/2008 09:00:00 PM,DECEPTIVE PRACTICE,CREDIT CARD FRAUD,false,false,3,41.960046783,-87.646762046,2008-11-21T21:00:00.000+02:00,11,21,21,2008,Non-Violent
6022829,01/08/2008 08:38:00 AM,NARCOTICS,MANU/DELIVER:CRACK,true,false,8,41.907092924,-87.639677552,2008-01-08T08:38:00.000+02:00,1,8,8,2008,Non-Violent
6152028,03/22/2008 11:41:46 PM,NARCOTICS,POSS: COCAINE,true,false,19,41.925289375,-87.742625149,2008-03-22T23:41:46.000+02:00,3,22,23,2008,Non-Violent
6676819,12/17/2008 12:00:00 AM,THEFT,$500 AND UNDER,false,false,7,41.932012618,-87.640940116,2008-12-17T00:00:00.000+02:00,12,17,0,2008,Non-Violent
6142201,03/18/2008 08:00:00 PM,CRIMINAL DAMAGE,TO PROPERTY,false,false,21,41.934448806,-87.724609278,2008-03-18T20:00:00.000+02:00,3,18,20,2008,Non-Violent
6668264,12/13/2008 07:40:00 PM,ROBBERY,STRONGARM - NO WEAPON,false,false,71,41.749869687,-87.665852691,2008-12-13T19:40:00.000+02:00,12,13,19,2008,Violent
6097718,02/25/2008 09:35:00 PM,BATTERY,DOMESTIC BATTERY SIMPLE,false,true,53,41.678960472,-87.645603207,2008-02-25T21:35:00.000+02:00,2,25,21,2008,Violent
6626886,11/24/2008 07:24:00 AM,ASSAULT,SIMPLE,false,true,23,41.896194201,-87.729806379,2008-11-24T07:24:00.000+02:00,11,24,7,2008,Violent
6045863,01/25/2008 05:48:00 AM,WEAPONS VIOLATION,UNLAWFUL USE OTHER DANG WEAPON,false,false,56,41.788987036,-87.74147999,2008-01-25T05:48:00.000+02:00,1,25,5,2008,Non-Violent
6631595,11/26/2008 04:30:00 PM,OTHER OFFENSE,OBSCENE TELEPHONE CALLS,false,false,36,41.819456039,-87.604352509,2008-11-26T16:30:00.000+02:00,11,26,16,2008,Non-Violent
6652036,12/05/2008 12:00:00 AM,OTHER OFFENSE,TELEPHONE THREAT,false,false,32,41.882748442,-87.632387132,2008-12-05T00:00:00.000+02:00,12,5,0,2008,Non-Violent
6029733,01/19/2008 12:30:00 PM,BATTERY,SIMPLE,false,false,43,41.756812461,-87.555422493,2008-01-19T12:30:00.000+02:00,1,19,12,2008,Violent
6675467,12/14/2008 03:00:00 PM,CRIMINAL DAMAGE,TO VEHICLE,false,false,49,41.713513709,-87.626057678,2008-12-14T15:00:00.000+02:00,12,14,15,2008,Non-Violent
6648392,11/15/2008 05:00:00 PM,BURGLARY,UNLAWFUL ENTRY,false,false,66,41.78102236,-87.687836289,2008-11-15T17:00:00.000+02:00,11,15,17,2008,Non-Violent
6006933,01/03/2008 11:50:00 PM,OTHER OFFENSE,VIOLATE ORDER OF PROTECTION,false,true,53,41.671934721,-87.636904422,2008-01-03T23:50:00.000+02:00,1,3,23,2008,Non-Violent
6012865,01/07/2008 11:29:00 PM,NARCOTICS,POSS: CRACK,true,false,25,41.885697091,-87.74883282,2008-01-07T23:29:00.000+02:00,1,7,23,2008,Non-Violent
6028318,01/17/2008 10:00:00 PM,BURGLARY,UNLAWFUL ENTRY,false,false,17,41.941387162,-87.81480899,2008-01-17T22:00:00.000+02:00,1,17,22,2008,Non-Violent
6685249,12/31/2008 11:40:00 PM,CRIMINAL TRESPASS,TO LAND,true,false,22,41.919863513,-87.692384042,2008-12-31T23:40:00.000+02:00,12,31,23,2008,Non-Violent
6077943,02/15/2008 04:23:00 PM,NARCOTICS,POSS: CANNABIS 30GMS OR LESS,true,false,23,41.910685962,-87.711697426,2008-02-15T16:23:00.000+02:00,2,15,16,2008,Non-Violent
6111533,03/01/2008 12:20:00 PM,BATTERY,DOMESTIC BATTERY SIMPLE,false,true,58,41.825556295,-87.693178787,2008-03-01T12:20:00.000+02:00,3,1,12,2008,Violent
6651101,12/08/2008 12:10:00 AM,BATTERY,AGGRAVATED: OTHER DANG WEAPON,false,false,32,,,2008-12-08T00:10:00.000+02:00,12,8,0,2008,Violent
6141481,03/12/2008 12:19:20 AM,NARCOTICS,MANU/DEL:CANNABIS OVER 10 GMS,true,false,67,41.7895617,-87.663237275,2008-03-12T00:19:20.000+02:00,3,12,0,2008,Non-Violent
6075269,02/14/2008 01:55:00 AM,BATTERY,DOMESTIC BATTERY SIMPLE,false,true,11,41.987439489,-87.770870101,2008-02-14T01:55:00.000+02:00,2,14,1,2008,Violent
6081873,02/09/2008 10:50:00 PM,NARCOTICS,FOUND SUSPECT NARCOTICS,true,false,7,41.924416977,-87.654791085,2008-02-09T22:50:00.000+02:00,2,9,22,2008,Non-Violent
6071353,02/11/2008 01:10:00 PM,THEFT,RETAIL THEFT,true,false,46,41.751821289,-87.559590955,2008-02-11T13:10:00.000+02:00,2,11,13,2008,Non-Violent
6636916,11/30/2008 10:50:00 AM,ROBBERY,ARMED: OTHER DANGEROUS WEAPON,false,false,67,41.762862598,-87.663731403,2008-11-30T10:50:00.000+02:00,11,30,10,2008,Violent
6643019,12/03/2008 08:00:00 PM,NARCOTICS,POSS: COCAINE,true,false,16,41.953816395,-87.715668018,2008-12-03T20:00:00.000+02:00,12,3,20,2008,Non-Violent
6657142,12/10/2008 11:00:00 PM,BURGLARY,FORCIBLE ENTRY,false,false,66,41.760194547,-87.679351098,2008-12-10T23:00:00.000+02:00,12,10,23,2008,Non-Violent
6681979,12/29/2008 06:45:00 PM,THEFT,RETAIL THEFT,true,false,32,41.882470918,-87.627847625,2008-12-29T18:45:00.000+02:00,12,29,18,2008,Non-Violent
6619537,11/19/2008 08:20:00 PM,SEX OFFENSE,PUBLIC INDECENCY,true,false,49,41.6889089,-87.626638453,2008-11-19T20:20:00.000+02:00,11,19,20,2008,Non-Violent
6653085,12/07/2008 03:20:00 PM,BATTERY,DOMESTIC BATTERY SIMPLE,true,true,16,41.950968994,-87.712817076,2008-12-07T15:20:00.000+02:00,12,7,15,2008,Violent
6064730,01/22/2008 03:00:00 PM,MOTOR VEHICLE THEFT,AUTOMOBILE,false,false,66,41.759162013,-87.683100073,2008-01-22T15:00:00.000+02:00,1,22,15,2008,Non-Violent
6092368,02/22/2008 11:30:00 PM,CRIMINAL DAMAGE,TO PROPERTY,false,false,58,41.813788084,-87.691076661,2008-02-22T23:30:00.000+02:00,2,22,23,2008,Non-Violent
6630570,11/26/2008 02:30:00 AM,BURGLARY,FORCIBLE ENTRY,false,false,24,41.895924701,-87.67620883,2008-11-26T02:30:00.000+02:00,11,26,2,2008,Non-Violent
6618935,11/19/2008 11:45:00 AM,NARCOTICS,POSS: CANNABIS 30GMS OR LESS,true,false,49,41.697624892,-87.620860102,2008-11-19T11:45:00.000+02:00,11,19,11,2008,Non-Violent
6673898,12/19/2008 08:52:06 PM,NARCOTICS,POSS: CANNABIS 30GMS OR LESS,true,false,26,41.877101586,-87.724437775,2008-12-19T20:52:06.000+02:00,12,19,20,2008,Non-Violent
6605902,11/11/2008 07:52:00 PM,THEFT,RETAIL THEFT,false,false,46,41.73327429,-87.55133578,2008-11-11T19:52:00.000+02:00,11,11,19,2008,Non-Violent
6612448,11/14/2008 10:39:00 PM,ROBBERY,ARMED: HANDGUN,true,false,58,41.816207928,-87.69936517,2008-11-14T22:39:00.000+02:00,11,14,22,2008,Violent
6163446,03/29/2008 03:31:00 PM,THEFT,RETAIL THEFT,false,false,44,41.736259984,-87.628068782,2008-03-29T15:31:00.000+02:00,3,29,15,2008,Non-Violent
6040795,01/25/2008 07:30:00 AM,BURGLARY,FORCIBLE ENTRY,false,false,30,41.84174108,-87.723264804,2008-01-25T07:30:00.000+02:00,1,25,7,2008,Non-Violent
6635221,11/26/2008 03:30:00 PM,BATTERY,DOMESTIC BATTERY SIMPLE,false,true,44,41.748372952,-87.61121479,2008-11-26T15:30:00.000+02:00,11,26,15,2008,Violent
6684989,12/30/2008 07:00:00 PM,MOTOR VEHICLE THEFT,AUTOMOBILE,false,false,61,41.802560898,-87.67454128,2008-12-30T19:00:00.000+02:00,12,30,19,2008,Non-Violent
6029703,01/18/2008 03:00:00 PM,BURGLARY,FORCIBLE ENTRY,false,false,61,41.793899439,-87.67589149,2008-01-18T15:00:00.000+02:00,1,18,15,2008,Non-Violent
6731854,09/30/2008 07:16:00 PM,NARCOTICS,ALTER/FORGE PRESCRIPTION,true,false,40,41.793883011,-87.622446424,2008-09-30T19:16:00.000+02:00,9,30,19,2008,Non-Violent
6665753,12/17/2008 10:45:00 PM,THEFT,$500 AND UNDER,false,false,25,41.880102253,-87.773762272,2008-12-17T22:45:00.000+02:00,12,17,22,2008,Non-Violent
6624244,11/21/2008 09:00:00 PM,OTHER OFFENSE,FALSE/STOLEN/ALTERED TRP,false,false,30,41.847994007,-87.718911196,2008-11-21T21:00:00.000+02:00,11,21,21,2008,Non-Violent
6662751,12/14/2008 11:50:00 AM,THEFT,$500 AND UNDER,false,false,49,41.699917513,-87.620153699,2008-12-14T11:50:00.000+02:00,12,14,11,2008,Non-Violent
6648829,12/07/2008 04:10:00 PM,THEFT,$500 AND UNDER,false,false,18,41.93446607,-87.799800336,2008-12-07T16:10:00.000+02:00,12,7,16,2008,Non-Violent
6139261,03/18/2008 12:00:00 AM,THEFT,OVER $500,false,false,2,41.997888171,-87.680440023,2008-03-18T00:00:00.000+02:00,3,18,0,2008,Non-Violent
6132327,03/13/2008 09:45:00 AM,THEFT,OVER $500,false,false,44,41.747646072,-87.60345414,2008-03-13T09:45:00.000+02:00,3,13,9,2008,Non-Violent
6628580,11/23/2008 11:54:00 AM,THEFT,$500 AND UNDER,false,false,66,41.782618691,-87.702504711,2008-11-23T11:54:00.000+02:00,11,23,11,2008,Non-Violent
6633632,11/27/2008 06:00:00 PM,BURGLARY,UNLAWFUL ENTRY,false,false,29,41.858516326,-87.707878665,2008-11-27T18:00:00.000+02:00,11,27,18,2008,Non-Violent
6677011,12/23/2008 06:15:00 PM,THEFT,FROM BUILDING,false,false,8,41.897895128,-87.624096605,2008-12-23T18:15:00.000+02:00,12,23,18,2008,Non-Violent
6623477,11/21/2008 07:20:00 PM,NARCOTICS,SOLICIT NARCOTICS ON PUBLICWAY,true,false,23,41.895558372,-87.705897593,2008-11-21T19:20:00.000+02:00,11,21,19,2008,Non-Violent
6024600,01/17/2008 03:55:00 AM,THEFT,RETAIL THEFT,false,false,66,41.77279778,-87.683468276,2008-01-17T03:55:00.000+02:00,1,17,3,2008,Non-Violent
6618720,11/11/2008 09:00:00 AM,NARCOTICS,FOUND SUSPECT NARCOTICS,true,false,29,41.868180939,-87.709271389,2008-11-11T09:00:00.000+02:00,11,11,9,2008,Non-Violent
6096213,02/24/2008 10:11:00 AM,BATTERY,SIMPLE,false,false,67,41.768489759,-87.669164134,2008-02-24T10:11:00.000+02:00,2,24,10,2008,Violent
6645876,11/26/2008 12:59:00 PM,GAMBLING,GAME/DICE,true,false,25,41.891379058,-87.745875882,2008-11-26T12:59:00.000+02:00,11,26,12,2008,Non-Violent
6071983,02/09/2008 01:30:00 PM,THEFT,RETAIL THEFT,false,false,7,41.910835515,-87.653351515,2008-02-09T13:30:00.000+02:00,2,9,13,2008,Non-Violent
6091694,02/22/2008 06:30:00 PM,CRIMINAL DAMAGE,CRIMINAL DEFACEMENT,false,false,24,41.901594544,-87.677212289,2008-02-22T18:30:00.000+02:00,2,22,18,2008,Non-Violent
6639006,12/01/2008 12:10:00 PM,BATTERY,DOMESTIC BATTERY SIMPLE,false,true,70,41.749099762,-87.695045665,2008-12-01T12:10:00.000+02:00,12,1,12,2008,Violent
6141937,03/19/2008 02:00:00 PM,THEFT,FROM BUILDING,false,false,32,41.884521087,-87.622099893,2008-03-19T14:00:00.000+02:00,3,19,14,2008,Non-Violent
6613429,11/13/2008 03:00:00 PM,THEFT,OVER $500,false,false,24,41.913331634,-87.682033618,2008-11-13T15:00:00.000+02:00,11,13,15,2008,Non-Violent
6031581,01/20/2008 08:30:00 PM,THEFT,OVER $500,false,false,24,41.900490912,-87.674736791,2008-01-20T20:30:00.000+02:00,1,20,20,2008,Non-Violent
6085924,02/15/2008 09:00:00 AM,OTHER OFFENSE,HARASSMENT BY TELEPHONE,false,false,42,41.774029105,-87.603353065,2008-02-15T09:00:00.000+02:00,2,15,9,2008,Non-Violent
6010124,01/09/2008 12:15:00 PM,CRIMINAL DAMAGE,TO PROPERTY,false,false,43,41.75375771,-87.552135344,2008-01-09T12:15:00.000+02:00,1,9,12,2008,Non-Violent
6626581,11/21/2008 07:00:00 AM,THEFT,$500 AND UNDER,false,false,27,41.87543874,-87.712171295,2008-11-21T07:00:00.000+02:00,11,21,7,2008,Non-Violent
6071015,02/11/2008 06:15:00 PM,OTHER OFFENSE,VIOLATE ORDER OF PROTECTION,true,true,23,41.905220225,-87.709311224,2008-02-11T18:15:00.000+02:00,2,11,18,2008,Non-Violent
6046678,01/20/2008 10:05:00 PM,BATTERY,DOMESTIC BATTERY SIMPLE,false,true,44,41.750359395,-87.600312091,2008-01-20T22:05:00.000+02:00,1,20,22,2008,Violent
6109062,02/29/2008 11:30:00 PM,BATTERY,SIMPLE,false,true,49,41.726544828,-87.629812553,2008-02-29T23:30:00.000+02:00,2,29,23,2008,Violent
6005167,01/07/2008 09:30:00 AM,BURGLARY,FORCIBLE ENTRY,false,false,68,41.792122921,-87.638428589,2008-01-07T09:30:00.000+02:00,1,7,9,2008,Non-Violent
6675296,12/24/2008 02:00:00 AM,MOTOR VEHICLE THEFT,AUTOMOBILE,true,false,34,41.856291443,-87.630191028,2008-12-24T02:00:00.000+02:00,12,24,2,2008,Non-Violent
6064051,01/28/2008 11:00:00 AM,THEFT,FINANCIAL ID THEFT: OVER $300,false,false,71,41.732025909,-87.639857068,2008-01-28T11:00:00.000+02:00,1,28,11,2008,Non-Violent
6621435,11/20/2008 04:27:00 PM,BATTERY,SIMPLE,true,false,49,41.694148281,-87.623150288,2008-11-20T16:27:00.000+02:00,11,20,16,2008,Violent
6141855,03/13/2008 12:20:00 PM,PROSTITUTION,SOLICIT ON PUBLIC WAY,true,false,26,41.879609452,-87.73850369,2008-03-13T12:20:00.000+02:00,3,13,12,2008,Non-Violent
6116286,03/05/2008 01:08:00 PM,THEFT,RETAIL THEFT,true,false,32,41.878222138,-87.627288482,2008-03-05T13:08:00.000+02:00,3,5,13,2008,Non-Violent
6052204,01/31/2008 07:39:00 PM,NARCOTICS,SOLICIT NARCOTICS ON PUBLICWAY,true,false,25,41.90467104,-87.774234735,2008-01-31T19:39:00.000+02:00,1,31,19,2008,Non-Violent
6606653,11/12/2008 04:00:00 PM,THEFT,OVER $500,false,false,28,41.874606843,-87.686256594,2008-11-12T16:00:00.000+02:00,11,12,16,2008,Non-Violent
6041746,01/26/2008 08:05:00 PM,NARCOTICS,POSSESSION OF DRUG EQUIPMENT,true,false,22,41.930654768,-87.710004181,2008-01-26T20:05:00.000+02:00,1,26,20,2008,Non-Violent
6064603,02/04/2008 06:36:00 AM,ROBBERY,ARMED: HANDGUN,false,false,53,41.678363085,-87.640722672,2008-02-04T06:36:00.000+02:00,2,4,6,2008,Violent
6012981,01/07/2008 08:00:00 AM,PROSTITUTION,SOLICIT ON PUBLIC WAY,true,false,67,41.78079961,-87.664252445,2008-01-07T08:00:00.000+02:00,1,7,8,2008,Non-Violent
6067992,02/09/2008 05:55:00 PM,ASSAULT,AGG PO HANDS NO/MIN INJURY,true,false,24,41.910698885,-87.694551457,2008-02-09T17:55:00.000+02:00,2,9,17,2008,Violent
6117592,03/03/2008 02:00:00 PM,THEFT,$500 AND UNDER,false,false,46,41.74548441,-87.551440472,2008-03-03T14:00:00.000+02:00,3,3,14,2008,Non-Violent
6683211,12/30/2008 12:25:00 PM,ASSAULT,AGGRAVATED:KNIFE/CUTTING INSTR,false,false,73,41.729323005,-87.665849285,2008-12-30T12:25:00.000+02:00,12,30,12,2008,Violent
6679691,12/27/2008 08:45:00 PM,BATTERY,AGGRAVATED DOMESTIC BATTERY: KNIFE/CUTTING INST,false,true,66,41.775034731,-87.683530015,2008-12-27T20:45:00.000+02:00,12,27,20,2008,Violent
6002862,01/05/2008 10:57:48 PM,PROSTITUTION,SOLICIT ON PUBLIC WAY,true,false,1,42.007894141,-87.6667091,2008-01-05T22:57:48.000+02:00,1,5,22,2008,Non-Violent
6614078,11/16/2008 04:50:00 PM,THEFT,RETAIL THEFT,true,false,28,41.864493678,-87.639158,2008-11-16T16:50:00.000+02:00,11,16,16,2008,Non-Violent
6665789,12/17/2008 06:00:00 PM,THEFT,$500 AND UNDER,false,false,66,41.775570564,-87.686571154,2008-12-17T18:00:00.000+02:00,12,17,18,2008,Non-Violent
6821364,08/25/2008 12:00:00 PM,THEFT,FINANCIAL ID THEFT: OVER $300,false,false,8,41.908668475,-87.627577615,2008-08-25T12:00:00.000+02:00,8,25,12,2008,Non-Violent
6139030,03/16/2008 01:00:00 PM,CRIMINAL DAMAGE,TO VEHICLE,false,true,25,41.914413176,-87.761437455,2008-03-16T13:00:00.000+02:00,3,16,13,2008,Non-Violent
6635422,11/29/2008 05:00:00 PM,DECEPTIVE PRACTICE,THEFT OF LABOR/SERVICES,true,false,8,41.896888586,-87.628203192,2008-11-29T17:00:00.000+02:00,11,29,17,2008,Non-Violent
6628431,11/25/2008 01:30:34 AM,CRIMINAL DAMAGE,TO PROPERTY,false,true,45,41.754234523,-87.594341856,2008-11-25T01:30:34.000+02:00,11,25,1,2008,Non-Violent
6677184,12/25/2008 05:05:00 PM,OTHER OFFENSE,VIOLATE ORDER OF PROTECTION,true,true,29,41.856040975,-87.732547984,2008-12-25T17:05:00.000+02:00,12,25,17,2008,Non-Violent
6113985,01/03/2008 08:00:00 AM,DECEPTIVE PRACTICE,ILLEGAL USE CASH CARD,false,false,8,41.903775756,-87.639324074,2008-01-03T08:00:00.000+02:00,1,3,8,2008,Non-Violent
6155435,03/26/2008 02:00:00 PM,BATTERY,AGGRAVATED: OTHER DANG WEAPON,false,false,30,41.853225404,-87.702861177,2008-03-26T14:00:00.000+02:00,3,26,14,2008,Violent
6604548,11/10/2008 07:39:34 PM,OTHER OFFENSE,TELEPHONE THREAT,false,false,2,42.003782014,-87.690041337,2008-11-10T19:39:34.000+02:00,11,10,19,2008,Non-Violent
6658589,12/10/2008 06:41:44 PM,BATTERY,DOMESTIC BATTERY SIMPLE,false,true,22,41.923258751,-87.703406834,2008-12-10T18:41:44.000+02:00,12,10,18,2008,Violent
6678261,12/03/2008 12:01:00 AM,THEFT,FROM BUILDING,false,false,58,41.823636097,-87.69776932,2008-12-03T00:01:00.000+02:00,12,3,0,2008,Non-Violent
6620192,11/20/2008 02:30:00 AM,BATTERY,DOMESTIC BATTERY SIMPLE,false,true,36,41.826142757,-87.606349642,2008-11-20T02:30:00.000+02:00,11,20,2,2008,Violent
6084604,02/13/2008 08:55:00 PM,PROSTITUTION,SOLICIT ON PUBLIC WAY,true,false,67,41.786275228,-87.664382519,2008-02-13T20:55:00.000+02:00,2,13,20,2008,Non-Violent
6085211,02/13/2008 08:41:00 PM,STALKING,CYBERSTALKING,false,false,3,41.97002338,-87.656241512,2008-02-13T20:41:00.000+02:00,2,13,20,2008,Non-Violent
6030427,01/20/2008 07:00:00 PM,OTHER OFFENSE,HARASSMENT BY TELEPHONE,false,true,73,41.725926434,-87.660356528,2008-01-20T19:00:00.000+02:00,1,20,19,2008,Non-Violent
6010250,01/04/2008 10:33:00 PM,NARCOTICS,POSS: CANNABIS 30GMS OR LESS,true,false,69,41.754438845,-87.60528294,2008-01-04T22:33:00.000+02:00,1,4,22,2008,Non-Violent
6625024,11/22/2008 11:35:54 PM,CRIMINAL DAMAGE,TO PROPERTY,false,true,38,41.806930371,-87.624392906,2008-11-22T23:35:54.000+02:00,11,22,23,2008,Non-Violent
6124244,03/06/2008 05:00:00 PM,BATTERY,SIMPLE,false,false,31,41.852979389,-87.683828168,2008-03-06T17:00:00.000+02:00,3,6,17,2008,Violent
6612488,11/15/2008 07:00:00 PM,BURGLARY,FORCIBLE ENTRY,false,false,58,41.812679591,-87.698020707,2008-11-15T19:00:00.000+02:00,11,15,19,2008,Non-Violent
6652800,12/09/2008 08:00:00 PM,CRIMINAL DAMAGE,TO VEHICLE,false,false,19,41.917591853,-87.747454289,2008-12-09T20:00:00.000+02:00,12,9,20,2008,Non-Violent
6078486,01/30/2008 10:15:00 AM,NARCOTICS,POSS: CANNABIS 30GMS OR LESS,true,false,61,41.807650669,-87.643080489,2008-01-30T10:15:00.000+02:00,1,30,10,2008,Non-Violent
6152640,03/19/2008 03:30:00 PM,BATTERY,DOMESTIC BATTERY SIMPLE,false,true,67,41.768052673,-87.655411299,2008-03-19T15:30:00.000+02:00,3,19,15,2008,Violent
6629347,11/24/2008 05:00:00 PM,BATTERY,DOMESTIC BATTERY SIMPLE,false,true,71,41.751935361,-87.648925684,2008-11-24T17:00:00.000+02:00,11,24,17,2008,Violent
6139272,03/17/2008 03:00:00 PM,THEFT,$500 AND UNDER,false,false,61,41.803926265,-87.677674213,2008-03-17T15:00:00.000+02:00,3,17,15,2008,Non-Violent
6623488,11/21/2008 01:00:00 PM,THEFT,$500 AND UNDER,false,false,16,41.942216025,-87.728968248,2008-11-21T13:00:00.000+02:00,11,21,13,2008,Non-Violent
6656417,12/01/2008 08:30:00 AM,THEFT,OVER $500,false,false,24,41.911575966,-87.670159068,2008-12-01T08:30:00.000+02:00,12,1,8,2008,Non-Violent
6681572,12/29/2008 11:15:00 PM,NARCOTICS,POSS: CANNABIS 30GMS OR LESS,true,false,23,41.902800545,-87.709951916,2008-12-29T23:15:00.000+02:00,12,29,23,2008,Non-Violent
6638644,12/01/2008 09:00:00 AM,OTHER OFFENSE,HARASSMENT BY TELEPHONE,false,false,25,41.893580201,-87.760594937,2008-12-01T09:00:00.000+02:00,12,1,9,2008,Non-Violent
6654607,12/04/2008 10:00:00 PM,THEFT,FROM BUILDING,false,false,77,41.988008918,-87.655322651,2008-12-04T22:00:00.000+02:00,12,4,22,2008,Non-Violent
6055014,01/30/2008 03:30:00 PM,THEFT,$500 AND UNDER,false,false,28,41.878556485,-87.664342629,2008-01-30T15:30:00.000+02:00,1,30,15,2008,Non-Violent
6073536,02/10/2008 12:30:00 AM,BATTERY,DOMESTIC BATTERY SIMPLE,false,true,19,41.930948469,-87.789958559,2008-02-10T00:30:00.000+02:00,2,10,0,2008,Violent
6026460,01/17/2008 01:55:00 PM,THEFT,OVER $500,false,false,33,41.86661375,-87.62413407,2008-01-17T13:55:00.000+02:00,1,17,13,2008,Non-Violent
6150468,03/11/2008 02:20:00 PM,THEFT,FROM BUILDING,true,false,76,41.976290414,-87.905227221,2008-03-11T14:20:00.000+02:00,3,11,14,2008,Non-Violent
6680767,12/29/2008 11:30:00 AM,NARCOTICS,POSS: CANNABIS 30GMS OR LESS,true,false,68,41.764762794,-87.654108023,2008-12-29T11:30:00.000+02:00,12,29,11,2008,Non-Violent
6649494,12/04/2008 08:30:00 PM,BATTERY,DOMESTIC BATTERY SIMPLE,true,true,7,41.922307379,-87.659571926,2008-12-04T20:30:00.000+02:00,12,4,20,2008,Violent
6651054,12/08/2008 10:46:29 AM,ASSAULT,SIMPLE,false,false,40,41.80215809,-87.612052585,2008-12-08T10:46:29.000+02:00,12,8,10,2008,Violent
6082234,02/18/2008 12:01:00 AM,THEFT,OVER $500,false,false,31,41.85834606,-87.640894724,2008-02-18T00:01:00.000+02:00,2,18,0,2008,Non-Violent
6071222,02/11/2008 08:52:00 PM,BATTERY,DOMESTIC BATTERY SIMPLE,false,true,51,41.718306946,-87.553777242,2008-02-11T20:52:00.000+02:00,2,11,20,2008,Violent
6029726,01/19/2008 12:00:00 PM,BATTERY,SIMPLE,false,true,43,41.754899052,-87.562658189,2008-01-19T12:00:00.000+02:00,1,19,12,2008,Violent
6130102,03/09/2008 08:00:00 AM,CRIMINAL DAMAGE,CRIMINAL DEFACEMENT,false,false,56,41.790754583,-87.739927261,2008-03-09T08:00:00.000+02:00,3,9,8,2008,Non-Violent
6937503,12/01/2008 05:00:00 PM,DECEPTIVE PRACTICE,COUNTERFEIT CHECK,false,false,22,41.917538631,-87.66722041,2008-12-01T17:00:00.000+02:00,12,1,17,2008,Non-Violent
6843058,03/20/2008 08:20:00 PM,PROSTITUTION,SOLICIT ON PUBLIC WAY,true,false,25,41.887155543,-87.77050932,2008-03-20T20:20:00.000+02:00,3,20,20,2008,Non-Violent
6027282,01/12/2008 11:24:33 PM,CRIMINAL DAMAGE,TO PROPERTY,true,false,44,41.750832464,-87.605224746,2008-01-12T23:24:33.000+02:00,1,12,23,2008,Non-Violent
6004117,01/03/2008 10:49:00 PM,NARCOTICS,POSS: BARBITUATES,true,false,3,41.965943826,-87.657821704,2008-01-03T22:49:00.000+02:00,1,3,22,2008,Non-Violent
6013440,01/05/2008 12:10:00 PM,NARCOTICS,POSS: HEROIN(WHITE),true,false,29,41.86422646,-87.71535996,2008-01-05T12:10:00.000+02:00,1,5,12,2008,Non-Violent
6890184,04/01/2008 02:00:00 PM,DECEPTIVE PRACTICE,FRAUD OR CONFIDENCE GAME,false,false,35,41.83442931,-87.629072664,2008-04-01T14:00:00.000+02:00,4,1,14,2008,Non-Violent
6082626,02/18/2008 12:00:00 PM,ASSAULT,SIMPLE,false,false,61,41.807839776,-87.653623841,2008-02-18T12:00:00.000+02:00,2,18,12,2008,Violent
6080738,02/17/2008 01:00:00 AM,THEFT,FROM BUILDING,false,false,30,41.851961298,-87.691153739,2008-02-17T01:00:00.000+02:00,2,17,1,2008,Non-Violent
6039119,01/21/2008 05:55:32 PM,NARCOTICS,POSS: CRACK,true,false,25,41.896787129,-87.751100826,2008-01-21T17:55:32.000+02:00,1,21,17,2008,Non-Violent
6015781,01/13/2008 12:01:00 AM,CRIMINAL DAMAGE,TO PROPERTY,false,false,17,41.935397939,-87.807878166,2008-01-13T00:01:00.000+02:00,1,13,0,2008,Non-Violent
6044139,01/27/2008 11:20:00 AM,THEFT,$500 AND UNDER,false,false,67,41.780812461,-87.657073463,2008-01-27T11:20:00.000+02:00,1,27,11,2008,Non-Violent
6069512,01/24/2008 10:45:00 PM,NARCOTICS,POSS: CANNABIS 30GMS OR LESS,true,false,30,41.85437045,-87.695530713,2008-01-24T22:45:00.000+02:00,1,24,22,2008,Non-Violent
6052804,02/01/2008 01:45:00 AM,BURGLARY,UNLAWFUL ENTRY,false,false,66,41.769439636,-87.684594571,2008-02-01T01:45:00.000+02:00,2,1,1,2008,Non-Violent
6143540,03/16/2008 12:59:00 AM,NARCOTICS,POSS: CANNABIS 30GMS OR LESS,true,false,15,41.93975219,-87.776266024,2008-03-16T00:59:00.000+02:00,3,16,0,2008,Non-Violent
6070342,02/09/2008 08:00:00 PM,CRIMINAL TRESPASS,TO STATE SUP LAND,true,false,11,41.97008868,-87.762690091,2008-02-09T20:00:00.000+02:00,2,9,20,2008,Non-Violent
6088265,02/16/2008 12:20:00 PM,NARCOTICS,POSS: CANNABIS 30GMS OR LESS,true,false,66,41.785950308,-87.693580269,2008-02-16T12:20:00.000+02:00,2,16,12,2008,Non-Violent
6062565,01/21/2008 01:30:00 PM,NARCOTICS,POSSESSION OF DRUG EQUIPMENT,true,false,26,41.885487535,-87.726422045,2008-01-21T13:30:00.000+02:00,1,21,13,2008,Non-Violent
6100958,02/26/2008 07:36:00 PM,CRIMINAL TRESPASS,TO VEHICLE,true,false,42,41.777967289,-87.615568353,2008-02-26T19:36:00.000+02:00,2,26,19,2008,Non-Violent
6046726,01/28/2008 10:49:01 PM,ROBBERY,ARMED: HANDGUN,false,false,1,42.002543011,-87.661536927,2008-01-28T22:49:01.000+02:00,1,28,22,2008,Violent
6011602,01/10/2008 11:10:00 AM,BATTERY,DOMESTIC BATTERY SIMPLE,false,true,27,41.872769292,-87.706744706,2008-01-10T11:10:00.000+02:00,1,10,11,2008,Violent
6015712,01/11/2008 05:00:00 PM,CRIMINAL DAMAGE,TO VEHICLE,false,false,17,41.949269832,-87.812057907,2008-01-11T17:00:00.000+02:00,1,11,17,2008,Non-Violent
6089843,02/20/2008 02:30:00 PM,BATTERY,SIMPLE,false,false,49,41.6889089,-87.626638453,2008-02-20T14:30:00.000+02:00,2,20,14,2008,Violent
6093996,02/22/2008 11:08:04 PM,OTHER OFFENSE,VIOLATE ORDER OF PROTECTION,false,true,25,41.875839302,-87.748206639,2008-02-22T23:08:04.000+02:00,2,22,23,2008,Non-Violent
6084114,02/12/2008 09:00:00 AM,NARCOTICS,POSS: HALLUCINOGENS,true,false,29,,,2008-02-12T09:00:00.000+02:00,2,12,9,2008,Non-Violent
6140441,02/29/2008 09:00:00 AM,DECEPTIVE PRACTICE,FRAUD OR CONFIDENCE GAME,false,false,6,41.948547685,-87.647995608,2008-02-29T09:00:00.000+02:00,2,29,9,2008,Non-Violent
6143291,03/12/2008 07:36:00 PM,NARCOTICS,POSS: COCAINE,true,false,10,42.000956065,-87.794620691,2008-03-12T19:36:00.000+02:00,3,12,19,2008,Non-Violent
6120841,03/08/2008 05:06:00 AM,BATTERY,SIMPLE,false,false,71,41.755144913,-87.660322589,2008-03-08T05:06:00.000+02:00,3,8,5,2008,Violent
6154121,03/25/2008 12:15:00 AM,BATTERY,DOMESTIC BATTERY SIMPLE,false,true,14,41.963005652,-87.708869019,2008-03-25T00:15:00.000+02:00,3,25,0,2008,Violent
6101470,02/25/2008 08:07:00 AM,ASSAULT,AGGRAVATED: HANDGUN,true,false,49,41.724560863,-87.617840828,2008-02-25T08:07:00.000+02:00,2,25,8,2008,Violent
6106275,02/25/2008 08:45:33 PM,NARCOTICS,POSS: CRACK,true,false,61,41.795016094,-87.653682341,2008-02-25T20:45:33.000+02:00,2,25,20,2008,Non-Violent
6075362,02/04/2008 07:45:00 PM,MOTOR VEHICLE THEFT,AUTOMOBILE,true,false,30,41.838985449,-87.708894577,2008-02-04T19:45:00.000+02:00,2,4,19,2008,Non-Violent
6013551,01/07/2008 09:15:00 PM,SEX OFFENSE,CRIMINAL SEXUAL ABUSE,false,false,68,41.762853861,-87.649205529,2008-01-07T21:15:00.000+02:00,1,7,21,2008,Non-Violent
6092059,02/21/2008 07:00:00 PM,BURGLARY,FORCIBLE ENTRY,false,false,72,41.706396318,-87.679585308,2008-02-21T19:00:00.000+02:00,2,21,19,2008,Non-Violent
6100831,02/25/2008 03:40:00 PM,NARCOTICS,POSS: HEROIN(WHITE),true,false,29,41.868302359,-87.698876423,2008-02-25T15:40:00.000+02:00,2,25,15,2008,Non-Violent
6114909,02/28/2008 08:20:00 PM,PROSTITUTION,SOLICIT ON PUBLIC WAY,true,false,27,41.881044465,-87.699473802,2008-02-28T20:20:00.000+02:00,2,28,20,2008,Non-Violent
6027387,01/09/2008 06:00:00 PM,CRIMINAL DAMAGE,TO PROPERTY,false,false,14,41.971027977,-87.720771352,2008-01-09T18:00:00.000+02:00,1,9,18,2008,Non-Violent
6121115,03/08/2008 08:32:40 PM,CRIM SEXUAL ASSAULT,NON-AGGRAVATED,false,false,43,41.753602854,-87.554387446,2008-03-08T20:32:40.000+02:00,3,8,20,2008,Non-Violent
6061688,02/05/2008 09:00:00 PM,MOTOR VEHICLE THEFT,ATT: AUTOMOBILE,false,false,72,41.734588252,-87.671829033,2008-02-05T21:00:00.000+02:00,2,5,21,2008,Non-Violent
6077459,02/14/2008 06:15:00 AM,CRIMINAL TRESPASS,TO LAND,false,false,32,41.879365171,-87.635604099,2008-02-14T06:15:00.000+02:00,2,14,6,2008,Non-Violent
6124323,03/10/2008 10:00:00 AM,BATTERY,DOMESTIC BATTERY SIMPLE,false,true,62,41.787856019,-87.716372635,2008-03-10T10:00:00.000+02:00,3,10,10,2008,Violent
6015732,01/12/2008 12:00:00 PM,ROBBERY,ARMED:KNIFE/CUTTING INSTRUMENT,false,false,29,41.852170919,-87.734525894,2008-01-12T12:00:00.000+02:00,1,12,12,2008,Violent
6008504,01/09/2008 01:15:00 PM,THEFT,OVER $500,false,false,22,41.929644221,-87.684131464,2008-01-09T13:15:00.000+02:00,1,9,13,2008,Non-Violent
6128568,03/11/2008 06:30:00 PM,BATTERY,SIMPLE,false,false,21,41.933039398,-87.719664929,2008-03-11T18:30:00.000+02:00,3,11,18,2008,Violent
6051353,01/27/2008 09:51:33 PM,NARCOTICS,POSS: CANNABIS 30GMS OR LESS,true,false,49,41.696233835,-87.62268429,2008-01-27T21:51:33.000+02:00,1,27,21,2008,Non-Violent
6123781,03/01/2008 12:30:00 PM,CRIMINAL DAMAGE,TO PROPERTY,false,false,68,41.788999312,-87.638781344,2008-03-01T12:30:00.000+02:00,3,1,12,2008,Non-Violent
6032116,01/18/2008 01:00:00 PM,THEFT,OVER $500,false,true,67,41.779428613,-87.665865222,2008-01-18T13:00:00.000+02:00,1,18,13,2008,Non-Violent
6109183,03/02/2008 01:15:00 PM,NARCOTICS,POSS: HEROIN(WHITE),true,false,23,41.901821059,-87.720184345,2008-03-02T13:15:00.000+02:00,3,2,13,2008,Non-Violent
6156611,03/26/2008 04:30:00 AM,WEAPONS VIOLATION,UNLAWFUL POSS OF HANDGUN,true,false,50,41.686476228,-87.607078439,2008-03-26T04:30:00.000+02:00,3,26,4,2008,Non-Violent
6146500,03/21/2008 02:38:04 PM,ROBBERY,ARMED: OTHER FIREARM,false,false,61,41.80756389,-87.669802392,2008-03-21T14:38:04.000+02:00,3,21,14,2008,Violent
6059160,02/05/2008 02:12:45 AM,PUBLIC PEACE VIOLATION,RECKLESS CONDUCT,true,false,23,41.8899055,-87.721715953,2008-02-05T02:12:45.000+02:00,2,5,2,2008,Non-Violent
6007218,01/08/2008 01:50:00 PM,BURGLARY,FORCIBLE ENTRY,false,false,53,41.664764882,-87.629431473,2008-01-08T13:50:00.000+02:00,1,8,13,2008,Non-Violent
6044426,01/23/2008 08:00:00 PM,CRIMINAL DAMAGE,CRIMINAL DEFACEMENT,true,false,30,41.85437045,-87.695530713,2008-01-23T20:00:00.000+02:00,1,23,20,2008,Non-Violent
6060995,02/05/2008 09:15:00 AM,BURGLARY,FORCIBLE ENTRY,false,false,18,41.933193465,-87.802916439,2008-02-05T09:15:00.000+02:00,2,5,9,2008,Non-Violent
6052825,02/01/2008 01:26:17 AM,BATTERY,SIMPLE,false,false,15,41.945591853,-87.747047289,2008-02-01T01:26:17.000+02:00,2,1,1,2008,Violent
6147531,03/22/2008 11:01:51 AM,THEFT,$500 AND UNDER,false,false,25,41.880362084,-87.755847438,2008-03-22T11:01:51.000+02:00,3,22,11,2008,Non-Violent
6119820,03/07/2008 09:00:00 PM,BATTERY,SIMPLE,false,false,24,41.898352272,-87.700445018,2008-03-07T21:00:00.000+02:00,3,7,21,2008,Violent
6129475,03/12/2008 08:15:00 PM,CRIMINAL TRESPASS,TO LAND,true,false,46,41.744647338,-87.552238463,2008-03-12T20:15:00.000+02:00,3,12,20,2008,Non-Violent
6029443,01/18/2008 04:00:00 PM,CRIMINAL DAMAGE,TO VEHICLE,false,false,24,41.892475257,-87.663396735,2008-01-18T16:00:00.000+02:00,1,18,16,2008,Non-Violent
6114147,02/12/2008 06:47:00 PM,DECEPTIVE PRACTICE,CREDIT CARD FRAUD,true,false,6,41.932837533,-87.643037034,2008-02-12T18:47:00.000+02:00,2,12,18,2008,Non-Violent
6160454,03/28/2008 12:15:00 AM,ROBBERY,ARMED: HANDGUN,false,false,44,41.750773621,-87.634642001,2008-03-28T00:15:00.000+02:00,3,28,0,2008,Violent
6043260,01/27/2008 03:00:00 AM,THEFT,OVER $500,false,false,19,41.928203725,-87.779512185,2008-01-27T03:00:00.000+02:00,1,27,3,2008,Non-Violent
6159669,03/28/2008 03:30:00 PM,BURGLARY,FORCIBLE ENTRY,false,false,24,41.905880796,-87.683442859,2008-03-28T15:30:00.000+02:00,3,28,15,2008,Non-Violent
6007933,01/08/2008 11:27:59 AM,THEFT,RETAIL THEFT,true,false,1,42.019399237,-87.675049485,2008-01-08T11:27:59.000+02:00,1,8,11,2008,Non-Violent
6159860,03/27/2008 01:30:00 PM,ASSAULT,SIMPLE,false,false,6,41.94514262,-87.67051707,2008-03-27T13:30:00.000+02:00,3,27,13,2008,Violent
6027977,01/14/2008 07:00:00 PM,CRIMINAL DAMAGE,TO PROPERTY,false,false,17,41.954966547,-87.78662598,2008-01-14T19:00:00.000+02:00,1,14,19,2008,Non-Violent
6157146,03/27/2008 12:01:00 AM,THEFT,$500 AND UNDER,false,false,25,41.903351739,-87.761003529,2008-03-27T00:01:00.000+02:00,3,27,0,2008,Non-Violent
6161314,03/28/2008 10:00:00 AM,THEFT,$500 AND UNDER,false,false,2,42.001834607,-87.69365174,2008-03-28T10:00:00.000+02:00,3,28,10,2008,Non-Violent
6158113,03/14/2008 11:30:00 AM,NARCOTICS,MANU/DELIVER: HEROIN (WHITE),true,false,29,41.860222864,-87.72621682,2008-03-14T11:30:00.000+02:00,3,14,11,2008,Non-Violent
6092641,02/22/2008 07:33:00 AM,BATTERY,SIMPLE,false,false,11,41.977043475,-87.76899404,2008-02-22T07:33:00.000+02:00,2,22,7,2008,Violent
6000419,01/05/2008 03:31:36 PM,DECEPTIVE PRACTICE,FRAUD OR CONFIDENCE GAME,false,false,48,41.726955185,-87.581506806,2008-01-05T15:31:36.000+02:00,1,5,15,2008,Non-Violent
6115519,03/05/2008 01:30:00 AM,THEFT,$500 AND UNDER,false,false,22,41.921497276,-87.671746597,2008-03-05T01:30:00.000+02:00,3,5,1,2008,Non-Violent
6055296,02/02/2008 03:40:00 PM,ROBBERY,ARMED: OTHER DANGEROUS WEAPON,false,false,44,41.750549448,-87.621370913,2008-02-02T15:40:00.000+02:00,2,2,15,2008,Violent
6032531,01/20/2008 12:17:44 PM,NARCOTICS,POSS: HEROIN(WHITE),true,false,25,41.875874651,-87.745456097,2008-01-20T12:17:44.000+02:00,1,20,12,2008,Non-Violent
6089638,02/17/2008 10:10:00 PM,PUBLIC PEACE VIOLATION,RECKLESS CONDUCT,true,false,46,41.750585257,-87.578401993,2008-02-17T22:10:00.000+02:00,2,17,22,2008,Non-Violent
6096325,02/23/2008 10:00:00 PM,CRIMINAL DAMAGE,TO VEHICLE,false,true,71,41.747903314,-87.648814601,2008-02-23T22:00:00.000+02:00,2,23,22,2008,Non-Violent
6131199,03/13/2008 07:00:00 PM,BATTERY,SIMPLE,false,false,66,41.771428143,-87.683427113,2008-03-13T19:00:00.000+02:00,3,13,19,2008,Violent
6090741,02/20/2008 03:10:00 PM,BATTERY,SIMPLE,false,false,71,41.755557363,-87.650228588,2008-02-20T15:10:00.000+02:00,2,20,15,2008,Violent
6029852,01/19/2008 06:30:00 AM,CRIMINAL DAMAGE,TO PROPERTY,false,true,52,41.705575034,-87.532870156,2008-01-19T06:30:00.000+02:00,1,19,6,2008,Non-Violent
6008890,01/09/2008 05:20:00 PM,MOTOR VEHICLE THEFT,AUTOMOBILE,false,false,23,41.907660661,-87.706939981,2008-01-09T17:20:00.000+02:00,1,9,17,2008,Non-Violent
6038470,01/23/2008 06:40:00 PM,NARCOTICS,POSS: CRACK,true,false,68,41.791475948,-87.646297679,2008-01-23T18:40:00.000+02:00,1,23,18,2008,Non-Violent
6108363,03/01/2008 08:17:00 PM,BATTERY,AGGRAVATED DOMESTIC BATTERY: OTHER DANG WEAPON,false,true,73,41.72991452,-87.660457782,2008-03-01T20:17:00.000+02:00,3,1,20,2008,Violent
6063468,02/06/2008 11:04:27 AM,BATTERY,AGGRAVATED: OTHER DANG WEAPON,true,false,23,41.889905429,-87.720158748,2008-02-06T11:04:27.000+02:00,2,6,11,2008,Violent
6107723,01/09/2008 01:30:00 PM,ASSAULT,SIMPLE,false,false,40,41.788896709,-87.615835136,2008-01-09T13:30:00.000+02:00,1,9,13,2008,Violent
6144823,03/19/2008 11:00:00 PM,BATTERY,DOMESTIC BATTERY SIMPLE,false,true,38,41.803362326,-87.619440499,2008-03-19T23:00:00.000+02:00,3,19,23,2008,Violent
6037236,01/22/2008 11:30:00 AM,BATTERY,SIMPLE,false,false,67,41.781142124,-87.675567181,2008-01-22T11:30:00.000+02:00,1,22,11,2008,Violent
6101103,02/26/2008 05:10:00 PM,BURGLARY,FORCIBLE ENTRY,false,false,43,41.760142627,-87.562133631,2008-02-26T17:10:00.000+02:00,2,26,17,2008,Non-Violent
6034490,01/21/2008 03:00:00 PM,BATTERY,SIMPLE,false,false,49,41.686967145,-87.627732401,2008-01-21T15:00:00.000+02:00,1,21,15,2008,Violent
6001421,01/06/2008 10:30:00 PM,OTHER OFFENSE,TELEPHONE THREAT,false,false,63,41.790929505,-87.704707774,2008-01-06T22:30:00.000+02:00,1,6,22,2008,Non-Violent
5996866,01/02/2008 11:10:52 PM,NARCOTICS,POSS: CANNABIS 30GMS OR LESS,true,false,61,41.803248055,-87.656786249,2008-01-02T23:10:52.000+02:00,1,2,23,2008,Non-Violent
6150426,03/24/2008 07:00:00 AM,THEFT,OVER $500,false,false,24,41.889983415,-87.65776321,2008-03-24T07:00:00.000+02:00,3,24,7,2008,Non-Violent
6150347,03/23/2008 12:01:00 AM,THEFT,OVER $500,false,false,33,41.859794359,-87.622370293,2008-03-23T00:01:00.000+02:00,3,23,0,2008,Non-Violent
6079461,02/17/2008 02:00:00 AM,OTHER OFFENSE,TELEPHONE THREAT,false,false,65,41.763243361,-87.715017681,2008-02-17T02:00:00.000+02:00,2,17,2,2008,Non-Violent
5999500,01/03/2008 12:00:00 PM,THEFT,OVER $500,false,false,1,42.019372548,-87.670887574,2008-01-03T12:00:00.000+02:00,1,3,12,2008,Non-Violent
6094962,02/23/2008 01:40:00 AM,BATTERY,DOMESTIC BATTERY SIMPLE,false,true,71,41.738557556,-87.666783255,2008-02-23T01:40:00.000+02:00,2,23,1,2008,Violent
6031592,01/18/2008 07:00:00 AM,CRIMINAL DAMAGE,TO PROPERTY,false,false,56,41.797400109,-87.762445968,2008-01-18T07:00:00.000+02:00,1,18,7,2008,Non-Violent
6082558,02/18/2008 09:45:00 AM,CRIMINAL DAMAGE,TO PROPERTY,false,false,48,41.732496529,-87.569527961,2008-02-18T09:45:00.000+02:00,2,18,9,2008,Non-Violent
6010009,01/09/2008 06:00:00 PM,BATTERY,SIMPLE,false,false,29,41.854804982,-87.729725811,2008-01-09T18:00:00.000+02:00,1,9,18,2008,Violent
6092580,02/14/2008 02:03:54 AM,NARCOTICS,POSS: CRACK,true,false,69,41.752636208,-87.63496263,2008-02-14T02:03:54.000+02:00,2,14,2,2008,Non-Violent
6030862,01/20/2008 07:30:00 PM,MOTOR VEHICLE THEFT,AUTOMOBILE,false,false,38,41.806849923,-87.621147701,2008-01-20T19:30:00.000+02:00,1,20,19,2008,Non-Violent
6153480,03/25/2008 08:57:34 PM,BATTERY,SIMPLE,false,false,43,41.755134088,-87.584927274,2008-03-25T20:57:34.000+02:00,3,25,20,2008,Violent
6081865,02/18/2008 01:50:00 AM,BATTERY,DOMESTIC BATTERY SIMPLE,true,true,48,41.732821527,-87.585560041,2008-02-18T01:50:00.000+02:00,2,18,1,2008,Violent
5995989,01/02/2008 05:45:00 PM,NARCOTICS,POSS: CANNABIS 30GMS OR LESS,true,false,36,41.825756866,-87.60781793,2008-01-02T17:45:00.000+02:00,1,2,17,2008,Non-Violent
6015951,01/09/2008 05:59:00 PM,NARCOTICS,POSS: HEROIN(WHITE),true,false,34,41.85268013,-87.632007113,2008-01-09T17:59:00.000+02:00,1,9,17,2008,Non-Violent
6148170,03/22/2008 03:00:00 PM,OTHER OFFENSE,HARASSMENT BY TELEPHONE,false,true,44,41.747646072,-87.60345414,2008-03-22T15:00:00.000+02:00,3,22,15,2008,Non-Violent
6030875,01/19/2008 02:00:00 PM,DECEPTIVE PRACTICE,FRAUD OR CONFIDENCE GAME,false,false,59,41.827801336,-87.677650799,2008-01-19T14:00:00.000+02:00,1,19,14,2008,Non-Violent
6030672,01/20/2008 03:45:00 AM,ARSON,BY FIRE,false,false,49,41.706522494,-87.617407307,2008-01-20T03:45:00.000+02:00,1,20,3,2008,Non-Violent
6111207,03/03/2008 07:16:26 PM,CRIMINAL TRESPASS,TO RESIDENCE,true,false,38,41.803140971,-87.608197825,2008-03-03T19:16:26.000+02:00,3,3,19,2008,Non-Violent
6032691,01/17/2008 05:50:00 PM,OTHER OFFENSE,HARASSMENT BY TELEPHONE,false,true,49,41.689497215,-87.632632763,2008-01-17T17:50:00.000+02:00,1,17,17,2008,Non-Violent
6036865,01/23/2008 11:00:00 AM,BURGLARY,FORCIBLE ENTRY,false,false,75,41.678723865,-87.669776785,2008-01-23T11:00:00.000+02:00,1,23,11,2008,Non-Violent
6084666,02/19/2008 11:45:00 AM,OTHER OFFENSE,TELEPHONE THREAT,false,false,57,41.797521225,-87.731862625,2008-02-19T11:45:00.000+02:00,2,19,11,2008,Non-Violent
6142469,03/18/2008 04:45:00 PM,BURGLARY,FORCIBLE ENTRY,false,false,17,41.942552803,-87.804437797,2008-03-18T16:45:00.000+02:00,3,18,16,2008,Non-Violent
6066608,02/08/2008 05:20:00 PM,BATTERY,AGGRAVATED:KNIFE/CUTTING INSTR,false,false,3,41.96538061,-87.659110921,2008-02-08T17:20:00.000+02:00,2,8,17,2008,Violent
6096076,02/21/2008 09:45:00 PM,THEFT,OVER $500,false,false,14,41.964668172,-87.721523544,2008-02-21T21:45:00.000+02:00,2,21,21,2008,Non-Violent
6043220,01/26/2008 04:00:00 PM,THEFT,$500 AND UNDER,false,false,24,41.905516604,-87.673476544,2008-01-26T16:00:00.000+02:00,1,26,16,2008,Non-Violent
6008296,01/08/2008 02:00:00 PM,ASSAULT,SIMPLE,true,true,61,41.800263355,-87.672052557,2008-01-08T14:00:00.000+02:00,1,8,14,2008,Violent
6089988,02/18/2008 05:56:34 PM,NARCOTICS,POSS: CRACK,true,false,66,41.76952879,-87.693149601,2008-02-18T17:56:34.000+02:00,2,18,17,2008,Non-Violent
5992096,01/01/2008 12:05:00 AM,BATTERY,DOMESTIC BATTERY SIMPLE,true,true,25,41.881249607,-87.766540131,2008-01-01T00:05:00.000+02:00,1,1,0,2008,Violent
6090427,02/20/2008 10:37:49 PM,NARCOTICS,POSS: CANNABIS 30GMS OR LESS,true,false,46,41.727208545,-87.544390349,2008-02-20T22:37:49.000+02:00,2,20,22,2008,Non-Violent
6147267,02/25/2008 11:35:00 AM,CRIMINAL DAMAGE,TO VEHICLE,false,false,20,41.934198291,-87.733847431,2008-02-25T11:35:00.000+02:00,2,25,11,2008,Non-Violent
6140602,03/10/2008 02:30:00 PM,BATTERY,AGG PRO.EMP: OTHER DANG WEAPON,false,false,67,41.791202978,-87.671793655,2008-03-10T14:30:00.000+02:00,3,10,14,2008,Violent
6030714,01/20/2008 04:57:44 AM,CRIMINAL TRESPASS,TO RESIDENCE,true,false,45,41.746915573,-87.584187231,2008-01-20T04:57:44.000+02:00,1,20,4,2008,Non-Violent
6075933,02/12/2008 12:30:00 PM,CRIMINAL TRESPASS,TO LAND,true,false,49,41.721627204,-87.624485177,2008-02-12T12:30:00.000+02:00,2,12,12,2008,Non-Violent
6115233,03/04/2008 01:00:00 PM,NARCOTICS,POSS: CANNABIS 30GMS OR LESS,true,false,29,41.859855885,-87.723768105,2008-03-04T13:00:00.000+02:00,3,4,13,2008,Non-Violent
6103415,02/27/2008 11:02:03 AM,ASSAULT,SIMPLE,false,false,1,42.017040425,-87.677653464,2008-02-27T11:02:03.000+02:00,2,27,11,2008,Violent
6155338,03/22/2008 09:30:00 PM,THEFT,OVER $500,false,false,23,41.893990113,-87.702155577,2008-03-22T21:30:00.000+02:00,3,22,21,2008,Non-Violent
6046924,01/28/2008 11:40:00 AM,CRIMINAL TRESPASS,TO LAND,true,false,44,41.750832464,-87.605224746,2008-01-28T11:40:00.000+02:00,1,28,11,2008,Non-Violent
6084517,02/18/2008 05:00:00 PM,THEFT,PURSE-SNATCHING,false,false,23,41.909882217,-87.726635552,2008-02-18T17:00:00.000+02:00,2,18,17,2008,Non-Violent
5997864,01/03/2008 05:00:00 PM,MOTOR VEHICLE THEFT,AUTOMOBILE,false,false,43,41.756897178,-87.591467231,2008-01-03T17:00:00.000+02:00,1,3,17,2008,Non-Violent
6058327,02/04/2008 12:30:00 PM,CRIMINAL DAMAGE,TO PROPERTY,false,false,26,41.874153389,-87.735238688,2008-02-04T12:30:00.000+02:00,2,4,12,2008,Non-Violent
6136569,03/16/2008 10:00:00 AM,MOTOR VEHICLE THEFT,"TRUCK, BUS, MOTOR HOME",false,false,44,41.73001882,-87.618644858,2008-03-16T10:00:00.000+02:00,3,16,10,2008,Non-Violent
6042678,01/26/2008 10:40:00 AM,NARCOTICS,ATTEMPT POSSESSION NARCOTICS,true,false,29,41.867182042,-87.716895493,2008-01-26T10:40:00.000+02:00,1,26,10,2008,Non-Violent
6126951,03/11/2008 06:10:00 PM,NARCOTICS,POSS: CANNABIS 30GMS OR LESS,true,false,2,41.994868071,-87.700758829,2008-03-11T18:10:00.000+02:00,3,11,18,2008,Non-Violent
6000551,01/05/2008 03:31:05 PM,ASSAULT,SIMPLE,false,false,68,41.773583696,-87.651914344,2008-01-05T15:31:05.000+02:00,1,5,15,2008,Violent
6108413,03/01/2008 10:35:00 PM,OTHER OFFENSE,TELEPHONE THREAT,false,false,69,41.76159766,-87.610329804,2008-03-01T22:35:00.000+02:00,3,1,22,2008,Non-Violent
6097050,02/25/2008 06:30:00 AM,MOTOR VEHICLE THEFT,AUTOMOBILE,false,false,38,41.818318549,-87.62519179,2008-02-25T06:30:00.000+02:00,2,25,6,2008,Non-Violent
6087290,02/20/2008 04:38:23 PM,ASSAULT,AGGRAVATED: HANDGUN,false,false,38,41.803141434,-87.608271173,2008-02-20T16:38:23.000+02:00,2,20,16,2008,Violent
6082508,02/17/2008 04:00:00 PM,MOTOR VEHICLE THEFT,AUTOMOBILE,false,false,66,41.763954411,-87.690565884,2008-02-17T16:00:00.000+02:00,2,17,16,2008,Non-Violent
6071663,02/11/2008 05:45:00 PM,BATTERY,SIMPLE,false,false,1,42.016507821,-87.674258681,2008-02-11T17:45:00.000+02:00,2,11,17,2008,Violent
6067618,02/08/2008 11:10:00 AM,THEFT,RETAIL THEFT,false,false,7,41.911343842,-87.63471588,2008-02-08T11:10:00.000+02:00,2,8,11,2008,Non-Violent
6096801,02/24/2008 10:52:00 PM,NARCOTICS,POSS: CANNABIS MORE THAN 30GMS,true,false,68,41.790102362,-87.632880321,2008-02-24T22:52:00.000+02:00,2,24,22,2008,Non-Violent
6133878,03/07/2008 12:00:00 PM,BURGLARY,FORCIBLE ENTRY,false,false,44,41.746660544,-87.603835415,2008-03-07T12:00:00.000+02:00,3,7,12,2008,Non-Violent
6133016,03/14/2008 01:35:37 AM,CRIMINAL DAMAGE,TO PROPERTY,false,false,8,41.896010965,-87.624279065,2008-03-14T01:35:37.000+02:00,3,14,1,2008,Non-Violent
6019668,01/15/2008 02:18:00 AM,BATTERY,DOMESTIC BATTERY SIMPLE,false,true,40,41.781251062,-87.622003001,2008-01-15T02:18:00.000+02:00,1,15,2,2008,Violent
6144115,03/15/2008 10:15:00 PM,WEAPONS VIOLATION,UNLAWFUL POSS OF HANDGUN,true,false,44,41.750269435,-87.637934685,2008-03-15T22:15:00.000+02:00,3,15,22,2008,Non-Violent
6120062,03/06/2008 07:55:00 AM,THEFT,OVER $500,false,false,28,41.864784953,-87.671292647,2008-03-06T07:55:00.000+02:00,3,6,7,2008,Non-Violent
6039288,01/23/2008 11:00:00 PM,CRIMINAL DAMAGE,TO PROPERTY,false,true,26,41.881088655,-87.720764494,2008-01-23T23:00:00.000+02:00,1,23,23,2008,Non-Violent
6031712,01/21/2008 07:00:00 PM,ASSAULT,SIMPLE,false,false,62,41.79639731,-87.723251281,2008-01-21T19:00:00.000+02:00,1,21,19,2008,Violent
6147217,03/22/2008 12:01:00 AM,THEFT,OVER $500,false,false,17,41.938987857,-87.806782807,2008-03-22T00:01:00.000+02:00,3,22,0,2008,Non-Violent
6139478,03/18/2008 10:00:00 AM,THEFT,OVER $500,false,false,3,41.975016893,-87.668287722,2008-03-18T10:00:00.000+02:00,3,18,10,2008,Non-Violent
6113163,01/30/2008 05:00:00 PM,THEFT,FINANCIAL ID THEFT: OVER $300,false,false,63,41.800028259,-87.704970936,2008-01-30T17:00:00.000+02:00,1,30,17,2008,Non-Violent
6043027,01/24/2008 03:20:00 PM,ASSAULT,AGGRAVATED:KNIFE/CUTTING INSTR,true,true,26,41.875254627,-87.726496837,2008-01-24T15:20:00.000+02:00,1,24,15,2008,Violent
6024433,01/16/2008 06:45:00 PM,BATTERY,SIMPLE,false,false,11,41.968628788,-87.75994156,2008-01-16T18:45:00.000+02:00,1,16,18,2008,Violent
6037021,01/23/2008 06:15:00 PM,ASSAULT,SIMPLE,false,false,53,41.677800201,-87.64295433,2008-01-23T18:15:00.000+02:00,1,23,18,2008,Violent
6094384,02/22/2008 09:10:00 PM,BATTERY,SIMPLE,false,false,64,41.778440434,-87.741426656,2008-02-22T21:10:00.000+02:00,2,22,21,2008,Violent
6115692,03/05/2008 06:50:00 PM,ASSAULT,AGGRAVATED:KNIFE/CUTTING INSTR,false,false,4,41.976741374,-87.697547464,2008-03-05T18:50:00.000+02:00,3,5,18,2008,Violent
6073671,02/11/2008 03:15:00 PM,ASSAULT,PRO EMP HANDS NO/MIN INJURY,true,false,71,41.746140855,-87.652406156,2008-02-11T15:15:00.000+02:00,2,11,15,2008,Violent
6089859,02/22/2008 01:18:00 AM,OTHER OFFENSE,VEHICLE TITLE/REG OFFENSE,true,false,61,41.7964402,-87.674376595,2008-02-22T01:18:00.000+02:00,2,22,1,2008,Non-Violent
6155304,03/26/2008 10:00:00 AM,BURGLARY,FORCIBLE ENTRY,false,false,61,41.79624405,-87.675585146,2008-03-26T10:00:00.000+02:00,3,26,10,2008,Non-Violent
6090347,02/19/2008 10:10:32 PM,NARCOTICS,POSS: CRACK,true,false,66,41.771521464,-87.683429837,2008-02-19T22:10:32.000+02:00,2,19,22,2008,Non-Violent
6152586,03/11/2008 05:00:00 PM,THEFT,FROM BUILDING,false,false,13,,,2008-03-11T17:00:00.000+02:00,3,11,17,2008,Non-Violent
6023871,01/15/2008 09:00:00 PM,THEFT,POCKET-PICKING,false,false,34,41.849393904,-87.641284903,2008-01-15T21:00:00.000+02:00,1,15,21,2008,Non-Violent
6133207,03/14/2008 10:30:00 PM,MOTOR VEHICLE THEFT,AUTOMOBILE,false,false,68,41.76803243,-87.646918107,2008-03-14T22:30:00.000+02:00,3,14,22,2008,Non-Violent
6032360,01/19/2008 09:01:15 PM,NARCOTICS,POSS: CANNABIS 30GMS OR LESS,true,false,15,41.946082885,-87.750244483,2008-01-19T21:01:15.000+02:00,1,19,21,2008,Non-Violent
6128719,03/09/2008 01:00:00 AM,BATTERY,SIMPLE,true,false,44,41.743557554,-87.601375156,2008-03-09T01:00:00.000+02:00,3,9,1,2008,Violent
6082455,02/18/2008 11:20:00 AM,CRIMINAL TRESPASS,TO RESIDENCE,true,true,69,41.771020613,-87.622489958,2008-02-18T11:20:00.000+02:00,2,18,11,2008,Non-Violent
6121824,03/03/2008 05:10:00 PM,NARCOTICS,POSS: HEROIN(WHITE),true,false,35,41.828695766,-87.613016949,2008-03-03T17:10:00.000+02:00,3,3,17,2008,Non-Violent
6005703,01/05/2008 12:00:00 AM,THEFT,$500 AND UNDER,false,false,41,41.801261714,-87.603953618,2008-01-05T00:00:00.000+02:00,1,5,0,2008,Non-Violent
6060304,02/05/2008 07:35:00 AM,BATTERY,DOMESTIC BATTERY SIMPLE,false,true,66,41.772891614,-87.67969138,2008-02-05T07:35:00.000+02:00,2,5,7,2008,Violent
6163672,03/23/2008 09:10:00 PM,NARCOTICS,POSS: CANNABIS 30GMS OR LESS,true,false,15,41.962027012,-87.78596631,2008-03-23T21:10:00.000+02:00,3,23,21,2008,Non-Violent
6068492,02/09/2008 10:01:19 AM,BATTERY,DOMESTIC BATTERY SIMPLE,false,true,25,41.882169295,-87.770520031,2008-02-09T10:01:19.000+02:00,2,9,10,2008,Violent
6029863,01/19/2008 05:20:11 PM,THEFT,RETAIL THEFT,false,false,32,41.879505465,-87.626683155,2008-01-19T17:20:11.000+02:00,1,19,17,2008,Non-Violent
6011169,01/06/2008 10:00:00 PM,CRIMINAL DAMAGE,TO VEHICLE,false,false,19,41.928557508,-87.744715402,2008-01-06T22:00:00.000+02:00,1,6,22,2008,Non-Violent
6154869,03/15/2008 05:00:00 AM,THEFT,FROM BUILDING,false,false,72,41.72762631,-87.676201282,2008-03-15T05:00:00.000+02:00,3,15,5,2008,Non-Violent
6159680,03/24/2008 12:00:00 PM,MOTOR VEHICLE THEFT,AUTOMOBILE,false,false,15,41.945079824,-87.757575864,2008-03-24T12:00:00.000+02:00,3,24,12,2008,Non-Violent
6076938,02/14/2008 12:02:00 PM,BATTERY,PRO EMP HANDS NO/MIN INJURY,true,false,25,41.890396818,-87.767781443,2008-02-14T12:02:00.000+02:00,2,14,12,2008,Violent
6064199,02/07/2008 06:30:00 PM,ASSAULT,SIMPLE,false,false,44,41.729126787,-87.604641957,2008-02-07T18:30:00.000+02:00,2,7,18,2008,Violent
6051385,01/29/2008 02:20:00 PM,NARCOTICS,MANU/DELIVER:CRACK,true,false,23,41.894436285,-87.71506148,2008-01-29T14:20:00.000+02:00,1,29,14,2008,Non-Violent
6036695,01/23/2008 02:00:00 PM,CRIMINAL DAMAGE,TO VEHICLE,false,false,63,41.79072669,-87.702252873,2008-01-23T14:00:00.000+02:00,1,23,14,2008,Non-Violent
6031483,01/19/2008 01:42:00 PM,OTHER OFFENSE,HARASSMENT BY TELEPHONE,false,true,43,41.764728045,-87.561272312,2008-01-19T13:42:00.000+02:00,1,19,13,2008,Non-Violent
6146779,03/21/2008 08:00:00 PM,MOTOR VEHICLE THEFT,AUTOMOBILE,false,false,10,41.974498987,-87.808792534,2008-03-21T20:00:00.000+02:00,3,21,20,2008,Non-Violent
6138444,01/01/2008 09:00:00 AM,DECEPTIVE PRACTICE,CREDIT CARD FRAUD,false,false,67,41.781911063,-87.655826315,2008-01-01T09:00:00.000+02:00,1,1,9,2008,Non-Violent
6129945,03/12/2008 11:00:00 AM,ASSAULT,SIMPLE,false,false,19,41.923892423,-87.771579245,2008-03-12T11:00:00.000+02:00,3,12,11,2008,Violent
6102675,02/26/2008 03:40:00 PM,CRIMINAL DAMAGE,TO PROPERTY,true,false,67,41.775266233,-87.664100992,2008-02-26T15:40:00.000+02:00,2,26,15,2008,Non-Violent
6125919,03/07/2008 02:00:00 PM,BURGLARY,FORCIBLE ENTRY,false,false,71,41.744296756,-87.666929102,2008-03-07T14:00:00.000+02:00,3,7,14,2008,Non-Violent
6108565,03/01/2008 09:26:00 AM,THEFT,OVER $500,false,false,28,41.876227971,-87.674545335,2008-03-01T09:26:00.000+02:00,3,1,9,2008,Non-Violent
6143659,03/19/2008 10:30:00 PM,MOTOR VEHICLE THEFT,AUTOMOBILE,false,false,68,41.773746894,-87.647058812,2008-03-19T22:30:00.000+02:00,3,19,22,2008,Non-Violent
6031777,01/22/2008 01:00:00 AM,NARCOTICS,POSS: CANNABIS 30GMS OR LESS,true,false,53,41.677863267,-87.637484768,2008-01-22T01:00:00.000+02:00,1,22,1,2008,Non-Violent
6032937,01/21/2008 04:23:05 PM,BURGLARY,FORCIBLE ENTRY,false,false,1,42.017582546,-87.665540726,2008-01-21T16:23:05.000+02:00,1,21,16,2008,Non-Violent
6081233,02/17/2008 03:20:58 PM,BATTERY,SIMPLE,false,false,25,41.882295519,-87.761077636,2008-02-17T15:20:58.000+02:00,2,17,15,2008,Violent
6144905,03/19/2008 08:14:06 PM,ROBBERY,ATTEMPT: STRONGARM-NO WEAPON,true,false,41,41.800938808,-87.589121997,2008-03-19T20:14:06.000+02:00,3,19,20,2008,Violent
6117869,03/06/2008 07:50:00 PM,CRIMINAL DAMAGE,TO VEHICLE,false,false,2,41.997783914,-87.686746638,2008-03-06T19:50:00.000+02:00,3,6,19,2008,Non-Violent
6055726,02/03/2008 02:30:00 AM,BATTERY,DOMESTIC BATTERY SIMPLE,false,true,26,41.884074783,-87.721867046,2008-02-03T02:30:00.000+02:00,2,3,2,2008,Violent
6048176,01/29/2008 12:30:00 PM,BATTERY,SIMPLE,true,false,68,41.764303087,-87.649245116,2008-01-29T12:30:00.000+02:00,1,29,12,2008,Violent
6119964,03/07/2008 04:36:00 PM,ROBBERY,ARMED: HANDGUN,false,false,23,41.909844371,-87.729347174,2008-03-07T16:36:00.000+02:00,3,7,16,2008,Violent
6000337,01/01/2008 01:41:58 AM,BATTERY,DOMESTIC BATTERY SIMPLE,false,true,8,41.891199446,-87.624137626,2008-01-01T01:41:58.000+02:00,1,1,1,2008,Violent
6058412,02/04/2008 05:00:00 PM,ASSAULT,SIMPLE,false,false,22,41.928471792,-87.696759165,2008-02-04T17:00:00.000+02:00,2,4,17,2008,Violent
6020052,01/12/2008 05:05:00 PM,BATTERY,SIMPLE,false,false,66,41.771686352,-87.702175595,2008-01-12T17:05:00.000+02:00,1,12,17,2008,Violent
6025145,01/16/2008 05:30:00 PM,THEFT,PURSE-SNATCHING,false,false,43,41.757614433,-87.586115266,2008-01-16T17:30:00.000+02:00,1,16,17,2008,Non-Violent
6029371,01/20/2008 04:30:00 AM,OTHER OFFENSE,HARASSMENT BY TELEPHONE,false,false,8,41.893200979,-87.633242486,2008-01-20T04:30:00.000+02:00,1,20,4,2008,Non-Violent
6032454,01/19/2008 08:10:00 PM,OTHER OFFENSE,VIOLATE ORDER OF PROTECTION,false,true,65,41.766914304,-87.716375374,2008-01-19T20:10:00.000+02:00,1,19,20,2008,Non-Violent
6133662,03/13/2008 10:30:00 AM,BATTERY,DOMESTIC BATTERY SIMPLE,false,true,43,41.758321628,-87.562723529,2008-03-13T10:30:00.000+02:00,3,13,10,2008,Violent
6010491,01/09/2008 10:00:00 AM,DECEPTIVE PRACTICE,CREDIT CARD FRAUD,false,false,44,41.737669205,-87.619406416,2008-01-09T10:00:00.000+02:00,1,9,10,2008,Non-Violent
6000018,01/05/2008 09:45:00 PM,THEFT,OVER $500,false,false,5,41.944166946,-87.675029988,2008-01-05T21:45:00.000+02:00,1,5,21,2008,Non-Violent
6137061,03/16/2008 08:00:00 AM,PROSTITUTION,SOLICIT FOR BUSINESS,true,false,58,41.809082426,-87.69911998,2008-03-16T08:00:00.000+02:00,3,16,8,2008,Non-Violent
5999866,01/05/2008 12:51:00 PM,OTHER OFFENSE,TELEPHONE THREAT,false,false,25,41.883774705,-87.753969538,2008-01-05T12:51:00.000+02:00,1,5,12,2008,Non-Violent
6138200,03/06/2008 09:00:00 AM,NARCOTICS,FORFEIT PROPERTY,true,false,29,41.868180939,-87.709271389,2008-03-06T09:00:00.000+02:00,3,6,9,2008,Non-Violent
6080970,02/17/2008 03:00:00 PM,OTHER OFFENSE,TELEPHONE THREAT,false,true,3,41.954535555,-87.651221802,2008-02-17T15:00:00.000+02:00,2,17,15,2008,Non-Violent
6135612,03/14/2008 11:06:55 AM,NARCOTICS,POSS: CRACK,true,false,38,41.816524363,-87.623949608,2008-03-14T11:06:55.000+02:00,3,14,11,2008,Non-Violent
6000920,01/06/2008 02:16:22 AM,BATTERY,DOMESTIC BATTERY SIMPLE,true,true,25,41.878624979,-87.771336943,2008-01-06T02:16:22.000+02:00,1,6,2,2008,Violent
6054520,02/01/2008 08:17:29 PM,OTHER OFFENSE,VIOLATE ORDER OF PROTECTION,true,true,43,41.757551837,-87.55762361,2008-02-01T20:17:29.000+02:00,2,1,20,2008,Non-Violent
6028671,01/19/2008 05:00:00 AM,OTHER OFFENSE,TELEPHONE THREAT,false,false,32,41.876989097,-87.625363287,2008-01-19T05:00:00.000+02:00,1,19,5,2008,Non-Violent
6160798,03/28/2008 06:00:00 AM,CRIMINAL DAMAGE,TO PROPERTY,false,false,46,,,2008-03-28T06:00:00.000+02:00,3,28,6,2008,Non-Violent
6068065,02/08/2008 03:00:00 PM,BURGLARY,UNLAWFUL ENTRY,false,false,6,41.936576105,-87.640460742,2008-02-08T15:00:00.000+02:00,2,8,15,2008,Non-Violent
6122690,03/09/2008 04:24:00 PM,NARCOTICS,POSS: CANNABIS 30GMS OR LESS,true,false,68,41.779881706,-87.636789913,2008-03-09T16:24:00.000+02:00,3,9,16,2008,Non-Violent
6090391,02/21/2008 11:10:00 AM,THEFT,RETAIL THEFT,true,false,61,41.808659359,-87.660921846,2008-02-21T11:10:00.000+02:00,2,21,11,2008,Non-Violent
6153530,03/19/2008 02:00:00 PM,BURGLARY,FORCIBLE ENTRY,false,false,22,41.919931236,-87.695675605,2008-03-19T14:00:00.000+02:00,3,19,14,2008,Non-Violent
6045380,01/28/2008 12:00:00 AM,DECEPTIVE PRACTICE,CREDIT CARD FRAUD,false,false,42,41.76948815,-87.606516788,2008-01-28T00:00:00.000+02:00,1,28,0,2008,Non-Violent
6098485,02/09/2008 11:00:00 AM,NARCOTICS,POSSESSION OF DRUG EQUIPMENT,true,false,49,41.706875037,-87.628265515,2008-02-09T11:00:00.000+02:00,2,9,11,2008,Non-Violent
6078859,02/15/2008 12:00:00 PM,THEFT,OVER $500,false,false,28,41.87760556,-87.667877617,2008-02-15T12:00:00.000+02:00,2,15,12,2008,Non-Violent
6108153,03/01/2008 09:33:16 PM,BURGLARY,FORCIBLE ENTRY,false,false,52,41.722247431,-87.53771098,2008-03-01T21:33:16.000+02:00,3,1,21,2008,Non-Violent
6096211,02/22/2008 12:14:00 PM,PUBLIC PEACE VIOLATION,RECKLESS CONDUCT,false,false,56,41.812440121,-87.744763626,2008-02-22T12:14:00.000+02:00,2,22,12,2008,Non-Violent
6080023,02/14/2008 05:00:00 PM,SEX OFFENSE,CRIMINAL SEXUAL ABUSE,false,false,60,41.841126416,-87.650155968,2008-02-14T17:00:00.000+02:00,2,14,17,2008,Non-Violent
6132561,03/13/2008 02:30:00 PM,THEFT,OVER $500,false,false,8,41.897946426,-87.634252186,2008-03-13T14:30:00.000+02:00,3,13,14,2008,Non-Violent
6101166,02/24/2008 04:30:57 PM,THEFT,RETAIL THEFT,true,false,70,41.75097171,-87.682871235,2008-02-24T16:30:57.000+02:00,2,24,16,2008,Non-Violent
6023827,01/16/2008 09:00:00 AM,THEFT,$500 AND UNDER,false,false,49,41.702962729,-87.611206769,2008-01-16T09:00:00.000+02:00,1,16,9,2008,Non-Violent
6146172,03/21/2008 06:20:00 PM,CRIMINAL DAMAGE,CRIMINAL DEFACEMENT,false,false,21,41.937897392,-87.713667869,2008-03-21T18:20:00.000+02:00,3,21,18,2008,Non-Violent
6119013,03/06/2008 10:28:56 PM,ASSAULT,AGGRAVATED:KNIFE/CUTTING INSTR,true,true,14,41.964876571,-87.723040134,2008-03-06T22:28:56.000+02:00,3,6,22,2008,Violent
6038116,01/17/2008 12:40:00 PM,NARCOTICS,POSS: CANNABIS 30GMS OR LESS,true,false,25,41.883088906,-87.748606877,2008-01-17T12:40:00.000+02:00,1,17,12,2008,Non-Violent
6092013,02/22/2008 07:35:00 PM,CRIMINAL DAMAGE,TO VEHICLE,false,false,25,41.894884155,-87.761233398,2008-02-22T19:35:00.000+02:00,2,22,19,2008,Non-Violent
6052771,01/31/2008 09:45:00 PM,ROBBERY,ATTEMPT: ARMED-HANDGUN,false,false,67,41.786291714,-87.664386014,2008-01-31T21:45:00.000+02:00,1,31,21,2008,Violent
6033957,01/09/2008 08:20:00 PM,CRIMINAL DAMAGE,TO CITY OF CHICAGO PROPERTY,false,false,61,41.816234066,-87.642507764,2008-01-09T20:20:00.000+02:00,1,9,20,2008,Non-Violent
6004274,01/07/2008 07:03:00 AM,BURGLARY,FORCIBLE ENTRY,false,false,49,41.700907156,-87.620867814,2008-01-07T07:03:00.000+02:00,1,7,7,2008,Non-Violent
6073153,02/11/2008 12:00:00 PM,OTHER OFFENSE,TELEPHONE THREAT,false,true,26,41.874343853,-87.726556857,2008-02-11T12:00:00.000+02:00,2,11,12,2008,Non-Violent
6047572,01/28/2008 10:00:00 PM,MOTOR VEHICLE THEFT,AUTOMOBILE,false,false,63,41.794711572,-87.691388167,2008-01-28T22:00:00.000+02:00,1,28,22,2008,Non-Violent
6008897,01/09/2008 09:30:00 AM,CRIMINAL DAMAGE,TO PROPERTY,false,false,52,41.692852451,-87.52582227,2008-01-09T09:30:00.000+02:00,1,9,9,2008,Non-Violent
6142249,03/19/2008 07:00:00 PM,MOTOR VEHICLE THEFT,AUTOMOBILE,false,false,49,41.719441926,-87.617714468,2008-03-19T19:00:00.000+02:00,3,19,19,2008,Non-Violent
6000694,01/06/2008 02:00:00 AM,THEFT,$500 AND UNDER,false,false,2,42.000203477,-87.703380613,2008-01-06T02:00:00.000+02:00,1,6,2,2008,Non-Violent
6077584,02/11/2008 09:00:00 AM,DECEPTIVE PRACTICE,CREDIT CARD FRAUD,false,false,35,41.836600771,-87.61677038,2008-02-11T09:00:00.000+02:00,2,11,9,2008,Non-Violent
6063956,01/27/2008 09:10:00 PM,NARCOTICS,POSS: CANNABIS 30GMS OR LESS,true,false,67,41.76039299,-87.661425975,2008-01-27T21:10:00.000+02:00,1,27,21,2008,Non-Violent
6071218,02/12/2008 06:55:00 AM,CRIMINAL DAMAGE,TO PROPERTY,false,false,73,41.72803273,-87.65919156,2008-02-12T06:55:00.000+02:00,2,12,6,2008,Non-Violent
6121167,03/09/2008 12:00:00 AM,MOTOR VEHICLE THEFT,AUTOMOBILE,false,false,31,41.848416189,-87.684402849,2008-03-09T00:00:00.000+02:00,3,9,0,2008,Non-Violent
6085873,02/20/2008 12:31:15 AM,THEFT,OVER $500,false,false,23,41.901905116,-87.718967664,2008-02-20T00:31:15.000+02:00,2,20,0,2008,Non-Violent
6025990,01/03/2008 12:00:00 PM,CRIMINAL DAMAGE,TO PROPERTY,false,false,31,41.857848849,-87.663013082,2008-01-03T12:00:00.000+02:00,1,3,12,2008,Non-Violent
6078823,02/14/2008 11:58:01 AM,NARCOTICS,POSS: CANNABIS 30GMS OR LESS,true,false,25,41.890396818,-87.767781443,2008-02-14T11:58:01.000+02:00,2,14,11,2008,Non-Violent
6050932,01/28/2008 12:00:00 PM,BURGLARY,UNLAWFUL ENTRY,false,false,58,41.811096075,-87.693066013,2008-01-28T12:00:00.000+02:00,1,28,12,2008,Non-Violent
6018627,01/04/2008 07:40:00 PM,NARCOTICS,POSS: CANNABIS 30GMS OR LESS,true,false,44,41.750657714,-87.614956494,2008-01-04T19:40:00.000+02:00,1,4,19,2008,Non-Violent
6158942,03/27/2008 11:00:00 AM,CRIMINAL TRESPASS,TO STATE SUP LAND,false,false,7,41.931439065,-87.678835913,2008-03-27T11:00:00.000+02:00,3,27,11,2008,Non-Violent
6087757,02/07/2008 11:25:00 PM,PROSTITUTION,SOLICIT ON PUBLIC WAY,true,false,25,41.880518571,-87.743441605,2008-02-07T23:25:00.000+02:00,2,7,23,2008,Non-Violent
6107572,01/30/2008 03:00:00 PM,THEFT,FINANCIAL ID THEFT: OVER $300,false,false,10,41.996278603,-87.811556741,2008-01-30T15:00:00.000+02:00,1,30,15,2008,Non-Violent
6049030,01/30/2008 02:15:00 AM,MOTOR VEHICLE THEFT,"TRUCK, BUS, MOTOR HOME",false,false,71,41.746166673,-87.663333264,2008-01-30T02:15:00.000+02:00,1,30,2,2008,Non-Violent
6029535,01/18/2008 12:05:00 AM,CRIMINAL DAMAGE,TO VEHICLE,false,false,26,41.878860295,-87.726444365,2008-01-18T00:05:00.000+02:00,1,18,0,2008,Non-Violent
6057954,02/04/2008 06:45:00 PM,CRIMINAL TRESPASS,TO LAND,true,false,22,41.924125733,-87.697397656,2008-02-04T18:45:00.000+02:00,2,4,18,2008,Non-Violent
6139240,03/16/2008 07:30:00 PM,BURGLARY,FORCIBLE ENTRY,false,false,16,41.952638269,-87.710429701,2008-03-16T19:30:00.000+02:00,3,16,19,2008,Non-Violent
6091232,02/19/2008 02:16:22 PM,NARCOTICS,POSS: CANNABIS 30GMS OR LESS,true,false,25,41.909429043,-87.761316624,2008-02-19T14:16:22.000+02:00,2,19,14,2008,Non-Violent
6038237,01/24/2008 06:00:00 AM,CRIMINAL DAMAGE,CRIMINAL DEFACEMENT,false,false,15,41.960377546,-87.77509738,2008-01-24T06:00:00.000+02:00,1,24,6,2008,Non-Violent
6144564,03/20/2008 02:50:00 PM,CRIMINAL TRESPASS,TO LAND,false,false,63,41.790146033,-87.688129795,2008-03-20T14:50:00.000+02:00,3,20,14,2008,Non-Violent
6160138,03/27/2008 05:05:00 AM,OTHER OFFENSE,TELEPHONE THREAT,false,false,30,41.837961524,-87.713396224,2008-03-27T05:05:00.000+02:00,3,27,5,2008,Non-Violent
6078040,02/15/2008 10:20:00 PM,DECEPTIVE PRACTICE,THEFT OF LABOR/SERVICES,false,false,21,41.932092005,-87.698351227,2008-02-15T22:20:00.000+02:00,2,15,22,2008,Non-Violent
6158794,03/26/2008 03:30:00 PM,THEFT,$500 AND UNDER,false,false,16,41.953588183,-87.733176813,2008-03-26T15:30:00.000+02:00,3,26,15,2008,Non-Violent
6052834,01/31/2008 10:30:00 PM,OTHER OFFENSE,TELEPHONE THREAT,false,false,67,41.780324639,-87.675142901,2008-01-31T22:30:00.000+02:00,1,31,22,2008,Non-Violent
6134839,03/15/2008 05:35:00 PM,ROBBERY,ARMED: HANDGUN,false,false,24,41.893077585,-87.683205382,2008-03-15T17:35:00.000+02:00,3,15,17,2008,Violent
6096348,02/25/2008 02:19:15 AM,BURGLARY,FORCIBLE ENTRY,false,false,53,41.685068874,-87.643231746,2008-02-25T02:19:15.000+02:00,2,25,2,2008,Non-Violent
6070416,02/10/2008 06:00:00 PM,BURGLARY,UNLAWFUL ENTRY,false,false,25,41.907945457,-87.774345765,2008-02-10T18:00:00.000+02:00,2,10,18,2008,Non-Violent
6145270,03/12/2008 04:30:00 AM,BATTERY,AGGRAVATED:KNIFE/CUTTING INSTR,false,true,23,41.894221123,-87.713836805,2008-03-12T04:30:00.000+02:00,3,12,4,2008,Violent
6109130,02/27/2008 10:00:00 PM,BATTERY,SIMPLE,false,false,66,41.773323425,-87.684702076,2008-02-27T22:00:00.000+02:00,2,27,22,2008,Violent
6076390,02/14/2008 11:30:00 AM,ASSAULT,SIMPLE,false,false,24,41.899065363,-87.667375699,2008-02-14T11:30:00.000+02:00,2,14,11,2008,Violent
6084634,02/12/2008 09:15:00 PM,NARCOTICS,POSS: CANNABIS 30GMS OR LESS,true,false,22,41.917276881,-87.717163174,2008-02-12T21:15:00.000+02:00,2,12,21,2008,Non-Violent
6023499,01/15/2008 09:30:00 PM,STALKING,SIMPLE,false,true,68,41.764787155,-87.637088825,2008-01-15T21:30:00.000+02:00,1,15,21,2008,Non-Violent
6002001,01/02/2008 11:30:00 AM,MOTOR VEHICLE THEFT,AUTOMOBILE,false,false,25,41.909279917,-87.773375269,2008-01-02T11:30:00.000+02:00,1,2,11,2008,Non-Violent
6054843,02/02/2008 05:10:00 PM,BURGLARY,FORCIBLE ENTRY,false,false,21,41.932085741,-87.699203906,2008-02-02T17:10:00.000+02:00,2,2,17,2008,Non-Violent
6050889,01/30/2008 10:00:00 PM,CRIMINAL DAMAGE,TO VEHICLE,false,false,2,41.997822224,-87.684296134,2008-01-30T22:00:00.000+02:00,1,30,22,2008,Non-Violent
6075237,02/13/2008 03:45:00 PM,BATTERY,SIMPLE,false,false,68,41.768478193,-87.638441887,2008-02-13T15:45:00.000+02:00,2,13,15,2008,Violent
6133505,03/14/2008 01:00:00 AM,CRIMINAL DAMAGE,TO VEHICLE,false,false,56,41.794788504,-87.800344244,2008-03-14T01:00:00.000+02:00,3,14,1,2008,Non-Violent
6072203,02/10/2008 10:30:00 PM,NARCOTICS,POSS: CANNABIS 30GMS OR LESS,true,false,30,41.839745817,-87.726858128,2008-02-10T22:30:00.000+02:00,2,10,22,2008,Non-Violent
6132790,03/13/2008 03:25:00 AM,NARCOTICS,POSS: CANNABIS 30GMS OR LESS,true,false,42,41.783364045,-87.614488863,2008-03-13T03:25:00.000+02:00,3,13,3,2008,Non-Violent
6023364,01/15/2008 11:30:00 PM,MOTOR VEHICLE THEFT,AUTOMOBILE,false,false,68,41.790824593,-87.636117742,2008-01-15T23:30:00.000+02:00,1,15,23,2008,Non-Violent
6017584,01/09/2008 12:32:11 AM,NARCOTICS,POSS: CANNABIS 30GMS OR LESS,true,false,5,41.937201507,-87.678280821,2008-01-09T00:32:11.000+02:00,1,9,0,2008,Non-Violent
6030155,01/19/2008 08:00:00 AM,ASSAULT,SIMPLE,false,false,71,41.748055645,-87.653672181,2008-01-19T08:00:00.000+02:00,1,19,8,2008,Violent
6015553,01/12/2008 01:20:00 PM,CRIMINAL DAMAGE,TO PROPERTY,false,false,75,41.684028993,-87.675081867,2008-01-12T13:20:00.000+02:00,1,12,13,2008,Non-Violent
6038809,01/24/2008 09:00:00 AM,BURGLARY,FORCIBLE ENTRY,false,false,24,41.904442607,-87.661941839,2008-01-24T09:00:00.000+02:00,1,24,9,2008,Non-Violent
6065969,02/07/2008 08:30:00 AM,ASSAULT,PRO EMP HANDS NO/MIN INJURY,true,false,27,41.878370307,-87.707248137,2008-02-07T08:30:00.000+02:00,2,7,8,2008,Violent
6106730,03/01/2008 02:35:00 AM,ROBBERY,AGGRAVATED,false,false,6,41.941790212,-87.650093247,2008-03-01T02:35:00.000+02:00,3,1,2,2008,Violent
6157850,03/27/2008 08:05:00 PM,NARCOTICS,POSS: CANNABIS 30GMS OR LESS,true,false,38,41.810109757,-87.622861271,2008-03-27T20:05:00.000+02:00,3,27,20,2008,Non-Violent
6121673,03/04/2008 09:25:00 AM,CRIMINAL TRESPASS,TO RESIDENCE,false,false,69,41.757323193,-87.634464678,2008-03-04T09:25:00.000+02:00,3,4,9,2008,Non-Violent
5999665,01/04/2008 10:00:00 AM,THEFT,OVER $500,false,false,38,41.808986931,-87.612661906,2008-01-04T10:00:00.000+02:00,1,4,10,2008,Non-Violent
5994340,01/01/2008 11:37:00 PM,BATTERY,AGGRAVATED: HANDGUN,true,false,42,41.777751828,-87.613151037,2008-01-01T23:37:00.000+02:00,1,1,23,2008,Violent
6048334,01/29/2008 03:50:00 PM,SEX OFFENSE,CRIMINAL SEXUAL ABUSE,false,false,67,41.768559491,-87.663213949,2008-01-29T15:50:00.000+02:00,1,29,15,2008,Non-Violent
6121599,03/07/2008 12:00:00 PM,BURGLARY,FORCIBLE ENTRY,false,false,71,41.748597835,-87.659060731,2008-03-07T12:00:00.000+02:00,3,7,12,2008,Non-Violent
6106480,02/29/2008 03:30:00 PM,THEFT,FROM BUILDING,false,false,43,41.761546376,-87.581810554,2008-02-29T15:30:00.000+02:00,2,29,15,2008,Non-Violent
6111007,01/14/2008 02:00:00 PM,DECEPTIVE PRACTICE,BOGUS CHECK,false,false,68,41.760867844,-87.6406462,2008-01-14T14:00:00.000+02:00,1,14,14,2008,Non-Violent
6084206,02/17/2008 06:45:51 PM,ROBBERY,ARMED: HANDGUN,false,false,43,41.758776307,-87.585009571,2008-02-17T18:45:51.000+02:00,2,17,18,2008,Violent
6137727,03/17/2008 12:00:00 PM,THEFT,FROM BUILDING,false,false,3,41.963008684,-87.654760481,2008-03-17T12:00:00.000+02:00,3,17,12,2008,Non-Violent
6157224,02/15/2008 12:00:00 PM,OTHER OFFENSE,OBSCENE TELEPHONE CALLS,false,false,32,41.884930201,-87.627919724,2008-02-15T12:00:00.000+02:00,2,15,12,2008,Non-Violent
6131324,03/13/2008 08:59:57 AM,BATTERY,DOMESTIC BATTERY SIMPLE,false,true,5,41.934380225,-87.68306908,2008-03-13T08:59:57.000+02:00,3,13,8,2008,Violent
6136834,03/15/2008 08:15:00 PM,BATTERY,SIMPLE,true,false,66,41.774361445,-87.706577964,2008-03-15T20:15:00.000+02:00,3,15,20,2008,Violent
6023852,01/16/2008 07:00:00 AM,THEFT,$500 AND UNDER,false,false,56,41.787880936,-87.774322956,2008-01-16T07:00:00.000+02:00,1,16,7,2008,Non-Violent
6014745,01/10/2008 10:58:33 AM,THEFT,FROM BUILDING,false,false,64,41.777558275,-87.788897937,2008-01-10T10:58:33.000+02:00,1,10,10,2008,Non-Violent
6024001,01/16/2008 08:00:00 PM,THEFT,OVER $500,false,false,6,41.942522253,-87.662545951,2008-01-16T20:00:00.000+02:00,1,16,20,2008,Non-Violent
6139197,03/10/2008 02:45:00 PM,OFFENSE INVOLVING CHILDREN,CONTRIBUTE DELINQUENCY OF A CHILD,false,false,41,41.797922443,-87.602308153,2008-03-10T14:45:00.000+02:00,3,10,14,2008,Non-Violent
6124311,03/10/2008 11:30:00 AM,WEAPONS VIOLATION,UNLAWFUL POSS OF HANDGUN,true,false,27,41.873761627,-87.699545765,2008-03-10T11:30:00.000+02:00,3,10,11,2008,Non-Violent
6160516,03/25/2008 02:41:17 PM,NARCOTICS,MANU/DELIVER:CRACK,true,false,25,41.894024093,-87.749561268,2008-03-25T14:41:17.000+02:00,3,25,14,2008,Non-Violent
6004760,01/02/2008 06:22:36 PM,NARCOTICS,FORFEIT PROPERTY,true,false,29,41.863495757,-87.717778937,2008-01-02T18:22:36.000+02:00,1,2,18,2008,Non-Violent
6003438,01/06/2008 09:00:00 PM,CRIMINAL DAMAGE,CRIMINAL DEFACEMENT,false,false,62,41.788837806,-87.736505403,2008-01-06T21:00:00.000+02:00,1,6,21,2008,Non-Violent
6086853,02/14/2008 10:30:00 PM,THEFT,OVER $500,false,false,6,41.945628841,-87.66398005,2008-02-14T22:30:00.000+02:00,2,14,22,2008,Non-Violent
6105075,02/28/2008 07:17:00 PM,BATTERY,DOMESTIC BATTERY SIMPLE,false,true,43,41.757954596,-87.57979267,2008-02-28T19:17:00.000+02:00,2,28,19,2008,Violent
6163639,03/30/2008 09:30:00 AM,PROSTITUTION,SOLICIT FOR BUSINESS,true,false,58,41.808313535,-87.692110699,2008-03-30T09:30:00.000+02:00,3,30,9,2008,Non-Violent
6122637,03/09/2008 12:57:46 AM,NARCOTICS,POSS: CANNABIS 30GMS OR LESS,true,false,67,41.777633208,-87.665755521,2008-03-09T00:57:46.000+02:00,3,9,0,2008,Non-Violent
6128944,03/11/2008 09:30:00 PM,BATTERY,AGGRAVATED: OTHER DANG WEAPON,false,false,66,41.779598042,-87.70315393,2008-03-11T21:30:00.000+02:00,3,11,21,2008,Violent
6007195,01/06/2008 10:00:00 PM,CRIMINAL DAMAGE,TO PROPERTY,false,false,67,41.793095576,-87.673057686,2008-01-06T22:00:00.000+02:00,1,6,22,2008,Non-Violent
6101266,02/26/2008 12:28:00 AM,NARCOTICS,POSS: CANNABIS 30GMS OR LESS,true,false,1,42.007894141,-87.6667091,2008-02-26T00:28:00.000+02:00,2,26,0,2008,Non-Violent
6040463,01/25/2008 08:00:00 AM,CRIMINAL DAMAGE,TO PROPERTY,false,false,24,41.899725861,-87.666281564,2008-01-25T08:00:00.000+02:00,1,25,8,2008,Non-Violent
6149160,03/22/2008 06:05:10 AM,THEFT,POCKET-PICKING,false,false,3,41.962222377,-87.655441678,2008-03-22T06:05:10.000+02:00,3,22,6,2008,Non-Violent
6078240,02/10/2008 08:00:00 PM,MOTOR VEHICLE THEFT,AUTOMOBILE,false,false,69,41.766798264,-87.629805491,2008-02-10T20:00:00.000+02:00,2,10,20,2008,Non-Violent
6106493,02/19/2008 05:00:00 PM,OTHER OFFENSE,HARASSMENT BY TELEPHONE,false,false,23,41.900670062,-87.737162208,2008-02-19T17:00:00.000+02:00,2,19,17,2008,Non-Violent
6162280,03/30/2008 12:45:00 PM,ASSAULT,SIMPLE,false,false,67,41.776629057,-87.676273211,2008-03-30T12:45:00.000+02:00,3,30,12,2008,Violent
6086860,02/20/2008 07:45:00 PM,THEFT,RETAIL THEFT,true,false,6,41.937919992,-87.649024588,2008-02-20T19:45:00.000+02:00,2,20,19,2008,Non-Violent
6107979,03/01/2008 05:00:00 PM,THEFT,FROM BUILDING,false,false,8,41.892505345,-87.626304822,2008-03-01T17:00:00.000+02:00,3,1,17,2008,Non-Violent
6061722,02/04/2008 09:40:00 AM,NARCOTICS,POSS: CANNABIS 30GMS OR LESS,true,false,68,41.769925563,-87.637267875,2008-02-04T09:40:00.000+02:00,2,4,9,2008,Non-Violent
6098657,02/24/2008 08:00:00 PM,MOTOR VEHICLE THEFT,AUTOMOBILE,false,false,14,41.969154427,-87.721940268,2008-02-24T20:00:00.000+02:00,2,24,20,2008,Non-Violent
6008658,01/09/2008 04:00:00 PM,OTHER OFFENSE,TELEPHONE THREAT,false,true,31,41.858764604,-87.662401496,2008-01-09T16:00:00.000+02:00,1,9,16,2008,Non-Violent
6022876,01/15/2008 01:40:00 PM,BATTERY,DOMESTIC BATTERY SIMPLE,false,true,46,41.732978563,-87.55547567,2008-01-15T13:40:00.000+02:00,1,15,13,2008,Violent
6019436,01/13/2008 11:30:00 PM,OTHER OFFENSE,TELEPHONE THREAT,true,true,43,41.755033744,-87.554146583,2008-01-13T23:30:00.000+02:00,1,13,23,2008,Non-Violent
6134843,03/15/2008 05:00:00 PM,BATTERY,DOMESTIC BATTERY SIMPLE,false,true,24,41.896707061,-87.699194062,2008-03-15T17:00:00.000+02:00,3,15,17,2008,Violent
6028519,01/18/2008 08:08:00 PM,OTHER OFFENSE,VEHICLE TITLE/REG OFFENSE,true,false,55,41.650882169,-87.537455475,2008-01-18T20:08:00.000+02:00,1,18,20,2008,Non-Violent
6059200,02/02/2008 08:00:00 AM,CRIMINAL DAMAGE,TO VEHICLE,false,false,43,41.757614433,-87.586115266,2008-02-02T08:00:00.000+02:00,2,2,8,2008,Non-Violent
6126390,03/06/2008 12:00:00 PM,DECEPTIVE PRACTICE,CREDIT CARD FRAUD,false,false,6,41.938836094,-87.64435799,2008-03-06T12:00:00.000+02:00,3,6,12,2008,Non-Violent
6126844,03/11/2008 07:30:50 PM,BATTERY,AGGRAVATED: HANDGUN,false,false,46,41.737390958,-87.550560381,2008-03-11T19:30:50.000+02:00,3,11,19,2008,Violent
6045645,01/27/2008 02:00:00 PM,CRIMINAL DAMAGE,TO VEHICLE,false,false,63,41.791424824,-87.687632924,2008-01-27T14:00:00.000+02:00,1,27,14,2008,Non-Violent
6149455,03/23/2008 10:00:00 AM,BATTERY,SIMPLE,false,false,25,41.902136786,-87.76613137,2008-03-23T10:00:00.000+02:00,3,23,10,2008,Violent
6035785,01/15/2008 03:00:00 AM,THEFT,OVER $500,false,false,69,41.756064436,-87.632356295,2008-01-15T03:00:00.000+02:00,1,15,3,2008,Non-Violent
6012106,01/01/2008 04:05:00 AM,CRIMINAL DAMAGE,TO VEHICLE,false,false,74,41.701145756,-87.706055384,2008-01-01T04:05:00.000+02:00,1,1,4,2008,Non-Violent
6147288,03/22/2008 03:23:00 PM,BURGLARY,FORCIBLE ENTRY,false,false,42,41.772237507,-87.60818674,2008-03-22T15:23:00.000+02:00,3,22,15,2008,Non-Violent
6115381,03/05/2008 06:30:00 AM,THEFT,$500 AND UNDER,false,false,28,41.88058568,-87.640023065,2008-03-05T06:30:00.000+02:00,3,5,6,2008,Non-Violent
6086783,02/20/2008 08:45:00 AM,THEFT,FROM BUILDING,false,false,69,41.754168689,-87.601635756,2008-02-20T08:45:00.000+02:00,2,20,8,2008,Non-Violent
6132487,03/13/2008 11:45:00 AM,THEFT,OVER $500,false,false,8,41.890779537,-87.634425828,2008-03-13T11:45:00.000+02:00,3,13,11,2008,Non-Violent
6060512,02/05/2008 05:51:46 PM,BURGLARY,FORCIBLE ENTRY,false,false,38,41.816647623,-87.615958344,2008-02-05T17:51:46.000+02:00,2,5,17,2008,Non-Violent
6082160,02/17/2008 07:30:00 PM,ASSAULT,SIMPLE,false,false,28,41.872949622,-87.689240029,2008-02-17T19:30:00.000+02:00,2,17,19,2008,Violent
6033831,01/22/2008 03:45:00 PM,OTHER OFFENSE,TELEPHONE THREAT,false,false,40,41.785161229,-87.620603115,2008-01-22T15:45:00.000+02:00,1,22,15,2008,Non-Violent
6137123,03/16/2008 09:24:00 AM,NARCOTICS,ATTEMPT POSSESSION NARCOTICS,true,false,35,41.829879483,-87.612291851,2008-03-16T09:24:00.000+02:00,3,16,9,2008,Non-Violent
6063304,02/05/2008 09:00:00 PM,DECEPTIVE PRACTICE,FRAUD OR CONFIDENCE GAME,false,false,8,41.905530484,-87.639062616,2008-02-05T21:00:00.000+02:00,2,5,21,2008,Non-Violent
5992050,01/01/2008 02:30:00 AM,ROBBERY,STRONGARM - NO WEAPON,false,false,44,41.727271346,-87.604596984,2008-01-01T02:30:00.000+02:00,1,1,2,2008,Violent
6072641,02/07/2008 02:30:00 PM,BATTERY,SIMPLE,false,false,75,41.691359415,-87.658571406,2008-02-07T14:30:00.000+02:00,2,7,14,2008,Violent
6015473,01/12/2008 03:34:15 PM,BURGLARY,FORCIBLE ENTRY,false,false,47,41.726788618,-87.597319719,2008-01-12T15:34:15.000+02:00,1,12,15,2008,Non-Violent
6016453,01/11/2008 01:11:00 PM,CRIMINAL DAMAGE,TO PROPERTY,false,false,69,41.759183158,-87.623166724,2008-01-11T13:11:00.000+02:00,1,11,13,2008,Non-Violent
6155168,03/26/2008 08:00:00 PM,CRIMINAL DAMAGE,TO PROPERTY,false,false,22,41.915454841,-87.678510597,2008-03-26T20:00:00.000+02:00,3,26,20,2008,Non-Violent
6147206,03/21/2008 01:00:00 PM,DECEPTIVE PRACTICE,FRAUD OR CONFIDENCE GAME,false,false,32,41.884497439,-87.625823907,2008-03-21T13:00:00.000+02:00,3,21,13,2008,Non-Violent
6106862,02/29/2008 11:58:46 AM,ASSAULT,SIMPLE,true,false,52,41.703544122,-87.525402868,2008-02-29T11:58:46.000+02:00,2,29,11,2008,Violent
6025414,01/10/2008 12:30:00 PM,NARCOTICS,POSS: CANNABIS 30GMS OR LESS,true,false,69,41.754274383,-87.597987977,2008-01-10T12:30:00.000+02:00,1,10,12,2008,Non-Violent
6046659,01/28/2008 03:50:00 PM,PUBLIC PEACE VIOLATION,RECKLESS CONDUCT,true,false,56,41.792244548,-87.780599755,2008-01-28T15:50:00.000+02:00,1,28,15,2008,Non-Violent
6163358,03/28/2008 12:30:00 PM,THEFT,$500 AND UNDER,false,false,34,41.852840843,-87.632710099,2008-03-28T12:30:00.000+02:00,3,28,12,2008,Non-Violent
6143555,03/19/2008 05:49:05 PM,CRIMINAL DAMAGE,TO PROPERTY,false,false,2,42.016549549,-87.688856539,2008-03-19T17:49:05.000+02:00,3,19,17,2008,Non-Violent
6100032,02/25/2008 10:15:00 PM,CRIMINAL DAMAGE,TO VEHICLE,false,false,20,,,2008-02-25T22:15:00.000+02:00,2,25,22,2008,Non-Violent
6155712,03/26/2008 10:32:06 AM,NARCOTICS,SOLICIT NARCOTICS ON PUBLICWAY,true,false,25,41.879391838,-87.753909984,2008-03-26T10:32:06.000+02:00,3,26,10,2008,Non-Violent
6094459,02/23/2008 02:00:00 PM,THEFT,OVER $500,false,false,30,41.853735451,-87.694843282,2008-02-23T14:00:00.000+02:00,2,23,14,2008,Non-Violent
6162255,03/29/2008 04:00:00 PM,CRIMINAL DAMAGE,TO PROPERTY,false,false,43,41.768033222,-87.57088076,2008-03-29T16:00:00.000+02:00,3,29,16,2008,Non-Violent
6106105,02/26/2008 02:40:00 PM,NARCOTICS,POSS: CANNABIS 30GMS OR LESS,true,false,61,41.802641458,-87.662382149,2008-02-26T14:40:00.000+02:00,2,26,14,2008,Non-Violent
6066855,02/07/2008 04:45:00 PM,PUBLIC PEACE VIOLATION,RECKLESS CONDUCT,false,false,75,41.689402074,-87.668824981,2008-02-07T16:45:00.000+02:00,2,7,16,2008,Non-Violent
5994639,01/01/2008 12:30:00 PM,BURGLARY,FORCIBLE ENTRY,false,false,31,41.849180698,-87.676478237,2008-01-01T12:30:00.000+02:00,1,1,12,2008,Non-Violent
5995917,01/02/2008 04:01:12 AM,BATTERY,DOMESTIC BATTERY SIMPLE,false,true,1,42.004100475,-87.66934255,2008-01-02T04:01:12.000+02:00,1,2,4,2008,Violent
6083579,02/16/2008 03:59:00 PM,NARCOTICS,POSS: CRACK,true,false,67,41.769948195,-87.656674371,2008-02-16T15:59:00.000+02:00,2,16,15,2008,Non-Violent
6092695,02/21/2008 02:00:00 PM,OTHER OFFENSE,TELEPHONE THREAT,false,true,38,41.808504765,-87.616302292,2008-02-21T14:00:00.000+02:00,2,21,14,2008,Non-Violent
6136819,03/16/2008 12:28:13 PM,CRIMINAL TRESPASS,TO STATE SUP LAND,false,false,33,41.850424032,-87.627029017,2008-03-16T12:28:13.000+02:00,3,16,12,2008,Non-Violent
6144650,03/20/2008 05:15:00 PM,BATTERY,DOMESTIC BATTERY SIMPLE,false,true,28,41.88007433,-87.642602726,2008-03-20T17:15:00.000+02:00,3,20,17,2008,Violent
6078184,02/12/2008 05:45:00 PM,ASSAULT,SIMPLE,false,false,28,41.867214518,-87.642557607,2008-02-12T17:45:00.000+02:00,2,12,17,2008,Violent
6016216,01/12/2008 08:40:00 PM,OFFENSE INVOLVING CHILDREN,CHILD ABUSE,true,true,53,41.664437504,-87.624834663,2008-01-12T20:40:00.000+02:00,1,12,20,2008,Non-Violent
6130915,03/12/2008 12:00:00 PM,THEFT,FROM BUILDING,false,false,40,41.78476954,-87.623826764,2008-03-12T12:00:00.000+02:00,3,12,12,2008,Non-Violent
6145824,03/21/2008 12:01:00 AM,OTHER OFFENSE,HARASSMENT BY TELEPHONE,false,false,17,41.947583635,-87.777282259,2008-03-21T00:01:00.000+02:00,3,21,0,2008,Non-Violent
6036623,01/23/2008 09:00:00 PM,OTHER OFFENSE,TELEPHONE THREAT,false,true,52,41.699958022,-87.537700173,2008-01-23T21:00:00.000+02:00,1,23,21,2008,Non-Violent
6111286,03/03/2008 05:30:00 PM,BATTERY,DOMESTIC BATTERY SIMPLE,true,true,48,41.727670725,-87.559488833,2008-03-03T17:30:00.000+02:00,3,3,17,2008,Violent
6145139,03/19/2008 01:40:13 AM,CRIMINAL DAMAGE,TO PROPERTY,false,false,71,41.747892631,-87.660948022,2008-03-19T01:40:13.000+02:00,3,19,1,2008,Non-Violent
5995316,01/02/2008 02:00:00 PM,NARCOTICS,POSS: CANNABIS 30GMS OR LESS,true,false,30,41.838133808,-87.709735877,2008-01-02T14:00:00.000+02:00,1,2,14,2008,Non-Violent
6128859,03/12/2008 09:00:00 PM,ASSAULT,AGGRAVATED:KNIFE/CUTTING INSTR,false,true,43,41.771684375,-87.571068474,2008-03-12T21:00:00.000+02:00,3,12,21,2008,Violent
6028423,01/17/2008 06:32:30 PM,BATTERY,SIMPLE,false,false,38,41.805139969,-87.621104286,2008-01-17T18:32:30.000+02:00,1,17,18,2008,Violent
6010680,01/08/2008 04:00:00 PM,BURGLARY,UNLAWFUL ENTRY,false,false,17,41.947869597,-87.807095703,2008-01-08T16:00:00.000+02:00,1,8,16,2008,Non-Violent
6021578,01/14/2008 08:00:00 AM,CRIMINAL DAMAGE,TO VEHICLE,false,false,65,41.754878573,-87.722171321,2008-01-14T08:00:00.000+02:00,1,14,8,2008,Non-Violent
5994474,01/02/2008 08:55:00 PM,CRIMINAL DAMAGE,TO VEHICLE,false,false,24,41.894274535,-87.666062824,2008-01-02T20:55:00.000+02:00,1,2,20,2008,Non-Violent
6028338,01/17/2008 12:00:00 PM,THEFT,$500 AND UNDER,false,false,31,41.858470208,-87.661332684,2008-01-17T12:00:00.000+02:00,1,17,12,2008,Non-Violent
6120424,02/24/2008 12:01:00 AM,DECEPTIVE PRACTICE,FORGERY,false,false,44,41.73627756,-87.614519556,2008-02-24T00:01:00.000+02:00,2,24,0,2008,Non-Violent
6140282,03/13/2008 02:21:00 PM,WEAPONS VIOLATION,UNLAWFUL USE HANDGUN,true,false,66,41.785803531,-87.692357048,2008-03-13T14:21:00.000+02:00,3,13,14,2008,Non-Violent
6105411,02/24/2008 05:34:55 AM,THEFT,FROM BUILDING,false,false,2,42.018241939,-87.687742802,2008-02-24T05:34:55.000+02:00,2,24,5,2008,Non-Violent
6131241,03/13/2008 12:00:00 PM,MOTOR VEHICLE THEFT,AUTOMOBILE,false,false,24,41.902252698,-87.669017631,2008-03-13T12:00:00.000+02:00,3,13,12,2008,Non-Violent
6043410,01/27/2008 08:37:25 PM,THEFT,$500 AND UNDER,false,false,28,41.878023127,-87.641482832,2008-01-27T20:37:25.000+02:00,1,27,20,2008,Non-Violent
5999769,01/03/2008 08:00:00 PM,MOTOR VEHICLE THEFT,AUTOMOBILE,false,false,24,41.904845445,-87.670346278,2008-01-03T20:00:00.000+02:00,1,3,20,2008,Non-Violent
6073630,02/07/2008 09:25:00 PM,NARCOTICS,SOLICIT NARCOTICS ON PUBLICWAY,true,false,49,41.706987456,-87.620244029,2008-02-07T21:25:00.000+02:00,2,7,21,2008,Non-Violent
6017877,01/13/2008 06:40:00 AM,ROBBERY,AGGRAVATED,false,false,71,41.744731508,-87.643868422,2008-01-13T06:40:00.000+02:00,1,13,6,2008,Violent
6048701,01/26/2008 05:00:00 PM,CRIMINAL DAMAGE,TO VEHICLE,false,false,24,41.890320072,-87.682799968,2008-01-26T17:00:00.000+02:00,1,26,17,2008,Non-Violent
6087396,02/20/2008 07:50:00 PM,BATTERY,AGGRAVATED: OTHER DANG WEAPON,true,false,26,41.880687244,-87.728909437,2008-02-20T19:50:00.000+02:00,2,20,19,2008,Violent
6111560,03/02/2008 12:01:00 AM,DECEPTIVE PRACTICE,CREDIT CARD FRAUD,false,false,15,41.956851068,-87.765550871,2008-03-02T00:01:00.000+02:00,3,2,0,2008,Non-Violent
6031089,01/16/2008 05:50:00 PM,THEFT,FROM BUILDING,false,false,8,41.897982937,-87.624095634,2008-01-16T17:50:00.000+02:00,1,16,17,2008,Non-Violent
6118971,03/02/2008 08:03:00 PM,PROSTITUTION,SOLICIT ON PUBLIC WAY,true,false,43,41.753602854,-87.554387446,2008-03-02T20:03:00.000+02:00,3,2,20,2008,Non-Violent
6013634,01/10/2008 10:00:00 PM,DECEPTIVE PRACTICE,ILLEGAL USE CASH CARD,false,false,8,41.910316023,-87.633121628,2008-01-10T22:00:00.000+02:00,1,10,22,2008,Non-Violent
5996420,01/01/2008 05:05:00 PM,OTHER OFFENSE,HARASSMENT BY ELECTRONIC MEANS,false,false,20,41.917093255,-87.732221875,2008-01-01T17:05:00.000+02:00,1,1,17,2008,Non-Violent
6146295,03/21/2008 02:30:00 PM,THEFT,OVER $500,false,false,28,41.881985776,-87.66228715,2008-03-21T14:30:00.000+02:00,3,21,14,2008,Non-Violent
6058117,02/05/2008 01:23:57 AM,BATTERY,DOMESTIC BATTERY SIMPLE,false,true,3,41.965378363,-87.659195515,2008-02-05T01:23:57.000+02:00,2,5,1,2008,Violent
6101394,02/21/2008 09:40:00 PM,PROSTITUTION,SOLICIT FOR BUSINESS,true,false,23,41.908985755,-87.721633045,2008-02-21T21:40:00.000+02:00,2,21,21,2008,Non-Violent
6111448,02/28/2008 10:00:00 PM,NARCOTICS,MANU/DEL:CANNABIS OVER 10 GMS,true,false,13,41.976579223,-87.713561484,2008-02-28T22:00:00.000+02:00,2,28,22,2008,Non-Violent
6057559,02/01/2008 03:30:00 PM,THEFT,FROM BUILDING,false,false,8,41.903769788,-87.63969883,2008-02-01T15:30:00.000+02:00,2,1,15,2008,Non-Violent
6153702,03/25/2008 01:45:00 PM,BATTERY,PRO EMP HANDS NO/MIN INJURY,true,false,66,41.76740997,-87.690652359,2008-03-25T13:45:00.000+02:00,3,25,13,2008,Violent
6013686,01/10/2008 11:00:00 PM,ASSAULT,AGGRAVATED: OTHER DANG WEAPON,true,false,42,41.777913616,-87.608331775,2008-01-10T23:00:00.000+02:00,1,10,23,2008,Violent
6027672,01/16/2008 08:30:00 PM,THEFT,OVER $500,false,false,21,41.944774357,-87.704573509,2008-01-16T20:30:00.000+02:00,1,16,20,2008,Non-Violent
6126932,03/10/2008 06:45:00 AM,BURGLARY,FORCIBLE ENTRY,false,false,43,41.768066652,-87.567654562,2008-03-10T06:45:00.000+02:00,3,10,6,2008,Non-Violent
6066159,01/31/2008 08:05:00 AM,PROSTITUTION,SOLICIT ON PUBLIC WAY,true,false,67,41.779380382,-87.66938174,2008-01-31T08:05:00.000+02:00,1,31,8,2008,Non-Violent
6126324,03/11/2008 06:30:00 AM,THEFT,FROM BUILDING,false,false,44,41.750657714,-87.614956494,2008-03-11T06:30:00.000+02:00,3,11,6,2008,Non-Violent
6071759,02/09/2008 12:00:00 AM,MOTOR VEHICLE THEFT,AUTOMOBILE,false,false,77,41.997366815,-87.660487724,2008-02-09T00:00:00.000+02:00,2,9,0,2008,Non-Violent
6117246,03/06/2008 12:01:00 AM,BATTERY,DOMESTIC BATTERY SIMPLE,true,true,68,41.779220641,-87.649632877,2008-03-06T00:01:00.000+02:00,3,6,0,2008,Violent
5992338,01/01/2008 05:00:00 AM,BATTERY,DOMESTIC BATTERY SIMPLE,false,true,48,41.732425977,-87.588037599,2008-01-01T05:00:00.000+02:00,1,1,5,2008,Violent
6045129,01/26/2008 12:10:00 PM,NARCOTICS,POSS: CANNABIS 30GMS OR LESS,true,false,15,41.945991583,-87.75771102,2008-01-26T12:10:00.000+02:00,1,26,12,2008,Non-Violent
6136100,03/13/2008 10:00:00 PM,BURGLARY,UNLAWFUL ENTRY,false,false,72,41.727661984,-87.676200919,2008-03-13T22:00:00.000+02:00,3,13,22,2008,Non-Violent
6116247,03/04/2008 04:00:00 PM,CRIMINAL DAMAGE,TO PROPERTY,false,false,66,41.768324572,-87.683953309,2008-03-04T16:00:00.000+02:00,3,4,16,2008,Non-Violent
6069771,02/10/2008 12:50:00 PM,BATTERY,SIMPLE,false,false,69,41.751254843,-87.606920408,2008-02-10T12:50:00.000+02:00,2,10,12,2008,Violent
6109102,03/01/2008 06:05:54 PM,BATTERY,AGGRAVATED: OTHER DANG WEAPON,false,false,71,41.740871113,-87.658339122,2008-03-01T18:05:54.000+02:00,3,1,18,2008,Violent
6012065,01/10/2008 07:00:00 PM,THEFT,OVER $500,false,false,6,41.938430626,-87.637643663,2008-01-10T19:00:00.000+02:00,1,10,19,2008,Non-Violent
6125418,03/10/2008 02:00:00 PM,BATTERY,SIMPLE,false,false,69,41.758125035,-87.605376887,2008-03-10T14:00:00.000+02:00,3,10,14,2008,Violent
6065132,01/28/2008 08:00:00 AM,BURGLARY,FORCIBLE ENTRY,false,false,69,41.767354959,-87.595188356,2008-01-28T08:00:00.000+02:00,1,28,8,2008,Non-Violent
6068491,02/09/2008 06:50:00 PM,BATTERY,DOMESTIC BATTERY SIMPLE,false,true,15,41.942650115,-87.756814803,2008-02-09T18:50:00.000+02:00,2,9,18,2008,Violent
6115316,02/29/2008 06:00:00 PM,ASSAULT,SIMPLE,false,false,19,41.922373826,-87.750449373,2008-02-29T18:00:00.000+02:00,2,29,18,2008,Violent
5993538,01/01/2008 12:08:01 AM,NARCOTICS,POSS: CANNABIS 30GMS OR LESS,true,false,69,41.764981554,-87.624895221,2008-01-01T00:08:01.000+02:00,1,1,0,2008,Non-Violent
6147166,03/11/2008 03:30:58 PM,NARCOTICS,POSS: CANNABIS 30GMS OR LESS,true,false,29,41.85838615,-87.722442202,2008-03-11T15:30:58.000+02:00,3,11,15,2008,Non-Violent
6082067,02/17/2008 08:00:00 PM,THEFT,FROM BUILDING,false,false,8,41.896686411,-87.627456116,2008-02-17T20:00:00.000+02:00,2,17,20,2008,Non-Violent
6161020,03/28/2008 07:00:00 PM,CRIMINAL DAMAGE,TO VEHICLE,false,false,43,41.768988584,-87.57883143,2008-03-28T19:00:00.000+02:00,3,28,19,2008,Non-Violent
6055658,02/02/2008 05:45:00 PM,THEFT,RETAIL THEFT,true,false,71,41.747851897,-87.66337071,2008-02-02T17:45:00.000+02:00,2,2,17,2008,Non-Violent
6120648,03/07/2008 05:00:00 PM,NARCOTICS,POSS: COCAINE,true,false,15,41.956490901,-87.746318726,2008-03-07T17:00:00.000+02:00,3,7,17,2008,Non-Violent
6126914,03/11/2008 06:30:00 PM,MOTOR VEHICLE THEFT,AUTOMOBILE,false,false,5,41.960373909,-87.692919459,2008-03-11T18:30:00.000+02:00,3,11,18,2008,Non-Violent
6072275,01/26/2008 07:20:00 PM,NARCOTICS,POSS: CANNABIS 30GMS OR LESS,true,false,30,41.85437045,-87.695530713,2008-01-26T19:20:00.000+02:00,1,26,19,2008,Non-Violent
6116074,03/06/2008 02:20:00 AM,BATTERY,SIMPLE,false,false,77,41.985534487,-87.660126814,2008-03-06T02:20:00.000+02:00,3,6,2,2008,Violent
6086830,02/20/2008 04:00:00 PM,OTHER OFFENSE,TELEPHONE THREAT,false,true,43,41.761396234,-87.557976827,2008-02-20T16:00:00.000+02:00,2,20,16,2008,Non-Violent
6124242,03/09/2008 12:37:00 PM,BURGLARY,FORCIBLE ENTRY,false,false,61,41.797848451,-87.67684866,2008-03-09T12:37:00.000+02:00,3,9,12,2008,Non-Violent
6041477,01/19/2008 10:10:50 PM,BATTERY,AGG PO HANDS NO/MIN INJURY,true,false,44,41.732621545,-87.614424764,2008-01-19T22:10:50.000+02:00,1,19,22,2008,Violent
6036477,01/23/2008 05:40:00 PM,BATTERY,DOMESTIC BATTERY SIMPLE,false,true,42,41.769451106,-87.608907286,2008-01-23T17:40:00.000+02:00,1,23,17,2008,Violent
6009168,01/07/2008 09:00:00 PM,ASSAULT,SIMPLE,false,false,3,41.965911528,-87.65886264,2008-01-07T21:00:00.000+02:00,1,7,21,2008,Violent
6116010,03/06/2008 04:18:00 AM,DECEPTIVE PRACTICE,THEFT OF LABOR/SERVICES,false,false,4,41.969661755,-87.694657698,2008-03-06T04:18:00.000+02:00,3,6,4,2008,Non-Violent
6053064,01/31/2008 08:20:00 PM,ROBBERY,ARMED:KNIFE/CUTTING INSTRUMENT,false,false,16,41.948594752,-87.732326703,2008-01-31T20:20:00.000+02:00,1,31,20,2008,Violent
5996530,01/03/2008 04:30:15 PM,BATTERY,AGGRAVATED DOMESTIC BATTERY: HANDGUN,false,true,48,41.730922877,-87.575569517,2008-01-03T16:30:15.000+02:00,1,3,16,2008,Violent
6156507,03/26/2008 02:19:20 PM,BATTERY,SIMPLE,false,false,26,41.878886971,-87.724226209,2008-03-26T14:19:20.000+02:00,3,26,14,2008,Violent
6108823,02/23/2008 06:30:00 PM,THEFT,$500 AND UNDER,false,false,8,41.901993756,-87.628349059,2008-02-23T18:30:00.000+02:00,2,23,18,2008,Non-Violent
6144363,01/08/2008 12:01:00 AM,THEFT,FINANCIAL ID THEFT: OVER $300,false,false,28,41.868950987,-87.656740084,2008-01-08T00:01:00.000+02:00,1,8,0,2008,Non-Violent
6024261,01/15/2008 03:00:00 PM,THEFT,FINANCIAL ID THEFT: OVER $300,false,false,49,41.697071399,-87.629013394,2008-01-15T15:00:00.000+02:00,1,15,15,2008,Non-Violent
6145507,03/20/2008 05:30:00 PM,CRIMINAL DAMAGE,TO VEHICLE,false,false,3,41.974126658,-87.657757306,2008-03-20T17:30:00.000+02:00,3,20,17,2008,Non-Violent
6121179,03/08/2008 08:10:00 PM,THEFT,RETAIL THEFT,true,false,59,41.827373751,-87.682568055,2008-03-08T20:10:00.000+02:00,3,8,20,2008,Non-Violent
6085836,02/19/2008 09:45:00 AM,ASSAULT,SIMPLE,false,false,49,41.689494383,-87.621012064,2008-02-19T09:45:00.000+02:00,2,19,9,2008,Violent
6145401,03/19/2008 06:20:00 AM,CRIMINAL TRESPASS,TO LAND,false,false,32,41.87936535,-87.635633473,2008-03-19T06:20:00.000+02:00,3,19,6,2008,Non-Violent
6081064,02/16/2008 08:40:00 PM,BATTERY,SIMPLE,false,false,69,41.76688692,-87.620149271,2008-02-16T20:40:00.000+02:00,2,16,20,2008,Violent
6059149,02/04/2008 03:03:52 PM,BATTERY,SIMPLE,false,false,1,42.010211344,-87.673550975,2008-02-04T15:03:52.000+02:00,2,4,15,2008,Violent
6147326,03/22/2008 08:00:00 AM,THEFT,FROM BUILDING,false,false,24,41.906221127,-87.670963902,2008-03-22T08:00:00.000+02:00,3,22,8,2008,Non-Violent
6140498,03/17/2008 06:00:00 AM,DECEPTIVE PRACTICE,THEFT OF LOST/MISLAID PROP,false,false,28,41.863276227,-87.642053002,2008-03-17T06:00:00.000+02:00,3,17,6,2008,Non-Violent
6022244,01/15/2008 09:00:00 AM,OFFENSE INVOLVING CHILDREN,CHILD ABDUCTION,false,true,39,41.814365919,-87.60399938,2008-01-15T09:00:00.000+02:00,1,15,9,2008,Non-Violent
6155037,03/24/2008 10:30:00 PM,ASSAULT,SIMPLE,false,true,19,41.926016609,-87.7523087,2008-03-24T22:30:00.000+02:00,3,24,22,2008,Violent
6017142,01/10/2008 09:49:30 PM,NARCOTICS,POSS: CANNABIS 30GMS OR LESS,true,false,49,41.708345281,-87.611355286,2008-01-10T21:49:30.000+02:00,1,10,21,2008,Non-Violent
6040194,01/24/2008 12:20:00 PM,THEFT,RETAIL THEFT,false,false,71,41.747758596,-87.66337168,2008-01-24T12:20:00.000+02:00,1,24,12,2008,Non-Violent
6158236,03/27/2008 07:08:00 PM,THEFT,RETAIL THEFT,false,false,18,41.938151196,-87.796189752,2008-03-27T19:08:00.000+02:00,3,27,19,2008,Non-Violent
6142837,03/08/2008 12:30:00 PM,THEFT,RETAIL THEFT,false,false,7,41.921607479,-87.66518653,2008-03-08T12:30:00.000+02:00,3,8,12,2008,Non-Violent
6113657,03/04/2008 03:25:00 PM,BATTERY,DOMESTIC BATTERY SIMPLE,false,true,17,41.938438493,-87.776994169,2008-03-04T15:25:00.000+02:00,3,4,15,2008,Violent
6135387,03/14/2008 07:30:00 PM,BATTERY,SIMPLE,false,false,69,41.7513401,-87.600037072,2008-03-14T19:30:00.000+02:00,3,14,19,2008,Violent
6076971,02/14/2008 05:10:00 PM,THEFT,RETAIL THEFT,true,false,25,41.909588772,-87.748894125,2008-02-14T17:10:00.000+02:00,2,14,17,2008,Non-Violent
6011150,01/10/2008 03:00:00 PM,CRIMINAL DAMAGE,TO VEHICLE,false,false,46,41.737264151,-87.560612084,2008-01-10T15:00:00.000+02:00,1,10,15,2008,Non-Violent
6030154,01/19/2008 08:03:00 PM,NARCOTICS,POSS: HEROIN(WHITE),true,false,19,41.922904107,-87.746266582,2008-01-19T20:03:00.000+02:00,1,19,20,2008,Non-Violent
6141745,03/12/2008 08:00:00 PM,PROSTITUTION,SOLICIT ON PUBLIC WAY,true,false,68,41.790625934,-87.647795548,2008-03-12T20:00:00.000+02:00,3,12,20,2008,Non-Violent
6074538,02/13/2008 10:27:33 PM,BATTERY,AGG PO HANDS NO/MIN INJURY,true,true,25,41.897716552,-87.749307254,2008-02-13T22:27:33.000+02:00,2,13,22,2008,Violent
6070351,02/11/2008 10:00:00 AM,MOTOR VEHICLE THEFT,AUTOMOBILE,true,false,44,41.735320534,-87.607217231,2008-02-11T10:00:00.000+02:00,2,11,10,2008,Non-Violent
6060350,02/05/2008 06:45:00 PM,BATTERY,SIMPLE,false,false,26,41.880715605,-87.726481891,2008-02-05T18:45:00.000+02:00,2,5,18,2008,Violent
6081616,01/22/2008 09:00:00 PM,ROBBERY,ARMED: HANDGUN,false,false,68,41.783283846,-87.637567068,2008-01-22T21:00:00.000+02:00,1,22,21,2008,Violent
6134152,03/13/2008 07:00:00 PM,BURGLARY,UNLAWFUL ENTRY,false,false,70,41.747546379,-87.692561844,2008-03-13T19:00:00.000+02:00,3,13,19,2008,Non-Violent
6128968,03/11/2008 10:48:40 AM,OTHER OFFENSE,FALSE/STOLEN/ALTERED TRP,false,false,25,41.880385859,-87.754029528,2008-03-11T10:48:40.000+02:00,3,11,10,2008,Non-Violent
6138967,03/18/2008 08:00:00 AM,THEFT,OVER $500,false,false,20,41.928047505,-87.732085974,2008-03-18T08:00:00.000+02:00,3,18,8,2008,Non-Violent
6074315,02/13/2008 06:40:00 PM,MOTOR VEHICLE THEFT,AUTOMOBILE,true,false,44,41.736259849,-87.6280468,2008-02-13T18:40:00.000+02:00,2,13,18,2008,Non-Violent
6094005,02/15/2008 09:00:00 AM,THEFT,FINANCIAL ID THEFT: OVER $300,false,false,48,41.726038929,-87.581140169,2008-02-15T09:00:00.000+02:00,2,15,9,2008,Non-Violent
6087248,02/08/2008 04:00:00 PM,CRIMINAL DAMAGE,TO VEHICLE,false,false,66,41.783791667,-87.692303754,2008-02-08T16:00:00.000+02:00,2,8,16,2008,Non-Violent
6016051,01/13/2008 04:35:58 AM,BURGLARY,FORCIBLE ENTRY,false,false,66,41.783795862,-87.683767888,2008-01-13T04:35:58.000+02:00,1,13,4,2008,Non-Violent
6018077,01/13/2008 10:25:00 PM,CRIMINAL DAMAGE,TO PROPERTY,false,true,27,41.883576711,-87.709874412,2008-01-13T22:25:00.000+02:00,1,13,22,2008,Non-Violent
6014170,01/08/2008 07:15:00 AM,OTHER OFFENSE,VIOLATE ORDER OF PROTECTION,false,true,8,41.892559086,-87.623450463,2008-01-08T07:15:00.000+02:00,1,8,7,2008,Non-Violent
6111035,02/23/2008 09:20:37 PM,NARCOTICS,POSS: COCAINE,true,false,63,41.787609913,-87.703387152,2008-02-23T21:20:37.000+02:00,2,23,21,2008,Non-Violent
6026497,01/15/2008 12:55:00 PM,NARCOTICS,POSS: CRACK,true,false,27,41.879245003,-87.697130461,2008-01-15T12:55:00.000+02:00,1,15,12,2008,Non-Violent
6090519,02/17/2008 08:25:00 PM,NARCOTICS,POSS: CRACK,true,false,66,41.782635043,-87.701485256,2008-02-17T20:25:00.000+02:00,2,17,20,2008,Non-Violent
6104451,01/15/2008 12:00:00 AM,THEFT,FROM BUILDING,false,false,11,41.978852966,-87.764759666,2008-01-15T00:00:00.000+02:00,1,15,0,2008,Non-Violent
6157558,03/25/2008 02:40:00 PM,ROBBERY,STRONGARM - NO WEAPON,false,false,43,41.756997586,-87.558044435,2008-03-25T14:40:00.000+02:00,3,25,14,2008,Violent
6007060,01/07/2008 06:00:00 PM,THEFT,FROM BUILDING,false,false,46,41.733226633,-87.544364336,2008-01-07T18:00:00.000+02:00,1,7,18,2008,Non-Violent
6122048,03/09/2008 03:19:00 PM,NARCOTICS,MANU/DELIVER: HEROIN (WHITE),true,false,25,41.909444913,-87.760096788,2008-03-09T15:19:00.000+02:00,3,9,15,2008,Non-Violent
6035594,01/17/2008 01:30:00 AM,MOTOR VEHICLE THEFT,AUTOMOBILE,false,false,28,41.883117424,-87.648974374,2008-01-17T01:30:00.000+02:00,1,17,1,2008,Non-Violent
6069889,02/10/2008 05:55:00 PM,CRIMINAL DAMAGE,TO VEHICLE,false,true,71,41.742453478,-87.665665679,2008-02-10T17:55:00.000+02:00,2,10,17,2008,Non-Violent
6047850,01/29/2008 11:00:00 AM,THEFT,OVER $500,false,false,43,41.770668705,-87.576421618,2008-01-29T11:00:00.000+02:00,1,29,11,2008,Non-Violent
6135126,03/15/2008 10:20:00 PM,CRIMINAL DAMAGE,TO PROPERTY,true,false,6,41.951412485,-87.668977968,2008-03-15T22:20:00.000+02:00,3,15,22,2008,Non-Violent
6068993,02/10/2008 08:15:00 PM,THEFT,OVER $500,false,true,31,41.854287751,-87.680808697,2008-02-10T20:15:00.000+02:00,2,10,20,2008,Non-Violent
6070921,02/11/2008 05:09:50 PM,BATTERY,DOMESTIC BATTERY SIMPLE,false,true,42,41.777913616,-87.608331775,2008-02-11T17:09:50.000+02:00,2,11,17,2008,Violent
6058715,02/04/2008 12:13:52 PM,NARCOTICS,MANU/DELIVER:COCAINE,true,false,38,41.819424241,-87.611048094,2008-02-04T12:13:52.000+02:00,2,4,12,2008,Non-Violent
6106449,02/26/2008 09:10:00 AM,BATTERY,DOMESTIC BATTERY SIMPLE,false,true,29,41.861830912,-87.712850003,2008-02-26T09:10:00.000+02:00,2,26,9,2008,Violent
6103743,02/27/2008 07:04:00 PM,CRIMINAL DAMAGE,TO PROPERTY,false,true,43,41.767121096,-87.582812195,2008-02-27T19:04:00.000+02:00,2,27,19,2008,Non-Violent
6076730,02/14/2008 05:48:45 PM,STALKING,SIMPLE,false,true,49,41.691543909,-87.64114148,2008-02-14T17:48:45.000+02:00,2,14,17,2008,Non-Violent
6013052,01/09/2008 08:30:00 AM,ASSAULT,SIMPLE,false,false,71,41.749544921,-87.669480384,2008-01-09T08:30:00.000+02:00,1,9,8,2008,Violent
6150901,03/13/2008 04:15:00 PM,THEFT,$500 AND UNDER,false,false,67,41.761042853,-87.663684347,2008-03-13T16:15:00.000+02:00,3,13,16,2008,Non-Violent
6028195,01/18/2008 05:15:00 PM,ASSAULT,SIMPLE,false,false,41,41.791514087,-87.589836085,2008-01-18T17:15:00.000+02:00,1,18,17,2008,Violent
6056280,02/03/2008 02:30:00 PM,ASSAULT,SIMPLE,false,false,26,41.880628274,-87.733889395,2008-02-03T14:30:00.000+02:00,2,3,14,2008,Violent
6050750,01/19/2008 12:30:00 AM,DECEPTIVE PRACTICE,CREDIT CARD FRAUD,false,false,24,41.909305374,-87.680983439,2008-01-19T00:30:00.000+02:00,1,19,0,2008,Non-Violent
6128709,03/12/2008 05:45:00 PM,MOTOR VEHICLE THEFT,"TRUCK, BUS, MOTOR HOME",false,false,45,41.736962773,-87.58220715,2008-03-12T17:45:00.000+02:00,3,12,17,2008,Non-Violent
6135656,03/15/2008 11:09:00 PM,BATTERY,SIMPLE,false,false,69,41.777838294,-87.615566126,2008-03-15T23:09:00.000+02:00,3,15,23,2008,Violent
6057974,02/04/2008 07:30:00 PM,THEFT,$500 AND UNDER,false,false,15,41.95347181,-87.743552438,2008-02-04T19:30:00.000+02:00,2,4,19,2008,Non-Violent
6056679,02/03/2008 07:00:00 PM,BATTERY,DOMESTIC BATTERY SIMPLE,false,true,68,41.768423095,-87.642045877,2008-02-03T19:00:00.000+02:00,2,3,19,2008,Violent
6078573,02/10/2008 05:45:24 PM,CRIMINAL DAMAGE,TO PROPERTY,false,false,1,42.019383301,-87.67275327,2008-02-10T17:45:24.000+02:00,2,10,17,2008,Non-Violent
6161435,03/28/2008 07:45:00 PM,CRIMINAL DAMAGE,TO PROPERTY,false,false,49,41.688965575,-87.622478715,2008-03-28T19:45:00.000+02:00,3,28,19,2008,Non-Violent
6080721,02/15/2008 05:15:07 AM,NARCOTICS,POSS: CRACK,true,false,29,41.858985055,-87.714364223,2008-02-15T05:15:07.000+02:00,2,15,5,2008,Non-Violent
6160898,03/29/2008 12:45:00 PM,OTHER OFFENSE,HARASSMENT BY TELEPHONE,false,false,19,41.926991358,-87.747555708,2008-03-29T12:45:00.000+02:00,3,29,12,2008,Non-Violent
6045307,01/28/2008 07:00:00 AM,THEFT,OVER $500,false,false,32,41.874215036,-87.631683611,2008-01-28T07:00:00.000+02:00,1,28,7,2008,Non-Violent
6138191,03/08/2008 12:01:00 AM,THEFT,$500 AND UNDER,false,false,28,41.861213102,-87.650863617,2008-03-08T00:01:00.000+02:00,3,8,0,2008,Non-Violent
6019528,01/09/2008 04:00:00 AM,BATTERY,AGGRAVATED DOMESTIC BATTERY: HANDS/FIST/FEET SERIOUS INJURY,false,true,22,41.914576519,-87.702000545,2008-01-09T04:00:00.000+02:00,1,9,4,2008,Violent
6142538,03/19/2008 12:49:00 AM,ROBBERY,STRONGARM - NO WEAPON,false,false,3,41.969326227,-87.654825814,2008-03-19T00:49:00.000+02:00,3,19,0,2008,Violent
5992345,01/01/2008 11:00:00 AM,THEFT,$500 AND UNDER,false,false,30,41.844063211,-87.705028372,2008-01-01T11:00:00.000+02:00,1,1,11,2008,Non-Violent
6160191,03/28/2008 01:10:00 PM,BATTERY,DOMESTIC BATTERY SIMPLE,false,true,4,41.975985759,-87.682682782,2008-03-28T13:10:00.000+02:00,3,28,13,2008,Violent
6097217,02/25/2008 01:00:00 PM,THEFT,OVER $500,false,false,4,41.963618619,-87.685283169,2008-02-25T13:00:00.000+02:00,2,25,13,2008,Non-Violent
6000471,01/06/2008 12:10:24 AM,THEFT,OVER $500,false,false,43,41.754209909,-87.550433015,2008-01-06T00:10:24.000+02:00,1,6,0,2008,Non-Violent
6088267,02/18/2008 12:05:00 AM,MOTOR VEHICLE THEFT,AUTOMOBILE,false,false,35,41.837954218,-87.608109527,2008-02-18T00:05:00.000+02:00,2,18,0,2008,Non-Violent
6135026,03/15/2008 05:50:00 PM,THEFT,RETAIL THEFT,true,false,25,41.909384533,-87.765064273,2008-03-15T17:50:00.000+02:00,3,15,17,2008,Non-Violent
6098224,02/25/2008 11:30:00 AM,BURGLARY,FORCIBLE ENTRY,false,false,19,41.932640072,-87.761381239,2008-02-25T11:30:00.000+02:00,2,25,11,2008,Non-Violent
6085738,02/16/2008 05:00:00 PM,BATTERY,AGGRAVATED: OTHER DANG WEAPON,false,false,61,41.806172326,-87.669765401,2008-02-16T17:00:00.000+02:00,2,16,17,2008,Violent
6136578,03/15/2008 01:00:00 PM,ASSAULT,SIMPLE,false,false,46,41.752885677,-87.549008833,2008-03-15T13:00:00.000+02:00,3,15,13,2008,Violent
6012096,01/10/2008 04:35:00 PM,BATTERY,DOMESTIC BATTERY SIMPLE,false,true,23,41.894258956,-87.710178226,2008-01-10T16:35:00.000+02:00,1,10,16,2008,Violent
6142328,03/19/2008 08:30:00 AM,BURGLARY,HOME INVASION,false,false,29,41.863665637,-87.727535236,2008-03-19T08:30:00.000+02:00,3,19,8,2008,Non-Violent
6050617,01/28/2008 05:45:00 PM,THEFT,OVER $500,false,false,2,41.995906695,-87.69013169,2008-01-28T17:45:00.000+02:00,1,28,17,2008,Non-Violent
6045960,01/28/2008 02:50:00 PM,ASSAULT,SIMPLE,false,false,56,41.808586084,-87.745627875,2008-01-28T14:50:00.000+02:00,1,28,14,2008,Violent
6163462,03/06/2008 10:30:00 PM,PROSTITUTION,SOLICIT FOR BUSINESS,true,false,21,41.937725094,-87.72714355,2008-03-06T22:30:00.000+02:00,3,6,22,2008,Non-Violent
6087725,02/20/2008 10:30:00 AM,BATTERY,DOMESTIC BATTERY SIMPLE,false,true,67,41.793071287,-87.658488475,2008-02-20T10:30:00.000+02:00,2,20,10,2008,Violent
6157889,03/27/2008 01:25:00 PM,THEFT,$500 AND UNDER,false,false,30,41.84585728,-87.701403077,2008-03-27T13:25:00.000+02:00,3,27,13,2008,Non-Violent
6013259,01/03/2008 08:03:28 PM,NARCOTICS,POSS: HEROIN(WHITE),true,false,61,41.794908087,-87.669470875,2008-01-03T20:03:28.000+02:00,1,3,20,2008,Non-Violent
6043179,01/27/2008 06:00:00 AM,OTHER OFFENSE,TELEPHONE THREAT,false,false,1,42.010627323,-87.674308351,2008-01-27T06:00:00.000+02:00,1,27,6,2008,Non-Violent
6147414,03/22/2008 02:00:00 AM,THEFT,FROM BUILDING,false,false,8,41.903933222,-87.629128536,2008-03-22T02:00:00.000+02:00,3,22,2,2008,Non-Violent
6080777,02/14/2008 06:00:00 AM,BURGLARY,FORCIBLE ENTRY,false,false,21,41.935815119,-87.713269044,2008-02-14T06:00:00.000+02:00,2,14,6,2008,Non-Violent
6140508,03/13/2008 07:40:00 PM,PROSTITUTION,SOLICIT ON PUBLIC WAY,true,false,57,41.80729031,-87.726016268,2008-03-13T19:40:00.000+02:00,3,13,19,2008,Non-Violent
6029306,01/19/2008 04:00:00 PM,OTHER OFFENSE,TELEPHONE THREAT,false,false,23,41.898009883,-87.731706653,2008-01-19T16:00:00.000+02:00,1,19,16,2008,Non-Violent
6109442,03/02/2008 01:10:00 AM,BATTERY,DOMESTIC BATTERY SIMPLE,false,true,49,41.705052523,-87.628219509,2008-03-02T01:10:00.000+02:00,3,2,1,2008,Violent
6014627,01/11/2008 06:40:00 PM,THEFT,$500 AND UNDER,false,false,29,41.856790413,-87.708424071,2008-01-11T18:40:00.000+02:00,1,11,18,2008,Non-Violent
6103507,02/23/2008 08:00:00 PM,THEFT,$500 AND UNDER,false,true,23,41.901850234,-87.71896819,2008-02-23T20:00:00.000+02:00,2,23,20,2008,Non-Violent
6085033,02/19/2008 10:50:00 PM,THEFT,RETAIL THEFT,true,false,28,41.881183664,-87.685081252,2008-02-19T22:50:00.000+02:00,2,19,22,2008,Non-Violent
6001209,01/06/2008 02:45:00 PM,THEFT,$500 AND UNDER,false,false,67,41.786291714,-87.664386014,2008-01-06T14:45:00.000+02:00,1,6,14,2008,Non-Violent
5995664,01/01/2008 09:00:00 PM,MOTOR VEHICLE THEFT,AUTOMOBILE,true,false,44,41.74953195,-87.636696668,2008-01-01T21:00:00.000+02:00,1,1,21,2008,Non-Violent
6022663,01/01/2008 07:20:00 PM,CRIMINAL TRESPASS,TO STATE SUP LAND,false,false,8,41.899540054,-87.640009077,2008-01-01T19:20:00.000+02:00,1,1,19,2008,Non-Violent
6085078,02/19/2008 07:10:00 PM,CRIMINAL DAMAGE,TO VEHICLE,false,false,46,41.739996087,-87.555119843,2008-02-19T19:10:00.000+02:00,2,19,19,2008,Non-Violent
6092975,02/23/2008 11:30:00 AM,OTHER OFFENSE,TELEPHONE THREAT,false,false,15,41.965851292,-87.775465101,2008-02-23T11:30:00.000+02:00,2,23,11,2008,Non-Violent
6078432,02/14/2008 10:00:35 AM,OTHER OFFENSE,FALSE/STOLEN/ALTERED TRP,false,false,30,41.851921529,-87.693862951,2008-02-14T10:00:35.000+02:00,2,14,10,2008,Non-Violent
6151642,03/24/2008 10:51:15 AM,BATTERY,DOMESTIC BATTERY SIMPLE,false,true,2,41.99467951,-87.688569575,2008-03-24T10:51:15.000+02:00,3,24,10,2008,Violent
6121182,02/25/2008 09:27:00 AM,OTHER OFFENSE,HARASSMENT BY TELEPHONE,false,false,75,41.685803567,-87.672991641,2008-02-25T09:27:00.000+02:00,2,25,9,2008,Non-Violent
6021369,01/15/2008 06:00:00 AM,MOTOR VEHICLE THEFT,AUTOMOBILE,false,false,21,,,2008-01-15T06:00:00.000+02:00,1,15,6,2008,Non-Violent
6063343,02/05/2008 10:30:00 AM,BURGLARY,FORCIBLE ENTRY,false,false,44,41.732859129,-87.613799288,2008-02-05T10:30:00.000+02:00,2,5,10,2008,Non-Violent
6042270,01/23/2008 12:30:00 PM,THEFT,OVER $500,false,false,12,41.995199887,-87.755362239,2008-01-23T12:30:00.000+02:00,1,23,12,2008,Non-Violent
6013965,01/08/2008 09:00:00 AM,ASSAULT,SIMPLE,false,false,66,41.763944701,-87.684444661,2008-01-08T09:00:00.000+02:00,1,8,9,2008,Violent
6140510,03/17/2008 02:00:00 PM,BURGLARY,UNLAWFUL ENTRY,false,false,60,41.841066766,-87.650277708,2008-03-17T14:00:00.000+02:00,3,17,14,2008,Non-Violent
6134373,03/14/2008 09:00:00 PM,BATTERY,DOMESTIC BATTERY SIMPLE,true,true,14,41.961036435,-87.720793525,2008-03-14T21:00:00.000+02:00,3,14,21,2008,Violent
6081001,02/13/2008 02:52:03 PM,ASSAULT,SIMPLE,false,true,18,41.924219899,-87.795263026,2008-02-13T14:52:03.000+02:00,2,13,14,2008,Violent
6098842,02/25/2008 04:40:36 PM,THEFT,FROM BUILDING,false,false,2,,,2008-02-25T16:40:36.000+02:00,2,25,16,2008,Non-Violent
6015819,01/13/2008 03:55:04 AM,ASSAULT,AGGRAVATED:KNIFE/CUTTING INSTR,true,false,31,41.85307445,-87.654705108,2008-01-13T03:55:04.000+02:00,1,13,3,2008,Violent
6039168,01/24/2008 07:00:00 PM,MOTOR VEHICLE THEFT,AUTOMOBILE,false,false,16,41.946343011,-87.72995117,2008-01-24T19:00:00.000+02:00,1,24,19,2008,Non-Violent
6152203,03/24/2008 01:30:55 AM,NARCOTICS,POSS: CRACK,true,false,25,41.909826172,-87.765582036,2008-03-24T01:30:55.000+02:00,3,24,1,2008,Non-Violent
6097992,02/23/2008 09:00:00 PM,THEFT,OVER $500,false,false,69,41.774549326,-87.629101227,2008-02-23T21:00:00.000+02:00,2,23,21,2008,Non-Violent
6048834,01/27/2008 09:00:00 PM,SEX OFFENSE,AGG CRIMINAL SEXUAL ABUSE,false,false,26,41.88461013,-87.731780968,2008-01-27T21:00:00.000+02:00,1,27,21,2008,Non-Violent
6072111,02/11/2008 12:05:00 AM,THEFT,OVER $500,false,false,9,42.005267295,-87.810066774,2008-02-11T00:05:00.000+02:00,2,11,0,2008,Non-Violent
6098208,02/22/2008 09:30:00 PM,BATTERY,AGGRAVATED: HANDGUN,false,false,61,41.815353595,-87.672432934,2008-02-22T21:30:00.000+02:00,2,22,21,2008,Violent
6031815,01/21/2008 09:00:00 PM,BATTERY,DOMESTIC BATTERY SIMPLE,true,true,28,41.883576055,-87.681583082,2008-01-21T21:00:00.000+02:00,1,21,21,2008,Violent
6097797,02/25/2008 08:00:00 AM,CRIMINAL DAMAGE,TO VEHICLE,false,false,26,41.882027029,-87.726939525,2008-02-25T08:00:00.000+02:00,2,25,8,2008,Non-Violent
6134776,03/15/2008 03:30:00 AM,BATTERY,DOMESTIC BATTERY SIMPLE,false,true,24,41.910962486,-87.662340099,2008-03-15T03:30:00.000+02:00,3,15,3,2008,Violent
6018410,01/11/2008 05:00:00 PM,BATTERY,DOMESTIC BATTERY SIMPLE,true,true,44,41.736259984,-87.628068782,2008-01-11T17:00:00.000+02:00,1,11,17,2008,Violent
6013741,01/11/2008 10:00:00 AM,THEFT,$500 AND UNDER,false,false,16,41.961471281,-87.739842353,2008-01-11T10:00:00.000+02:00,1,11,10,2008,Non-Violent
6124041,03/06/2008 12:01:00 AM,THEFT,FINANCIAL ID THEFT:$300 &UNDER,false,false,6,41.951716155,-87.655670653,2008-03-06T00:01:00.000+02:00,3,6,0,2008,Non-Violent
6090152,02/12/2008 12:05:00 AM,NARCOTICS,POSS: CANNABIS 30GMS OR LESS,true,false,27,41.881826552,-87.70999792,2008-02-12T00:05:00.000+02:00,2,12,0,2008,Non-Violent
6131128,03/13/2008 10:30:00 PM,MOTOR VEHICLE THEFT,AUTOMOBILE,false,false,19,41.938747961,-87.753027473,2008-03-13T22:30:00.000+02:00,3,13,22,2008,Non-Violent
6031188,01/19/2008 03:34:42 PM,BATTERY,DOMESTIC BATTERY SIMPLE,false,true,46,41.749425665,-87.568631033,2008-01-19T15:34:42.000+02:00,1,19,15,2008,Violent
6107410,02/10/2008 12:01:00 AM,OTHER OFFENSE,HARASSMENT BY TELEPHONE,false,false,24,41.90177271,-87.674778719,2008-02-10T00:01:00.000+02:00,2,10,0,2008,Non-Violent
6142683,03/15/2008 11:00:00 PM,THEFT,$500 AND UNDER,false,false,69,41.765444001,-87.626906181,2008-03-15T23:00:00.000+02:00,3,15,23,2008,Non-Violent
6054535,02/01/2008 05:23:42 PM,NARCOTICS,POSS: CANNABIS 30GMS OR LESS,true,false,27,41.875446677,-87.711102716,2008-02-01T17:23:42.000+02:00,2,1,17,2008,Non-Violent
6087870,02/20/2008 08:50:00 AM,CRIMINAL TRESPASS,TO LAND,true,false,66,41.782120436,-87.703224562,2008-02-20T08:50:00.000+02:00,2,20,8,2008,Non-Violent
6161987,03/29/2008 06:52:00 PM,ROBBERY,STRONGARM - NO WEAPON,false,false,44,41.735752519,-87.625429032,2008-03-29T18:52:00.000+02:00,3,29,18,2008,Violent
6104544,02/28/2008 09:00:00 AM,OTHER OFFENSE,HARASSMENT BY TELEPHONE,false,false,67,41.761286519,-87.662644532,2008-02-28T09:00:00.000+02:00,2,28,9,2008,Non-Violent
6077261,02/11/2008 09:00:00 AM,DECEPTIVE PRACTICE,CREDIT CARD FRAUD,false,false,32,41.871811902,-87.627340674,2008-02-11T09:00:00.000+02:00,2,11,9,2008,Non-Violent
6133756,03/14/2008 09:30:00 PM,CRIMINAL TRESPASS,TO LAND,false,false,4,41.97157016,-87.679271022,2008-03-14T21:30:00.000+02:00,3,14,21,2008,Non-Violent
6024700,01/14/2008 02:00:00 PM,THEFT,OVER $500,false,false,59,41.830038123,-87.684452738,2008-01-14T14:00:00.000+02:00,1,14,14,2008,Non-Violent
6144949,03/20/2008 05:00:00 PM,THEFT,$500 AND UNDER,false,false,51,41.722474162,-87.574892216,2008-03-20T17:00:00.000+02:00,3,20,17,2008,Non-Violent
6081906,02/17/2008 11:30:00 PM,CRIMINAL DAMAGE,TO VEHICLE,false,false,69,41.76861938,-87.623381578,2008-02-17T23:30:00.000+02:00,2,17,23,2008,Non-Violent
5992170,01/01/2008 01:30:00 PM,BATTERY,DOMESTIC BATTERY SIMPLE,false,true,28,41.882100231,-87.685079332,2008-01-01T13:30:00.000+02:00,1,1,13,2008,Violent
6123294,03/09/2008 04:25:00 PM,THEFT,FROM BUILDING,false,false,55,41.680946794,-87.538307803,2008-03-09T16:25:00.000+02:00,3,9,16,2008,Non-Violent
6102013,02/26/2008 05:00:00 AM,THEFT,FROM BUILDING,false,false,8,41.895774559,-87.621552652,2008-02-26T05:00:00.000+02:00,2,26,5,2008,Non-Violent
6021066,01/12/2008 03:15:00 PM,ROBBERY,ARMED: HANDGUN,false,false,43,41.766266256,-87.573419937,2008-01-12T15:15:00.000+02:00,1,12,15,2008,Violent
6134571,03/15/2008 03:30:00 PM,ASSAULT,SIMPLE,false,false,29,41.866473624,-87.699180867,2008-03-15T15:30:00.000+02:00,3,15,15,2008,Violent
6064461,01/14/2008 02:35:00 AM,NARCOTICS,SOLICIT NARCOTICS ON PUBLICWAY,true,false,8,41.902811108,-87.631414693,2008-01-14T02:35:00.000+02:00,1,14,2,2008,Non-Violent
6045537,01/17/2008 07:18:00 PM,BATTERY,AGGRAVATED: OTHER DANG WEAPON,false,false,25,41.88774484,-87.76590246,2008-01-17T19:18:00.000+02:00,1,17,19,2008,Violent
6148873,03/23/2008 03:40:00 PM,ASSAULT,SIMPLE,false,true,38,41.816339694,-87.606698968,2008-03-23T15:40:00.000+02:00,3,23,15,2008,Violent
6118243,02/13/2008 12:00:00 AM,DECEPTIVE PRACTICE,FRAUD OR CONFIDENCE GAME,false,false,61,41.794062319,-87.662765006,2008-02-13T00:00:00.000+02:00,2,13,0,2008,Non-Violent
6022337,01/14/2008 11:00:27 PM,NARCOTICS,POSS: CANNABIS MORE THAN 30GMS,true,false,38,41.809314925,-87.620808615,2008-01-14T23:00:27.000+02:00,1,14,23,2008,Non-Violent
6001745,01/06/2008 10:50:00 AM,THEFT,RETAIL THEFT,false,false,67,41.778938708,-87.664205796,2008-01-06T10:50:00.000+02:00,1,6,10,2008,Non-Violent
6124590,03/10/2008 08:15:00 PM,BATTERY,DOMESTIC BATTERY SIMPLE,true,true,42,41.777366068,-87.604635062,2008-03-10T20:15:00.000+02:00,3,10,20,2008,Violent
6037226,01/23/2008 09:37:29 PM,NARCOTICS,POSS: CANNABIS 30GMS OR LESS,true,false,16,41.949333627,-87.70177901,2008-01-23T21:37:29.000+02:00,1,23,21,2008,Non-Violent
6134621,03/15/2008 03:00:00 PM,THEFT,$500 AND UNDER,false,false,56,41.791952663,-87.800723443,2008-03-15T15:00:00.000+02:00,3,15,15,2008,Non-Violent
6123187,01/07/2008 07:45:05 PM,CRIMINAL TRESPASS,TO RESIDENCE,false,false,23,41.895470043,-87.715418807,2008-01-07T19:45:05.000+02:00,1,7,19,2008,Non-Violent
6101899,02/25/2008 08:50:00 PM,OTHER OFFENSE,FALSE/STOLEN/ALTERED TRP,false,false,30,41.845760134,-87.697722894,2008-02-25T20:50:00.000+02:00,2,25,20,2008,Non-Violent
6109465,03/02/2008 08:35:00 AM,THEFT,RETAIL THEFT,false,false,25,41.909676677,-87.783357173,2008-03-02T08:35:00.000+02:00,3,2,8,2008,Non-Violent
6039660,01/24/2008 01:15:00 PM,NARCOTICS,POSS: CANNABIS 30GMS OR LESS,true,false,16,41.939753737,-87.738286881,2008-01-24T13:15:00.000+02:00,1,24,13,2008,Non-Violent
6015605,01/12/2008 01:07:00 AM,NARCOTICS,POSS: CANNABIS 30GMS OR LESS,true,false,7,41.926369385,-87.633964012,2008-01-12T01:07:00.000+02:00,1,12,1,2008,Non-Violent
6052963,01/31/2008 11:50:00 AM,THEFT,RETAIL THEFT,true,false,8,41.899410159,-87.624131266,2008-01-31T11:50:00.000+02:00,1,31,11,2008,Non-Violent
6162768,03/31/2008 12:45:00 AM,BATTERY,DOMESTIC BATTERY SIMPLE,false,true,75,41.682448371,-87.670327915,2008-03-31T00:45:00.000+02:00,3,31,0,2008,Violent
6067033,02/08/2008 03:00:00 PM,BATTERY,SIMPLE,false,false,10,41.983462159,-87.787724752,2008-02-08T15:00:00.000+02:00,2,8,15,2008,Violent
6128308,03/01/2008 10:35:00 PM,NARCOTICS,POSS: CANNABIS 30GMS OR LESS,true,false,61,41.801412842,-87.657839815,2008-03-01T22:35:00.000+02:00,3,1,22,2008,Non-Violent
6007539,01/08/2008 08:27:23 PM,BATTERY,DOMESTIC BATTERY SIMPLE,false,true,1,42.022526417,-87.672455756,2008-01-08T20:27:23.000+02:00,1,8,20,2008,Violent
6018128,01/13/2008 12:09:11 PM,MOTOR VEHICLE THEFT,THEFT/RECOVERY: AUTOMOBILE,false,false,40,41.799137324,-87.620958045,2008-01-13T12:09:11.000+02:00,1,13,12,2008,Non-Violent
6129136,03/10/2008 11:30:00 AM,OTHER OFFENSE,TELEPHONE THREAT,false,true,58,41.824034743,-87.70689357,2008-03-10T11:30:00.000+02:00,3,10,11,2008,Non-Violent
6094564,02/23/2008 07:00:00 AM,ASSAULT,SIMPLE,false,true,68,41.777197018,-87.647150348,2008-02-23T07:00:00.000+02:00,2,23,7,2008,Violent
6107784,02/19/2008 03:52:50 PM,NARCOTICS,POSS: CANNABIS 30GMS OR LESS,true,false,38,41.808856306,-87.621198838,2008-02-19T15:52:50.000+02:00,2,19,15,2008,Non-Violent
6019310,01/12/2008 05:00:00 PM,MOTOR VEHICLE THEFT,THEFT/RECOVERY: AUTOMOBILE,false,false,13,41.98166603,-87.714913446,2008-01-12T17:00:00.000+02:00,1,12,17,2008,Non-Violent
6154139,03/23/2008 05:35:00 PM,CRIMINAL DAMAGE,TO PROPERTY,false,true,71,41.735961774,-87.6514072,2008-03-23T17:35:00.000+02:00,3,23,17,2008,Non-Violent
6007142,01/08/2008 04:50:00 PM,ASSAULT,SIMPLE,false,false,33,41.857533855,-87.625603607,2008-01-08T16:50:00.000+02:00,1,8,16,2008,Violent
6036998,01/23/2008 05:50:28 PM,NARCOTICS,POSS: CRACK,true,false,25,41.878244691,-87.754988896,2008-01-23T17:50:28.000+02:00,1,23,17,2008,Non-Violent
6115281,03/05/2008 02:00:00 PM,MOTOR VEHICLE THEFT,AUTOMOBILE,false,false,71,41.737861254,-87.645491772,2008-03-05T14:00:00.000+02:00,3,5,14,2008,Non-Violent
6119591,03/07/2008 09:00:00 AM,MOTOR VEHICLE THEFT,AUTOMOBILE,false,false,30,41.847128473,-87.691121329,2008-03-07T09:00:00.000+02:00,3,7,9,2008,Non-Violent
6034069,01/22/2008 09:10:00 AM,CRIMINAL DAMAGE,TO PROPERTY,false,false,75,41.695864114,-87.65319671,2008-01-22T09:10:00.000+02:00,1,22,9,2008,Non-Violent
6133864,03/14/2008 04:37:41 PM,CRIMINAL DAMAGE,TO VEHICLE,false,false,67,41.779310448,-87.674394341,2008-03-14T16:37:41.000+02:00,3,14,16,2008,Non-Violent
6152983,03/20/2008 08:58:08 PM,NARCOTICS,POSS: CANNABIS 30GMS OR LESS,true,false,38,41.808981361,-87.606551046,2008-03-20T20:58:08.000+02:00,3,20,20,2008,Non-Violent
6031888,01/20/2008 02:00:00 AM,CRIMINAL DAMAGE,TO PROPERTY,false,false,67,41.78407744,-87.669179285,2008-01-20T02:00:00.000+02:00,1,20,2,2008,Non-Violent
6135429,03/15/2008 10:10:58 PM,NARCOTICS,POSS: CANNABIS 30GMS OR LESS,true,false,68,41.773326331,-87.654332957,2008-03-15T22:10:58.000+02:00,3,15,22,2008,Non-Violent
6078967,02/14/2008 04:30:00 PM,OTHER OFFENSE,TELEPHONE THREAT,false,false,25,41.906441515,-87.757114973,2008-02-14T16:30:00.000+02:00,2,14,16,2008,Non-Violent
6024364,01/14/2008 05:00:00 PM,CRIMINAL DAMAGE,CRIMINAL DEFACEMENT,false,false,76,41.980967223,-87.844900486,2008-01-14T17:00:00.000+02:00,1,14,17,2008,Non-Violent
6124672,03/10/2008 09:54:24 PM,THEFT,$500 AND UNDER,false,false,43,41.75278901,-87.556999304,2008-03-10T21:54:24.000+02:00,3,10,21,2008,Non-Violent
6074105,02/07/2008 08:20:00 PM,NARCOTICS,POSS: CANNABIS 30GMS OR LESS,true,false,23,41.89765683,-87.726152565,2008-02-07T20:20:00.000+02:00,2,7,20,2008,Non-Violent
6081338,02/16/2008 01:28:50 PM,THEFT,OVER $500,false,false,51,41.709225834,-87.568865933,2008-02-16T13:28:50.000+02:00,2,16,13,2008,Non-Violent
6024219,01/16/2008 03:00:00 PM,CRIMINAL DAMAGE,TO VEHICLE,false,false,31,41.853082035,-87.676783353,2008-01-16T15:00:00.000+02:00,1,16,15,2008,Non-Violent
6129536,03/11/2008 02:40:00 PM,NARCOTICS,POSS: CANNABIS 30GMS OR LESS,true,false,1,42.021140334,-87.669080649,2008-03-11T14:40:00.000+02:00,3,11,14,2008,Non-Violent
6015097,01/11/2008 05:00:00 PM,THEFT,OVER $500,false,false,6,41.94058948,-87.669957758,2008-01-11T17:00:00.000+02:00,1,11,17,2008,Non-Violent
6122364,03/09/2008 04:31:39 PM,THEFT,$500 AND UNDER,false,false,43,41.754480777,-87.584480414,2008-03-09T16:31:39.000+02:00,3,9,16,2008,Non-Violent
6131330,03/13/2008 10:26:02 AM,BURGLARY,FORCIBLE ENTRY,false,false,49,41.711815837,-87.628431273,2008-03-13T10:26:02.000+02:00,3,13,10,2008,Non-Violent
6027806,01/14/2008 03:00:00 PM,OTHER OFFENSE,TELEPHONE THREAT,false,false,68,41.776943218,-87.651999767,2008-01-14T15:00:00.000+02:00,1,14,15,2008,Non-Violent
6148607,03/23/2008 11:00:00 PM,OTHER OFFENSE,TELEPHONE THREAT,false,true,25,41.87384532,-87.763154118,2008-03-23T23:00:00.000+02:00,3,23,23,2008,Non-Violent
6140887,03/19/2008 02:36:50 AM,BATTERY,DOMESTIC BATTERY SIMPLE,false,true,52,,,2008-03-19T02:36:50.000+02:00,3,19,2,2008,Violent
6064070,01/28/2008 11:30:00 AM,THEFT,$500 AND UNDER,false,false,58,41.814983917,-87.684608383,2008-01-28T11:30:00.000+02:00,1,28,11,2008,Non-Violent
6116156,03/05/2008 11:54:42 PM,BATTERY,DOMESTIC BATTERY SIMPLE,false,true,33,41.853930752,-87.623841071,2008-03-05T23:54:42.000+02:00,3,5,23,2008,Violent
6161565,03/30/2008 03:40:00 AM,CRIMINAL DAMAGE,TO VEHICLE,false,false,49,41.693673001,-87.63878264,2008-03-30T03:40:00.000+02:00,3,30,3,2008,Non-Violent
6121475,03/07/2008 11:15:00 AM,NARCOTICS,SOLICIT NARCOTICS ON PUBLICWAY,true,false,27,41.871781022,-87.713763476,2008-03-07T11:15:00.000+02:00,3,7,11,2008,Non-Violent
6020219,01/11/2008 09:49:19 PM,BATTERY,AGGRAVATED: HANDGUN,false,false,38,41.814298511,-87.611575233,2008-01-11T21:49:19.000+02:00,1,11,21,2008,Violent
6108317,03/02/2008 12:10:00 AM,BATTERY,DOMESTIC BATTERY SIMPLE,false,true,25,41.879288484,-87.741712366,2008-03-02T00:10:00.000+02:00,3,2,0,2008,Violent
6084594,02/12/2008 10:33:00 PM,NARCOTICS,POSS: CANNABIS 30GMS OR LESS,true,false,25,41.889116365,-87.74559546,2008-02-12T22:33:00.000+02:00,2,12,22,2008,Non-Violent
6095544,02/23/2008 11:00:00 PM,BATTERY,DOMESTIC BATTERY SIMPLE,false,true,6,41.935596201,-87.638607987,2008-02-23T23:00:00.000+02:00,2,23,23,2008,Violent
6041889,01/26/2008 10:30:00 AM,BATTERY,DOMESTIC BATTERY SIMPLE,true,true,28,41.877565108,-87.68479102,2008-01-26T10:30:00.000+02:00,1,26,10,2008,Violent
6069494,02/10/2008 06:20:52 AM,BATTERY,DOMESTIC BATTERY SIMPLE,false,true,52,41.705515521,-87.540118241,2008-02-10T06:20:52.000+02:00,2,10,6,2008,Violent
6081711,02/17/2008 11:09:25 AM,ASSAULT,SIMPLE,false,true,68,41.771188145,-87.637301882,2008-02-17T11:09:25.000+02:00,2,17,11,2008,Violent
6034653,01/18/2008 08:20:00 PM,PROSTITUTION,SOLICIT ON PUBLIC WAY,true,false,29,41.858216509,-87.737160227,2008-01-18T20:20:00.000+02:00,1,18,20,2008,Non-Violent
6140627,03/19/2008 01:40:36 AM,MOTOR VEHICLE THEFT,AUTOMOBILE,false,false,68,41.773539841,-87.635465451,2008-03-19T01:40:36.000+02:00,3,19,1,2008,Non-Violent
6064862,02/06/2008 10:00:00 AM,THEFT,OVER $500,false,false,72,41.700115754,-87.682699231,2008-02-06T10:00:00.000+02:00,2,6,10,2008,Non-Violent
6080795,02/14/2008 09:00:00 AM,CRIMINAL SEXUAL ASSAULT,NON-AGGRAVATED,false,false,54,41.651431574,-87.617230951,2008-02-14T09:00:00.000+02:00,2,14,9,2008,Violent
6060161,02/05/2008 05:00:00 PM,MOTOR VEHICLE THEFT,AUTOMOBILE,false,false,44,41.736422269,-87.604815966,2008-02-05T17:00:00.000+02:00,2,5,17,2008,Non-Violent
6098799,02/24/2008 08:30:00 PM,BATTERY,DOMESTIC BATTERY SIMPLE,false,true,44,,,2008-02-24T20:30:00.000+02:00,2,24,20,2008,Violent
6044874,01/22/2008 05:30:00 PM,THEFT,FROM BUILDING,false,false,53,41.682078365,-87.65908937,2008-01-22T17:30:00.000+02:00,1,22,17,2008,Non-Violent
6139595,03/18/2008 12:00:00 AM,THEFT,$500 AND UNDER,false,false,8,41.906097165,-87.625354033,2008-03-18T00:00:00.000+02:00,3,18,0,2008,Non-Violent
6025216,01/12/2008 12:00:00 AM,CRIMINAL DAMAGE,TO VEHICLE,false,false,10,41.978836729,-87.828808134,2008-01-12T00:00:00.000+02:00,1,12,0,2008,Non-Violent
6110051,03/01/2008 03:45:00 AM,BATTERY,SIMPLE,false,false,64,41.771961744,-87.742076435,2008-03-01T03:45:00.000+02:00,3,1,3,2008,Violent
6058317,02/03/2008 11:00:00 PM,CRIMINAL DAMAGE,TO VEHICLE,false,false,65,41.773213221,-87.721132127,2008-02-03T23:00:00.000+02:00,2,3,23,2008,Non-Violent
6123825,03/10/2008 12:08:00 PM,OFFENSE INVOLVING CHILDREN,CRIM SEX ABUSE BY FAM MEMBER,false,false,68,41.75883012,-87.649105326,2008-03-10T12:08:00.000+02:00,3,10,12,2008,Non-Violent
6016856,01/12/2008 12:02:35 AM,ASSAULT,SIMPLE,false,true,29,41.863515576,-87.715337436,2008-01-12T00:02:35.000+02:00,1,12,0,2008,Violent
6067168,02/08/2008 08:56:00 PM,THEFT,RETAIL THEFT,false,false,56,41.795119256,-87.766254471,2008-02-08T20:56:00.000+02:00,2,8,20,2008,Non-Violent
6135330,03/15/2008 11:50:00 PM,BATTERY,AGGRAVATED: OTHER DANG WEAPON,true,false,7,41.918046646,-87.657415862,2008-03-15T23:50:00.000+02:00,3,15,23,2008,Violent
6065131,02/04/2008 08:30:00 AM,THEFT,FROM BUILDING,false,false,7,41.918646522,-87.64613311,2008-02-04T08:30:00.000+02:00,2,4,8,2008,Non-Violent
6146136,03/20/2008 02:00:00 PM,THEFT,OVER $500,false,false,71,41.744489168,-87.654790779,2008-03-20T14:00:00.000+02:00,3,20,14,2008,Non-Violent
6155596,03/25/2008 10:30:00 AM,OTHER OFFENSE,VIO BAIL BOND: DOM VIOLENCE,true,true,27,41.870112418,-87.699662588,2008-03-25T10:30:00.000+02:00,3,25,10,2008,Non-Violent
6030465,01/20/2008 08:00:00 PM,OTHER OFFENSE,TELEPHONE THREAT,false,true,25,41.898532866,-87.761557128,2008-01-20T20:00:00.000+02:00,1,20,20,2008,Non-Violent
6107550,02/14/2008 05:00:00 PM,BURGLARY,FORCIBLE ENTRY,false,false,15,41.943219177,-87.760305284,2008-02-14T17:00:00.000+02:00,2,14,17,2008,Non-Violent
6111757,02/28/2008 10:20:00 AM,NARCOTICS,POSS: CANNABIS 30GMS OR LESS,true,false,63,41.791220341,-87.688848758,2008-02-28T10:20:00.000+02:00,2,28,10,2008,Non-Violent
6082770,02/19/2008 12:24:11 AM,CRIMINAL DAMAGE,TO PROPERTY,false,false,61,41.801355133,-87.645341277,2008-02-19T00:24:11.000+02:00,2,19,0,2008,Non-Violent
6019217,01/13/2008 11:30:00 AM,BATTERY,SIMPLE,false,false,49,41.705968345,-87.622302438,2008-01-13T11:30:00.000+02:00,1,13,11,2008,Violent
6109835,02/29/2008 09:00:00 AM,BURGLARY,FORCIBLE ENTRY,false,false,8,41.903684856,-87.645195215,2008-02-29T09:00:00.000+02:00,2,29,9,2008,Non-Violent
6163079,03/29/2008 05:30:00 AM,CRIM SEXUAL ASSAULT,AGGRAVATED: OTHER DANG WEAPON,false,false,25,41.914284365,-87.772038259,2008-03-29T05:30:00.000+02:00,3,29,5,2008,Non-Violent
6029433,01/19/2008 10:09:24 PM,ASSAULT,SIMPLE,false,false,7,41.926752802,-87.642448526,2008-01-19T22:09:24.000+02:00,1,19,22,2008,Violent
6161546,03/28/2008 05:04:00 PM,CRIMINAL DAMAGE,TO PROPERTY,false,false,31,41.858888015,-87.654449089,2008-03-28T17:04:00.000+02:00,3,28,17,2008,Non-Violent
5997294,01/03/2008 10:17:00 PM,MOTOR VEHICLE THEFT,AUTOMOBILE,true,false,42,41.778598116,-87.605479026,2008-01-03T22:17:00.000+02:00,1,3,22,2008,Non-Violent
6018618,01/14/2008 10:30:00 AM,THEFT,$500 AND UNDER,false,false,6,41.93991842,-87.653288878,2008-01-14T10:30:00.000+02:00,1,14,10,2008,Non-Violent
6097696,02/07/2008 02:12:00 PM,OTHER OFFENSE,VIOLATE ORDER OF PROTECTION,true,true,3,41.962476151,-87.669282204,2008-02-07T14:12:00.000+02:00,2,7,14,2008,Non-Violent
6132053,03/06/2008 04:08:00 PM,BURGLARY,FORCIBLE ENTRY,true,false,71,41.753985135,-87.664263469,2008-03-06T16:08:00.000+02:00,3,6,16,2008,Non-Violent
6105125,02/27/2008 09:45:00 AM,CRIMINAL DAMAGE,TO PROPERTY,false,false,67,41.764066402,-87.659345986,2008-02-27T09:45:00.000+02:00,2,27,9,2008,Non-Violent
5995200,01/02/2008 10:00:00 PM,THEFT,$500 AND UNDER,false,false,25,41.897323317,-87.755657925,2008-01-02T22:00:00.000+02:00,1,2,22,2008,Non-Violent
6099706,02/22/2008 03:45:00 PM,OTHER OFFENSE,TELEPHONE THREAT,false,true,44,,,2008-02-22T15:45:00.000+02:00,2,22,15,2008,Non-Violent
6017405,01/11/2008 02:30:00 PM,BATTERY,DOMESTIC BATTERY SIMPLE,false,true,14,41.967389752,-87.709668262,2008-01-11T14:30:00.000+02:00,1,11,14,2008,Violent
6030091,01/18/2008 02:08:00 PM,DECEPTIVE PRACTICE,UNLAWFUL USE OF RECORDED SOUND,true,false,71,41.736066281,-87.644085679,2008-01-18T14:08:00.000+02:00,1,18,14,2008,Non-Violent
6074418,02/14/2008 12:10:00 AM,OTHER OFFENSE,TELEPHONE THREAT,false,true,70,41.735346079,-87.693218046,2008-02-14T00:10:00.000+02:00,2,14,0,2008,Non-Violent
6081174,02/17/2008 08:49:27 AM,ARSON,BY FIRE,false,false,25,41.884111636,-87.77040016,2008-02-17T08:49:27.000+02:00,2,17,8,2008,Non-Violent
6050291,01/30/2008 08:20:00 AM,BATTERY,AGGRAVATED DOMESTIC BATTERY: KNIFE/CUTTING INST,false,true,66,41.783899619,-87.698400231,2008-01-30T08:20:00.000+02:00,1,30,8,2008,Violent
6159948,03/27/2008 07:09:00 PM,THEFT,RETAIL THEFT,true,false,6,41.938636968,-87.64960867,2008-03-27T19:09:00.000+02:00,3,27,19,2008,Non-Violent
6066744,02/09/2008 02:17:38 AM,BATTERY,AGGRAVATED: OTHER DANG WEAPON,false,false,61,41.808548727,-87.670690889,2008-02-09T02:17:38.000+02:00,2,9,2,2008,Violent
6123849,03/10/2008 02:00:00 PM,MOTOR VEHICLE THEFT,AUTOMOBILE,false,false,58,41.820780888,-87.694591109,2008-03-10T14:00:00.000+02:00,3,10,14,2008,Non-Violent
6118226,03/06/2008 09:18:00 PM,CRIMINAL DAMAGE,TO VEHICLE,false,false,17,41.960174996,-87.788342597,2008-03-06T21:18:00.000+02:00,3,6,21,2008,Non-Violent
6079258,02/14/2008 02:30:00 PM,BATTERY,AGGRAVATED DOMESTIC BATTERY: OTHER DANG WEAPON,false,true,44,41.742959421,-87.62682291,2008-02-14T14:30:00.000+02:00,2,14,14,2008,Violent
6028447,01/18/2008 11:00:00 PM,CRIMINAL DAMAGE,TO VEHICLE,false,false,59,41.82500923,-87.66648168,2008-01-18T23:00:00.000+02:00,1,18,23,2008,Non-Violent
6120679,03/07/2008 12:50:00 PM,CRIMINAL TRESPASS,TO LAND,true,false,8,41.889551923,-87.626649565,2008-03-07T12:50:00.000+02:00,3,7,12,2008,Non-Violent
6104647,02/28/2008 11:17:00 AM,ASSAULT,SIMPLE,false,false,24,41.899065363,-87.667375699,2008-02-28T11:17:00.000+02:00,2,28,11,2008,Violent
6015678,01/10/2008 07:00:00 PM,CRIMINAL DAMAGE,TO PROPERTY,false,false,15,41.953666074,-87.779244016,2008-01-10T19:00:00.000+02:00,1,10,19,2008,Non-Violent
6142342,03/19/2008 02:30:00 AM,ROBBERY,ARMED: HANDGUN,false,false,25,41.888119752,-87.765135251,2008-03-19T02:30:00.000+02:00,3,19,2,2008,Violent
6055343,01/30/2008 08:30:00 AM,CRIMINAL DAMAGE,TO PROPERTY,false,true,71,41.753952607,-87.666693629,2008-01-30T08:30:00.000+02:00,1,30,8,2008,Non-Violent
6094907,02/22/2008 12:00:00 PM,CRIMINAL DAMAGE,TO PROPERTY,false,false,58,41.812827251,-87.702905354,2008-02-22T12:00:00.000+02:00,2,22,12,2008,Non-Violent
6133596,03/14/2008 09:55:00 AM,BATTERY,DOMESTIC BATTERY SIMPLE,false,true,66,41.762781016,-87.68881454,2008-03-14T09:55:00.000+02:00,3,14,9,2008,Violent
6084584,02/15/2008 09:00:00 AM,THEFT,FROM BUILDING,false,false,54,41.64792153,-87.613274338,2008-02-15T09:00:00.000+02:00,2,15,9,2008,Non-Violent
6142059,03/18/2008 10:38:00 PM,WEAPONS VIOLATION,UNLAWFUL POSS OF HANDGUN,true,false,49,41.712546903,-87.629950563,2008-03-18T22:38:00.000+02:00,3,18,22,2008,Non-Violent
6127768,03/08/2008 11:40:00 PM,NARCOTICS,POSS: CANNABIS 30GMS OR LESS,true,false,15,41.939630149,-87.755460014,2008-03-08T23:40:00.000+02:00,3,8,23,2008,Non-Violent
6081658,02/17/2008 01:35:00 PM,THEFT,$500 AND UNDER,false,false,28,41.870010391,-87.639285562,2008-02-17T13:35:00.000+02:00,2,17,13,2008,Non-Violent
5995352,01/02/2008 12:01:00 AM,CRIMINAL TRESPASS,TO LAND,false,false,32,41.883208167,-87.633072493,2008-01-02T00:01:00.000+02:00,1,2,0,2008,Non-Violent
6128947,03/12/2008 09:50:00 PM,CRIMINAL TRESPASS,TO LAND,false,false,24,41.893285756,-87.656538409,2008-03-12T21:50:00.000+02:00,3,12,21,2008,Non-Violent
6068196,02/08/2008 03:15:00 PM,WEAPONS VIOLATION,UNLAWFUL USE HANDGUN,true,false,77,41.987181547,-87.666803855,2008-02-08T15:15:00.000+02:00,2,8,15,2008,Non-Violent
6117061,02/21/2008 08:00:00 AM,DECEPTIVE PRACTICE,ILLEGAL USE CASH CARD,false,false,28,41.878021378,-87.64164809,2008-02-21T08:00:00.000+02:00,2,21,8,2008,Non-Violent
6022097,01/15/2008 03:00:00 PM,OTHER OFFENSE,TELEPHONE THREAT,false,false,16,41.9670996,-87.74142642,2008-01-15T15:00:00.000+02:00,1,15,15,2008,Non-Violent
6130090,03/11/2008 02:23:00 PM,ASSAULT,AGGRAVATED: HANDGUN,false,false,23,41.91043132,-87.725127755,2008-03-11T14:23:00.000+02:00,3,11,14,2008,Violent
6076091,01/14/2008 09:00:00 AM,OTHER OFFENSE,HARASSMENT BY TELEPHONE,false,false,18,41.933150748,-87.801986982,2008-01-14T09:00:00.000+02:00,1,14,9,2008,Non-Violent
6064619,02/07/2008 09:00:00 AM,BATTERY,AGGRAVATED PO: OTHER DANG WEAP,true,false,68,41.766161253,-87.649291358,2008-02-07T09:00:00.000+02:00,2,7,9,2008,Violent
6074644,02/01/2008 11:00:00 AM,BURGLARY,UNLAWFUL ENTRY,false,false,63,41.794476866,-87.706029976,2008-02-01T11:00:00.000+02:00,2,1,11,2008,Non-Violent
6121481,03/07/2008 01:30:00 PM,NARCOTICS,POSS: CANNABIS 30GMS OR LESS,true,false,26,41.875872318,-87.725503265,2008-03-07T13:30:00.000+02:00,3,7,13,2008,Non-Violent
6119015,03/06/2008 09:00:00 PM,NARCOTICS,POSS: HEROIN(WHITE),true,false,29,41.866858673,-87.719541962,2008-03-06T21:00:00.000+02:00,3,6,21,2008,Non-Violent
6152594,03/24/2008 12:01:00 AM,THEFT,OVER $500,false,false,20,41.931707213,-87.733451801,2008-03-24T00:01:00.000+02:00,3,24,0,2008,Non-Violent
6140495,03/18/2008 09:39:44 PM,CRIMINAL DAMAGE,TO PROPERTY,false,false,46,41.743736985,-87.555180936,2008-03-18T21:39:44.000+02:00,3,18,21,2008,Non-Violent
6147715,03/21/2008 06:10:00 PM,OTHER OFFENSE,TELEPHONE THREAT,false,true,63,,,2008-03-21T18:10:00.000+02:00,3,21,18,2008,Non-Violent
6045933,01/27/2008 10:10:00 PM,THEFT,OVER $500,false,false,7,41.917402098,-87.635454463,2008-01-27T22:10:00.000+02:00,1,27,22,2008,Non-Violent
6134015,03/15/2008 02:30:45 AM,THEFT,$500 AND UNDER,false,false,25,41.897051576,-87.750756828,2008-03-15T02:30:45.000+02:00,3,15,2,2008,Non-Violent
6042689,01/25/2008 08:50:16 AM,THEFT,$500 AND UNDER,true,false,38,41.81597361,-87.618331997,2008-01-25T08:50:16.000+02:00,1,25,8,2008,Non-Violent
6020153,01/07/2008 04:30:00 PM,ROBBERY,STRONGARM - NO WEAPON,true,false,34,41.849061414,-87.638939487,2008-01-07T16:30:00.000+02:00,1,7,16,2008,Violent
6122200,03/08/2008 09:30:00 PM,MOTOR VEHICLE THEFT,"TRUCK, BUS, MOTOR HOME",false,false,24,41.895138471,-87.66834208,2008-03-08T21:30:00.000+02:00,3,8,21,2008,Non-Violent
6163414,03/18/2008 01:10:00 PM,NARCOTICS,MANU/DELIVER: HEROIN (WHITE),true,false,39,41.812560204,-87.604434374,2008-03-18T13:10:00.000+02:00,3,18,13,2008,Non-Violent
6151364,03/24/2008 10:00:00 AM,ASSAULT,AGGRAVATED: OTHER DANG WEAPON,false,false,68,41.788638889,-87.645011568,2008-03-24T10:00:00.000+02:00,3,24,10,2008,Violent
6088415,02/08/2008 07:00:00 AM,PROSTITUTION,SOLICIT ON PUBLIC WAY,true,false,26,41.880565994,-87.739332063,2008-02-08T07:00:00.000+02:00,2,8,7,2008,Non-Violent
6085539,02/19/2008 07:25:00 PM,THEFT,OVER $500,false,false,60,41.824510288,-87.646542657,2008-02-19T19:25:00.000+02:00,2,19,19,2008,Non-Violent
6273779,05/28/2008 02:50:00 AM,BATTERY,AGGRAVATED:KNIFE/CUTTING INSTR,false,true,67,41.780855651,-87.663038277,2008-05-28T02:50:00.000+02:00,5,28,2,2008,Violent
6268409,05/23/2008 08:00:00 PM,BATTERY,SIMPLE,false,false,65,41.765128817,-87.714020882,2008-05-23T20:00:00.000+02:00,5,23,20,2008,Violent
6291236,06/06/2008 11:50:00 PM,CRIMINAL DAMAGE,TO VEHICLE,false,false,58,41.807510157,-87.685388034,2008-06-06T23:50:00.000+02:00,6,6,23,2008,Non-Violent
6228165,04/30/2008 08:00:00 AM,THEFT,$500 AND UNDER,false,false,33,41.85102174,-87.618954852,2008-04-30T08:00:00.000+02:00,4,30,8,2008,Non-Violent
6288545,06/05/2008 09:00:00 PM,THEFT,$500 AND UNDER,false,false,24,41.894922383,-87.665626346,2008-06-05T21:00:00.000+02:00,6,5,21,2008,Non-Violent
6310784,06/13/2008 03:00:00 PM,CRIMINAL DAMAGE,CRIMINAL DEFACEMENT,false,false,22,,,2008-06-13T15:00:00.000+02:00,6,13,15,2008,Non-Violent
6339146,07/02/2008 12:00:00 AM,THEFT,OVER $500,false,false,22,41.916515538,-87.705795233,2008-07-02T00:00:00.000+02:00,7,2,0,2008,Non-Violent
6225285,05/01/2008 08:50:00 PM,BATTERY,DOMESTIC BATTERY SIMPLE,false,true,29,41.858542789,-87.71275698,2008-05-01T20:50:00.000+02:00,5,1,20,2008,Violent
6327646,06/21/2008 07:00:00 PM,THEFT,FROM BUILDING,false,false,66,41.776622842,-87.70308407,2008-06-21T19:00:00.000+02:00,6,21,19,2008,Non-Violent
6192976,04/04/2008 11:00:00 PM,BURGLARY,UNLAWFUL ENTRY,false,false,61,41.797348695,-87.674400294,2008-04-04T23:00:00.000+02:00,4,4,23,2008,Non-Violent
6352910,07/08/2008 09:22:00 PM,BATTERY,DOMESTIC BATTERY SIMPLE,true,true,46,41.738469953,-87.559952765,2008-07-08T21:22:00.000+02:00,7,8,21,2008,Violent
6286953,06/04/2008 09:20:00 PM,BATTERY,SIMPLE,true,false,54,41.656568509,-87.602331692,2008-06-04T21:20:00.000+02:00,6,4,21,2008,Violent
6189919,04/14/2008 04:15:00 PM,BATTERY,DOMESTIC BATTERY SIMPLE,true,true,66,41.777291241,-87.6890139,2008-04-14T16:15:00.000+02:00,4,14,16,2008,Violent
6305212,06/14/2008 10:00:00 AM,THEFT,$500 AND UNDER,false,false,6,41.951584219,-87.649617365,2008-06-14T10:00:00.000+02:00,6,14,10,2008,Non-Violent
6166311,03/31/2008 09:54:35 PM,CRIMINAL DAMAGE,TO PROPERTY,false,false,29,41.849011755,-87.734426896,2008-03-31T21:54:35.000+02:00,3,31,21,2008,Non-Violent
6293870,06/07/2008 11:13:00 PM,ASSAULT,SIMPLE,false,true,7,41.925160357,-87.667394686,2008-06-07T23:13:00.000+02:00,6,7,23,2008,Violent
6251282,05/15/2008 06:27:00 PM,CRIMINAL DAMAGE,TO PROPERTY,false,false,50,41.706529012,-87.605340317,2008-05-15T18:27:00.000+02:00,5,15,18,2008,Non-Violent
6175978,04/03/2008 04:04:45 PM,BURGLARY,FORCIBLE ENTRY,false,false,25,41.890193984,-87.752978676,2008-04-03T16:04:45.000+02:00,4,3,16,2008,Non-Violent
6249025,05/13/2008 01:50:00 PM,BATTERY,PRO EMP HANDS NO/MIN INJURY,true,false,68,41.793876041,-87.649323127,2008-05-13T13:50:00.000+02:00,5,13,13,2008,Violent
6295257,06/08/2008 03:54:31 AM,BATTERY,DOMESTIC BATTERY SIMPLE,false,true,25,41.909304522,-87.771670424,2008-06-08T03:54:31.000+02:00,6,8,3,2008,Violent
6332114,06/25/2008 11:50:00 PM,BATTERY,DOMESTIC BATTERY SIMPLE,false,true,46,41.750993798,-87.552883476,2008-06-25T23:50:00.000+02:00,6,25,23,2008,Violent
6174589,04/05/2008 05:00:00 AM,BATTERY,AGG PO HANDS NO/MIN INJURY,true,false,15,41.951501344,-87.753224285,2008-04-05T05:00:00.000+02:00,4,5,5,2008,Violent
6185685,04/08/2008 05:30:00 PM,SEX OFFENSE,CRIMINAL SEXUAL ABUSE,false,false,28,41.874363279,-87.643013039,2008-04-08T17:30:00.000+02:00,4,8,17,2008,Non-Violent
6323256,06/23/2008 04:55:00 PM,THEFT,RETAIL THEFT,true,false,31,41.857967236,-87.655596783,2008-06-23T16:55:00.000+02:00,6,23,16,2008,Non-Violent
6327817,06/25/2008 08:30:00 PM,PROSTITUTION,SOLICIT ON PUBLIC WAY,true,false,40,41.792490517,-87.619165105,2008-06-25T20:30:00.000+02:00,6,25,20,2008,Non-Violent
6258002,05/19/2008 10:30:00 AM,ROBBERY,STRONGARM - NO WEAPON,false,false,19,41.931457901,-87.785705885,2008-05-19T10:30:00.000+02:00,5,19,10,2008,Violent
6272341,05/28/2008 12:01:00 AM,THEFT,$500 AND UNDER,false,false,61,41.800793966,-87.668416218,2008-05-28T00:01:00.000+02:00,5,28,0,2008,Non-Violent
6235631,05/07/2008 04:20:00 PM,CRIMINAL TRESPASS,TO LAND,true,false,25,41.882254819,-87.763931315,2008-05-07T16:20:00.000+02:00,5,7,16,2008,Non-Violent
6250905,05/15/2008 06:00:55 PM,ASSAULT,SIMPLE,true,false,53,41.67710047,-87.629842491,2008-05-15T18:00:55.000+02:00,5,15,18,2008,Violent
6226022,05/02/2008 10:00:00 PM,CRIMINAL DAMAGE,TO VEHICLE,false,false,20,41.916300424,-87.726530677,2008-05-02T22:00:00.000+02:00,5,2,22,2008,Non-Violent
6361533,07/10/2008 08:30:00 AM,THEFT,FROM BUILDING,false,false,68,41.793323548,-87.634132413,2008-07-10T08:30:00.000+02:00,7,10,8,2008,Non-Violent
6272016,05/10/2008 10:00:00 AM,THEFT,OVER $500,false,false,28,41.887485143,-87.644656629,2008-05-10T10:00:00.000+02:00,5,10,10,2008,Non-Violent
6334708,06/26/2008 04:00:00 PM,DECEPTIVE PRACTICE,THEFT OF LABOR/SERVICES,true,false,27,41.884389103,-87.706866213,2008-06-26T16:00:00.000+02:00,6,26,16,2008,Non-Violent
6321185,06/22/2008 10:50:00 PM,BATTERY,DOMESTIC BATTERY SIMPLE,false,true,45,41.748766616,-87.595426991,2008-06-22T22:50:00.000+02:00,6,22,22,2008,Violent
6291688,06/07/2008 01:30:00 AM,BATTERY,DOMESTIC BATTERY SIMPLE,false,true,22,41.928815042,-87.725669762,2008-06-07T01:30:00.000+02:00,6,7,1,2008,Violent
6219800,04/30/2008 04:00:00 AM,ROBBERY,STRONGARM - NO WEAPON,false,false,8,41.906577809,-87.642085666,2008-04-30T04:00:00.000+02:00,4,30,4,2008,Violent
6227229,05/03/2008 11:45:00 AM,THEFT,OVER $500,false,false,24,41.908838794,-87.665694419,2008-05-03T11:45:00.000+02:00,5,3,11,2008,Non-Violent
6258168,05/18/2008 06:00:00 PM,BATTERY,SIMPLE,false,false,66,41.770020864,-87.6913338,2008-05-18T18:00:00.000+02:00,5,18,18,2008,Violent
6235776,05/02/2008 02:35:00 PM,BATTERY,DOMESTIC BATTERY SIMPLE,false,true,24,41.910722229,-87.700253036,2008-05-02T14:35:00.000+02:00,5,2,14,2008,Violent
6327055,06/21/2008 01:23:34 AM,BATTERY,AGGRAVATED: OTHER DANG WEAPON,false,false,27,41.872655641,-87.696064936,2008-06-21T01:23:34.000+02:00,6,21,1,2008,Violent
6182832,04/09/2008 11:16:51 AM,STALKING,SIMPLE,false,false,27,41.886303497,-87.714765311,2008-04-09T11:16:51.000+02:00,4,9,11,2008,Non-Violent
6174754,04/06/2008 12:33:39 AM,BURGLARY,UNLAWFUL ENTRY,false,false,43,41.756655606,-87.562688485,2008-04-06T00:33:39.000+02:00,4,6,0,2008,Non-Violent
6363068,07/12/2008 01:55:00 PM,ROBBERY,STRONG ARM - NO WEAPON,false,false,22,41.924673521,-87.711230943,2008-07-12T13:55:00.000+02:00,7,12,13,2008,Violent
6238213,05/08/2008 03:30:00 PM,PROSTITUTION,SOLICIT FOR PROSTITUTE,true,false,57,41.806989137,-87.72355794,2008-05-08T15:30:00.000+02:00,5,8,15,2008,Non-Violent
6229754,05/04/2008 10:00:00 AM,THEFT,OVER $500,false,false,7,41.914409376,-87.656285892,2008-05-04T10:00:00.000+02:00,5,4,10,2008,Non-Violent
6181569,04/08/2008 04:30:00 AM,THEFT,FROM BUILDING,false,true,43,41.764012888,-87.572544826,2008-04-08T04:30:00.000+02:00,4,8,4,2008,Non-Violent
6205397,03/04/2008 03:00:00 PM,BATTERY,SIMPLE,false,false,68,41.774164116,-87.653535923,2008-03-04T15:00:00.000+02:00,3,4,15,2008,Violent
6275396,05/28/2008 09:28:00 PM,CRIMINAL DAMAGE,TO CITY OF CHICAGO PROPERTY,true,false,27,41.881826552,-87.70999792,2008-05-28T21:28:00.000+02:00,5,28,21,2008,Non-Violent
6329041,06/20/2008 02:00:00 AM,BATTERY,DOMESTIC BATTERY SIMPLE,false,true,23,41.911797372,-87.718321724,2008-06-20T02:00:00.000+02:00,6,20,2,2008,Violent
6318453,06/19/2008 10:00:00 AM,CRIMINAL TRESPASS,TO RESIDENCE,false,false,43,41.763684359,-87.566471415,2008-06-19T10:00:00.000+02:00,6,19,10,2008,Non-Violent
6246575,05/12/2008 01:35:00 PM,THEFT,$500 AND UNDER,false,false,30,41.844805165,-87.724578944,2008-05-12T13:35:00.000+02:00,5,12,13,2008,Non-Violent
6374585,07/18/2008 09:35:39 AM,ASSAULT,SIMPLE,false,false,2,41.996538341,-87.708099849,2008-07-18T09:35:39.000+02:00,7,18,9,2008,Violent
6369201,07/15/2008 08:20:00 PM,CRIMINAL DAMAGE,TO PROPERTY,false,false,69,41.752361714,-87.610110959,2008-07-15T20:20:00.000+02:00,7,15,20,2008,Non-Violent
6253422,05/17/2008 12:00:00 PM,CRIMINAL DAMAGE,TO VEHICLE,false,false,24,41.908840448,-87.665507041,2008-05-17T12:00:00.000+02:00,5,17,12,2008,Non-Violent
6331763,06/24/2008 03:10:00 PM,BATTERY,DOMESTIC BATTERY SIMPLE,true,true,21,41.932083788,-87.699347253,2008-06-24T15:10:00.000+02:00,6,24,15,2008,Violent
6224194,04/15/2008 09:40:25 PM,ROBBERY,AGGRAVATED,true,false,67,41.788249856,-87.674134129,2008-04-15T21:40:25.000+02:00,4,15,21,2008,Violent
6213660,04/26/2008 12:00:00 AM,THEFT,OVER $500,false,false,15,41.950550961,-87.75795674,2008-04-26T00:00:00.000+02:00,4,26,0,2008,Non-Violent
6239312,05/09/2008 10:15:06 PM,BATTERY,AGGRAVATED: HANDGUN,false,false,35,41.824744206,-87.619199348,2008-05-09T22:15:06.000+02:00,5,9,22,2008,Violent
6199710,04/18/2008 10:00:00 PM,THEFT,$500 AND UNDER,false,false,25,41.893815214,-87.773752779,2008-04-18T22:00:00.000+02:00,4,18,22,2008,Non-Violent
6233310,05/07/2008 12:15:00 AM,OTHER OFFENSE,VIOLATE ORDER OF PROTECTION,true,true,73,41.719188412,-87.654170576,2008-05-07T00:15:00.000+02:00,5,7,0,2008,Non-Violent
6227953,05/03/2008 11:35:00 PM,CRIMINAL DAMAGE,TO PROPERTY,false,true,51,41.717312929,-87.550060528,2008-05-03T23:35:00.000+02:00,5,3,23,2008,Non-Violent
6332388,06/28/2008 12:26:37 AM,BATTERY,AGGRAVATED: OTHER DANG WEAPON,false,false,48,41.725587418,-87.572998324,2008-06-28T00:26:37.000+02:00,6,28,0,2008,Violent
6279660,05/31/2008 09:16:40 AM,BATTERY,DOMESTIC BATTERY SIMPLE,false,true,25,41.890465072,-87.746919955,2008-05-31T09:16:40.000+02:00,5,31,9,2008,Violent
6378670,07/16/2008 11:10:00 PM,ASSAULT,SIMPLE,true,false,19,41.924019477,-87.762839894,2008-07-16T23:10:00.000+02:00,7,16,23,2008,Violent
6309916,06/15/2008 12:30:00 AM,BATTERY,DOMESTIC BATTERY SIMPLE,false,true,51,41.720919187,-87.552917831,2008-06-15T00:30:00.000+02:00,6,15,0,2008,Violent
6186098,04/11/2008 10:58:40 PM,DECEPTIVE PRACTICE,COUNTERFEITING DOCUMENT,false,false,77,41.996890296,-87.665352435,2008-04-11T22:58:40.000+02:00,4,11,22,2008,Non-Violent
6361892,07/11/2008 06:30:00 AM,THEFT,FROM BUILDING,false,true,11,41.983654176,-87.769535187,2008-07-11T06:30:00.000+02:00,7,11,6,2008,Non-Violent
6215386,04/26/2008 01:10:00 PM,CRIMINAL DAMAGE,TO PROPERTY,false,false,69,41.777873967,-87.615565728,2008-04-26T13:10:00.000+02:00,4,26,13,2008,Non-Violent
6328637,06/26/2008 01:00:00 AM,THEFT,$500 AND UNDER,false,false,22,41.921304668,-87.683672187,2008-06-26T01:00:00.000+02:00,6,26,1,2008,Non-Violent
6343857,07/03/2008 07:15:00 PM,BATTERY,SIMPLE,false,true,15,41.940708356,-87.771439024,2008-07-03T19:15:00.000+02:00,7,3,19,2008,Violent
6263377,05/22/2008 09:00:00 AM,DECEPTIVE PRACTICE,CREDIT CARD FRAUD,false,false,10,41.995280562,-87.803949953,2008-05-22T09:00:00.000+02:00,5,22,9,2008,Non-Violent
6308843,06/15/2008 10:30:00 PM,THEFT,FROM BUILDING,false,false,22,41.914701942,-87.695892994,2008-06-15T22:30:00.000+02:00,6,15,22,2008,Non-Violent
6365845,07/12/2008 11:00:00 PM,THEFT,OVER $500,false,false,25,41.901427639,-87.746786601,2008-07-12T23:00:00.000+02:00,7,12,23,2008,Non-Violent
6246195,05/12/2008 12:18:12 PM,ASSAULT,SIMPLE,false,false,27,41.874903091,-87.694566549,2008-05-12T12:18:12.000+02:00,5,12,12,2008,Violent
6355460,07/09/2008 02:40:00 PM,ASSAULT,SIMPLE,false,false,76,41.962298818,-87.836693032,2008-07-09T14:40:00.000+02:00,7,9,14,2008,Violent
6329674,06/26/2008 09:00:00 PM,BURGLARY,UNLAWFUL ENTRY,false,false,56,41.80117474,-87.74421023,2008-06-26T21:00:00.000+02:00,6,26,21,2008,Non-Violent
6236354,05/06/2008 09:38:00 AM,BURGLARY,FORCIBLE ENTRY,true,false,36,41.821610138,-87.604760988,2008-05-06T09:38:00.000+02:00,5,6,9,2008,Non-Violent
6267333,05/12/2008 07:45:00 PM,NARCOTICS,POSS: CANNABIS 30GMS OR LESS,true,false,44,41.728135929,-87.60461652,2008-05-12T19:45:00.000+02:00,5,12,19,2008,Non-Violent
6224440,05/01/2008 12:30:00 AM,CRIMINAL DAMAGE,TO PROPERTY,false,false,22,41.91853418,-87.6981072,2008-05-01T00:30:00.000+02:00,5,1,0,2008,Non-Violent
6318033,06/06/2008 10:00:00 AM,NARCOTICS,MANU/DEL:CANNABIS OVER 10 GMS,true,false,44,41.750832464,-87.605224746,2008-06-06T10:00:00.000+02:00,6,6,10,2008,Non-Violent
6274916,05/28/2008 11:46:36 PM,BATTERY,AGGRAVATED DOMESTIC BATTERY: OTHER DANG WEAPON,true,true,25,41.895534382,-87.767849981,2008-05-28T23:46:36.000+02:00,5,28,23,2008,Violent
6200475,04/18/2008 12:49:00 PM,NARCOTICS,ATTEMPT POSSESSION NARCOTICS,true,false,23,41.898916021,-87.732333607,2008-04-18T12:49:00.000+02:00,4,18,12,2008,Non-Violent
6330700,06/26/2008 12:55:00 AM,MOTOR VEHICLE THEFT,AUTOMOBILE,true,false,49,41.704202514,-87.62343516,2008-06-26T00:55:00.000+02:00,6,26,0,2008,Non-Violent
6372025,07/17/2008 02:15:00 PM,NARCOTICS,POSS: CANNABIS 30GMS OR LESS,true,false,71,41.735290844,-87.652110425,2008-07-17T14:15:00.000+02:00,7,17,14,2008,Non-Violent
6372354,07/16/2008 10:45:00 PM,ASSAULT,SIMPLE,false,false,24,41.896956409,-87.662424292,2008-07-16T22:45:00.000+02:00,7,16,22,2008,Violent
6255275,05/17/2008 05:00:00 PM,ASSAULT,SIMPLE,true,false,68,41.791350864,-87.654802831,2008-05-17T17:00:00.000+02:00,5,17,17,2008,Violent
6224823,04/08/2008 03:01:00 PM,NARCOTICS,POSS: CANNABIS 30GMS OR LESS,true,false,61,41.81159312,-87.669911205,2008-04-08T15:01:00.000+02:00,4,8,15,2008,Non-Violent
6260600,05/18/2008 09:00:00 AM,CRIMINAL DAMAGE,TO STATE SUP PROP,true,false,8,41.897771695,-87.641196251,2008-05-18T09:00:00.000+02:00,5,18,9,2008,Non-Violent
6223445,04/25/2008 02:23:00 PM,NARCOTICS,MANU/DELIVER: HEROIN (WHITE),true,false,28,41.88210198,-87.684903049,2008-04-25T14:23:00.000+02:00,4,25,14,2008,Non-Violent
6269577,05/21/2008 11:33:00 PM,BATTERY,AGGRAVATED DOMESTIC BATTERY: OTHER DANG WEAPON,true,true,71,41.751877734,-87.648926297,2008-05-21T23:33:00.000+02:00,5,21,23,2008,Violent
6245095,05/06/2008 09:15:00 PM,NARCOTICS,POSS: CANNABIS 30GMS OR LESS,true,false,29,41.856460541,-87.694357334,2008-05-06T21:15:00.000+02:00,5,6,21,2008,Non-Violent
6242205,04/15/2008 03:00:00 PM,THEFT,$500 AND UNDER,false,false,17,,,2008-04-15T15:00:00.000+02:00,4,15,15,2008,Non-Violent
6381770,07/22/2008 08:00:00 AM,BURGLARY,FORCIBLE ENTRY,false,false,75,41.696781912,-87.652934387,2008-07-22T08:00:00.000+02:00,7,22,8,2008,Non-Violent
6193537,04/13/2008 10:00:00 AM,THEFT,FROM BUILDING,false,false,67,41.783122463,-87.663513319,2008-04-13T10:00:00.000+02:00,4,13,10,2008,Non-Violent
6250750,05/16/2008 01:00:00 AM,CRIMINAL DAMAGE,TO VEHICLE,false,false,17,,,2008-05-16T01:00:00.000+02:00,5,16,1,2008,Non-Violent
6227465,05/03/2008 02:00:00 PM,THEFT,POCKET-PICKING,false,false,76,41.976290414,-87.905227221,2008-05-03T14:00:00.000+02:00,5,3,14,2008,Non-Violent
6383446,07/20/2008 05:00:00 PM,THEFT,OVER $500,false,false,3,41.964068894,-87.670898212,2008-07-20T17:00:00.000+02:00,7,20,17,2008,Non-Violent
6187254,04/12/2008 07:20:00 AM,BATTERY,DOMESTIC BATTERY SIMPLE,false,true,65,41.776172813,-87.72757842,2008-04-12T07:20:00.000+02:00,4,12,7,2008,Violent
6206291,04/20/2008 03:55:00 PM,GAMBLING,GAME/DICE,true,false,25,41.876585788,-87.76018857,2008-04-20T15:55:00.000+02:00,4,20,15,2008,Non-Violent
6261014,05/17/2008 12:35:00 AM,BATTERY,DOMESTIC BATTERY SIMPLE,true,true,43,41.753049024,-87.563831077,2008-05-17T00:35:00.000+02:00,5,17,0,2008,Violent
6382954,07/18/2008 11:27:00 AM,BATTERY,DOMESTIC BATTERY SIMPLE,false,true,1,42.007913834,-87.665847907,2008-07-18T11:27:00.000+02:00,7,18,11,2008,Violent
6200776,04/19/2008 04:15:00 PM,BATTERY,DOMESTIC BATTERY SIMPLE,false,true,67,41.779294399,-87.675424745,2008-04-19T16:15:00.000+02:00,4,19,16,2008,Violent
6181169,04/05/2008 04:20:00 PM,BATTERY,AGGRAVATED:KNIFE/CUTTING INSTR,false,false,71,41.748074236,-87.663379392,2008-04-05T16:20:00.000+02:00,4,5,16,2008,Violent
6320854,06/22/2008 07:30:00 PM,OTHER OFFENSE,TELEPHONE THREAT,false,false,75,41.698251726,-87.672966842,2008-06-22T19:30:00.000+02:00,6,22,19,2008,Non-Violent
6254637,05/17/2008 09:00:00 PM,CRIMINAL DAMAGE,TO PROPERTY,false,true,24,41.892466501,-87.655823517,2008-05-17T21:00:00.000+02:00,5,17,21,2008,Non-Violent
6236209,05/08/2008 01:57:00 AM,CRIMINAL TRESPASS,TO VEHICLE,false,false,43,41.768067466,-87.567364963,2008-05-08T01:57:00.000+02:00,5,8,1,2008,Non-Violent
6188481,04/13/2008 08:20:43 AM,BURGLARY,FORCIBLE ENTRY,false,false,77,41.996429587,-87.666350521,2008-04-13T08:20:43.000+02:00,4,13,8,2008,Non-Violent
6326360,05/14/2008 06:00:00 PM,THEFT,FROM BUILDING,false,false,7,41.924214912,-87.653569578,2008-05-14T18:00:00.000+02:00,5,14,18,2008,Non-Violent
6218193,03/24/2008 03:00:00 PM,THEFT,OVER $500,false,false,29,41.860563576,-87.734135566,2008-03-24T15:00:00.000+02:00,3,24,15,2008,Non-Violent
6283087,06/02/2008 11:00:00 AM,OTHER OFFENSE,ANIMAL ABUSE/NEGLECT,true,false,10,41.979699864,-87.802357805,2008-06-02T11:00:00.000+02:00,6,2,11,2008,Non-Violent
6223773,05/01/2008 06:00:00 AM,THEFT,OVER $500,false,false,44,41.740970864,-87.609795428,2008-05-01T06:00:00.000+02:00,5,1,6,2008,Non-Violent
6311743,06/14/2008 06:00:00 PM,ROBBERY,ARMED: HANDGUN,false,false,75,41.69189982,-87.642367883,2008-06-14T18:00:00.000+02:00,6,14,18,2008,Violent
6213426,04/25/2008 11:50:00 PM,ROBBERY,ARMED: OTHER DANGEROUS WEAPON,false,false,58,41.805682406,-87.705139429,2008-04-25T23:50:00.000+02:00,4,25,23,2008,Violent
6182487,04/06/2008 05:00:00 PM,THEFT,$500 AND UNDER,false,false,19,41.920851672,-87.777187382,2008-04-06T17:00:00.000+02:00,4,6,17,2008,Non-Violent
6202440,04/18/2008 10:00:00 PM,NARCOTICS,POSS: CANNABIS 30GMS OR LESS,true,false,63,41.798187691,-87.692703085,2008-04-18T22:00:00.000+02:00,4,18,22,2008,Non-Violent
6263267,05/14/2008 12:00:00 PM,OTHER OFFENSE,HARASSMENT BY TELEPHONE,false,false,29,41.86641507,-87.705004143,2008-05-14T12:00:00.000+02:00,5,14,12,2008,Non-Violent
6262690,05/22/2008 12:10:00 AM,BATTERY,DOMESTIC BATTERY SIMPLE,false,true,61,41.8032982,-87.653195042,2008-05-22T00:10:00.000+02:00,5,22,0,2008,Violent
6226188,04/24/2008 10:30:00 PM,BATTERY,SIMPLE,false,false,28,41.869072823,-87.678708812,2008-04-24T22:30:00.000+02:00,4,24,22,2008,Violent
6362346,07/13/2008 06:15:00 PM,THEFT,$500 AND UNDER,false,false,40,41.793612114,-87.615951236,2008-07-13T18:15:00.000+02:00,7,13,18,2008,Non-Violent
6221291,04/22/2008 04:40:00 PM,DECEPTIVE PRACTICE,ILLEGAL USE CASH CARD,false,false,43,41.772561512,-87.583841227,2008-04-22T16:40:00.000+02:00,4,22,16,2008,Non-Violent
6214230,04/26/2008 08:15:00 AM,BATTERY,SIMPLE,false,false,3,41.966237156,-87.659638736,2008-04-26T08:15:00.000+02:00,4,26,8,2008,Violent
6255025,05/17/2008 12:42:21 AM,BATTERY,AGGRAVATED: OTHER DANG WEAPON,false,false,25,41.881716983,-87.752974602,2008-05-17T00:42:21.000+02:00,5,17,0,2008,Violent
6186243,04/11/2008 03:00:00 PM,NARCOTICS,POSS: CRACK,true,false,28,41.865629068,-87.666357104,2008-04-11T15:00:00.000+02:00,4,11,15,2008,Non-Violent
6201539,04/18/2008 11:45:00 AM,BATTERY,DOMESTIC BATTERY SIMPLE,false,true,28,41.874381838,-87.641536792,2008-04-18T11:45:00.000+02:00,4,18,11,2008,Violent
6330561,06/27/2008 01:44:46 AM,CRIMINAL TRESPASS,TO STATE SUP LAND,false,false,33,41.850330711,-87.627026373,2008-06-27T01:44:46.000+02:00,6,27,1,2008,Non-Violent
6195585,04/17/2008 01:30:00 AM,MOTOR VEHICLE THEFT,AUTOMOBILE,false,false,35,41.829864596,-87.613418466,2008-04-17T01:30:00.000+02:00,4,17,1,2008,Non-Violent
6287426,06/03/2008 10:15:00 PM,STALKING,SIMPLE,false,true,8,41.904466173,-87.631462688,2008-06-03T22:15:00.000+02:00,6,3,22,2008,Non-Violent
6363837,07/14/2008 05:30:00 AM,CRIMINAL DAMAGE,TO PROPERTY,false,false,15,41.959707854,-87.755661019,2008-07-14T05:30:00.000+02:00,7,14,5,2008,Non-Violent
6217758,04/23/2008 04:00:00 PM,OFFENSE INVOLVING CHILDREN,OTHER OFFENSE,false,true,49,41.6979571,-87.631138505,2008-04-23T16:00:00.000+02:00,4,23,16,2008,Non-Violent
6196289,04/11/2008 12:10:00 AM,ROBBERY,STRONGARM - NO WEAPON,false,false,68,41.779295906,-87.644774188,2008-04-11T00:10:00.000+02:00,4,11,0,2008,Violent
6200792,04/16/2008 11:00:00 AM,ASSAULT,SIMPLE,false,true,28,41.874381838,-87.641536792,2008-04-16T11:00:00.000+02:00,4,16,11,2008,Violent
6213983,04/25/2008 10:30:00 PM,MOTOR VEHICLE THEFT,AUTOMOBILE,false,false,56,41.798262749,-87.74575888,2008-04-25T22:30:00.000+02:00,4,25,22,2008,Non-Violent
6376002,07/15/2008 02:00:00 PM,THEFT,FROM BUILDING,false,false,68,41.765152625,-87.647663581,2008-07-15T14:00:00.000+02:00,7,15,14,2008,Non-Violent
6316144,06/18/2008 08:00:00 PM,BATTERY,DOMESTIC BATTERY SIMPLE,false,true,68,41.777740745,-87.631760999,2008-06-18T20:00:00.000+02:00,6,18,20,2008,Violent
6214244,04/26/2008 11:15:00 AM,CRIMINAL TRESPASS,TO LAND,true,false,24,41.902923197,-87.697288509,2008-04-26T11:15:00.000+02:00,4,26,11,2008,Non-Violent
6187040,04/07/2008 07:00:00 PM,CRIMINAL DAMAGE,TO VEHICLE,false,false,48,41.72734309,-87.586704269,2008-04-07T19:00:00.000+02:00,4,7,19,2008,Non-Violent
6213656,04/25/2008 01:25:00 PM,BATTERY,DOMESTIC BATTERY SIMPLE,false,true,73,41.730390353,-87.658767583,2008-04-25T13:25:00.000+02:00,4,25,13,2008,Violent
6361051,07/12/2008 12:00:00 AM,MOTOR VEHICLE THEFT,AUTOMOBILE,false,false,27,41.876763879,-87.703544179,2008-07-12T00:00:00.000+02:00,7,12,0,2008,Non-Violent
6184724,04/09/2008 10:00:00 PM,CRIMINAL DAMAGE,TO VEHICLE,false,false,15,41.950186585,-87.747225754,2008-04-09T22:00:00.000+02:00,4,9,22,2008,Non-Violent
6282165,06/01/2008 07:30:00 PM,BATTERY,AGGRAVATED: OTHER DANG WEAPON,false,false,22,41.925017447,-87.726786152,2008-06-01T19:30:00.000+02:00,6,1,19,2008,Violent
6234142,05/06/2008 05:55:00 PM,CRIMINAL TRESPASS,TO STATE SUP LAND,true,false,15,41.95529191,-87.762141971,2008-05-06T17:55:00.000+02:00,5,6,17,2008,Non-Violent
6279825,05/31/2008 07:50:00 PM,THEFT,ATTEMPT THEFT,false,false,18,41.923593819,-87.795764356,2008-05-31T19:50:00.000+02:00,5,31,19,2008,Non-Violent
6315973,06/19/2008 01:32:35 PM,THEFT,RETAIL THEFT,false,false,28,41.866644572,-87.666379591,2008-06-19T13:32:35.000+02:00,6,19,13,2008,Non-Violent
6199326,04/19/2008 02:30:00 AM,CRIMINAL DAMAGE,TO VEHICLE,false,false,61,41.800658919,-87.646397643,2008-04-19T02:30:00.000+02:00,4,19,2,2008,Non-Violent
6359357,07/06/2008 06:00:00 PM,THEFT,$500 AND UNDER,false,false,33,41.860559903,-87.617934625,2008-07-06T18:00:00.000+02:00,7,6,18,2008,Non-Violent
6221125,04/29/2008 06:05:25 AM,ROBBERY,VEHICULAR HIJACKING,false,false,26,41.873511247,-87.720664282,2008-04-29T06:05:25.000+02:00,4,29,6,2008,Violent
6381815,07/18/2008 06:00:00 PM,THEFT,$500 AND UNDER,false,false,14,41.967254121,-87.720664101,2008-07-18T18:00:00.000+02:00,7,18,18,2008,Non-Violent
6271031,05/24/2008 05:00:00 PM,THEFT,FROM BUILDING,false,false,53,41.68076853,-87.63235407,2008-05-24T17:00:00.000+02:00,5,24,17,2008,Non-Violent
6344723,06/28/2008 04:30:00 PM,MOTOR VEHICLE THEFT,AUTOMOBILE,false,false,67,41.784157326,-87.671609424,2008-06-28T16:30:00.000+02:00,6,28,16,2008,Non-Violent
6226011,05/02/2008 05:00:00 PM,OTHER OFFENSE,TELEPHONE THREAT,false,true,33,41.852216317,-87.627075368,2008-05-02T17:00:00.000+02:00,5,2,17,2008,Non-Violent
6235342,05/07/2008 12:30:46 PM,BATTERY,DOMESTIC BATTERY SIMPLE,false,true,27,41.879243499,-87.69735447,2008-05-07T12:30:46.000+02:00,5,7,12,2008,Violent
6316243,06/19/2008 11:15:00 AM,BATTERY,SIMPLE,true,false,67,41.779053457,-87.661766501,2008-06-19T11:15:00.000+02:00,6,19,11,2008,Violent
6345883,07/04/2008 07:00:00 PM,BURGLARY,FORCIBLE ENTRY,false,false,46,41.744296542,-87.546676597,2008-07-04T19:00:00.000+02:00,7,4,19,2008,Non-Violent
6285683,06/04/2008 08:30:00 AM,ASSAULT,SIMPLE,false,true,21,41.939367576,-87.701950868,2008-06-04T08:30:00.000+02:00,6,4,8,2008,Violent
6259712,05/19/2008 05:15:00 PM,SEX OFFENSE,CRIMINAL SEXUAL ABUSE,true,false,53,41.669705721,-87.640438488,2008-05-19T17:15:00.000+02:00,5,19,17,2008,Non-Violent
6337287,06/27/2008 09:15:00 PM,ROBBERY,STRONGARM - NO WEAPON,false,false,25,41.909428878,-87.761283562,2008-06-27T21:15:00.000+02:00,6,27,21,2008,Violent
6190266,04/10/2008 12:01:00 AM,THEFT,$500 AND UNDER,false,false,69,41.763621825,-87.629147424,2008-04-10T00:01:00.000+02:00,4,10,0,2008,Non-Violent
6299350,06/05/2008 08:00:00 PM,BATTERY,SIMPLE,false,false,71,41.755554244,-87.653867946,2008-06-05T20:00:00.000+02:00,6,5,20,2008,Violent
6224245,05/01/2008 12:15:07 PM,NARCOTICS,SOLICIT NARCOTICS ON PUBLICWAY,true,false,3,41.97330604,-87.655412418,2008-05-01T12:15:07.000+02:00,5,1,12,2008,Non-Violent
6245931,05/13/2008 03:32:46 PM,THEFT,OVER $500,true,false,23,41.901845588,-87.715544681,2008-05-13T15:32:46.000+02:00,5,13,15,2008,Non-Violent
6194702,04/15/2008 08:01:00 PM,THEFT,RETAIL THEFT,false,false,65,41.771274459,-87.730751505,2008-04-15T20:01:00.000+02:00,4,15,20,2008,Non-Violent
6261998,05/22/2008 12:00:00 AM,THEFT,$500 AND UNDER,false,false,2,42.000050978,-87.704596182,2008-05-22T00:00:00.000+02:00,5,22,0,2008,Non-Violent
6218217,04/29/2008 07:08:00 AM,ROBBERY,ATTEMPT: STRONGARM-NO WEAPON,false,false,49,41.706875037,-87.628265515,2008-04-29T07:08:00.000+02:00,4,29,7,2008,Violent
6245297,05/12/2008 05:15:00 PM,THEFT,RETAIL THEFT,true,false,57,41.812610526,-87.723765071,2008-05-12T17:15:00.000+02:00,5,12,17,2008,Non-Violent
6348810,07/05/2008 05:46:00 PM,OTHER OFFENSE,OTHER WEAPONS VIOLATION,false,false,76,41.976290414,-87.905227221,2008-07-05T17:46:00.000+02:00,7,5,17,2008,Non-Violent
6360699,07/12/2008 04:18:00 AM,CRIMINAL DAMAGE,TO VEHICLE,false,true,49,41.703483431,-87.626094371,2008-07-12T04:18:00.000+02:00,7,12,4,2008,Non-Violent
6380374,07/19/2008 02:39:00 AM,NARCOTICS,POSS: CANNABIS 30GMS OR LESS,true,false,19,41.920562885,-87.747801902,2008-07-19T02:39:00.000+02:00,7,19,2,2008,Non-Violent
6329138,06/28/2008 11:00:00 PM,THEFT,OVER $500,false,false,3,,,2008-06-28T23:00:00.000+02:00,6,28,23,2008,Non-Violent
6242537,05/11/2008 09:55:00 PM,CRIMINAL DAMAGE,TO PROPERTY,false,false,46,41.751205054,-87.556519988,2008-05-11T21:55:00.000+02:00,5,11,21,2008,Non-Violent
6361962,07/10/2008 07:30:00 AM,ROBBERY,VEHICULAR HIJACKING,false,true,29,41.861398119,-87.720152183,2008-07-10T07:30:00.000+02:00,7,10,7,2008,Violent
6261672,05/21/2008 11:30:00 AM,THEFT,OVER $500,false,false,8,41.89256902,-87.623725813,2008-05-21T11:30:00.000+02:00,5,21,11,2008,Non-Violent
6319366,06/20/2008 12:00:00 PM,THEFT,FROM BUILDING,false,false,24,41.889012632,-87.674410321,2008-06-20T12:00:00.000+02:00,6,20,12,2008,Non-Violent
6318700,06/19/2008 01:15:00 PM,THEFT,FROM BUILDING,false,false,15,41.95529191,-87.762141971,2008-06-19T13:15:00.000+02:00,6,19,13,2008,Non-Violent
6174650,04/05/2008 10:46:00 PM,BATTERY,SIMPLE,false,false,8,41.896786148,-87.635693654,2008-04-05T22:46:00.000+02:00,4,5,22,2008,Violent
6207582,04/23/2008 08:10:00 PM,OTHER OFFENSE,TELEPHONE THREAT,false,false,71,,,2008-04-23T20:10:00.000+02:00,4,23,20,2008,Non-Violent
6171775,04/02/2008 07:03:00 AM,PUBLIC PEACE VIOLATION,FALSE POLICE REPORT,true,false,71,41.752039895,-87.641635327,2008-04-02T07:03:00.000+02:00,4,2,7,2008,Non-Violent
6215662,04/27/2008 10:00:00 PM,THEFT,OVER $500,false,false,5,41.951437555,-87.677635119,2008-04-27T22:00:00.000+02:00,4,27,22,2008,Non-Violent
6344319,06/28/2008 10:00:00 PM,BURGLARY,FORCIBLE ENTRY,false,false,38,41.813069957,-87.613026982,2008-06-28T22:00:00.000+02:00,6,28,22,2008,Non-Violent
6231766,04/28/2008 11:08:00 PM,NARCOTICS,POSS: CRACK,true,false,26,41.875803715,-87.725503915,2008-04-28T23:08:00.000+02:00,4,28,23,2008,Non-Violent
6182735,03/31/2008 03:46:00 PM,PUBLIC PEACE VIOLATION,MOB ACTION,true,false,69,41.752353215,-87.603990848,2008-03-31T15:46:00.000+02:00,3,31,15,2008,Non-Violent
6356413,07/08/2008 04:15:00 PM,ASSAULT,SIMPLE,false,false,49,41.688535339,-87.618155947,2008-07-08T16:15:00.000+02:00,7,8,16,2008,Violent
6223042,04/24/2008 08:00:00 AM,NARCOTICS,CRIMINAL DRUG CONSPIRACY,true,false,22,41.917217521,-87.721973302,2008-04-24T08:00:00.000+02:00,4,24,8,2008,Non-Violent
6379995,07/21/2008 01:00:00 AM,BATTERY,SIMPLE,false,false,11,41.96990673,-87.762522562,2008-07-21T01:00:00.000+02:00,7,21,1,2008,Violent
6242390,05/06/2008 02:20:00 PM,GAMBLING,GAME/AMUSEMENT DEVICE,true,false,2,41.990455346,-87.697271229,2008-05-06T14:20:00.000+02:00,5,6,14,2008,Non-Violent
6358090,07/10/2008 11:25:00 AM,ASSAULT,AGG PO HANDS NO/MIN INJURY,true,false,66,41.777174999,-87.701186897,2008-07-10T11:25:00.000+02:00,7,10,11,2008,Violent
6348322,07/06/2008 06:30:00 PM,BURGLARY,FORCIBLE ENTRY,false,false,75,41.688884833,-87.660113,2008-07-06T18:30:00.000+02:00,7,6,18,2008,Non-Violent
6257540,05/15/2008 07:00:00 AM,CRIMINAL DAMAGE,TO VEHICLE,false,false,10,41.98287878,-87.791440835,2008-05-15T07:00:00.000+02:00,5,15,7,2008,Non-Violent
6371475,07/16/2008 09:30:00 PM,THEFT,FROM BUILDING,false,false,1,42.01032737,-87.667033254,2008-07-16T21:30:00.000+02:00,7,16,21,2008,Non-Violent
6333145,06/28/2008 06:00:00 PM,OTHER OFFENSE,VIOLATE ORDER OF PROTECTION,false,true,16,41.956063996,-87.708080178,2008-06-28T18:00:00.000+02:00,6,28,18,2008,Non-Violent
6296120,06/03/2008 11:55:00 PM,NARCOTICS,POSS: CRACK,false,true,53,41.675572338,-87.640763574,2008-06-03T23:55:00.000+02:00,6,3,23,2008,Non-Violent
6366920,06/21/2008 07:45:00 PM,PROSTITUTION,SOLICIT ON PUBLIC WAY,true,false,25,41.887193854,-87.767137625,2008-06-21T19:45:00.000+02:00,6,21,19,2008,Non-Violent
6267298,05/20/2008 02:30:00 PM,CRIMINAL DAMAGE,TO VEHICLE,false,false,71,41.740461759,-87.67290097,2008-05-20T14:30:00.000+02:00,5,20,14,2008,Non-Violent
6278151,05/29/2008 01:40:00 AM,CRIMINAL DAMAGE,TO PROPERTY,false,false,70,41.749555438,-87.682834228,2008-05-29T01:40:00.000+02:00,5,29,1,2008,Non-Violent
6173138,04/04/2008 10:35:00 AM,CRIMINAL TRESPASS,TO STATE SUP LAND,false,false,33,41.850424032,-87.627029017,2008-04-04T10:35:00.000+02:00,4,4,10,2008,Non-Violent
6170874,04/03/2008 06:00:00 PM,THEFT,OVER $500,false,false,43,41.758754602,-87.587157605,2008-04-03T18:00:00.000+02:00,4,3,18,2008,Non-Violent
6191204,04/13/2008 11:47:41 PM,BATTERY,DOMESTIC BATTERY SIMPLE,false,true,1,42.01710172,-87.669222039,2008-04-13T23:47:41.000+02:00,4,13,23,2008,Violent
6336972,06/27/2008 12:15:00 PM,CRIMINAL DAMAGE,TO PROPERTY,false,false,66,41.783805703,-87.70327406,2008-06-27T12:15:00.000+02:00,6,27,12,2008,Non-Violent
6245811,05/12/2008 02:00:00 PM,CRIMINAL DAMAGE,TO PROPERTY,false,false,42,41.785057412,-87.609703294,2008-05-12T14:00:00.000+02:00,5,12,14,2008,Non-Violent
6221944,04/28/2008 06:25:56 PM,GAMBLING,GAME/DICE,true,false,25,41.893951553,-87.763529932,2008-04-28T18:25:56.000+02:00,4,28,18,2008,Non-Violent
6353828,07/05/2008 11:00:00 PM,BATTERY,DOMESTIC BATTERY SIMPLE,false,true,71,41.747816902,-87.659732185,2008-07-05T23:00:00.000+02:00,7,5,23,2008,Violent
6220782,04/29/2008 06:50:00 PM,ASSAULT,SIMPLE,false,false,42,41.781534778,-87.605955453,2008-04-29T18:50:00.000+02:00,4,29,18,2008,Violent
6171131,04/03/2008 06:20:00 PM,NARCOTICS,POSS: HEROIN(WHITE),true,false,28,41.864195486,-87.665226596,2008-04-03T18:20:00.000+02:00,4,3,18,2008,Non-Violent
6231467,05/05/2008 05:20:00 PM,THEFT,RETAIL THEFT,true,false,7,41.925394137,-87.652509775,2008-05-05T17:20:00.000+02:00,5,5,17,2008,Non-Violent
6223455,04/25/2008 11:00:00 PM,MOTOR VEHICLE THEFT,AUTOMOBILE,false,false,23,41.901369392,-87.725041113,2008-04-25T23:00:00.000+02:00,4,25,23,2008,Non-Violent
6230417,05/05/2008 10:00:00 PM,ASSAULT,SIMPLE,false,false,28,41.869335009,-87.686720968,2008-05-05T22:00:00.000+02:00,5,5,22,2008,Violent
6271541,05/26/2008 02:35:00 AM,CRIMINAL DAMAGE,TO PROPERTY,false,true,42,41.770694351,-87.609355193,2008-05-26T02:35:00.000+02:00,5,26,2,2008,Non-Violent
6329307,06/21/2008 11:40:00 AM,NARCOTICS,POSS: HEROIN(WHITE),true,false,29,41.867163377,-87.718533097,2008-06-21T11:40:00.000+02:00,6,21,11,2008,Non-Violent
6251248,05/10/2008 09:59:44 PM,DECEPTIVE PRACTICE,THEFT OF LABOR/SERVICES,false,false,1,42.007919177,-87.665351128,2008-05-10T21:59:44.000+02:00,5,10,21,2008,Non-Violent
6245332,05/12/2008 09:00:00 PM,THEFT,FROM BUILDING,false,false,65,41.759283913,-87.741709017,2008-05-12T21:00:00.000+02:00,5,12,21,2008,Non-Violent
6380295,07/21/2008 12:30:00 AM,BURGLARY,FORCIBLE ENTRY,false,false,25,41.906243744,-87.774287138,2008-07-21T00:30:00.000+02:00,7,21,0,2008,Non-Violent
6330020,06/26/2008 05:00:06 PM,THEFT,RETAIL THEFT,true,false,32,41.882394062,-87.627844798,2008-06-26T17:00:06.000+02:00,6,26,17,2008,Non-Violent
6297966,06/09/2008 04:30:00 PM,BATTERY,AGGRAVATED DOMESTIC BATTERY: HANDS/FIST/FEET SERIOUS INJURY,false,true,37,41.804583454,-87.633250773,2008-06-09T16:30:00.000+02:00,6,9,16,2008,Violent
6325201,06/24/2008 08:45:00 PM,OTHER OFFENSE,TELEPHONE THREAT,false,true,42,41.783688699,-87.594718715,2008-06-24T20:45:00.000+02:00,6,24,20,2008,Non-Violent
6356927,07/02/2008 08:22:00 AM,NARCOTICS,POSS: CANNABIS 30GMS OR LESS,true,false,29,41.864096311,-87.714124026,2008-07-02T08:22:00.000+02:00,7,2,8,2008,Non-Violent
6378228,07/14/2008 12:51:39 AM,CRIMINAL DAMAGE,TO PROPERTY,false,true,30,41.847238501,-87.713647998,2008-07-14T00:51:39.000+02:00,7,14,0,2008,Non-Violent
6340287,07/01/2008 05:00:58 PM,BATTERY,SIMPLE,false,false,46,41.747804488,-87.554032459,2008-07-01T17:00:58.000+02:00,7,1,17,2008,Violent
6250743,05/14/2008 08:00:00 PM,MOTOR VEHICLE THEFT,AUTOMOBILE,false,false,58,41.811866433,-87.707866836,2008-05-14T20:00:00.000+02:00,5,14,20,2008,Non-Violent
6318812,06/03/2008 12:01:00 AM,THEFT,OVER $500,false,true,8,41.892006423,-87.624165427,2008-06-03T00:01:00.000+02:00,6,3,0,2008,Non-Violent
6295567,06/07/2008 08:30:00 PM,BATTERY,SIMPLE,false,false,56,41.791622125,-87.774470137,2008-06-07T20:30:00.000+02:00,6,7,20,2008,Violent
6246001,05/12/2008 06:57:00 PM,PUBLIC PEACE VIOLATION,MOB ACTION,true,false,42,41.773063021,-87.61028171,2008-05-12T18:57:00.000+02:00,5,12,18,2008,Non-Violent
6190499,04/14/2008 06:30:00 PM,BATTERY,SIMPLE,false,false,42,41.77528594,-87.584583054,2008-04-14T18:30:00.000+02:00,4,14,18,2008,Violent
6333099,06/27/2008 08:00:00 PM,THEFT,OVER $500,false,false,7,41.919566543,-87.661555515,2008-06-27T20:00:00.000+02:00,6,27,20,2008,Non-Violent
6352902,07/09/2008 02:10:17 AM,CRIMINAL TRESPASS,TO LAND,false,false,38,41.807083442,-87.618097079,2008-07-09T02:10:17.000+02:00,7,9,2,2008,Non-Violent
6213244,04/26/2008 01:45:00 AM,CRIMINAL DAMAGE,TO PROPERTY,false,false,51,41.700392747,-87.559566962,2008-04-26T01:45:00.000+02:00,4,26,1,2008,Non-Violent
6321987,06/21/2008 07:00:00 AM,CRIMINAL DAMAGE,TO PROPERTY,false,false,42,41.781238369,-87.60595147,2008-06-21T07:00:00.000+02:00,6,21,7,2008,Non-Violent
6199550,04/17/2008 02:00:00 PM,BATTERY,SIMPLE,true,false,27,41.878370307,-87.707248137,2008-04-17T14:00:00.000+02:00,4,17,14,2008,Violent
6352432,07/04/2008 01:30:00 AM,CRIM SEXUAL ASSAULT,AGGRAVATED: OTHER,false,true,21,41.940002793,-87.705190093,2008-07-04T01:30:00.000+02:00,7,4,1,2008,Non-Violent
6174112,04/03/2008 02:50:00 PM,NARCOTICS,POSS: CANNABIS 30GMS OR LESS,true,false,2,42.001860435,-87.697312172,2008-04-03T14:50:00.000+02:00,4,3,14,2008,Non-Violent
6311724,06/17/2008 06:23:35 PM,CRIMINAL TRESPASS,TO RESIDENCE,false,false,26,41.878862379,-87.726319496,2008-06-17T18:23:35.000+02:00,6,17,18,2008,Non-Violent
6174962,04/05/2008 11:00:00 AM,OTHER OFFENSE,TELEPHONE THREAT,false,false,49,41.692196959,-87.618265505,2008-04-05T11:00:00.000+02:00,4,5,11,2008,Non-Violent
6339225,06/27/2008 06:50:00 PM,CRIMINAL DAMAGE,TO VEHICLE,false,false,57,41.805690349,-87.719810718,2008-06-27T18:50:00.000+02:00,6,27,18,2008,Non-Violent
6376713,07/20/2008 03:00:00 AM,ROBBERY,STRONGARM - NO WEAPON,false,false,32,41.887854002,-87.619231403,2008-07-20T03:00:00.000+02:00,7,20,3,2008,Violent
6278966,05/29/2008 04:52:42 PM,BURGLARY,FORCIBLE ENTRY,false,false,23,41.902816416,-87.708328121,2008-05-29T16:52:42.000+02:00,5,29,16,2008,Non-Violent
6166333,03/26/2008 07:00:00 PM,NARCOTICS,POSS: CRACK,true,false,29,41.858372615,-87.712751284,2008-03-26T19:00:00.000+02:00,3,26,19,2008,Non-Violent
6199779,04/17/2008 06:40:05 AM,CRIMINAL DAMAGE,TO CITY OF CHICAGO PROPERTY,false,false,27,41.870088978,-87.701884089,2008-04-17T06:40:05.000+02:00,4,17,6,2008,Non-Violent
6192481,04/14/2008 11:00:00 AM,BURGLARY,FORCIBLE ENTRY,false,false,65,41.775117487,-87.71595215,2008-04-14T11:00:00.000+02:00,4,14,11,2008,Non-Violent
6336352,06/29/2008 06:00:00 PM,THEFT,OVER $500,false,false,39,41.807037056,-87.588347184,2008-06-29T18:00:00.000+02:00,6,29,18,2008,Non-Violent
6235471,05/07/2008 12:30:00 PM,BURGLARY,FORCIBLE ENTRY,false,false,53,41.680734707,-87.633558817,2008-05-07T12:30:00.000+02:00,5,7,12,2008,Non-Violent
6199273,04/16/2008 02:10:00 PM,CRIMINAL DAMAGE,TO PROPERTY,false,false,27,41.886334501,-87.712374246,2008-04-16T14:10:00.000+02:00,4,16,14,2008,Non-Violent
6293561,06/09/2008 12:00:00 AM,MOTOR VEHICLE THEFT,AUTOMOBILE,false,false,15,41.956141343,-87.748803544,2008-06-09T00:00:00.000+02:00,6,9,0,2008,Non-Violent
6312912,06/15/2008 12:40:52 AM,MOTOR VEHICLE THEFT,THEFT/RECOVERY: AUTOMOBILE,false,false,41,41.791160785,-87.579836586,2008-06-15T00:40:52.000+02:00,6,15,0,2008,Non-Violent
6306039,06/13/2008 07:00:00 PM,ROBBERY,STRONGARM - NO WEAPON,false,false,69,41.780110888,-87.615617777,2008-06-13T19:00:00.000+02:00,6,13,19,2008,Violent
6376283,07/19/2008 05:07:00 AM,BATTERY,AGGRAVATED: OTHER DANG WEAPON,true,false,8,41.904538325,-87.632942313,2008-07-19T05:07:00.000+02:00,7,19,5,2008,Violent
6304747,06/06/2008 11:00:00 AM,THEFT,ATTEMPT FINANCIAL IDENTITY THEFT,false,false,38,41.814899021,-87.612371861,2008-06-06T11:00:00.000+02:00,6,6,11,2008,Non-Violent
6335594,06/29/2008 09:05:00 PM,ASSAULT,SIMPLE,true,true,69,41.768668255,-87.620195524,2008-06-29T21:05:00.000+02:00,6,29,21,2008,Violent
6306858,06/14/2008 06:57:41 PM,CRIMINAL TRESPASS,TO LAND,false,false,33,41.861130782,-87.617946617,2008-06-14T18:57:41.000+02:00,6,14,18,2008,Non-Violent
6172116,03/31/2008 10:30:00 PM,CRIMINAL DAMAGE,TO VEHICLE,false,false,21,41.940815951,-87.697867718,2008-03-31T22:30:00.000+02:00,3,31,22,2008,Non-Violent
6375736,07/18/2008 11:50:00 AM,BURGLARY,FORCIBLE ENTRY,false,false,75,41.687239895,-87.672695049,2008-07-18T11:50:00.000+02:00,7,18,11,2008,Non-Violent
6165709,03/28/2008 01:40:00 PM,NARCOTICS,POSS: HEROIN(WHITE),true,false,36,41.828606402,-87.609279096,2008-03-28T13:40:00.000+02:00,3,28,13,2008,Non-Violent
6176247,04/06/2008 03:18:45 AM,CRIMINAL DAMAGE,TO PROPERTY,true,false,44,41.741528656,-87.602534093,2008-04-06T03:18:45.000+02:00,4,6,3,2008,Non-Violent
6203721,04/21/2008 06:30:00 AM,BURGLARY,ATTEMPT FORCIBLE ENTRY,false,false,24,41.911007674,-87.700261237,2008-04-21T06:30:00.000+02:00,4,21,6,2008,Non-Violent
6370768,07/16/2008 01:00:00 AM,BURGLARY,FORCIBLE ENTRY,false,false,71,41.737191479,-87.657021997,2008-07-16T01:00:00.000+02:00,7,16,1,2008,Non-Violent
6375261,07/18/2008 12:00:00 PM,OTHER OFFENSE,TELEPHONE THREAT,false,false,68,41.791752346,-87.643878147,2008-07-18T12:00:00.000+02:00,7,18,12,2008,Non-Violent
6272142,05/22/2008 10:00:00 AM,THEFT,FINANCIAL ID THEFT: OVER $300,false,false,67,41.767891908,-87.668759744,2008-05-22T10:00:00.000+02:00,5,22,10,2008,Non-Violent
6293148,06/07/2008 08:23:09 AM,OTHER OFFENSE,FALSE/STOLEN/ALTERED TRP,false,false,73,41.731504297,-87.656858177,2008-06-07T08:23:09.000+02:00,6,7,8,2008,Non-Violent
6336208,06/22/2008 05:30:00 AM,CRIMINAL DAMAGE,TO VEHICLE,false,false,8,41.893429499,-87.635619998,2008-06-22T05:30:00.000+02:00,6,22,5,2008,Non-Violent
6239129,05/09/2008 08:45:00 AM,THEFT,FROM BUILDING,false,false,60,41.833746519,-87.654689152,2008-05-09T08:45:00.000+02:00,5,9,8,2008,Non-Violent
6274512,05/23/2008 01:38:27 PM,NARCOTICS,POSS: CRACK,true,false,25,41.896804386,-87.74963512,2008-05-23T13:38:27.000+02:00,5,23,13,2008,Non-Violent
6180369,04/08/2008 04:40:00 PM,BATTERY,DOMESTIC BATTERY SIMPLE,true,true,17,41.952758064,-87.80791574,2008-04-08T16:40:00.000+02:00,4,8,16,2008,Violent
6165673,03/31/2008 11:00:00 PM,THEFT,OVER $500,false,false,25,41.911935597,-87.777742397,2008-03-31T23:00:00.000+02:00,3,31,23,2008,Non-Violent
6362545,07/13/2008 05:00:00 PM,CRIMINAL DAMAGE,TO VEHICLE,false,false,25,41.91118433,-87.767201203,2008-07-13T17:00:00.000+02:00,7,13,17,2008,Non-Violent
6291285,06/06/2008 04:55:00 PM,BURGLARY,UNLAWFUL ENTRY,false,false,43,41.765131921,-87.587937781,2008-06-06T16:55:00.000+02:00,6,6,16,2008,Non-Violent
6181823,04/10/2008 12:01:00 AM,THEFT,OVER $500,false,false,66,41.760620589,-87.710589552,2008-04-10T00:01:00.000+02:00,4,10,0,2008,Non-Violent
6335672,06/23/2008 11:00:00 AM,ASSAULT,SIMPLE,false,false,22,41.925809934,-87.707247537,2008-06-23T11:00:00.000+02:00,6,23,11,2008,Violent
6236621,05/07/2008 12:01:00 AM,CRIMINAL DAMAGE,TO PROPERTY,false,false,71,41.738955271,-87.658285904,2008-05-07T00:01:00.000+02:00,5,7,0,2008,Non-Violent
6306395,06/14/2008 01:30:00 PM,CRIMINAL DAMAGE,TO VEHICLE,false,false,49,41.689609637,-87.621010793,2008-06-14T13:30:00.000+02:00,6,14,13,2008,Non-Violent
6340301,06/29/2008 01:00:00 PM,WEAPONS VIOLATION,UNLAWFUL POSS OF HANDGUN,true,false,53,41.680949737,-87.635976238,2008-06-29T13:00:00.000+02:00,6,29,13,2008,Non-Violent
6332238,06/27/2008 12:45:00 PM,ASSAULT,AGGRAVATED: OTHER DANG WEAPON,false,true,48,41.727103086,-87.568983733,2008-06-27T12:45:00.000+02:00,6,27,12,2008,Violent
6212653,04/25/2008 09:00:00 AM,THEFT,FROM BUILDING,false,false,39,41.803667488,-87.590528166,2008-04-25T09:00:00.000+02:00,4,25,9,2008,Non-Violent
6382677,07/21/2008 11:44:42 PM,CRIMINAL DAMAGE,TO VEHICLE,false,false,16,41.943473081,-87.732143235,2008-07-21T23:44:42.000+02:00,7,21,23,2008,Non-Violent
6250432,05/15/2008 02:00:00 PM,BATTERY,AGGRAVATED DOMESTIC BATTERY: OTHER DANG WEAPON,false,true,56,41.810305757,-87.748121142,2008-05-15T14:00:00.000+02:00,5,15,14,2008,Violent
6327204,06/25/2008 10:40:00 AM,BATTERY,DOMESTIC BATTERY SIMPLE,false,true,75,41.684973395,-87.650217899,2008-06-25T10:40:00.000+02:00,6,25,10,2008,Violent
6170809,04/02/2008 10:20:00 PM,BATTERY,AGGRAVATED: OTHER DANG WEAPON,true,false,75,41.690273866,-87.662998245,2008-04-02T22:20:00.000+02:00,4,2,22,2008,Violent
6279485,05/30/2008 03:00:00 PM,BURGLARY,FORCIBLE ENTRY,true,false,49,41.694391105,-87.62425339,2008-05-30T15:00:00.000+02:00,5,30,15,2008,Non-Violent
6274376,05/27/2008 01:45:00 PM,ASSAULT,SIMPLE,false,false,68,41.777740745,-87.631760999,2008-05-27T13:45:00.000+02:00,5,27,13,2008,Violent
6314308,06/14/2008 06:00:00 AM,WEAPONS VIOLATION,UNLAWFUL USE OTHER DANG WEAPON,false,false,44,41.736673632,-87.60291156,2008-06-14T06:00:00.000+02:00,6,14,6,2008,Non-Violent
6258778,05/19/2008 09:55:00 PM,ROBBERY,ARMED: HANDGUN,false,false,28,41.873500674,-87.688654365,2008-05-19T21:55:00.000+02:00,5,19,21,2008,Violent
6217537,04/28/2008 01:45:00 PM,THEFT,FROM BUILDING,false,false,6,41.932831201,-87.643353162,2008-04-28T13:45:00.000+02:00,4,28,13,2008,Non-Violent
6289123,05/27/2008 12:00:00 PM,CRIMINAL TRESPASS,TO RESIDENCE,false,false,66,41.768286639,-87.686472033,2008-05-27T12:00:00.000+02:00,5,27,12,2008,Non-Violent
6316595,06/19/2008 06:00:00 PM,BATTERY,SIMPLE,false,false,53,41.662351152,-87.645051694,2008-06-19T18:00:00.000+02:00,6,19,18,2008,Violent
6354020,07/06/2008 02:20:00 PM,NARCOTICS,POSS: HEROIN(WHITE),true,false,31,41.857617944,-87.642113943,2008-07-06T14:20:00.000+02:00,7,6,14,2008,Non-Violent
6369962,07/16/2008 09:00:00 PM,WEAPONS VIOLATION,UNLAWFUL POSS OF HANDGUN,true,false,25,41.912902389,-87.775647192,2008-07-16T21:00:00.000+02:00,7,16,21,2008,Non-Violent
6218175,04/25/2008 10:37:59 PM,CRIMINAL DAMAGE,TO PROPERTY,false,false,1,42.00711743,-87.670006581,2008-04-25T22:37:59.000+02:00,4,25,22,2008,Non-Violent
6335007,06/27/2008 03:48:00 PM,NARCOTICS,POSS: CANNABIS 30GMS OR LESS,true,false,13,41.973123373,-87.715941192,2008-06-27T15:48:00.000+02:00,6,27,15,2008,Non-Violent
6259655,05/20/2008 08:34:39 PM,BATTERY,DOMESTIC BATTERY SIMPLE,false,true,28,41.877565688,-87.684893829,2008-05-20T20:34:39.000+02:00,5,20,20,2008,Violent
6333439,06/28/2008 10:00:00 PM,THEFT,OVER $500,false,false,28,41.885876453,-87.653311437,2008-06-28T22:00:00.000+02:00,6,28,22,2008,Non-Violent
6177117,03/01/2008 09:00:00 AM,OTHER OFFENSE,HARASSMENT BY TELEPHONE,false,false,25,41.890668766,-87.757892127,2008-03-01T09:00:00.000+02:00,3,1,9,2008,Non-Violent
6272036,05/14/2008 07:00:00 PM,OTHER OFFENSE,TELEPHONE THREAT,false,false,25,41.881329293,-87.761578328,2008-05-14T19:00:00.000+02:00,5,14,19,2008,Non-Violent
6276928,05/28/2008 06:36:54 PM,CRIMINAL TRESPASS,TO RESIDENCE,false,false,2,42.00192518,-87.693654512,2008-05-28T18:36:54.000+02:00,5,28,18,2008,Non-Violent
6323336,06/05/2008 12:00:00 AM,DECEPTIVE PRACTICE,ILLEGAL USE CASH CARD,false,false,70,41.749175751,-87.740475242,2008-06-05T00:00:00.000+02:00,6,5,0,2008,Non-Violent
6336094,06/30/2008 01:56:32 AM,CRIMINAL TRESPASS,TO LAND,true,false,58,41.8225226,-87.690494093,2008-06-30T01:56:32.000+02:00,6,30,1,2008,Non-Violent
6377059,07/19/2008 10:00:00 PM,THEFT,OVER $500,false,false,22,41.91973681,-87.696739432,2008-07-19T22:00:00.000+02:00,7,19,22,2008,Non-Violent
6381790,07/23/2008 12:55:00 AM,CRIMINAL TRESPASS,TO LAND,true,false,21,,,2008-07-23T00:55:00.000+02:00,7,23,0,2008,Non-Violent
6167787,03/30/2008 01:00:00 PM,BATTERY,DOMESTIC BATTERY SIMPLE,false,true,73,41.70780108,-87.652587488,2008-03-30T13:00:00.000+02:00,3,30,13,2008,Violent
6313788,06/07/2008 02:00:00 AM,THEFT,FROM BUILDING,false,false,6,41.946076436,-87.655609079,2008-06-07T02:00:00.000+02:00,6,7,2,2008,Non-Violent
6308156,06/15/2008 07:40:00 PM,ROBBERY,ATTEMPT: STRONGARM-NO WEAPON,false,false,68,41.787633336,-87.646195703,2008-06-15T19:40:00.000+02:00,6,15,19,2008,Violent
6253493,05/17/2008 01:20:00 PM,ROBBERY,ATTEMPT: ARMED-HANDGUN,false,false,42,41.784909185,-87.609697627,2008-05-17T13:20:00.000+02:00,5,17,13,2008,Violent
6202633,04/20/2008 04:00:00 AM,BATTERY,DOMESTIC BATTERY SIMPLE,false,true,23,41.899476558,-87.72620879,2008-04-20T04:00:00.000+02:00,4,20,4,2008,Violent
6228475,05/04/2008 06:30:00 PM,THEFT,$500 AND UNDER,false,false,46,41.751198244,-87.572315031,2008-05-04T18:30:00.000+02:00,5,4,18,2008,Non-Violent
6309639,06/16/2008 11:49:09 PM,THEFT,$500 AND UNDER,true,false,6,41.941791622,-87.649869018,2008-06-16T23:49:09.000+02:00,6,16,23,2008,Non-Violent
6326342,06/23/2008 05:50:00 PM,CRIMINAL TRESPASS,TO LAND,true,false,23,41.906187671,-87.72648318,2008-06-23T17:50:00.000+02:00,6,23,17,2008,Non-Violent
6188136,04/13/2008 03:37:00 AM,BURGLARY,FORCIBLE ENTRY,true,false,38,41.804847176,-87.624346184,2008-04-13T03:37:00.000+02:00,4,13,3,2008,Non-Violent
6204218,04/21/2008 10:00:00 PM,MOTOR VEHICLE THEFT,AUTOMOBILE,false,false,25,41.911419075,-87.769175683,2008-04-21T22:00:00.000+02:00,4,21,22,2008,Non-Violent
6167430,04/01/2008 05:30:00 PM,BATTERY,SIMPLE,false,false,77,41.985124533,-87.669366893,2008-04-01T17:30:00.000+02:00,4,1,17,2008,Violent
6165165,03/01/2008 10:14:00 PM,PUBLIC PEACE VIOLATION,RECKLESS CONDUCT,true,false,43,41.752574748,-87.580892737,2008-03-01T22:14:00.000+02:00,3,1,22,2008,Non-Violent
6231958,04/30/2008 02:22:00 PM,NARCOTICS,POSS: HEROIN(WHITE),true,false,27,41.879241324,-87.697457309,2008-04-30T14:22:00.000+02:00,4,30,14,2008,Non-Violent
6352136,07/04/2008 10:00:00 PM,CRIMINAL DAMAGE,TO PROPERTY,false,false,74,41.70600611,-87.714178443,2008-07-04T22:00:00.000+02:00,7,4,22,2008,Non-Violent
6267942,05/24/2008 09:30:00 PM,BATTERY,DOMESTIC BATTERY SIMPLE,false,true,70,41.74018926,-87.694107961,2008-05-24T21:30:00.000+02:00,5,24,21,2008,Violent
6179786,04/08/2008 01:00:00 AM,CRIMINAL DAMAGE,TO VEHICLE,false,false,65,41.770730132,-87.727439005,2008-04-08T01:00:00.000+02:00,4,8,1,2008,Non-Violent
6284247,06/02/2008 05:20:00 PM,BURGLARY,UNLAWFUL ENTRY,false,false,43,41.760069167,-87.570036745,2008-06-02T17:20:00.000+02:00,6,2,17,2008,Non-Violent
6323242,06/23/2008 09:40:00 PM,BATTERY,AGGRAVATED: OTHER DANG WEAPON,false,false,29,41.865751735,-87.703141961,2008-06-23T21:40:00.000+02:00,6,23,21,2008,Violent
6248639,05/14/2008 09:00:00 AM,CRIMINAL DAMAGE,TO PROPERTY,false,false,49,41.695221499,-87.631219523,2008-05-14T09:00:00.000+02:00,5,14,9,2008,Non-Violent
6181910,04/08/2008 08:45:00 PM,THEFT,$500 AND UNDER,false,false,2,41.984156423,-87.690687663,2008-04-08T20:45:00.000+02:00,4,8,20,2008,Non-Violent
6383139,06/03/2008 12:45:34 AM,NARCOTICS,POSS: COCAINE,true,false,63,41.787274402,-87.708281936,2008-06-03T00:45:34.000+02:00,6,3,0,2008,Non-Violent
6308364,06/04/2008 07:15:00 AM,PROSTITUTION,SOLICIT FOR BUSINESS,true,false,26,41.880575249,-87.738469028,2008-06-04T07:15:00.000+02:00,6,4,7,2008,Non-Violent
6250768,05/15/2008 02:10:43 AM,CRIMINAL DAMAGE,TO VEHICLE,false,false,49,41.713591631,-87.62846681,2008-05-15T02:10:43.000+02:00,5,15,2,2008,Non-Violent
6296657,06/06/2008 09:01:00 AM,NARCOTICS,ATTEMPT POSSESSION NARCOTICS,true,false,11,41.975276551,-87.767391513,2008-06-06T09:01:00.000+02:00,6,6,9,2008,Non-Violent
6169364,04/01/2008 01:00:00 PM,BURGLARY,FORCIBLE ENTRY,false,false,29,41.858359419,-87.710313967,2008-04-01T13:00:00.000+02:00,4,1,13,2008,Non-Violent
6281569,05/31/2008 11:30:00 PM,BURGLARY,FORCIBLE ENTRY,false,false,49,41.703074707,-87.612432284,2008-05-31T23:30:00.000+02:00,5,31,23,2008,Non-Violent
6322307,06/21/2008 10:00:00 AM,ROBBERY,ARMED: HANDGUN,false,false,40,41.784721103,-87.622206644,2008-06-21T10:00:00.000+02:00,6,21,10,2008,Violent
6375781,07/17/2008 11:25:39 PM,BATTERY,DOMESTIC BATTERY SIMPLE,false,true,25,41.87025207,-87.746069362,2008-07-17T23:25:39.000+02:00,7,17,23,2008,Violent
6200219,04/19/2008 10:00:00 AM,DECEPTIVE PRACTICE,BOGUS CHECK,true,false,3,41.961453707,-87.654927727,2008-04-19T10:00:00.000+02:00,4,19,10,2008,Non-Violent
6248361,05/14/2008 07:30:00 PM,MOTOR VEHICLE THEFT,AUTOMOBILE,false,false,73,41.704180149,-87.646396519,2008-05-14T19:30:00.000+02:00,5,14,19,2008,Non-Violent
6175448,04/07/2008 12:45:00 AM,BATTERY,DOMESTIC BATTERY SIMPLE,false,true,50,41.705406026,-87.603954053,2008-04-07T00:45:00.000+02:00,4,7,0,2008,Violent
6315170,06/18/2008 12:40:20 PM,DECEPTIVE PRACTICE,EMBEZZLEMENT,false,false,48,41.735181698,-87.566828891,2008-06-18T12:40:20.000+02:00,6,18,12,2008,Non-Violent
6323168,06/11/2008 03:35:38 PM,NARCOTICS,FOUND SUSPECT NARCOTICS,true,false,29,41.856790413,-87.708424071,2008-06-11T15:35:38.000+02:00,6,11,15,2008,Non-Violent
6256078,05/18/2008 07:30:00 PM,ROBBERY,ARMED: HANDGUN,false,false,49,41.699450245,-87.620920514,2008-05-18T19:30:00.000+02:00,5,18,19,2008,Violent
6325648,06/23/2008 09:00:00 AM,CRIMINAL DAMAGE,TO PROPERTY,false,true,25,41.900852791,-87.772901582,2008-06-23T09:00:00.000+02:00,6,23,9,2008,Non-Violent
6201588,04/17/2008 11:06:00 AM,NARCOTICS,POSS: HEROIN(WHITE),true,false,27,41.871734428,-87.716323042,2008-04-17T11:06:00.000+02:00,4,17,11,2008,Non-Violent
6278575,05/31/2008 02:30:57 AM,CRIMINAL DAMAGE,TO VEHICLE,false,false,27,41.876690012,-87.701088405,2008-05-31T02:30:57.000+02:00,5,31,2,2008,Non-Violent
6234928,05/02/2008 09:00:00 AM,THEFT,OVER $500,false,false,16,41.947116367,-87.740387221,2008-05-02T09:00:00.000+02:00,5,2,9,2008,Non-Violent
6168059,03/26/2008 02:30:00 PM,NARCOTICS,MANU/DELIVER: HEROIN (WHITE),true,false,29,41.861562286,-87.726259215,2008-03-26T14:30:00.000+02:00,3,26,14,2008,Non-Violent
6211931,04/21/2008 02:59:00 PM,NARCOTICS,MANU/DEL:CANNABIS 10GM OR LESS,true,false,25,41.883408217,-87.756396558,2008-04-21T14:59:00.000+02:00,4,21,14,2008,Non-Violent
6347898,07/06/2008 04:07:23 PM,ROBBERY,AGGRAVATED VEHICULAR HIJACKING,true,false,38,41.808929094,-87.616576329,2008-07-06T16:07:23.000+02:00,7,6,16,2008,Violent
6244415,05/11/2008 11:45:00 PM,THEFT,$500 AND UNDER,false,false,24,41.902940868,-87.695032866,2008-05-11T23:45:00.000+02:00,5,11,23,2008,Non-Violent
6320174,06/22/2008 12:00:00 AM,THEFT,OVER $500,false,false,58,41.822964269,-87.685580787,2008-06-22T00:00:00.000+02:00,6,22,0,2008,Non-Violent
6300064,06/11/2008 10:00:00 PM,MOTOR VEHICLE THEFT,AUTOMOBILE,false,false,2,41.99924609,-87.707455281,2008-06-11T22:00:00.000+02:00,6,11,22,2008,Non-Violent
6261063,05/17/2008 01:45:00 AM,CRIMINAL DAMAGE,TO VEHICLE,false,false,25,41.909859136,-87.791140399,2008-05-17T01:45:00.000+02:00,5,17,1,2008,Non-Violent
6332214,06/27/2008 01:37:03 PM,BATTERY,DOMESTIC BATTERY SIMPLE,true,true,1,42.019396661,-87.67460054,2008-06-27T13:37:03.000+02:00,6,27,13,2008,Violent
6299978,06/11/2008 08:45:00 PM,MOTOR VEHICLE THEFT,AUTOMOBILE,false,false,28,41.883935022,-87.683426607,2008-06-11T20:45:00.000+02:00,6,11,20,2008,Non-Violent
6268638,05/24/2008 12:01:00 AM,CRIMINAL DAMAGE,TO PROPERTY,false,false,19,41.917921699,-87.758418952,2008-05-24T00:01:00.000+02:00,5,24,0,2008,Non-Violent
6250658,05/14/2008 02:00:00 PM,PUBLIC PEACE VIOLATION,RECKLESS CONDUCT,true,false,28,41.877585867,-87.683123746,2008-05-14T14:00:00.000+02:00,5,14,14,2008,Non-Violent
6300119,05/31/2008 11:00:00 AM,MOTOR VEHICLE THEFT,AUTOMOBILE,false,false,77,41.97634319,-87.658557666,2008-05-31T11:00:00.000+02:00,5,31,11,2008,Non-Violent
6187763,04/12/2008 03:00:00 PM,THEFT,OVER $500,false,false,24,41.902626035,-87.672367558,2008-04-12T15:00:00.000+02:00,4,12,15,2008,Non-Violent
6237646,05/08/2008 09:01:50 PM,BATTERY,DOMESTIC BATTERY SIMPLE,false,true,49,41.697127603,-87.624318535,2008-05-08T21:01:50.000+02:00,5,8,21,2008,Violent
6306076,06/15/2008 12:00:00 AM,BATTERY,DOMESTIC BATTERY SIMPLE,false,true,43,41.757176296,-87.565859866,2008-06-15T00:00:00.000+02:00,6,15,0,2008,Violent
6173858,04/04/2008 10:00:00 PM,CRIMINAL DAMAGE,TO VEHICLE,false,false,46,41.738176211,-87.561161739,2008-04-04T22:00:00.000+02:00,4,4,22,2008,Non-Violent
6323300,06/19/2008 07:55:00 AM,OTHER OFFENSE,OTHER WEAPONS VIOLATION,false,false,76,41.976290414,-87.905227221,2008-06-19T07:55:00.000+02:00,6,19,7,2008,Non-Violent
6225128,04/30/2008 05:10:00 PM,OFFENSE INVOLVING CHILDREN,CHILD ABUSE,false,true,69,41.754477263,-87.605282506,2008-04-30T17:10:00.000+02:00,4,30,17,2008,Non-Violent
6235002,05/02/2008 05:00:00 PM,THEFT,FROM BUILDING,false,false,58,41.821767828,-87.700359595,2008-05-02T17:00:00.000+02:00,5,2,17,2008,Non-Violent
6175006,04/06/2008 10:30:00 AM,INTIMIDATION,INTIMIDATION,false,true,27,41.870112418,-87.699662588,2008-04-06T10:30:00.000+02:00,4,6,10,2008,Non-Violent
6183374,04/05/2008 05:55:00 PM,THEFT,FROM BUILDING,false,false,33,41.867116025,-87.619275002,2008-04-05T17:55:00.000+02:00,4,5,17,2008,Non-Violent
6250757,05/14/2008 07:51:41 PM,BURGLARY,FORCIBLE ENTRY,false,false,48,41.734185662,-87.579293846,2008-05-14T19:51:41.000+02:00,5,14,19,2008,Non-Violent
6253777,05/16/2008 10:40:00 PM,ASSAULT,SIMPLE,false,true,4,41.961919992,-87.69115015,2008-05-16T22:40:00.000+02:00,5,16,22,2008,Violent
6356500,07/08/2008 07:15:00 PM,GAMBLING,GAME/DICE,true,false,61,41.797828889,-87.646284839,2008-07-08T19:15:00.000+02:00,7,8,19,2008,Non-Violent
6241251,04/10/2008 12:00:00 AM,OTHER OFFENSE,HARASSMENT BY TELEPHONE,false,false,71,41.746692239,-87.664987808,2008-04-10T00:00:00.000+02:00,4,10,0,2008,Non-Violent
6341316,07/02/2008 07:45:00 AM,CRIMINAL TRESPASS,TO STATE SUP LAND,false,false,35,41.844000177,-87.628442902,2008-07-02T07:45:00.000+02:00,7,2,7,2008,Non-Violent
6180313,04/08/2008 04:18:42 PM,NARCOTICS,POSS: CANNABIS 30GMS OR LESS,true,false,70,41.751795342,-87.720368183,2008-04-08T16:18:42.000+02:00,4,8,16,2008,Non-Violent
6281658,05/31/2008 06:55:51 PM,THEFT,OVER $500,false,false,2,41.996437072,-87.697160165,2008-05-31T18:55:51.000+02:00,5,31,18,2008,Non-Violent
6234233,04/29/2008 10:30:00 AM,DECEPTIVE PRACTICE,BOGUS CHECK,false,false,32,41.868277934,-87.627441974,2008-04-29T10:30:00.000+02:00,4,29,10,2008,Non-Violent
6305936,06/14/2008 11:20:00 AM,BATTERY,AGGRAVATED: HANDGUN,false,false,66,41.764653245,-87.68599536,2008-06-14T11:20:00.000+02:00,6,14,11,2008,Violent
6263424,04/11/2008 07:03:00 PM,NARCOTICS,POSS: CANNABIS 30GMS OR LESS,true,false,25,41.906595063,-87.774298768,2008-04-11T19:03:00.000+02:00,4,11,19,2008,Non-Violent
6352844,07/09/2008 12:00:00 AM,CRIMINAL DAMAGE,TO VEHICLE,false,false,45,41.740023474,-87.590349734,2008-07-09T00:00:00.000+02:00,7,9,0,2008,Non-Violent
6293913,06/09/2008 12:05:00 AM,ROBBERY,STRONGARM - NO WEAPON,false,false,20,41.926701014,-87.73173849,2008-06-09T00:05:00.000+02:00,6,9,0,2008,Violent
6264176,05/22/2008 05:30:00 PM,MOTOR VEHICLE THEFT,"TRUCK, BUS, MOTOR HOME",false,false,25,41.880294849,-87.761055094,2008-05-22T17:30:00.000+02:00,5,22,17,2008,Non-Violent
6370408,07/16/2008 01:15:00 AM,CRIMINAL DAMAGE,TO PROPERTY,false,true,77,41.985516503,-87.65613622,2008-07-16T01:15:00.000+02:00,7,16,1,2008,Non-Violent
6308806,06/15/2008 08:30:00 AM,CRIMINAL DAMAGE,TO VEHICLE,false,false,3,41.965835517,-87.669361306,2008-06-15T08:30:00.000+02:00,6,15,8,2008,Non-Violent
6322201,06/22/2008 02:46:08 PM,BATTERY,DOMESTIC BATTERY SIMPLE,false,true,1,42.021784992,-87.671892998,2008-06-22T14:46:08.000+02:00,6,22,14,2008,Violent
6320834,06/05/2008 05:30:00 PM,MOTOR VEHICLE THEFT,"THEFT/RECOVERY: TRUCK,BUS,MHOME",true,false,70,41.747248626,-87.691333529,2008-06-05T17:30:00.000+02:00,6,5,17,2008,Non-Violent
6379416,07/18/2008 09:30:00 AM,THEFT,FROM BUILDING,false,false,68,41.777069754,-87.648357886,2008-07-18T09:30:00.000+02:00,7,18,9,2008,Non-Violent
6305949,06/15/2008 04:25:00 AM,BATTERY,DOMESTIC BATTERY SIMPLE,false,true,25,41.893813454,-87.773954803,2008-06-15T04:25:00.000+02:00,6,15,4,2008,Violent
6308863,06/12/2008 10:30:00 PM,THEFT,RETAIL THEFT,true,false,8,41.903478069,-87.631433102,2008-06-12T22:30:00.000+02:00,6,12,22,2008,Non-Violent
6266728,05/24/2008 02:00:11 AM,PUBLIC PEACE VIOLATION,RECKLESS CONDUCT,true,false,67,41.773556277,-87.664056445,2008-05-24T02:00:11.000+02:00,5,24,2,2008,Non-Violent
6174390,04/05/2008 04:00:00 AM,BATTERY,DOMESTIC BATTERY SIMPLE,false,true,19,41.919353756,-87.757237656,2008-04-05T04:00:00.000+02:00,4,5,4,2008,Violent
6267981,05/25/2008 12:48:15 AM,NARCOTICS,POSS: CRACK,true,false,25,41.908198043,-87.757157956,2008-05-25T00:48:15.000+02:00,5,25,0,2008,Non-Violent
6293957,06/09/2008 02:30:00 AM,BATTERY,DOMESTIC BATTERY SIMPLE,true,true,69,41.764926344,-87.611615683,2008-06-09T02:30:00.000+02:00,6,9,2,2008,Violent
6308185,06/15/2008 10:00:00 PM,BURGLARY,FORCIBLE ENTRY,false,false,23,41.897857457,-87.729853162,2008-06-15T22:00:00.000+02:00,6,15,22,2008,Non-Violent
6257475,05/19/2008 06:00:00 PM,THEFT,FROM BUILDING,false,false,32,41.880404956,-87.624356147,2008-05-19T18:00:00.000+02:00,5,19,18,2008,Non-Violent
6347453,07/06/2008 06:00:00 PM,THEFT,OVER $500,false,false,69,41.769091608,-87.628765021,2008-07-06T18:00:00.000+02:00,7,6,18,2008,Non-Violent
6275715,05/28/2008 07:00:00 PM,CRIMINAL DAMAGE,TO PROPERTY,false,false,53,41.675391464,-87.615753821,2008-05-28T19:00:00.000+02:00,5,28,19,2008,Non-Violent
6223270,01/26/2008 08:38:56 AM,CRIMINAL TRESPASS,TO STATE SUP LAND,false,false,33,41.850424032,-87.627029017,2008-01-26T08:38:56.000+02:00,1,26,8,2008,Non-Violent
6319863,06/22/2008 07:50:00 AM,BATTERY,SIMPLE,false,false,8,41.892904362,-87.614547398,2008-06-22T07:50:00.000+02:00,6,22,7,2008,Violent
6355355,06/30/2008 09:50:00 PM,OTHER OFFENSE,VIOLATE ORDER OF PROTECTION,false,true,3,41.96465039,-87.648404014,2008-06-30T21:50:00.000+02:00,6,30,21,2008,Non-Violent
6269747,05/19/2008 12:00:00 AM,OTHER OFFENSE,HARASSMENT BY TELEPHONE,false,false,13,41.985082652,-87.711375132,2008-05-19T00:00:00.000+02:00,5,19,0,2008,Non-Violent
6293416,06/07/2008 09:00:00 PM,CRIMINAL DAMAGE,TO PROPERTY,false,false,7,41.931943182,-87.65784615,2008-06-07T21:00:00.000+02:00,6,7,21,2008,Non-Violent
6356839,07/01/2008 11:35:00 AM,NARCOTICS,POSS: CANNABIS 30GMS OR LESS,true,false,29,41.856261973,-87.712694604,2008-07-01T11:35:00.000+02:00,7,1,11,2008,Non-Violent
6261805,05/19/2008 08:20:00 AM,BATTERY,DOMESTIC BATTERY SIMPLE,false,true,21,41.93738432,-87.717767209,2008-05-19T08:20:00.000+02:00,5,19,8,2008,Violent
6323195,06/23/2008 08:50:37 AM,CRIMINAL DAMAGE,TO PROPERTY,false,false,38,41.804806747,-87.61387144,2008-06-23T08:50:37.000+02:00,6,23,8,2008,Non-Violent
6305459,06/14/2008 01:45:00 PM,THEFT,FROM BUILDING,false,false,2,42.018604147,-87.690182692,2008-06-14T13:45:00.000+02:00,6,14,13,2008,Non-Violent
6248749,05/14/2008 10:05:53 AM,CRIMINAL DAMAGE,TO CITY OF CHICAGO PROPERTY,false,false,52,41.688218178,-87.537357913,2008-05-14T10:05:53.000+02:00,5,14,10,2008,Non-Violent
6172517,04/03/2008 06:45:00 PM,CRIMINAL DAMAGE,TO VEHICLE,false,true,71,41.74014463,-87.671680408,2008-04-03T18:45:00.000+02:00,4,3,18,2008,Non-Violent
6332373,06/27/2008 06:30:00 PM,BURGLARY,FORCIBLE ENTRY,false,false,71,41.753588793,-87.640453269,2008-06-27T18:30:00.000+02:00,6,27,18,2008,Non-Violent
6378127,07/17/2008 09:00:00 PM,BURGLARY,FORCIBLE ENTRY,false,false,67,41.789278038,-87.677808832,2008-07-17T21:00:00.000+02:00,7,17,21,2008,Non-Violent
6273079,05/21/2008 08:05:00 PM,NARCOTICS,MANU/DELIVER: HEROIN (WHITE),true,false,25,41.891401248,-87.744314763,2008-05-21T20:05:00.000+02:00,5,21,20,2008,Non-Violent
6286486,06/03/2008 09:30:00 PM,BURGLARY,FORCIBLE ENTRY,false,false,3,41.970921998,-87.659721755,2008-06-03T21:30:00.000+02:00,6,3,21,2008,Non-Violent
6225973,05/02/2008 08:00:00 AM,OTHER OFFENSE,HARASSMENT BY TELEPHONE,false,true,6,41.947634669,-87.670094251,2008-05-02T08:00:00.000+02:00,5,2,8,2008,Non-Violent
6233892,05/06/2008 09:00:00 AM,ASSAULT,AGGRAVATED: HANDGUN,false,false,43,41.767089837,-87.573879419,2008-05-06T09:00:00.000+02:00,5,6,9,2008,Violent
6252572,05/16/2008 05:43:29 PM,BURGLARY,FORCIBLE ENTRY,false,false,25,41.886253297,-87.766727271,2008-05-16T17:43:29.000+02:00,5,16,17,2008,Non-Violent
6223037,05/01/2008 01:55:00 AM,PROSTITUTION,SOLICIT ON PUBLIC WAY,true,false,27,41.88104652,-87.699348928,2008-05-01T01:55:00.000+02:00,5,1,1,2008,Non-Violent
6190902,04/14/2008 11:58:42 PM,THEFT,$500 AND UNDER,false,true,25,41.899946801,-87.745918577,2008-04-14T23:58:42.000+02:00,4,14,23,2008,Non-Violent
6239603,05/09/2008 11:30:00 PM,BURGLARY,FORCIBLE ENTRY,false,false,71,41.740464725,-87.664400173,2008-05-09T23:30:00.000+02:00,5,9,23,2008,Non-Violent
6279117,05/30/2008 11:15:00 PM,ASSAULT,SIMPLE,false,false,42,41.775725186,-87.586293691,2008-05-30T23:15:00.000+02:00,5,30,23,2008,Violent
6181475,04/09/2008 01:00:00 AM,BURGLARY,UNLAWFUL ENTRY,false,false,70,41.737716412,-87.738528823,2008-04-09T01:00:00.000+02:00,4,9,1,2008,Non-Violent
6285566,06/04/2008 01:00:00 AM,CRIMINAL DAMAGE,TO PROPERTY,false,false,69,41.757663878,-87.611447833,2008-06-04T01:00:00.000+02:00,6,4,1,2008,Non-Violent
6350213,07/04/2008 04:00:00 AM,BATTERY,DOMESTIC BATTERY SIMPLE,false,true,29,41.859831325,-87.72742459,2008-07-04T04:00:00.000+02:00,7,4,4,2008,Violent
6307033,06/15/2008 02:01:00 PM,BATTERY,AGGRAVATED: HANDGUN,false,false,46,41.751221544,-87.556523454,2008-06-15T14:01:00.000+02:00,6,15,14,2008,Violent
6332916,06/26/2008 07:00:00 PM,OTHER OFFENSE,HARASSMENT BY TELEPHONE,false,true,16,41.957294135,-87.728189765,2008-06-26T19:00:00.000+02:00,6,26,19,2008,Non-Violent
6333427,06/25/2008 03:00:00 PM,THEFT,RETAIL THEFT,false,false,8,41.892753031,-87.624193896,2008-06-25T15:00:00.000+02:00,6,25,15,2008,Non-Violent
6297927,06/10/2008 03:15:23 PM,BATTERY,SIMPLE,true,true,40,41.792316704,-87.620784213,2008-06-10T15:15:23.000+02:00,6,10,15,2008,Violent
6277249,05/30/2008 01:39:00 AM,CRIMINAL TRESPASS,TO VEHICLE,false,false,33,41.856048879,-87.628226184,2008-05-30T01:39:00.000+02:00,5,30,1,2008,Non-Violent
6208023,04/22/2008 11:50:00 PM,BATTERY,DOMESTIC BATTERY SIMPLE,true,true,43,41.764260979,-87.583146097,2008-04-22T23:50:00.000+02:00,4,22,23,2008,Violent
6327206,06/24/2008 10:37:52 PM,NARCOTICS,POSS: CRACK,true,false,26,41.878743129,-87.736025768,2008-06-24T22:37:52.000+02:00,6,24,22,2008,Non-Violent
6188019,04/12/2008 11:00:00 PM,CRIMINAL DAMAGE,TO VEHICLE,false,false,8,41.893255699,-87.629176054,2008-04-12T23:00:00.000+02:00,4,12,23,2008,Non-Violent
6168117,04/01/2008 12:00:00 AM,CRIMINAL DAMAGE,TO PROPERTY,false,false,53,41.667961689,-87.641577151,2008-04-01T00:00:00.000+02:00,4,1,0,2008,Non-Violent
6352402,07/08/2008 12:00:00 PM,THEFT,$500 AND UNDER,true,false,24,41.895896023,-87.677913394,2008-07-08T12:00:00.000+02:00,7,8,12,2008,Non-Violent
6279102,05/19/2008 10:00:00 AM,DECEPTIVE PRACTICE,ILLEGAL USE CASH CARD,false,false,48,41.737137914,-87.570055531,2008-05-19T10:00:00.000+02:00,5,19,10,2008,Non-Violent
6375636,07/07/2008 08:00:00 PM,THEFT,FROM BUILDING,false,false,4,41.968078941,-87.679167005,2008-07-07T20:00:00.000+02:00,7,7,20,2008,Non-Violent
6263343,05/19/2008 04:30:00 AM,THEFT,FROM BUILDING,false,true,70,41.735344151,-87.693364618,2008-05-19T04:30:00.000+02:00,5,19,4,2008,Non-Violent
6285625,05/28/2008 01:50:00 PM,ROBBERY,STRONGARM - NO WEAPON,false,false,69,41.755500696,-87.63441848,2008-05-28T13:50:00.000+02:00,5,28,13,2008,Violent
6231370,05/02/2008 01:35:00 PM,ASSAULT,SIMPLE,false,false,71,41.734209915,-87.646633525,2008-05-02T13:35:00.000+02:00,5,2,13,2008,Violent
6192548,04/11/2008 05:37:00 PM,OTHER OFFENSE,HARASSMENT BY ELECTRONIC MEANS,true,false,20,41.928001461,-87.735882518,2008-04-11T17:37:00.000+02:00,4,11,17,2008,Non-Violent
6370388,07/15/2008 09:00:00 AM,BURGLARY,FORCIBLE ENTRY,false,false,63,41.78721864,-87.704601022,2008-07-15T09:00:00.000+02:00,7,15,9,2008,Non-Violent
6237955,04/27/2008 11:00:00 PM,BATTERY,DOMESTIC BATTERY SIMPLE,false,true,33,41.850517353,-87.627031661,2008-04-27T23:00:00.000+02:00,4,27,23,2008,Violent
6226339,05/02/2008 06:56:54 PM,BURGLARY,FORCIBLE ENTRY,true,false,48,41.734726394,-87.579309504,2008-05-02T18:56:54.000+02:00,5,2,18,2008,Non-Violent
6216725,04/25/2008 07:30:00 PM,BATTERY,SIMPLE,false,false,44,41.74685659,-87.613599039,2008-04-25T19:30:00.000+02:00,4,25,19,2008,Violent
6254501,01/28/2008 08:00:00 PM,CRIMINAL DAMAGE,TO PROPERTY,false,false,25,41.882292995,-87.761121725,2008-01-28T20:00:00.000+02:00,1,28,20,2008,Non-Violent
6303668,06/12/2008 04:30:00 PM,MOTOR VEHICLE THEFT,AUTOMOBILE,false,false,73,41.724441234,-87.637235185,2008-06-12T16:30:00.000+02:00,6,12,16,2008,Non-Violent
6248456,05/14/2008 10:15:00 AM,THEFT,RETAIL THEFT,true,false,24,41.895896023,-87.677913394,2008-05-14T10:15:00.000+02:00,5,14,10,2008,Non-Violent
6310993,06/13/2008 12:00:00 AM,THEFT,$500 AND UNDER,false,false,43,41.773085006,-87.568335406,2008-06-13T00:00:00.000+02:00,6,13,0,2008,Non-Violent
6371478,07/16/2008 02:40:00 PM,BATTERY,SIMPLE,false,false,23,41.895479821,-87.714177247,2008-07-16T14:40:00.000+02:00,7,16,14,2008,Violent
6286545,05/31/2008 02:45:00 AM,CRIMINAL DAMAGE,TO PROPERTY,false,true,66,41.761945263,-87.690508963,2008-05-31T02:45:00.000+02:00,5,31,2,2008,Non-Violent
6365517,07/12/2008 12:21:00 AM,PUBLIC PEACE VIOLATION,MOB ACTION,true,false,68,41.789750344,-87.648688607,2008-07-12T00:21:00.000+02:00,7,12,0,2008,Non-Violent
6304444,06/12/2008 12:39:08 PM,BATTERY,AGG: HANDS/FIST/FEET NO/MINOR INJURY,false,false,6,41.950042231,-87.664099304,2008-06-12T12:39:08.000+02:00,6,12,12,2008,Violent
6375538,07/19/2008 03:00:00 PM,THEFT,$500 AND UNDER,false,false,33,41.857371774,-87.619368728,2008-07-19T15:00:00.000+02:00,7,19,15,2008,Non-Violent
6357165,07/10/2008 11:40:00 AM,THEFT,OVER $500,false,false,57,41.807978431,-87.715082878,2008-07-10T11:40:00.000+02:00,7,10,11,2008,Non-Violent
6238376,05/09/2008 02:40:00 AM,BATTERY,AGGRAVATED: OTHER DANG WEAPON,false,false,7,41.923758707,-87.640147464,2008-05-09T02:40:00.000+02:00,5,9,2,2008,Violent
6231725,05/04/2008 10:30:00 PM,CRIMINAL DAMAGE,CRIMINAL DEFACEMENT,false,false,12,41.982644722,-87.74500826,2008-05-04T22:30:00.000+02:00,5,4,22,2008,Non-Violent
6270428,05/24/2008 12:01:00 AM,BURGLARY,FORCIBLE ENTRY,false,false,21,41.939041922,-87.73124026,2008-05-24T00:01:00.000+02:00,5,24,0,2008,Non-Violent
6234675,05/07/2008 12:00:00 AM,CRIMINAL DAMAGE,TO PROPERTY,false,false,25,41.90486704,-87.764413714,2008-05-07T00:00:00.000+02:00,5,7,0,2008,Non-Violent
6211631,04/26/2008 12:00:00 AM,CRIMINAL DAMAGE,TO VEHICLE,false,false,4,41.967290516,-87.698571751,2008-04-26T00:00:00.000+02:00,4,26,0,2008,Non-Violent
6244477,05/12/2008 09:05:00 PM,BATTERY,DOMESTIC BATTERY SIMPLE,false,true,8,41.903894777,-87.631814251,2008-05-12T21:05:00.000+02:00,5,12,21,2008,Violent
6377761,07/20/2008 02:30:00 PM,ASSAULT,SIMPLE,false,false,44,41.750332707,-87.61126612,2008-07-20T14:30:00.000+02:00,7,20,14,2008,Violent
6189289,04/12/2008 05:17:26 PM,NARCOTICS,POSS: CANNABIS 30GMS OR LESS,true,false,36,41.825789911,-87.607835902,2008-04-12T17:17:26.000+02:00,4,12,17,2008,Non-Violent
6227894,05/03/2008 07:30:00 AM,BATTERY,DOMESTIC BATTERY SIMPLE,false,true,66,41.779056117,-87.697439773,2008-05-03T07:30:00.000+02:00,5,3,7,2008,Violent
6235090,04/30/2008 07:00:00 AM,THEFT,OVER $500,false,false,7,41.928320067,-87.642957119,2008-04-30T07:00:00.000+02:00,4,30,7,2008,Non-Violent
6342570,07/03/2008 12:00:00 AM,DECEPTIVE PRACTICE,COUNTERFEIT CHECK,false,false,23,41.909880656,-87.726859669,2008-07-03T00:00:00.000+02:00,7,3,0,2008,Non-Violent
6222201,04/30/2008 04:30:00 PM,CRIMINAL TRESPASS,TO RESIDENCE,false,false,53,41.678738129,-87.645594592,2008-04-30T16:30:00.000+02:00,4,30,16,2008,Non-Violent
6313520,06/17/2008 08:00:00 PM,CRIMINAL DAMAGE,TO VEHICLE,false,false,40,41.793612114,-87.615951236,2008-06-17T20:00:00.000+02:00,6,17,20,2008,Non-Violent
6178361,04/07/2008 06:15:00 AM,BURGLARY,UNLAWFUL ENTRY,false,false,7,41.91346616,-87.643510336,2008-04-07T06:15:00.000+02:00,4,7,6,2008,Non-Violent
6346765,07/06/2008 01:30:00 AM,ROBBERY,AGGRAVATED VEHICULAR HIJACKING,false,false,49,41.703061295,-87.61731021,2008-07-06T01:30:00.000+02:00,7,6,1,2008,Violent
6176480,04/01/2008 11:15:00 PM,NARCOTICS,POSS: AMPHETAMINES,true,false,8,41.892559086,-87.623450463,2008-04-01T23:15:00.000+02:00,4,1,23,2008,Non-Violent
6323417,06/23/2008 08:40:00 AM,BATTERY,SIMPLE,true,false,25,41.900508343,-87.746791341,2008-06-23T08:40:00.000+02:00,6,23,8,2008,Violent
6222793,04/28/2008 09:00:00 PM,THEFT,OVER $500,false,false,23,41.899434622,-87.728662887,2008-04-28T21:00:00.000+02:00,4,28,21,2008,Non-Violent
6287816,05/27/2008 06:50:00 PM,CRIMINAL DAMAGE,CRIMINAL DEFACEMENT,true,false,16,41.944766651,-87.73024907,2008-05-27T18:50:00.000+02:00,5,27,18,2008,Non-Violent
6309776,06/15/2008 10:08:00 PM,BATTERY,SIMPLE,false,false,49,41.695221499,-87.631219523,2008-06-15T22:08:00.000+02:00,6,15,22,2008,Violent
6361032,07/10/2008 03:26:00 AM,BURGLARY,UNLAWFUL ENTRY,false,false,22,41.929531766,-87.707369166,2008-07-10T03:26:00.000+02:00,7,10,3,2008,Non-Violent
6327453,06/19/2008 07:00:00 PM,ASSAULT,SIMPLE,false,false,5,41.946907728,-87.674909893,2008-06-19T19:00:00.000+02:00,6,19,19,2008,Violent
6236423,04/28/2008 10:00:00 AM,DECEPTIVE PRACTICE,FRAUD OR CONFIDENCE GAME,false,false,45,41.740234894,-87.585290834,2008-04-28T10:00:00.000+02:00,4,28,10,2008,Non-Violent
6241687,05/11/2008 04:30:00 PM,CRIMINAL DAMAGE,TO VEHICLE,false,false,69,41.767533838,-87.614746256,2008-05-11T16:30:00.000+02:00,5,11,16,2008,Non-Violent
6343854,06/30/2008 06:30:00 PM,CRIM SEXUAL ASSAULT,NON-AGGRAVATED,false,false,32,41.886915553,-87.616601344,2008-06-30T18:30:00.000+02:00,6,30,18,2008,Non-Violent
6165338,03/30/2008 01:30:00 AM,THEFT,FROM BUILDING,false,false,70,41.747071383,-87.737922121,2008-03-30T01:30:00.000+02:00,3,30,1,2008,Non-Violent
6217257,04/24/2008 12:53:00 AM,OTHER OFFENSE,HARASSMENT BY TELEPHONE,false,false,30,41.837679775,-87.735306866,2008-04-24T00:53:00.000+02:00,4,24,0,2008,Non-Violent
6174848,04/05/2008 07:40:00 PM,BATTERY,DOMESTIC BATTERY SIMPLE,false,true,11,41.976344235,-87.755312105,2008-04-05T19:40:00.000+02:00,4,5,19,2008,Violent
6267922,05/24/2008 01:30:00 PM,THEFT,RETAIL THEFT,false,false,61,41.819027613,-87.665219378,2008-05-24T13:30:00.000+02:00,5,24,13,2008,Non-Violent
6180662,04/01/2008 03:00:00 PM,BURGLARY,FORCIBLE ENTRY,false,false,44,41.749466069,-87.636693716,2008-04-01T15:00:00.000+02:00,4,1,15,2008,Non-Violent
6373499,07/15/2008 11:00:00 PM,BATTERY,DOMESTIC BATTERY SIMPLE,false,true,25,41.911197719,-87.766021769,2008-07-15T23:00:00.000+02:00,7,15,23,2008,Violent
6250140,05/15/2008 09:00:00 AM,MOTOR VEHICLE THEFT,AUTOMOBILE,false,false,23,41.907147763,-87.722785748,2008-05-15T09:00:00.000+02:00,5,15,9,2008,Non-Violent
6379778,07/20/2008 02:15:00 AM,BATTERY,AGGRAVATED:KNIFE/CUTTING INSTR,false,false,8,41.892399066,-87.633144732,2008-07-20T02:15:00.000+02:00,7,20,2,2008,Violent
6168601,04/02/2008 01:43:58 PM,BURGLARY,FORCIBLE ENTRY,true,false,71,41.730718902,-87.668523894,2008-04-02T13:43:58.000+02:00,4,2,13,2008,Non-Violent
6170716,04/02/2008 02:30:00 AM,MOTOR VEHICLE THEFT,AUTOMOBILE,false,false,71,41.743137547,-87.658744105,2008-04-02T02:30:00.000+02:00,4,2,2,2008,Non-Violent
6382902,07/22/2008 03:11:47 AM,NARCOTICS,POSS: HEROIN(WHITE),true,false,25,41.909384715,-87.765101009,2008-07-22T03:11:47.000+02:00,7,22,3,2008,Non-Violent
6378578,07/19/2008 10:48:00 PM,WEAPONS VIOLATION,UNLAWFUL POSS OF HANDGUN,true,false,29,41.85616387,-87.7199746,2008-07-19T22:48:00.000+02:00,7,19,22,2008,Non-Violent
6257383,05/19/2008 02:15:00 AM,OTHER OFFENSE,VIOLATE ORDER OF PROTECTION,false,true,63,41.8002521,-87.703751129,2008-05-19T02:15:00.000+02:00,5,19,2,2008,Non-Violent
6186534,04/12/2008 03:42:00 AM,ASSAULT,AGGRAVATED:KNIFE/CUTTING INSTR,false,false,42,41.775139801,-87.589970239,2008-04-12T03:42:00.000+02:00,4,12,3,2008,Violent
6195558,04/15/2008 10:30:00 PM,CRIMINAL DAMAGE,TO VEHICLE,false,false,1,42.007921471,-87.665273836,2008-04-15T22:30:00.000+02:00,4,15,22,2008,Non-Violent
6195727,04/14/2008 02:20:00 PM,NARCOTICS,POSS: CRACK,true,false,54,41.656972482,-87.59768703,2008-04-14T14:20:00.000+02:00,4,14,14,2008,Non-Violent
6186018,04/08/2008 08:40:00 PM,BATTERY,AGGRAVATED: OTHER DANG WEAPON,false,false,8,41.89652481,-87.639211587,2008-04-08T20:40:00.000+02:00,4,8,20,2008,Violent
6374348,07/17/2008 10:10:00 PM,ROBBERY,AGGRAVATED VEHICULAR HIJACKING,false,false,70,41.743867618,-87.702228253,2008-07-17T22:10:00.000+02:00,7,17,22,2008,Violent
6221926,04/30/2008 01:20:00 PM,ASSAULT,PRO EMP HANDS NO/MIN INJURY,false,false,31,41.857509563,-87.661306034,2008-04-30T13:20:00.000+02:00,4,30,13,2008,Violent
6330322,06/26/2008 05:55:00 AM,CRIMINAL DAMAGE,TO VEHICLE,false,false,55,41.649538486,-87.559308653,2008-06-26T05:55:00.000+02:00,6,26,5,2008,Non-Violent
6312207,06/11/2008 07:15:59 AM,THEFT,OVER $500,false,false,43,41.763208678,-87.572525003,2008-06-11T07:15:59.000+02:00,6,11,7,2008,Non-Violent
6216956,04/27/2008 11:30:00 AM,THEFT,FROM BUILDING,false,false,42,41.776757223,-87.586322042,2008-04-27T11:30:00.000+02:00,4,27,11,2008,Non-Violent
6252527,05/16/2008 06:45:00 PM,BATTERY,SIMPLE,false,false,63,41.793703055,-87.693110793,2008-05-16T18:45:00.000+02:00,5,16,18,2008,Violent
6190528,04/14/2008 12:15:00 PM,THEFT,$500 AND UNDER,false,false,53,41.676251558,-87.61901673,2008-04-14T12:15:00.000+02:00,4,14,12,2008,Non-Violent
6337222,06/24/2008 12:01:00 AM,DECEPTIVE PRACTICE,CREDIT CARD FRAUD,false,false,25,41.900743429,-87.774111048,2008-06-24T00:01:00.000+02:00,6,24,0,2008,Non-Violent
6317047,06/19/2008 08:35:33 AM,MOTOR VEHICLE THEFT,AUTOMOBILE,false,false,25,41.872290256,-87.744306672,2008-06-19T08:35:33.000+02:00,6,19,8,2008,Non-Violent
6372949,07/13/2008 03:25:00 PM,THEFT,ATTEMPT THEFT,false,false,67,41.776628286,-87.66661283,2008-07-13T15:25:00.000+02:00,7,13,15,2008,Non-Violent
6356597,07/06/2008 09:25:00 PM,THEFT,RETAIL THEFT,true,false,8,41.903775756,-87.639324074,2008-07-06T21:25:00.000+02:00,7,6,21,2008,Non-Violent
6249455,05/15/2008 01:25:00 AM,BATTERY,DOMESTIC BATTERY SIMPLE,false,true,27,41.874581632,-87.709473494,2008-05-15T01:25:00.000+02:00,5,15,1,2008,Violent
6263710,05/18/2008 04:28:43 PM,BATTERY,AGGRAVATED: OTHER DANG WEAPON,false,false,23,41.894215064,-87.716279344,2008-05-18T16:28:43.000+02:00,5,18,16,2008,Violent
6228896,04/24/2008 05:06:57 PM,THEFT,FROM BUILDING,false,false,33,41.866657026,-87.625811383,2008-04-24T17:06:57.000+02:00,4,24,17,2008,Non-Violent
6236577,05/07/2008 11:46:42 PM,ASSAULT,SIMPLE,true,true,25,41.882948676,-87.761633664,2008-05-07T23:46:42.000+02:00,5,7,23,2008,Violent
6342227,07/01/2008 12:28:05 PM,CRIMINAL DAMAGE,TO PROPERTY,false,false,43,41.756936862,-87.555556597,2008-07-01T12:28:05.000+02:00,7,1,12,2008,Non-Violent
6373828,07/15/2008 01:00:00 PM,THEFT,FINANCIAL ID THEFT: OVER $300,false,false,23,41.90554536,-87.733766572,2008-07-15T13:00:00.000+02:00,7,15,13,2008,Non-Violent
6314287,06/16/2008 10:00:00 AM,THEFT,$500 AND UNDER,false,false,19,41.925195881,-87.746333765,2008-06-16T10:00:00.000+02:00,6,16,10,2008,Non-Violent
6238452,05/08/2008 02:37:58 PM,GAMBLING,GAME/DICE,true,false,67,41.760450948,-87.657738119,2008-05-08T14:37:58.000+02:00,5,8,14,2008,Non-Violent
6380106,07/20/2008 03:44:00 PM,THEFT,$500 AND UNDER,false,false,24,41.907343722,-87.693258717,2008-07-20T15:44:00.000+02:00,7,20,15,2008,Non-Violent
6304252,06/13/2008 07:00:00 AM,THEFT,$500 AND UNDER,false,false,28,41.873902628,-87.685470602,2008-06-13T07:00:00.000+02:00,6,13,7,2008,Non-Violent
6246516,05/12/2008 12:53:46 PM,NARCOTICS,POSS: CANNABIS 30GMS OR LESS,true,false,46,41.743794133,-87.54424597,2008-05-12T12:53:46.000+02:00,5,12,12,2008,Non-Violent
6231746,05/05/2008 05:00:00 PM,BATTERY,SIMPLE,false,false,49,41.720965255,-87.631096862,2008-05-05T17:00:00.000+02:00,5,5,17,2008,Violent
6352656,07/06/2008 02:00:00 AM,CRIMINAL DAMAGE,TO PROPERTY,false,false,27,41.885388355,-87.706929899,2008-07-06T02:00:00.000+02:00,7,6,2,2008,Non-Violent
6357156,07/10/2008 05:00:00 PM,ROBBERY,STRONGARM - NO WEAPON,false,false,44,41.750940757,-87.625185222,2008-07-10T17:00:00.000+02:00,7,10,17,2008,Violent
6248238,05/10/2008 04:00:00 PM,THEFT,OVER $500,false,false,68,41.773766875,-87.649489168,2008-05-10T16:00:00.000+02:00,5,10,16,2008,Non-Violent
6372931,07/17/2008 08:30:00 AM,ASSAULT,SIMPLE,false,true,43,41.769417774,-87.569856281,2008-07-17T08:30:00.000+02:00,7,17,8,2008,Violent
6177156,04/07/2008 12:00:00 PM,OTHER OFFENSE,HARASSMENT BY TELEPHONE,false,true,2,42.012901677,-87.703034541,2008-04-07T12:00:00.000+02:00,4,7,12,2008,Non-Violent
6255201,05/18/2008 09:00:00 PM,CRIMINAL DAMAGE,CRIMINAL DEFACEMENT,false,false,63,41.80462016,-87.684368169,2008-05-18T21:00:00.000+02:00,5,18,21,2008,Non-Violent
6214925,04/25/2008 11:00:00 PM,THEFT,$500 AND UNDER,false,false,8,41.901878151,-87.628739704,2008-04-25T23:00:00.000+02:00,4,25,23,2008,Non-Violent
6170344,03/30/2008 05:15:00 AM,CRIMINAL DAMAGE,TO PROPERTY,true,false,62,41.79639731,-87.723251281,2008-03-30T05:15:00.000+02:00,3,30,5,2008,Non-Violent
6197686,04/18/2008 02:15:00 AM,BATTERY,AGGRAVATED: HANDGUN,false,false,4,41.969662021,-87.694705499,2008-04-18T02:15:00.000+02:00,4,18,2,2008,Violent
6243827,05/11/2008 10:40:00 AM,OTHER OFFENSE,HARASSMENT BY TELEPHONE,false,true,3,41.957333828,-87.650622101,2008-05-11T10:40:00.000+02:00,5,11,10,2008,Non-Violent
6298427,06/09/2008 10:00:00 PM,ASSAULT,SIMPLE,false,false,24,41.912406937,-87.680602833,2008-06-09T22:00:00.000+02:00,6,9,22,2008,Violent
6211563,04/24/2008 10:00:00 PM,BATTERY,DOMESTIC BATTERY SIMPLE,false,true,8,41.898546648,-87.641830683,2008-04-24T22:00:00.000+02:00,4,24,22,2008,Violent
6234783,05/04/2008 11:32:00 PM,BATTERY,DOMESTIC BATTERY SIMPLE,false,true,69,41.768537094,-87.614122885,2008-05-04T23:32:00.000+02:00,5,4,23,2008,Violent
6377313,07/19/2008 12:45:00 PM,CRIMINAL DAMAGE,TO PROPERTY,false,false,71,41.747926162,-87.657308777,2008-07-19T12:45:00.000+02:00,7,19,12,2008,Non-Violent
6282436,06/02/2008 06:00:00 PM,THEFT,$500 AND UNDER,false,false,22,41.925543174,-87.705133519,2008-06-02T18:00:00.000+02:00,6,2,18,2008,Non-Violent
6298722,06/05/2008 09:30:00 PM,CRIMINAL DAMAGE,TO PROPERTY,false,false,29,41.865802306,-87.706867809,2008-06-05T21:30:00.000+02:00,6,5,21,2008,Non-Violent
6328598,06/24/2008 01:00:00 PM,THEFT,$500 AND UNDER,false,false,52,41.700202741,-87.541344334,2008-06-24T13:00:00.000+02:00,6,24,13,2008,Non-Violent
6343554,06/20/2008 01:00:00 AM,THEFT,OVER $500,false,false,64,41.782395353,-87.793311842,2008-06-20T01:00:00.000+02:00,6,20,1,2008,Non-Violent
6284142,06/01/2008 12:00:00 PM,BATTERY,DOMESTIC BATTERY SIMPLE,false,true,68,41.786403732,-87.646168499,2008-06-01T12:00:00.000+02:00,6,1,12,2008,Violent
6249388,05/14/2008 12:04:00 AM,CRIMINAL DAMAGE,CRIMINAL DEFACEMENT,true,false,30,41.851810212,-87.702016183,2008-05-14T00:04:00.000+02:00,5,14,0,2008,Non-Violent
6326598,06/25/2008 01:02:01 AM,INTERFERENCE WITH PUBLIC OFFICER,OBSTRUCTING JUSTICE,true,false,38,41.810081037,-87.613838101,2008-06-25T01:02:01.000+02:00,6,25,1,2008,Non-Violent
6238058,05/07/2008 06:00:00 PM,BURGLARY,FORCIBLE ENTRY,false,false,22,41.913999421,-87.706863308,2008-05-07T18:00:00.000+02:00,5,7,18,2008,Non-Violent
6248836,05/14/2008 07:12:00 PM,THEFT,RETAIL THEFT,true,false,30,41.851912036,-87.694622835,2008-05-14T19:12:00.000+02:00,5,14,19,2008,Non-Violent
6227698,05/03/2008 05:49:08 AM,ROBBERY,STRONGARM - NO WEAPON,false,false,52,41.704107141,-87.535283341,2008-05-03T05:49:08.000+02:00,5,3,5,2008,Violent
6191278,04/05/2008 02:50:00 AM,NARCOTICS,POSS: CRACK,true,false,29,41.854864309,-87.724846958,2008-04-05T02:50:00.000+02:00,4,5,2,2008,Non-Violent
6343721,07/03/2008 11:30:00 AM,BURGLARY,FORCIBLE ENTRY,false,false,10,41.979561648,-87.799773453,2008-07-03T11:30:00.000+02:00,7,3,11,2008,Non-Violent
6348156,07/07/2008 12:50:11 AM,THEFT,FROM BUILDING,false,false,37,41.81691816,-87.633567673,2008-07-07T00:50:11.000+02:00,7,7,0,2008,Non-Violent
6344599,06/30/2008 09:03:00 PM,OTHER OFFENSE,FALSE/STOLEN/ALTERED TRP,true,false,46,41.739960146,-87.562408141,2008-06-30T21:03:00.000+02:00,6,30,21,2008,Non-Violent
6360953,07/12/2008 03:00:00 AM,THEFT,OVER $500,false,false,67,41.780723425,-87.660605155,2008-07-12T03:00:00.000+02:00,7,12,3,2008,Non-Violent
6215720,04/27/2008 02:03:24 AM,THEFT,$500 AND UNDER,false,true,49,41.707793505,-87.62011793,2008-04-27T02:03:24.000+02:00,4,27,2,2008,Non-Violent
6194745,04/16/2008 10:10:00 PM,ASSAULT,SIMPLE,false,true,73,41.729588474,-87.65680867,2008-04-16T22:10:00.000+02:00,4,16,22,2008,Violent
6252431,05/15/2008 09:00:00 AM,MOTOR VEHICLE THEFT,AUTOMOBILE,false,false,38,41.81611063,-87.621393611,2008-05-15T09:00:00.000+02:00,5,15,9,2008,Non-Violent
6187983,04/13/2008 04:30:00 PM,BATTERY,SIMPLE,false,false,22,41.91661021,-87.693610707,2008-04-13T16:30:00.000+02:00,4,13,16,2008,Violent
6358828,07/08/2008 05:30:00 PM,THEFT,OVER $500,false,false,67,41.782340415,-87.663055812,2008-07-08T17:30:00.000+02:00,7,8,17,2008,Non-Violent
6235929,05/04/2008 02:00:00 PM,ASSAULT,SIMPLE,false,true,49,41.729308085,-87.629320805,2008-05-04T14:00:00.000+02:00,5,4,14,2008,Violent
6323838,06/20/2008 05:35:00 PM,WEAPONS VIOLATION,UNLAWFUL POSS OF HANDGUN,true,false,64,41.781876484,-87.786309533,2008-06-20T17:35:00.000+02:00,6,20,17,2008,Non-Violent
6239800,05/09/2008 02:59:00 AM,BATTERY,SIMPLE,false,false,28,41.885393253,-87.663547848,2008-05-09T02:59:00.000+02:00,5,9,2,2008,Violent
6219876,04/29/2008 10:40:00 AM,BATTERY,AGGRAVATED:KNIFE/CUTTING INSTR,false,false,31,41.856109737,-87.657987678,2008-04-29T10:40:00.000+02:00,4,29,10,2008,Violent
6223593,05/01/2008 09:20:00 AM,OTHER OFFENSE,TELEPHONE THREAT,false,true,25,41.908032172,-87.764620728,2008-05-01T09:20:00.000+02:00,5,1,9,2008,Non-Violent
6253916,05/16/2008 11:00:00 AM,DECEPTIVE PRACTICE,FORGERY,false,false,32,41.88121504,-87.637001425,2008-05-16T11:00:00.000+02:00,5,16,11,2008,Non-Violent
6229752,05/03/2008 10:30:00 PM,CRIMINAL DAMAGE,TO VEHICLE,false,false,7,41.912417835,-87.653165719,2008-05-03T22:30:00.000+02:00,5,3,22,2008,Non-Violent
6179999,04/08/2008 10:00:00 AM,OTHER OFFENSE,HARASSMENT BY TELEPHONE,false,true,57,41.798602545,-87.728218082,2008-04-08T10:00:00.000+02:00,4,8,10,2008,Non-Violent
6225766,04/30/2008 09:54:39 PM,CRIMINAL DAMAGE,TO PROPERTY,false,false,23,41.895457291,-87.716619992,2008-04-30T21:54:39.000+02:00,4,30,21,2008,Non-Violent
6290118,06/06/2008 12:28:00 PM,THEFT,ATTEMPT FINANCIAL IDENTITY THEFT,false,false,42,41.777720239,-87.610742672,2008-06-06T12:28:00.000+02:00,6,6,12,2008,Non-Violent
6328175,06/23/2008 05:15:00 PM,ASSAULT,AGGRAVATED: HANDGUN,true,false,49,41.686811995,-87.616849726,2008-06-23T17:15:00.000+02:00,6,23,17,2008,Violent
6370931,07/16/2008 10:00:00 PM,THEFT,$500 AND UNDER,false,false,70,41.737765399,-87.730027948,2008-07-16T22:00:00.000+02:00,7,16,22,2008,Non-Violent
6247030,05/14/2008 01:45:00 AM,CRIMINAL TRESPASS,TO LAND,true,false,69,41.777615976,-87.615561272,2008-05-14T01:45:00.000+02:00,5,14,1,2008,Non-Violent
6187246,04/06/2008 11:50:00 AM,NARCOTICS,POSS: HEROIN(WHITE),true,false,25,41.894008139,-87.751284,2008-04-06T11:50:00.000+02:00,4,6,11,2008,Non-Violent
6366785,07/14/2008 12:05:00 PM,CRIMINAL DAMAGE,TO CITY OF CHICAGO PROPERTY,false,false,68,41.789009928,-87.638267865,2008-07-14T12:05:00.000+02:00,7,14,12,2008,Non-Violent
6373353,07/13/2008 08:17:25 PM,CRIMINAL DAMAGE,TO PROPERTY,false,false,46,41.734897624,-87.552759624,2008-07-13T20:17:25.000+02:00,7,13,20,2008,Non-Violent
6226284,05/02/2008 06:20:00 PM,BATTERY,DOMESTIC BATTERY SIMPLE,false,true,28,41.864192977,-87.665267005,2008-05-02T18:20:00.000+02:00,5,2,18,2008,Violent
6257148,05/18/2008 09:01:40 PM,BATTERY,DOMESTIC BATTERY SIMPLE,false,true,25,41.886094169,-87.765068733,2008-05-18T21:01:40.000+02:00,5,18,21,2008,Violent
6240291,05/07/2008 08:00:00 PM,THEFT,$500 AND UNDER,false,false,27,41.874532075,-87.71146775,2008-05-07T20:00:00.000+02:00,5,7,20,2008,Non-Violent
6281455,05/31/2008 07:50:00 AM,BATTERY,DOMESTIC BATTERY SIMPLE,false,true,3,41.963653562,-87.651054693,2008-05-31T07:50:00.000+02:00,5,31,7,2008,Violent
6309869,06/14/2008 12:20:00 AM,CRIMINAL DAMAGE,TO PROPERTY,false,false,70,41.749568654,-87.713521821,2008-06-14T00:20:00.000+02:00,6,14,0,2008,Non-Violent
6173278,04/05/2008 02:32:47 AM,BATTERY,DOMESTIC BATTERY SIMPLE,false,true,68,41.771804071,-87.653080609,2008-04-05T02:32:47.000+02:00,4,5,2,2008,Violent
6261003,05/07/2008 06:31:00 PM,NARCOTICS,POSS: CANNABIS 30GMS OR LESS,true,false,64,41.777927449,-87.768169424,2008-05-07T18:31:00.000+02:00,5,7,18,2008,Non-Violent
6266237,05/23/2008 10:40:00 PM,THEFT,FROM BUILDING,false,false,28,41.881348623,-87.674525788,2008-05-23T22:40:00.000+02:00,5,23,22,2008,Non-Violent
6361686,07/12/2008 11:15:00 PM,BATTERY,DOMESTIC BATTERY SIMPLE,false,true,49,41.721180629,-87.623717187,2008-07-12T23:15:00.000+02:00,7,12,23,2008,Violent
6320869,06/22/2008 04:00:00 PM,BATTERY,DOMESTIC BATTERY SIMPLE,false,true,73,41.717146527,-87.639452981,2008-06-22T16:00:00.000+02:00,6,22,16,2008,Violent
6164713,03/31/2008 07:53:43 AM,BURGLARY,UNLAWFUL ENTRY,false,false,45,41.743267622,-87.587443207,2008-03-31T07:53:43.000+02:00,3,31,7,2008,Non-Violent
6231277,05/05/2008 01:35:38 PM,NARCOTICS,POSS: CRACK,true,false,25,41.893768542,-87.759293054,2008-05-05T13:35:38.000+02:00,5,5,13,2008,Non-Violent
6273552,05/26/2008 07:00:00 AM,OTHER OFFENSE,OTHER WEAPONS VIOLATION,false,false,76,41.976290414,-87.905227221,2008-05-26T07:00:00.000+02:00,5,26,7,2008,Non-Violent
6170385,03/18/2008 07:55:00 PM,LIQUOR LAW VIOLATION,SELL/GIVE/DEL LIQUOR TO MINOR,true,false,7,41.932258505,-87.648996906,2008-03-18T19:55:00.000+02:00,3,18,19,2008,Non-Violent
6231047,05/04/2008 07:43:39 PM,MOTOR VEHICLE THEFT,ATT: AUTOMOBILE,false,false,42,,,2008-05-04T19:43:39.000+02:00,5,4,19,2008,Non-Violent
6337161,06/30/2008 01:16:25 PM,BURGLARY,UNLAWFUL ENTRY,false,false,38,41.820331167,-87.61038488,2008-06-30T13:16:25.000+02:00,6,30,13,2008,Non-Violent
6235594,05/07/2008 08:30:00 AM,CRIMINAL DAMAGE,TO VEHICLE,false,false,54,41.657559722,-87.613280429,2008-05-07T08:30:00.000+02:00,5,7,8,2008,Non-Violent
6289625,06/06/2008 12:19:00 AM,CRIMINAL DAMAGE,TO PROPERTY,false,false,18,41.936888182,-87.806708195,2008-06-06T00:19:00.000+02:00,6,6,0,2008,Non-Violent
6205985,04/17/2008 03:45:00 PM,BATTERY,SIMPLE,false,false,43,41.761101102,-87.559791032,2008-04-17T15:45:00.000+02:00,4,17,15,2008,Violent
6248821,05/14/2008 01:56:40 AM,NARCOTICS,POSS: HALLUCINOGENS,true,false,25,41.882301097,-87.760545114,2008-05-14T01:56:40.000+02:00,5,14,1,2008,Non-Violent
6360916,07/12/2008 01:50:00 PM,THEFT,$500 AND UNDER,false,false,24,41.898882295,-87.672262913,2008-07-12T13:50:00.000+02:00,7,12,13,2008,Non-Violent
6349606,07/07/2008 12:00:00 AM,THEFT,$500 AND UNDER,false,false,61,41.802431903,-87.674538934,2008-07-07T00:00:00.000+02:00,7,7,0,2008,Non-Violent
6271775,05/27/2008 10:00:00 PM,THEFT,$500 AND UNDER,false,false,3,,,2008-05-27T22:00:00.000+02:00,5,27,22,2008,Non-Violent
6369998,07/16/2008 12:00:00 PM,THEFT,FINANCIAL ID THEFT:$300 &UNDER,false,true,75,41.680226453,-87.682021049,2008-07-16T12:00:00.000+02:00,7,16,12,2008,Non-Violent
6237564,05/09/2008 07:00:00 AM,ROBBERY,STRONGARM - NO WEAPON,true,false,20,41.937892922,-87.740895344,2008-05-09T07:00:00.000+02:00,5,9,7,2008,Violent
6288409,06/05/2008 11:20:00 AM,CRIMINAL DAMAGE,CRIMINAL DEFACEMENT,true,false,20,41.928001461,-87.735882518,2008-06-05T11:20:00.000+02:00,6,5,11,2008,Non-Violent
6303151,06/12/2008 02:51:59 PM,WEAPONS VIOLATION,UNLAWFUL POSS OF HANDGUN,false,false,53,41.679310052,-87.629906282,2008-06-12T14:51:59.000+02:00,6,12,14,2008,Non-Violent
6275114,05/01/2008 09:00:00 AM,OTHER OFFENSE,OTHER VEHICLE OFFENSE,false,false,40,41.785632818,-87.620091889,2008-05-01T09:00:00.000+02:00,5,1,9,2008,Non-Violent
6211260,04/23/2008 06:43:00 PM,ROBBERY,AGGRAVATED VEHICULAR HIJACKING,false,false,68,41.78701723,-87.645505595,2008-04-23T18:43:00.000+02:00,4,23,18,2008,Violent
6290747,06/04/2008 07:00:00 PM,CRIMINAL TRESPASS,TO LAND,true,false,30,41.843587405,-87.725746539,2008-06-04T19:00:00.000+02:00,6,4,19,2008,Non-Violent
6313716,06/18/2008 08:06:08 PM,CRIMINAL DAMAGE,TO PROPERTY,true,false,61,41.800770653,-87.655040879,2008-06-18T20:06:08.000+02:00,6,18,20,2008,Non-Violent
6291768,06/04/2008 09:00:00 AM,OTHER OFFENSE,OTHER VEHICLE OFFENSE,false,false,49,41.697086882,-87.620840409,2008-06-04T09:00:00.000+02:00,6,4,9,2008,Non-Violent
6243732,05/12/2008 01:53:00 AM,BATTERY,SIMPLE,true,false,42,41.781731648,-87.587862886,2008-05-12T01:53:00.000+02:00,5,12,1,2008,Violent
6202455,04/19/2008 02:25:00 PM,BATTERY,AGGRAVATED DOMESTIC BATTERY: OTHER DANG WEAPON,false,true,66,41.78528412,-87.706647596,2008-04-19T14:25:00.000+02:00,4,19,14,2008,Violent
6238787,05/09/2008 10:00:00 AM,CRIMINAL DAMAGE,TO VEHICLE,false,false,24,41.897912726,-87.665947815,2008-05-09T10:00:00.000+02:00,5,9,10,2008,Non-Violent
6192578,04/11/2008 09:00:00 PM,ASSAULT,AGGRAVATED: HANDGUN,false,false,43,41.764090685,-87.578097077,2008-04-11T21:00:00.000+02:00,4,11,21,2008,Violent
6205635,04/16/2008 10:00:00 AM,BURGLARY,UNLAWFUL ENTRY,false,false,22,41.9299058,-87.693084659,2008-04-16T10:00:00.000+02:00,4,16,10,2008,Non-Violent
6379399,07/20/2008 07:00:00 PM,MOTOR VEHICLE THEFT,"CYCLE, SCOOTER, BIKE W-VIN",false,false,22,41.917800368,-87.675492103,2008-07-20T19:00:00.000+02:00,7,20,19,2008,Non-Violent
6173128,04/04/2008 07:07:45 PM,CRIMINAL DAMAGE,TO PROPERTY,false,false,68,41.777450272,-87.634983111,2008-04-04T19:07:45.000+02:00,4,4,19,2008,Non-Violent
6375805,07/19/2008 08:15:00 PM,ASSAULT,SIMPLE,false,false,75,41.691312761,-87.662321097,2008-07-19T20:15:00.000+02:00,7,19,20,2008,Violent
6339819,07/02/2008 06:15:00 AM,CRIMINAL DAMAGE,TO PROPERTY,false,false,32,41.868913202,-87.628554776,2008-07-02T06:15:00.000+02:00,7,2,6,2008,Non-Violent
6319948,06/21/2008 08:00:00 PM,ASSAULT,AGGRAVATED: OTHER DANG WEAPON,true,false,15,41.955480298,-87.779305507,2008-06-21T20:00:00.000+02:00,6,21,20,2008,Violent
6187174,04/08/2008 12:11:03 PM,NARCOTICS,POSS: HEROIN(WHITE),true,false,25,41.893113371,-87.751255395,2008-04-08T12:11:03.000+02:00,4,8,12,2008,Non-Violent
6229747,05/03/2008 09:00:00 PM,CRIMINAL DAMAGE,TO VEHICLE,false,false,1,42.007440009,-87.673601689,2008-05-03T21:00:00.000+02:00,5,3,21,2008,Non-Violent
6315188,06/12/2008 07:05:00 AM,PROSTITUTION,SOLICIT ON PUBLIC WAY,true,false,1,42.00820667,-87.673781419,2008-06-12T07:05:00.000+02:00,6,12,7,2008,Non-Violent
6376036,07/19/2008 08:30:46 AM,BATTERY,DOMESTIC BATTERY SIMPLE,false,true,1,42.002099092,-87.663524631,2008-07-19T08:30:46.000+02:00,7,19,8,2008,Violent
6177742,04/07/2008 07:45:00 PM,NARCOTICS,MANU/DELIVER:CRACK,true,false,33,41.850330711,-87.627026373,2008-04-07T19:45:00.000+02:00,4,7,19,2008,Non-Violent
6187806,04/13/2008 01:45:00 PM,CRIMINAL DAMAGE,TO PROPERTY,false,false,28,41.867608211,-87.680298775,2008-04-13T13:45:00.000+02:00,4,13,13,2008,Non-Violent
6209825,04/20/2008 12:01:00 AM,OTHER OFFENSE,TELEPHONE THREAT,false,false,25,,,2008-04-20T00:01:00.000+02:00,4,20,0,2008,Non-Violent
6374560,07/19/2008 05:00:00 AM,CRIMINAL DAMAGE,TO VEHICLE,false,false,25,41.893913117,-87.763526601,2008-07-19T05:00:00.000+02:00,7,19,5,2008,Non-Violent
6215043,04/23/2008 02:15:00 PM,NARCOTICS,POSS: CANNABIS 30GMS OR LESS,true,false,35,41.830093485,-87.619312348,2008-04-23T14:15:00.000+02:00,4,23,14,2008,Non-Violent
6362920,07/12/2008 01:00:00 PM,THEFT,ATTEMPT THEFT,false,false,32,41.875740284,-87.623111546,2008-07-12T13:00:00.000+02:00,7,12,13,2008,Non-Violent
6380580,07/19/2008 12:00:00 PM,THEFT,OVER $500,false,true,20,41.927336721,-87.737343943,2008-07-19T12:00:00.000+02:00,7,19,12,2008,Non-Violent
6309650,06/16/2008 12:25:24 PM,CRIMINAL TRESPASS,TO LAND,true,false,67,41.76002733,-87.663661918,2008-06-16T12:25:24.000+02:00,6,16,12,2008,Non-Violent
6184357,04/09/2008 11:17:27 AM,DECEPTIVE PRACTICE,THEFT OF LABOR/SERVICES,false,false,31,41.851488418,-87.685623422,2008-04-09T11:17:27.000+02:00,4,9,11,2008,Non-Violent
6208553,04/22/2008 06:34:22 PM,BATTERY,SIMPLE,false,false,68,41.786551958,-87.64617425,2008-04-22T18:34:22.000+02:00,4,22,18,2008,Violent
6378548,07/19/2008 09:30:00 PM,BATTERY,DOMESTIC BATTERY SIMPLE,true,true,11,41.98377761,-87.775139447,2008-07-19T21:30:00.000+02:00,7,19,21,2008,Violent
6234654,05/06/2008 08:15:00 AM,BATTERY,DOMESTIC BATTERY SIMPLE,false,true,44,41.747672289,-87.601104881,2008-05-06T08:15:00.000+02:00,5,6,8,2008,Violent
6263432,02/24/2008 10:30:00 AM,OTHER OFFENSE,OTHER CRIME INVOLVING PROPERTY,false,false,7,41.922398472,-87.646232483,2008-02-24T10:30:00.000+02:00,2,24,10,2008,Non-Violent
6248115,05/14/2008 12:01:00 AM,MOTOR VEHICLE THEFT,THEFT/RECOVERY: AUTOMOBILE,false,false,18,41.935503317,-87.796840444,2008-05-14T00:01:00.000+02:00,5,14,0,2008,Non-Violent
6312755,06/17/2008 08:45:00 AM,THEFT,$500 AND UNDER,false,false,32,41.884304288,-87.621213594,2008-06-17T08:45:00.000+02:00,6,17,8,2008,Non-Violent
6314120,06/17/2008 02:00:00 PM,BURGLARY,UNLAWFUL ENTRY,false,false,29,41.86339496,-87.732427749,2008-06-17T14:00:00.000+02:00,6,17,14,2008,Non-Violent
6174979,04/05/2008 12:50:00 PM,BATTERY,DOMESTIC BATTERY SIMPLE,false,true,66,41.776900276,-87.68100717,2008-04-05T12:50:00.000+02:00,4,5,12,2008,Violent
6210939,04/22/2008 03:00:00 PM,BATTERY,SIMPLE,false,false,70,41.742401035,-87.708046765,2008-04-22T15:00:00.000+02:00,4,22,15,2008,Violent
6193453,04/15/2008 01:15:00 PM,BURGLARY,ATTEMPT FORCIBLE ENTRY,false,false,20,41.917143973,-87.728293659,2008-04-15T13:15:00.000+02:00,4,15,13,2008,Non-Violent
6346772,07/05/2008 06:00:00 AM,BURGLARY,UNLAWFUL ENTRY,false,false,23,41.888565226,-87.720997895,2008-07-05T06:00:00.000+02:00,7,5,6,2008,Non-Violent
6300243,06/12/2008 12:00:00 AM,THEFT,$500 AND UNDER,false,false,67,41.78434093,-87.660695673,2008-06-12T00:00:00.000+02:00,6,12,0,2008,Non-Violent
6360390,07/10/2008 12:30:00 PM,THEFT,$500 AND UNDER,false,false,50,41.686079735,-87.609480873,2008-07-10T12:30:00.000+02:00,7,10,12,2008,Non-Violent
6252735,05/16/2008 08:40:00 AM,DECEPTIVE PRACTICE,BOGUS CHECK,false,false,11,41.975907563,-87.768474495,2008-05-16T08:40:00.000+02:00,5,16,8,2008,Non-Violent
6174272,04/05/2008 12:20:00 PM,BATTERY,SIMPLE,false,false,61,41.800645342,-87.676930139,2008-04-05T12:20:00.000+02:00,4,5,12,2008,Violent
6216560,04/11/2008 01:30:00 PM,NARCOTICS,POSS: CANNABIS MORE THAN 30GMS,true,false,29,,,2008-04-11T13:30:00.000+02:00,4,11,13,2008,Non-Violent
6225629,04/29/2008 05:26:00 AM,MOTOR VEHICLE THEFT,"THEFT/RECOVERY: TRUCK,BUS,MHOME",false,false,43,41.769197008,-87.580064346,2008-04-29T05:26:00.000+02:00,4,29,5,2008,Non-Violent
6271108,05/26/2008 03:50:00 PM,NARCOTICS,POSS: CANNABIS 30GMS OR LESS,true,false,36,41.823125769,-87.602725951,2008-05-26T15:50:00.000+02:00,5,26,15,2008,Non-Violent
6221652,03/26/2008 07:45:40 PM,BATTERY,SIMPLE,false,false,73,41.731390119,-87.661720981,2008-03-26T19:45:40.000+02:00,3,26,19,2008,Violent
6326627,06/24/2008 01:26:00 PM,THEFT,FINANCIAL ID THEFT: OVER $300,false,false,27,41.870953335,-87.706879932,2008-06-24T13:26:00.000+02:00,6,24,13,2008,Non-Violent
6339529,07/01/2008 05:00:00 AM,OTHER OFFENSE,HARASSMENT BY TELEPHONE,false,true,51,41.720173249,-87.553802304,2008-07-01T05:00:00.000+02:00,7,1,5,2008,Non-Violent
6228216,04/30/2008 11:30:00 PM,ROBBERY,ARMED: HANDGUN,false,false,49,41.721325872,-87.620580034,2008-04-30T23:30:00.000+02:00,4,30,23,2008,Violent
6202722,04/18/2008 11:45:00 PM,DECEPTIVE PRACTICE,ILLEGAL USE CASH CARD,false,false,26,41.88068906,-87.728733158,2008-04-18T23:45:00.000+02:00,4,18,23,2008,Non-Violent
6282800,06/02/2008 05:32:00 PM,WEAPONS VIOLATION,UNLAWFUL USE HANDGUN,false,false,31,41.853207815,-87.667646062,2008-06-02T17:32:00.000+02:00,6,2,17,2008,Non-Violent
6331852,06/21/2008 01:00:00 PM,OTHER OFFENSE,TELEPHONE THREAT,false,true,65,41.766045581,-87.71354287,2008-06-21T13:00:00.000+02:00,6,21,13,2008,Non-Violent
6269829,05/24/2008 02:30:00 PM,THEFT,$500 AND UNDER,false,false,19,41.928589041,-87.762372896,2008-05-24T14:30:00.000+02:00,5,24,14,2008,Non-Violent
6194166,04/15/2008 04:49:40 PM,THEFT,RETAIL THEFT,false,false,29,41.866147992,-87.726788556,2008-04-15T16:49:40.000+02:00,4,15,16,2008,Non-Violent
6336778,06/30/2008 03:00:00 PM,MOTOR VEHICLE THEFT,AUTOMOBILE,false,false,20,41.921680978,-87.735254356,2008-06-30T15:00:00.000+02:00,6,30,15,2008,Non-Violent
6300824,06/11/2008 10:00:00 PM,CRIMINAL DAMAGE,TO PROPERTY,false,false,62,41.796308573,-87.71588817,2008-06-11T22:00:00.000+02:00,6,11,22,2008,Non-Violent
6309879,06/16/2008 09:00:00 AM,THEFT,$500 AND UNDER,false,false,49,41.700895337,-87.612372403,2008-06-16T09:00:00.000+02:00,6,16,9,2008,Non-Violent
6311246,06/17/2008 01:10:00 PM,BATTERY,SIMPLE,false,false,35,41.831676098,-87.616975751,2008-06-17T13:10:00.000+02:00,6,17,13,2008,Violent
6334785,06/27/2008 06:45:00 PM,BATTERY,SIMPLE,false,false,43,41.756068542,-87.582196985,2008-06-27T18:45:00.000+02:00,6,27,18,2008,Violent
6333002,06/28/2008 06:06:00 PM,BATTERY,DOMESTIC BATTERY SIMPLE,false,true,22,41.915517564,-87.712528656,2008-06-28T18:06:00.000+02:00,6,28,18,2008,Violent
6198813,04/18/2008 08:00:00 PM,OTHER OFFENSE,OTHER VEHICLE OFFENSE,false,true,57,41.806936464,-87.719850179,2008-04-18T20:00:00.000+02:00,4,18,20,2008,Non-Violent
6367372,07/12/2008 05:00:00 PM,MOTOR VEHICLE THEFT,"TRUCK, BUS, MOTOR HOME",false,false,69,41.761603489,-87.615197285,2008-07-12T17:00:00.000+02:00,7,12,17,2008,Non-Violent
6169355,04/02/2008 11:48:20 AM,NARCOTICS,POSS: HEROIN(WHITE),true,false,33,41.852216317,-87.627075368,2008-04-02T11:48:20.000+02:00,4,2,11,2008,Non-Violent
6256217,05/13/2008 05:30:00 AM,CRIMINAL DAMAGE,TO VEHICLE,false,false,23,41.912729599,-87.726421215,2008-05-13T05:30:00.000+02:00,5,13,5,2008,Non-Violent
6328377,06/24/2008 07:10:00 AM,KIDNAPPING,CHILD ABDUCTION/STRANGER,false,false,16,41.956444275,-87.723164711,2008-06-24T07:10:00.000+02:00,6,24,7,2008,Violent
6286695,06/01/2008 12:01:00 AM,MOTOR VEHICLE THEFT,AUTOMOBILE,false,false,4,41.969699165,-87.690053426,2008-06-01T00:01:00.000+02:00,6,1,0,2008,Non-Violent
6284062,06/02/2008 04:05:19 PM,CRIMINAL DAMAGE,TO VEHICLE,false,false,53,41.677162539,-87.623867836,2008-06-02T16:05:19.000+02:00,6,2,16,2008,Non-Violent
6293258,06/07/2008 08:30:00 PM,ASSAULT,SIMPLE,false,true,51,41.721938553,-87.578990155,2008-06-07T20:30:00.000+02:00,6,7,20,2008,Violent
6350276,07/07/2008 01:10:00 AM,BATTERY,DOMESTIC BATTERY SIMPLE,false,true,67,41.773129529,-87.676176953,2008-07-07T01:10:00.000+02:00,7,7,1,2008,Violent
6268072,05/23/2008 12:02:03 PM,THEFT,$500 AND UNDER,false,false,23,41.896030258,-87.727335988,2008-05-23T12:02:03.000+02:00,5,23,12,2008,Non-Violent
6253267,05/15/2008 10:00:00 PM,NARCOTICS,POSS: CANNABIS 30GMS OR LESS,true,false,24,41.902974842,-87.691281983,2008-05-15T22:00:00.000+02:00,5,15,22,2008,Non-Violent
6265077,05/21/2008 07:35:34 PM,INTERFERENCE WITH PUBLIC OFFICER,INTERFERENCE JUDICIAL PROCESS,true,false,2,41.995078127,-87.685284156,2008-05-21T19:35:34.000+02:00,5,21,19,2008,Non-Violent
6267726,05/24/2008 01:47:21 PM,NARCOTICS,SOLICIT NARCOTICS ON PUBLICWAY,true,false,25,41.898664919,-87.746929424,2008-05-24T13:47:21.000+02:00,5,24,13,2008,Non-Violent
6318487,06/20/2008 07:00:00 PM,MOTOR VEHICLE THEFT,AUTOMOBILE,false,false,64,41.779052677,-87.771539898,2008-06-20T19:00:00.000+02:00,6,20,19,2008,Non-Violent
6273227,05/26/2008 07:00:00 AM,THEFT,OVER $500,false,false,6,,,2008-05-26T07:00:00.000+02:00,5,26,7,2008,Non-Violent
6306965,06/15/2008 04:20:00 PM,ROBBERY,STRONGARM - NO WEAPON,false,false,70,41.74883909,-87.682819472,2008-06-15T16:20:00.000+02:00,6,15,16,2008,Violent
6328303,06/25/2008 10:18:02 PM,NARCOTICS,POSS: HEROIN(WHITE),true,false,25,41.887216076,-87.755620452,2008-06-25T22:18:02.000+02:00,6,25,22,2008,Non-Violent
6364482,07/13/2008 10:50:00 AM,BATTERY,DOMESTIC BATTERY SIMPLE,false,true,52,41.705523241,-87.535287802,2008-07-13T10:50:00.000+02:00,7,13,10,2008,Violent
6216711,04/25/2008 05:15:00 PM,ASSAULT,SIMPLE,false,false,71,41.740526486,-87.643744855,2008-04-25T17:15:00.000+02:00,4,25,17,2008,Violent
6225580,05/02/2008 12:30:00 AM,THEFT,OVER $500,false,false,19,41.93568027,-87.765169022,2008-05-02T00:30:00.000+02:00,5,2,0,2008,Non-Violent
6238772,05/08/2008 09:00:00 AM,THEFT,FINANCIAL ID THEFT: OVER $300,false,false,29,41.854635889,-87.712420345,2008-05-08T09:00:00.000+02:00,5,8,9,2008,Non-Violent
6314883,06/03/2008 09:30:00 PM,PROSTITUTION,SOLICIT ON PUBLIC WAY,true,false,25,41.880553047,-87.740543983,2008-06-03T21:30:00.000+02:00,6,3,21,2008,Non-Violent
6174090,04/04/2008 09:00:00 PM,BATTERY,SIMPLE,false,false,29,41.858535535,-87.707878478,2008-04-04T21:00:00.000+02:00,4,4,21,2008,Violent
6284893,06/01/2008 01:38:37 AM,BATTERY,SIMPLE,false,false,29,41.863472388,-87.72265444,2008-06-01T01:38:37.000+02:00,6,1,1,2008,Violent
6258340,05/20/2008 12:15:00 AM,MOTOR VEHICLE THEFT,"CYCLE, SCOOTER, BIKE W-VIN",false,false,73,41.709753129,-87.641696959,2008-05-20T00:15:00.000+02:00,5,20,0,2008,Non-Violent
6339219,06/30/2008 09:00:00 AM,THEFT,$500 AND UNDER,false,false,24,41.895150666,-87.648012165,2008-06-30T09:00:00.000+02:00,6,30,9,2008,Non-Violent
6193383,04/15/2008 02:10:00 PM,THEFT,$500 AND UNDER,false,false,32,41.878113871,-87.634262752,2008-04-15T14:10:00.000+02:00,4,15,14,2008,Non-Violent
6283599,05/30/2008 04:00:00 PM,BURGLARY,FORCIBLE ENTRY,false,false,23,41.903559347,-87.727646835,2008-05-30T16:00:00.000+02:00,5,30,16,2008,Non-Violent
6327637,06/25/2008 10:10:00 PM,BATTERY,SIMPLE,false,false,65,41.779783022,-87.728897334,2008-06-25T22:10:00.000+02:00,6,25,22,2008,Violent
6164983,03/29/2008 02:00:00 AM,ASSAULT,SIMPLE,false,false,28,41.865819053,-87.645069093,2008-03-29T02:00:00.000+02:00,3,29,2,2008,Violent
6208519,04/23/2008 08:32:39 PM,LIQUOR LAW VIOLATION,ILLEGAL CONSUMPTION BY MINOR,true,false,59,41.833491458,-87.682696898,2008-04-23T20:32:39.000+02:00,4,23,20,2008,Non-Violent
6317069,06/18/2008 10:56:50 PM,THEFT,$500 AND UNDER,false,false,25,41.891700795,-87.75793061,2008-06-18T22:56:50.000+02:00,6,18,22,2008,Non-Violent
6220407,04/28/2008 11:20:00 AM,CRIMINAL TRESPASS,TO LAND,true,false,76,41.976290414,-87.905227221,2008-04-28T11:20:00.000+02:00,4,28,11,2008,Non-Violent
6274161,05/28/2008 09:00:00 PM,THEFT,$500 AND UNDER,false,false,64,41.775617443,-87.796935851,2008-05-28T21:00:00.000+02:00,5,28,21,2008,Non-Violent
6230282,05/05/2008 02:00:00 PM,THEFT,FROM BUILDING,false,false,32,41.878227412,-87.626807395,2008-05-05T14:00:00.000+02:00,5,5,14,2008,Non-Violent
6176968,03/28/2008 04:06:24 PM,NARCOTICS,POSS: CANNABIS 30GMS OR LESS,true,false,71,41.749943887,-87.644025199,2008-03-28T16:06:24.000+02:00,3,28,16,2008,Non-Violent
6299257,06/05/2008 04:30:00 PM,CRIMINAL DAMAGE,TO PROPERTY,true,false,71,41.75153688,-87.664677357,2008-06-05T16:30:00.000+02:00,6,5,16,2008,Non-Violent
6259686,05/20/2008 03:38:54 PM,BATTERY,SIMPLE,false,false,36,41.830676853,-87.610352872,2008-05-20T15:38:54.000+02:00,5,20,15,2008,Violent
6363661,07/13/2008 09:45:00 AM,BATTERY,DOMESTIC BATTERY SIMPLE,false,true,23,41.896254751,-87.719998845,2008-07-13T09:45:00.000+02:00,7,13,9,2008,Violent
6248526,05/15/2008 12:35:00 AM,BATTERY,AGGRAVATED:KNIFE/CUTTING INSTR,false,false,19,41.924037539,-87.761505847,2008-05-15T00:35:00.000+02:00,5,15,0,2008,Violent
6165037,04/01/2008 02:25:20 AM,OTHER OFFENSE,VIOLATE ORDER OF PROTECTION,false,true,48,41.726168713,-87.571266055,2008-04-01T02:25:20.000+02:00,4,1,2,2008,Non-Violent
6237590,05/02/2008 08:00:00 AM,THEFT,FROM BUILDING,false,false,28,41.878478014,-87.657036174,2008-05-02T08:00:00.000+02:00,5,2,8,2008,Non-Violent
6311370,06/17/2008 04:15:00 PM,BATTERY,SIMPLE,false,false,42,41.779826802,-87.613197481,2008-06-17T16:15:00.000+02:00,6,17,16,2008,Violent
6337016,06/30/2008 09:33:53 PM,NARCOTICS,POSS: CANNABIS 30GMS OR LESS,true,false,31,41.853525903,-87.653085286,2008-06-30T21:33:53.000+02:00,6,30,21,2008,Non-Violent
6270884,05/21/2008 11:00:00 PM,MOTOR VEHICLE THEFT,AUTOMOBILE,false,false,26,41.884638532,-87.729349603,2008-05-21T23:00:00.000+02:00,5,21,23,2008,Non-Violent
6329512,06/26/2008 04:00:00 PM,CRIMINAL DAMAGE,TO VEHICLE,false,false,59,41.83031469,-87.681921835,2008-06-26T16:00:00.000+02:00,6,26,16,2008,Non-Violent
6215100,04/27/2008 01:04:00 PM,NARCOTICS,POSS: HEROIN(WHITE),true,false,25,41.900423863,-87.755023892,2008-04-27T13:04:00.000+02:00,4,27,13,2008,Non-Violent
6334013,06/21/2008 06:14:00 AM,NARCOTICS,POSS: CANNABIS 30GMS OR LESS,true,false,8,41.897629845,-87.641792824,2008-06-21T06:14:00.000+02:00,6,21,6,2008,Non-Violent
6226499,04/29/2008 03:30:00 PM,WEAPONS VIOLATION,UNLAWFUL USE OTHER DANG WEAPON,false,false,62,41.800385396,-87.723371159,2008-04-29T15:30:00.000+02:00,4,29,15,2008,Non-Violent
6222534,04/29/2008 07:30:00 AM,BURGLARY,FORCIBLE ENTRY,false,false,41,41.798926254,-87.59663054,2008-04-29T07:30:00.000+02:00,4,29,7,2008,Non-Violent
6382939,07/20/2008 05:30:00 PM,THEFT,OVER $500,false,false,61,41.796141303,-87.644476552,2008-07-20T17:30:00.000+02:00,7,20,17,2008,Non-Violent
6251632,05/15/2008 07:00:00 PM,BATTERY,SIMPLE,false,false,67,41.78316852,-87.660124944,2008-05-15T19:00:00.000+02:00,5,15,19,2008,Violent
6348344,06/25/2008 08:30:00 AM,THEFT,FROM BUILDING,false,false,32,41.878260207,-87.625448401,2008-06-25T08:30:00.000+02:00,6,25,8,2008,Non-Violent
6363135,07/13/2008 04:00:00 PM,THEFT,OVER $500,false,false,35,41.835746019,-87.607822546,2008-07-13T16:00:00.000+02:00,7,13,16,2008,Non-Violent
6280398,05/23/2008 12:00:00 PM,THEFT,FROM BUILDING,false,false,29,41.860135843,-87.723776459,2008-05-23T12:00:00.000+02:00,5,23,12,2008,Non-Violent
6261113,05/15/2008 05:00:00 AM,BATTERY,DOMESTIC BATTERY SIMPLE,false,true,44,41.746842227,-87.602627744,2008-05-15T05:00:00.000+02:00,5,15,5,2008,Violent
6303043,06/12/2008 02:45:50 AM,BATTERY,DOMESTIC BATTERY SIMPLE,false,true,66,41.779200334,-87.687869227,2008-06-12T02:45:50.000+02:00,6,12,2,2008,Violent
6366492,07/11/2008 08:00:00 PM,THEFT,FROM BUILDING,false,false,6,41.948602111,-87.657640897,2008-07-11T20:00:00.000+02:00,7,11,20,2008,Non-Violent
6335129,06/29/2008 11:30:17 AM,BURGLARY,FORCIBLE ENTRY,false,false,63,41.80207485,-87.680737223,2008-06-29T11:30:17.000+02:00,6,29,11,2008,Non-Violent
6352739,07/07/2008 08:45:00 AM,BATTERY,AGG: HANDS/FIST/FEET NO/MINOR INJURY,false,false,49,41.705366859,-87.621781719,2008-07-07T08:45:00.000+02:00,7,7,8,2008,Violent
6345857,07/05/2008 08:00:00 AM,MOTOR VEHICLE THEFT,AUTOMOBILE,false,false,51,41.701947674,-87.565129096,2008-07-05T08:00:00.000+02:00,7,5,8,2008,Non-Violent
6213340,04/25/2008 10:38:00 AM,THEFT,OVER $500,false,false,43,41.755173214,-87.581672341,2008-04-25T10:38:00.000+02:00,4,25,10,2008,Non-Violent
6306977,06/14/2008 10:10:00 AM,THEFT,RETAIL THEFT,false,false,32,41.872967379,-87.629152783,2008-06-14T10:10:00.000+02:00,6,14,10,2008,Non-Violent
6198993,04/13/2008 06:00:00 PM,CRIMINAL DAMAGE,TO VEHICLE,false,false,38,41.808747436,-87.613856692,2008-04-13T18:00:00.000+02:00,4,13,18,2008,Non-Violent
6169516,04/02/2008 02:26:38 PM,CRIM SEXUAL ASSAULT,NON-AGGRAVATED,false,false,25,41.875867507,-87.746205221,2008-04-02T14:26:38.000+02:00,4,2,14,2008,Non-Violent
6334859,06/28/2008 09:58:00 AM,OTHER OFFENSE,FALSE/STOLEN/ALTERED TRP,false,false,23,41.896006811,-87.712669898,2008-06-28T09:58:00.000+02:00,6,28,9,2008,Non-Violent
6361783,07/13/2008 01:00:00 AM,CRIMINAL DAMAGE,CRIMINAL DEFACEMENT,false,false,68,41.76692306,-87.650951125,2008-07-13T01:00:00.000+02:00,7,13,1,2008,Non-Violent
6265238,05/21/2008 12:00:00 PM,BURGLARY,FORCIBLE ENTRY,false,false,71,41.746311162,-87.658480023,2008-05-21T12:00:00.000+02:00,5,21,12,2008,Non-Violent
6287750,04/15/2008 10:00:00 PM,OTHER OFFENSE,HARASSMENT BY ELECTRONIC MEANS,false,true,5,41.935313112,-87.678215614,2008-04-15T22:00:00.000+02:00,4,15,22,2008,Non-Violent
6226603,05/01/2008 04:30:00 PM,BATTERY,AGGRAVATED: OTHER DANG WEAPON,false,false,30,41.851717911,-87.709229564,2008-05-01T16:30:00.000+02:00,5,1,16,2008,Violent
6267899,05/24/2008 06:00:00 PM,THEFT,FROM BUILDING,false,false,42,41.783522021,-87.593125671,2008-05-24T18:00:00.000+02:00,5,24,18,2008,Non-Violent
6246721,05/12/2008 08:10:00 AM,CRIMINAL DAMAGE,TO VEHICLE,false,false,17,41.952753411,-87.803915999,2008-05-12T08:10:00.000+02:00,5,12,8,2008,Non-Violent
6351288,07/01/2008 09:15:00 PM,NARCOTICS,POSS: CRACK,true,false,25,41.893722348,-87.750665879,2008-07-01T21:15:00.000+02:00,7,1,21,2008,Non-Violent
6353258,07/08/2008 01:00:00 PM,CRIMINAL DAMAGE,TO VEHICLE,true,true,23,41.897974238,-87.715177953,2008-07-08T13:00:00.000+02:00,7,8,13,2008,Non-Violent
6302199,06/05/2008 04:27:00 PM,BATTERY,DOMESTIC BATTERY SIMPLE,false,true,58,41.820864788,-87.700328132,2008-06-05T16:27:00.000+02:00,6,5,16,2008,Violent
6319800,06/22/2008 01:55:00 AM,BATTERY,SIMPLE,false,false,74,41.691524515,-87.703618876,2008-06-22T01:55:00.000+02:00,6,22,1,2008,Violent
6374547,07/17/2008 08:00:00 AM,BATTERY,DOMESTIC BATTERY SIMPLE,false,true,69,41.752327918,-87.599157274,2008-07-17T08:00:00.000+02:00,7,17,8,2008,Violent
6170225,04/01/2008 07:48:53 AM,CRIMINAL TRESPASS,TO STATE SUP LAND,false,false,33,41.850424032,-87.627029017,2008-04-01T07:48:53.000+02:00,4,1,7,2008,Non-Violent
6265251,05/21/2008 03:30:00 PM,PROSTITUTION,SOLICIT ON PUBLIC WAY,true,false,56,41.80716827,-87.743142974,2008-05-21T15:30:00.000+02:00,5,21,15,2008,Non-Violent
6181752,04/06/2008 05:00:00 AM,THEFT,FROM BUILDING,false,false,6,41.944953005,-87.649416212,2008-04-06T05:00:00.000+02:00,4,6,5,2008,Non-Violent
6267830,05/21/2008 12:01:00 AM,NARCOTICS,POSS: CANNABIS 30GMS OR LESS,true,false,25,41.908616529,-87.75470014,2008-05-21T00:01:00.000+02:00,5,21,0,2008,Non-Violent
6274583,05/12/2008 03:40:00 PM,CRIMINAL DAMAGE,TO PROPERTY,false,false,53,,,2008-05-12T15:40:00.000+02:00,5,12,15,2008,Non-Violent
6332346,06/27/2008 09:58:51 PM,BATTERY,DOMESTIC BATTERY SIMPLE,true,true,41,41.798414583,-87.593449415,2008-06-27T21:58:51.000+02:00,6,27,21,2008,Violent
6288334,06/05/2008 05:00:00 PM,OTHER OFFENSE,TELEPHONE THREAT,false,false,25,41.911845725,-87.772801757,2008-06-05T17:00:00.000+02:00,6,5,17,2008,Non-Violent
6309607,06/16/2008 08:00:00 PM,CRIMINAL DAMAGE,TO VEHICLE,false,false,49,,,2008-06-16T20:00:00.000+02:00,6,16,20,2008,Non-Violent
6365444,07/14/2008 11:10:00 AM,ASSAULT,SIMPLE,false,true,51,41.71471058,-87.565812218,2008-07-14T11:10:00.000+02:00,7,14,11,2008,Violent
6378045,07/20/2008 07:00:00 AM,BURGLARY,FORCIBLE ENTRY,false,false,49,41.703509731,-87.624127578,2008-07-20T07:00:00.000+02:00,7,20,7,2008,Non-Violent
6254485,05/13/2008 11:30:00 AM,THEFT,$500 AND UNDER,false,false,24,41.898540671,-87.669177319,2008-05-13T11:30:00.000+02:00,5,13,11,2008,Non-Violent
6350102,07/07/2008 05:40:00 PM,THEFT,RETAIL THEFT,true,false,3,41.96137851,-87.65474101,2008-07-07T17:40:00.000+02:00,7,7,17,2008,Non-Violent
6293538,06/06/2008 01:55:00 AM,CRIMINAL DAMAGE,TO PROPERTY,false,false,63,41.795956618,-87.703628143,2008-06-06T01:55:00.000+02:00,6,6,1,2008,Non-Violent
6248485,05/14/2008 01:00:00 PM,THEFT,FROM BUILDING,false,false,53,41.67360896,-87.640568663,2008-05-14T13:00:00.000+02:00,5,14,13,2008,Non-Violent
6360349,07/10/2008 09:50:00 PM,THEFT,OVER $500,false,false,51,41.707382983,-87.562083333,2008-07-10T21:50:00.000+02:00,7,10,21,2008,Non-Violent
6232681,05/06/2008 01:10:00 PM,CRIMINAL DAMAGE,TO PROPERTY,false,false,42,41.774044549,-87.611880073,2008-05-06T13:10:00.000+02:00,5,6,13,2008,Non-Violent
6306864,06/15/2008 12:07:18 AM,CRIMINAL DAMAGE,TO PROPERTY,false,false,32,41.877578503,-87.629282088,2008-06-15T00:07:18.000+02:00,6,15,0,2008,Non-Violent
6263422,05/18/2008 11:49:00 AM,NARCOTICS,POSS: CANNABIS 30GMS OR LESS,true,false,23,41.892319584,-87.711339316,2008-05-18T11:49:00.000+02:00,5,18,11,2008,Non-Violent
6272963,05/27/2008 10:00:00 AM,OTHER OFFENSE,HARASSMENT BY TELEPHONE,false,true,1,42.015411281,-87.681666533,2008-05-27T10:00:00.000+02:00,5,27,10,2008,Non-Violent
6352265,07/07/2008 12:00:00 PM,CRIMINAL TRESPASS,TO RESIDENCE,false,false,39,41.805322323,-87.603808532,2008-07-07T12:00:00.000+02:00,7,7,12,2008,Non-Violent
6357359,07/09/2008 10:50:37 PM,NARCOTICS,POSS: CANNABIS 30GMS OR LESS,true,false,43,41.754172384,-87.552581097,2008-07-09T22:50:37.000+02:00,7,9,22,2008,Non-Violent
6249153,05/13/2008 09:00:00 PM,BURGLARY,FORCIBLE ENTRY,false,false,24,41.89109186,-87.656326515,2008-05-13T21:00:00.000+02:00,5,13,21,2008,Non-Violent
6376410,07/19/2008 08:45:00 AM,SEX OFFENSE,CRIMINAL SEXUAL ABUSE,false,false,32,41.8731127,-87.626452498,2008-07-19T08:45:00.000+02:00,7,19,8,2008,Non-Violent
6200838,04/14/2008 12:01:00 AM,THEFT,FINANCIAL ID THEFT: OVER $300,false,true,67,41.776829172,-87.673840482,2008-04-14T00:01:00.000+02:00,4,14,0,2008,Non-Violent
6287384,06/03/2008 09:00:00 PM,CRIMINAL DAMAGE,TO VEHICLE,false,false,8,41.897395617,-87.63618656,2008-06-03T21:00:00.000+02:00,6,3,21,2008,Non-Violent
6203557,04/21/2008 03:45:00 PM,CRIMINAL DAMAGE,TO VEHICLE,false,false,39,41.80895651,-87.604361519,2008-04-21T15:45:00.000+02:00,4,21,15,2008,Non-Violent
6286595,06/04/2008 02:13:10 AM,NARCOTICS,MANU/DELIVER:COCAINE,true,false,25,41.890799173,-87.750556555,2008-06-04T02:13:10.000+02:00,6,4,2,2008,Non-Violent
6250569,05/15/2008 12:59:16 PM,ROBBERY,ARMED: HANDGUN,false,false,38,41.804879235,-87.621099838,2008-05-15T12:59:16.000+02:00,5,15,12,2008,Violent
6254240,05/17/2008 10:45:00 AM,BATTERY,DOMESTIC BATTERY SIMPLE,true,true,49,41.706319443,-87.619617854,2008-05-17T10:45:00.000+02:00,5,17,10,2008,Violent
6367439,07/06/2008 11:00:00 AM,NARCOTICS,SOLICIT NARCOTICS ON PUBLICWAY,true,false,29,41.865425136,-87.705641621,2008-07-06T11:00:00.000+02:00,7,6,11,2008,Non-Violent
6283245,06/01/2008 12:10:00 AM,ASSAULT,SIMPLE,false,false,49,41.698889033,-87.629158341,2008-06-01T00:10:00.000+02:00,6,1,0,2008,Violent
6272009,05/27/2008 11:25:00 AM,CRIMINAL DAMAGE,TO VEHICLE,false,false,27,41.882880585,-87.698023476,2008-05-27T11:25:00.000+02:00,5,27,11,2008,Non-Violent
6279881,06/01/2008 04:30:00 PM,THEFT,OVER $500,false,false,22,41.918233765,-87.676417244,2008-06-01T16:30:00.000+02:00,6,1,16,2008,Non-Violent
6337666,06/27/2008 12:00:00 AM,ASSAULT,SIMPLE,false,false,71,41.747780077,-87.669436269,2008-06-27T00:00:00.000+02:00,6,27,0,2008,Violent
6166313,01/09/2008 12:00:00 PM,DECEPTIVE PRACTICE,CREDIT CARD FRAUD,false,false,25,41.906853097,-87.752203302,2008-01-09T12:00:00.000+02:00,1,9,12,2008,Non-Violent
6247573,05/12/2008 06:00:00 AM,CRIMINAL DAMAGE,TO PROPERTY,false,false,14,41.970254822,-87.710195582,2008-05-12T06:00:00.000+02:00,5,12,6,2008,Non-Violent
6185522,04/11/2008 07:00:00 PM,MOTOR VEHICLE THEFT,AUTOMOBILE,false,false,32,41.886169843,-87.620686081,2008-04-11T19:00:00.000+02:00,4,11,19,2008,Non-Violent
6267237,05/11/2008 05:00:00 PM,THEFT,FROM BUILDING,false,false,28,41.874964796,-87.689399714,2008-05-11T17:00:00.000+02:00,5,11,17,2008,Non-Violent
6283023,05/28/2008 07:50:00 PM,NARCOTICS,POSS: CANNABIS 30GMS OR LESS,true,false,44,41.751128044,-87.614247622,2008-05-28T19:50:00.000+02:00,5,28,19,2008,Non-Violent
6355630,07/09/2008 11:40:00 AM,OTHER OFFENSE,VIOLATE ORDER OF PROTECTION,false,true,44,41.748493191,-87.630606378,2008-07-09T11:40:00.000+02:00,7,9,11,2008,Non-Violent
6215818,04/12/2008 11:38:00 AM,NARCOTICS,POSS: CANNABIS 30GMS OR LESS,true,false,29,41.865369326,-87.733716227,2008-04-12T11:38:00.000+02:00,4,12,11,2008,Non-Violent
6281380,05/31/2008 06:48:00 PM,ASSAULT,SIMPLE,false,false,68,41.773784321,-87.648271865,2008-05-31T18:48:00.000+02:00,5,31,18,2008,Violent
6324618,06/23/2008 11:15:00 PM,NARCOTICS,POSS: CRACK,true,false,25,41.878085803,-87.74157658,2008-06-23T23:15:00.000+02:00,6,23,23,2008,Non-Violent
6243460,05/06/2008 09:52:02 PM,NARCOTICS,POSS: CANNABIS 30GMS OR LESS,true,false,23,41.895492647,-87.712994425,2008-05-06T21:52:02.000+02:00,5,6,21,2008,Non-Violent
6254933,05/11/2008 07:00:00 PM,MOTOR VEHICLE THEFT,AUTOMOBILE,false,false,69,41.764921343,-87.633429194,2008-05-11T19:00:00.000+02:00,5,11,19,2008,Non-Violent
6229557,04/29/2008 06:45:00 PM,BURGLARY,UNLAWFUL ENTRY,true,false,23,41.888526809,-87.720998262,2008-04-29T18:45:00.000+02:00,4,29,18,2008,Non-Violent
6326097,06/24/2008 07:50:00 AM,BURGLARY,UNLAWFUL ENTRY,false,false,69,41.771887841,-87.620280838,2008-06-24T07:50:00.000+02:00,6,24,7,2008,Non-Violent
6164632,04/01/2008 04:42:57 AM,ROBBERY,ARMED: HANDGUN,false,false,25,41.880334264,-87.757959152,2008-04-01T04:42:57.000+02:00,4,1,4,2008,Violent
6269005,05/25/2008 04:59:32 AM,ROBBERY,AGGRAVATED,false,false,26,41.88060406,-87.736089224,2008-05-25T04:59:32.000+02:00,5,25,4,2008,Violent
6323263,06/21/2008 01:35:44 AM,NARCOTICS,POSS: HEROIN(WHITE),true,false,42,41.776972433,-87.578939497,2008-06-21T01:35:44.000+02:00,6,21,1,2008,Non-Violent
6175557,04/07/2008 12:00:00 AM,THEFT,$500 AND UNDER,false,false,30,41.852481608,-87.702842788,2008-04-07T00:00:00.000+02:00,4,7,0,2008,Non-Violent
6320670,06/22/2008 08:00:00 AM,OTHER OFFENSE,HARASSMENT BY TELEPHONE,false,true,2,42.009438686,-87.696107071,2008-06-22T08:00:00.000+02:00,6,22,8,2008,Non-Violent
6332015,06/27/2008 10:22:00 PM,ROBBERY,STRONGARM - NO WEAPON,false,false,70,41.749958973,-87.688209882,2008-06-27T22:22:00.000+02:00,6,27,22,2008,Violent
6281475,06/01/2008 01:32:00 AM,CRIMINAL DAMAGE,TO VEHICLE,false,false,68,41.789922709,-87.636732559,2008-06-01T01:32:00.000+02:00,6,1,1,2008,Non-Violent
6288084,06/04/2008 08:35:58 PM,CRIMINAL DAMAGE,TO VEHICLE,false,true,67,41.773061957,-87.672529994,2008-06-04T20:35:58.000+02:00,6,4,20,2008,Non-Violent
6214351,04/26/2008 01:45:00 PM,NARCOTICS,POSS: CANNABIS 30GMS OR LESS,true,false,48,41.726322889,-87.559025114,2008-04-26T13:45:00.000+02:00,4,26,13,2008,Non-Violent
6165993,04/01/2008 02:40:00 AM,INTERFERENCE WITH PUBLIC OFFICER,RESIST/OBSTRUCT/DISARM OFFICER,true,false,67,41.791343182,-87.674223448,2008-04-01T02:40:00.000+02:00,4,1,2,2008,Non-Violent
6364668,06/30/2008 07:45:00 AM,PROSTITUTION,SOLICIT ON PUBLIC WAY,true,false,44,41.751330646,-87.601136601,2008-06-30T07:45:00.000+02:00,6,30,7,2008,Non-Violent
6259509,05/20/2008 09:00:00 AM,BURGLARY,UNLAWFUL ENTRY,false,false,22,41.928767567,-87.706626961,2008-05-20T09:00:00.000+02:00,5,20,9,2008,Non-Violent
6227858,05/03/2008 01:10:00 PM,THEFT,RETAIL THEFT,false,false,8,41.891990384,-87.611461502,2008-05-03T13:10:00.000+02:00,5,3,13,2008,Non-Violent
6324180,06/23/2008 03:46:35 AM,NARCOTICS,POSS: CRACK,true,false,43,41.7589416,-87.570500923,2008-06-23T03:46:35.000+02:00,6,23,3,2008,Non-Violent
6240288,05/09/2008 09:45:00 AM,THEFT,OVER $500,false,false,56,41.788080583,-87.790198651,2008-05-09T09:45:00.000+02:00,5,9,9,2008,Non-Violent
6373980,07/17/2008 02:00:00 PM,OTHER OFFENSE,TELEPHONE THREAT,false,false,24,41.89589617,-87.677939104,2008-07-17T14:00:00.000+02:00,7,17,14,2008,Non-Violent
6382250,07/21/2008 08:56:34 PM,BATTERY,DOMESTIC BATTERY SIMPLE,false,true,25,41.89761252,-87.762454228,2008-07-21T20:56:34.000+02:00,7,21,20,2008,Violent
6344935,07/05/2008 02:03:00 AM,BATTERY,AGGRAVATED: HANDGUN,false,false,19,41.926446662,-87.758695196,2008-07-05T02:03:00.000+02:00,7,5,2,2008,Violent
6248356,05/13/2008 09:30:00 PM,THEFT,OVER $500,false,false,6,41.945093874,-87.645893274,2008-05-13T21:30:00.000+02:00,5,13,21,2008,Non-Violent
6222072,04/30/2008 09:16:00 AM,OTHER OFFENSE,SEX OFFENDER: FAIL TO REGISTER,false,false,61,41.802650781,-87.655090736,2008-04-30T09:16:00.000+02:00,4,30,9,2008,Non-Violent
6201512,04/20/2008 06:29:00 PM,ASSAULT,AGGRAVATED:KNIFE/CUTTING INSTR,true,false,70,41.75274452,-87.708584067,2008-04-20T18:29:00.000+02:00,4,20,18,2008,Violent
6275693,05/26/2008 11:30:00 AM,OFFENSE INVOLVING CHILDREN,CHILD ABANDONMENT,false,true,43,41.76015578,-87.556752911,2008-05-26T11:30:00.000+02:00,5,26,11,2008,Non-Violent
6251506,05/12/2008 05:30:00 PM,ASSAULT,SIMPLE,false,false,48,41.728155001,-87.558863904,2008-05-12T17:30:00.000+02:00,5,12,17,2008,Violent
6201600,04/17/2008 02:05:00 PM,NARCOTICS,POSS: CANNABIS 30GMS OR LESS,true,false,27,41.881866774,-87.706799047,2008-04-17T14:05:00.000+02:00,4,17,14,2008,Non-Violent
6223756,03/14/2008 01:10:00 PM,SEX OFFENSE,OTHER,false,false,76,41.976290414,-87.905227221,2008-03-14T13:10:00.000+02:00,3,14,13,2008,Non-Violent
6202710,04/20/2008 07:30:00 PM,ASSAULT,SIMPLE,false,false,23,41.906187671,-87.72648318,2008-04-20T19:30:00.000+02:00,4,20,19,2008,Violent
6183641,04/09/2008 01:55:00 PM,BATTERY,SIMPLE,true,false,49,41.703779826,-87.623425161,2008-04-09T13:55:00.000+02:00,4,9,13,2008,Violent
6283910,06/03/2008 08:15:00 AM,ASSAULT,PRO EMP HANDS NO/MIN INJURY,false,false,35,41.830450306,-87.61932306,2008-06-03T08:15:00.000+02:00,6,3,8,2008,Violent
6180728,04/08/2008 07:30:00 PM,THEFT,RETAIL THEFT,true,false,15,41.953443342,-87.744957048,2008-04-08T19:30:00.000+02:00,4,8,19,2008,Non-Violent
6215121,04/26/2008 12:00:00 PM,CRIMINAL DAMAGE,TO PROPERTY,false,false,22,41.924837948,-87.694200981,2008-04-26T12:00:00.000+02:00,4,26,12,2008,Non-Violent
6219529,04/27/2008 12:00:00 AM,THEFT,$500 AND UNDER,false,false,44,41.747274836,-87.626152631,2008-04-27T00:00:00.000+02:00,4,27,0,2008,Non-Violent
6271238,05/25/2008 10:40:00 PM,ASSAULT,SIMPLE,false,false,77,41.990842666,-87.666394137,2008-05-25T22:40:00.000+02:00,5,25,22,2008,Violent
6252395,05/02/2008 05:00:00 PM,THEFT,FINANCIAL ID THEFT: OVER $300,false,false,19,41.937842161,-87.752443945,2008-05-02T17:00:00.000+02:00,5,2,17,2008,Non-Violent
6313360,06/18/2008 12:00:00 AM,THEFT,$500 AND UNDER,false,false,22,41.930915922,-87.70005707,2008-06-18T00:00:00.000+02:00,6,18,0,2008,Non-Violent
6276547,05/28/2008 02:30:00 PM,BATTERY,SIMPLE,true,false,53,41.668162322,-87.634368428,2008-05-28T14:30:00.000+02:00,5,28,14,2008,Violent
6368644,07/13/2008 05:40:00 PM,THEFT,RETAIL THEFT,false,false,56,41.804876524,-87.743090651,2008-07-13T17:40:00.000+02:00,7,13,17,2008,Non-Violent
6239461,05/09/2008 01:55:00 PM,OTHER OFFENSE,OTHER CRIME AGAINST PERSON,false,true,67,41.776824987,-87.672634348,2008-05-09T13:55:00.000+02:00,5,9,13,2008,Non-Violent
6269109,05/25/2008 10:10:00 AM,CRIMINAL DAMAGE,TO VEHICLE,false,true,46,41.747653209,-87.562524986,2008-05-25T10:10:00.000+02:00,5,25,10,2008,Non-Violent
6313307,06/05/2008 08:40:00 PM,PROSTITUTION,SOLICIT ON PUBLIC WAY,true,false,27,41.880966228,-87.706719713,2008-06-05T20:40:00.000+02:00,6,5,20,2008,Non-Violent
6365919,07/10/2008 06:40:00 PM,DECEPTIVE PRACTICE,COUNTERFEITING DOCUMENT,false,false,22,41.924673521,-87.711230943,2008-07-10T18:40:00.000+02:00,7,10,18,2008,Non-Violent
6182533,04/10/2008 04:00:00 AM,BURGLARY,ATTEMPT FORCIBLE ENTRY,false,false,1,42.016068877,-87.66714996,2008-04-10T04:00:00.000+02:00,4,10,4,2008,Non-Violent
6339838,07/01/2008 04:28:20 PM,NARCOTICS,POSS: CANNABIS 30GMS OR LESS,true,false,25,41.883477487,-87.75762248,2008-07-01T16:28:20.000+02:00,7,1,16,2008,Non-Violent
6281012,06/01/2008 01:45:00 PM,CRIMINAL DAMAGE,TO PROPERTY,false,false,40,41.786856524,-87.617405257,2008-06-01T13:45:00.000+02:00,6,1,13,2008,Non-Violent
6330197,06/26/2008 09:15:00 AM,BATTERY,DOMESTIC BATTERY SIMPLE,true,true,68,41.780620122,-87.65331375,2008-06-26T09:15:00.000+02:00,6,26,9,2008,Violent
6346932,07/05/2008 11:45:00 AM,BATTERY,AGGRAVATED: OTHER DANG WEAPON,false,false,27,41.879296357,-87.692055183,2008-07-05T11:45:00.000+02:00,7,5,11,2008,Violent
6293287,06/08/2008 07:00:00 PM,CRIMINAL DAMAGE,TO VEHICLE,false,false,66,41.7728946,-87.699322622,2008-06-08T19:00:00.000+02:00,6,8,19,2008,Non-Violent
6332390,06/28/2008 01:24:00 AM,CRIMINAL TRESPASS,TO STATE SUP LAND,false,false,6,41.93991842,-87.653288878,2008-06-28T01:24:00.000+02:00,6,28,1,2008,Non-Violent
6377113,07/19/2008 07:00:00 PM,THEFT,FROM BUILDING,false,false,4,41.967988684,-87.699274507,2008-07-19T19:00:00.000+02:00,7,19,19,2008,Non-Violent
6219433,04/27/2008 08:00:00 PM,ASSAULT,SIMPLE,false,false,71,41.752002423,-87.644076471,2008-04-27T20:00:00.000+02:00,4,27,20,2008,Violent
6304545,06/13/2008 02:00:00 PM,BURGLARY,UNLAWFUL ENTRY,false,false,29,41.854813778,-87.707778926,2008-06-13T14:00:00.000+02:00,6,13,14,2008,Non-Violent
6179518,04/08/2008 07:00:00 AM,CRIMINAL DAMAGE,TO PROPERTY,false,false,22,41.925667222,-87.707245258,2008-04-08T07:00:00.000+02:00,4,8,7,2008,Non-Violent
6372726,07/17/2008 12:00:00 PM,CRIMINAL DAMAGE,TO VEHICLE,false,false,27,41.873521544,-87.718483183,2008-07-17T12:00:00.000+02:00,7,17,12,2008,Non-Violent
6239693,05/09/2008 08:55:00 AM,BATTERY,PRO EMP HANDS NO/MIN INJURY,true,false,15,41.939898633,-87.754281422,2008-05-09T08:55:00.000+02:00,5,9,8,2008,Violent
6297711,06/11/2008 03:20:00 AM,BATTERY,DOMESTIC BATTERY SIMPLE,true,true,21,41.938476766,-87.69865911,2008-06-11T03:20:00.000+02:00,6,11,3,2008,Violent
6172545,04/04/2008 07:00:00 PM,MOTOR VEHICLE THEFT,AUTOMOBILE,false,false,23,41.904419476,-87.729956677,2008-04-04T19:00:00.000+02:00,4,4,19,2008,Non-Violent
6177315,04/07/2008 11:00:00 AM,BURGLARY,FORCIBLE ENTRY,false,false,46,41.731344886,-87.545687939,2008-04-07T11:00:00.000+02:00,4,7,11,2008,Non-Violent
6302051,06/11/2008 01:30:00 PM,BATTERY,SIMPLE,false,false,22,41.924910899,-87.68664515,2008-06-11T13:30:00.000+02:00,6,11,13,2008,Violent
6290219,06/04/2008 05:17:31 PM,DECEPTIVE PRACTICE,FRAUD OR CONFIDENCE GAME,false,false,7,41.91081797,-87.654560398,2008-06-04T17:17:31.000+02:00,6,4,17,2008,Non-Violent
6201095,04/20/2008 12:00:00 AM,THEFT,FROM BUILDING,false,false,8,41.899410159,-87.624131266,2008-04-20T00:00:00.000+02:00,4,20,0,2008,Non-Violent
6201968,04/20/2008 01:00:00 PM,BURGLARY,FORCIBLE ENTRY,false,false,43,41.762401133,-87.587481894,2008-04-20T13:00:00.000+02:00,4,20,13,2008,Non-Violent
6221880,04/28/2008 08:50:00 AM,CRIMINAL DAMAGE,CRIMINAL DEFACEMENT,false,false,58,41.810266932,-87.710468408,2008-04-28T08:50:00.000+02:00,4,28,8,2008,Non-Violent
6268407,05/24/2008 10:35:00 AM,ASSAULT,SIMPLE,false,false,67,41.782192322,-87.673979853,2008-05-24T10:35:00.000+02:00,5,24,10,2008,Violent
6318457,06/20/2008 04:30:00 PM,THEFT,RETAIL THEFT,true,false,77,41.991262667,-87.660305558,2008-06-20T16:30:00.000+02:00,6,20,16,2008,Non-Violent
6374213,07/18/2008 06:00:00 PM,CRIMINAL DAMAGE,TO VEHICLE,false,false,23,41.908453029,-87.711858691,2008-07-18T18:00:00.000+02:00,7,18,18,2008,Non-Violent
6350311,07/07/2008 10:16:00 PM,BATTERY,SIMPLE,false,false,58,41.823936708,-87.688190566,2008-07-07T22:16:00.000+02:00,7,7,22,2008,Violent
6329990,06/26/2008 09:05:00 AM,CRIMINAL DAMAGE,TO VEHICLE,false,false,25,41.873934027,-87.755644612,2008-06-26T09:05:00.000+02:00,6,26,9,2008,Non-Violent
6300587,06/11/2008 09:00:00 PM,BATTERY,SIMPLE,false,false,69,41.759580305,-87.610282811,2008-06-11T21:00:00.000+02:00,6,11,21,2008,Violent
6247425,05/07/2008 09:00:00 PM,NARCOTICS,POSS: CANNABIS 30GMS OR LESS,true,false,23,41.902678812,-87.725638467,2008-05-07T21:00:00.000+02:00,5,7,21,2008,Non-Violent
6287093,06/02/2008 02:30:00 PM,ASSAULT,SIMPLE,false,true,24,41.905481693,-87.69201729,2008-06-02T14:30:00.000+02:00,6,2,14,2008,Violent
6243771,05/12/2008 05:30:00 AM,BURGLARY,UNLAWFUL ENTRY,false,false,22,41.921674152,-87.699204121,2008-05-12T05:30:00.000+02:00,5,12,5,2008,Non-Violent
6304621,06/11/2008 06:00:00 PM,BURGLARY,FORCIBLE ENTRY,false,false,42,41.776090362,-87.603399348,2008-06-11T18:00:00.000+02:00,6,11,18,2008,Non-Violent
6367065,07/02/2008 01:30:00 PM,NARCOTICS,POSS: HEROIN(WHITE),true,false,29,41.852532436,-87.716243344,2008-07-02T13:30:00.000+02:00,7,2,13,2008,Non-Violent
6312450,06/17/2008 03:00:00 PM,THEFT,$500 AND UNDER,false,false,10,41.997372091,-87.786483907,2008-06-17T15:00:00.000+02:00,6,17,15,2008,Non-Violent
6164824,03/30/2008 07:00:00 PM,BURGLARY,FORCIBLE ENTRY,false,false,68,41.791795865,-87.651167764,2008-03-30T19:00:00.000+02:00,3,30,19,2008,Non-Violent
6258287,05/18/2008 08:55:00 AM,PROSTITUTION,SOLICIT ON PUBLIC WAY,true,false,23,41.905778334,-87.726398891,2008-05-18T08:55:00.000+02:00,5,18,8,2008,Non-Violent
6260095,05/21/2008 06:36:51 AM,ASSAULT,SIMPLE,false,false,37,41.801807599,-87.63257314,2008-05-21T06:36:51.000+02:00,5,21,6,2008,Violent
6210848,04/24/2008 07:50:00 PM,CRIMINAL DAMAGE,TO PROPERTY,false,false,66,41.762893122,-87.682413628,2008-04-24T19:50:00.000+02:00,4,24,19,2008,Non-Violent
6330219,06/24/2008 06:11:31 PM,CRIMINAL TRESPASS,TO VEHICLE,false,false,32,41.886816051,-87.625779962,2008-06-24T18:11:31.000+02:00,6,24,18,2008,Non-Violent
6246149,05/12/2008 09:00:00 PM,THEFT,$500 AND UNDER,false,false,66,41.780595495,-87.68367553,2008-05-12T21:00:00.000+02:00,5,12,21,2008,Non-Violent
6283362,05/17/2008 08:35:00 PM,PROSTITUTION,SOLICIT ON PUBLIC WAY,true,false,25,41.887173032,-87.769040166,2008-05-17T20:35:00.000+02:00,5,17,20,2008,Non-Violent
6186602,04/12/2008 02:30:00 PM,THEFT,OVER $500,false,false,24,41.899768544,-87.663713542,2008-04-12T14:30:00.000+02:00,4,12,14,2008,Non-Violent
6307633,05/16/2008 05:45:00 AM,BATTERY,DOMESTIC BATTERY SIMPLE,false,true,71,41.746846571,-87.654333547,2008-05-16T05:45:00.000+02:00,5,16,5,2008,Violent
6224368,05/01/2008 04:33:43 AM,BATTERY,AGGRAVATED DOMESTIC BATTERY: OTHER DANG WEAPON,true,true,40,41.801144558,-87.624251301,2008-05-01T04:33:43.000+02:00,5,1,4,2008,Violent
6182136,04/08/2008 08:20:00 PM,THEFT,RETAIL THEFT,true,false,31,41.852198325,-87.674377204,2008-04-08T20:20:00.000+02:00,4,8,20,2008,Non-Violent
6336338,06/30/2008 02:08:00 AM,CRIMINAL DAMAGE,TO PROPERTY,false,false,53,41.68253984,-87.642068999,2008-06-30T02:08:00.000+02:00,6,30,2,2008,Non-Violent
6197007,04/17/2008 09:39:40 PM,BURGLARY,FORCIBLE ENTRY,false,false,46,41.741870665,-87.555152171,2008-04-17T21:39:40.000+02:00,4,17,21,2008,Non-Violent
6312699,06/16/2008 10:47:00 PM,NARCOTICS,POSS: COCAINE,true,false,60,41.841768986,-87.640148666,2008-06-16T22:47:00.000+02:00,6,16,22,2008,Non-Violent
6353053,07/08/2008 07:27:38 PM,MOTOR VEHICLE THEFT,AUTOMOBILE,false,false,25,41.880186421,-87.768532463,2008-07-08T19:27:38.000+02:00,7,8,19,2008,Non-Violent
6236154,05/07/2008 03:00:00 PM,ROBBERY,ARMED: HANDGUN,false,false,19,41.93485174,-87.77190941,2008-05-07T15:00:00.000+02:00,5,7,15,2008,Violent
6281751,06/01/2008 04:11:01 PM,BATTERY,AGGRAVATED: OTHER DANG WEAPON,false,false,23,41.899939653,-87.728680162,2008-06-01T16:11:01.000+02:00,6,1,16,2008,Violent
6264340,05/22/2008 04:30:00 PM,THEFT,FROM BUILDING,false,false,6,41.937010053,-87.648295571,2008-05-22T16:30:00.000+02:00,5,22,16,2008,Non-Violent
6329811,06/23/2008 12:30:00 AM,BATTERY,AGGRAVATED DOMESTIC BATTERY: OTHER DANG WEAPON,false,true,67,41.771156016,-87.67467576,2008-06-23T00:30:00.000+02:00,6,23,0,2008,Violent
6311251,06/15/2008 03:05:00 PM,DECEPTIVE PRACTICE,CREDIT CARD FRAUD,false,false,25,41.909664252,-87.742728815,2008-06-15T15:05:00.000+02:00,6,15,15,2008,Non-Violent
6213011,04/25/2008 03:10:00 PM,NARCOTICS,SOLICIT NARCOTICS ON PUBLICWAY,true,false,77,41.982382511,-87.657978987,2008-04-25T15:10:00.000+02:00,4,25,15,2008,Non-Violent
6187308,04/12/2008 07:00:00 PM,THEFT,RETAIL THEFT,true,false,73,41.706911711,-87.643349776,2008-04-12T19:00:00.000+02:00,4,12,19,2008,Non-Violent
6262498,05/22/2008 12:00:00 AM,THEFT,$500 AND UNDER,false,false,22,41.925776957,-87.691336358,2008-05-22T00:00:00.000+02:00,5,22,0,2008,Non-Violent
6238066,05/08/2008 05:47:31 PM,CRIMINAL TRESPASS,TO STATE SUP LAND,false,false,33,41.851958307,-87.627067195,2008-05-08T17:47:31.000+02:00,5,8,17,2008,Non-Violent
6223514,04/29/2008 07:25:00 PM,NARCOTICS,POSS: CRACK,true,false,23,41.89437537,-87.711403847,2008-04-29T19:25:00.000+02:00,4,29,19,2008,Non-Violent
6362523,07/13/2008 09:00:00 PM,THEFT,$500 AND UNDER,false,false,9,42.010793282,-87.807486235,2008-07-13T21:00:00.000+02:00,7,13,21,2008,Non-Violent
6283054,04/02/2008 12:01:00 AM,THEFT,RETAIL THEFT,true,false,22,41.929494816,-87.683916158,2008-04-02T00:01:00.000+02:00,4,2,0,2008,Non-Violent
6258164,05/19/2008 07:40:00 PM,ASSAULT,SIMPLE,false,true,69,41.770475103,-87.618606538,2008-05-19T19:40:00.000+02:00,5,19,19,2008,Violent
6263685,05/21/2008 12:00:00 PM,MOTOR VEHICLE THEFT,"TRUCK, BUS, MOTOR HOME",false,false,25,41.90271047,-87.771742912,2008-05-21T12:00:00.000+02:00,5,21,12,2008,Non-Violent
6237198,05/06/2008 12:05:00 PM,NARCOTICS,POSS: HEROIN(WHITE),false,true,36,41.830065637,-87.610036858,2008-05-06T12:05:00.000+02:00,5,6,12,2008,Non-Violent
6212916,04/25/2008 09:20:00 PM,ROBBERY,ARMED: OTHER DANGEROUS WEAPON,false,false,25,41.884606524,-87.765015813,2008-04-25T21:20:00.000+02:00,4,25,21,2008,Violent
6174756,03/29/2008 11:32:02 PM,NARCOTICS,POSS: CANNABIS 30GMS OR LESS,true,false,40,41.78690669,-87.625500912,2008-03-29T23:32:02.000+02:00,3,29,23,2008,Non-Violent
6282806,06/01/2008 01:00:00 AM,BATTERY,DOMESTIC BATTERY SIMPLE,false,true,8,41.892734193,-87.634099676,2008-06-01T01:00:00.000+02:00,6,1,1,2008,Violent
6315321,06/17/2008 05:50:00 PM,ASSAULT,AGGRAVATED: OTHER DANG WEAPON,true,false,71,41.747947535,-87.660951114,2008-06-17T17:50:00.000+02:00,6,17,17,2008,Violent
6255445,05/17/2008 07:10:00 PM,NARCOTICS,MANU/DEL:CANNABIS OVER 10 GMS,true,false,14,41.970867608,-87.707321313,2008-05-17T19:10:00.000+02:00,5,17,19,2008,Non-Violent
6305367,06/08/2008 09:00:00 AM,THEFT,$500 AND UNDER,false,false,46,41.753029609,-87.55039605,2008-06-08T09:00:00.000+02:00,6,8,9,2008,Non-Violent
6266825,05/23/2008 07:15:00 PM,ASSAULT,SIMPLE,false,false,43,41.76587359,-87.576294705,2008-05-23T19:15:00.000+02:00,5,23,19,2008,Violent
6206316,04/22/2008 03:16:34 PM,ASSAULT,SIMPLE,false,false,25,41.868283502,-87.770546387,2008-04-22T15:16:34.000+02:00,4,22,15,2008,Violent
6259897,05/21/2008 05:18:35 AM,CRIMINAL DAMAGE,TO PROPERTY,false,true,43,41.758571453,-87.561511043,2008-05-21T05:18:35.000+02:00,5,21,5,2008,Non-Violent
6285712,06/01/2008 12:15:00 PM,NARCOTICS,POSS: HEROIN(WHITE),true,false,26,41.879662384,-87.733905767,2008-06-01T12:15:00.000+02:00,6,1,12,2008,Non-Violent
6362477,07/10/2008 08:10:00 PM,THEFT,$500 AND UNDER,false,true,25,41.909573262,-87.750161722,2008-07-10T20:10:00.000+02:00,7,10,20,2008,Non-Violent
6215298,04/27/2008 11:30:00 AM,THEFT,$500 AND UNDER,false,false,22,41.914284457,-87.670623352,2008-04-27T11:30:00.000+02:00,4,27,11,2008,Non-Violent
6224079,04/30/2008 06:00:00 PM,CRIMINAL DAMAGE,TO PROPERTY,false,false,28,41.883051873,-87.652720777,2008-04-30T18:00:00.000+02:00,4,30,18,2008,Non-Violent
6286132,06/03/2008 03:40:00 PM,BURGLARY,FORCIBLE ENTRY,true,false,68,41.773489197,-87.640701048,2008-06-03T15:40:00.000+02:00,6,3,15,2008,Non-Violent
6183540,04/10/2008 09:16:32 PM,ROBBERY,ATTEMPT: ARMED-HANDGUN,true,false,46,41.728226861,-87.552855036,2008-04-10T21:16:32.000+02:00,4,10,21,2008,Violent
6355804,07/07/2008 01:30:00 PM,BATTERY,SIMPLE,false,false,16,41.954614809,-87.708035521,2008-07-07T13:30:00.000+02:00,7,7,13,2008,Violent
6315507,06/14/2008 03:00:00 PM,OTHER OFFENSE,HARASSMENT BY TELEPHONE,false,false,23,41.905587011,-87.723954115,2008-06-14T15:00:00.000+02:00,6,14,15,2008,Non-Violent
6335100,06/28/2008 10:15:00 PM,CRIMINAL DAMAGE,TO PROPERTY,false,false,71,41.751480925,-87.656992959,2008-06-28T22:15:00.000+02:00,6,28,22,2008,Non-Violent
6227827,05/02/2008 07:50:00 AM,BURGLARY,FORCIBLE ENTRY,false,false,6,41.945300839,-87.660447333,2008-05-02T07:50:00.000+02:00,5,2,7,2008,Non-Violent
6359131,07/11/2008 04:00:00 AM,BURGLARY,FORCIBLE ENTRY,false,false,65,41.779835182,-87.732563214,2008-07-11T04:00:00.000+02:00,7,11,4,2008,Non-Violent
6321612,06/22/2008 03:36:00 PM,ROBBERY,STRONGARM - NO WEAPON,false,false,2,41.996366085,-87.68984012,2008-06-22T15:36:00.000+02:00,6,22,15,2008,Violent
6298017,06/03/2008 01:10:00 PM,THEFT,RETAIL THEFT,true,false,49,41.706987456,-87.620244029,2008-06-03T13:10:00.000+02:00,6,3,13,2008,Non-Violent
6310030,06/16/2008 01:05:00 PM,BATTERY,SIMPLE,true,false,68,41.786992554,-87.63279317,2008-06-16T13:05:00.000+02:00,6,16,13,2008,Violent
6325646,06/13/2008 09:30:00 AM,BURGLARY,UNLAWFUL ENTRY,false,false,49,41.6933984,-87.631078246,2008-06-13T09:30:00.000+02:00,6,13,9,2008,Non-Violent
6276888,05/22/2008 12:55:19 PM,DECEPTIVE PRACTICE,THEFT OF LABOR/SERVICES,false,false,32,41.885740288,-87.631590568,2008-05-22T12:55:19.000+02:00,5,22,12,2008,Non-Violent
6176383,04/06/2008 09:28:00 AM,ASSAULT,SIMPLE,true,true,19,41.934256017,-87.747691374,2008-04-06T09:28:00.000+02:00,4,6,9,2008,Violent
6245847,05/11/2008 01:56:00 AM,BATTERY,DOMESTIC BATTERY SIMPLE,true,true,25,41.911841785,-87.76308428,2008-05-11T01:56:00.000+02:00,5,11,1,2008,Violent
6308834,06/15/2008 01:45:00 PM,DECEPTIVE PRACTICE,COUNTERFEITING DOCUMENT,false,false,39,41.816455303,-87.598557379,2008-06-15T13:45:00.000+02:00,6,15,13,2008,Non-Violent
6298464,06/10/2008 05:15:00 AM,ROBBERY,ARMED:KNIFE/CUTTING INSTRUMENT,false,false,44,41.73660254,-87.60815174,2008-06-10T05:15:00.000+02:00,6,10,5,2008,Violent
6372035,07/15/2008 07:00:00 PM,CRIMINAL DAMAGE,TO PROPERTY,false,false,17,41.94752649,-87.782506304,2008-07-15T19:00:00.000+02:00,7,15,19,2008,Non-Violent
6170697,04/03/2008 01:00:00 PM,BURGLARY,FORCIBLE ENTRY,false,false,65,41.770524473,-87.718686918,2008-04-03T13:00:00.000+02:00,4,3,13,2008,Non-Violent
6377816,07/18/2008 03:01:33 PM,NARCOTICS,POSS: CRACK,true,false,36,41.830572232,-87.61029901,2008-07-18T15:01:33.000+02:00,7,18,15,2008,Non-Violent
6231612,05/05/2008 07:30:00 PM,THEFT,FROM BUILDING,false,false,24,41.911022492,-87.677475785,2008-05-05T19:30:00.000+02:00,5,5,19,2008,Non-Violent
6308840,06/16/2008 10:00:00 AM,THEFT,OVER $500,false,false,36,41.818819075,-87.602147578,2008-06-16T10:00:00.000+02:00,6,16,10,2008,Non-Violent
6380371,07/21/2008 09:30:00 PM,MOTOR VEHICLE THEFT,AUTOMOBILE,false,false,16,41.94110202,-87.728475212,2008-07-21T21:30:00.000+02:00,7,21,21,2008,Non-Violent
6292322,06/07/2008 11:00:00 AM,OTHER OFFENSE,VIOLATE ORDER OF PROTECTION,false,true,63,41.798364499,-87.696368746,2008-06-07T11:00:00.000+02:00,6,7,11,2008,Non-Violent
6353462,06/25/2008 02:00:00 PM,ASSAULT,SIMPLE,false,false,29,41.858099141,-87.723689347,2008-06-25T14:00:00.000+02:00,6,25,14,2008,Violent
6268636,05/22/2008 02:15:00 PM,OTHER OFFENSE,HARASSMENT BY TELEPHONE,false,true,66,41.765889422,-87.688167614,2008-05-22T14:15:00.000+02:00,5,22,14,2008,Non-Violent
6345319,07/05/2008 01:45:00 AM,ASSAULT,SIMPLE,true,false,63,41.796444913,-87.690219334,2008-07-05T01:45:00.000+02:00,7,5,1,2008,Violent
6309489,06/16/2008 03:00:00 AM,CRIMINAL DAMAGE,TO VEHICLE,false,false,67,41.773318536,-87.671335913,2008-06-16T03:00:00.000+02:00,6,16,3,2008,Non-Violent
6319435,06/20/2008 02:45:00 PM,THEFT,OVER $500,false,false,67,41.779307977,-87.674442028,2008-06-20T14:45:00.000+02:00,6,20,14,2008,Non-Violent
6343810,06/14/2008 09:40:00 AM,CRIMINAL DAMAGE,TO VEHICLE,false,false,27,41.883576472,-87.709830347,2008-06-14T09:40:00.000+02:00,6,14,9,2008,Non-Violent
6192834,04/07/2008 12:01:00 AM,THEFT,FROM BUILDING,false,false,68,41.793320428,-87.646351324,2008-04-07T00:01:00.000+02:00,4,7,0,2008,Non-Violent
6206335,04/20/2008 01:46:00 PM,BATTERY,AGGRAVATED:KNIFE/CUTTING INSTR,false,false,2,42.009780902,-87.694974036,2008-04-20T13:46:00.000+02:00,4,20,13,2008,Violent
6204763,04/04/2008 10:02:00 PM,PROSTITUTION,SOLICIT FOR BUSINESS,true,false,1,42.007407039,-87.673594671,2008-04-04T22:02:00.000+02:00,4,4,22,2008,Non-Violent
6295157,06/07/2008 11:00:00 AM,DECEPTIVE PRACTICE,BOGUS CHECK,false,false,71,41.755094007,-87.675701274,2008-06-07T11:00:00.000+02:00,6,7,11,2008,Non-Violent
6363712,05/23/2008 01:00:00 PM,THEFT,OVER $500,false,false,44,41.735752519,-87.625429032,2008-05-23T13:00:00.000+02:00,5,23,13,2008,Non-Violent
6195845,04/15/2008 11:10:00 PM,THEFT,$500 AND UNDER,true,false,61,41.801355133,-87.645341277,2008-04-15T23:10:00.000+02:00,4,15,23,2008,Non-Violent
6187248,04/11/2008 05:48:00 AM,BATTERY,DOMESTIC BATTERY SIMPLE,false,true,70,41.735876145,-87.715349858,2008-04-11T05:48:00.000+02:00,4,11,5,2008,Violent
6182054,04/09/2008 11:00:00 AM,ASSAULT,SIMPLE,false,false,61,41.813233446,-87.643233311,2008-04-09T11:00:00.000+02:00,4,9,11,2008,Violent
6193082,04/14/2008 12:20:00 PM,CRIMINAL DAMAGE,TO PROPERTY,false,false,29,41.862294538,-87.695786038,2008-04-14T12:20:00.000+02:00,4,14,12,2008,Non-Violent
6366827,07/15/2008 01:00:00 AM,MOTOR VEHICLE THEFT,"CYCLE, SCOOTER, BIKE W-VIN",false,false,16,41.959210472,-87.72110882,2008-07-15T01:00:00.000+02:00,7,15,1,2008,Non-Violent
6344626,06/23/2008 10:00:00 AM,THEFT,FINANCIAL ID THEFT:$300 &UNDER,false,false,73,41.727812975,-87.665264117,2008-06-23T10:00:00.000+02:00,6,23,10,2008,Non-Violent
6247731,05/11/2008 08:15:00 PM,BATTERY,SIMPLE,false,false,30,41.845274309,-87.695232034,2008-05-11T20:15:00.000+02:00,5,11,20,2008,Violent
6222820,04/29/2008 10:42:26 AM,NARCOTICS,POSS: CANNABIS 30GMS OR LESS,true,false,69,41.769185486,-87.625732415,2008-04-29T10:42:26.000+02:00,4,29,10,2008,Non-Violent
6355233,07/09/2008 08:50:00 PM,BATTERY,DOMESTIC BATTERY SIMPLE,true,true,66,41.783453178,-87.702045543,2008-07-09T20:50:00.000+02:00,7,9,20,2008,Violent
6265358,05/22/2008 07:45:00 AM,BURGLARY,UNLAWFUL ENTRY,false,false,61,41.797182226,-87.670745648,2008-05-22T07:45:00.000+02:00,5,22,7,2008,Non-Violent
6227420,05/02/2008 01:00:00 AM,THEFT,$500 AND UNDER,false,false,53,41.677310813,-87.62744621,2008-05-02T01:00:00.000+02:00,5,2,1,2008,Non-Violent
6370217,07/12/2008 10:10:00 PM,CRIMINAL DAMAGE,TO VEHICLE,false,false,70,41.748409085,-87.728697005,2008-07-12T22:10:00.000+02:00,7,12,22,2008,Non-Violent
6353067,07/07/2008 02:33:00 AM,CRIMINAL TRESPASS,TO LAND,false,false,49,41.692569761,-87.624397882,2008-07-07T02:33:00.000+02:00,7,7,2,2008,Non-Violent
6232606,05/05/2008 11:47:51 PM,BATTERY,DOMESTIC BATTERY SIMPLE,true,true,25,41.905120682,-87.765759648,2008-05-05T23:47:51.000+02:00,5,5,23,2008,Violent
6189041,04/14/2008 02:50:00 AM,THEFT,$500 AND UNDER,false,false,8,41.908545461,-87.649885786,2008-04-14T02:50:00.000+02:00,4,14,2,2008,Non-Violent
6344072,07/03/2008 10:45:00 AM,THEFT,$500 AND UNDER,false,false,61,41.817570192,-87.665183168,2008-07-03T10:45:00.000+02:00,7,3,10,2008,Non-Violent
6268832,05/25/2008 08:09:18 AM,BURGLARY,FORCIBLE ENTRY,false,false,25,41.887067499,-87.747957292,2008-05-25T08:09:18.000+02:00,5,25,8,2008,Non-Violent
6173516,04/04/2008 09:00:00 PM,MOTOR VEHICLE THEFT,"TRUCK, BUS, MOTOR HOME",false,false,40,41.782987402,-87.620546526,2008-04-04T21:00:00.000+02:00,4,4,21,2008,Non-Violent
6362126,07/13/2008 04:45:00 AM,NARCOTICS,MANU/DEL:CANNABIS OVER 10 GMS,true,false,46,41.751245796,-87.563797643,2008-07-13T04:45:00.000+02:00,7,13,4,2008,Non-Violent
6292399,06/06/2008 04:30:00 PM,BURGLARY,FORCIBLE ENTRY,false,false,69,41.756812796,-87.600125043,2008-06-06T16:30:00.000+02:00,6,6,16,2008,Non-Violent
6371720,07/17/2008 08:00:00 AM,OTHER OFFENSE,TELEPHONE THREAT,false,false,27,41.873618605,-87.711535352,2008-07-17T08:00:00.000+02:00,7,17,8,2008,Non-Violent
6184094,04/11/2008 04:38:57 AM,CRIMINAL DAMAGE,TO VEHICLE,false,false,24,41.891046874,-87.660344942,2008-04-11T04:38:57.000+02:00,4,11,4,2008,Non-Violent
6171554,04/03/2008 09:00:00 AM,CRIMINAL TRESPASS,TO STATE SUP LAND,false,false,57,41.803201891,-87.72198373,2008-04-03T09:00:00.000+02:00,4,3,9,2008,Non-Violent
6168627,04/01/2008 05:00:00 PM,CRIMINAL DAMAGE,TO PROPERTY,false,false,44,41.744818065,-87.606267424,2008-04-01T17:00:00.000+02:00,4,1,17,2008,Non-Violent
6181625,03/15/2008 08:00:00 AM,THEFT,FINANCIAL ID THEFT: OVER $300,false,false,19,41.91917974,-87.746179467,2008-03-15T08:00:00.000+02:00,3,15,8,2008,Non-Violent
6305502,06/14/2008 12:00:00 PM,CRIMINAL DAMAGE,TO PROPERTY,false,false,34,41.843483989,-87.634236146,2008-06-14T12:00:00.000+02:00,6,14,12,2008,Non-Violent
6282815,06/02/2008 01:35:00 PM,THEFT,FINANCIAL ID THEFT:$300 &UNDER,false,false,38,41.80950879,-87.608371773,2008-06-02T13:35:00.000+02:00,6,2,13,2008,Non-Violent
6255379,05/18/2008 10:55:35 AM,NARCOTICS,MANU/DEL:CANNABIS 10GM OR LESS,true,false,25,41.883412267,-87.74905562,2008-05-18T10:55:35.000+02:00,5,18,10,2008,Non-Violent
6356368,07/10/2008 12:00:00 AM,ASSAULT,SIMPLE,false,false,69,41.7646807,-87.623282046,2008-07-10T00:00:00.000+02:00,7,10,0,2008,Violent
6235377,05/07/2008 02:03:35 PM,BATTERY,AGGRAVATED:KNIFE/CUTTING INSTR,false,false,67,41.767606724,-87.671174697,2008-05-07T14:03:35.000+02:00,5,7,14,2008,Violent
6377630,07/17/2008 05:50:00 PM,BATTERY,AGGRAVATED DOMESTIC BATTERY: OTHER DANG WEAPON,false,true,67,41.773699618,-87.654343684,2008-07-17T17:50:00.000+02:00,7,17,17,2008,Violent
6338910,06/25/2008 03:30:00 PM,OTHER OFFENSE,OTHER VEHICLE OFFENSE,false,false,69,41.75762546,-87.611448263,2008-06-25T15:30:00.000+02:00,6,25,15,2008,Non-Violent
6383574,07/21/2008 07:31:00 AM,CRIMINAL TRESPASS,TO LAND,false,false,43,41.753638242,-87.559217307,2008-07-21T07:31:00.000+02:00,7,21,7,2008,Non-Violent
6278795,05/30/2008 10:00:00 PM,THEFT,OVER $500,false,false,17,41.951760551,-87.799884059,2008-05-30T22:00:00.000+02:00,5,30,22,2008,Non-Violent
6170918,04/03/2008 09:30:00 AM,THEFT,FROM BUILDING,false,false,12,41.974169276,-87.747965747,2008-04-03T09:30:00.000+02:00,4,3,9,2008,Non-Violent
6323589,06/19/2008 09:00:00 PM,CRIMINAL TRESPASS,TO LAND,true,false,56,41.791546962,-87.789109615,2008-06-19T21:00:00.000+02:00,6,19,21,2008,Non-Violent
6198803,04/18/2008 07:00:00 PM,BATTERY,SIMPLE,false,false,66,41.773025125,-87.698111564,2008-04-18T19:00:00.000+02:00,4,18,19,2008,Violent
6272322,05/05/2008 06:00:00 PM,THEFT,OVER $500,false,false,29,41.861066163,-87.696470034,2008-05-05T18:00:00.000+02:00,5,5,18,2008,Non-Violent
6299748,06/06/2008 01:00:00 PM,THEFT,RETAIL THEFT,true,false,44,41.736148121,-87.629070243,2008-06-06T13:00:00.000+02:00,6,6,13,2008,Non-Violent
6237975,05/08/2008 07:07:05 PM,NARCOTICS,POSS: CANNABIS 30GMS OR LESS,true,false,28,41.867229164,-87.686055646,2008-05-08T19:07:05.000+02:00,5,8,19,2008,Non-Violent
6254532,05/07/2008 03:30:00 PM,BATTERY,AGGRAVATED: OTHER DANG WEAPON,false,false,69,41.757289552,-87.638419662,2008-05-07T15:30:00.000+02:00,5,7,15,2008,Violent
6285019,06/02/2008 08:39:11 PM,NARCOTICS,FORFEIT PROPERTY,true,false,68,41.774197764,-87.634897415,2008-06-02T20:39:11.000+02:00,6,2,20,2008,Non-Violent
6241225,05/11/2008 02:00:00 AM,MOTOR VEHICLE THEFT,AUTOMOBILE,false,false,71,41.731077638,-87.667443099,2008-05-11T02:00:00.000+02:00,5,11,2,2008,Non-Violent
6264806,04/28/2008 12:00:00 PM,DECEPTIVE PRACTICE,FORGERY,false,false,63,41.790021483,-87.695310926,2008-04-28T12:00:00.000+02:00,4,28,12,2008,Non-Violent
6198488,04/15/2008 09:14:00 PM,GAMBLING,GAME/DICE,true,false,68,41.766086124,-87.650501797,2008-04-15T21:14:00.000+02:00,4,15,21,2008,Non-Violent
6217993,04/28/2008 08:17:00 AM,CRIMINAL TRESPASS,TO LAND,true,false,25,41.876650547,-87.755587101,2008-04-28T08:17:00.000+02:00,4,28,8,2008,Non-Violent
6272551,05/27/2008 03:00:00 PM,THEFT,FINANCIAL ID THEFT:$300 &UNDER,false,false,37,41.81691816,-87.633567673,2008-05-27T15:00:00.000+02:00,5,27,15,2008,Non-Violent
6268377,05/22/2008 12:07:03 PM,BATTERY,DOMESTIC BATTERY SIMPLE,false,true,27,41.875124065,-87.710819445,2008-05-22T12:07:03.000+02:00,5,22,12,2008,Violent
6280802,06/01/2008 08:04:00 PM,ASSAULT,SIMPLE,false,false,69,41.764707098,-87.624890909,2008-06-01T20:04:00.000+02:00,6,1,20,2008,Violent
6225686,04/29/2008 04:00:00 PM,MOTOR VEHICLE THEFT,THEFT/RECOVERY: AUTOMOBILE,true,false,67,41.78938508,-87.677811409,2008-04-29T16:00:00.000+02:00,4,29,16,2008,Non-Violent
6218490,04/28/2008 06:50:00 PM,CRIMINAL TRESPASS,TO LAND,true,false,42,41.781534778,-87.605955453,2008-04-28T18:50:00.000+02:00,4,28,18,2008,Non-Violent
6363248,07/09/2008 09:00:00 AM,CRIMINAL TRESPASS,TO RESIDENCE,true,false,29,41.857834021,-87.733272708,2008-07-09T09:00:00.000+02:00,7,9,9,2008,Non-Violent
6222558,04/29/2008 04:00:00 PM,THEFT,OVER $500,false,false,28,41.866730019,-87.677884637,2008-04-29T16:00:00.000+02:00,4,29,16,2008,Non-Violent
6309185,06/16/2008 12:00:00 PM,THEFT,FROM BUILDING,false,false,7,41.914409376,-87.656285892,2008-06-16T12:00:00.000+02:00,6,16,12,2008,Non-Violent
6269855,05/25/2008 03:58:00 PM,BATTERY,DOMESTIC BATTERY SIMPLE,false,true,76,41.976545678,-87.841539813,2008-05-25T15:58:00.000+02:00,5,25,15,2008,Violent
6332324,06/25/2008 10:30:00 PM,BATTERY,DOMESTIC BATTERY SIMPLE,true,true,69,41.764281833,-87.628476756,2008-06-25T22:30:00.000+02:00,6,25,22,2008,Violent
6344395,07/03/2008 04:30:00 PM,CRIMINAL DAMAGE,TO PROPERTY,false,false,46,41.728321653,-87.545032483,2008-07-03T16:30:00.000+02:00,7,3,16,2008,Non-Violent
6285420,05/28/2008 08:40:00 AM,BATTERY,SIMPLE,false,true,49,41.72169846,-87.625359863,2008-05-28T08:40:00.000+02:00,5,28,8,2008,Violent
6289459,06/03/2008 04:15:00 PM,OTHER OFFENSE,OTHER WEAPONS VIOLATION,false,false,76,41.976290414,-87.905227221,2008-06-03T16:15:00.000+02:00,6,3,16,2008,Non-Violent
6186519,04/10/2008 01:00:00 AM,BATTERY,AGGRAVATED DOMESTIC BATTERY: OTHER DANG WEAPON,false,true,43,41.756934413,-87.587046748,2008-04-10T01:00:00.000+02:00,4,10,1,2008,Violent
6375196,07/18/2008 12:00:00 PM,CRIMINAL DAMAGE,TO VEHICLE,false,false,58,41.814552814,-87.699308126,2008-07-18T12:00:00.000+02:00,7,18,12,2008,Non-Violent
6368127,07/16/2008 02:11:00 AM,BATTERY,DOMESTIC BATTERY SIMPLE,true,true,32,41.868277934,-87.627441974,2008-07-16T02:11:00.000+02:00,7,16,2,2008,Violent
6322798,06/23/2008 05:00:00 AM,THEFT,$500 AND UNDER,false,false,41,41.799028507,-87.589078086,2008-06-23T05:00:00.000+02:00,6,23,5,2008,Non-Violent
6224828,04/28/2008 04:00:00 PM,BATTERY,DOMESTIC BATTERY SIMPLE,false,true,66,41.769318222,-87.682051753,2008-04-28T16:00:00.000+02:00,4,28,16,2008,Violent
6174018,04/05/2008 02:00:00 PM,CRIMINAL DAMAGE,TO VEHICLE,false,false,42,41.781992383,-87.587867199,2008-04-05T14:00:00.000+02:00,4,5,14,2008,Non-Violent
6310703,06/16/2008 08:15:00 PM,CRIMINAL TRESPASS,TO LAND,true,false,42,41.781740631,-87.605960459,2008-06-16T20:15:00.000+02:00,6,16,20,2008,Non-Violent
6288984,06/01/2008 11:50:00 AM,THEFT,PURSE-SNATCHING,false,false,66,41.779249554,-87.683942092,2008-06-01T11:50:00.000+02:00,6,1,11,2008,Non-Violent
6194350,04/16/2008 01:30:00 PM,OTHER OFFENSE,TELEPHONE THREAT,false,false,67,,,2008-04-16T13:30:00.000+02:00,4,16,13,2008,Non-Violent
6214513,04/26/2008 03:00:00 PM,BURGLARY,FORCIBLE ENTRY,false,false,30,41.847120563,-87.723400878,2008-04-26T15:00:00.000+02:00,4,26,15,2008,Non-Violent
6170757,04/03/2008 01:12:00 PM,BURGLARY,ATTEMPT FORCIBLE ENTRY,false,false,75,41.685900265,-87.671672683,2008-04-03T13:12:00.000+02:00,4,3,13,2008,Non-Violent
6203910,04/20/2008 05:24:35 PM,BATTERY,AGGRAVATED: OTHER DANG WEAPON,true,false,25,41.902474874,-87.755780468,2008-04-20T17:24:35.000+02:00,4,20,17,2008,Violent
6226776,05/02/2008 05:30:00 PM,ASSAULT,SIMPLE,false,true,23,41.903527064,-87.729854876,2008-05-02T17:30:00.000+02:00,5,2,17,2008,Violent
6324677,06/24/2008 05:30:00 AM,THEFT,$500 AND UNDER,false,false,7,41.918578314,-87.636183854,2008-06-24T05:30:00.000+02:00,6,24,5,2008,Non-Violent
6232464,05/05/2008 07:57:00 PM,CRIMINAL TRESPASS,TO VEHICLE,false,false,43,41.760227976,-87.572464917,2008-05-05T19:57:00.000+02:00,5,5,19,2008,Non-Violent
6273012,05/25/2008 10:25:00 PM,BATTERY,AGGRAVATED DOMESTIC BATTERY: KNIFE/CUTTING INST,true,true,25,41.908487519,-87.754693958,2008-05-25T22:25:00.000+02:00,5,25,22,2008,Violent
6366077,07/12/2008 06:44:00 PM,BATTERY,AGGRAVATED: OTHER DANG WEAPON,false,false,68,41.773429489,-87.645837753,2008-07-12T18:44:00.000+02:00,7,12,18,2008,Violent
6195838,04/15/2008 05:25:00 PM,DECEPTIVE PRACTICE,FRAUD OR CONFIDENCE GAME,false,false,1,42.019399237,-87.675049485,2008-04-15T17:25:00.000+02:00,4,15,17,2008,Non-Violent
6324725,06/20/2008 05:25:00 PM,CRIMINAL DAMAGE,TO VEHICLE,false,true,26,41.883680016,-87.739196724,2008-06-20T17:25:00.000+02:00,6,20,17,2008,Non-Violent
6315995,06/19/2008 02:10:00 PM,THEFT,$500 AND UNDER,false,false,24,41.896063478,-87.667902742,2008-06-19T14:10:00.000+02:00,6,19,14,2008,Non-Violent
6370378,07/13/2008 04:26:47 AM,BATTERY,DOMESTIC BATTERY SIMPLE,false,true,29,41.865389461,-87.734945909,2008-07-13T04:26:47.000+02:00,7,13,4,2008,Violent
6370356,07/13/2008 03:04:26 AM,BATTERY,DOMESTIC BATTERY SIMPLE,false,true,29,41.859740848,-87.731092704,2008-07-13T03:04:26.000+02:00,7,13,3,2008,Violent
6170831,04/03/2008 01:38:00 PM,BURGLARY,ATTEMPT FORCIBLE ENTRY,true,false,75,41.684516413,-87.682603808,2008-04-03T13:38:00.000+02:00,4,3,13,2008,Non-Violent
6273993,05/24/2008 12:10:00 PM,OTHER OFFENSE,TELEPHONE THREAT,false,false,71,41.751722452,-87.656997753,2008-05-24T12:10:00.000+02:00,5,24,12,2008,Non-Violent
6184511,04/10/2008 01:49:52 PM,OTHER OFFENSE,FALSE/STOLEN/ALTERED TRP,false,false,23,41.90163014,-87.725049658,2008-04-10T13:49:52.000+02:00,4,10,13,2008,Non-Violent
6341220,07/02/2008 09:00:00 AM,THEFT,FROM BUILDING,false,false,42,41.779388822,-87.601646099,2008-07-02T09:00:00.000+02:00,7,2,9,2008,Non-Violent
6239316,05/09/2008 11:30:00 AM,THEFT,RETAIL THEFT,false,false,62,41.785930664,-87.723266186,2008-05-09T11:30:00.000+02:00,5,9,11,2008,Non-Violent
6356136,06/10/2008 12:15:00 PM,GAMBLING,ILLEGAL ILL LOTTERY,false,false,38,41.808833439,-87.622824022,2008-06-10T12:15:00.000+02:00,6,10,12,2008,Non-Violent
6215117,04/26/2008 06:35:00 PM,CRIMINAL DAMAGE,TO PROPERTY,false,false,53,41.66324995,-87.635724425,2008-04-26T18:35:00.000+02:00,4,26,18,2008,Non-Violent
6181011,04/08/2008 10:53:00 PM,NARCOTICS,POSS: CANNABIS 30GMS OR LESS,true,false,42,41.781335054,-87.615651789,2008-04-08T22:53:00.000+02:00,4,8,22,2008,Non-Violent
6187240,04/11/2008 08:56:35 PM,NARCOTICS,POSS: CANNABIS 30GMS OR LESS,true,false,51,41.714908914,-87.561008109,2008-04-11T20:56:35.000+02:00,4,11,20,2008,Non-Violent
6171827,04/02/2008 08:45:00 AM,THEFT,OVER $500,false,false,44,41.748398214,-87.633029696,2008-04-02T08:45:00.000+02:00,4,2,8,2008,Non-Violent
6212878,04/05/2008 09:00:00 AM,DECEPTIVE PRACTICE,FORGERY,false,true,15,,,2008-04-05T09:00:00.000+02:00,4,5,9,2008,Non-Violent
6329983,06/26/2008 08:00:00 PM,THEFT,$500 AND UNDER,false,false,5,41.945090283,-87.673818497,2008-06-26T20:00:00.000+02:00,6,26,20,2008,Non-Violent
6343759,07/03/2008 08:30:23 AM,BURGLARY,FORCIBLE ENTRY,false,false,43,41.758085678,-87.561505869,2008-07-03T08:30:23.000+02:00,7,3,8,2008,Non-Violent
6186530,04/11/2008 04:43:00 PM,ROBBERY,ARMED: HANDGUN,false,false,39,41.807128737,-87.606513299,2008-04-11T16:43:00.000+02:00,4,11,16,2008,Violent
6231849,05/04/2008 01:30:00 PM,CRIMINAL DAMAGE,TO PROPERTY,false,false,44,41.744941034,-87.617988366,2008-05-04T13:30:00.000+02:00,5,4,13,2008,Non-Violent
6346958,07/05/2008 09:00:00 AM,THEFT,FROM BUILDING,false,true,71,41.744136151,-87.653566945,2008-07-05T09:00:00.000+02:00,7,5,9,2008,Non-Violent
6253405,05/16/2008 10:00:00 PM,BURGLARY,UNLAWFUL ENTRY,false,false,22,41.929074043,-87.717112131,2008-05-16T22:00:00.000+02:00,5,16,22,2008,Non-Violent
6374087,07/17/2008 03:00:00 PM,MOTOR VEHICLE THEFT,AUTOMOBILE,false,false,22,41.91482839,-87.690516553,2008-07-17T15:00:00.000+02:00,7,17,15,2008,Non-Violent
6216149,04/26/2008 04:30:00 PM,THEFT,OVER $500,false,false,24,41.900541125,-87.662081888,2008-04-26T16:30:00.000+02:00,4,26,16,2008,Non-Violent
6362547,07/05/2008 10:00:00 PM,OTHER OFFENSE,HARASSMENT BY TELEPHONE,false,false,25,41.904078436,-87.754329689,2008-07-05T22:00:00.000+02:00,7,5,22,2008,Non-Violent
6344094,07/03/2008 08:01:28 PM,ASSAULT,SIMPLE,false,false,2,41.995366855,-87.684902319,2008-07-03T20:01:28.000+02:00,7,3,20,2008,Violent
6270015,05/26/2008 07:20:00 PM,OTHER OFFENSE,TELEPHONE THREAT,false,false,22,41.927146651,-87.688945037,2008-05-26T19:20:00.000+02:00,5,26,19,2008,Non-Violent
6208570,04/22/2008 04:00:00 PM,CRIMINAL DAMAGE,TO PROPERTY,false,false,64,41.773807091,-87.79419408,2008-04-22T16:00:00.000+02:00,4,22,16,2008,Non-Violent
6190920,04/09/2008 03:40:00 PM,CRIMINAL TRESPASS,TO LAND,false,false,73,41.715126542,-87.660187176,2008-04-09T15:40:00.000+02:00,4,9,15,2008,Non-Violent
6184472,04/09/2008 05:00:00 AM,MOTOR VEHICLE THEFT,AUTOMOBILE,false,false,71,41.748038694,-87.657311261,2008-04-09T05:00:00.000+02:00,4,9,5,2008,Non-Violent
6277135,05/28/2008 07:40:00 PM,BATTERY,SIMPLE,false,false,59,41.823031539,-87.681463683,2008-05-28T19:40:00.000+02:00,5,28,19,2008,Violent
6191534,04/15/2008 12:00:00 AM,OTHER OFFENSE,TELEPHONE THREAT,false,false,71,41.736869889,-87.669167598,2008-04-15T00:00:00.000+02:00,4,15,0,2008,Non-Violent
6306261,06/14/2008 02:47:39 AM,NARCOTICS,POSS: CRACK,true,false,25,41.878930532,-87.745218784,2008-06-14T02:47:39.000+02:00,6,14,2,2008,Non-Violent
6199113,04/18/2008 10:29:03 AM,PUBLIC PEACE VIOLATION,BOMB THREAT,false,false,25,41.880186421,-87.768532463,2008-04-18T10:29:03.000+02:00,4,18,10,2008,Non-Violent
6272807,05/27/2008 04:39:15 PM,ASSAULT,AGGRAVATED: OTHER DANG WEAPON,false,true,40,41.786549104,-87.622256111,2008-05-27T16:39:15.000+02:00,5,27,16,2008,Violent
6354515,07/09/2008 12:00:00 PM,THEFT,$500 AND UNDER,false,false,33,41.863967977,-87.618770371,2008-07-09T12:00:00.000+02:00,7,9,12,2008,Non-Violent
6243122,05/10/2008 06:15:00 PM,THEFT,RETAIL THEFT,false,false,32,41.882394062,-87.627844798,2008-05-10T18:15:00.000+02:00,5,10,18,2008,Non-Violent
6285618,06/02/2008 08:45:00 PM,BATTERY,AGGRAVATED:KNIFE/CUTTING INSTR,true,false,26,41.877904548,-87.731517054,2008-06-02T20:45:00.000+02:00,6,2,20,2008,Violent
6169249,04/02/2008 12:15:00 PM,ASSAULT,SIMPLE,true,false,27,41.873732481,-87.702226415,2008-04-02T12:15:00.000+02:00,4,2,12,2008,Violent
6330815,06/23/2008 02:00:00 PM,BATTERY,AGGRAVATED: OTHER DANG WEAPON,false,false,49,41.699486967,-87.618437414,2008-06-23T14:00:00.000+02:00,6,23,14,2008,Violent
6319769,06/22/2008 01:02:59 AM,INTERFERENCE WITH PUBLIC OFFICER,OBSTRUCTING JUSTICE,true,false,46,41.73964142,-87.567274171,2008-06-22T01:02:59.000+02:00,6,22,1,2008,Non-Violent
6344688,07/05/2008 12:00:00 AM,THEFT,POCKET-PICKING,false,false,7,41.916927579,-87.63684848,2008-07-05T00:00:00.000+02:00,7,5,0,2008,Non-Violent
6251270,05/12/2008 07:45:00 AM,CRIMINAL TRESPASS,TO LAND,true,false,34,41.830954079,-87.630703226,2008-05-12T07:45:00.000+02:00,5,12,7,2008,Non-Violent
6185687,04/11/2008 11:13:22 AM,THEFT,RETAIL THEFT,false,false,48,41.734547924,-87.585594973,2008-04-11T11:13:22.000+02:00,4,11,11,2008,Non-Violent
6336998,06/29/2008 10:00:00 PM,BURGLARY,FORCIBLE ENTRY,false,false,57,41.807831884,-87.726715402,2008-06-29T22:00:00.000+02:00,6,29,22,2008,Non-Violent
6322273,06/21/2008 07:00:00 PM,OTHER OFFENSE,VIOLATE ORDER OF PROTECTION,true,true,15,41.94133105,-87.765254857,2008-06-21T19:00:00.000+02:00,6,21,19,2008,Non-Violent
6171686,03/30/2008 09:00:00 AM,BATTERY,DOMESTIC BATTERY SIMPLE,false,true,44,41.748203504,-87.636663391,2008-03-30T09:00:00.000+02:00,3,30,9,2008,Violent
6192378,04/15/2008 04:30:00 AM,BURGLARY,FORCIBLE ENTRY,false,false,22,41.922352875,-87.705359563,2008-04-15T04:30:00.000+02:00,4,15,4,2008,Non-Violent
6293197,06/08/2008 09:00:00 AM,CRIMINAL DAMAGE,TO VEHICLE,false,false,7,41.917315704,-87.655388056,2008-06-08T09:00:00.000+02:00,6,8,9,2008,Non-Violent
6297740,06/09/2008 02:50:00 PM,BATTERY,SIMPLE,false,false,66,41.782831495,-87.688929105,2008-06-09T14:50:00.000+02:00,6,9,14,2008,Violent
6199824,01/04/2008 11:00:00 PM,THEFT,OVER $500,false,false,14,41.969269226,-87.746569143,2008-01-04T23:00:00.000+02:00,1,4,23,2008,Non-Violent
6243035,05/06/2008 12:00:00 AM,THEFT,OVER $500,false,false,23,41.893990113,-87.702155577,2008-05-06T00:00:00.000+02:00,5,6,0,2008,Non-Violent
6172451,04/04/2008 10:00:00 AM,CRIMINAL TRESPASS,TO LAND,true,false,72,41.705282379,-87.665786718,2008-04-04T10:00:00.000+02:00,4,4,10,2008,Non-Violent
6351143,07/05/2008 11:15:00 AM,BATTERY,SIMPLE,false,false,30,41.841606959,-87.711052675,2008-07-05T11:15:00.000+02:00,7,5,11,2008,Violent
6250880,05/16/2008 04:20:00 AM,BATTERY,SIMPLE,false,false,72,41.699953887,-87.666903758,2008-05-16T04:20:00.000+02:00,5,16,4,2008,Violent
6247632,05/06/2008 10:00:00 PM,DECEPTIVE PRACTICE,ILLEGAL USE CASH CARD,false,false,39,41.810453067,-87.593347577,2008-05-06T22:00:00.000+02:00,5,6,22,2008,Non-Violent
6317274,06/08/2008 08:00:00 PM,NARCOTICS,POSS: CANNABIS 30GMS OR LESS,true,false,23,41.901562503,-87.726269844,2008-06-08T20:00:00.000+02:00,6,8,20,2008,Non-Violent
6186815,04/12/2008 09:00:00 PM,CRIMINAL DAMAGE,TO PROPERTY,false,false,23,41.913078836,-87.710160526,2008-04-12T21:00:00.000+02:00,4,12,21,2008,Non-Violent
6254176,05/16/2008 05:10:00 PM,ASSAULT,SIMPLE,false,false,17,41.945835818,-87.807027883,2008-05-16T17:10:00.000+02:00,5,16,17,2008,Violent
6233522,05/06/2008 07:30:00 PM,ASSAULT,SIMPLE,false,false,26,41.877018518,-87.731062705,2008-05-06T19:30:00.000+02:00,5,6,19,2008,Violent
6321009,06/22/2008 11:55:00 AM,THEFT,RETAIL THEFT,true,false,61,41.809860998,-87.645565723,2008-06-22T11:55:00.000+02:00,6,22,11,2008,Non-Violent
6296400,06/05/2008 11:45:00 AM,NARCOTICS,POSS: CRACK,true,false,15,41.95913142,-87.76719982,2008-06-05T11:45:00.000+02:00,6,5,11,2008,Non-Violent
6291109,06/06/2008 03:15:00 PM,ASSAULT,SIMPLE,false,false,61,41.813947066,-87.643251329,2008-06-06T15:15:00.000+02:00,6,6,15,2008,Violent
6383977,07/12/2008 03:11:00 AM,NARCOTICS,POSS: COCAINE,true,false,30,41.843798704,-87.733051547,2008-07-12T03:11:00.000+02:00,7,12,3,2008,Non-Violent
6178552,04/05/2008 02:15:00 PM,BATTERY,SIMPLE,false,false,56,41.788492935,-87.7414552,2008-04-05T14:15:00.000+02:00,4,5,14,2008,Violent
6230461,05/05/2008 10:30:00 PM,MOTOR VEHICLE THEFT,AUTOMOBILE,false,false,28,41.863369043,-87.65998548,2008-05-05T22:30:00.000+02:00,5,5,22,2008,Non-Violent
6325657,06/24/2008 05:30:00 PM,CRIMINAL DAMAGE,TO VEHICLE,false,false,75,41.684806175,-87.67421728,2008-06-24T17:30:00.000+02:00,6,24,17,2008,Non-Violent
6307657,06/15/2008 04:00:00 PM,THEFT,$500 AND UNDER,false,false,25,41.909588772,-87.748894125,2008-06-15T16:00:00.000+02:00,6,15,16,2008,Non-Violent
6346815,07/05/2008 01:13:00 AM,BATTERY,DOMESTIC BATTERY SIMPLE,false,true,70,41.745450959,-87.704708211,2008-07-05T01:13:00.000+02:00,7,5,1,2008,Violent
6322984,06/24/2008 12:15:00 AM,THEFT,FROM BUILDING,false,true,66,41.777236649,-87.69250102,2008-06-24T00:15:00.000+02:00,6,24,0,2008,Non-Violent
6183530,04/09/2008 09:30:00 PM,ROBBERY,ARMED: HANDGUN,false,false,56,41.814553782,-87.746483073,2008-04-09T21:30:00.000+02:00,4,9,21,2008,Violent
6351401,07/07/2008 12:00:00 PM,CRIMINAL DAMAGE,TO PROPERTY,false,false,43,41.754773883,-87.577275421,2008-07-07T12:00:00.000+02:00,7,7,12,2008,Non-Violent
6298009,06/10/2008 03:09:00 AM,WEAPONS VIOLATION,UNLAWFUL POSS OF HANDGUN,true,false,54,41.657321574,-87.605967939,2008-06-10T03:09:00.000+02:00,6,10,3,2008,Non-Violent
6315684,06/19/2008 03:30:00 PM,CRIMINAL DAMAGE,TO PROPERTY,false,false,56,41.791485326,-87.775685114,2008-06-19T15:30:00.000+02:00,6,19,15,2008,Non-Violent
6290000,06/03/2008 08:27:00 PM,NARCOTICS,POSS: CANNABIS 30GMS OR LESS,true,false,27,41.885421196,-87.704402968,2008-06-03T20:27:00.000+02:00,6,3,20,2008,Non-Violent
6380103,07/20/2008 12:45:00 AM,BATTERY,SIMPLE,false,false,43,41.765755571,-87.576292427,2008-07-20T00:45:00.000+02:00,7,20,0,2008,Violent
6183929,04/10/2008 04:30:00 PM,CRIMINAL DAMAGE,TO PROPERTY,true,true,66,41.758743529,-87.686751137,2008-04-10T16:30:00.000+02:00,4,10,16,2008,Non-Violent
6309801,06/16/2008 09:20:00 AM,BATTERY,DOMESTIC BATTERY SIMPLE,false,true,66,41.773286383,-87.685919559,2008-06-16T09:20:00.000+02:00,6,16,9,2008,Violent
6285787,05/14/2008 02:00:00 PM,DECEPTIVE PRACTICE,CREDIT CARD FRAUD,false,false,8,41.891990384,-87.611461502,2008-05-14T14:00:00.000+02:00,5,14,14,2008,Non-Violent
6378369,06/27/2008 11:59:00 PM,NARCOTICS,POSS: CRACK,true,false,71,41.756060839,-87.654610265,2008-06-27T23:59:00.000+02:00,6,27,23,2008,Non-Violent
6268024,05/24/2008 05:30:00 PM,ROBBERY,STRONGARM - NO WEAPON,false,false,17,41.948452638,-87.834425808,2008-05-24T17:30:00.000+02:00,5,24,17,2008,Violent
6302812,06/10/2008 01:50:00 AM,CRIMINAL DAMAGE,TO VEHICLE,false,false,69,41.756540452,-87.617427096,2008-06-10T01:50:00.000+02:00,6,10,1,2008,Non-Violent
6376541,06/24/2008 07:00:00 PM,NARCOTICS,POSS: CANNABIS 30GMS OR LESS,true,false,43,41.769278449,-87.58286403,2008-06-24T19:00:00.000+02:00,6,24,19,2008,Non-Violent
6242206,05/14/2008 02:00:00 PM,THEFT,$500 AND UNDER,false,false,59,41.830174487,-87.678019189,2008-05-14T14:00:00.000+02:00,5,14,14,2008,Non-Violent
6250984,05/13/2008 04:00:00 AM,THEFT,$500 AND UNDER,false,false,7,41.920710478,-87.655881239,2008-05-13T04:00:00.000+02:00,5,13,4,2008,Non-Violent
6255656,05/18/2008 06:00:00 PM,CRIMINAL DAMAGE,TO VEHICLE,false,false,16,41.959763593,-87.726567051,2008-05-18T18:00:00.000+02:00,5,18,18,2008,Non-Violent
6173936,04/05/2008 01:30:00 PM,THEFT,OVER $500,false,false,25,41.875251082,-87.761639849,2008-04-05T13:30:00.000+02:00,4,5,13,2008,Non-Violent
6339657,06/26/2008 08:00:00 PM,BURGLARY,UNLAWFUL ENTRY,false,false,17,41.949646286,-87.826884189,2008-06-26T20:00:00.000+02:00,6,26,20,2008,Non-Violent
6322377,06/20/2008 03:20:00 PM,PROSTITUTION,SOLICIT ON PUBLIC WAY,true,false,40,41.792490517,-87.619165105,2008-06-20T15:20:00.000+02:00,6,20,15,2008,Non-Violent
6369322,07/08/2008 06:15:00 AM,PROSTITUTION,SOLICIT ON PUBLIC WAY,true,false,23,41.909031467,-87.720427618,2008-07-08T06:15:00.000+02:00,7,8,6,2008,Non-Violent
6328574,06/25/2008 07:25:00 AM,THEFT,RETAIL THEFT,true,false,43,41.757614433,-87.586115266,2008-06-25T07:25:00.000+02:00,6,25,7,2008,Non-Violent
6327625,06/25/2008 08:25:00 PM,ASSAULT,SIMPLE,false,true,53,41.668760704,-87.63755352,2008-06-25T20:25:00.000+02:00,6,25,20,2008,Violent
6211216,04/24/2008 06:20:00 PM,BATTERY,SIMPLE,false,false,51,41.72182671,-87.575339397,2008-04-24T18:20:00.000+02:00,4,24,18,2008,Violent
6204789,04/04/2008 11:15:00 PM,PROSTITUTION,SOLICIT FOR BUSINESS,true,false,1,42.007407039,-87.673594671,2008-04-04T23:15:00.000+02:00,4,4,23,2008,Non-Violent
6179421,04/07/2008 09:00:00 AM,BATTERY,DOMESTIC BATTERY SIMPLE,false,true,18,41.934768224,-87.799272259,2008-04-07T09:00:00.000+02:00,4,7,9,2008,Violent
6214289,04/21/2008 01:00:00 PM,ASSAULT,SIMPLE,false,false,38,41.815874475,-87.626256876,2008-04-21T13:00:00.000+02:00,4,21,13,2008,Violent
6222779,04/28/2008 09:55:00 AM,THEFT,FROM BUILDING,false,false,27,41.87448398,-87.718334431,2008-04-28T09:55:00.000+02:00,4,28,9,2008,Non-Violent
6383407,07/22/2008 10:05:51 AM,ASSAULT,SIMPLE,false,false,27,41.883609157,-87.707263095,2008-07-22T10:05:51.000+02:00,7,22,10,2008,Violent
6187560,04/12/2008 11:44:00 AM,BATTERY,DOMESTIC BATTERY SIMPLE,false,true,23,41.900079859,-87.718904349,2008-04-12T11:44:00.000+02:00,4,12,11,2008,Violent
6365660,07/12/2008 04:00:00 AM,CRIM SEXUAL ASSAULT,AGGRAVATED: KNIFE/CUT INSTR,true,false,67,41.784115858,-87.669178889,2008-07-12T04:00:00.000+02:00,7,12,4,2008,Non-Violent
6195896,04/15/2008 05:00:00 PM,THEFT,FINANCIAL ID THEFT: OVER $300,false,false,28,41.860295708,-87.659088972,2008-04-15T17:00:00.000+02:00,4,15,17,2008,Non-Violent
6166765,04/02/2008 01:20:00 AM,NARCOTICS,POSS: CANNABIS 30GMS OR LESS,true,false,46,41.731157122,-87.544320053,2008-04-02T01:20:00.000+02:00,4,2,1,2008,Non-Violent
6281317,06/02/2008 01:30:00 AM,ROBBERY,ARMED:KNIFE/CUTTING INSTRUMENT,false,false,66,41.785784322,-87.692357239,2008-06-02T01:30:00.000+02:00,6,2,1,2008,Violent
6304214,06/13/2008 12:00:00 PM,THEFT,$500 AND UNDER,false,false,28,41.886161557,-87.64131791,2008-06-13T12:00:00.000+02:00,6,13,12,2008,Non-Violent
6288094,05/30/2008 09:30:00 PM,PROSTITUTION,SOLICIT ON PUBLIC WAY,false,false,8,41.89537651,-87.632686147,2008-05-30T21:30:00.000+02:00,5,30,21,2008,Non-Violent
6298751,06/10/2008 09:00:00 AM,THEFT,OVER $500,false,false,38,41.814369195,-87.616728441,2008-06-10T09:00:00.000+02:00,6,10,9,2008,Non-Violent
6239212,04/11/2008 07:48:00 PM,DECEPTIVE PRACTICE,THEFT OF LOST/MISLAID PROP,false,false,3,41.964104403,-87.662363735,2008-04-11T19:48:00.000+02:00,4,11,19,2008,Non-Violent
6361749,07/08/2008 11:30:00 PM,BATTERY,AGG: HANDS/FIST/FEET SERIOUS INJURY,false,false,59,41.829886017,-87.667939116,2008-07-08T23:30:00.000+02:00,7,8,23,2008,Violent
6364113,07/01/2008 12:00:00 PM,OTHER OFFENSE,OTHER VEHICLE OFFENSE,false,false,69,41.751720359,-87.637347322,2008-07-01T12:00:00.000+02:00,7,1,12,2008,Non-Violent
6190271,04/14/2008 09:00:00 PM,THEFT,OVER $500,false,false,21,41.941700486,-87.718699737,2008-04-14T21:00:00.000+02:00,4,14,21,2008,Non-Violent
6163768,03/30/2008 01:50:00 PM,BATTERY,SIMPLE,false,false,16,41.960340936,-87.72884848,2008-03-30T13:50:00.000+02:00,3,30,13,2008,Violent
6213182,04/25/2008 08:30:00 AM,THEFT,FROM BUILDING,false,false,61,41.813125577,-87.666318836,2008-04-25T08:30:00.000+02:00,4,25,8,2008,Non-Violent
6239527,04/26/2008 09:30:00 PM,ASSAULT,SIMPLE,false,false,46,41.734544705,-87.55413415,2008-04-26T21:30:00.000+02:00,4,26,21,2008,Violent
6181021,04/09/2008 12:00:00 AM,THEFT,$500 AND UNDER,false,false,27,41.886406836,-87.706997072,2008-04-09T00:00:00.000+02:00,4,9,0,2008,Non-Violent
6240895,05/10/2008 11:00:00 PM,BURGLARY,FORCIBLE ENTRY,false,false,44,41.736736273,-87.598532484,2008-05-10T23:00:00.000+02:00,5,10,23,2008,Non-Violent
6202091,04/16/2008 08:23:29 PM,NARCOTICS,POSS: CRACK,true,false,33,41.850517353,-87.627031661,2008-04-16T20:23:29.000+02:00,4,16,20,2008,Non-Violent
6212400,04/09/2008 11:50:00 PM,PROSTITUTION,SOLICIT ON PUBLIC WAY,true,false,38,41.814324761,-87.619729627,2008-04-09T23:50:00.000+02:00,4,9,23,2008,Non-Violent
6325716,06/24/2008 02:21:11 PM,BATTERY,DOMESTIC BATTERY SIMPLE,false,true,46,41.749188459,-87.577157733,2008-06-24T14:21:11.000+02:00,6,24,14,2008,Violent
6325513,06/20/2008 09:00:00 PM,THEFT,OVER $500,false,false,56,41.787747225,-87.785302588,2008-06-20T21:00:00.000+02:00,6,20,21,2008,Non-Violent
6249122,05/13/2008 11:00:00 AM,BURGLARY,UNLAWFUL ENTRY,false,false,51,,,2008-05-13T11:00:00.000+02:00,5,13,11,2008,Non-Violent
6221698,04/28/2008 11:00:00 AM,THEFT,FROM BUILDING,false,false,24,41.909699143,-87.676405564,2008-04-28T11:00:00.000+02:00,4,28,11,2008,Non-Violent
6256335,05/19/2008 06:00:00 AM,THEFT,FROM BUILDING,false,false,31,41.854812268,-87.66606573,2008-05-19T06:00:00.000+02:00,5,19,6,2008,Non-Violent
6277906,05/26/2008 07:30:00 PM,BATTERY,SIMPLE,false,false,71,41.750306372,-87.659797776,2008-05-26T19:30:00.000+02:00,5,26,19,2008,Violent
6181456,04/02/2008 10:51:10 AM,NARCOTICS,POSS: CANNABIS 30GMS OR LESS,true,false,30,41.845412192,-87.712377413,2008-04-02T10:51:10.000+02:00,4,2,10,2008,Non-Violent
6328032,06/22/2008 08:00:00 PM,BATTERY,DOMESTIC BATTERY SIMPLE,false,true,30,41.849400719,-87.701511347,2008-06-22T20:00:00.000+02:00,6,22,20,2008,Violent
6379311,07/20/2008 01:00:00 AM,BATTERY,DOMESTIC BATTERY SIMPLE,false,true,39,41.806747062,-87.604313209,2008-07-20T01:00:00.000+02:00,7,20,1,2008,Violent
6175076,04/06/2008 11:45:00 AM,OTHER OFFENSE,VIOLATE ORDER OF PROTECTION,false,true,2,41.998973423,-87.677298169,2008-04-06T11:45:00.000+02:00,4,6,11,2008,Non-Violent
6338300,06/30/2008 05:30:00 PM,CRIMINAL DAMAGE,TO PROPERTY,false,false,46,41.741741208,-87.564867492,2008-06-30T17:30:00.000+02:00,6,30,17,2008,Non-Violent
6341458,05/30/2008 12:00:00 AM,OTHER OFFENSE,HARASSMENT BY TELEPHONE,false,false,45,41.746871961,-87.582971131,2008-05-30T00:00:00.000+02:00,5,30,0,2008,Non-Violent
6193364,04/15/2008 01:41:20 PM,CRIMINAL DAMAGE,TO PROPERTY,false,false,27,41.872899368,-87.694491036,2008-04-15T13:41:20.000+02:00,4,15,13,2008,Non-Violent
6354059,07/07/2008 06:56:59 PM,NARCOTICS,POSS: CRACK,true,false,25,41.882299672,-87.760809526,2008-07-07T18:56:59.000+02:00,7,7,18,2008,Non-Violent
6213105,04/25/2008 07:00:00 PM,THEFT,$500 AND UNDER,false,false,73,41.712606862,-87.653130114,2008-04-25T19:00:00.000+02:00,4,25,19,2008,Non-Violent
6334614,06/28/2008 10:00:00 PM,THEFT,OVER $500,false,false,56,41.799044642,-87.769813982,2008-06-28T22:00:00.000+02:00,6,28,22,2008,Non-Violent
6237843,05/08/2008 09:25:41 PM,CRIMINAL DAMAGE,TO PROPERTY,false,false,54,41.654211215,-87.611466157,2008-05-08T21:25:41.000+02:00,5,8,21,2008,Non-Violent
6316638,06/19/2008 10:35:00 PM,BATTERY,DOMESTIC BATTERY SIMPLE,false,true,46,41.7367597,-87.554184318,2008-06-19T22:35:00.000+02:00,6,19,22,2008,Violent
6171740,04/03/2008 02:25:00 PM,ASSAULT,SIMPLE,false,false,10,41.992223478,-87.799200543,2008-04-03T14:25:00.000+02:00,4,3,14,2008,Violent
6222784,04/30/2008 07:51:38 AM,THEFT,OVER $500,false,false,38,41.804806747,-87.61387144,2008-04-30T07:51:38.000+02:00,4,30,7,2008,Non-Violent
6173217,03/04/2008 02:00:00 PM,THEFT,$500 AND UNDER,false,false,33,41.850657231,-87.612880723,2008-03-04T14:00:00.000+02:00,3,4,14,2008,Non-Violent
6196074,04/15/2008 03:21:12 PM,NARCOTICS,POSS: CANNABIS 30GMS OR LESS,true,false,68,41.785925632,-87.653448356,2008-04-15T15:21:12.000+02:00,4,15,15,2008,Non-Violent
6165362,03/30/2008 10:26:00 PM,CRIMINAL DAMAGE,TO VEHICLE,true,true,71,41.746111568,-87.67182069,2008-03-30T22:26:00.000+02:00,3,30,22,2008,Non-Violent
6312980,05/24/2008 07:10:00 PM,NARCOTICS,POSS: COCAINE,true,false,66,41.772908027,-87.701760362,2008-05-24T19:10:00.000+02:00,5,24,19,2008,Non-Violent
6362196,07/13/2008 12:00:00 PM,OTHER OFFENSE,HARASSMENT BY TELEPHONE,false,false,30,41.8377256,-87.723148817,2008-07-13T12:00:00.000+02:00,7,13,12,2008,Non-Violent
6299846,06/01/2008 12:01:00 AM,THEFT,FROM BUILDING,false,true,66,41.779202789,-87.687817874,2008-06-01T00:01:00.000+02:00,6,1,0,2008,Non-Violent
6174902,04/05/2008 04:25:00 PM,CRIMINAL DAMAGE,TO VEHICLE,false,true,50,41.719852575,-87.597138803,2008-04-05T16:25:00.000+02:00,4,5,16,2008,Non-Violent
6361709,07/12/2008 01:50:00 AM,CRIMINAL DAMAGE,TO VEHICLE,false,false,58,41.809115903,-87.709745951,2008-07-12T01:50:00.000+02:00,7,12,1,2008,Non-Violent
6241394,05/11/2008 03:30:00 AM,CRIMINAL DAMAGE,TO PROPERTY,false,false,69,41.76781115,-87.594860548,2008-05-11T03:30:00.000+02:00,5,11,3,2008,Non-Violent
6304204,06/11/2008 01:30:00 AM,THEFT,OVER $500,false,false,69,41.765587727,-87.621292649,2008-06-11T01:30:00.000+02:00,6,11,1,2008,Non-Violent
6187452,04/11/2008 04:30:00 PM,BURGLARY,FORCIBLE ENTRY,false,false,26,41.871442365,-87.725365328,2008-04-11T16:30:00.000+02:00,4,11,16,2008,Non-Violent
6354615,07/07/2008 10:22:00 PM,CRIMINAL DAMAGE,TO PROPERTY,false,false,25,41.912843356,-87.780464288,2008-07-07T22:22:00.000+02:00,7,7,22,2008,Non-Violent
6374681,07/19/2008 12:33:43 AM,ASSAULT,SIMPLE,true,true,25,41.874973714,-87.745295451,2008-07-19T00:33:43.000+02:00,7,19,0,2008,Violent
6229320,05/04/2008 11:00:00 PM,BURGLARY,FORCIBLE ENTRY,false,false,29,41.862868089,-87.713838517,2008-05-04T23:00:00.000+02:00,5,4,23,2008,Non-Violent
6373660,07/17/2008 01:15:00 AM,BATTERY,DOMESTIC BATTERY SIMPLE,true,true,44,41.750727662,-87.599105879,2008-07-17T01:15:00.000+02:00,7,17,1,2008,Violent
6230501,05/06/2008 12:00:00 AM,CRIMINAL DAMAGE,TO VEHICLE,false,false,19,41.927828776,-87.752501722,2008-05-06T00:00:00.000+02:00,5,6,0,2008,Non-Violent
6362317,07/13/2008 12:30:00 AM,CRIMINAL DAMAGE,TO VEHICLE,false,false,24,41.909851453,-87.673773564,2008-07-13T00:30:00.000+02:00,7,13,0,2008,Non-Violent
6232088,05/04/2008 06:45:57 PM,BATTERY,SIMPLE,true,false,23,41.901374131,-87.727494842,2008-05-04T18:45:57.000+02:00,5,4,18,2008,Violent
6171048,03/16/2008 10:56:00 PM,DECEPTIVE PRACTICE,"THEFT BY LESSEE,MOTOR VEH",false,false,56,41.793065099,-87.738831483,2008-03-16T22:56:00.000+02:00,3,16,22,2008,Non-Violent
6201167,04/16/2008 01:19:49 PM,NARCOTICS,POSS: CANNABIS 30GMS OR LESS,true,false,69,41.765253769,-87.615255549,2008-04-16T13:19:49.000+02:00,4,16,13,2008,Non-Violent
6183380,04/10/2008 05:48:00 AM,CRIMINAL TRESPASS,TO LAND,false,false,43,41.769257286,-87.581306331,2008-04-10T05:48:00.000+02:00,4,10,5,2008,Non-Violent
6185255,04/10/2008 04:30:00 PM,MOTOR VEHICLE THEFT,AUTOMOBILE,false,false,67,41.759030974,-87.66363196,2008-04-10T16:30:00.000+02:00,4,10,16,2008,Non-Violent
6248952,05/14/2008 01:30:00 PM,THEFT,RETAIL THEFT,false,false,32,41.86821682,-87.6304532,2008-05-14T13:30:00.000+02:00,5,14,13,2008,Non-Violent
6352230,07/08/2008 12:15:00 AM,ROBBERY,AGGRAVATED,false,false,39,41.804379361,-87.584779905,2008-07-08T00:15:00.000+02:00,7,8,0,2008,Violent
6244392,05/05/2008 12:30:00 PM,DECEPTIVE PRACTICE,FRAUD OR CONFIDENCE GAME,false,false,7,41.921000188,-87.636425726,2008-05-05T12:30:00.000+02:00,5,5,12,2008,Non-Violent
6361623,07/12/2008 01:15:00 PM,BATTERY,SIMPLE,true,false,51,41.709210604,-87.564526242,2008-07-12T13:15:00.000+02:00,7,12,13,2008,Violent
6264637,05/20/2008 05:45:00 PM,ROBBERY,STRONGARM - NO WEAPON,false,false,43,41.772381955,-87.59042,2008-05-20T17:45:00.000+02:00,5,20,17,2008,Violent
6170386,04/02/2008 04:40:00 PM,THEFT,RETAIL THEFT,false,false,56,41.795656147,-87.762729156,2008-04-02T16:40:00.000+02:00,4,2,16,2008,Non-Violent
6216753,04/25/2008 11:56:39 AM,NARCOTICS,POSS: CANNABIS 30GMS OR LESS,true,false,67,41.76939171,-87.667582216,2008-04-25T11:56:39.000+02:00,4,25,11,2008,Non-Violent
6220872,04/29/2008 02:22:32 PM,OTHER OFFENSE,OTHER WEAPONS VIOLATION,false,false,2,42.003611477,-87.697357279,2008-04-29T14:22:32.000+02:00,4,29,14,2008,Non-Violent
6270231,05/25/2008 06:15:00 PM,ROBBERY,ARMED:KNIFE/CUTTING INSTRUMENT,false,false,40,41.790752055,-87.625601621,2008-05-25T18:15:00.000+02:00,5,25,18,2008,Violent
6190879,04/14/2008 10:12:00 AM,BATTERY,DOMESTIC BATTERY SIMPLE,false,true,67,41.782337119,-87.658274723,2008-04-14T10:12:00.000+02:00,4,14,10,2008,Violent
6323086,06/11/2008 02:40:00 PM,NARCOTICS,POSS: CANNABIS 30GMS OR LESS,true,false,30,41.841906601,-87.708620292,2008-06-11T14:40:00.000+02:00,6,11,14,2008,Non-Violent
6358030,07/09/2008 02:30:06 PM,BATTERY,SIMPLE,false,false,61,41.805969146,-87.661250741,2008-07-09T14:30:06.000+02:00,7,9,14,2008,Violent
6307259,06/12/2008 08:22:00 PM,NARCOTICS,POSS: HEROIN(WHITE),true,false,15,41.940127372,-87.746902545,2008-06-12T20:22:00.000+02:00,6,12,20,2008,Non-Violent
6241015,05/10/2008 12:00:00 PM,THEFT,RETAIL THEFT,false,false,32,41.884650262,-87.627915459,2008-05-10T12:00:00.000+02:00,5,10,12,2008,Non-Violent
6185336,04/11/2008 02:30:00 PM,THEFT,POCKET-PICKING,false,false,63,41.796882513,-87.693885964,2008-04-11T14:30:00.000+02:00,4,11,14,2008,Non-Violent
6182736,04/09/2008 01:00:00 PM,THEFT,RETAIL THEFT,false,false,61,41.810676762,-87.675199089,2008-04-09T13:00:00.000+02:00,4,9,13,2008,Non-Violent
6202306,04/18/2008 12:47:26 PM,NARCOTICS,POSS: CRACK,true,false,67,41.791505709,-87.659663678,2008-04-18T12:47:26.000+02:00,4,18,12,2008,Non-Violent
6328887,06/25/2008 07:02:52 AM,PROSTITUTION,SOLICIT ON PUBLIC WAY,true,false,25,41.90954372,-87.752454432,2008-06-25T07:02:52.000+02:00,6,25,7,2008,Non-Violent
6364047,07/13/2008 03:55:00 AM,BATTERY,SIMPLE,true,true,13,41.991129115,-87.717668989,2008-07-13T03:55:00.000+02:00,7,13,3,2008,Violent
6297411,06/10/2008 12:00:00 AM,THEFT,$500 AND UNDER,false,false,73,41.726028568,-87.643335763,2008-06-10T00:00:00.000+02:00,6,10,0,2008,Non-Violent
6241779,04/12/2008 11:00:00 PM,BURGLARY,FORCIBLE ENTRY,false,false,6,41.933800775,-87.646701815,2008-04-12T23:00:00.000+02:00,4,12,23,2008,Non-Violent
6216842,04/24/2008 11:00:00 PM,CRIMINAL DAMAGE,TO PROPERTY,false,false,55,41.652658477,-87.544726255,2008-04-24T23:00:00.000+02:00,4,24,23,2008,Non-Violent
6291277,06/04/2008 11:56:30 AM,GAMBLING,GAME/DICE,true,false,25,41.875646819,-87.763409822,2008-06-04T11:56:30.000+02:00,6,4,11,2008,Non-Violent
6242391,05/10/2008 08:40:00 AM,OTHER OFFENSE,VIOLATE ORDER OF PROTECTION,true,true,61,41.800707586,-87.661118679,2008-05-10T08:40:00.000+02:00,5,10,8,2008,Non-Violent
6302879,06/12/2008 03:30:00 PM,BURGLARY,UNLAWFUL ENTRY,false,false,45,41.741546263,-87.592428089,2008-06-12T15:30:00.000+02:00,6,12,15,2008,Non-Violent
6355717,07/09/2008 05:43:00 PM,NARCOTICS,POSS: HEROIN(WHITE),true,false,61,41.794614135,-87.645167671,2008-07-09T17:43:00.000+02:00,7,9,17,2008,Non-Violent
6308836,06/16/2008 12:15:00 PM,THEFT,FROM BUILDING,false,false,32,41.87870641,-87.63693686,2008-06-16T12:15:00.000+02:00,6,16,12,2008,Non-Violent
6289726,06/06/2008 01:28:23 AM,ASSAULT,SIMPLE,false,true,25,41.883436397,-87.752731361,2008-06-06T01:28:23.000+02:00,6,6,1,2008,Violent
6257316,05/19/2008 02:45:00 PM,BATTERY,AGGRAVATED: OTHER DANG WEAPON,false,false,68,41.784797052,-87.647333315,2008-05-19T14:45:00.000+02:00,5,19,14,2008,Violent
6250443,05/15/2008 05:00:00 PM,THEFT,$500 AND UNDER,false,false,63,41.792783389,-87.705984148,2008-05-15T17:00:00.000+02:00,5,15,17,2008,Non-Violent
6254239,05/17/2008 06:30:00 PM,BATTERY,SIMPLE,false,false,15,41.957855843,-87.757913093,2008-05-17T18:30:00.000+02:00,5,17,18,2008,Violent
6280209,05/29/2008 04:40:00 PM,CRIMINAL TRESPASS,TO LAND,false,false,8,41.902672756,-87.641628208,2008-05-29T16:40:00.000+02:00,5,29,16,2008,Non-Violent
6332944,06/27/2008 04:12:00 PM,OTHER OFFENSE,TELEPHONE THREAT,false,false,18,41.922836995,-87.792382774,2008-06-27T16:12:00.000+02:00,6,27,16,2008,Non-Violent
6360155,07/09/2008 08:05:20 PM,DECEPTIVE PRACTICE,THEFT OF LOST/MISLAID PROP,true,false,77,41.990039704,-87.659064106,2008-07-09T20:05:20.000+02:00,7,9,20,2008,Non-Violent
6284257,06/03/2008 01:00:00 AM,CRIMINAL DAMAGE,TO VEHICLE,false,false,49,41.708501922,-87.625951474,2008-06-03T01:00:00.000+02:00,6,3,1,2008,Non-Violent
6214460,04/26/2008 03:30:00 AM,CRIMINAL DAMAGE,TO VEHICLE,false,false,9,41.998956892,-87.807337207,2008-04-26T03:30:00.000+02:00,4,26,3,2008,Non-Violent
6270830,05/26/2008 11:42:01 AM,BATTERY,DOMESTIC BATTERY SIMPLE,false,true,68,41.775049383,-87.651953822,2008-05-26T11:42:01.000+02:00,5,26,11,2008,Violent
6252242,01/01/2008 12:01:00 AM,THEFT,FINANCIAL ID THEFT: OVER $300,false,false,69,41.759469891,-87.611489901,2008-01-01T00:01:00.000+02:00,1,1,0,2008,Non-Violent
6174305,04/06/2008 01:46:00 AM,BATTERY,DOMESTIC BATTERY SIMPLE,false,true,61,41.80079763,-87.658689815,2008-04-06T01:46:00.000+02:00,4,6,1,2008,Violent
6337934,06/29/2008 01:30:00 AM,THEFT,$500 AND UNDER,false,false,68,41.77060805,-87.647623816,2008-06-29T01:30:00.000+02:00,6,29,1,2008,Non-Violent
6268830,05/25/2008 11:12:49 PM,ARSON,ATTEMPT ARSON,false,false,61,41.802336479,-87.668455285,2008-05-25T23:12:49.000+02:00,5,25,23,2008,Non-Violent
6244717,05/07/2008 07:15:00 PM,BATTERY,PRO EMP HANDS NO/MIN INJURY,true,false,22,41.917293959,-87.715744759,2008-05-07T19:15:00.000+02:00,5,7,19,2008,Violent
6376086,07/20/2008 01:00:00 AM,BATTERY,SIMPLE,true,false,22,41.919863513,-87.692384042,2008-07-20T01:00:00.000+02:00,7,20,1,2008,Violent
6333704,06/28/2008 10:34:39 PM,BATTERY,SIMPLE,false,false,67,41.789482264,-87.67417284,2008-06-28T22:34:39.000+02:00,6,28,22,2008,Violent
6290542,05/13/2008 09:00:00 AM,DECEPTIVE PRACTICE,ILLEGAL USE CASH CARD,false,false,71,41.735160427,-87.643589757,2008-05-13T09:00:00.000+02:00,5,13,9,2008,Non-Violent
6318059,06/19/2008 11:14:00 AM,BATTERY,DOMESTIC BATTERY SIMPLE,false,true,25,41.901765214,-87.748407127,2008-06-19T11:14:00.000+02:00,6,19,11,2008,Violent
6192675,04/15/2008 06:55:22 PM,ASSAULT,AGGRAVATED: OTHER DANG WEAPON,false,false,67,41.770040898,-87.654246634,2008-04-15T18:55:22.000+02:00,4,15,18,2008,Violent
6267477,05/24/2008 04:30:00 PM,THEFT,OVER $500,false,false,32,41.885728393,-87.63413935,2008-05-24T16:30:00.000+02:00,5,24,16,2008,Non-Violent
6309942,06/15/2008 09:40:00 AM,BATTERY,DOMESTIC BATTERY SIMPLE,true,true,12,41.975280626,-87.752276703,2008-06-15T09:40:00.000+02:00,6,15,9,2008,Violent
6257344,05/19/2008 10:15:00 PM,THEFT,$500 AND UNDER,false,false,30,41.836806313,-87.73095549,2008-05-19T22:15:00.000+02:00,5,19,22,2008,Non-Violent
6229699,05/03/2008 10:30:00 PM,OTHER OFFENSE,OTHER VEHICLE OFFENSE,false,false,49,41.726455091,-87.626370007,2008-05-03T22:30:00.000+02:00,5,3,22,2008,Non-Violent
6191866,04/14/2008 11:15:00 AM,BATTERY,SIMPLE,false,false,45,41.740325519,-87.585722147,2008-04-14T11:15:00.000+02:00,4,14,11,2008,Violent
6267002,05/24/2008 12:01:00 AM,OTHER OFFENSE,VIOLATE ORDER OF PROTECTION,true,true,49,41.705235229,-87.631615959,2008-05-24T00:01:00.000+02:00,5,24,0,2008,Non-Violent
6364648,07/14/2008 07:45:00 AM,THEFT,$500 AND UNDER,false,false,31,41.857729001,-87.635971485,2008-07-14T07:45:00.000+02:00,7,14,7,2008,Non-Violent
6313903,06/16/2008 09:30:00 PM,BATTERY,AGGRAVATED:KNIFE/CUTTING INSTR,false,false,71,41.748097343,-87.662166183,2008-06-16T21:30:00.000+02:00,6,16,21,2008,Violent
6219770,04/29/2008 04:00:00 PM,CRIMINAL DAMAGE,TO VEHICLE,false,false,49,41.724927226,-87.623815165,2008-04-29T16:00:00.000+02:00,4,29,16,2008,Non-Violent
6245760,05/06/2008 10:55:00 PM,NARCOTICS,POSS: CANNABIS 30GMS OR LESS,true,false,61,41.798504861,-87.668351863,2008-05-06T22:55:00.000+02:00,5,6,22,2008,Non-Violent
6320231,06/21/2008 11:20:00 AM,NARCOTICS,POSS: CANNABIS 30GMS OR LESS,true,false,61,41.802649709,-87.656304744,2008-06-21T11:20:00.000+02:00,6,21,11,2008,Non-Violent
6187488,04/12/2008 06:58:00 PM,ASSAULT,AGGRAVATED: HANDGUN,false,false,23,41.898058037,-87.720058725,2008-04-12T18:58:00.000+02:00,4,12,18,2008,Violent
6246037,05/11/2008 01:00:00 AM,THEFT,$500 AND UNDER,false,false,77,41.977434179,-87.669649057,2008-05-11T01:00:00.000+02:00,5,11,1,2008,Non-Violent
6361221,07/12/2008 06:50:00 PM,CRIMINAL DAMAGE,TO PROPERTY,false,false,66,41.773332991,-87.683481204,2008-07-12T18:50:00.000+02:00,7,12,18,2008,Non-Violent
6262194,05/21/2008 08:15:00 AM,ASSAULT,PRO EMP HANDS NO/MIN INJURY,true,false,28,41.86559259,-87.676214817,2008-05-21T08:15:00.000+02:00,5,21,8,2008,Violent
6261005,05/20/2008 02:00:00 PM,THEFT,FROM BUILDING,false,true,68,41.771199121,-87.637301763,2008-05-20T14:00:00.000+02:00,5,20,14,2008,Non-Violent
6314781,03/13/2008 05:34:42 PM,CRIMINAL DAMAGE,TO VEHICLE,false,false,44,41.747222066,-87.600219523,2008-03-13T17:34:42.000+02:00,3,13,17,2008,Non-Violent
6246384,05/13/2008 07:30:48 PM,CRIMINAL DAMAGE,TO VEHICLE,false,false,68,41.790934645,-87.628965912,2008-05-13T19:30:48.000+02:00,5,13,19,2008,Non-Violent
6207967,04/22/2008 03:00:00 PM,OTHER OFFENSE,TELEPHONE THREAT,false,false,50,41.718043694,-87.600514612,2008-04-22T15:00:00.000+02:00,4,22,15,2008,Non-Violent
6368800,06/30/2008 11:30:00 AM,DECEPTIVE PRACTICE,FRAUD OR CONFIDENCE GAME,false,false,58,41.808427535,-87.685041334,2008-06-30T11:30:00.000+02:00,6,30,11,2008,Non-Violent
6313723,06/18/2008 07:13:31 PM,NARCOTICS,POSS: CANNABIS 30GMS OR LESS,true,false,61,41.798754709,-87.650133097,2008-06-18T19:13:31.000+02:00,6,18,19,2008,Non-Violent
6274627,05/25/2008 08:00:00 PM,NARCOTICS,POSS: CANNABIS 30GMS OR LESS,true,false,32,41.876603096,-87.620634485,2008-05-25T20:00:00.000+02:00,5,25,20,2008,Non-Violent
6277105,05/28/2008 12:25:00 PM,THEFT,RETAIL THEFT,true,false,10,41.97443857,-87.81119077,2008-05-28T12:25:00.000+02:00,5,28,12,2008,Non-Violent
6254862,05/16/2008 11:00:00 PM,THEFT,FROM BUILDING,false,false,6,41.941002896,-87.651524102,2008-05-16T23:00:00.000+02:00,5,16,23,2008,Non-Violent
6228005,05/03/2008 01:27:00 PM,THEFT,RETAIL THEFT,false,false,49,41.721633492,-87.630422911,2008-05-03T13:27:00.000+02:00,5,3,13,2008,Non-Violent
6273297,05/24/2008 01:00:00 AM,THEFT,FROM BUILDING,false,false,8,41.895053843,-87.629732954,2008-05-24T01:00:00.000+02:00,5,24,1,2008,Non-Violent
6248443,04/26/2008 02:30:00 PM,BATTERY,DOMESTIC BATTERY SIMPLE,false,true,68,41.779636911,-87.652722856,2008-04-26T14:30:00.000+02:00,4,26,14,2008,Violent
6178922,02/08/2008 04:39:50 PM,BATTERY,AGGRAVATED: OTHER DANG WEAPON,false,false,43,41.754676733,-87.562653519,2008-02-08T16:39:50.000+02:00,2,8,16,2008,Violent
6237938,05/08/2008 09:00:00 AM,BATTERY,SIMPLE,false,false,52,41.687781567,-87.540098152,2008-05-08T09:00:00.000+02:00,5,8,9,2008,Violent
6232084,05/04/2008 04:15:00 PM,ASSAULT,SIMPLE,false,false,27,41.875894454,-87.70413654,2008-05-04T16:15:00.000+02:00,5,4,16,2008,Violent
6380457,07/19/2008 10:05:19 PM,NARCOTICS,POSS: COCAINE,true,false,18,41.923563971,-87.799365706,2008-07-19T22:05:19.000+02:00,7,19,22,2008,Non-Violent
6227075,05/02/2008 10:58:00 PM,CRIMINAL DAMAGE,TO PROPERTY,false,false,52,41.70362634,-87.531656565,2008-05-02T22:58:00.000+02:00,5,2,22,2008,Non-Violent
6357409,07/09/2008 05:20:00 PM,MOTOR VEHICLE THEFT,AUTOMOBILE,false,false,66,41.774040135,-87.703025036,2008-07-09T17:20:00.000+02:00,7,9,17,2008,Non-Violent
6371717,07/15/2008 10:56:02 PM,CRIMINAL DAMAGE,TO PROPERTY,false,false,42,41.783241673,-87.607248787,2008-07-15T22:56:02.000+02:00,7,15,22,2008,Non-Violent
6313689,06/18/2008 04:00:00 PM,CRIMINAL DAMAGE,TO VEHICLE,false,false,40,,,2008-06-18T16:00:00.000+02:00,6,18,16,2008,Non-Violent
6290493,06/06/2008 12:33:00 PM,PUBLIC PEACE VIOLATION,MOB ACTION,true,false,73,41.706070186,-87.653645803,2008-06-06T12:33:00.000+02:00,6,6,12,2008,Non-Violent
6284667,06/02/2008 05:00:00 PM,BATTERY,SIMPLE,false,false,27,41.887417616,-87.714247757,2008-06-02T17:00:00.000+02:00,6,2,17,2008,Violent
6257287,05/18/2008 11:00:00 AM,OTHER OFFENSE,VIOLATE ORDER OF PROTECTION,true,true,66,41.783453178,-87.702045543,2008-05-18T11:00:00.000+02:00,5,18,11,2008,Non-Violent
6285290,05/27/2008 10:30:00 PM,ASSAULT,AGGRAVATED: OTHER DANG WEAPON,false,true,71,41.744136151,-87.653566945,2008-05-27T22:30:00.000+02:00,5,27,22,2008,Violent
6195188,04/13/2008 05:30:00 PM,MOTOR VEHICLE THEFT,AUTOMOBILE,false,false,77,41.989433412,-87.655366388,2008-04-13T17:30:00.000+02:00,4,13,17,2008,Non-Violent
6237924,05/08/2008 12:45:00 PM,BATTERY,SIMPLE,false,false,46,41.751279169,-87.556522759,2008-05-08T12:45:00.000+02:00,5,8,12,2008,Violent
6285684,06/03/2008 09:00:00 PM,THEFT,$500 AND UNDER,false,false,7,41.925162419,-87.667277075,2008-06-03T21:00:00.000+02:00,6,3,21,2008,Non-Violent
6178533,04/07/2008 10:00:00 PM,CRIMINAL DAMAGE,TO VEHICLE,false,false,43,41.767430357,-87.572669404,2008-04-07T22:00:00.000+02:00,4,7,22,2008,Non-Violent
6325451,06/23/2008 06:15:00 PM,THEFT,FROM BUILDING,false,false,28,41.88317648,-87.641882601,2008-06-23T18:15:00.000+02:00,6,23,18,2008,Non-Violent
6318603,06/17/2008 04:00:00 PM,NARCOTICS,POSS: HEROIN(WHITE),true,false,25,41.898932408,-87.760782197,2008-06-17T16:00:00.000+02:00,6,17,16,2008,Non-Violent
6240596,05/10/2008 10:28:00 PM,WEAPONS VIOLATION,UNLAWFUL POSS OF HANDGUN,true,false,22,41.918104126,-87.687426686,2008-05-10T22:28:00.000+02:00,5,10,22,2008,Non-Violent
6189796,04/13/2008 12:40:00 PM,DECEPTIVE PRACTICE,FRAUD OR CONFIDENCE GAME,false,false,25,41.908430047,-87.746075929,2008-04-13T12:40:00.000+02:00,4,13,12,2008,Non-Violent
6178420,04/07/2008 09:49:05 PM,NARCOTICS,SOLICIT NARCOTICS ON PUBLICWAY,true,false,68,41.768832649,-87.644897088,2008-04-07T21:49:05.000+02:00,4,7,21,2008,Non-Violent
6281555,05/31/2008 11:30:00 PM,MOTOR VEHICLE THEFT,"CYCLE, SCOOTER, BIKE W-VIN",false,false,8,41.901577106,-87.627086347,2008-05-31T23:30:00.000+02:00,5,31,23,2008,Non-Violent
6294477,06/09/2008 12:36:00 AM,ROBBERY,ARMED: HANDGUN,false,false,44,41.750657714,-87.614956494,2008-06-09T00:36:00.000+02:00,6,9,0,2008,Violent
6335391,06/29/2008 07:30:00 AM,CRIMINAL TRESPASS,TO RESIDENCE,true,false,68,41.7627041,-87.644350483,2008-06-29T07:30:00.000+02:00,6,29,7,2008,Non-Violent
6272915,05/28/2008 05:40:00 AM,BURGLARY,FORCIBLE ENTRY,true,false,53,41.668005795,-87.63797157,2008-05-28T05:40:00.000+02:00,5,28,5,2008,Non-Violent
6178835,03/31/2008 03:04:41 PM,NARCOTICS,POSS: CANNABIS 30GMS OR LESS,true,false,25,41.897102236,-87.74830643,2008-03-31T15:04:41.000+02:00,3,31,15,2008,Non-Violent
6263400,05/21/2008 08:00:00 AM,THEFT,FROM BUILDING,false,false,69,41.763167652,-87.620029182,2008-05-21T08:00:00.000+02:00,5,21,8,2008,Non-Violent
6225794,05/01/2008 03:00:00 PM,THEFT,$500 AND UNDER,false,false,77,41.990391905,-87.661565395,2008-05-01T15:00:00.000+02:00,5,1,15,2008,Non-Violent
6340733,06/28/2008 11:15:00 PM,THEFT,FROM BUILDING,true,true,69,41.772864484,-87.621113193,2008-06-28T23:15:00.000+02:00,6,28,23,2008,Non-Violent
6278748,05/30/2008 05:15:00 AM,OTHER OFFENSE,VIOLATE ORDER OF PROTECTION,true,true,15,41.949127029,-87.747169291,2008-05-30T05:15:00.000+02:00,5,30,5,2008,Non-Violent
6239270,05/09/2008 10:00:00 AM,BATTERY,SIMPLE,false,false,25,41.897819723,-87.765501067,2008-05-09T10:00:00.000+02:00,5,9,10,2008,Violent
6191387,04/14/2008 09:20:00 AM,ASSAULT,PRO EMP HANDS NO/MIN INJURY,true,false,15,41.939898633,-87.754281422,2008-04-14T09:20:00.000+02:00,4,14,9,2008,Violent
6278708,05/30/2008 10:05:41 AM,ASSAULT,SIMPLE,false,true,68,41.765156822,-87.64744727,2008-05-30T10:05:41.000+02:00,5,30,10,2008,Violent
6223383,05/01/2008 10:00:00 AM,OTHER OFFENSE,HARASSMENT BY TELEPHONE,false,true,43,41.765190617,-87.581782689,2008-05-01T10:00:00.000+02:00,5,1,10,2008,Non-Violent
6171408,04/04/2008 06:30:00 AM,THEFT,FROM BUILDING,false,false,21,41.932013304,-87.709020735,2008-04-04T06:30:00.000+02:00,4,4,6,2008,Non-Violent
6244843,05/10/2008 11:00:00 AM,THEFT,$500 AND UNDER,false,false,7,41.913763571,-87.642313078,2008-05-10T11:00:00.000+02:00,5,10,11,2008,Non-Violent
6242382,05/11/2008 10:11:55 PM,THEFT,RETAIL THEFT,true,false,77,41.991262667,-87.660305558,2008-05-11T22:11:55.000+02:00,5,11,22,2008,Non-Violent
6378401,06/29/2008 12:00:00 AM,THEFT,FROM BUILDING,false,false,22,41.924753265,-87.7032084,2008-06-29T00:00:00.000+02:00,6,29,0,2008,Non-Violent
6364834,07/14/2008 06:40:00 AM,THEFT,OVER $500,false,false,73,41.72137925,-87.649689591,2008-07-14T06:40:00.000+02:00,7,14,6,2008,Non-Violent
6344577,07/04/2008 11:45:00 AM,THEFT,RETAIL THEFT,true,false,22,41.924491602,-87.725945966,2008-07-04T11:45:00.000+02:00,7,4,11,2008,Non-Violent
6269807,05/03/2008 07:00:00 AM,MOTOR VEHICLE THEFT,AUTOMOBILE,false,false,71,41.755574885,-87.649022623,2008-05-03T07:00:00.000+02:00,5,3,7,2008,Non-Violent
6191282,04/10/2008 08:18:02 PM,CRIMINAL TRESPASS,TO STATE SUP LAND,true,false,35,41.829864596,-87.613418466,2008-04-10T20:18:02.000+02:00,4,10,20,2008,Non-Violent
6273363,05/22/2008 09:05:00 PM,OTHER OFFENSE,VIOLATE ORDER OF PROTECTION,true,true,43,41.752719419,-87.566250124,2008-05-22T21:05:00.000+02:00,5,22,21,2008,Non-Violent
6359541,07/08/2008 01:55:00 PM,NARCOTICS,POSS: HEROIN(WHITE),false,false,35,41.832076134,-87.61336433,2008-07-08T13:55:00.000+02:00,7,8,13,2008,Non-Violent
6321401,06/23/2008 12:40:13 AM,NARCOTICS,POSS: CANNABIS 30GMS OR LESS,true,false,28,41.869313273,-87.663300857,2008-06-23T00:40:13.000+02:00,6,23,0,2008,Non-Violent
6318098,06/19/2008 04:00:00 PM,ASSAULT,PRO EMP HANDS NO/MIN INJURY,false,false,70,41.735159923,-87.703731406,2008-06-19T16:00:00.000+02:00,6,19,16,2008,Violent
6220221,04/08/2008 09:00:00 PM,DECEPTIVE PRACTICE,FRAUD OR CONFIDENCE GAME,false,false,67,41.769472115,-87.663944937,2008-04-08T21:00:00.000+02:00,4,8,21,2008,Non-Violent
6321300,06/19/2008 05:22:40 PM,NARCOTICS,POSS: CANNABIS 30GMS OR LESS,true,false,2,41.990983376,-87.696982731,2008-06-19T17:22:40.000+02:00,6,19,17,2008,Non-Violent
6226452,04/22/2008 05:00:00 AM,MOTOR VEHICLE THEFT,AUTOMOBILE,false,false,66,41.773772913,-87.685086146,2008-04-22T05:00:00.000+02:00,4,22,5,2008,Non-Violent
6327401,06/25/2008 06:00:00 PM,THEFT,OVER $500,false,false,19,41.937142972,-87.771308606,2008-06-25T18:00:00.000+02:00,6,25,18,2008,Non-Violent
6344379,07/03/2008 11:00:00 PM,OTHER OFFENSE,TELEPHONE THREAT,false,true,25,41.892831474,-87.773485904,2008-07-03T23:00:00.000+02:00,7,3,23,2008,Non-Violent
6352379,07/07/2008 08:30:00 PM,MOTOR VEHICLE THEFT,AUTOMOBILE,false,false,36,41.819767809,-87.600302468,2008-07-07T20:30:00.000+02:00,7,7,20,2008,Non-Violent
6185953,04/11/2008 06:00:00 PM,THEFT,FROM BUILDING,false,false,17,41.949656887,-87.812084162,2008-04-11T18:00:00.000+02:00,4,11,18,2008,Non-Violent
6339786,07/02/2008 02:09:47 AM,BATTERY,DOMESTIC BATTERY SIMPLE,true,true,28,41.862783222,-87.65696297,2008-07-02T02:09:47.000+02:00,7,2,2,2008,Violent
6378372,07/14/2008 08:15:00 PM,CRIMINAL TRESPASS,TO LAND,true,false,31,41.852198325,-87.674377204,2008-07-14T20:15:00.000+02:00,7,14,20,2008,Non-Violent
6225949,04/24/2008 12:00:00 PM,THEFT,FROM BUILDING,false,false,25,41.879431601,-87.750920569,2008-04-24T12:00:00.000+02:00,4,24,12,2008,Non-Violent
6297985,06/09/2008 09:50:00 PM,BATTERY,AGGRAVATED: HANDGUN,false,false,69,41.76186678,-87.596962971,2008-06-09T21:50:00.000+02:00,6,9,21,2008,Violent
6173576,04/04/2008 02:40:00 PM,BATTERY,SIMPLE,true,false,27,41.871025414,-87.699510379,2008-04-04T14:40:00.000+02:00,4,4,14,2008,Violent
6275235,05/17/2008 05:15:00 PM,BURGLARY,UNLAWFUL ENTRY,false,false,24,41.908595251,-87.670076035,2008-05-17T17:15:00.000+02:00,5,17,17,2008,Non-Violent
6343696,07/03/2008 07:00:00 PM,THEFT,POCKET-PICKING,false,false,46,41.751375148,-87.55895132,2008-07-03T19:00:00.000+02:00,7,3,19,2008,Non-Violent
6215351,04/27/2008 10:56:00 AM,OTHER OFFENSE,HARASSMENT BY TELEPHONE,false,false,36,41.830109681,-87.610058377,2008-04-27T10:56:00.000+02:00,4,27,10,2008,Non-Violent
6175384,04/05/2008 11:11:12 PM,NARCOTICS,POSS: CANNABIS 30GMS OR LESS,true,false,46,41.727872617,-87.551207132,2008-04-05T23:11:12.000+02:00,4,5,23,2008,Non-Violent
6218514,04/28/2008 02:50:00 PM,BATTERY,AGGRAVATED PO: OTHER DANG WEAP,true,false,66,41.780968276,-87.691407935,2008-04-28T14:50:00.000+02:00,4,28,14,2008,Violent
6227835,05/02/2008 11:15:00 PM,BURGLARY,UNLAWFUL ENTRY,false,false,7,41.92617099,-87.64977854,2008-05-02T23:15:00.000+02:00,5,2,23,2008,Non-Violent
6291510,06/06/2008 07:00:00 PM,ASSAULT,AGGRAVATED: OTHER DANG WEAPON,true,true,25,41.894084068,-87.744110141,2008-06-06T19:00:00.000+02:00,6,6,19,2008,Violent
6286004,05/22/2008 07:40:00 PM,LIQUOR LAW VIOLATION,SELL/GIVE/DEL LIQUOR TO MINOR,true,false,22,41.916084323,-87.669612711,2008-05-22T19:40:00.000+02:00,5,22,19,2008,Non-Violent
6187224,04/12/2008 02:00:00 PM,THEFT,RETAIL THEFT,false,false,3,41.964238371,-87.666517247,2008-04-12T14:00:00.000+02:00,4,12,14,2008,Non-Violent
6239456,05/08/2008 11:30:00 PM,BATTERY,DOMESTIC BATTERY SIMPLE,false,true,66,41.777291241,-87.6890139,2008-05-08T23:30:00.000+02:00,5,8,23,2008,Violent
6325152,06/23/2008 02:00:00 PM,THEFT,FROM BUILDING,false,false,32,41.88575899,-87.624359385,2008-06-23T14:00:00.000+02:00,6,23,14,2008,Non-Violent
6274150,05/28/2008 04:24:00 PM,OTHER OFFENSE,TELEPHONE THREAT,false,false,28,41.87763473,-87.679645914,2008-05-28T16:24:00.000+02:00,5,28,16,2008,Non-Violent
6296085,06/09/2008 03:00:00 PM,ASSAULT,AGGRAVATED: HANDGUN,false,false,49,41.689852605,-87.624354491,2008-06-09T15:00:00.000+02:00,6,9,15,2008,Violent
6298309,06/10/2008 08:00:00 PM,THEFT,RETAIL THEFT,true,false,61,41.808659359,-87.660921846,2008-06-10T20:00:00.000+02:00,6,10,20,2008,Non-Violent
6311662,06/17/2008 06:45:00 PM,BATTERY,SIMPLE,false,false,49,41.707223264,-87.619768996,2008-06-17T18:45:00.000+02:00,6,17,18,2008,Violent
6348487,07/07/2008 01:12:00 AM,CRIMINAL DAMAGE,TO PROPERTY,true,true,43,41.754172384,-87.552581097,2008-07-07T01:12:00.000+02:00,7,7,1,2008,Non-Violent
6227085,05/02/2008 11:00:00 PM,THEFT,FROM BUILDING,false,false,8,41.893962515,-87.636176148,2008-05-02T23:00:00.000+02:00,5,2,23,2008,Non-Violent
6289814,05/29/2008 07:45:00 PM,CRIMINAL DAMAGE,TO PROPERTY,false,true,71,41.74764894,-87.657300692,2008-05-29T19:45:00.000+02:00,5,29,19,2008,Non-Violent
6295673,06/09/2008 06:00:00 PM,CRIMINAL DAMAGE,TO VEHICLE,false,false,24,41.907852199,-87.666395351,2008-06-09T18:00:00.000+02:00,6,9,18,2008,Non-Violent
6237463,05/04/2008 06:39:31 PM,BATTERY,DOMESTIC BATTERY SIMPLE,false,true,25,41.893925228,-87.762097739,2008-05-04T18:39:31.000+02:00,5,4,18,2008,Violent
6207943,04/20/2008 08:07:08 PM,CRIMINAL DAMAGE,TO PROPERTY,false,true,29,41.865490571,-87.708078696,2008-04-20T20:07:08.000+02:00,4,20,20,2008,Non-Violent
6178015,04/07/2008 12:10:00 AM,BATTERY,AGGRAVATED: HANDGUN,false,false,42,41.77587085,-87.609476619,2008-04-07T00:10:00.000+02:00,4,7,0,2008,Violent
6300700,06/11/2008 06:45:00 PM,BATTERY,DOMESTIC BATTERY SIMPLE,false,true,42,41.783522021,-87.593125671,2008-06-11T18:45:00.000+02:00,6,11,18,2008,Violent
6210454,04/22/2008 10:58:00 PM,NARCOTICS,POSS: CANNABIS 30GMS OR LESS,true,false,29,41.866741109,-87.720137842,2008-04-22T22:58:00.000+02:00,4,22,22,2008,Non-Violent
6349826,05/09/2008 01:00:00 PM,THEFT,FINANCIAL ID THEFT: OVER $300,false,false,63,41.794679621,-87.708488699,2008-05-09T13:00:00.000+02:00,5,9,13,2008,Non-Violent
6332965,06/20/2008 11:53:35 PM,NARCOTICS,POSS: CANNABIS 30GMS OR LESS,true,false,46,41.751832643,-87.558832214,2008-06-20T23:53:35.000+02:00,6,20,23,2008,Non-Violent
6381179,05/31/2008 10:15:41 PM,GAMBLING,GAME/DICE,true,false,66,41.779232785,-87.685346466,2008-05-31T22:15:41.000+02:00,5,31,22,2008,Non-Violent
6317107,06/19/2008 09:00:00 PM,BATTERY,DOMESTIC BATTERY SIMPLE,false,true,71,41.737151312,-87.642428972,2008-06-19T21:00:00.000+02:00,6,19,21,2008,Violent
6364544,07/13/2008 12:30:00 AM,CRIMINAL DAMAGE,TO VEHICLE,false,false,77,41.982581828,-87.66672678,2008-07-13T00:30:00.000+02:00,7,13,0,2008,Non-Violent
6320026,06/20/2008 02:22:00 AM,BURGLARY,ATTEMPT FORCIBLE ENTRY,false,false,66,41.767805108,-87.683328051,2008-06-20T02:22:00.000+02:00,6,20,2,2008,Non-Violent
6177041,04/07/2008 03:00:00 PM,THEFT,OVER $500,false,false,22,41.91720979,-87.722583296,2008-04-07T15:00:00.000+02:00,4,7,15,2008,Non-Violent
6245851,05/05/2008 09:35:00 AM,THEFT,POCKET-PICKING,false,false,73,41.706070186,-87.653645803,2008-05-05T09:35:00.000+02:00,5,5,9,2008,Non-Violent
6233517,05/05/2008 05:30:00 AM,THEFT,$500 AND UNDER,false,false,8,41.910951828,-87.646153195,2008-05-05T05:30:00.000+02:00,5,5,5,2008,Non-Violent
6173716,04/05/2008 12:46:11 AM,THEFT,FROM BUILDING,false,false,33,41.858544503,-87.623947921,2008-04-05T00:46:11.000+02:00,4,5,0,2008,Non-Violent
6320995,06/21/2008 11:00:00 PM,BATTERY,SIMPLE,false,false,69,41.763234282,-87.623254009,2008-06-21T23:00:00.000+02:00,6,21,23,2008,Violent
6299347,06/02/2008 10:00:00 PM,MOTOR VEHICLE THEFT,AUTOMOBILE,false,false,61,41.813602928,-87.684013382,2008-06-02T22:00:00.000+02:00,6,2,22,2008,Non-Violent
6360890,07/12/2008 11:10:00 AM,MOTOR VEHICLE THEFT,AUTOMOBILE,false,false,8,41.88946287,-87.624222942,2008-07-12T11:10:00.000+02:00,7,12,11,2008,Non-Violent
6256912,05/18/2008 06:00:00 PM,CRIMINAL DAMAGE,TO PROPERTY,false,false,74,41.691357572,-87.714311612,2008-05-18T18:00:00.000+02:00,5,18,18,2008,Non-Violent
6319690,06/20/2008 04:50:00 PM,BATTERY,DOMESTIC BATTERY SIMPLE,false,true,68,41.78696943,-87.648989537,2008-06-20T16:50:00.000+02:00,6,20,16,2008,Violent
6264032,05/20/2008 10:00:00 AM,THEFT,OVER $500,false,false,3,41.955448811,-87.652513513,2008-05-20T10:00:00.000+02:00,5,20,10,2008,Non-Violent
6336168,06/28/2008 07:50:00 PM,BATTERY,DOMESTIC BATTERY SIMPLE,false,true,26,41.876951034,-87.736534493,2008-06-28T19:50:00.000+02:00,6,28,19,2008,Violent
6318376,06/18/2008 10:46:00 AM,OTHER OFFENSE,HARASSMENT BY TELEPHONE,false,true,67,41.770434611,-87.659590924,2008-06-18T10:46:00.000+02:00,6,18,10,2008,Non-Violent
6248255,04/24/2008 09:00:00 PM,BATTERY,DOMESTIC BATTERY SIMPLE,false,true,20,41.927002017,-87.734197767,2008-04-24T21:00:00.000+02:00,4,24,21,2008,Violent
6376155,07/19/2008 05:10:00 PM,BATTERY,SIMPLE,false,false,6,41.936335635,-87.650710119,2008-07-19T17:10:00.000+02:00,7,19,17,2008,Violent
6181904,04/09/2008 06:10:11 PM,THEFT,RETAIL THEFT,true,false,66,41.781954133,-87.683713146,2008-04-09T18:10:11.000+02:00,4,9,18,2008,Non-Violent
6314370,06/18/2008 10:25:00 PM,BATTERY,DOMESTIC BATTERY SIMPLE,true,true,16,41.956558428,-87.705652544,2008-06-18T22:25:00.000+02:00,6,18,22,2008,Violent
6346629,07/05/2008 06:45:00 AM,BURGLARY,FORCIBLE ENTRY,false,false,36,41.820908958,-87.604974384,2008-07-05T06:45:00.000+02:00,7,5,6,2008,Non-Violent
6283445,06/02/2008 05:30:00 PM,ASSAULT,SIMPLE,false,false,19,41.915991722,-87.748482991,2008-06-02T17:30:00.000+02:00,6,2,17,2008,Violent
6307874,06/15/2008 01:35:00 PM,OTHER OFFENSE,TELEPHONE THREAT,false,true,46,41.740144292,-87.555121718,2008-06-15T13:35:00.000+02:00,6,15,13,2008,Non-Violent
6268736,05/24/2008 04:45:00 PM,BURGLARY,UNLAWFUL ENTRY,false,false,24,41.912277103,-87.679005994,2008-05-24T16:45:00.000+02:00,5,24,16,2008,Non-Violent
6164425,03/30/2008 02:50:00 PM,NARCOTICS,POSS: CANNABIS 30GMS OR LESS,true,false,68,41.774037014,-87.644636139,2008-03-30T14:50:00.000+02:00,3,30,14,2008,Non-Violent
6186985,04/12/2008 10:44:26 AM,THEFT,RETAIL THEFT,false,false,43,41.751717281,-87.567002336,2008-04-12T10:44:26.000+02:00,4,12,10,2008,Non-Violent
6317275,06/16/2008 10:00:00 PM,THEFT,OVER $500,false,false,63,41.789329235,-87.686355869,2008-06-16T22:00:00.000+02:00,6,16,22,2008,Non-Violent
6336065,06/14/2008 09:30:00 PM,ROBBERY,VEHICULAR HIJACKING,false,false,27,41.875927657,-87.701187715,2008-06-14T21:30:00.000+02:00,6,14,21,2008,Violent
6229816,05/04/2008 11:22:41 AM,ASSAULT,SIMPLE,false,true,26,41.877072569,-87.726733001,2008-05-04T11:22:41.000+02:00,5,4,11,2008,Violent
6315543,06/18/2008 10:00:00 PM,THEFT,OVER $500,false,false,24,41.908923397,-87.689642668,2008-06-18T22:00:00.000+02:00,6,18,22,2008,Non-Violent
6179622,03/27/2008 08:00:00 AM,DECEPTIVE PRACTICE,FORGERY,false,false,23,41.909882469,-87.726683309,2008-03-27T08:00:00.000+02:00,3,27,8,2008,Non-Violent
6254580,05/15/2008 05:35:00 PM,ASSAULT,SIMPLE,false,true,71,41.751880122,-87.652561724,2008-05-15T17:35:00.000+02:00,5,15,17,2008,Violent
6166551,04/01/2008 05:45:00 AM,THEFT,$500 AND UNDER,false,false,6,41.93467909,-87.636706827,2008-04-01T05:45:00.000+02:00,4,1,5,2008,Non-Violent
6207646,04/21/2008 04:00:00 PM,THEFT,$500 AND UNDER,false,false,51,41.721938553,-87.578990155,2008-04-21T16:00:00.000+02:00,4,21,16,2008,Non-Violent
6225386,05/01/2008 02:05:00 AM,BATTERY,SIMPLE,false,false,68,41.779670942,-87.650134051,2008-05-01T02:05:00.000+02:00,5,1,2,2008,Violent
6297336,06/09/2008 10:43:00 AM,BURGLARY,FORCIBLE ENTRY,false,false,68,41.780842439,-87.653318734,2008-06-09T10:43:00.000+02:00,6,9,10,2008,Non-Violent
6331220,06/27/2008 08:00:00 AM,CRIMINAL DAMAGE,TO VEHICLE,false,false,1,42.014519962,-87.670260848,2008-06-27T08:00:00.000+02:00,6,27,8,2008,Non-Violent
6217802,04/25/2008 11:30:00 AM,CRIMINAL TRESPASS,TO LAND,true,false,70,41.749460005,-87.72089612,2008-04-25T11:30:00.000+02:00,4,25,11,2008,Non-Violent
6234336,04/29/2008 08:45:00 PM,NARCOTICS,POSS: CANNABIS 30GMS OR LESS,true,false,26,41.885487535,-87.726422045,2008-04-29T20:45:00.000+02:00,4,29,20,2008,Non-Violent
6243224,04/30/2008 09:00:00 PM,PROSTITUTION,SOLICIT ON PUBLIC WAY,true,false,66,41.778588585,-87.698250977,2008-04-30T21:00:00.000+02:00,4,30,21,2008,Non-Violent
6284614,05/16/2008 10:00:00 AM,NARCOTICS,FOUND SUSPECT NARCOTICS,true,false,29,,,2008-05-16T10:00:00.000+02:00,5,16,10,2008,Non-Violent
6165473,03/30/2008 12:00:00 PM,NARCOTICS,MANU/DEL:CANNABIS 10GM OR LESS,true,false,61,41.808126189,-87.667383061,2008-03-30T12:00:00.000+02:00,3,30,12,2008,Non-Violent
6289591,06/05/2008 09:00:00 AM,BURGLARY,FORCIBLE ENTRY,false,false,43,41.768010495,-87.57324906,2008-06-05T09:00:00.000+02:00,6,5,9,2008,Non-Violent
6304283,06/12/2008 05:30:00 PM,ROBBERY,ATTEMPT: STRONGARM-NO WEAPON,false,false,3,41.963624641,-87.653581019,2008-06-12T17:30:00.000+02:00,6,12,17,2008,Violent
6352383,07/06/2008 08:00:00 PM,THEFT,PURSE-SNATCHING,false,false,49,41.704601425,-87.622262568,2008-07-06T20:00:00.000+02:00,7,6,20,2008,Non-Violent
6361836,07/10/2008 01:18:52 PM,CRIMINAL DAMAGE,TO PROPERTY,false,false,67,41.774923092,-87.675007494,2008-07-10T13:18:52.000+02:00,7,10,13,2008,Non-Violent
6204662,04/21/2008 09:37:00 PM,CRIMINAL DAMAGE,TO VEHICLE,false,false,35,41.834650079,-87.616847182,2008-04-21T21:37:00.000+02:00,4,21,21,2008,Non-Violent
6278818,05/28/2008 06:00:00 PM,THEFT,PURSE-SNATCHING,false,false,66,41.778767526,-87.683627986,2008-05-28T18:00:00.000+02:00,5,28,18,2008,Non-Violent
6217100,04/26/2008 04:35:00 AM,BATTERY,DOMESTIC BATTERY SIMPLE,true,true,29,41.8614393,-87.720155461,2008-04-26T04:35:00.000+02:00,4,26,4,2008,Violent
6337183,06/29/2008 09:53:00 PM,BATTERY,SIMPLE,false,false,15,41.960413966,-87.772435127,2008-06-29T21:53:00.000+02:00,6,29,21,2008,Violent
6176749,04/05/2008 01:30:00 AM,BATTERY,DOMESTIC BATTERY SIMPLE,false,true,71,41.751617999,-87.647708692,2008-04-05T01:30:00.000+02:00,4,5,1,2008,Violent
6298045,06/10/2008 01:30:00 AM,MOTOR VEHICLE THEFT,AUTOMOBILE,false,false,20,41.919777091,-87.729080821,2008-06-10T01:30:00.000+02:00,6,10,1,2008,Non-Violent
6343074,06/30/2008 12:01:00 AM,MOTOR VEHICLE THEFT,"TRUCK, BUS, MOTOR HOME",false,false,15,41.947285426,-87.747123671,2008-06-30T00:01:00.000+02:00,6,30,0,2008,Non-Violent
6267643,05/24/2008 05:00:00 PM,THEFT,OVER $500,false,false,4,41.974618961,-87.701315965,2008-05-24T17:00:00.000+02:00,5,24,17,2008,Non-Violent
6261873,05/19/2008 02:00:00 PM,ASSAULT,PRO EMP HANDS NO/MIN INJURY,false,false,23,41.90624044,-87.729726463,2008-05-19T14:00:00.000+02:00,5,19,14,2008,Violent
6281660,06/01/2008 09:34:57 AM,BATTERY,DOMESTIC BATTERY SIMPLE,false,true,26,41.869822522,-87.724191109,2008-06-01T09:34:57.000+02:00,6,1,9,2008,Violent
6299369,06/05/2008 07:55:00 PM,ASSAULT,SIMPLE,false,false,49,41.727846463,-87.631743619,2008-06-05T19:55:00.000+02:00,6,5,19,2008,Violent
6267467,05/16/2008 12:00:00 PM,BURGLARY,FORCIBLE ENTRY,false,false,49,41.688136612,-87.642247062,2008-05-16T12:00:00.000+02:00,5,16,12,2008,Non-Violent
6285170,05/28/2008 10:17:00 PM,BATTERY,DOMESTIC BATTERY SIMPLE,false,true,19,41.926020442,-87.751981615,2008-05-28T22:17:00.000+02:00,5,28,22,2008,Violent
6174703,03/12/2008 11:15:53 PM,CRIMINAL TRESPASS,TO LAND,true,false,44,41.750218826,-87.631866529,2008-03-12T23:15:53.000+02:00,3,12,23,2008,Non-Violent
6300453,06/10/2008 12:28:00 PM,CRIMINAL DAMAGE,TO VEHICLE,true,false,49,41.710281384,-87.624800282,2008-06-10T12:28:00.000+02:00,6,10,12,2008,Non-Violent
6217632,04/13/2008 11:30:00 PM,THEFT,$500 AND UNDER,false,false,1,42.020186004,-87.66824415,2008-04-13T23:30:00.000+02:00,4,13,23,2008,Non-Violent
6171228,04/01/2008 09:10:00 PM,CRIMINAL DAMAGE,TO VEHICLE,false,true,67,41.786680302,-87.669874772,2008-04-01T21:10:00.000+02:00,4,1,21,2008,Non-Violent
6301152,06/11/2008 09:22:03 AM,ASSAULT,SIMPLE,false,true,68,41.781632265,-87.640826076,2008-06-11T09:22:03.000+02:00,6,11,9,2008,Violent
6350614,07/07/2008 12:30:00 AM,ROBBERY,ARMED: HANDGUN,false,false,71,41.755551284,-87.640505461,2008-07-07T00:30:00.000+02:00,7,7,0,2008,Violent
6169656,04/02/2008 01:00:00 PM,MOTOR VEHICLE THEFT,"ATT: TRUCK, BUS, MOTOR HOME",false,false,51,41.711217152,-87.562136389,2008-04-02T13:00:00.000+02:00,4,2,13,2008,Non-Violent
6279461,05/29/2008 12:30:00 PM,BATTERY,SIMPLE,true,false,30,41.835947057,-87.734045986,2008-05-29T12:30:00.000+02:00,5,29,12,2008,Violent
6339378,06/30/2008 09:53:05 PM,NARCOTICS,POSS: CANNABIS 30GMS OR LESS,true,false,40,41.792377986,-87.619162687,2008-06-30T21:53:05.000+02:00,6,30,21,2008,Non-Violent
6343764,07/01/2008 11:55:00 PM,NARCOTICS,POSS: CANNABIS 30GMS OR LESS,true,false,52,41.707760141,-87.53770286,2008-07-01T23:55:00.000+02:00,7,1,23,2008,Non-Violent
6318467,06/19/2008 11:05:00 PM,BATTERY,AGGRAVATED: HANDGUN,false,false,61,41.798775026,-87.667142481,2008-06-19T23:05:00.000+02:00,6,19,23,2008,Violent
6272652,05/27/2008 09:00:00 PM,OTHER OFFENSE,HAZARDOUS MATERIALS VIOLATION,false,false,22,41.931105059,-87.726960009,2008-05-27T21:00:00.000+02:00,5,27,21,2008,Non-Violent
6266942,05/23/2008 08:44:09 AM,ASSAULT,PRO EMP HANDS NO/MIN INJURY,false,false,25,41.884807342,-87.75033191,2008-05-23T08:44:09.000+02:00,5,23,8,2008,Violent
6205326,04/21/2008 09:03:16 PM,BATTERY,DOMESTIC BATTERY SIMPLE,false,true,27,41.872636054,-87.716604432,2008-04-21T21:03:16.000+02:00,4,21,21,2008,Violent
6287468,05/23/2008 02:00:00 PM,THEFT,FROM BUILDING,false,false,10,41.976178538,-87.796348413,2008-05-23T14:00:00.000+02:00,5,23,14,2008,Non-Violent
6281446,05/28/2008 12:01:00 AM,BATTERY,DOMESTIC BATTERY SIMPLE,false,true,22,41.928184574,-87.723731748,2008-05-28T00:01:00.000+02:00,5,28,0,2008,Violent
6205279,04/21/2008 01:00:03 AM,BATTERY,DOMESTIC BATTERY SIMPLE,false,true,2,42.013551903,-87.692599681,2008-04-21T01:00:03.000+02:00,4,21,1,2008,Violent
6272013,05/26/2008 11:45:00 PM,BATTERY,DOMESTIC BATTERY SIMPLE,false,true,70,41.741256221,-87.738459515,2008-05-26T23:45:00.000+02:00,5,26,23,2008,Violent
6219620,04/29/2008 02:15:00 PM,OTHER OFFENSE,TELEPHONE THREAT,true,false,42,41.781592427,-87.605958468,2008-04-29T14:15:00.000+02:00,4,29,14,2008,Non-Violent
6352652,07/02/2008 09:35:00 AM,NARCOTICS,POSS: CANNABIS 30GMS OR LESS,true,false,69,41.769185486,-87.625732415,2008-07-02T09:35:00.000+02:00,7,2,9,2008,Non-Violent
6382428,07/20/2008 04:00:00 PM,THEFT,POCKET-PICKING,false,false,73,41.722578383,-87.662706548,2008-07-20T16:00:00.000+02:00,7,20,16,2008,Non-Violent
6319481,06/21/2008 10:23:57 PM,MOTOR VEHICLE THEFT,AUTOMOBILE,false,false,67,41.782338838,-87.661845881,2008-06-21T22:23:57.000+02:00,6,21,22,2008,Non-Violent
6371157,07/12/2008 01:10:11 PM,CRIMINAL TRESPASS,TO LAND,true,false,31,41.840293682,-87.665816577,2008-07-12T13:10:11.000+02:00,7,12,13,2008,Non-Violent
6262314,05/20/2008 05:34:57 PM,NARCOTICS,POSS: CANNABIS 30GMS OR LESS,true,false,25,41.887090644,-87.753601709,2008-05-20T17:34:57.000+02:00,5,20,17,2008,Non-Violent
6300911,06/11/2008 10:15:17 PM,BATTERY,SIMPLE,false,false,1,42.00711743,-87.670006581,2008-06-11T22:15:17.000+02:00,6,11,22,2008,Violent
6198252,04/17/2008 11:00:00 AM,ASSAULT,SIMPLE,false,false,50,41.692833841,-87.60431945,2008-04-17T11:00:00.000+02:00,4,17,11,2008,Violent
6206181,04/22/2008 09:45:00 AM,ASSAULT,SIMPLE,false,false,66,41.779598042,-87.70315393,2008-04-22T09:45:00.000+02:00,4,22,9,2008,Violent
6383211,07/20/2008 07:30:00 PM,NARCOTICS,POSS: HEROIN(WHITE),true,false,42,41.778286296,-87.58639962,2008-07-20T19:30:00.000+02:00,7,20,19,2008,Non-Violent
6328241,06/25/2008 09:00:00 PM,BATTERY,SIMPLE,false,false,76,41.984622486,-87.836582104,2008-06-25T21:00:00.000+02:00,6,25,21,2008,Violent
6288633,06/05/2008 06:00:00 PM,THEFT,RETAIL THEFT,false,false,77,41.977370604,-87.655016254,2008-06-05T18:00:00.000+02:00,6,5,18,2008,Non-Violent
6362759,07/13/2008 12:00:00 PM,THEFT,OVER $500,false,false,28,41.87752876,-87.672637252,2008-07-13T12:00:00.000+02:00,7,13,12,2008,Non-Violent
6278801,05/30/2008 06:03:00 PM,CRIMINAL TRESPASS,TO LAND,false,false,53,41.67550077,-87.640727737,2008-05-30T18:03:00.000+02:00,5,30,18,2008,Non-Violent
6264756,05/17/2008 12:53:42 PM,NARCOTICS,POSS: CANNABIS MORE THAN 30GMS,true,false,25,41.880419254,-87.751407336,2008-05-17T12:53:42.000+02:00,5,17,12,2008,Non-Violent
6181139,04/07/2008 03:31:18 PM,BATTERY,SIMPLE,false,false,23,41.895363905,-87.726390989,2008-04-07T15:31:18.000+02:00,4,7,15,2008,Violent
6211685,04/20/2008 02:00:00 AM,DECEPTIVE PRACTICE,ILLEGAL POSSESSION CASH CARD,false,false,8,41.893179585,-87.634686145,2008-04-20T02:00:00.000+02:00,4,20,2,2008,Non-Violent
6271039,05/26/2008 06:41:29 PM,ROBBERY,ARMED: HANDGUN,false,false,1,41.998103671,-87.668264445,2008-05-26T18:41:29.000+02:00,5,26,18,2008,Violent
6179603,04/08/2008 02:20:00 PM,CRIMINAL DAMAGE,TO PROPERTY,false,false,53,41.668239109,-87.630758817,2008-04-08T14:20:00.000+02:00,4,8,14,2008,Non-Violent
6217897,04/23/2008 01:30:00 AM,ROBBERY,ARMED: HANDGUN,false,false,68,41.762874072,-87.647992068,2008-04-23T01:30:00.000+02:00,4,23,1,2008,Violent
6317361,06/17/2008 08:30:00 PM,THEFT,FROM BUILDING,false,true,67,41.786159515,-87.661952684,2008-06-17T20:30:00.000+02:00,6,17,20,2008,Non-Violent
6254364,05/16/2008 11:11:38 PM,BATTERY,DOMESTIC BATTERY SIMPLE,true,true,29,41.860114126,-87.731103885,2008-05-16T23:11:38.000+02:00,5,16,23,2008,Violent
6185177,04/11/2008 07:40:00 AM,OTHER OFFENSE,SEX OFFENDER: FAIL REG NEW ADD,false,false,23,41.899854107,-87.721338189,2008-04-11T07:40:00.000+02:00,4,11,7,2008,Non-Violent
6270406,05/26/2008 03:45:00 PM,BATTERY,SIMPLE,false,false,4,41.96938944,-87.700488807,2008-05-26T15:45:00.000+02:00,5,26,15,2008,Violent
6268399,05/24/2008 01:15:00 AM,CRIMINAL TRESPASS,TO LAND,true,false,14,41.96374427,-87.727904441,2008-05-24T01:15:00.000+02:00,5,24,1,2008,Non-Violent
6357137,07/09/2008 11:00:00 PM,OTHER OFFENSE,HARASSMENT BY TELEPHONE,false,false,70,41.737728829,-87.693340943,2008-07-09T23:00:00.000+02:00,7,9,23,2008,Non-Violent
6167630,03/31/2008 11:15:00 PM,NARCOTICS,POSS: CANNABIS 30GMS OR LESS,true,false,35,41.843892459,-87.622098627,2008-03-31T23:15:00.000+02:00,3,31,23,2008,Non-Violent
6166419,03/31/2008 03:00:00 PM,THEFT,RETAIL THEFT,false,false,8,41.900192266,-87.627248537,2008-03-31T15:00:00.000+02:00,3,31,15,2008,Non-Violent
6319261,06/21/2008 10:00:00 AM,THEFT,$500 AND UNDER,false,false,13,41.980027491,-87.714866777,2008-06-21T10:00:00.000+02:00,6,21,10,2008,Non-Violent
6378968,07/18/2008 01:00:00 PM,THEFT,OVER $500,false,false,32,41.88030381,-87.636978269,2008-07-18T13:00:00.000+02:00,7,18,13,2008,Non-Violent
6306114,06/13/2008 08:00:00 AM,BURGLARY,FORCIBLE ENTRY,false,false,13,41.98577752,-87.710470897,2008-06-13T08:00:00.000+02:00,6,13,8,2008,Non-Violent
6304318,06/14/2008 01:35:00 AM,BATTERY,SIMPLE,false,false,6,41.951058037,-87.643770543,2008-06-14T01:35:00.000+02:00,6,14,1,2008,Violent
6244155,05/12/2008 08:00:00 PM,THEFT,OVER $500,false,false,7,41.920493127,-87.659517524,2008-05-12T20:00:00.000+02:00,5,12,20,2008,Non-Violent
6268698,05/25/2008 01:21:56 AM,CRIMINAL DAMAGE,TO VEHICLE,false,false,43,41.771984027,-87.588723609,2008-05-25T01:21:56.000+02:00,5,25,1,2008,Non-Violent
6326386,06/22/2008 08:50:00 PM,CRIMINAL DAMAGE,TO VEHICLE,false,false,66,41.774472495,-87.701800004,2008-06-22T20:50:00.000+02:00,6,22,20,2008,Non-Violent
6175529,04/06/2008 01:00:00 PM,BATTERY,AGGRAVATED:KNIFE/CUTTING INSTR,false,false,62,41.794571363,-87.725652283,2008-04-06T13:00:00.000+02:00,4,6,13,2008,Violent
6553646,10/14/2008 01:00:00 AM,MOTOR VEHICLE THEFT,AUTOMOBILE,false,false,54,41.651828974,-87.614946936,2008-10-14T01:00:00.000+02:00,10,14,1,2008,Non-Violent
6525896,09/29/2008 10:00:00 AM,THEFT,OVER $500,false,false,8,41.89200132,-87.620239294,2008-09-29T10:00:00.000+02:00,9,29,10,2008,Non-Violent
6522484,09/27/2008 04:09:31 AM,BATTERY,SIMPLE,false,false,6,41.947169937,-87.657692781,2008-09-27T04:09:31.000+02:00,9,27,4,2008,Violent
6548824,10/12/2008 12:00:00 AM,THEFT,$500 AND UNDER,false,false,35,41.83981113,-87.617141911,2008-10-12T00:00:00.000+02:00,10,12,0,2008,Non-Violent
6471096,09/02/2008 11:00:00 PM,CRIMINAL TRESPASS,TO RESIDENCE,false,false,22,41.914940883,-87.70689819,2008-09-02T23:00:00.000+02:00,9,2,23,2008,Non-Violent
6416871,08/07/2008 12:50:00 PM,NARCOTICS,POSS: CANNABIS 30GMS OR LESS,true,false,71,41.732148453,-87.637430415,2008-08-07T12:50:00.000+02:00,8,7,12,2008,Non-Violent
6554178,10/14/2008 02:05:00 PM,ROBBERY,ARMED: HANDGUN,false,false,29,41.863609249,-87.695824373,2008-10-14T14:05:00.000+02:00,10,14,14,2008,Violent
6530672,10/01/2008 02:30:00 PM,THEFT,POCKET-PICKING,false,false,56,41.793922473,-87.774035764,2008-10-01T14:30:00.000+02:00,10,1,14,2008,Non-Violent
6494131,09/12/2008 08:00:00 PM,THEFT,$500 AND UNDER,false,false,39,41.803807415,-87.58208345,2008-09-12T20:00:00.000+02:00,9,12,20,2008,Non-Violent
6387122,07/24/2008 06:30:00 AM,MOTOR VEHICLE THEFT,AUTOMOBILE,false,false,32,41.874508398,-87.627608412,2008-07-24T06:30:00.000+02:00,7,24,6,2008,Non-Violent
6507055,09/19/2008 02:30:00 PM,OTHER OFFENSE,TELEPHONE THREAT,false,false,43,41.756285081,-87.562681923,2008-09-19T14:30:00.000+02:00,9,19,14,2008,Non-Violent
6588973,10/30/2008 06:00:00 PM,ASSAULT,SIMPLE,false,true,25,41.911587412,-87.778946782,2008-10-30T18:00:00.000+02:00,10,30,18,2008,Violent
6532009,09/30/2008 03:05:00 PM,PUBLIC PEACE VIOLATION,MOB ACTION,true,false,42,41.778047465,-87.586387726,2008-09-30T15:05:00.000+02:00,9,30,15,2008,Non-Violent
6523520,09/20/2008 09:00:00 AM,THEFT,FROM BUILDING,false,false,46,41.749072474,-87.557700049,2008-09-20T09:00:00.000+02:00,9,20,9,2008,Non-Violent
6388177,07/23/2008 09:30:00 PM,CRIMINAL DAMAGE,TO PROPERTY,false,true,67,41.7826337,-87.660647519,2008-07-23T21:30:00.000+02:00,7,23,21,2008,Non-Violent
6593378,11/04/2008 09:00:00 PM,MOTOR VEHICLE THEFT,AUTOMOBILE,false,false,23,41.900665737,-87.737386318,2008-11-04T21:00:00.000+02:00,11,4,21,2008,Non-Violent
6599612,11/07/2008 10:31:00 PM,BATTERY,DOMESTIC BATTERY SIMPLE,false,true,26,41.872457773,-87.733723414,2008-11-07T22:31:00.000+02:00,11,7,22,2008,Violent
6386541,07/15/2008 06:50:00 PM,NARCOTICS,POSS: HEROIN(WHITE),true,false,26,41.87327816,-87.738444903,2008-07-15T18:50:00.000+02:00,7,15,18,2008,Non-Violent
6493286,09/12/2008 09:33:00 PM,BURGLARY,FORCIBLE ENTRY,false,false,29,41.862084834,-87.705542133,2008-09-12T21:33:00.000+02:00,9,12,21,2008,Non-Violent
6387661,07/23/2008 04:00:00 PM,OTHER OFFENSE,TELEPHONE THREAT,false,true,40,41.788786066,-87.622315729,2008-07-23T16:00:00.000+02:00,7,23,16,2008,Non-Violent
6576166,10/26/2008 01:05:00 PM,BATTERY,DOMESTIC BATTERY SIMPLE,true,true,27,41.881042431,-87.699602347,2008-10-26T13:05:00.000+02:00,10,26,13,2008,Violent
6582526,10/29/2008 12:00:00 PM,THEFT,POCKET-PICKING,false,false,5,41.94319685,-87.680072014,2008-10-29T12:00:00.000+02:00,10,29,12,2008,Non-Violent
6531085,09/21/2008 05:00:00 AM,CRIM SEXUAL ASSAULT,NON-AGGRAVATED,false,false,5,41.949584572,-87.679929601,2008-09-21T05:00:00.000+02:00,9,21,5,2008,Non-Violent
6525626,09/28/2008 04:50:00 PM,THEFT,RETAIL THEFT,false,false,8,41.910216533,-87.653556471,2008-09-28T16:50:00.000+02:00,9,28,16,2008,Non-Violent
6554377,10/03/2008 10:50:00 PM,PROSTITUTION,SOLICIT ON PUBLIC WAY,true,false,27,41.881476843,-87.698757127,2008-10-03T22:50:00.000+02:00,10,3,22,2008,Non-Violent
6518720,09/24/2008 11:00:00 AM,ROBBERY,ARMED: HANDGUN,false,false,30,41.846580965,-87.724628173,2008-09-24T11:00:00.000+02:00,9,24,11,2008,Violent
6574012,10/24/2008 11:00:00 AM,THEFT,OVER $500,false,false,44,41.744795571,-87.607484247,2008-10-24T11:00:00.000+02:00,10,24,11,2008,Non-Violent
6559103,10/16/2008 09:00:00 PM,MOTOR VEHICLE THEFT,AUTOMOBILE,false,false,28,41.877161446,-87.676536946,2008-10-16T21:00:00.000+02:00,10,16,21,2008,Non-Violent
6478704,09/05/2008 02:00:00 PM,MOTOR VEHICLE THEFT,AUTOMOBILE,false,false,68,41.779655307,-87.651197459,2008-09-05T14:00:00.000+02:00,9,5,14,2008,Non-Violent
6534992,09/27/2008 04:13:00 PM,OTHER OFFENSE,TELEPHONE THREAT,false,false,57,41.803201891,-87.72198373,2008-09-27T16:13:00.000+02:00,9,27,16,2008,Non-Violent
6569557,10/20/2008 01:00:00 PM,DECEPTIVE PRACTICE,CREDIT CARD FRAUD,false,false,51,41.705944829,-87.5620639,2008-10-20T13:00:00.000+02:00,10,20,13,2008,Non-Violent
6435079,08/15/2008 09:40:00 AM,BATTERY,DOMESTIC BATTERY SIMPLE,false,true,69,41.762989807,-87.632152633,2008-08-15T09:40:00.000+02:00,8,15,9,2008,Violent
6536930,10/05/2008 06:00:00 PM,CRIMINAL DAMAGE,TO VEHICLE,false,false,26,41.872461439,-87.733374572,2008-10-05T18:00:00.000+02:00,10,5,18,2008,Non-Violent
6538340,10/05/2008 10:20:00 PM,BATTERY,DOMESTIC BATTERY SIMPLE,false,true,44,41.746945834,-87.605114755,2008-10-05T22:20:00.000+02:00,10,5,22,2008,Violent
6573959,10/24/2008 11:35:00 PM,NARCOTICS,POSS: SYNTHETIC DRUGS,true,false,56,41.795959294,-87.760779136,2008-10-24T23:35:00.000+02:00,10,24,23,2008,Non-Violent
6393012,07/21/2008 03:00:00 PM,OTHER OFFENSE,OTHER VEHICLE OFFENSE,false,false,58,41.828186773,-87.698883753,2008-07-21T15:00:00.000+02:00,7,21,15,2008,Non-Violent
6490564,09/11/2008 10:00:00 AM,BURGLARY,UNLAWFUL ENTRY,false,false,4,41.963903779,-87.676069644,2008-09-11T10:00:00.000+02:00,9,11,10,2008,Non-Violent
6598438,11/04/2008 02:00:00 PM,BURGLARY,FORCIBLE ENTRY,false,false,27,41.8783029,-87.699959894,2008-11-04T14:00:00.000+02:00,11,4,14,2008,Non-Violent
6460366,08/27/2008 04:55:36 PM,BATTERY,DOMESTIC BATTERY SIMPLE,true,true,58,41.817766835,-87.70188475,2008-08-27T16:55:36.000+02:00,8,27,16,2008,Violent
6593838,11/04/2008 08:00:00 PM,MOTOR VEHICLE THEFT,AUTOMOBILE,false,false,46,41.738573994,-87.564824644,2008-11-04T20:00:00.000+02:00,11,4,20,2008,Non-Violent
6578446,10/27/2008 08:00:00 PM,THEFT,$500 AND UNDER,false,false,6,41.943286991,-87.672804205,2008-10-27T20:00:00.000+02:00,10,27,20,2008,Non-Violent
6601154,11/08/2008 12:50:00 AM,CRIMINAL DAMAGE,CRIMINAL DEFACEMENT,false,false,57,41.810670713,-87.71971551,2008-11-08T00:50:00.000+02:00,11,8,0,2008,Non-Violent
6544278,10/09/2008 07:30:00 AM,CRIMINAL DAMAGE,TO VEHICLE,false,false,75,41.689795069,-87.682832528,2008-10-09T07:30:00.000+02:00,10,9,7,2008,Non-Violent
6395039,07/26/2008 04:33:33 PM,BATTERY,DOMESTIC BATTERY SIMPLE,true,true,18,41.933181587,-87.797991845,2008-07-26T16:33:33.000+02:00,7,26,16,2008,Violent
6589030,11/02/2008 06:30:00 PM,BATTERY,SIMPLE,true,false,42,41.774070353,-87.609438208,2008-11-02T18:30:00.000+02:00,11,2,18,2008,Violent
6565020,10/20/2008 08:00:00 AM,THEFT,$500 AND UNDER,false,false,21,41.937751033,-87.720656222,2008-10-20T08:00:00.000+02:00,10,20,8,2008,Non-Violent
6471149,08/30/2008 03:30:00 AM,BURGLARY,ATTEMPT FORCIBLE ENTRY,false,false,31,41.858072086,-87.647831873,2008-08-30T03:30:00.000+02:00,8,30,3,2008,Non-Violent
6454785,08/25/2008 11:30:00 AM,BURGLARY,FORCIBLE ENTRY,false,false,46,41.743786316,-87.557606108,2008-08-25T11:30:00.000+02:00,8,25,11,2008,Non-Violent
6560960,10/17/2008 07:00:00 PM,BURGLARY,FORCIBLE ENTRY,false,false,28,41.867806275,-87.657144993,2008-10-17T19:00:00.000+02:00,10,17,19,2008,Non-Violent
6418552,08/05/2008 09:14:35 AM,DECEPTIVE PRACTICE,THEFT OF LABOR/SERVICES,true,false,27,41.884994578,-87.71733391,2008-08-05T09:14:35.000+02:00,8,5,9,2008,Non-Violent
6573112,10/15/2008 12:10:56 PM,PROSTITUTION,SOLICIT FOR BUSINESS,false,true,29,41.85868766,-87.737522938,2008-10-15T12:10:56.000+02:00,10,15,12,2008,Non-Violent
6398124,07/28/2008 06:14:28 PM,NARCOTICS,POSS: CRACK,true,false,25,41.882235414,-87.765554609,2008-07-28T18:14:28.000+02:00,7,28,18,2008,Non-Violent
6406133,07/31/2008 11:10:00 AM,CRIMINAL DAMAGE,TO PROPERTY,false,false,35,41.845169197,-87.625314164,2008-07-31T11:10:00.000+02:00,7,31,11,2008,Non-Violent
6409607,08/04/2008 07:30:00 PM,MOTOR VEHICLE THEFT,"TRUCK, BUS, MOTOR HOME",false,false,44,41.735857166,-87.624152861,2008-08-04T19:30:00.000+02:00,8,4,19,2008,Non-Violent
6406992,08/02/2008 03:49:02 AM,BATTERY,DOMESTIC BATTERY SIMPLE,false,true,11,41.972493574,-87.756295691,2008-08-02T03:49:02.000+02:00,8,2,3,2008,Violent
6595227,11/05/2008 07:00:00 AM,THEFT,FROM BUILDING,true,false,68,41.783570953,-87.633780059,2008-11-05T07:00:00.000+02:00,11,5,7,2008,Non-Violent
6441707,08/11/2008 07:54:46 PM,NARCOTICS,POSS: CANNABIS 30GMS OR LESS,true,false,68,41.779508069,-87.647210037,2008-08-11T19:54:46.000+02:00,8,11,19,2008,Non-Violent
6384786,07/24/2008 02:25:00 AM,BATTERY,DOMESTIC BATTERY SIMPLE,true,true,22,41.929189918,-87.707585653,2008-07-24T02:25:00.000+02:00,7,24,2,2008,Violent
6523903,09/27/2008 01:45:00 PM,THEFT,RETAIL THEFT,true,false,44,41.73625535,-87.62820806,2008-09-27T13:45:00.000+02:00,9,27,13,2008,Non-Violent
6480008,09/07/2008 12:17:00 AM,BATTERY,DOMESTIC BATTERY SIMPLE,true,true,22,41.920970709,-87.714629021,2008-09-07T00:17:00.000+02:00,9,7,0,2008,Violent
6576790,10/26/2008 04:30:00 PM,ASSAULT,AGGRAVATED: HANDGUN,false,false,30,41.83778843,-87.719489554,2008-10-26T16:30:00.000+02:00,10,26,16,2008,Violent
6425154,08/11/2008 11:00:00 PM,MOTOR VEHICLE THEFT,AUTOMOBILE,false,false,66,41.762134668,-87.68806961,2008-08-11T23:00:00.000+02:00,8,11,23,2008,Non-Violent
6385140,07/21/2008 01:00:00 PM,CRIMINAL DAMAGE,TO PROPERTY,false,false,49,41.710486231,-87.611415565,2008-07-21T13:00:00.000+02:00,7,21,13,2008,Non-Violent
6483140,09/08/2008 06:09:00 AM,THEFT,FROM BUILDING,false,false,43,41.771046097,-87.585017278,2008-09-08T06:09:00.000+02:00,9,8,6,2008,Non-Violent
6452084,08/24/2008 03:40:00 PM,BATTERY,DOMESTIC BATTERY SIMPLE,false,true,60,41.837701156,-87.637741232,2008-08-24T15:40:00.000+02:00,8,24,15,2008,Violent
6465322,08/30/2008 01:10:00 PM,CRIMINAL DAMAGE,TO PROPERTY,true,false,32,41.886012928,-87.629505318,2008-08-30T13:10:00.000+02:00,8,30,13,2008,Non-Violent
6517318,09/24/2008 11:10:00 PM,BATTERY,DOMESTIC BATTERY SIMPLE,false,true,26,41.882027029,-87.726939525,2008-09-24T23:10:00.000+02:00,9,24,23,2008,Violent
6435220,08/16/2008 02:24:00 AM,BATTERY,AGGRAVATED: HANDGUN,false,false,66,41.776781366,-87.696992972,2008-08-16T02:24:00.000+02:00,8,16,2,2008,Violent
6422380,07/30/2008 02:29:00 AM,ROBBERY,ATTEMPT: AGGRAVATED,false,false,21,41.932853053,-87.704999317,2008-07-30T02:29:00.000+02:00,7,30,2,2008,Violent
6497633,09/15/2008 01:25:00 PM,CRIMINAL TRESPASS,TO LAND,true,false,49,41.687047175,-87.630491986,2008-09-15T13:25:00.000+02:00,9,15,13,2008,Non-Violent
6408910,08/03/2008 07:31:02 PM,CRIMINAL TRESPASS,TO LAND,false,false,42,41.782237571,-87.605562528,2008-08-03T19:31:02.000+02:00,8,3,19,2008,Non-Violent
6488655,09/11/2008 03:26:00 AM,NARCOTICS,POSS: CRACK,true,false,24,41.898882295,-87.672262913,2008-09-11T03:26:00.000+02:00,9,11,3,2008,Non-Violent
6459997,08/27/2008 07:43:00 PM,BATTERY,AGGRAVATED: OTHER DANG WEAPON,false,false,57,41.801962834,-87.72586119,2008-08-27T19:43:00.000+02:00,8,27,19,2008,Violent
6560584,10/18/2008 02:31:23 AM,NARCOTICS,POSS: CANNABIS MORE THAN 30GMS,true,false,73,41.724740411,-87.637242945,2008-10-18T02:31:23.000+02:00,10,18,2,2008,Non-Violent
6419431,08/08/2008 05:39:00 PM,DECEPTIVE PRACTICE,FRAUD OR CONFIDENCE GAME,false,false,6,41.946212132,-87.646579678,2008-08-08T17:39:00.000+02:00,8,8,17,2008,Non-Violent
6492815,09/12/2008 04:50:00 PM,NARCOTICS,POSS: HEROIN(WHITE),true,false,38,41.81230738,-87.619674987,2008-09-12T16:50:00.000+02:00,9,12,16,2008,Non-Violent
6493527,09/12/2008 09:00:00 AM,KIDNAPPING,CHILD ABDUCTION/STRANGER,false,false,53,41.677052099,-87.635864574,2008-09-12T09:00:00.000+02:00,9,12,9,2008,Violent
6528842,09/30/2008 09:15:00 AM,ROBBERY,ARMED: HANDGUN,false,false,49,41.704362455,-87.628911856,2008-09-30T09:15:00.000+02:00,9,30,9,2008,Violent
6423876,08/11/2008 09:58:00 AM,ASSAULT,AGGRAVATED: HANDGUN,true,false,51,41.718490825,-87.553778683,2008-08-11T09:58:00.000+02:00,8,11,9,2008,Violent
6455411,08/21/2008 12:00:00 AM,THEFT,$500 AND UNDER,false,false,6,41.937058463,-87.639448474,2008-08-21T00:00:00.000+02:00,8,21,0,2008,Non-Violent
6504840,09/18/2008 12:00:00 PM,THEFT,ATTEMPT FINANCIAL IDENTITY THEFT,false,false,13,41.97445616,-87.714755194,2008-09-18T12:00:00.000+02:00,9,18,12,2008,Non-Violent
6438942,08/18/2008 12:55:00 PM,NARCOTICS,POSS: CANNABIS 30GMS OR LESS,true,false,1,42.002481537,-87.66322629,2008-08-18T12:55:00.000+02:00,8,18,12,2008,Non-Violent
6541348,10/06/2008 11:05:00 AM,BATTERY,AGGRAVATED: OTHER DANG WEAPON,false,false,46,41.751173846,-87.569878279,2008-10-06T11:05:00.000+02:00,10,6,11,2008,Violent
6442662,08/16/2008 04:00:00 PM,BURGLARY,FORCIBLE ENTRY,false,false,22,41.925580377,-87.697434656,2008-08-16T16:00:00.000+02:00,8,16,16,2008,Non-Violent
6429027,08/07/2008 05:30:00 PM,THEFT,FROM BUILDING,false,false,8,41.893223483,-87.63153437,2008-08-07T17:30:00.000+02:00,8,7,17,2008,Non-Violent
6531318,10/01/2008 05:00:11 PM,BATTERY,SIMPLE,false,false,68,41.794172746,-87.632080565,2008-10-01T17:00:11.000+02:00,10,1,17,2008,Violent
6529641,10/01/2008 09:40:00 AM,CRIMINAL DAMAGE,TO VEHICLE,false,false,77,41.991022897,-87.670030253,2008-10-01T09:40:00.000+02:00,10,1,9,2008,Non-Violent
6503271,09/15/2008 09:00:00 AM,THEFT,OVER $500,false,false,8,41.893376763,-87.621660078,2008-09-15T09:00:00.000+02:00,9,15,9,2008,Non-Violent
6526571,09/28/2008 09:05:00 PM,BATTERY,DOMESTIC BATTERY SIMPLE,false,true,66,41.782207371,-87.699571875,2008-09-28T21:05:00.000+02:00,9,28,21,2008,Violent
6440656,08/15/2008 12:59:00 PM,ASSAULT,SIMPLE,true,false,71,41.746403307,-87.653627313,2008-08-15T12:59:00.000+02:00,8,15,12,2008,Violent
6456154,08/07/2008 03:00:00 PM,DECEPTIVE PRACTICE,CREDIT CARD FRAUD,false,false,71,41.738621501,-87.657061954,2008-08-07T15:00:00.000+02:00,8,7,15,2008,Non-Violent
6543947,10/08/2008 09:15:00 PM,ASSAULT,AGGRAVATED: OTHER DANG WEAPON,false,false,62,41.787568912,-87.718102455,2008-10-08T21:15:00.000+02:00,10,8,21,2008,Violent
6543281,10/08/2008 11:40:00 PM,BATTERY,DOMESTIC BATTERY SIMPLE,false,true,14,41.96194719,-87.715611558,2008-10-08T23:40:00.000+02:00,10,8,23,2008,Violent
6478149,09/03/2008 07:00:00 PM,THEFT,OVER $500,false,false,24,41.90840497,-87.69608055,2008-09-03T19:00:00.000+02:00,9,3,19,2008,Non-Violent
6456477,08/21/2008 10:30:00 PM,THEFT,FROM BUILDING,false,true,71,41.738807382,-87.63763333,2008-08-21T22:30:00.000+02:00,8,21,22,2008,Non-Violent
6497939,09/15/2008 03:45:00 AM,BATTERY,SIMPLE,true,false,36,,,2008-09-15T03:45:00.000+02:00,9,15,3,2008,Violent
6469655,09/01/2008 12:40:00 AM,BATTERY,SIMPLE,false,false,14,41.964667506,-87.721398534,2008-09-01T00:40:00.000+02:00,9,1,0,2008,Violent
6408771,07/30/2008 09:45:00 PM,CRIMINAL DAMAGE,TO VEHICLE,false,false,66,41.769217319,-87.68458948,2008-07-30T21:45:00.000+02:00,7,30,21,2008,Non-Violent
6504666,09/17/2008 11:32:00 AM,ASSAULT,SIMPLE,false,false,42,41.78210152,-87.586502002,2008-09-17T11:32:00.000+02:00,9,17,11,2008,Violent
6574571,10/24/2008 02:32:13 PM,BATTERY,SIMPLE,false,false,29,41.860092075,-87.727433141,2008-10-24T14:32:13.000+02:00,10,24,14,2008,Violent
6578305,10/27/2008 08:10:00 PM,DECEPTIVE PRACTICE,STOLEN PROP: BUY/RECEIVE/POS.,true,false,33,41.854271827,-87.624857731,2008-10-27T20:10:00.000+02:00,10,27,20,2008,Non-Violent
6525375,09/22/2008 08:40:15 PM,NARCOTICS,POSS: CRACK,true,false,25,41.883374107,-87.761648233,2008-09-22T20:40:15.000+02:00,9,22,20,2008,Non-Violent
6530281,09/22/2008 12:00:00 PM,THEFT,FINANCIAL ID THEFT: OVER $300,false,false,16,41.946346548,-87.729579871,2008-09-22T12:00:00.000+02:00,9,22,12,2008,Non-Violent
6397471,07/25/2008 08:45:00 PM,OTHER OFFENSE,FALSE/STOLEN/ALTERED TRP,false,false,30,41.846587079,-87.727861541,2008-07-25T20:45:00.000+02:00,7,25,20,2008,Non-Violent
6541342,10/06/2008 03:20:02 PM,BATTERY,DOMESTIC BATTERY SIMPLE,false,true,40,41.794325001,-87.624693192,2008-10-06T15:20:02.000+02:00,10,6,15,2008,Violent
6493548,09/09/2008 09:15:00 PM,PROSTITUTION,SOLICIT FOR BUSINESS,true,false,26,41.880248772,-87.740609221,2008-09-09T21:15:00.000+02:00,9,9,21,2008,Non-Violent
6594833,11/05/2008 01:45:00 PM,NARCOTICS,FOUND SUSPECT NARCOTICS,true,false,1,42.009035303,-87.670902851,2008-11-05T13:45:00.000+02:00,11,5,13,2008,Non-Violent
6414867,08/07/2008 08:45:00 AM,ASSAULT,AGGRAVATED: HANDGUN,false,false,24,41.908414019,-87.695239179,2008-08-07T08:45:00.000+02:00,8,7,8,2008,Violent
6582915,10/30/2008 03:00:00 AM,BATTERY,DOMESTIC BATTERY SIMPLE,false,true,61,41.802287382,-87.662371172,2008-10-30T03:00:00.000+02:00,10,30,3,2008,Violent
6457234,08/26/2008 05:58:43 PM,THEFT,FROM BUILDING,false,false,38,41.805178409,-87.621107528,2008-08-26T17:58:43.000+02:00,8,26,17,2008,Non-Violent
6474892,09/03/2008 11:50:00 AM,CRIMINAL TRESPASS,TO LAND,true,false,60,41.823404728,-87.649827084,2008-09-03T11:50:00.000+02:00,9,3,11,2008,Non-Violent
6509948,09/21/2008 12:00:00 PM,THEFT,OVER $500,false,false,17,41.938346644,-87.784136345,2008-09-21T12:00:00.000+02:00,9,21,12,2008,Non-Violent
6444329,08/20/2008 11:00:00 AM,THEFT,OVER $500,false,false,19,41.916910389,-87.74781692,2008-08-20T11:00:00.000+02:00,8,20,11,2008,Non-Violent
6453880,08/24/2008 01:56:18 PM,NARCOTICS,POSS: CANNABIS 30GMS OR LESS,true,false,43,41.757788194,-87.584562913,2008-08-24T13:56:18.000+02:00,8,24,13,2008,Non-Violent
6441238,08/15/2008 12:00:00 AM,BURGLARY,FORCIBLE ENTRY,false,false,56,41.798770338,-87.786881039,2008-08-15T00:00:00.000+02:00,8,15,0,2008,Non-Violent
6462929,08/24/2008 11:40:00 AM,BATTERY,DOMESTIC BATTERY SIMPLE,false,true,71,41.748495383,-87.666427608,2008-08-24T11:40:00.000+02:00,8,24,11,2008,Violent
6472538,09/02/2008 10:00:00 AM,CRIMINAL DAMAGE,TO PROPERTY,false,true,43,41.756496183,-87.55289378,2008-09-02T10:00:00.000+02:00,9,2,10,2008,Non-Violent
6573204,10/21/2008 05:00:00 PM,BATTERY,SIMPLE,false,false,67,41.761239082,-87.666753832,2008-10-21T17:00:00.000+02:00,10,21,17,2008,Violent
6535015,10/02/2008 04:58:28 PM,BATTERY,DOMESTIC BATTERY SIMPLE,true,true,40,41.782881146,-87.623774252,2008-10-02T16:58:28.000+02:00,10,2,16,2008,Violent
6524579,09/28/2008 08:25:36 PM,ROBBERY,ARMED: HANDGUN,false,false,43,41.758273773,-87.554811094,2008-09-28T20:25:36.000+02:00,9,28,20,2008,Violent
6529748,09/27/2008 10:00:00 PM,THEFT,FROM BUILDING,false,false,24,41.9110516,-87.700264477,2008-09-27T22:00:00.000+02:00,9,27,22,2008,Non-Violent
6424663,04/07/2008 07:00:00 AM,BURGLARY,UNLAWFUL ENTRY,false,false,54,41.654666979,-87.615881443,2008-04-07T07:00:00.000+02:00,4,7,7,2008,Non-Violent
6401773,07/29/2008 10:31:06 PM,NARCOTICS,POSS: CANNABIS 30GMS OR LESS,true,false,25,41.894945791,-87.754911705,2008-07-29T22:31:06.000+02:00,7,29,22,2008,Non-Violent
6576574,10/25/2008 09:00:00 PM,BURGLARY,FORCIBLE ENTRY,false,false,46,41.730087889,-87.550491518,2008-10-25T21:00:00.000+02:00,10,25,21,2008,Non-Violent
6436195,08/15/2008 08:45:00 PM,CRIMINAL DAMAGE,TO VEHICLE,false,false,21,41.94460841,-87.723152602,2008-08-15T20:45:00.000+02:00,8,15,20,2008,Non-Violent
6508987,09/15/2008 10:30:00 PM,ASSAULT,SIMPLE,false,false,23,41.892669786,-87.710131236,2008-09-15T22:30:00.000+02:00,9,15,22,2008,Violent
6567831,10/21/2008 12:37:13 AM,NARCOTICS,POSS: CRACK,true,false,25,41.882803164,-87.763276458,2008-10-21T00:37:13.000+02:00,10,21,0,2008,Non-Violent
6558610,10/17/2008 06:30:00 AM,CRIMINAL DAMAGE,TO VEHICLE,false,false,24,41.910334687,-87.686358785,2008-10-17T06:30:00.000+02:00,10,17,6,2008,Non-Violent
6556351,10/15/2008 04:00:00 PM,BATTERY,DOMESTIC BATTERY SIMPLE,true,true,24,41.907266717,-87.695695116,2008-10-15T16:00:00.000+02:00,10,15,16,2008,Violent
6559320,10/16/2008 04:14:00 PM,BATTERY,SIMPLE,true,false,20,41.923617669,-87.726744292,2008-10-16T16:14:00.000+02:00,10,16,16,2008,Violent
6449490,08/22/2008 05:00:00 PM,MOTOR VEHICLE THEFT,AUTOMOBILE,false,false,66,41.776857254,-87.68601563,2008-08-22T17:00:00.000+02:00,8,22,17,2008,Non-Violent
6517278,09/24/2008 09:50:00 PM,NARCOTICS,POSS: CANNABIS 30GMS OR LESS,true,false,73,41.708280992,-87.642870023,2008-09-24T21:50:00.000+02:00,9,24,21,2008,Non-Violent
6408107,08/02/2008 01:09:54 PM,DECEPTIVE PRACTICE,UNLAWFUL USE OF RECORDED SOUND,false,false,60,41.833522986,-87.646171108,2008-08-02T13:09:54.000+02:00,8,2,13,2008,Non-Violent
6477496,03/11/2008 04:00:00 PM,BURGLARY,ATTEMPT FORCIBLE ENTRY,false,false,77,41.996345992,-87.663305376,2008-03-11T16:00:00.000+02:00,3,11,16,2008,Non-Violent
6568008,10/21/2008 04:00:00 AM,CRIMINAL DAMAGE,TO PROPERTY,false,false,66,41.776464448,-87.69576427,2008-10-21T04:00:00.000+02:00,10,21,4,2008,Non-Violent
6602157,11/10/2008 02:46:51 AM,THEFT,OVER $500,false,false,46,41.7476947,-87.554030122,2008-11-10T02:46:51.000+02:00,11,10,2,2008,Non-Violent
6401331,07/18/2008 10:55:29 PM,NARCOTICS,POSS: CANNABIS 30GMS OR LESS,true,false,66,41.78591045,-87.705757818,2008-07-18T22:55:29.000+02:00,7,18,22,2008,Non-Violent
6439583,08/18/2008 01:04:01 PM,ASSAULT,SIMPLE,false,true,25,41.898646321,-87.74920328,2008-08-18T13:04:01.000+02:00,8,18,13,2008,Violent
6511399,09/19/2008 03:30:00 PM,BURGLARY,FORCIBLE ENTRY,false,false,38,41.820248497,-87.616020877,2008-09-19T15:30:00.000+02:00,9,19,15,2008,Non-Violent
6578601,10/27/2008 05:00:00 PM,THEFT,OVER $500,false,false,5,41.96082283,-87.683440047,2008-10-27T17:00:00.000+02:00,10,27,17,2008,Non-Violent
6483534,09/08/2008 10:30:00 AM,THEFT,OVER $500,false,false,28,41.86859692,-87.677065194,2008-09-08T10:30:00.000+02:00,9,8,10,2008,Non-Violent
6469832,09/01/2008 06:40:00 PM,NARCOTICS,POSS: CANNABIS 30GMS OR LESS,true,false,29,41.858326942,-87.723694525,2008-09-01T18:40:00.000+02:00,9,1,18,2008,Non-Violent
6389913,07/26/2008 03:30:00 AM,THEFT,PURSE-SNATCHING,false,false,6,41.951654108,-87.654458166,2008-07-26T03:30:00.000+02:00,7,26,3,2008,Non-Violent
6419816,08/06/2008 04:45:21 PM,BATTERY,SIMPLE,false,false,67,41.792714503,-87.677916836,2008-08-06T16:45:21.000+02:00,8,6,16,2008,Violent
6478226,09/04/2008 01:00:00 PM,BATTERY,SIMPLE,false,false,19,41.918714522,-87.765536325,2008-09-04T13:00:00.000+02:00,9,4,13,2008,Violent
6553005,10/11/2008 10:13:20 PM,BATTERY,DOMESTIC BATTERY SIMPLE,false,true,1,42.013167042,-87.663636658,2008-10-11T22:13:20.000+02:00,10,11,22,2008,Violent
6532207,10/02/2008 03:50:00 PM,NARCOTICS,POSS: CANNABIS 30GMS OR LESS,true,false,36,41.829538814,-87.607004696,2008-10-02T15:50:00.000+02:00,10,2,15,2008,Non-Violent
6595769,11/03/2008 10:00:00 AM,BURGLARY,FORCIBLE ENTRY,false,false,53,41.67974531,-87.63152322,2008-11-03T10:00:00.000+02:00,11,3,10,2008,Non-Violent
6500169,08/15/2008 03:28:00 PM,NARCOTICS,POSS: CANNABIS 30GMS OR LESS,true,false,71,41.751928332,-87.644077264,2008-08-15T15:28:00.000+02:00,8,15,15,2008,Non-Violent
6455132,08/23/2008 01:00:00 PM,BATTERY,SIMPLE,false,false,26,41.879753885,-87.726248634,2008-08-23T13:00:00.000+02:00,8,23,13,2008,Violent
6573677,10/20/2008 02:00:00 AM,THEFT,OVER $500,false,false,69,41.768310521,-87.624917247,2008-10-20T02:00:00.000+02:00,10,20,2,2008,Non-Violent
6519313,09/11/2008 12:15:00 AM,THEFT,FINANCIAL ID THEFT:$300 &UNDER,false,false,43,41.765113713,-87.590210613,2008-09-11T00:15:00.000+02:00,9,11,0,2008,Non-Violent
6578068,10/27/2008 03:20:00 PM,CRIMINAL TRESPASS,TO STATE SUP LAND,true,false,68,41.790822539,-87.636231441,2008-10-27T15:20:00.000+02:00,10,27,15,2008,Non-Violent
6470083,09/01/2008 02:24:00 AM,BATTERY,DOMESTIC BATTERY SIMPLE,false,true,70,41.747810548,-87.713197929,2008-09-01T02:24:00.000+02:00,9,1,2,2008,Violent
6427301,08/09/2008 03:00:00 AM,BATTERY,AGGRAVATED: OTHER DANG WEAPON,false,false,60,41.837568166,-87.647111303,2008-08-09T03:00:00.000+02:00,8,9,3,2008,Violent
6419631,08/08/2008 06:30:00 PM,THEFT,RETAIL THEFT,false,false,49,41.693421344,-87.620983384,2008-08-08T18:30:00.000+02:00,8,8,18,2008,Non-Violent
6542218,07/24/2008 01:30:00 PM,THEFT,FINANCIAL ID THEFT: OVER $300,false,false,68,41.780811561,-87.650888224,2008-07-24T13:30:00.000+02:00,7,24,13,2008,Non-Violent
6531174,09/30/2008 10:15:00 AM,THEFT,FROM BUILDING,false,false,22,41.919443453,-87.685017505,2008-09-30T10:15:00.000+02:00,9,30,10,2008,Non-Violent
6404065,07/30/2008 08:30:00 PM,BURGLARY,UNLAWFUL ENTRY,false,false,16,41.954744622,-87.717839147,2008-07-30T20:30:00.000+02:00,7,30,20,2008,Non-Violent
6561527,10/17/2008 07:11:37 PM,NARCOTICS,FORFEIT PROPERTY,true,false,71,41.749693621,-87.663421189,2008-10-17T19:11:37.000+02:00,10,17,19,2008,Non-Violent
6440453,08/15/2008 03:40:00 PM,NARCOTICS,POSS: HEROIN(WHITE),true,false,38,41.816074957,-87.621394006,2008-08-15T15:40:00.000+02:00,8,15,15,2008,Non-Violent
6413007,08/05/2008 09:44:21 AM,ASSAULT,AGGRAVATED: HANDGUN,false,false,49,41.687119818,-87.624446734,2008-08-05T09:44:21.000+02:00,8,5,9,2008,Violent
6387901,07/21/2008 10:05:00 PM,BATTERY,DOMESTIC BATTERY SIMPLE,false,true,24,41.905414199,-87.683429223,2008-07-21T22:05:00.000+02:00,7,21,22,2008,Violent
6495899,09/11/2008 04:00:00 PM,CRIMINAL DAMAGE,TO VEHICLE,false,false,72,41.728187264,-87.66686482,2008-09-11T16:00:00.000+02:00,9,11,16,2008,Non-Violent
6578698,10/27/2008 07:13:32 PM,BATTERY,DOMESTIC BATTERY SIMPLE,false,true,39,41.809297059,-87.591967028,2008-10-27T19:13:32.000+02:00,10,27,19,2008,Violent
6558361,10/15/2008 10:00:00 AM,ASSAULT,SIMPLE,false,true,51,41.698685517,-87.560751861,2008-10-15T10:00:00.000+02:00,10,15,10,2008,Violent
6531616,09/29/2008 08:00:00 AM,CRIMINAL DAMAGE,TO VEHICLE,false,false,9,42.008509297,-87.820037346,2008-09-29T08:00:00.000+02:00,9,29,8,2008,Non-Violent
6460964,08/28/2008 01:17:43 AM,LIQUOR LAW VIOLATION,ILLEGAL CONSUMPTION BY MINOR,true,false,19,41.931829008,-87.758878417,2008-08-28T01:17:43.000+02:00,8,28,1,2008,Non-Violent
6575632,10/25/2008 02:00:00 PM,THEFT,OVER $500,false,false,32,41.881526212,-87.630869196,2008-10-25T14:00:00.000+02:00,10,25,14,2008,Non-Violent
6511646,09/22/2008 08:00:00 AM,THEFT,POCKET-PICKING,false,false,6,41.943647189,-87.663923587,2008-09-22T08:00:00.000+02:00,9,22,8,2008,Non-Violent
6547685,10/10/2008 03:00:00 PM,BATTERY,SIMPLE,false,false,19,41.932963282,-87.776328777,2008-10-10T15:00:00.000+02:00,10,10,15,2008,Violent
6483747,09/08/2008 12:00:00 PM,THEFT,$500 AND UNDER,false,false,28,41.886790586,-87.675505517,2008-09-08T12:00:00.000+02:00,9,8,12,2008,Non-Violent
6454750,08/22/2008 02:00:00 AM,CRIMINAL DAMAGE,TO PROPERTY,false,false,29,41.865619703,-87.723933633,2008-08-22T02:00:00.000+02:00,8,22,2,2008,Non-Violent
6583055,10/29/2008 07:20:00 PM,BATTERY,DOMESTIC BATTERY SIMPLE,true,true,42,41.780396105,-87.606855588,2008-10-29T19:20:00.000+02:00,10,29,19,2008,Violent
6483658,09/07/2008 04:10:00 PM,THEFT,RETAIL THEFT,true,false,32,41.882394062,-87.627844798,2008-09-07T16:10:00.000+02:00,9,7,16,2008,Non-Violent
6584836,10/22/2008 07:04:00 PM,THEFT,$500 AND UNDER,false,false,74,41.691314623,-87.717043381,2008-10-22T19:04:00.000+02:00,10,22,19,2008,Non-Violent
6516469,09/19/2008 04:40:00 PM,ROBBERY,STRONGARM - NO WEAPON,true,false,26,41.881226517,-87.728133201,2008-09-19T16:40:00.000+02:00,9,19,16,2008,Violent
6410064,08/01/2008 11:30:00 AM,BURGLARY,UNLAWFUL ENTRY,false,false,30,41.837787951,-87.725592228,2008-08-01T11:30:00.000+02:00,8,1,11,2008,Non-Violent
6440570,08/18/2008 07:00:00 AM,BURGLARY,UNLAWFUL ENTRY,false,false,25,41.906214076,-87.768225966,2008-08-18T07:00:00.000+02:00,8,18,7,2008,Non-Violent
6441063,08/17/2008 09:59:00 AM,BURGLARY,HOME INVASION,true,false,23,41.899792368,-87.734613808,2008-08-17T09:59:00.000+02:00,8,17,9,2008,Non-Violent
6415998,08/06/2008 06:30:00 PM,ASSAULT,SIMPLE,false,false,48,41.732527364,-87.563456906,2008-08-06T18:30:00.000+02:00,8,6,18,2008,Violent
6545095,09/07/2008 11:00:00 PM,CRIMINAL DAMAGE,TO VEHICLE,false,false,52,41.694653213,-87.52823831,2008-09-07T23:00:00.000+02:00,9,7,23,2008,Non-Violent
6558866,10/17/2008 04:18:00 AM,ASSAULT,AGGRAVATED: HANDGUN,true,true,38,41.802815125,-87.610053672,2008-10-17T04:18:00.000+02:00,10,17,4,2008,Violent
6433223,08/15/2008 12:05:00 AM,ASSAULT,AGGRAVATED: HANDGUN,true,false,69,41.7672742,-87.594151905,2008-08-15T00:05:00.000+02:00,8,15,0,2008,Violent
6432122,08/14/2008 07:15:00 PM,ASSAULT,AGGRAVATED:KNIFE/CUTTING INSTR,true,true,49,41.691663673,-87.62432362,2008-08-14T19:15:00.000+02:00,8,14,19,2008,Violent
6541553,10/02/2008 12:01:00 AM,BURGLARY,FORCIBLE ENTRY,false,false,26,41.876107914,-87.731155708,2008-10-02T00:01:00.000+02:00,10,2,0,2008,Non-Violent
6494744,09/13/2008 01:30:00 PM,MOTOR VEHICLE THEFT,"TRUCK, BUS, MOTOR HOME",false,false,61,41.818310905,-87.650673661,2008-09-13T13:30:00.000+02:00,9,13,13,2008,Non-Violent
6599101,11/07/2008 02:20:00 PM,OTHER OFFENSE,HARASSMENT BY TELEPHONE,false,true,30,41.843281635,-87.695171094,2008-11-07T14:20:00.000+02:00,11,7,14,2008,Non-Violent
6484579,07/05/2008 08:30:00 AM,BATTERY,DOMESTIC BATTERY SIMPLE,false,true,43,41.762173747,-87.576213575,2008-07-05T08:30:00.000+02:00,7,5,8,2008,Violent
6544673,10/01/2008 02:57:00 PM,BATTERY,SIMPLE,false,false,39,41.816879397,-87.600937037,2008-10-01T14:57:00.000+02:00,10,1,14,2008,Violent
6400530,07/30/2008 05:00:00 PM,CRIMINAL DAMAGE,TO VEHICLE,false,false,14,41.962900789,-87.717396647,2008-07-30T17:00:00.000+02:00,7,30,17,2008,Non-Violent
6533559,10/03/2008 09:00:00 AM,THEFT,OVER $500,false,false,22,41.91678288,-87.672732211,2008-10-03T09:00:00.000+02:00,10,3,9,2008,Non-Violent
6531509,10/01/2008 11:45:00 PM,CRIMINAL DAMAGE,TO PROPERTY,false,true,67,41.776648266,-87.676273015,2008-10-01T23:45:00.000+02:00,10,1,23,2008,Non-Violent
6445850,08/21/2008 01:14:53 AM,NARCOTICS,POSS: CRACK,true,false,25,41.884751129,-87.752778215,2008-08-21T01:14:53.000+02:00,8,21,1,2008,Non-Violent
6507937,09/17/2008 12:35:00 PM,THEFT,RETAIL THEFT,false,false,71,41.750490827,-87.654302474,2008-09-17T12:35:00.000+02:00,9,17,12,2008,Non-Violent
6588858,10/31/2008 08:00:00 PM,THEFT,OVER $500,false,false,31,41.859720099,-87.646698312,2008-10-31T20:00:00.000+02:00,10,31,20,2008,Non-Violent
6517358,09/24/2008 09:15:00 PM,CRIMINAL DAMAGE,TO PROPERTY,false,false,3,41.965836398,-87.657752976,2008-09-24T21:15:00.000+02:00,9,24,21,2008,Non-Violent
6520432,09/25/2008 06:30:00 AM,BURGLARY,FORCIBLE ENTRY,false,false,14,41.969308219,-87.739210676,2008-09-25T06:30:00.000+02:00,9,25,6,2008,Non-Violent
6457271,08/24/2008 01:53:18 AM,NARCOTICS,POSS: CRACK,true,false,49,41.686568379,-87.632529085,2008-08-24T01:53:18.000+02:00,8,24,1,2008,Non-Violent
6570472,09/18/2008 09:32:00 AM,THEFT,OVER $500,false,false,73,41.722578383,-87.662706548,2008-09-18T09:32:00.000+02:00,9,18,9,2008,Non-Violent
6396076,07/15/2008 06:00:00 PM,THEFT,$500 AND UNDER,false,false,43,41.765997737,-87.564409477,2008-07-15T18:00:00.000+02:00,7,15,18,2008,Non-Violent
6442210,08/19/2008 05:40:00 PM,THEFT,RETAIL THEFT,true,false,61,41.808659638,-87.660969527,2008-08-19T17:40:00.000+02:00,8,19,17,2008,Non-Violent
6595246,11/05/2008 07:00:00 PM,THEFT,$500 AND UNDER,false,false,4,41.981325621,-87.693360542,2008-11-05T19:00:00.000+02:00,11,5,19,2008,Non-Violent
6576412,10/26/2008 10:04:00 PM,CRIMINAL TRESPASS,TO STATE SUP LAND,true,false,28,41.861559271,-87.65976218,2008-10-26T22:04:00.000+02:00,10,26,22,2008,Non-Violent
6449737,08/22/2008 05:30:00 AM,BATTERY,AGGRAVATED: OTHER DANG WEAPON,false,false,8,41.892841858,-87.617721411,2008-08-22T05:30:00.000+02:00,8,22,5,2008,Violent
6418129,08/07/2008 09:00:00 PM,ROBBERY,STRONGARM - NO WEAPON,false,false,43,41.770839645,-87.589568991,2008-08-07T21:00:00.000+02:00,8,7,21,2008,Violent
6593489,11/01/2008 11:15:00 PM,ROBBERY,ARMED: HANDGUN,false,false,44,41.736422269,-87.604815966,2008-11-01T23:15:00.000+02:00,11,1,23,2008,Violent
6385326,07/22/2008 03:50:00 PM,BURGLARY,FORCIBLE ENTRY,false,false,42,41.775838146,-87.614319946,2008-07-22T15:50:00.000+02:00,7,22,15,2008,Non-Violent
6598777,10/30/2008 10:15:00 PM,NARCOTICS,POSS: HEROIN(WHITE),true,false,23,41.890345817,-87.723496676,2008-10-30T22:15:00.000+02:00,10,30,22,2008,Non-Violent
6527649,09/28/2008 06:00:00 PM,CRIMINAL TRESPASS,TO LAND,true,false,68,41.769661943,-87.644525308,2008-09-28T18:00:00.000+02:00,9,28,18,2008,Non-Violent
6491413,09/10/2008 04:00:00 PM,ASSAULT,SIMPLE,false,false,46,41.743363357,-87.546658674,2008-09-10T16:00:00.000+02:00,9,10,16,2008,Violent
6590010,11/02/2008 08:10:00 PM,ASSAULT,AGGRAVATED: HANDGUN,false,false,68,41.78656651,-87.637648911,2008-11-02T20:10:00.000+02:00,11,2,20,2008,Violent
6390140,07/25/2008 07:08:25 PM,THEFT,OVER $500,false,false,18,41.926404101,-87.792881805,2008-07-25T19:08:25.000+02:00,7,25,19,2008,Non-Violent
6420614,08/09/2008 10:00:00 AM,THEFT,OVER $500,false,false,24,41.911897031,-87.681177485,2008-08-09T10:00:00.000+02:00,8,9,10,2008,Non-Violent
6554897,10/08/2008 11:33:45 PM,NARCOTICS,POSS: HALLUCINOGENS,true,false,66,41.778638613,-87.686071041,2008-10-08T23:33:45.000+02:00,10,8,23,2008,Non-Violent
6535992,10/04/2008 12:45:08 AM,CRIM SEXUAL ASSAULT,NON-AGGRAVATED,false,false,69,41.762990673,-87.630946706,2008-10-04T00:45:08.000+02:00,10,4,0,2008,Non-Violent
6434330,08/15/2008 09:00:00 AM,MOTOR VEHICLE THEFT,AUTOMOBILE,false,false,61,41.808147803,-87.664961971,2008-08-15T09:00:00.000+02:00,8,15,9,2008,Non-Violent
6570643,10/17/2008 09:30:00 AM,BURGLARY,FORCIBLE ENTRY,false,false,44,41.747009664,-87.602633174,2008-10-17T09:30:00.000+02:00,10,17,9,2008,Non-Violent
6463770,08/28/2008 12:00:00 PM,BURGLARY,UNLAWFUL ENTRY,false,false,22,41.920433854,-87.677721138,2008-08-28T12:00:00.000+02:00,8,28,12,2008,Non-Violent
6396884,07/28/2008 08:00:00 PM,THEFT,$500 AND UNDER,false,false,12,41.994840497,-87.748339201,2008-07-28T20:00:00.000+02:00,7,28,20,2008,Non-Violent
6507158,09/19/2008 11:45:00 PM,ASSAULT,AGGRAVATED: HANDGUN,false,false,22,41.916293095,-87.699272091,2008-09-19T23:45:00.000+02:00,9,19,23,2008,Violent
6480974,09/05/2008 12:00:00 PM,ASSAULT,PRO EMP HANDS NO/MIN INJURY,false,false,44,41.743553697,-87.609865368,2008-09-05T12:00:00.000+02:00,9,5,12,2008,Violent
6391091,07/26/2008 04:40:00 PM,ASSAULT,SIMPLE,true,false,22,41.931016798,-87.689086161,2008-07-26T16:40:00.000+02:00,7,26,16,2008,Violent
6470492,08/31/2008 01:00:00 AM,THEFT,FROM BUILDING,false,false,49,41.734932471,-87.633124701,2008-08-31T01:00:00.000+02:00,8,31,1,2008,Non-Violent
6420904,08/09/2008 09:00:00 PM,MOTOR VEHICLE THEFT,AUTOMOBILE,false,false,41,41.802356856,-87.597526492,2008-08-09T21:00:00.000+02:00,8,9,21,2008,Non-Violent
6468029,08/30/2008 09:58:13 PM,BATTERY,SIMPLE,false,false,15,41.960674821,-87.751512298,2008-08-30T21:58:13.000+02:00,8,30,21,2008,Violent
6539058,10/06/2008 10:30:00 PM,CRIMINAL DAMAGE,TO VEHICLE,false,false,49,41.719564726,-87.614086803,2008-10-06T22:30:00.000+02:00,10,6,22,2008,Non-Violent
6440187,08/18/2008 08:20:00 PM,CRIMINAL DAMAGE,TO VEHICLE,false,false,67,41.782432685,-87.664290466,2008-08-18T20:20:00.000+02:00,8,18,20,2008,Non-Violent
6406429,07/31/2008 01:50:00 AM,ROBBERY,STRONGARM - NO WEAPON,true,false,30,41.851921529,-87.693862951,2008-07-31T01:50:00.000+02:00,7,31,1,2008,Violent
6584417,10/30/2008 08:45:00 PM,NARCOTICS,POSS: CANNABIS 30GMS OR LESS,true,false,25,41.88290449,-87.758828452,2008-10-30T20:45:00.000+02:00,10,30,20,2008,Non-Violent
6436042,08/16/2008 10:00:00 PM,CRIMINAL DAMAGE,TO PROPERTY,false,true,49,41.707023298,-87.634566576,2008-08-16T22:00:00.000+02:00,8,16,22,2008,Non-Violent
6439573,08/19/2008 03:15:00 AM,CRIMINAL DAMAGE,TO VEHICLE,false,false,23,41.910007254,-87.715601921,2008-08-19T03:15:00.000+02:00,8,19,3,2008,Non-Violent
6466848,08/31/2008 05:00:00 PM,MOTOR VEHICLE THEFT,AUTOMOBILE,false,false,28,41.880420133,-87.651331272,2008-08-31T17:00:00.000+02:00,8,31,17,2008,Non-Violent
6478836,09/05/2008 08:55:00 AM,ROBBERY,STRONGARM - NO WEAPON,false,false,1,42.009971584,-87.666253222,2008-09-05T08:55:00.000+02:00,9,5,8,2008,Violent
6428104,08/10/2008 10:20:00 PM,BATTERY,SIMPLE,false,false,69,41.757998728,-87.611455076,2008-08-10T22:20:00.000+02:00,8,10,22,2008,Violent
6598048,11/05/2008 02:20:00 PM,ROBBERY,ARMED:KNIFE/CUTTING INSTRUMENT,false,false,23,41.910646496,-87.730022948,2008-11-05T14:20:00.000+02:00,11,5,14,2008,Violent
6437053,08/16/2008 01:30:00 PM,MOTOR VEHICLE THEFT,"CYCLE, SCOOTER, BIKE W-VIN",false,false,7,41.922932507,-87.636489212,2008-08-16T13:30:00.000+02:00,8,16,13,2008,Non-Violent
6515704,09/22/2008 04:45:00 PM,BATTERY,SIMPLE,false,false,66,41.785950308,-87.693580269,2008-09-22T16:45:00.000+02:00,9,22,16,2008,Violent
6587105,10/31/2008 12:10:00 PM,THEFT,PURSE-SNATCHING,false,false,40,41.789332293,-87.617033022,2008-10-31T12:10:00.000+02:00,10,31,12,2008,Non-Violent
6530617,09/30/2008 06:15:00 PM,DECEPTIVE PRACTICE,THEFT OF LOST/MISLAID PROP,false,false,6,41.947763579,-87.649500126,2008-09-30T18:15:00.000+02:00,9,30,18,2008,Non-Violent
6553790,10/14/2008 07:15:00 PM,THEFT,OVER $500,false,false,67,41.768111862,-87.662690747,2008-10-14T19:15:00.000+02:00,10,14,19,2008,Non-Violent
6515744,09/24/2008 12:51:30 AM,NARCOTICS,POSS: CANNABIS 30GMS OR LESS,true,false,67,41.782004216,-87.672764506,2008-09-24T00:51:30.000+02:00,9,24,0,2008,Non-Violent
6494371,09/13/2008 07:00:00 AM,BATTERY,AGGRAVATED DOMESTIC BATTERY: OTHER DANG WEAPON,false,true,43,41.763968536,-87.590934926,2008-09-13T07:00:00.000+02:00,9,13,7,2008,Violent
6527733,09/08/2008 08:00:00 AM,THEFT,FINANCIAL ID THEFT:$300 &UNDER,false,false,11,41.979008295,-87.763985951,2008-09-08T08:00:00.000+02:00,9,8,8,2008,Non-Violent
6439256,08/11/2008 12:01:00 AM,THEFT,FINANCIAL ID THEFT: OVER $300,false,false,22,41.91466597,-87.684084881,2008-08-11T00:01:00.000+02:00,8,11,0,2008,Non-Violent
6511833,09/21/2008 01:20:00 AM,BATTERY,DOMESTIC BATTERY SIMPLE,false,true,30,41.848117803,-87.706776118,2008-09-21T01:20:00.000+02:00,9,21,1,2008,Violent
6396098,07/26/2008 12:55:00 AM,CRIMINAL DAMAGE,TO VEHICLE,false,false,22,41.928559123,-87.712203782,2008-07-26T00:55:00.000+02:00,7,26,0,2008,Non-Violent
6590973,11/03/2008 02:45:00 PM,NARCOTICS,POSS: CANNABIS 30GMS OR LESS,true,false,49,41.711885298,-87.627229216,2008-11-03T14:45:00.000+02:00,11,3,14,2008,Non-Violent
6447516,08/21/2008 01:02:00 PM,NARCOTICS,POSS: CANNABIS 30GMS OR LESS,true,false,3,41.961796222,-87.653449706,2008-08-21T13:02:00.000+02:00,8,21,13,2008,Non-Violent
6414771,08/06/2008 09:38:00 PM,BATTERY,AGGRAVATED: OTHER DANG WEAPON,true,false,57,41.814876031,-87.731329772,2008-08-06T21:38:00.000+02:00,8,6,21,2008,Violent
6497171,09/11/2008 08:44:29 PM,PROSTITUTION,SOLICIT FOR PROSTITUTE,true,false,30,41.852451849,-87.695465352,2008-09-11T20:44:29.000+02:00,9,11,20,2008,Non-Violent
6477778,09/03/2008 05:30:00 PM,CRIM SEXUAL ASSAULT,AGGRAVATED: HANDGUN,false,false,42,41.776968675,-87.587188476,2008-09-03T17:30:00.000+02:00,9,3,17,2008,Non-Violent
6442580,08/19/2008 09:17:55 PM,ASSAULT,SIMPLE,false,false,4,41.982225522,-87.695297169,2008-08-19T21:17:55.000+02:00,8,19,21,2008,Violent
6452385,08/25/2008 03:00:00 AM,BURGLARY,FORCIBLE ENTRY,false,false,24,41.903775844,-87.667139404,2008-08-25T03:00:00.000+02:00,8,25,3,2008,Non-Violent
6425001,08/05/2008 11:43:56 AM,ASSAULT,AGGRAVATED:KNIFE/CUTTING INSTR,false,true,25,41.898648299,-87.749052662,2008-08-05T11:43:56.000+02:00,8,5,11,2008,Violent
6572350,10/23/2008 10:30:00 AM,CRIMINAL DAMAGE,TO PROPERTY,true,true,53,41.676106425,-87.631540791,2008-10-23T10:30:00.000+02:00,10,23,10,2008,Non-Violent
6393021,07/28/2008 04:45:00 AM,BATTERY,AGGRAVATED PO: OTHER DANG WEAP,true,false,24,41.912127102,-87.68789843,2008-07-28T04:45:00.000+02:00,7,28,4,2008,Violent
6597579,11/04/2008 01:30:00 PM,BATTERY,AGGRAVATED DOMESTIC BATTERY: OTHER DANG WEAPON,false,true,63,41.791116459,-87.702267385,2008-11-04T13:30:00.000+02:00,11,4,13,2008,Violent
6478728,09/03/2008 11:45:00 PM,ROBBERY,AGGRAVATED VEHICULAR HIJACKING,true,false,49,41.694404651,-87.62244812,2008-09-03T23:45:00.000+02:00,9,3,23,2008,Violent
6450761,08/23/2008 08:00:00 PM,NARCOTICS,POSS: CANNABIS 30GMS OR LESS,true,false,26,41.876536548,-87.725526346,2008-08-23T20:00:00.000+02:00,8,23,20,2008,Non-Violent
6509296,09/19/2008 09:00:00 AM,OTHER OFFENSE,HARASSMENT BY TELEPHONE,false,true,27,41.881955922,-87.700037657,2008-09-19T09:00:00.000+02:00,9,19,9,2008,Non-Violent
6553497,10/12/2008 09:20:00 PM,CRIMINAL DAMAGE,TO VEHICLE,false,false,30,41.841966137,-87.723270006,2008-10-12T21:20:00.000+02:00,10,12,21,2008,Non-Violent
6490325,08/29/2008 06:00:00 PM,BATTERY,DOMESTIC BATTERY SIMPLE,false,true,19,41.930517689,-87.754590447,2008-08-29T18:00:00.000+02:00,8,29,18,2008,Violent
6561295,10/17/2008 12:30:00 PM,CRIMINAL TRESPASS,TO RESIDENCE,false,true,19,41.923313589,-87.747457065,2008-10-17T12:30:00.000+02:00,10,17,12,2008,Non-Violent
6427308,08/12/2008 07:00:00 PM,THEFT,FROM BUILDING,false,false,32,41.882394062,-87.627844798,2008-08-12T19:00:00.000+02:00,8,12,19,2008,Non-Violent
6519509,09/24/2008 08:30:00 AM,ROBBERY,STRONGARM - NO WEAPON,false,false,22,41.919115805,-87.68921323,2008-09-24T08:30:00.000+02:00,9,24,8,2008,Violent
6526927,09/10/2008 04:00:00 PM,NARCOTICS,FORFEIT PROPERTY,true,false,28,,,2008-09-10T16:00:00.000+02:00,9,10,16,2008,Non-Violent
6532540,10/02/2008 10:47:00 PM,NARCOTICS,POSS: CRACK,true,false,46,41.734545831,-87.55551538,2008-10-02T22:47:00.000+02:00,10,2,22,2008,Non-Violent
6536369,10/04/2008 06:00:00 PM,OFFENSE INVOLVING CHILDREN,OTHER OFFENSE,false,true,11,41.969253409,-87.785577177,2008-10-04T18:00:00.000+02:00,10,4,18,2008,Non-Violent
6564997,10/18/2008 04:30:00 AM,THEFT,FROM BUILDING,false,false,24,41.910534851,-87.674266171,2008-10-18T04:30:00.000+02:00,10,18,4,2008,Non-Violent
6549680,10/11/2008 07:30:00 PM,THEFT,OVER $500,false,false,6,41.944321558,-87.667577603,2008-10-11T19:30:00.000+02:00,10,11,19,2008,Non-Violent
6463296,08/26/2008 09:30:00 PM,ASSAULT,SIMPLE,false,false,48,41.729329717,-87.56215059,2008-08-26T21:30:00.000+02:00,8,26,21,2008,Violent
6412925,07/29/2008 06:02:00 PM,BATTERY,SIMPLE,false,false,25,41.909604848,-87.747740409,2008-07-29T18:02:00.000+02:00,7,29,18,2008,Violent
6398576,07/28/2008 05:25:00 PM,BATTERY,SIMPLE,false,false,62,41.796777189,-87.733373189,2008-07-28T17:25:00.000+02:00,7,28,17,2008,Violent
6405962,08/01/2008 03:03:19 AM,NARCOTICS,POSS: HEROIN(WHITE),false,false,69,41.768398037,-87.61734293,2008-08-01T03:03:19.000+02:00,8,1,3,2008,Non-Violent
6451902,08/25/2008 02:02:28 AM,MOTOR VEHICLE THEFT,AUTOMOBILE,false,false,22,,,2008-08-25T02:02:28.000+02:00,8,25,2,2008,Non-Violent
6489751,09/11/2008 11:49:00 AM,ASSAULT,SIMPLE,false,false,27,41.872678492,-87.714290873,2008-09-11T11:49:00.000+02:00,9,11,11,2008,Violent
6597435,11/06/2008 05:00:00 PM,ASSAULT,SIMPLE,false,true,24,41.902886566,-87.70109084,2008-11-06T17:00:00.000+02:00,11,6,17,2008,Violent
6573989,10/20/2008 07:00:00 PM,THEFT,$500 AND UNDER,false,false,3,41.957298342,-87.656214464,2008-10-20T19:00:00.000+02:00,10,20,19,2008,Non-Violent
6448196,08/21/2008 01:37:16 AM,CRIMINAL DAMAGE,TO PROPERTY,false,false,1,42.015657227,-87.679073386,2008-08-21T01:37:16.000+02:00,8,21,1,2008,Non-Violent
6419119,08/08/2008 03:00:00 PM,THEFT,RETAIL THEFT,false,false,8,41.895993005,-87.635683921,2008-08-08T15:00:00.000+02:00,8,8,15,2008,Non-Violent
6457600,08/26/2008 09:30:00 PM,THEFT,$500 AND UNDER,false,false,22,41.92327781,-87.720622003,2008-08-26T21:30:00.000+02:00,8,26,21,2008,Non-Violent
6398337,07/26/2008 02:30:00 PM,CRIMINAL DAMAGE,TO STATE SUP PROP,false,false,35,41.844000177,-87.628442902,2008-07-26T14:30:00.000+02:00,7,26,14,2008,Non-Violent
6439555,08/19/2008 12:00:00 AM,OTHER OFFENSE,TELEPHONE THREAT,false,true,29,41.865900902,-87.693393247,2008-08-19T00:00:00.000+02:00,8,19,0,2008,Non-Violent
6596445,11/01/2008 06:00:00 PM,CRIMINAL DAMAGE,CRIMINAL DEFACEMENT,false,false,66,41.779245661,-87.684224438,2008-11-01T18:00:00.000+02:00,11,1,18,2008,Non-Violent
6425084,08/10/2008 12:16:00 PM,BATTERY,DOMESTIC BATTERY SIMPLE,true,true,62,41.786941835,-87.716821413,2008-08-10T12:16:00.000+02:00,8,10,12,2008,Violent
6423672,08/08/2008 11:40:00 AM,CRIMINAL DAMAGE,TO VEHICLE,false,false,67,41.787944018,-87.664427506,2008-08-08T11:40:00.000+02:00,8,8,11,2008,Non-Violent
6547741,10/09/2008 07:30:00 PM,THEFT,OVER $500,false,false,28,41.883612314,-87.642711511,2008-10-09T19:30:00.000+02:00,10,9,19,2008,Non-Violent
6439753,08/17/2008 02:58:00 PM,NARCOTICS,POSS: CANNABIS 30GMS OR LESS,true,false,73,41.731337683,-87.649573018,2008-08-17T14:58:00.000+02:00,8,17,14,2008,Non-Violent
6553705,10/13/2008 07:52:17 PM,CRIMINAL DAMAGE,CRIMINAL DEFACEMENT,false,false,22,41.928653883,-87.723223822,2008-10-13T19:52:17.000+02:00,10,13,19,2008,Non-Violent
6569597,10/22/2008 08:40:00 PM,NARCOTICS,POSSESSION OF DRUG EQUIPMENT,true,false,3,41.972221847,-87.656302808,2008-10-22T20:40:00.000+02:00,10,22,20,2008,Non-Violent
6436510,08/16/2008 08:25:00 AM,BATTERY,DOMESTIC BATTERY SIMPLE,true,true,43,41.754830209,-87.565081532,2008-08-16T08:25:00.000+02:00,8,16,8,2008,Violent
6524012,09/26/2008 08:30:00 AM,DECEPTIVE PRACTICE,FORGERY,false,false,25,41.908452786,-87.765880756,2008-09-26T08:30:00.000+02:00,9,26,8,2008,Non-Violent
6413018,08/02/2008 04:00:00 PM,THEFT,$500 AND UNDER,false,false,55,41.656602345,-87.548370433,2008-08-02T16:00:00.000+02:00,8,2,16,2008,Non-Violent
6540213,10/06/2008 07:00:00 PM,THEFT,OVER $500,false,false,7,41.926678063,-87.639156749,2008-10-06T19:00:00.000+02:00,10,6,19,2008,Non-Violent
6584719,10/30/2008 03:46:40 PM,NARCOTICS,SOLICIT NARCOTICS ON PUBLICWAY,true,false,25,41.883741655,-87.749070981,2008-10-30T15:46:40.000+02:00,10,30,15,2008,Non-Violent
6544658,09/09/2008 02:00:00 AM,OTHER OFFENSE,TELEPHONE THREAT,false,false,61,41.802306646,-87.642928792,2008-09-09T02:00:00.000+02:00,9,9,2,2008,Non-Violent
6438111,08/13/2008 06:44:52 PM,NARCOTICS,SOLICIT NARCOTICS ON PUBLICWAY,true,false,27,41.880158115,-87.697000224,2008-08-13T18:44:52.000+02:00,8,13,18,2008,Non-Violent
6537315,05/10/2008 03:40:00 PM,OFFENSE INVOLVING CHILDREN,OTHER OFFENSE,false,true,21,41.936891547,-87.724681608,2008-05-10T15:40:00.000+02:00,5,10,15,2008,Non-Violent
6543738,10/09/2008 05:38:00 AM,NARCOTICS,POSS: COCAINE,true,false,61,41.80682546,-87.661736958,2008-10-09T05:38:00.000+02:00,10,9,5,2008,Non-Violent
6400197,07/30/2008 01:00:00 PM,BATTERY,DOMESTIC BATTERY SIMPLE,false,true,36,41.825449227,-87.606471226,2008-07-30T13:00:00.000+02:00,7,30,13,2008,Violent
6513896,09/23/2008 01:00:00 AM,MOTOR VEHICLE THEFT,AUTOMOBILE,false,false,69,41.763659742,-87.626830452,2008-09-23T01:00:00.000+02:00,9,23,1,2008,Non-Violent
6505906,09/15/2008 04:45:00 AM,CRIMINAL DAMAGE,TO STATE SUP PROP,false,false,8,41.897681751,-87.639933678,2008-09-15T04:45:00.000+02:00,9,15,4,2008,Non-Violent
6568804,10/16/2008 01:30:00 PM,PROSTITUTION,SOLICIT ON PUBLIC WAY,true,false,56,41.803515121,-87.743044463,2008-10-16T13:30:00.000+02:00,10,16,13,2008,Non-Violent
6559956,10/17/2008 03:00:00 PM,OTHER OFFENSE,TELEPHONE THREAT,false,true,23,41.912567406,-87.701939517,2008-10-17T15:00:00.000+02:00,10,17,15,2008,Non-Violent
6565164,10/16/2008 02:00:00 AM,BURGLARY,FORCIBLE ENTRY,false,false,43,41.752892887,-87.582120402,2008-10-16T02:00:00.000+02:00,10,16,2,2008,Non-Violent
6400728,06/11/2008 03:00:00 PM,THEFT,OVER $500,false,false,6,41.940871191,-87.652914872,2008-06-11T15:00:00.000+02:00,6,11,15,2008,Non-Violent
6388337,07/24/2008 08:17:47 PM,CRIMINAL DAMAGE,TO PROPERTY,false,false,33,41.850517353,-87.627031661,2008-07-24T20:17:47.000+02:00,7,24,20,2008,Non-Violent
6400039,07/29/2008 06:30:00 PM,NARCOTICS,FOUND SUSPECT NARCOTICS,false,false,34,41.852868298,-87.63091491,2008-07-29T18:30:00.000+02:00,7,29,18,2008,Non-Violent
6511491,09/16/2008 07:33:59 PM,NARCOTICS,POSS: CRACK,true,false,29,41.860902067,-87.707051468,2008-09-16T19:33:59.000+02:00,9,16,19,2008,Non-Violent
6391894,07/27/2008 02:00:00 AM,MOTOR VEHICLE THEFT,AUTOMOBILE,false,false,60,41.840600731,-87.660121479,2008-07-27T02:00:00.000+02:00,7,27,2,2008,Non-Violent
6575704,10/25/2008 08:14:18 PM,THEFT,RETAIL THEFT,true,false,67,41.793086059,-87.674267933,2008-10-25T20:14:18.000+02:00,10,25,20,2008,Non-Violent
6417098,08/07/2008 01:40:00 PM,ASSAULT,SIMPLE,false,true,75,41.691320706,-87.652937021,2008-08-07T13:40:00.000+02:00,8,7,13,2008,Violent
6384616,07/22/2008 10:00:00 PM,MOTOR VEHICLE THEFT,AUTOMOBILE,false,false,71,41.749721525,-87.64401292,2008-07-22T22:00:00.000+02:00,7,22,22,2008,Non-Violent
6457805,08/26/2008 07:21:07 AM,NARCOTICS,POSS: HEROIN(WHITE),true,false,25,41.894306956,-87.750682603,2008-08-26T07:21:07.000+02:00,8,26,7,2008,Non-Violent
6465675,08/28/2008 10:18:29 PM,BATTERY,SIMPLE,false,false,25,41.874030718,-87.748182746,2008-08-28T22:18:29.000+02:00,8,28,22,2008,Violent
6477248,09/04/2008 01:00:00 PM,THEFT,OVER $500,false,false,19,,,2008-09-04T13:00:00.000+02:00,9,4,13,2008,Non-Violent
6529660,09/30/2008 01:20:00 PM,BURGLARY,UNLAWFUL ENTRY,false,false,7,41.926630917,-87.656075838,2008-09-30T13:20:00.000+02:00,9,30,13,2008,Non-Violent
6531059,09/30/2008 07:00:00 PM,BURGLARY,FORCIBLE ENTRY,false,false,49,41.708329404,-87.610139582,2008-09-30T19:00:00.000+02:00,9,30,19,2008,Non-Violent
6437652,08/17/2008 12:01:00 AM,CRIM SEXUAL ASSAULT,NON-AGGRAVATED,false,false,25,41.906770999,-87.762093446,2008-08-17T00:01:00.000+02:00,8,17,0,2008,Non-Violent
6396259,07/27/2008 03:15:00 AM,BATTERY,SIMPLE,false,false,7,41.928929071,-87.642465467,2008-07-27T03:15:00.000+02:00,7,27,3,2008,Violent
6563996,10/19/2008 09:00:00 PM,MOTOR VEHICLE THEFT,AUTOMOBILE,false,false,46,41.749610317,-87.546794956,2008-10-19T21:00:00.000+02:00,10,19,21,2008,Non-Violent
6536733,10/05/2008 12:25:00 PM,CRIMINAL DAMAGE,TO VEHICLE,false,false,53,41.677834205,-87.639941321,2008-10-05T12:25:00.000+02:00,10,5,12,2008,Non-Violent
6504224,09/17/2008 07:00:00 PM,THEFT,$500 AND UNDER,false,false,17,41.94301647,-87.803224657,2008-09-17T19:00:00.000+02:00,9,17,19,2008,Non-Violent
6512051,09/22/2008 03:00:00 PM,BATTERY,SIMPLE,false,false,14,41.968221589,-87.729755782,2008-09-22T15:00:00.000+02:00,9,22,15,2008,Violent
6588250,11/02/2008 04:20:00 AM,DECEPTIVE PRACTICE,THEFT OF LABOR/SERVICES,false,false,24,41.898842319,-87.671040161,2008-11-02T04:20:00.000+02:00,11,2,4,2008,Non-Violent
6490873,09/11/2008 03:46:23 PM,CRIMINAL DAMAGE,TO VEHICLE,true,true,35,41.827501469,-87.615121711,2008-09-11T15:46:23.000+02:00,9,11,15,2008,Non-Violent
6574417,10/25/2008 01:38:09 AM,BATTERY,SIMPLE,false,false,67,41.784436302,-87.664339302,2008-10-25T01:38:09.000+02:00,10,25,1,2008,Violent
6418968,08/08/2008 09:00:00 AM,THEFT,FINANCIAL ID THEFT:$300 &UNDER,false,false,8,41.896213602,-87.632702709,2008-08-08T09:00:00.000+02:00,8,8,9,2008,Non-Violent
6426819,08/11/2008 04:30:00 PM,BATTERY,SIMPLE,false,false,39,41.809693341,-87.592138525,2008-08-11T16:30:00.000+02:00,8,11,16,2008,Violent
6574851,10/25/2008 12:00:00 AM,CRIMINAL TRESPASS,TO RESIDENCE,false,true,49,41.704958578,-87.616142922,2008-10-25T00:00:00.000+02:00,10,25,0,2008,Non-Violent
6463254,08/27/2008 01:07:03 PM,THEFT,OVER $500,false,false,27,41.869961348,-87.714228973,2008-08-27T13:07:03.000+02:00,8,27,13,2008,Non-Violent
6532152,09/30/2008 05:55:00 PM,OTHER OFFENSE,FALSE/STOLEN/ALTERED TRP,false,false,30,41.837602078,-87.73408926,2008-09-30T17:55:00.000+02:00,9,30,17,2008,Non-Violent
6384542,07/23/2008 03:00:00 PM,WEAPONS VIOLATION,UNLAWFUL POSS OTHER FIREARM,true,false,24,41.911149017,-87.694565339,2008-07-23T15:00:00.000+02:00,7,23,15,2008,Non-Violent
6445881,08/20/2008 06:22:10 PM,NARCOTICS,POSS: HEROIN(WHITE),true,false,27,41.879221392,-87.699311888,2008-08-20T18:22:10.000+02:00,8,20,18,2008,Non-Violent
6530147,09/27/2008 06:30:00 PM,BATTERY,SIMPLE,false,false,71,41.746330371,-87.658479822,2008-09-27T18:30:00.000+02:00,9,27,18,2008,Violent
6498881,08/31/2008 06:00:00 PM,THEFT,FROM BUILDING,false,false,32,41.879079395,-87.624341423,2008-08-31T18:00:00.000+02:00,8,31,18,2008,Non-Violent
6493726,09/12/2008 05:18:19 AM,BATTERY,DOMESTIC BATTERY SIMPLE,false,true,25,41.873936494,-87.755589514,2008-09-12T05:18:19.000+02:00,9,12,5,2008,Violent
6385418,07/19/2008 01:00:00 AM,MOTOR VEHICLE THEFT,AUTOMOBILE,false,false,16,41.953710345,-87.733973428,2008-07-19T01:00:00.000+02:00,7,19,1,2008,Non-Violent
6466066,08/30/2008 04:43:15 PM,THEFT,RETAIL THEFT,true,false,32,41.883500187,-87.627876698,2008-08-30T16:43:15.000+02:00,8,30,16,2008,Non-Violent
6501276,09/16/2008 02:27:00 AM,BURGLARY,FORCIBLE ENTRY,false,false,6,41.942282369,-87.652561708,2008-09-16T02:27:00.000+02:00,9,16,2,2008,Non-Violent
6475987,07/25/2008 06:50:06 PM,NARCOTICS,POSS: CANNABIS 30GMS OR LESS,true,false,71,41.755662935,-87.641728366,2008-07-25T18:50:06.000+02:00,7,25,18,2008,Non-Violent
6603627,11/10/2008 10:15:00 PM,NARCOTICS,POSS: CANNABIS 30GMS OR LESS,true,false,49,41.706210169,-87.626804247,2008-11-10T22:15:00.000+02:00,11,10,22,2008,Non-Violent
6490294,09/11/2008 02:05:00 PM,OTHER OFFENSE,OTHER CRIME INVOLVING PROPERTY,true,false,40,41.793935909,-87.625680278,2008-09-11T14:05:00.000+02:00,9,11,14,2008,Non-Violent
6395587,07/25/2008 05:30:00 PM,THEFT,RETAIL THEFT,false,false,65,41.754592961,-87.741528537,2008-07-25T17:30:00.000+02:00,7,25,17,2008,Non-Violent
6416097,08/04/2008 02:20:00 PM,THEFT,RETAIL THEFT,true,false,26,41.880773152,-87.721810393,2008-08-04T14:20:00.000+02:00,8,4,14,2008,Non-Violent
6564917,10/20/2008 11:00:00 AM,CRIMINAL TRESPASS,TO LAND,true,false,69,41.777950825,-87.615568537,2008-10-20T11:00:00.000+02:00,10,20,11,2008,Non-Violent
6440511,08/16/2008 11:00:00 PM,NARCOTICS,MANU/DELIVER: HEROIN (WHITE),true,false,23,41.901788359,-87.723835955,2008-08-16T23:00:00.000+02:00,8,16,23,2008,Non-Violent
6584260,10/30/2008 02:00:00 PM,CRIMINAL DAMAGE,CRIMINAL DEFACEMENT,true,false,12,41.970079906,-87.74786713,2008-10-30T14:00:00.000+02:00,10,30,14,2008,Non-Violent
6460992,08/25/2008 05:00:00 PM,BATTERY,SIMPLE,false,false,17,41.942989242,-87.779435711,2008-08-25T17:00:00.000+02:00,8,25,17,2008,Violent
6432266,07/31/2008 12:00:00 AM,OTHER OFFENSE,HARASSMENT BY TELEPHONE,false,false,23,41.908879698,-87.722846393,2008-07-31T00:00:00.000+02:00,7,31,0,2008,Non-Violent
6557636,10/12/2008 09:13:00 PM,CRIMINAL TRESPASS,TO LAND,true,false,42,41.776283468,-87.600970163,2008-10-12T21:13:00.000+02:00,10,12,21,2008,Non-Violent
6591897,11/03/2008 06:00:00 PM,CRIMINAL DAMAGE,TO PROPERTY,false,true,35,41.829651528,-87.614451899,2008-11-03T18:00:00.000+02:00,11,3,18,2008,Non-Violent
6515269,09/23/2008 06:45:00 AM,MOTOR VEHICLE THEFT,AUTOMOBILE,false,false,37,41.802807643,-87.633207753,2008-09-23T06:45:00.000+02:00,9,23,6,2008,Non-Violent
6515954,09/23/2008 05:00:00 AM,BURGLARY,UNLAWFUL ENTRY,false,false,19,41.928635187,-87.760068334,2008-09-23T05:00:00.000+02:00,9,23,5,2008,Non-Violent
6477041,09/04/2008 05:25:06 PM,BURGLARY,FORCIBLE ENTRY,false,false,7,41.919114045,-87.641274311,2008-09-04T17:25:06.000+02:00,9,4,17,2008,Non-Violent
6506937,09/09/2008 09:00:00 AM,DECEPTIVE PRACTICE,COUNTERFEIT CHECK,false,false,56,41.807036513,-87.743136848,2008-09-09T09:00:00.000+02:00,9,9,9,2008,Non-Violent
6419889,08/08/2008 10:45:00 AM,NARCOTICS,POSS: CRACK,true,false,33,41.857533855,-87.625603607,2008-08-08T10:45:00.000+02:00,8,8,10,2008,Non-Violent
6433656,07/31/2008 11:48:00 AM,NARCOTICS,POSS: HEROIN(WHITE),false,false,49,,,2008-07-31T11:48:00.000+02:00,7,31,11,2008,Non-Violent
6466663,08/30/2008 11:45:00 PM,THEFT,FROM BUILDING,false,false,8,41.893240902,-87.630344179,2008-08-30T23:45:00.000+02:00,8,30,23,2008,Non-Violent
6551292,10/10/2008 06:30:00 PM,ASSAULT,SIMPLE,false,false,29,41.856246213,-87.719977483,2008-10-10T18:30:00.000+02:00,10,10,18,2008,Violent
6486207,09/09/2008 03:00:00 AM,BATTERY,DOMESTIC BATTERY SIMPLE,false,true,66,41.759929017,-87.69656939,2008-09-09T03:00:00.000+02:00,9,9,3,2008,Violent
6414701,08/06/2008 12:48:00 PM,OTHER OFFENSE,HARASSMENT BY TELEPHONE,false,false,63,41.793620102,-87.697941257,2008-08-06T12:48:00.000+02:00,8,6,12,2008,Non-Violent
6481161,09/07/2008 01:45:00 PM,NARCOTICS,POSS: HEROIN(WHITE),true,false,40,41.79230014,-87.615918194,2008-09-07T13:45:00.000+02:00,9,7,13,2008,Non-Violent
6443979,04/14/2008 07:00:00 PM,THEFT,PURSE-SNATCHING,false,false,68,41.790882478,-87.63210176,2008-04-14T19:00:00.000+02:00,4,14,19,2008,Non-Violent
6554774,10/04/2008 09:20:00 PM,NARCOTICS,POSS: CANNABIS 30GMS OR LESS,true,false,38,41.821385069,-87.623158546,2008-10-04T21:20:00.000+02:00,10,4,21,2008,Non-Violent
6395669,07/28/2008 11:30:00 PM,OTHER OFFENSE,VIOLATE ORDER OF PROTECTION,true,true,58,41.806870512,-87.694164445,2008-07-28T23:30:00.000+02:00,7,28,23,2008,Non-Violent
6393311,07/27/2008 10:50:00 AM,ASSAULT,SIMPLE,true,true,71,41.737041597,-87.655803482,2008-07-27T10:50:00.000+02:00,7,27,10,2008,Violent
6553270,08/02/2008 11:00:00 AM,DECEPTIVE PRACTICE,CREDIT CARD FRAUD,false,false,22,41.920086604,-87.67029509,2008-08-02T11:00:00.000+02:00,8,2,11,2008,Non-Violent
6530128,10/01/2008 01:01:00 PM,WEAPONS VIOLATION,DEFACE IDENT MARKS OF FIREARM,true,false,54,41.656336434,-87.614267441,2008-10-01T13:01:00.000+02:00,10,1,13,2008,Non-Violent
6585043,10/30/2008 12:25:00 PM,BATTERY,AGGRAVATED DOMESTIC BATTERY: OTHER DANG WEAPON,true,true,67,41.789795217,-87.657191741,2008-10-30T12:25:00.000+02:00,10,30,12,2008,Violent
6531036,10/01/2008 05:00:00 AM,WEAPONS VIOLATION,UNLAWFUL POSS OF HANDGUN,true,false,73,41.711920502,-87.642959263,2008-10-01T05:00:00.000+02:00,10,1,5,2008,Non-Violent
6448547,08/21/2008 05:15:00 PM,ASSAULT,AGGRAVATED: OTHER DANG WEAPON,false,false,67,41.771862342,-87.65551049,2008-08-21T17:15:00.000+02:00,8,21,17,2008,Violent
6430824,08/07/2008 08:25:00 PM,THEFT,$500 AND UNDER,false,false,8,41.901604915,-87.625363254,2008-08-07T20:25:00.000+02:00,8,7,20,2008,Non-Violent
6512908,09/13/2008 12:01:00 AM,OTHER OFFENSE,HARASSMENT BY TELEPHONE,false,false,1,42.011594532,-87.664091031,2008-09-13T00:01:00.000+02:00,9,13,0,2008,Non-Violent
6546744,09/26/2008 08:50:00 PM,PROSTITUTION,SOLICIT ON PUBLIC WAY,false,false,25,41.868451003,-87.744833889,2008-09-26T20:50:00.000+02:00,9,26,20,2008,Non-Violent
6427292,08/07/2008 12:00:00 PM,DECEPTIVE PRACTICE,ILLEGAL USE CASH CARD,false,false,63,41.80169033,-87.703792065,2008-08-07T12:00:00.000+02:00,8,7,12,2008,Non-Violent
6406843,08/03/2008 03:35:00 AM,CRIMINAL TRESPASS,TO LAND,false,false,75,41.691789124,-87.679740557,2008-08-03T03:35:00.000+02:00,8,3,3,2008,Non-Violent
6559138,10/16/2008 09:00:00 PM,BATTERY,DOMESTIC BATTERY SIMPLE,false,true,68,41.768183524,-87.636007378,2008-10-16T21:00:00.000+02:00,10,16,21,2008,Violent
6551635,10/13/2008 08:25:00 PM,NARCOTICS,POSS: CRACK,true,false,6,41.95152786,-87.654455829,2008-10-13T20:25:00.000+02:00,10,13,20,2008,Non-Violent
6437672,08/17/2008 12:55:15 AM,CRIMINAL DAMAGE,TO VEHICLE,true,true,69,41.77037701,-87.626705427,2008-08-17T00:55:15.000+02:00,8,17,0,2008,Non-Violent
6446606,08/18/2008 10:50:00 PM,ASSAULT,SIMPLE,false,true,41,41.79275784,-87.591625921,2008-08-18T22:50:00.000+02:00,8,18,22,2008,Violent
6452537,08/22/2008 11:16:40 PM,BATTERY,DOMESTIC BATTERY SIMPLE,false,true,68,41.789656207,-87.646251106,2008-08-22T23:16:40.000+02:00,8,22,23,2008,Violent
6589355,11/01/2008 02:20:00 PM,THEFT,$500 AND UNDER,false,false,8,41.908171602,-87.631580069,2008-11-01T14:20:00.000+02:00,11,1,14,2008,Non-Violent
6468146,08/31/2008 12:00:00 PM,CRIMINAL DAMAGE,TO VEHICLE,false,false,17,41.949552126,-87.808364818,2008-08-31T12:00:00.000+02:00,8,31,12,2008,Non-Violent
6586905,10/31/2008 11:40:00 PM,ROBBERY,ARMED: HANDGUN,false,false,5,41.938929979,-87.687903877,2008-10-31T23:40:00.000+02:00,10,31,23,2008,Violent
6558638,10/16/2008 04:30:00 AM,BATTERY,DOMESTIC BATTERY SIMPLE,false,true,46,41.751072904,-87.582881895,2008-10-16T04:30:00.000+02:00,10,16,4,2008,Violent
6532414,10/01/2008 12:00:00 PM,THEFT,OVER $500,false,false,7,41.930915643,-87.67512216,2008-10-01T12:00:00.000+02:00,10,1,12,2008,Non-Violent
6447254,08/21/2008 11:18:03 AM,NARCOTICS,POSS: CANNABIS 30GMS OR LESS,true,false,1,42.005391824,-87.669616106,2008-08-21T11:18:03.000+02:00,8,21,11,2008,Non-Violent
6529287,09/30/2008 02:05:00 PM,THEFT,$500 AND UNDER,false,false,27,41.872871783,-87.696936649,2008-09-30T14:05:00.000+02:00,9,30,14,2008,Non-Violent
6399798,07/29/2008 02:00:00 AM,ROBBERY,ARMED: HANDGUN,false,false,45,41.743811895,-87.588004875,2008-07-29T02:00:00.000+02:00,7,29,2,2008,Violent
6570422,10/21/2008 07:50:00 PM,ROBBERY,ARMED:KNIFE/CUTTING INSTRUMENT,false,false,65,41.778674106,-87.72159714,2008-10-21T19:50:00.000+02:00,10,21,19,2008,Violent
6399563,05/07/2008 07:05:00 AM,THEFT,$500 AND UNDER,false,false,69,41.761603489,-87.615197285,2008-05-07T07:05:00.000+02:00,5,7,7,2008,Non-Violent
6543940,10/08/2008 05:00:00 PM,BURGLARY,FORCIBLE ENTRY,false,false,21,41.942818457,-87.707720738,2008-10-08T17:00:00.000+02:00,10,8,17,2008,Non-Violent
6568244,10/21/2008 10:55:00 AM,BURGLARY,UNLAWFUL ENTRY,false,false,70,41.742288292,-87.715105168,2008-10-21T10:55:00.000+02:00,10,21,10,2008,Non-Violent
6539326,10/06/2008 01:45:00 PM,THEFT,RETAIL THEFT,true,false,32,41.882470918,-87.627847625,2008-10-06T13:45:00.000+02:00,10,6,13,2008,Non-Violent
6403552,07/29/2008 12:01:00 AM,OFFENSE INVOLVING CHILDREN,CHILD ABUSE,false,true,51,41.719653708,-87.564672836,2008-07-29T00:01:00.000+02:00,7,29,0,2008,Non-Violent
6455532,08/25/2008 08:00:00 PM,CRIMINAL DAMAGE,TO PROPERTY,false,false,42,41.783527405,-87.60599893,2008-08-25T20:00:00.000+02:00,8,25,20,2008,Non-Violent
6539769,10/07/2008 03:12:55 AM,NARCOTICS,POSS: HEROIN(WHITE),true,false,25,41.880383764,-87.754158071,2008-10-07T03:12:55.000+02:00,10,7,3,2008,Non-Violent
6563116,10/18/2008 10:00:00 PM,CRIMINAL DAMAGE,TO VEHICLE,false,false,72,41.724860791,-87.670122847,2008-10-18T22:00:00.000+02:00,10,18,22,2008,Non-Violent
6531888,09/04/2008 12:00:00 AM,DECEPTIVE PRACTICE,FRAUD OR CONFIDENCE GAME,false,false,53,41.664578083,-87.618728554,2008-09-04T00:00:00.000+02:00,9,4,0,2008,Non-Violent
6538006,10/04/2008 11:11:43 AM,PROSTITUTION,SOLICIT ON PUBLIC WAY,true,false,40,41.792377986,-87.619162687,2008-10-04T11:11:43.000+02:00,10,4,11,2008,Non-Violent
6601029,11/09/2008 03:00:00 AM,BATTERY,DOMESTIC BATTERY SIMPLE,false,true,28,41.882181278,-87.680010862,2008-11-09T03:00:00.000+02:00,11,9,3,2008,Violent
6429013,08/11/2008 10:20:00 PM,BATTERY,SIMPLE,false,false,29,41.865906172,-87.709311868,2008-08-11T22:20:00.000+02:00,8,11,22,2008,Violent
6539753,10/06/2008 11:36:00 PM,CRIMINAL DAMAGE,TO PROPERTY,false,false,27,,,2008-10-06T23:36:00.000+02:00,10,6,23,2008,Non-Violent
6603789,11/09/2008 02:23:21 PM,CRIM SEXUAL ASSAULT,ATTEMPT AGG: KNIFE/CUT INSTR,false,false,25,41.88044309,-87.749615127,2008-11-09T14:23:21.000+02:00,11,9,14,2008,Non-Violent
6476685,09/04/2008 05:30:00 AM,BURGLARY,FORCIBLE ENTRY,false,false,29,41.864096311,-87.714124026,2008-09-04T05:30:00.000+02:00,9,4,5,2008,Non-Violent
6460603,08/28/2008 02:30:00 AM,THEFT,OVER $500,false,false,67,41.768615103,-87.659584303,2008-08-28T02:30:00.000+02:00,8,28,2,2008,Non-Violent
6510585,09/09/2008 10:54:29 PM,NARCOTICS,POSS: CANNABIS 30GMS OR LESS,true,false,53,41.677410606,-87.620493754,2008-09-09T22:54:29.000+02:00,9,9,22,2008,Non-Violent
6414244,06/26/2008 03:00:00 PM,THEFT,OVER $500,false,false,8,41.894888404,-87.6273694,2008-06-26T15:00:00.000+02:00,6,26,15,2008,Non-Violent
6552821,10/12/2008 10:55:00 AM,BATTERY,DOMESTIC BATTERY SIMPLE,false,true,19,41.918986419,-87.74862834,2008-10-12T10:55:00.000+02:00,10,12,10,2008,Violent
6555264,10/13/2008 07:15:00 PM,NARCOTICS,POSS: CANNABIS 30GMS OR LESS,true,false,26,41.886815578,-87.726908933,2008-10-13T19:15:00.000+02:00,10,13,19,2008,Non-Violent
6450994,08/21/2008 03:40:00 AM,NARCOTICS,POSS: CRACK,true,false,27,41.880933395,-87.709257484,2008-08-21T03:40:00.000+02:00,8,21,3,2008,Non-Violent
6510467,09/22/2008 03:50:00 AM,BATTERY,DOMESTIC BATTERY SIMPLE,true,true,27,41.877390937,-87.700299373,2008-09-22T03:50:00.000+02:00,9,22,3,2008,Violent
6550744,10/12/2008 10:35:37 PM,BATTERY,SIMPLE,false,false,69,41.765693367,-87.595841543,2008-10-12T22:35:37.000+02:00,10,12,22,2008,Violent
6499798,09/14/2008 05:46:00 PM,BATTERY,DOMESTIC BATTERY SIMPLE,false,true,68,41.78999187,-87.648693371,2008-09-14T17:46:00.000+02:00,9,14,17,2008,Violent
6554095,10/14/2008 11:10:00 AM,BURGLARY,FORCIBLE ENTRY,false,false,75,41.690378914,-87.655641646,2008-10-14T11:10:00.000+02:00,10,14,11,2008,Non-Violent
6565850,10/18/2008 01:08:00 PM,NARCOTICS,POSS: CANNABIS 30GMS OR LESS,true,false,69,41.777967289,-87.615568353,2008-10-18T13:08:00.000+02:00,10,18,13,2008,Non-Violent
6507222,09/19/2008 09:00:00 PM,THEFT,$500 AND UNDER,false,false,25,41.910045396,-87.780135746,2008-09-19T21:00:00.000+02:00,9,19,21,2008,Non-Violent
6534572,07/31/2008 12:35:00 PM,WEAPONS VIOLATION,UNLAWFUL POSS OF HANDGUN,false,false,68,41.760940791,-87.64915621,2008-07-31T12:35:00.000+02:00,7,31,12,2008,Non-Violent
6507598,09/19/2008 08:16:58 PM,CRIMINAL TRESPASS,TO STATE SUP LAND,false,false,1,42.009645332,-87.670094384,2008-09-19T20:16:58.000+02:00,9,19,20,2008,Non-Violent
6423211,08/10/2008 12:05:03 PM,NARCOTICS,POSS: HEROIN(WHITE),true,false,26,41.873274269,-87.738753362,2008-08-10T12:05:03.000+02:00,8,10,12,2008,Non-Violent
6495904,09/14/2008 11:15:00 PM,MOTOR VEHICLE THEFT,AUTOMOBILE,false,false,69,41.766778358,-87.631037355,2008-09-14T23:15:00.000+02:00,9,14,23,2008,Non-Violent
6445265,08/20/2008 01:20:00 AM,ASSAULT,AGGRAVATED: OTHER DANG WEAPON,true,false,28,41.885702212,-87.642053677,2008-08-20T01:20:00.000+02:00,8,20,1,2008,Violent
6517564,09/22/2008 09:46:21 PM,BATTERY,DOMESTIC BATTERY SIMPLE,false,true,38,41.810552766,-87.61818687,2008-09-22T21:46:21.000+02:00,9,22,21,2008,Violent
6526235,09/29/2008 10:30:00 PM,CRIMINAL TRESPASS,TO STATE SUP LAND,true,false,33,41.852216317,-87.627075368,2008-09-29T22:30:00.000+02:00,9,29,22,2008,Non-Violent
6481825,08/28/2008 05:20:00 PM,NARCOTICS,POSS: HEROIN(WHITE),true,false,26,41.885487535,-87.726422045,2008-08-28T17:20:00.000+02:00,8,28,17,2008,Non-Violent
6517490,09/23/2008 09:00:00 AM,BURGLARY,FORCIBLE ENTRY,true,false,64,41.777650931,-87.783001825,2008-09-23T09:00:00.000+02:00,9,23,9,2008,Non-Violent
6384359,07/22/2008 08:10:00 PM,BATTERY,AGGRAVATED: HANDGUN,false,false,68,41.766402779,-87.649296123,2008-07-22T20:10:00.000+02:00,7,22,20,2008,Violent
6519916,09/25/2008 05:59:49 PM,ASSAULT,SIMPLE,false,false,75,41.697430487,-87.650774484,2008-09-25T17:59:49.000+02:00,9,25,17,2008,Violent
6408714,07/31/2008 02:30:00 PM,THEFT,$500 AND UNDER,false,false,61,41.806794998,-87.664040718,2008-07-31T14:30:00.000+02:00,7,31,14,2008,Non-Violent
6433893,08/15/2008 12:30:00 AM,ASSAULT,AGGRAVATED:KNIFE/CUTTING INSTR,false,true,23,41.896121831,-87.728569255,2008-08-15T00:30:00.000+02:00,8,15,0,2008,Violent
6603987,11/08/2008 10:28:00 PM,MOTOR VEHICLE THEFT,THEFT/RECOVERY: AUTOMOBILE,true,false,53,41.681357737,-87.620618587,2008-11-08T22:28:00.000+02:00,11,8,22,2008,Non-Violent
6526110,09/23/2008 11:00:00 AM,BURGLARY,FORCIBLE ENTRY,false,false,53,41.682538543,-87.623398771,2008-09-23T11:00:00.000+02:00,9,23,11,2008,Non-Violent
6603775,11/10/2008 06:30:00 PM,OTHER OFFENSE,TELEPHONE THREAT,false,true,66,41.782379646,-87.688610976,2008-11-10T18:30:00.000+02:00,11,10,18,2008,Non-Violent
6566045,10/19/2008 09:50:00 PM,CRIMINAL DAMAGE,TO CITY OF CHICAGO PROPERTY,false,false,63,41.803902566,-87.703854768,2008-10-19T21:50:00.000+02:00,10,19,21,2008,Non-Violent
6499578,09/14/2008 12:25:30 PM,NARCOTICS,MANU/DELIVER:COCAINE,true,false,15,41.947610832,-87.774969837,2008-09-14T12:25:30.000+02:00,9,14,12,2008,Non-Violent
6449789,08/22/2008 04:28:00 AM,BATTERY,SIMPLE,true,false,28,41.887676641,-87.648687002,2008-08-22T04:28:00.000+02:00,8,22,4,2008,Violent
6425557,08/11/2008 03:15:00 PM,THEFT,RETAIL THEFT,false,false,30,41.851660202,-87.715304747,2008-08-11T15:15:00.000+02:00,8,11,15,2008,Non-Violent
6558379,10/12/2008 11:12:00 PM,PUBLIC PEACE VIOLATION,ARSON THREAT,false,false,58,41.82708266,-87.689839412,2008-10-12T23:12:00.000+02:00,10,12,23,2008,Non-Violent
6497961,09/15/2008 09:40:00 PM,THEFT,$500 AND UNDER,false,false,7,41.925406329,-87.651789407,2008-09-15T21:40:00.000+02:00,9,15,21,2008,Non-Violent
6559868,10/06/2008 03:15:00 PM,CRIMINAL DAMAGE,TO VEHICLE,false,false,8,41.895978014,-87.624275756,2008-10-06T15:15:00.000+02:00,10,6,15,2008,Non-Violent
6512458,09/23/2008 02:15:00 AM,BURGLARY,FORCIBLE ENTRY,true,false,21,41.934530286,-87.70259029,2008-09-23T02:15:00.000+02:00,9,23,2,2008,Non-Violent
6576788,10/24/2008 11:30:00 PM,BURGLARY,FORCIBLE ENTRY,false,false,61,41.795997265,-87.648383751,2008-10-24T23:30:00.000+02:00,10,24,23,2008,Non-Violent
6596835,11/05/2008 06:15:00 AM,CRIMINAL DAMAGE,TO PROPERTY,false,true,30,41.85075701,-87.719850075,2008-11-05T06:15:00.000+02:00,11,5,6,2008,Non-Violent
6482012,09/03/2008 09:42:36 PM,ROBBERY,ATTEMPT: STRONGARM-NO WEAPON,true,false,44,41.74946081,-87.604870119,2008-09-03T21:42:36.000+02:00,9,3,21,2008,Violent
6470878,09/01/2008 02:00:00 PM,CRIMINAL DAMAGE,CRIMINAL DEFACEMENT,false,false,19,41.931352455,-87.76016528,2008-09-01T14:00:00.000+02:00,9,1,14,2008,Non-Violent
6397570,07/26/2008 03:30:00 AM,CRIMINAL DAMAGE,TO VEHICLE,false,false,30,41.849248491,-87.700279614,2008-07-26T03:30:00.000+02:00,7,26,3,2008,Non-Violent
6545650,10/08/2008 09:45:00 AM,CRIMINAL DAMAGE,TO PROPERTY,false,false,34,41.845291445,-87.631819896,2008-10-08T09:45:00.000+02:00,10,8,9,2008,Non-Violent
6470229,09/01/2008 12:10:13 AM,BATTERY,DOMESTIC BATTERY SIMPLE,false,true,2,41.99305621,-87.703127383,2008-09-01T00:10:13.000+02:00,9,1,0,2008,Violent
6473013,09/02/2008 04:18:22 AM,NARCOTICS,POSS: CANNABIS 30GMS OR LESS,true,false,25,41.908570443,-87.751012133,2008-09-02T04:18:22.000+02:00,9,2,4,2008,Non-Violent
6519682,09/24/2008 03:00:00 AM,THEFT,OVER $500,false,false,66,41.770153165,-87.682655498,2008-09-24T03:00:00.000+02:00,9,24,3,2008,Non-Violent
6582572,10/29/2008 08:55:00 PM,BATTERY,SIMPLE,false,false,24,41.900138792,-87.656653383,2008-10-29T20:55:00.000+02:00,10,29,20,2008,Violent
6584355,10/30/2008 06:00:00 PM,THEFT,FROM BUILDING,false,false,73,41.721196356,-87.663838141,2008-10-30T18:00:00.000+02:00,10,30,18,2008,Non-Violent
6426733,08/12/2008 08:30:00 AM,THEFT,PURSE-SNATCHING,false,false,73,41.708280992,-87.642870023,2008-08-12T08:30:00.000+02:00,8,12,8,2008,Non-Violent
6470773,09/01/2008 12:01:00 AM,CRIMINAL DAMAGE,TO PROPERTY,false,false,65,41.77984156,-87.733784055,2008-09-01T00:01:00.000+02:00,9,1,0,2008,Non-Violent
6389872,07/08/2008 09:00:00 AM,DECEPTIVE PRACTICE,FORGERY,false,false,33,41.852450058,-87.622260765,2008-07-08T09:00:00.000+02:00,7,8,9,2008,Non-Violent
6497630,09/15/2008 01:00:00 AM,MOTOR VEHICLE THEFT,AUTOMOBILE,false,false,6,41.95386239,-87.64510423,2008-09-15T01:00:00.000+02:00,9,15,1,2008,Non-Violent
6508911,09/20/2008 10:45:00 PM,ASSAULT,SIMPLE,false,false,23,41.910804307,-87.721468729,2008-09-20T22:45:00.000+02:00,9,20,22,2008,Violent
6505040,09/18/2008 06:00:00 PM,CRIMINAL DAMAGE,TO PROPERTY,false,false,27,41.878316096,-87.71191944,2008-09-18T18:00:00.000+02:00,9,18,18,2008,Non-Violent
6557663,10/11/2008 12:20:00 AM,NARCOTICS,POSS: CANNABIS 30GMS OR LESS,true,false,71,41.753434487,-87.672013039,2008-10-11T00:20:00.000+02:00,10,11,0,2008,Non-Violent
6543330,10/07/2008 04:53:38 PM,SEX OFFENSE,PUBLIC INDECENCY,true,false,25,41.878631263,-87.764808046,2008-10-07T16:53:38.000+02:00,10,7,16,2008,Non-Violent
6517524,09/24/2008 02:15:57 PM,THEFT,RETAIL THEFT,true,false,61,41.808659359,-87.660921846,2008-09-24T14:15:57.000+02:00,9,24,14,2008,Non-Violent
6423402,08/09/2008 04:42:31 AM,NARCOTICS,POSS: CANNABIS 30GMS OR LESS,true,false,42,41.774294882,-87.615480989,2008-08-09T04:42:31.000+02:00,8,9,4,2008,Non-Violent
6508670,09/20/2008 08:00:00 PM,MOTOR VEHICLE THEFT,AUTOMOBILE,false,false,25,41.872924943,-87.744991122,2008-09-20T20:00:00.000+02:00,9,20,20,2008,Non-Violent
6494164,09/07/2008 12:00:00 PM,THEFT,OVER $500,false,false,50,41.691277987,-87.604348002,2008-09-07T12:00:00.000+02:00,9,7,12,2008,Non-Violent
6433232,08/14/2008 02:00:00 PM,THEFT,OVER $500,false,false,22,41.921148215,-87.683666425,2008-08-14T14:00:00.000+02:00,8,14,14,2008,Non-Violent
6418339,08/04/2008 07:08:00 PM,NARCOTICS,SOLICIT NARCOTICS ON PUBLICWAY,true,false,23,41.892794899,-87.708914316,2008-08-04T19:08:00.000+02:00,8,4,19,2008,Non-Violent
6560373,10/14/2008 05:00:00 PM,MOTOR VEHICLE THEFT,AUTOMOBILE,false,false,36,41.829389915,-87.606892634,2008-10-14T17:00:00.000+02:00,10,14,17,2008,Non-Violent
6553247,10/14/2008 11:40:00 AM,MOTOR VEHICLE THEFT,"CYCLE, SCOOTER, BIKE W-VIN",false,false,8,41.903136692,-87.648062686,2008-10-14T11:40:00.000+02:00,10,14,11,2008,Non-Violent
6547786,10/09/2008 09:00:00 PM,CRIMINAL DAMAGE,TO PROPERTY,false,false,11,41.980451428,-87.775661331,2008-10-09T21:00:00.000+02:00,10,9,21,2008,Non-Violent
6532499,10/01/2008 09:00:00 AM,OTHER OFFENSE,HARASSMENT BY TELEPHONE,false,true,66,41.780704306,-87.709244016,2008-10-01T09:00:00.000+02:00,10,1,9,2008,Non-Violent
6429255,08/12/2008 06:00:00 PM,CRIMINAL DAMAGE,TO VEHICLE,false,false,41,41.796464116,-87.602995843,2008-08-12T18:00:00.000+02:00,8,12,18,2008,Non-Violent
6412365,08/05/2008 09:00:00 PM,THEFT,$500 AND UNDER,false,false,71,41.756541532,-87.672098424,2008-08-05T21:00:00.000+02:00,8,5,21,2008,Non-Violent
6580155,10/28/2008 02:55:00 PM,NARCOTICS,ATTEMPT POSSESSION CANNABIS,true,false,23,41.903753563,-87.72389808,2008-10-28T14:55:00.000+02:00,10,28,14,2008,Non-Violent
6541624,10/03/2008 09:17:41 PM,OTHER OFFENSE,VIOLATE ORDER OF PROTECTION,true,true,30,41.850972341,-87.70888445,2008-10-03T21:17:41.000+02:00,10,3,21,2008,Non-Violent
6396627,06/27/2008 11:21:36 PM,NARCOTICS,POSS: COCAINE,true,false,66,41.785852383,-87.69967898,2008-06-27T23:21:36.000+02:00,6,27,23,2008,Non-Violent
6529252,09/29/2008 12:35:00 PM,WEAPONS VIOLATION,UNLAWFUL POSS OF HANDGUN,true,false,44,41.749904766,-87.624514982,2008-09-29T12:35:00.000+02:00,9,29,12,2008,Non-Violent
6541384,09/20/2008 12:01:00 AM,THEFT,$500 AND UNDER,false,false,15,41.940667941,-87.74582065,2008-09-20T00:01:00.000+02:00,9,20,0,2008,Non-Violent
6398592,07/30/2008 08:50:00 AM,OTHER OFFENSE,TELEPHONE THREAT,false,false,27,41.882928311,-87.693274778,2008-07-30T08:50:00.000+02:00,7,30,8,2008,Non-Violent
6441257,08/18/2008 06:30:00 PM,ASSAULT,SIMPLE,true,false,5,41.937719362,-87.681032068,2008-08-18T18:30:00.000+02:00,8,18,18,2008,Violent
6397399,07/24/2008 04:25:00 PM,NARCOTICS,MANU/DEL:CANNABIS 10GM OR LESS,true,false,23,41.901562503,-87.726269844,2008-07-24T16:25:00.000+02:00,7,24,16,2008,Non-Violent
6512417,09/22/2008 07:00:00 PM,CRIMINAL DAMAGE,TO VEHICLE,false,false,68,41.766290188,-87.634689941,2008-09-22T19:00:00.000+02:00,9,22,19,2008,Non-Violent
6599600,11/06/2008 09:00:00 PM,CRIMINAL DAMAGE,TO PROPERTY,false,false,71,41.735216731,-87.652107544,2008-11-06T21:00:00.000+02:00,11,6,21,2008,Non-Violent
6393476,06/18/2008 04:24:11 PM,NARCOTICS,POSS: CRACK,true,false,70,41.756368897,-87.681750217,2008-06-18T16:24:11.000+02:00,6,18,16,2008,Non-Violent
6520112,09/26/2008 02:27:00 AM,PUBLIC PEACE VIOLATION,RECKLESS CONDUCT,true,false,22,41.931845714,-87.722763423,2008-09-26T02:27:00.000+02:00,9,26,2,2008,Non-Violent
6521995,09/25/2008 08:55:00 AM,BURGLARY,FORCIBLE ENTRY,true,false,46,41.734959454,-87.561097685,2008-09-25T08:55:00.000+02:00,9,25,8,2008,Non-Violent
6589526,11/02/2008 06:22:00 AM,ASSAULT,SIMPLE,false,true,8,41.90316534,-87.629210442,2008-11-02T06:22:00.000+02:00,11,2,6,2008,Violent
6430414,08/12/2008 09:10:00 AM,MOTOR VEHICLE THEFT,THEFT/RECOVERY: AUTOMOBILE,false,false,4,41.971098166,-87.693885821,2008-08-12T09:10:00.000+02:00,8,12,9,2008,Non-Violent
6494093,08/07/2008 07:43:00 PM,NARCOTICS,POSS: CANNABIS 30GMS OR LESS,true,false,71,41.753446164,-87.644115998,2008-08-07T19:43:00.000+02:00,8,7,19,2008,Non-Violent
6409134,08/04/2008 12:25:00 PM,NARCOTICS,POSS: CANNABIS 30GMS OR LESS,true,false,49,41.707099379,-87.628599988,2008-08-04T12:25:00.000+02:00,8,4,12,2008,Non-Violent
6550574,10/11/2008 01:00:00 AM,CRIMINAL DAMAGE,TO PROPERTY,false,true,69,41.75563077,-87.636857948,2008-10-11T01:00:00.000+02:00,10,11,1,2008,Non-Violent
6587132,10/30/2008 12:20:00 PM,DECEPTIVE PRACTICE,THEFT OF LABOR/SERVICES,false,false,8,41.896888586,-87.628203192,2008-10-30T12:20:00.000+02:00,10,30,12,2008,Non-Violent
6496394,09/14/2008 09:20:00 AM,BURGLARY,FORCIBLE ENTRY,false,false,69,41.76386105,-87.616356052,2008-09-14T09:20:00.000+02:00,9,14,9,2008,Non-Violent
6494973,09/12/2008 06:45:00 PM,THEFT,RETAIL THEFT,true,false,61,41.809687513,-87.674970791,2008-09-12T18:45:00.000+02:00,9,12,18,2008,Non-Violent
6509417,09/21/2008 01:19:00 AM,BATTERY,AGGRAVATED: HANDGUN,false,false,26,41.878798167,-87.731325068,2008-09-21T01:19:00.000+02:00,9,21,1,2008,Violent
6543749,10/07/2008 03:39:06 AM,BATTERY,DOMESTIC BATTERY SIMPLE,false,true,56,41.814545662,-87.746505157,2008-10-07T03:39:06.000+02:00,10,7,3,2008,Violent
6597468,11/06/2008 09:00:00 PM,THEFT,OVER $500,false,false,6,41.947708111,-87.665248564,2008-11-06T21:00:00.000+02:00,11,6,21,2008,Non-Violent
6431142,08/12/2008 02:53:17 PM,CRIMINAL DAMAGE,TO PROPERTY,false,false,2,42.011694602,-87.690237586,2008-08-12T14:53:17.000+02:00,8,12,14,2008,Non-Violent
6427714,08/08/2008 04:20:00 AM,ROBBERY,STRONGARM - NO WEAPON,false,false,56,41.793065099,-87.738831483,2008-08-08T04:20:00.000+02:00,8,8,4,2008,Violent
6512479,09/22/2008 02:50:11 AM,BATTERY,DOMESTIC BATTERY SIMPLE,false,true,25,41.900425978,-87.754898982,2008-09-22T02:50:11.000+02:00,9,22,2,2008,Violent
6530716,09/26/2008 05:00:00 PM,THEFT,OVER $500,false,false,61,41.812484006,-87.646396028,2008-09-26T17:00:00.000+02:00,9,26,17,2008,Non-Violent
6549120,10/09/2008 06:45:00 PM,CRIMINAL DAMAGE,TO PROPERTY,false,false,43,41.75272545,-87.582115024,2008-10-09T18:45:00.000+02:00,10,9,18,2008,Non-Violent
6466757,08/28/2008 10:00:00 PM,THEFT,$500 AND UNDER,false,false,5,41.93769941,-87.682351738,2008-08-28T22:00:00.000+02:00,8,28,22,2008,Non-Violent
6541737,10/07/2008 06:30:00 PM,BATTERY,AGGRAVATED: OTHER DANG WEAPON,false,false,30,41.843942138,-87.713555026,2008-10-07T18:30:00.000+02:00,10,7,18,2008,Violent
6559848,10/08/2008 05:05:00 PM,NARCOTICS,POSS: COCAINE,false,false,65,41.779798565,-87.727679955,2008-10-08T17:05:00.000+02:00,10,8,17,2008,Non-Violent
6404815,07/31/2008 10:00:00 PM,MOTOR VEHICLE THEFT,AUTOMOBILE,false,false,30,41.843201328,-87.730598241,2008-07-31T22:00:00.000+02:00,7,31,22,2008,Non-Violent
6440123,07/24/2008 06:40:00 AM,WEAPONS VIOLATION,POSS FIREARM/AMMO:NO FOID CARD,false,false,33,41.861161041,-87.627270627,2008-07-24T06:40:00.000+02:00,7,24,6,2008,Non-Violent
6586978,10/31/2008 08:00:00 PM,THEFT,RETAIL THEFT,false,false,75,41.692466898,-87.681176287,2008-10-31T20:00:00.000+02:00,10,31,20,2008,Non-Violent
6499066,09/11/2008 02:53:00 PM,NARCOTICS,POSS: CANNABIS 30GMS OR LESS,true,false,25,41.887739656,-87.763746728,2008-09-11T14:53:00.000+02:00,9,11,14,2008,Non-Violent
6554498,10/14/2008 03:15:00 PM,THEFT,$500 AND UNDER,false,true,32,41.885888079,-87.627942238,2008-10-14T15:15:00.000+02:00,10,14,15,2008,Non-Violent
6551903,10/13/2008 12:23:08 PM,BATTERY,DOMESTIC BATTERY SIMPLE,false,true,25,41.880318927,-87.759281249,2008-10-13T12:23:08.000+02:00,10,13,12,2008,Violent
6433643,07/30/2008 12:00:00 PM,DECEPTIVE PRACTICE,FORGERY,false,true,53,41.671755385,-87.630885292,2008-07-30T12:00:00.000+02:00,7,30,12,2008,Non-Violent
6408818,08/01/2008 11:15:00 PM,BATTERY,SIMPLE,false,false,8,41.904493689,-87.643246928,2008-08-01T23:15:00.000+02:00,8,1,23,2008,Violent
6397627,07/28/2008 09:05:00 PM,CRIMINAL DAMAGE,TO VEHICLE,false,false,75,41.694080956,-87.650992973,2008-07-28T21:05:00.000+02:00,7,28,21,2008,Non-Violent
6598033,11/05/2008 10:24:49 AM,OTHER OFFENSE,HARASSMENT BY TELEPHONE,false,true,1,42.015385991,-87.683013622,2008-11-05T10:24:49.000+02:00,11,5,10,2008,Non-Violent
6488959,09/04/2008 05:30:00 PM,BATTERY,DOMESTIC BATTERY SIMPLE,false,true,23,41.896237818,-87.726107238,2008-09-04T17:30:00.000+02:00,9,4,17,2008,Violent
6527028,09/28/2008 10:10:00 AM,BATTERY,DOMESTIC BATTERY SIMPLE,false,true,71,41.755913646,-87.657573136,2008-09-28T10:10:00.000+02:00,9,28,10,2008,Violent
6547366,10/09/2008 02:30:00 PM,BATTERY,SIMPLE,false,false,30,41.836752122,-87.695008451,2008-10-09T14:30:00.000+02:00,10,9,14,2008,Violent
6554354,10/14/2008 12:46:00 PM,MOTOR VEHICLE THEFT,THEFT/RECOVERY: AUTOMOBILE,true,false,27,41.881046784,-87.699396664,2008-10-14T12:46:00.000+02:00,10,14,12,2008,Non-Violent
6562050,10/18/2008 03:15:00 PM,THEFT,FROM BUILDING,false,false,6,41.949314339,-87.672510392,2008-10-18T15:15:00.000+02:00,10,18,15,2008,Non-Violent
6602844,11/08/2008 12:20:00 PM,NARCOTICS,POSS: CANNABIS 30GMS OR LESS,true,false,77,41.990089693,-87.656367307,2008-11-08T12:20:00.000+02:00,11,8,12,2008,Non-Violent
6594789,11/02/2008 03:10:00 PM,BATTERY,SIMPLE,false,false,30,41.844243782,-87.725321944,2008-11-02T15:10:00.000+02:00,11,2,15,2008,Violent
6585767,10/22/2008 09:21:28 PM,NARCOTICS,POSS: CANNABIS 30GMS OR LESS,true,false,27,41.871650791,-87.700947143,2008-10-22T21:21:28.000+02:00,10,22,21,2008,Non-Violent
6528493,09/29/2008 06:30:00 PM,CRIMINAL DAMAGE,TO VEHICLE,false,false,58,41.809167571,-87.708648706,2008-09-29T18:30:00.000+02:00,9,29,18,2008,Non-Violent
6410766,08/01/2008 05:50:00 PM,DECEPTIVE PRACTICE,THEFT OF LABOR/SERVICES,false,false,32,41.879202837,-87.626113652,2008-08-01T17:50:00.000+02:00,8,1,17,2008,Non-Violent
6467274,08/30/2008 06:30:00 PM,CRIMINAL TRESPASS,TO LAND,false,false,28,41.877565688,-87.684893829,2008-08-30T18:30:00.000+02:00,8,30,18,2008,Non-Violent
6548364,10/10/2008 10:00:00 AM,BURGLARY,FORCIBLE ENTRY,false,false,22,41.923096645,-87.682702299,2008-10-10T10:00:00.000+02:00,10,10,10,2008,Non-Violent
6397087,07/28/2008 03:30:00 AM,ARSON,BY FIRE,false,false,67,41.782491495,-87.673987788,2008-07-28T03:30:00.000+02:00,7,28,3,2008,Non-Violent
6428934,08/06/2008 12:30:00 PM,THEFT,FROM BUILDING,false,false,66,41.783543755,-87.702048321,2008-08-06T12:30:00.000+02:00,8,6,12,2008,Non-Violent
6480530,08/29/2008 12:30:00 PM,MOTOR VEHICLE THEFT,AUTOMOBILE,true,false,48,41.737132553,-87.570487938,2008-08-29T12:30:00.000+02:00,8,29,12,2008,Non-Violent
6474663,08/29/2008 12:01:00 AM,BATTERY,AGGRAVATED: OTHER DANG WEAPON,false,false,30,41.838902489,-87.71384586,2008-08-29T00:01:00.000+02:00,8,29,0,2008,Violent
6441751,08/18/2008 05:35:00 PM,THEFT,$500 AND UNDER,false,false,28,41.877491577,-87.67476369,2008-08-18T17:35:00.000+02:00,8,18,17,2008,Non-Violent
6514897,09/23/2008 06:00:00 PM,THEFT,OVER $500,false,false,15,41.942454783,-87.766637963,2008-09-23T18:00:00.000+02:00,9,23,18,2008,Non-Violent
6561044,10/16/2008 10:07:52 AM,CRIMINAL DAMAGE,TO PROPERTY,false,false,1,42.010230157,-87.672527861,2008-10-16T10:07:52.000+02:00,10,16,10,2008,Non-Violent
6553087,10/05/2008 07:20:00 PM,NARCOTICS,POSS: CRACK,true,false,66,41.758750432,-87.687978898,2008-10-05T19:20:00.000+02:00,10,5,19,2008,Non-Violent
6529973,09/22/2008 05:00:00 PM,CRIMINAL DAMAGE,TO VEHICLE,false,false,15,41.967964953,-87.75289476,2008-09-22T17:00:00.000+02:00,9,22,17,2008,Non-Violent
6438474,08/17/2008 01:20:00 PM,BATTERY,AGGRAVATED: HANDGUN,false,false,68,41.787222215,-87.63175297,2008-08-17T13:20:00.000+02:00,8,17,13,2008,Violent
6389701,07/25/2008 09:30:00 PM,NARCOTICS,POSS: CANNABIS 30GMS OR LESS,true,false,20,41.916058949,-87.733848209,2008-07-25T21:30:00.000+02:00,7,25,21,2008,Non-Violent
6468220,09/01/2008 12:00:00 AM,CRIMINAL DAMAGE,TO VEHICLE,false,false,17,41.949080329,-87.797715476,2008-09-01T00:00:00.000+02:00,9,1,0,2008,Non-Violent
6507759,09/20/2008 07:15:00 AM,THEFT,FROM BUILDING,false,false,77,41.996509716,-87.670234472,2008-09-20T07:15:00.000+02:00,9,20,7,2008,Non-Violent
6529857,10/01/2008 12:25:00 PM,NARCOTICS,POSS: CRACK,true,false,23,41.903563246,-87.727345576,2008-10-01T12:25:00.000+02:00,10,1,12,2008,Non-Violent
6399351,07/05/2008 06:51:31 PM,GAMBLING,GAME/DICE,true,false,66,41.762517178,-87.705597292,2008-07-05T18:51:31.000+02:00,7,5,18,2008,Non-Violent
6437002,08/17/2008 02:35:00 PM,NARCOTICS,POSS: CANNABIS 30GMS OR LESS,true,false,25,41.876552273,-87.763379746,2008-08-17T14:35:00.000+02:00,8,17,14,2008,Non-Violent
6476431,09/04/2008 02:30:00 PM,BATTERY,SIMPLE,false,false,49,41.690141313,-87.637465963,2008-09-04T14:30:00.000+02:00,9,4,14,2008,Violent
6603531,11/10/2008 04:00:00 PM,CRIMINAL TRESPASS,TO LAND,false,false,70,41.748318039,-87.70357354,2008-11-10T16:00:00.000+02:00,11,10,16,2008,Non-Violent
6544459,10/06/2008 02:55:00 PM,NARCOTICS,MANU/DEL:CANNABIS 10GM OR LESS,true,false,66,41.778454724,-87.688507305,2008-10-06T14:55:00.000+02:00,10,6,14,2008,Non-Violent
6538905,10/06/2008 09:07:00 PM,NARCOTICS,SOLICIT NARCOTICS ON PUBLICWAY,true,false,25,41.895496761,-87.758065495,2008-10-06T21:07:00.000+02:00,10,6,21,2008,Non-Violent
6416859,08/03/2008 01:30:00 AM,BATTERY,DOMESTIC BATTERY SIMPLE,false,true,8,41.892162461,-87.6325964,2008-08-03T01:30:00.000+02:00,8,3,1,2008,Violent
6515899,09/23/2008 04:40:00 PM,BURGLARY,FORCIBLE ENTRY,false,false,41,41.796184191,-87.582561219,2008-09-23T16:40:00.000+02:00,9,23,16,2008,Non-Violent
6449052,08/22/2008 07:48:00 PM,NARCOTICS,POSS: HEROIN(WHITE),true,false,25,41.894143418,-87.767924691,2008-08-22T19:48:00.000+02:00,8,22,19,2008,Non-Violent
6414046,07/22/2008 11:45:00 AM,NARCOTICS,MANU/DELIVER:CRACK,true,false,25,,,2008-07-22T11:45:00.000+02:00,7,22,11,2008,Non-Violent
6450422,08/19/2008 08:00:00 PM,NARCOTICS,POSS: CANNABIS 30GMS OR LESS,true,false,45,41.745422451,-87.584153287,2008-08-19T20:00:00.000+02:00,8,19,20,2008,Non-Violent
6437192,08/18/2008 02:45:00 PM,BATTERY,DOMESTIC BATTERY SIMPLE,true,true,22,,,2008-08-18T14:45:00.000+02:00,8,18,14,2008,Violent
6524426,09/28/2008 01:44:18 PM,BATTERY,DOMESTIC BATTERY SIMPLE,true,true,25,41.88314073,-87.76660788,2008-09-28T13:44:18.000+02:00,9,28,13,2008,Violent
6392764,07/27/2008 07:50:00 PM,ROBBERY,STRONGARM - NO WEAPON,true,false,38,41.816598679,-87.619113763,2008-07-27T19:50:00.000+02:00,7,27,19,2008,Violent
6464565,08/29/2008 08:15:00 PM,BATTERY,DOMESTIC BATTERY SIMPLE,false,true,69,41.761418996,-87.624820784,2008-08-29T20:15:00.000+02:00,8,29,20,2008,Violent
6388968,07/24/2008 02:55:00 AM,THEFT,RETAIL THEFT,true,false,27,41.882139587,-87.71104513,2008-07-24T02:55:00.000+02:00,7,24,2,2008,Non-Violent
6390977,07/25/2008 11:22:00 AM,CRIMINAL TRESPASS,TO LAND,true,false,42,41.782896788,-87.615689372,2008-07-25T11:22:00.000+02:00,7,25,11,2008,Non-Violent
6583581,10/29/2008 07:25:32 PM,BATTERY,DOMESTIC BATTERY SIMPLE,true,true,29,41.862377709,-87.717055445,2008-10-29T19:25:32.000+02:00,10,29,19,2008,Violent
6427839,08/12/2008 04:50:00 PM,MOTOR VEHICLE THEFT,AUTOMOBILE,false,false,19,41.930947564,-87.789767466,2008-08-12T16:50:00.000+02:00,8,12,16,2008,Non-Violent
6548821,10/11/2008 07:30:00 PM,CRIMINAL DAMAGE,TO VEHICLE,false,false,49,41.704753338,-87.614918402,2008-10-11T19:30:00.000+02:00,10,11,19,2008,Non-Violent
6526041,09/29/2008 09:00:00 AM,CRIMINAL DAMAGE,TO VEHICLE,false,false,64,41.78051335,-87.791105786,2008-09-29T09:00:00.000+02:00,9,29,9,2008,Non-Violent
6469289,08/29/2008 11:36:00 AM,DECEPTIVE PRACTICE,CREDIT CARD FRAUD,true,false,59,41.829933759,-87.675273397,2008-08-29T11:36:00.000+02:00,8,29,11,2008,Non-Violent
6532926,09/30/2008 12:53:53 PM,MOTOR VEHICLE THEFT,THEFT/RECOVERY: AUTOMOBILE,true,false,37,41.795671442,-87.633032385,2008-09-30T12:53:53.000+02:00,9,30,12,2008,Non-Violent
6463596,08/25/2008 01:00:00 PM,THEFT,FROM BUILDING,false,false,29,41.848984638,-87.735542925,2008-08-25T13:00:00.000+02:00,8,25,13,2008,Non-Violent
6474485,09/03/2008 05:25:00 PM,THEFT,$500 AND UNDER,false,false,51,41.702769942,-87.562925787,2008-09-03T17:25:00.000+02:00,9,3,17,2008,Non-Violent
6499301,08/19/2008 01:00:00 PM,NARCOTICS,POSS: HEROIN(WHITE),true,false,69,41.751452878,-87.624567581,2008-08-19T13:00:00.000+02:00,8,19,13,2008,Non-Violent
6518249,09/21/2008 04:02:00 AM,ASSAULT,AGGRAVATED: HANDGUN,false,true,44,41.735613434,-87.613204315,2008-09-21T04:02:00.000+02:00,9,21,4,2008,Violent
6562267,10/12/2008 05:00:00 AM,BATTERY,DOMESTIC BATTERY SIMPLE,false,true,49,41.722168296,-87.632164372,2008-10-12T05:00:00.000+02:00,10,12,5,2008,Violent
6451089,08/22/2008 08:45:00 PM,BATTERY,DOMESTIC BATTERY SIMPLE,false,true,27,41.878359889,-87.694888308,2008-08-22T20:45:00.000+02:00,8,22,20,2008,Violent
6541188,10/07/2008 11:00:00 PM,ASSAULT,SIMPLE,false,false,3,41.965380265,-87.659052093,2008-10-07T23:00:00.000+02:00,10,7,23,2008,Violent
6415034,08/07/2008 12:50:55 AM,BATTERY,DOMESTIC BATTERY SIMPLE,false,true,33,41.854963672,-87.627133239,2008-08-07T00:50:55.000+02:00,8,7,0,2008,Violent
6405122,08/01/2008 03:21:00 PM,THEFT,RETAIL THEFT,false,false,32,41.882539542,-87.627850543,2008-08-01T15:21:00.000+02:00,8,1,15,2008,Non-Violent
6594167,11/04/2008 03:30:00 PM,BATTERY,SIMPLE,false,false,10,41.969184698,-87.803684359,2008-11-04T15:30:00.000+02:00,11,4,15,2008,Violent
6462070,08/28/2008 03:00:00 PM,THEFT,FROM BUILDING,false,false,53,41.682507377,-87.625910442,2008-08-28T15:00:00.000+02:00,8,28,15,2008,Non-Violent
6422233,08/10/2008 02:00:00 PM,BURGLARY,ATTEMPT FORCIBLE ENTRY,false,false,19,41.933570715,-87.774831375,2008-08-10T14:00:00.000+02:00,8,10,14,2008,Non-Violent
6558099,10/16/2008 08:50:00 PM,THEFT,RETAIL THEFT,true,false,11,41.974824456,-87.783344986,2008-10-16T20:50:00.000+02:00,10,16,20,2008,Non-Violent
6567892,10/21/2008 01:00:00 AM,THEFT,$500 AND UNDER,false,false,29,41.856476758,-87.719982622,2008-10-21T01:00:00.000+02:00,10,21,1,2008,Non-Violent
6405284,08/01/2008 03:20:00 PM,ASSAULT,SIMPLE,true,false,73,41.709639631,-87.642903096,2008-08-01T15:20:00.000+02:00,8,1,15,2008,Violent
6401592,07/15/2008 01:00:00 PM,THEFT,FINANCIAL ID THEFT:$300 &UNDER,false,false,68,41.760923966,-87.652792352,2008-07-15T13:00:00.000+02:00,7,15,13,2008,Non-Violent
6418605,08/05/2008 10:30:00 PM,CRIMINAL DAMAGE,TO PROPERTY,false,true,44,41.746793169,-87.608747978,2008-08-05T22:30:00.000+02:00,8,5,22,2008,Non-Violent
6393491,07/21/2008 11:00:00 PM,THEFT,$500 AND UNDER,false,false,16,41.96152721,-87.730561672,2008-07-21T23:00:00.000+02:00,7,21,23,2008,Non-Violent
6507973,09/18/2008 12:01:00 AM,THEFT,AGG: FINANCIAL ID THEFT,false,false,69,41.757663757,-87.616688923,2008-09-18T00:01:00.000+02:00,9,18,0,2008,Non-Violent
6397251,07/27/2008 05:10:00 PM,OTHER OFFENSE,OTHER VEHICLE OFFENSE,false,false,36,41.824914418,-87.605655435,2008-07-27T17:10:00.000+02:00,7,27,17,2008,Non-Violent
6544524,10/07/2008 08:00:00 PM,MOTOR VEHICLE THEFT,AUTOMOBILE,false,false,31,41.852115685,-87.679604831,2008-10-07T20:00:00.000+02:00,10,7,20,2008,Non-Violent
6432705,08/12/2008 10:00:00 AM,BATTERY,SIMPLE,false,false,71,41.746005146,-87.665757137,2008-08-12T10:00:00.000+02:00,8,12,10,2008,Violent
6430465,08/14/2008 12:00:00 AM,CRIMINAL DAMAGE,TO VEHICLE,false,false,19,41.91748505,-87.758904197,2008-08-14T00:00:00.000+02:00,8,14,0,2008,Non-Violent
6510997,07/02/2008 02:50:00 PM,ROBBERY,ARMED: HANDGUN,false,false,33,41.860577635,-87.62566916,2008-07-02T14:50:00.000+02:00,7,2,14,2008,Violent
6585602,10/31/2008 10:00:00 AM,THEFT,OVER $500,false,false,58,41.828110045,-87.70289119,2008-10-31T10:00:00.000+02:00,10,31,10,2008,Non-Violent
6562901,10/17/2008 09:50:00 PM,CRIMINAL DAMAGE,TO PROPERTY,false,false,22,41.923395407,-87.716957325,2008-10-17T21:50:00.000+02:00,10,17,21,2008,Non-Violent
6578296,10/27/2008 06:45:00 AM,CRIMINAL DAMAGE,CRIMINAL DEFACEMENT,false,false,51,41.707704116,-87.562090482,2008-10-27T06:45:00.000+02:00,10,27,6,2008,Non-Violent
6541371,10/07/2008 07:30:00 AM,BATTERY,SIMPLE,false,false,46,41.736940053,-87.550034589,2008-10-07T07:30:00.000+02:00,10,7,7,2008,Violent
6409983,08/01/2008 08:45:00 AM,THEFT,$500 AND UNDER,false,false,62,41.800303052,-87.723368272,2008-08-01T08:45:00.000+02:00,8,1,8,2008,Non-Violent
6457053,08/26/2008 06:00:00 AM,THEFT,FROM BUILDING,false,true,1,42.001784136,-87.66646016,2008-08-26T06:00:00.000+02:00,8,26,6,2008,Non-Violent
6427158,08/10/2008 05:00:00 PM,THEFT,$500 AND UNDER,false,false,7,41.928269145,-87.643159785,2008-08-10T17:00:00.000+02:00,8,10,17,2008,Non-Violent
6507768,09/19/2008 06:30:00 PM,CRIMINAL DAMAGE,TO PROPERTY,false,false,6,41.949387288,-87.671359031,2008-09-19T18:30:00.000+02:00,9,19,18,2008,Non-Violent
6500173,08/15/2008 09:00:00 PM,NARCOTICS,POSS: CANNABIS 30GMS OR LESS,true,false,71,41.747664827,-87.654874605,2008-08-15T21:00:00.000+02:00,8,15,21,2008,Non-Violent
6495125,09/14/2008 08:30:00 AM,ROBBERY,ARMED: OTHER DANGEROUS WEAPON,false,false,14,41.968427294,-87.71122829,2008-09-14T08:30:00.000+02:00,9,14,8,2008,Violent
6460539,08/23/2008 04:00:00 PM,THEFT,FROM BUILDING,false,true,43,41.771171016,-87.576437708,2008-08-23T16:00:00.000+02:00,8,23,16,2008,Non-Violent
6463393,07/24/2008 10:54:00 PM,DECEPTIVE PRACTICE,ILLEGAL USE CASH CARD,false,false,16,41.956637399,-87.709063547,2008-07-24T22:54:00.000+02:00,7,24,22,2008,Non-Violent
6514460,09/22/2008 11:00:41 PM,BATTERY,DOMESTIC BATTERY SIMPLE,false,true,42,41.776838258,-87.600179287,2008-09-22T23:00:41.000+02:00,9,22,23,2008,Violent
6584091,10/28/2008 11:35:00 AM,BATTERY,SIMPLE,true,false,42,41.78210152,-87.586502002,2008-10-28T11:35:00.000+02:00,10,28,11,2008,Violent
6434430,08/09/2008 09:00:00 PM,THEFT,OVER $500,false,false,24,41.893866538,-87.692232668,2008-08-09T21:00:00.000+02:00,8,9,21,2008,Non-Violent
6471354,09/01/2008 09:16:19 PM,BATTERY,SIMPLE,false,false,35,41.824933076,-87.623104662,2008-09-01T21:16:19.000+02:00,9,1,21,2008,Violent
6542626,10/07/2008 02:58:00 AM,BATTERY,AGGRAVATED: HANDGUN,false,false,43,41.762945974,-87.561528262,2008-10-07T02:58:00.000+02:00,10,7,2,2008,Violent
6547678,10/10/2008 11:30:00 PM,BATTERY,SIMPLE,false,false,28,41.864822916,-87.656618405,2008-10-10T23:30:00.000+02:00,10,10,23,2008,Violent
6478874,09/05/2008 10:14:09 AM,BATTERY,PRO EMP HANDS NO/MIN INJURY,true,false,25,41.884856209,-87.763346345,2008-09-05T10:14:09.000+02:00,9,5,10,2008,Violent
6489346,09/10/2008 05:10:00 PM,CRIMINAL DAMAGE,TO VEHICLE,false,false,68,41.793876041,-87.649323127,2008-09-10T17:10:00.000+02:00,9,10,17,2008,Non-Violent
6425821,08/08/2008 04:40:00 PM,OTHER OFFENSE,HARASSMENT BY TELEPHONE,false,false,72,41.71088122,-87.68746906,2008-08-08T16:40:00.000+02:00,8,8,16,2008,Non-Violent
6586693,10/28/2008 03:30:00 PM,THEFT,FROM BUILDING,false,false,17,41.947483095,-87.815641826,2008-10-28T15:30:00.000+02:00,10,28,15,2008,Non-Violent
6523808,09/26/2008 08:30:00 AM,BURGLARY,UNLAWFUL ENTRY,false,false,8,41.907094196,-87.646738265,2008-09-26T08:30:00.000+02:00,9,26,8,2008,Non-Violent
6423524,08/10/2008 11:30:00 PM,CRIMINAL TRESPASS,TO LAND,false,true,17,41.94931164,-87.785093592,2008-08-10T23:30:00.000+02:00,8,10,23,2008,Non-Violent
6510510,09/21/2008 10:00:00 PM,THEFT,$500 AND UNDER,false,false,3,41.973558433,-87.654935349,2008-09-21T22:00:00.000+02:00,9,21,22,2008,Non-Violent
6407702,08/03/2008 10:15:00 AM,NARCOTICS,POSS: CANNABIS 30GMS OR LESS,true,false,75,41.697179993,-87.66135568,2008-08-03T10:15:00.000+02:00,8,3,10,2008,Non-Violent
6405766,07/18/2008 10:51:00 PM,NARCOTICS,POSS: CANNABIS 30GMS OR LESS,true,false,68,41.771652427,-87.650648055,2008-07-18T22:51:00.000+02:00,7,18,22,2008,Non-Violent
6433623,08/15/2008 05:00:00 AM,THEFT,FROM BUILDING,false,false,40,41.794731271,-87.620277064,2008-08-15T05:00:00.000+02:00,8,15,5,2008,Non-Violent
6588779,11/02/2008 11:22:00 AM,NARCOTICS,POSS: CANNABIS 30GMS OR LESS,true,false,23,41.904962221,-87.709302716,2008-11-02T11:22:00.000+02:00,11,2,11,2008,Non-Violent
6430701,08/13/2008 11:53:27 PM,BATTERY,SIMPLE,true,false,25,41.875841354,-87.748070762,2008-08-13T23:53:27.000+02:00,8,13,23,2008,Violent
6445730,08/20/2008 03:06:01 AM,BATTERY,DOMESTIC BATTERY SIMPLE,false,true,44,41.739535346,-87.609756582,2008-08-20T03:06:01.000+02:00,8,20,3,2008,Violent
6390973,07/18/2008 12:00:00 PM,OTHER OFFENSE,HARASSMENT BY TELEPHONE,false,false,49,41.710301704,-87.630791756,2008-07-18T12:00:00.000+02:00,7,18,12,2008,Non-Violent
6595985,11/05/2008 03:55:00 PM,THEFT,RETAIL THEFT,true,false,32,41.883218909,-87.628548144,2008-11-05T15:55:00.000+02:00,11,5,15,2008,Non-Violent
6547660,10/10/2008 04:31:47 PM,BATTERY,SIMPLE,false,false,25,41.898881162,-87.770399024,2008-10-10T16:31:47.000+02:00,10,10,16,2008,Violent
6510860,09/17/2008 11:30:00 PM,BATTERY,AGGRAVATED: OTHER DANG WEAPON,false,false,26,41.880660786,-87.731186405,2008-09-17T23:30:00.000+02:00,9,17,23,2008,Violent
6510296,09/21/2008 10:54:00 PM,CRIMINAL DAMAGE,TO VEHICLE,false,false,46,41.747524136,-87.563739484,2008-09-21T22:54:00.000+02:00,9,21,22,2008,Non-Violent
6558468,10/16/2008 11:35:37 AM,OTHER OFFENSE,TELEPHONE THREAT,false,true,25,41.894027788,-87.749208636,2008-10-16T11:35:37.000+02:00,10,16,11,2008,Non-Violent
6408180,08/03/2008 11:01:00 AM,BATTERY,AGGRAVATED: OTHER DANG WEAPON,false,false,46,41.737401728,-87.549724872,2008-08-03T11:01:00.000+02:00,8,3,11,2008,Violent
6494158,08/28/2008 06:00:00 PM,MOTOR VEHICLE THEFT,AUTOMOBILE,false,false,29,41.861808491,-87.728712818,2008-08-28T18:00:00.000+02:00,8,28,18,2008,Non-Violent
6593239,11/04/2008 10:30:00 AM,OTHER OFFENSE,TELEPHONE THREAT,false,true,10,41.993004124,-87.780348637,2008-11-04T10:30:00.000+02:00,11,4,10,2008,Non-Violent
6559557,10/16/2008 11:05:00 AM,CRIMINAL DAMAGE,TO PROPERTY,false,false,7,41.929164242,-87.674541155,2008-10-16T11:05:00.000+02:00,10,16,11,2008,Non-Violent
6391828,07/26/2008 08:11:00 PM,PUBLIC PEACE VIOLATION,MOB ACTION,true,false,69,41.765067169,-87.61525763,2008-07-26T20:11:00.000+02:00,7,26,20,2008,Non-Violent
6390865,07/26/2008 07:45:00 AM,THEFT,PURSE-SNATCHING,false,false,32,41.878638996,-87.627691486,2008-07-26T07:45:00.000+02:00,7,26,7,2008,Non-Violent
6495556,09/14/2008 03:00:00 AM,CRIMINAL DAMAGE,TO PROPERTY,false,false,74,41.699133363,-87.72065981,2008-09-14T03:00:00.000+02:00,9,14,3,2008,Non-Violent
6434979,08/16/2008 03:58:33 AM,BATTERY,DOMESTIC BATTERY SIMPLE,false,true,42,41.774257884,-87.600923552,2008-08-16T03:58:33.000+02:00,8,16,3,2008,Violent
6578363,10/27/2008 10:00:00 PM,THEFT,$500 AND UNDER,false,false,6,41.955100267,-87.672230041,2008-10-27T22:00:00.000+02:00,10,27,22,2008,Non-Violent
6592870,11/02/2008 09:15:00 AM,BATTERY,SIMPLE,false,false,27,41.884545238,-87.701304753,2008-11-02T09:15:00.000+02:00,11,2,9,2008,Violent
6442878,08/19/2008 12:48:00 PM,BATTERY,AGGRAVATED DOMESTIC BATTERY: KNIFE/CUTTING INST,false,true,67,41.771150142,-87.671266562,2008-08-19T12:48:00.000+02:00,8,19,12,2008,Violent
6440757,08/18/2008 11:30:00 PM,BATTERY,SIMPLE,false,false,19,41.924902436,-87.766025313,2008-08-18T23:30:00.000+02:00,8,18,23,2008,Violent
6491666,07/20/2008 05:00:00 PM,BURGLARY,FORCIBLE ENTRY,false,false,39,41.803244589,-87.603758748,2008-07-20T17:00:00.000+02:00,7,20,17,2008,Non-Violent
6532526,10/02/2008 10:38:00 PM,CRIMINAL TRESPASS,TO LAND,true,false,33,41.852252485,-87.622262954,2008-10-02T22:38:00.000+02:00,10,2,22,2008,Non-Violent
6482299,08/18/2008 04:00:00 AM,PROSTITUTION,SOLICIT ON PUBLIC WAY,true,false,22,41.9177748,-87.676778353,2008-08-18T04:00:00.000+02:00,8,18,4,2008,Non-Violent
6489193,09/09/2008 07:45:00 PM,THEFT,RETAIL THEFT,false,false,19,41.930946496,-87.788962647,2008-09-09T19:45:00.000+02:00,9,9,19,2008,Non-Violent
6562988,10/19/2008 05:15:00 PM,THEFT,OVER $500,false,false,8,41.908016743,-87.648197855,2008-10-19T17:15:00.000+02:00,10,19,17,2008,Non-Violent
6542786,10/08/2008 12:25:00 PM,NARCOTICS,MANU/DELIVER:CRACK,true,false,67,41.775283736,-87.67138536,2008-10-08T12:25:00.000+02:00,10,8,12,2008,Non-Violent
6385797,07/23/2008 03:50:00 AM,BATTERY,DOMESTIC BATTERY SIMPLE,false,true,68,41.775394055,-87.640753876,2008-07-23T03:50:00.000+02:00,7,23,3,2008,Violent
6518141,09/16/2008 09:00:00 PM,PROSTITUTION,SOLICIT ON PUBLIC WAY,true,false,61,41.808634077,-87.645527495,2008-09-16T21:00:00.000+02:00,9,16,21,2008,Non-Violent
6540906,10/07/2008 02:00:00 PM,OTHER OFFENSE,PROBATION VIOLATION,true,false,38,41.813158946,-87.607545605,2008-10-07T14:00:00.000+02:00,10,7,14,2008,Non-Violent
6411776,08/03/2008 02:16:00 AM,CRIMINAL DAMAGE,TO VEHICLE,false,false,29,41.850643653,-87.727966434,2008-08-03T02:16:00.000+02:00,8,3,2,2008,Non-Violent
6387498,07/25/2008 12:49:06 AM,BATTERY,DOMESTIC BATTERY SIMPLE,true,true,24,41.895229672,-87.66138088,2008-07-25T00:49:06.000+02:00,7,25,0,2008,Violent
6471000,09/02/2008 10:00:00 AM,BURGLARY,FORCIBLE ENTRY,false,true,29,41.858150645,-87.726159332,2008-09-02T10:00:00.000+02:00,9,2,10,2008,Non-Violent
6450757,08/23/2008 03:00:00 PM,MOTOR VEHICLE THEFT,AUTOMOBILE,false,false,69,41.757583951,-87.634472844,2008-08-23T15:00:00.000+02:00,8,23,15,2008,Non-Violent
6443759,08/04/2008 10:20:00 PM,NARCOTICS,POSSESSION OF DRUG EQUIPMENT,true,false,66,41.782616048,-87.70252307,2008-08-04T22:20:00.000+02:00,8,4,22,2008,Non-Violent
6385112,07/24/2008 12:57:00 AM,BATTERY,SIMPLE,false,false,26,41.877039505,-87.729311002,2008-07-24T00:57:00.000+02:00,7,24,0,2008,Violent
6562338,10/16/2008 10:30:00 PM,BURGLARY,FORCIBLE ENTRY,false,false,44,41.748675713,-87.619702242,2008-10-16T22:30:00.000+02:00,10,16,22,2008,Non-Violent
6504574,09/14/2008 05:25:00 AM,ROBBERY,ARMED: HANDGUN,false,false,69,41.759311656,-87.615142204,2008-09-14T05:25:00.000+02:00,9,14,5,2008,Violent
6486524,09/09/2008 10:58:43 AM,CRIMINAL DAMAGE,TO VEHICLE,false,false,68,41.779761017,-87.644079937,2008-09-09T10:58:43.000+02:00,9,9,10,2008,Non-Violent
6561149,10/17/2008 01:26:00 PM,WEAPONS VIOLATION,POSS FIREARM/AMMO:NO FOID CARD,true,false,69,41.777484213,-87.615555409,2008-10-17T13:26:00.000+02:00,10,17,13,2008,Non-Violent
6548210,10/07/2008 10:30:00 PM,DECEPTIVE PRACTICE,ILLEGAL USE CASH CARD,false,false,44,41.733615445,-87.601887393,2008-10-07T22:30:00.000+02:00,10,7,22,2008,Non-Violent
6601294,11/08/2008 11:01:00 PM,THEFT,$500 AND UNDER,true,false,4,41.975828073,-87.697641133,2008-11-08T23:01:00.000+02:00,11,8,23,2008,Non-Violent
6472734,09/03/2008 11:35:00 AM,NARCOTICS,POSS: CANNABIS 30GMS OR LESS,true,false,23,41.895546079,-87.707164891,2008-09-03T11:35:00.000+02:00,9,3,11,2008,Non-Violent
6602540,11/10/2008 09:15:00 AM,MOTOR VEHICLE THEFT,AUTOMOBILE,false,false,77,41.982015403,-87.672227533,2008-11-10T09:15:00.000+02:00,11,10,9,2008,Non-Violent
6444691,08/20/2008 07:13:00 PM,CRIMINAL DAMAGE,TO VEHICLE,true,false,28,41.862651094,-87.666277921,2008-08-20T19:13:00.000+02:00,8,20,19,2008,Non-Violent
6485972,09/09/2008 10:05:00 PM,NARCOTICS,POSS: CANNABIS 30GMS OR LESS,true,false,75,41.691841556,-87.67690247,2008-09-09T22:05:00.000+02:00,9,9,22,2008,Non-Violent
6402996,08/01/2008 02:58:00 AM,WEAPONS VIOLATION,UNLAWFUL POSS AMMUNITION,true,false,54,41.647924185,-87.616333124,2008-08-01T02:58:00.000+02:00,8,1,2,2008,Non-Violent
6598634,11/05/2008 01:30:00 AM,OTHER OFFENSE,HARASSMENT BY ELECTRONIC MEANS,false,true,53,41.660591182,-87.63355005,2008-11-05T01:30:00.000+02:00,11,5,1,2008,Non-Violent
6451951,08/23/2008 10:13:00 PM,ASSAULT,AGGRAVATED: HANDGUN,true,false,40,41.784824445,-87.623829825,2008-08-23T22:13:00.000+02:00,8,23,22,2008,Violent
6396651,05/01/2008 02:27:00 PM,CRIMINAL DAMAGE,TO VEHICLE,false,false,39,41.809487437,-87.588307789,2008-05-01T14:27:00.000+02:00,5,1,14,2008,Non-Violent
6387099,07/03/2008 09:00:00 PM,SEX OFFENSE,AGG CRIMINAL SEXUAL ABUSE,false,true,73,41.709732084,-87.640481276,2008-07-03T21:00:00.000+02:00,7,3,21,2008,Non-Violent
6408731,08/02/2008 02:00:00 AM,MOTOR VEHICLE THEFT,AUTOMOBILE,false,false,73,41.722537195,-87.635962661,2008-08-02T02:00:00.000+02:00,8,2,2,2008,Non-Violent
6414782,08/03/2008 03:25:00 AM,ASSAULT,SIMPLE,false,true,63,41.787914301,-87.685094041,2008-08-03T03:25:00.000+02:00,8,3,3,2008,Violent
6499419,06/03/2008 07:46:00 PM,OTHER OFFENSE,HARASSMENT BY TELEPHONE,false,false,67,41.7808646,-87.657072915,2008-06-03T19:46:00.000+02:00,6,3,19,2008,Non-Violent
6480717,09/05/2008 10:00:00 PM,BATTERY,AGGRAVATED:KNIFE/CUTTING INSTR,false,false,29,41.852491274,-87.71624374,2008-09-05T22:00:00.000+02:00,9,5,22,2008,Violent
6440797,08/16/2008 01:30:00 AM,THEFT,$500 AND UNDER,false,false,8,41.90416925,-87.628685126,2008-08-16T01:30:00.000+02:00,8,16,1,2008,Non-Violent
6542937,10/02/2008 09:30:00 PM,CRIMINAL TRESPASS,TO VEHICLE,true,false,40,41.783846315,-87.617889736,2008-10-02T21:30:00.000+02:00,10,2,21,2008,Non-Violent
6580092,10/28/2008 02:30:00 PM,NARCOTICS,POSS: CANNABIS 30GMS OR LESS,true,false,52,41.704093574,-87.536491984,2008-10-28T14:30:00.000+02:00,10,28,14,2008,Non-Violent
6490460,09/10/2008 06:00:00 PM,OTHER OFFENSE,OTHER VEHICLE OFFENSE,true,false,29,41.864142913,-87.708036758,2008-09-10T18:00:00.000+02:00,9,10,18,2008,Non-Violent
6457804,08/27/2008 01:38:00 AM,NARCOTICS,POSS: CANNABIS 30GMS OR LESS,true,false,34,41.838199851,-87.634451458,2008-08-27T01:38:00.000+02:00,8,27,1,2008,Non-Violent
6403839,08/01/2008 12:26:43 AM,CRIMINAL DAMAGE,TO PROPERTY,false,false,26,41.881088655,-87.720764494,2008-08-01T00:26:43.000+02:00,8,1,0,2008,Non-Violent
6544631,10/09/2008 01:55:00 AM,BATTERY,DOMESTIC BATTERY SIMPLE,false,true,39,41.810729022,-87.601726053,2008-10-09T01:55:00.000+02:00,10,9,1,2008,Violent
6415162,08/03/2008 07:55:00 PM,BATTERY,DOMESTIC BATTERY SIMPLE,true,true,68,41.766216836,-87.651717386,2008-08-03T19:55:00.000+02:00,8,3,19,2008,Violent
6575702,10/26/2008 02:00:00 AM,MOTOR VEHICLE THEFT,"TRUCK, BUS, MOTOR HOME",false,false,28,41.881714876,-87.651240388,2008-10-26T02:00:00.000+02:00,10,26,2,2008,Non-Violent
6571778,10/23/2008 10:00:00 AM,MOTOR VEHICLE THEFT,"CYCLE, SCOOTER, BIKE W-VIN",false,false,6,41.950653232,-87.668184454,2008-10-23T10:00:00.000+02:00,10,23,10,2008,Non-Violent
6434460,08/15/2008 07:30:00 PM,NARCOTICS,POSS: CANNABIS 30GMS OR LESS,true,false,49,41.692281606,-87.613361976,2008-08-15T19:30:00.000+02:00,8,15,19,2008,Non-Violent
6499226,09/14/2008 10:53:00 AM,OTHER OFFENSE,VIOLATE ORDER OF PROTECTION,true,true,71,41.738445025,-87.666780755,2008-09-14T10:53:00.000+02:00,9,14,10,2008,Non-Violent
6565130,10/20/2008 07:00:00 AM,CRIMINAL DAMAGE,CRIMINAL DEFACEMENT,false,false,7,41.929456343,-87.669510858,2008-10-20T07:00:00.000+02:00,10,20,7,2008,Non-Violent
6452489,08/24/2008 12:28:00 PM,BATTERY,DOMESTIC BATTERY SIMPLE,false,true,35,41.825169629,-87.619209296,2008-08-24T12:28:00.000+02:00,8,24,12,2008,Violent
6412325,08/06/2008 02:00:00 AM,MOTOR VEHICLE THEFT,AUTOMOBILE,false,false,53,41.678010923,-87.661375761,2008-08-06T02:00:00.000+02:00,8,6,2,2008,Non-Violent
6539172,10/02/2008 05:00:00 PM,CRIMINAL DAMAGE,CRIMINAL DEFACEMENT,false,false,62,41.797019742,-87.713922981,2008-10-02T17:00:00.000+02:00,10,2,17,2008,Non-Violent
6602356,11/07/2008 09:20:48 AM,THEFT,RETAIL THEFT,true,false,32,41.88233367,-87.627841791,2008-11-07T09:20:48.000+02:00,11,7,9,2008,Non-Violent
6546590,10/08/2008 09:00:00 PM,CRIMINAL TRESPASS,TO LAND,true,false,27,41.872790905,-87.70467367,2008-10-08T21:00:00.000+02:00,10,8,21,2008,Non-Violent
6523265,09/27/2008 09:40:00 PM,BATTERY,SIMPLE,false,false,17,41.938248896,-87.790124466,2008-09-27T21:40:00.000+02:00,9,27,21,2008,Violent
6467775,08/30/2008 06:20:00 PM,BATTERY,SIMPLE,true,false,13,41.984253748,-87.711346419,2008-08-30T18:20:00.000+02:00,8,30,18,2008,Violent
6544027,09/22/2008 11:00:00 PM,OTHER OFFENSE,FALSE/STOLEN/ALTERED TRP,true,false,44,41.746665865,-87.605106926,2008-09-22T23:00:00.000+02:00,9,22,23,2008,Non-Violent
6429117,08/12/2008 11:00:00 PM,THEFT,OVER $500,false,false,33,41.853676611,-87.622239838,2008-08-12T23:00:00.000+02:00,8,12,23,2008,Non-Violent
6452362,08/24/2008 08:40:00 PM,MOTOR VEHICLE THEFT,"TRUCK, BUS, MOTOR HOME",false,false,49,41.71888734,-87.631020586,2008-08-24T20:40:00.000+02:00,8,24,20,2008,Non-Violent
6599353,11/06/2008 09:00:00 PM,CRIMINAL DAMAGE,TO VEHICLE,false,false,6,41.949345749,-87.668918555,2008-11-06T21:00:00.000+02:00,11,6,21,2008,Non-Violent
6525961,09/29/2008 03:45:00 PM,THEFT,OVER $500,false,false,22,41.930956961,-87.684794354,2008-09-29T15:45:00.000+02:00,9,29,15,2008,Non-Violent
6465410,08/29/2008 07:00:00 PM,THEFT,OVER $500,false,false,22,41.918086514,-87.668001006,2008-08-29T19:00:00.000+02:00,8,29,19,2008,Non-Violent
6588373,10/27/2008 10:30:00 PM,NARCOTICS,POSS: CRACK,true,false,29,41.866124007,-87.728484922,2008-10-27T22:30:00.000+02:00,10,27,22,2008,Non-Violent
6600089,11/07/2008 11:00:00 PM,MOTOR VEHICLE THEFT,AUTOMOBILE,false,false,29,41.854721181,-87.717558419,2008-11-07T23:00:00.000+02:00,11,7,23,2008,Non-Violent
6521022,09/26/2008 07:00:00 AM,MOTOR VEHICLE THEFT,AUTOMOBILE,false,false,31,41.857829626,-87.653208535,2008-09-26T07:00:00.000+02:00,9,26,7,2008,Non-Violent
6591152,11/02/2008 07:00:00 PM,BATTERY,DOMESTIC BATTERY SIMPLE,false,true,25,41.904870098,-87.770603563,2008-11-02T19:00:00.000+02:00,11,2,19,2008,Violent
6478223,09/05/2008 09:45:00 AM,BURGLARY,FORCIBLE ENTRY,false,false,42,41.783236508,-87.612092362,2008-09-05T09:45:00.000+02:00,9,5,9,2008,Non-Violent
6409681,08/04/2008 03:10:00 AM,ROBBERY,STRONGARM - NO WEAPON,false,false,24,41.907597728,-87.692058564,2008-08-04T03:10:00.000+02:00,8,4,3,2008,Violent
6520924,09/26/2008 12:00:00 AM,THEFT,$500 AND UNDER,false,false,6,41.949896328,-87.661670932,2008-09-26T00:00:00.000+02:00,9,26,0,2008,Non-Violent
6549985,10/12/2008 12:00:00 AM,MOTOR VEHICLE THEFT,AUTOMOBILE,true,false,49,41.698826001,-87.641370983,2008-10-12T00:00:00.000+02:00,10,12,0,2008,Non-Violent
6601432,11/09/2008 12:00:00 AM,THEFT,OVER $500,false,false,33,41.851946269,-87.623778581,2008-11-09T00:00:00.000+02:00,11,9,0,2008,Non-Violent
6414516,08/03/2008 12:00:00 PM,BURGLARY,UNLAWFUL ENTRY,false,false,24,41.909094831,-87.685967192,2008-08-03T12:00:00.000+02:00,8,3,12,2008,Non-Violent
6429604,08/13/2008 08:30:00 PM,ROBBERY,ATTEMPT: ARMED-HANDGUN,false,false,49,41.708083606,-87.61866446,2008-08-13T20:30:00.000+02:00,8,13,20,2008,Violent
6490895,09/11/2008 08:00:00 PM,MOTOR VEHICLE THEFT,AUTOMOBILE,false,false,7,41.925318321,-87.656861404,2008-09-11T20:00:00.000+02:00,9,11,20,2008,Non-Violent
6565166,10/15/2008 08:00:00 PM,THEFT,$500 AND UNDER,false,false,58,41.809454673,-87.706441415,2008-10-15T20:00:00.000+02:00,10,15,20,2008,Non-Violent
6400173,07/30/2008 12:00:00 PM,ASSAULT,SIMPLE,false,false,41,41.796804813,-87.605654453,2008-07-30T12:00:00.000+02:00,7,30,12,2008,Violent
6482843,09/06/2008 10:30:00 PM,BATTERY,DOMESTIC BATTERY SIMPLE,false,true,68,41.771907116,-87.644581938,2008-09-06T22:30:00.000+02:00,9,6,22,2008,Violent
6466711,08/31/2008 03:00:00 PM,CRIMINAL DAMAGE,TO VEHICLE,false,true,68,41.786449647,-87.643755294,2008-08-31T15:00:00.000+02:00,8,31,15,2008,Non-Violent
